Sheet: @Saving
A1: Emulation of data tables
A3: r = | B3: 4.4999999999999998E-2
A4: terms = | B4: 10
A5: FV = | B5: =100*(1+R[-2]C)^R[-1]C -> 155.29694217328952 | C5: =define("saving",RC[-1],R[-2]C[-1],R[-1]C[-1]) -> #NAME?

Sheet: @Functions
A1: Area of a triangle
A2: a | B2: b | C2: c | D2: s | E2: area
A3: 3 | B3: 4 | C3: 5 | D3: =(RC[-3]+RC[-2]+RC[-1])/2 -> 6 | E3: =SQRT(RC[-1]*(RC[-1]-RC[-4])*(RC[-1]-RC[-3])*(RC[-1]-RC[-2])) -> 6

Sheet: Sheet1
E1: a | F1: b | G1: c | H1: area
E2: 3 | F2: 4 | G2: 5
E3: 30 | F3: 40 | G3: 50
E4: 100 | F4: 100 | G4: 100
E5: 6 | F5: 8 | G5: 10
E6: 1 | F6: 1 | G6: 1
E7: =RAND() -> 0.96440107056761648 | F7: =RAND() -> 0.57290793243619598 | G7: =RAND() -> 0.87131142601751299
B10: 5 | C10: 10 | D10: 15
A11: 0.01 | B11: =saving(RC1,R10C) -> #NAME?
A12: 0.02
A13: 0.03
A14: 0.04

Sheet: Excel-style
E1: a | F1: b | G1: c | H1: s | I1: area
E2: 3 | F2: 4 | G2: 5 | H2: =(RC[-3]+RC[-2]+RC[-1])/2 -> 6 | I2: =SQRT(RC[-1]*(RC[-1]-RC[-4])*(RC[-1]-RC[-3])*(RC[-1]-RC[-2])) -> 6
A3: r = | B3: 4.4999999999999998E-2 | E3: 30 | F3: 40 | G3: 50 | H3: =(RC[-3]+RC[-2]+RC[-1])/2 -> 60 | I3: =SQRT(RC[-1]*(RC[-1]-RC[-4])*(RC[-1]-RC[-3])*(RC[-1]-RC[-2])) -> 600
A4: terms = | B4: 10 | E4: 100 | F4: 100 | G4: 100 | H4: =(RC[-3]+RC[-2]+RC[-1])/2 -> 150 | I4: =SQRT(RC[-1]*(RC[-1]-RC[-4])*(RC[-1]-RC[-3])*(RC[-1]-RC[-2])) -> 4330.1270189221932
A5: FV = | B5: =100*(1+R[-2]C)^R[-1]C -> 155.29694217328952 | E5: 6 | F5: 8 | G5: 10 | H5: =(RC[-3]+RC[-2]+RC[-1])/2 -> 12 | I5: =SQRT(RC[-1]*(RC[-1]-RC[-4])*(RC[-1]-RC[-3])*(RC[-1]-RC[-2])) -> 24
E6: 1 | F6: 1 | G6: 1 | H6: =(RC[-3]+RC[-2]+RC[-1])/2 -> 1.5 | I6: =SQRT(RC[-1]*(RC[-1]-RC[-4])*(RC[-1]-RC[-3])*(RC[-1]-RC[-2])) -> 0.4330127018922193
E7: =RAND() -> 0.20597969635957114 | F7: =RAND() -> 0.22882541776875176 | G7: =RAND() -> 0.45758981178468872 | H7: =(RC[-3]+RC[-2]+RC[-1])/2 -> 0.44619746295650581 | I7: =SQRT(RC[-1]*(RC[-1]-RC[-4])*(RC[-1]-RC[-3])*(RC[-1]-RC[-2])) -> #NUM!
A10: =R5C2 -> 155.29694217328952 | B10: 5 | C10: 10 | D10: 15
A11: 0.01 | B11: 105.10100500999999 | C11: 110.46221254112048 | D11: 116.09689553699984
A12: 0.02 | B12: 110.40808032 | C12: 121.89944199947571 | D12: 134.58683383241294
A13: 0.03 | B13: 115.92740742999999 | C13: 134.39163793441219 | D13: 155.79674166007644
A14: 0.04 | B14: 121.66529024000003 | C14: 148.02442849183447 | D14: 180.09435055069167

Sheet: @CGExample
A2: =ABS(R[-1]C) -> 0
A3: =EXP(-R[-1]C*R[-1]C/2) -> 1
A4: =RAND()*IF(R[-2]C>37, 1, 0.3989*R[-1]C) -> 0.3641470007537902
A8: =define("FOO",R[-4]C,R[-7]C) -> #NAME?