Sheet: Sheet1
A1: 78 | B1: =RC[-1]+15 -> 93 | C1: =RC[-1]+15 -> 108 | G1: =R1C1 -> 78 | H1: =R1C1 -> 78 | I1: =R1C1 -> 78 | J1: =R1C1 -> 78
A2: =R[-1]C*2 -> 156 | B2: =R[-1]C*2 -> 186 | C2: =R[-1]C*2 -> 216 | G2: =R1C1 -> 78
A3: =R[-1]C*2 -> 312 | B3: =R[-1]C*2 -> 372 | C3: =R[-1]C*2 -> 432 | D3: =SUM(R1C[-3]:R[-1]C2) -> 513 | E3: =SUM(R1C[-3]:R[-1]C2) -> 279 | F3: =SUM(R1C2:R[-1]C[-3]) -> 603 | G3: =R1C1 -> 78 | H3: =SUM(R1C1:R[-2]C[-7]) -> 78 | I3: =SUM(R1C1:R[-2]C[-7]) -> 171 | J3: =SUM(R1C1:R[-2]C[-7]) -> 279
A4: =R[-1]C*2 -> 624 | B4: =R[-1]C*2 -> 744 | C4: =R[-1]C*2 -> 864 | D4: =SUM(R1C[-3]:R[-1]C2) -> 1197 | E4: =SUM(R1C[-3]:R[-1]C2) -> 651 | F4: =SUM(R1C2:R[-1]C[-3]) -> 1407 | G4: =R1C1 -> 78 | H4: =SUM(R1C1:R[-2]C[-7]) -> 234 | I4: =SUM(R1C1:R[-2]C[-7]) -> 513 | J4: =SUM(R1C1:R[-2]C[-7]) -> 837
A5: =R[-1]C*2 -> 1248 | B5: =R[-1]C*2 -> 1488 | C5: =R[-1]C*2 -> 1728 | D5: =SUM(R1C[-3]:R[-1]C2) -> 2565 | E5: =SUM(R1C[-3]:R[-1]C2) -> 1395 | F5: =SUM(R1C2:R[-1]C[-3]) -> 3015 | G5: =R1C1 -> 78 | H5: =SUM(R1C1:R[-2]C[-7]) -> 546 | I5: =SUM(R1C1:R[-2]C[-7]) -> 1197 | J5: =SUM(R1C1:R[-2]C[-7]) -> 1953
A6: =R[-1]C*2 -> 2496 | B6: =R[-1]C*2 -> 2976 | G6: =R1C1 -> 78 | H6: =SUM(R1C1:R[-2]C[-7]) -> 1170 | I6: =SUM(R1C1:R[-2]C[-7]) -> 2565 | J6: =SUM(R1C1:R[-2]C[-7]) -> 4185
G7: =R1C1 -> 78 | H7: =SUM(R1C1:R[-2]C[-7]) -> 2418 | I7: =SUM(R1C1:R[-2]C[-7]) -> 5301 | J7: =SUM(R1C1:R[-2]C[-7]) -> 8649
A8: =R5C3 -> 1728 | G8: =R1C1 -> 78
A9: =R5C3 -> 1728 | G9: =R1C1 -> 78 | I9: =R5C3 -> 1728 | J9: =R5C3 -> 1728
A10: =R5C3 -> 1728 | B10: =R5C3 -> 1728 | C10: =R5C3 -> 1728 | D10: =R5C3 -> 1728 | G10: =R1C1 -> 78 | I10: =R5C3 -> 1728 | J10: =R5C3 -> 1728
C13: =TRANSPOSE(R[-12]C[-2]:R[-10]C) -> 78 | D13: 156 | E13: 312
C14: 93 | D14: 186 | E14: 372
C15: 108 | D15: 216 | E15: 432