Sheet: @Sheet1
A1: Gregorian calendar: Date Library.
A2: Based on "Nachum Dershowitz, Edward M. Reingold--- Calendarical Calculation. 3rd ed,Cambridge 2008".
A3: huixu@itu.dk, mainul@itu.dk
A4: LEAPYEAR Function
A5: Gregorian-leap-year? (g-year)
A6: Input year (yyyy)= | B6: 2009
A7: (g-year mod4) =0 ? | B7: =MOD(R[-1]C,4) -> 1 | C7: =IF(RC[-1]<>0,0,1) -> 0
A8: (g-year mod 400)<>{100,200,300} | B8: =MOD(R[-2]C,400) -> 9 | C8: =IF(RC[-1]<>100,IF(RC[-1]<>200,IF(RC[-1]<>300,1,0),0),0) -> 1
A9: Out Leaf year (true=1,false=0)= | B9: =IF(RC[1]<>2,0,1) -> 0 | C9: =R[-2]C+R[-1]C -> 1 | D9: =define("leapyear",RC[-2],R[-3]C[-2]) -> #NAME?
A11: FIXDATE Function
A12: fixed-from-Gregorian (yyyy,mm,dd)
A13: Year (yyyy)= | B13: 2100
A14: Month (mm)= | B14: 2
A15: Day (dd)= | B15: 28
A16: y = year + floor((month+9)/12)= | B16: =R[-3]C+FLOOR((R[-2]C+9)/12,1) -> 2100
A17: m = (month-2) amod 12= | B17: =12+MOD((R[-3]C-2),-12) -> 12
A18: Fixed date from Gregorian= | B18: =-306+365*(R[-2]C-1) +FLOOR((R[-2]C-1)/4,1)-FLOOR((R[-2]C-1)/100,1)+FLOOR((R[-2]C-1)/400,1)+FLOOR((3*R[-1]C-1)/5,1)+30*(R[-1]C-1)+R[-3]C -> 766703 | D18: =define("fixdate",RC[-2],R[-5]C[-2],R[-4]C[-2],R[-3]C[-2]) -> #NAME?
A20: EFIXDATE Function
A21: fixed-from-Gdate(int: yyyymmdd)
A22: Input int date: | B22: 20081112
A23: Year= | B23: =FLOOR(R[-1]C/10000,1) -> 2008
A24: Month= | B24: =FLOOR((R[-2]C-FLOOR(R[-2]C/10000,1)*10000)/100,1) -> 11
A25: Day= | B25: =R[-3]C-FLOOR(R[-3]C/100,1)*100 -> 12
A26: y = year + floor((month+9)/12)= | B26: =R[-3]C+FLOOR((R[-2]C+9)/12,1) -> 2009
A27: m = (month-2) amod 12= | B27: =12+MOD((R[-3]C-2),-12) -> 9
A28: Fixed date from Gregorian= | B28: =-306+365*(R[-2]C-1) +FLOOR((R[-2]C-1)/4,1)-FLOOR((R[-2]C-1)/100,1)+FLOOR((R[-2]C-1)/400,1)+FLOOR((3*R[-1]C-1)/5,1)+30*(R[-1]C-1)+R[-3]C -> 733358 | D28: =define("efixdate",RC[-2],R[-6]C[-2]) -> #NAME?
A30: GYEAR Function
A31: gregorian-year-from-fixed (fixed date)
A32: Input fixed date( int )= | B32: 736785
A33: approx= floor ((400/146097)*(fixed date+1),1)=
A34: approx= | B34: =FLOOR((400/146097*(R[-2]C+1)),1) -> 2017
A35: start=1+365*approx+floor(approx/4,1)-floor(approx/100,1)+floor(approx/400,1)=
A36: start= | B36: =1+365*R[-2]C+FLOOR(R[-2]C/4,1)-FLOOR(R[-2]C/100,1)+FLOOR(R[-2]C/400,1) -> 736695
A37: Gregorian Year= | B37: =IF(R[-5]C<R[-1]C,R[-3]C,R[-3]C+1) -> 2018 | D37: =define("gyear",RC[-2],R[-5]C[-2]) -> #NAME?
A39: GMONTH Function
A40: gregorian-month-from-fixed (fixed date)
A41: Input fixed date (int)= | B41: 736785
A42: x=fixed date+306= | B42: =R[-1]C+306 -> 737091 | C42: approx= | D42: =FLOOR((400/146097*(RC[-2]+1)),1) -> 2018
C43: start= | D43: =1+365*R[-1]C+FLOOR(R[-1]C/4,1)-FLOOR(R[-1]C/100,1)+FLOOR(R[-1]C/400,1) -> 737060
A44: y=Gregorian-year-from-fixed(x)= | B44: =IF(R[-3]C<R[-1]C[2],R[-2]C[2],R[-2]C[2]+1) -> 2018
A45: z=fixed-from-gregorian(y-1,march,1)= | B45: y-1= | C45: =R[-1]C[-1]-1 -> 2017 | E45: y= | F45: =RC[-3]+FLOOR((R[1]C[-3]+9)/12,1) -> 2018
B46: march= | C46: 3 | E46: m= | F46: =12+MOD((RC[-3]-2),-12) -> 1
B47: 1= | C47: 1
A48: z= | B48: =-306+365*(R[-3]C[4]-1) +FLOOR((R[-3]C[4]-1)/4,1)-FLOOR((R[-3]C[4]-1)/100,1)+FLOOR((R[-3]C[4]-1)/400,1)+FLOOR((3*R[-2]C[4]-1)/5,1)+30*(R[-2]C[4]-1)+R[-1]C[1] -> 736389
A49: prior-days = fixed date- z= | B49: =R[-8]C-R[-1]C -> 396
A50: w=(floor(1/153*(5*prior-days+2),1)+3)= | B50: =(FLOOR(1/153*(5*R[-1]C+2),1)+3) -> 15
A51: month=w amod 12= | B51: =12+MOD(R[-1]C,-12) -> 3 | D51: =define("gmonth",RC[-2],R[-10]C[-2]) -> #NAME?
A53: GDAY Function
A54: gregorian-day-from-fixed (fixed date)
A55: Input fixed date (int)= | B55: 736785
A56: x=fixed date+306= | B56: =R[-1]C+306 -> 737091 | C56: approx= | D56: =FLOOR((400/146097*(RC[-2]+1)),1) -> 2018
C57: start= | D57: =1+365*R[-1]C+FLOOR(R[-1]C/4,1)-FLOOR(R[-1]C/100,1)+FLOOR(R[-1]C/400,1) -> 737060
A58: y=Gregorian-year-from-fixed(x)= | B58: =IF(R[-2]C<R[-1]C[2],R[-2]C[2],R[-2]C[2]+1) -> 2019
A59: z=fixed-from-gregorian(y-1,march,1)= | B59: y-1= | C59: =R[-1]C[-1]-1 -> 2018 | E59: y= | F59: =RC[-3]+FLOOR((R[1]C[-3]+9)/12,1) -> 2019
B60: march= | C60: 3 | E60: m= | F60: =12+MOD((RC[-3]-2),-12) -> 1
B61: 1= | C61: 1
A62: z= | B62: =-306+365*(R[-3]C[4]-1) +FLOOR((R[-3]C[4]-1)/4,1)-FLOOR((R[-3]C[4]-1)/100,1)+FLOOR((R[-3]C[4]-1)/400,1)+FLOOR((3*R[-2]C[4]-1)/5,1)+30*(R[-2]C[4]-1)+R[-1]C[1] -> 736754
A63: prior-days = fixed date- z= | B63: =R[-8]C-R[-1]C -> 31
A64: w=(floor(1/153*(5*prior-days+2),1)+3)= | B64: =(FLOOR(1/153*(5*R[-1]C+2),1)+3) -> 4
A65: month=w amod 12= | B65: =12+MOD(R[-1]C,-12) -> 4 | C65: y = | D65: = R[1]C[-2] + FLOOR((RC[-2]+9)/12,1) -> 2019
A66: Year= y- floor((month+9)/12,1)= | B66: =R[-8]C-FLOOR(((R[-1]C+9)/12),1) -> 2018 | C66: m = | D66: =12+MOD((R[-1]C[-2]-2),-12) -> 2
A67: day=1 | B67: 1
A68: t=fixed-from-gregorian( year, month,1)= | B68: =-306+365*(R[-3]C[2]-1) +FLOOR((R[-3]C[2]-1)/4,1)-FLOOR((R[-3]C[2]-1)/100,1)+FLOOR((R[-3]C[2]-1)/400,1)+FLOOR((3*R[-2]C[2]-1)/5,1)+30*(R[-2]C[2]-1)+R[-1]C -> 736785
A69: Day= fixed date- t+1= | B69: =R[-14]C-R[-1]C+1 -> 1 | D69: =define("gday",RC[-2],R[-14]C[-2]) -> #NAME?
A71: GDATE Functioin
A72: gregorian-date-from-fixed (fixed date)
A73: Input fixed date (int)= | B73: 733358
A74: x=fixed date+306= | B74: =R[-1]C+306 -> 733664 | C74: approx= | D74: =FLOOR((400/146097*(RC[-2]+1)),1) -> 2008
C75: start= | D75: =1+365*R[-1]C+FLOOR(R[-1]C/4,1)-FLOOR(R[-1]C/100,1)+FLOOR(R[-1]C/400,1) -> 733408
A76: y=Gregorian-year-from-fixed(x)= | B76: =IF(R[-2]C<R[-1]C[2],R[-2]C[2],R[-2]C[2]+1) -> 2009
A77: z=fixed-from-gregorian(y-1,march,1)= | B77: y-1= | C77: =R[-1]C[-1]-1 -> 2008 | E77: y= | F77: =RC[-3]+FLOOR((R[1]C[-3]+9)/12,1) -> 2009
B78: march= | C78: 3 | E78: m= | F78: =12+MOD((RC[-3]-2),-12) -> 1
B79: 1= | C79: 1
A80: z= | B80: =-306+365*(R[-3]C[4]-1) +FLOOR((R[-3]C[4]-1)/4,1)-FLOOR((R[-3]C[4]-1)/100,1)+FLOOR((R[-3]C[4]-1)/400,1)+FLOOR((3*R[-2]C[4]-1)/5,1)+30*(R[-2]C[4]-1)+R[-1]C[1] -> 733102
A81: prior-days = fixed date- z= | B81: =R[-8]C-R[-1]C -> 256
A82: w=(floor(1/153*(5*prior-days+2),1)+3)= | B82: =(FLOOR(1/153*(5*R[-1]C+2),1)+3) -> 11
A83: month=w amod 12= | B83: =12+MOD(R[-1]C,-12) -> 11 | C83: y = | D83: = R[1]C[-2] + FLOOR((RC[-2]+9)/12,1) -> 2009
A84: Year= y- floor((month+9)/12,1)= | B84: =R[-8]C-FLOOR(((R[-1]C+9)/12),1) -> 2008 | C84: m = | D84: =12+MOD((R[-1]C[-2]-2),-12) -> 9
A85: day=1 | B85: 1
A86: t=fixed-from-gregorian( year, month,1)= | B86: =-306+365*(R[-3]C[2]-1) +FLOOR((R[-3]C[2]-1)/4,1)-FLOOR((R[-3]C[2]-1)/100,1)+FLOOR((R[-3]C[2]-1)/400,1)+FLOOR((3*R[-2]C[2]-1)/5,1)+30*(R[-2]C[2]-1)+R[-1]C -> 733347
A87: Day= fixed date- t+1= | B87: =R[-14]C-R[-1]C+1 -> 12
A88: gregorian-date=y*10000+m*100+d | B88: =R[-4]C*10000+R[-5]C*100+R[-1]C -> 20081112 | D88: =define("gdate",RC[-2],R[-15]C[-2]) -> #NAME?
A90: DATE Function
A91: input year= | B91: 2008
A92: input month= | B92: 11
A93: input day= | B93: 12
A94: output date=y*10000+m*100+d= | B94: =R[-3]C*10000+R[-2]C*100+R[-1]C -> 20081112 | D94: =define("date",RC[-2],R[-3]C[-2],R[-2]C[-2],R[-1]C[-2]) -> #NAME?
A96: YEAR Function
A97: input date (int)= | B97: 20081112
A98: ouput year= | B98: =FLOOR(R[-1]C/10000,1) -> 2008 | D98: =define("year", RC[-2],R[-1]C[-2]) -> #NAME?
A100: MONTH Function
A101: input date (int)= | B101: 20081112
A102: output month= | B102: =FLOOR((R[-1]C-FLOOR(R[-1]C/10000,1)*10000)/100,1) -> 11 | D102: =define("month", RC[-2],R[-1]C[-2]) -> #NAME?
A104: DAY Function
A105: input date (int)= | B105: 20081112
A106: output day= | B106: =R[-1]C-FLOOR(R[-1]C/100,1)*100 -> 12 | D106: =define("day", RC[-2],R[-1]C[-2]) -> #NAME?
A108: DAYS Function
A109: input date1 (int)= | B109: 20081112
A110: input date2 (int)= | B110: 20090101
A111: year= | B111: =FLOOR(R[-2]C/10000,1) -> 2008 | D111: =FLOOR(R[-1]C[-2]/10000,1) -> 2009
A112: month= | B112: =FLOOR((R[-3]C-FLOOR(R[-3]C/10000,1)*10000)/100,1) -> 11 | D112: =FLOOR((R[-2]C[-2]-FLOOR(R[-2]C[-2]/10000,1)*10000)/100,1) -> 1
A113: day= | B113: =R[-4]C-FLOOR(R[-4]C/100,1)*100 -> 12 | D113: =R[-3]C[-2]-FLOOR(R[-3]C[-2]/100,1)*100 -> 1
A114: y1= | B114: =R[-3]C+FLOOR((R[-2]C+9)/12,1) -> 2009 | C114: y2= | D114: =R[-3]C+FLOOR((R[-2]C+9)/12,1) -> 2009
A115: m1= | B115: =12+MOD((R[-3]C-2),-12) -> 9 | C115: m2= | D115: =12+MOD((R[-3]C-2),-12) -> 11
A116: fixed date1= | B116: =-306+365*(R[-2]C-1) +FLOOR((R[-2]C-1)/4,1)-FLOOR((R[-2]C-1)/100,1)+FLOOR((R[-2]C-1)/400,1)+FLOOR((3*R[-1]C-1)/5,1)+30*(R[-1]C-1)+R[-3]C -> 733358 | C116: fixed date2= | D116: =-306+365*(R[-2]C-1) +FLOOR((R[-2]C-1)/4,1)-FLOOR((R[-2]C-1)/100,1)+FLOOR((R[-2]C-1)/400,1)+FLOOR((3*R[-1]C-1)/5,1)+30*(R[-1]C-1)+R[-3]C -> 733408
A117: days= fixed date1-fixed date2 = | B117: =R[-1]C[2]-R[-1]C -> 50 | D117: =define("days",RC[-2],R[-8]C[-2],R[-7]C[-2]) -> #NAME?
A119: WEEKDAY Function:
A120: input date(int)= | B120: 20081112
A121: Return type(1-S,2-M)= | B121: 2
A122: Year= | B122: =FLOOR(R[-2]C/10000,1) -> 2008 | C122: CKyear= | D122: =IF(RC[-2]>=1582,RC[-2],0) -> 2008 | E122: Nyear= | F122: =IF(R[1]C[-2]<3,RC[-2]-1,RC[-2]) -> 2008
A123: Month= | B123: =FLOOR((R[-3]C-FLOOR(R[-3]C/10000,1)*10000)/100,1) -> 11 | C123: CKmonth= | D123: =IF(RC[-2]<=12,IF(RC[-2]>=1,RC[-2],0),0) -> 11 | E123: Nmonth= | F123: =IF(RC[-2]<3,RC[-2]+12,RC[-2]) -> 11
A124: Day= | B124: =R[-4]C-FLOOR(R[-4]C/100,1)*100 -> 12 | C124: CKday= | D124: =IF(RC[-2]>=1,IF(RC[-2]<=31,RC[-2],0),0) -> 12 | E124: Nday= | F124: =RC[-2] -> 12
A125: A=(Nday)= | B125: =R[-1]C[4] -> 12
A126: B=trunc((Nmonth+1)*26/10)= | B126: =FLOOR((R[-3]C[4]+1)*26/10,1) -> 31
A127: C=Nyear mod 100= | B127: =MOD(R[-5]C[4],100) -> 8
A128: D=trunc(C/4)= | B128: =FLOOR(R[-1]C/4,1) -> 2
A129: E=trunc(trunc(Nyear/100)/4)= | B129: =FLOOR(R[-7]C[4]/400,1) -> 5
A130: F=5*trunc(Nyear/100)= | B130: =5*FLOOR(R[-8]C[4]/100,1) -> 100
A131: W=(A+B+C+D+E+F) mod 7= | B131: =MOD((R[-6]C+R[-5]C+R[-4]C+R[-3]C+R[-2]C+R[-1]C),7) -> 4
A132: (0=Saturday, 1=Sunday???)
A133: DAY-OF-WEEK (ISO)= | B133: =MOD((R[-2]C+5),7)+1 -> 3
A134: (Monday=1, Sunday=7)
A135: WEEKDAY= | B135: =IF(R[-14]C<>2,R[-4]C,R[-2]C) -> 3 | D135: =define("weekday",RC[-2],R[-15]C[-2],R[-14]C[-2]) -> #NAME?
A137: KDAYOB Function
A138: input K day: (0=Sunday, 1=M???6=Sat): | B138: 4
A139: Input int date: | B139: 20081112
A140: Year= | B140: =FLOOR(R[-1]C/10000,1) -> 2008
A141: Month= | B141: =FLOOR((R[-2]C-FLOOR(R[-2]C/10000,1)*10000)/100,1) -> 11
A142: Day= | B142: =R[-3]C-FLOOR(R[-3]C/100,1)*100 -> 12
A143: y = year + floor((month+9)/12)= | B143: =R[-3]C+FLOOR((R[-2]C+9)/12,1) -> 2009
A144: m = (month-2) amod 12= | B144: =12+MOD((R[-3]C-2),-12) -> 9
A145: a1=Fixed date from Gregorian= | B145: =-306+365*(R[-2]C-1) +FLOOR((R[-2]C-1)/4,1)-FLOOR((R[-2]C-1)/100,1)+FLOOR((R[-2]C-1)/400,1)+FLOOR((3*R[-1]C-1)/5,1)+30*(R[-1]C-1)+R[-3]C -> 733358
A146: a2=(Gdayofweek-K)= | B146: =MOD((R[-1]C-R[-8]C),7) -> 6
A147: a1-a2= | B147: =R[-2]C-R[-1]C -> 733352
A148: x=fixed date+306= | B148: =R[-1]C+306 -> 733658 | C148: approx= | D148: =FLOOR((400/146097*(RC[-2]+1)),1) -> 2008
C149: start= | D149: =1+365*R[-1]C+FLOOR(R[-1]C/4,1)-FLOOR(R[-1]C/100,1)+FLOOR(R[-1]C/400,1) -> 733408
A150: y=Gregorian-year-from-fixed(x)= | B150: =IF(R[-2]C<R[-1]C[2],R[-2]C[2],R[-2]C[2]+1) -> 2009
A151: z=fixed-from-gregorian(y-1,march,1)= | B151: y-1= | C151: =R[-1]C[-1]-1 -> 2008 | E151: y= | F151: =RC[-3]+FLOOR((R[1]C[-3]+9)/12,1) -> 2009
B152: march= | C152: 3 | E152: m= | F152: =12+MOD((RC[-3]-2),-12) -> 1
B153: 1= | C153: 1
A154: z= | B154: =-306+365*(R[-3]C[4]-1) +FLOOR((R[-3]C[4]-1)/4,1)-FLOOR((R[-3]C[4]-1)/100,1)+FLOOR((R[-3]C[4]-1)/400,1)+FLOOR((3*R[-2]C[4]-1)/5,1)+30*(R[-2]C[4]-1)+R[-1]C[1] -> 733102
A155: prior-days = fixed date- z= | B155: =R[-8]C-R[-1]C -> 250
A156: w=(floor(1/153*(5*prior-days+2),1)+3)= | B156: =(FLOOR(1/153*(5*R[-1]C+2),1)+3) -> 11
A157: month=w amod 12= | B157: =12+MOD(R[-1]C,-12) -> 11 | C157: y = | D157: = R[1]C[-2] + FLOOR((RC[-2]+9)/12,1) -> 2009
A158: Year= y- floor((month+9)/12,1)= | B158: =R[-8]C-FLOOR(((R[-1]C+9)/12),1) -> 2008 | C158: m = | D158: =12+MOD((R[-1]C[-2]-2),-12) -> 9
A159: day=1 | B159: 1
A160: t=fixed-from-gregorian( year, month,1)= | B160: =-306+365*(R[-3]C[2]-1) +FLOOR((R[-3]C[2]-1)/4,1)-FLOOR((R[-3]C[2]-1)/100,1)+FLOOR((R[-3]C[2]-1)/400,1)+FLOOR((3*R[-2]C[2]-1)/5,1)+30*(R[-2]C[2]-1)+R[-1]C -> 733347
A161: Day= fixed date- t+1= | B161: =R[-14]C-R[-1]C+1 -> 6
A162: gregorian-date=y*10000+m*100+d | B162: =R[-4]C*10000+R[-5]C*100+R[-1]C -> 20081106 | D162: =define("kdayob",RC[-2],R[-24]C[-2],R[-23]C[-2]) -> #NAME?
A164: KDAYB Function
A165: input K day: (0=Sunday, 1=M???6=Sat): | B165: 3
A166: Input int date: | B166: 20081112
A167: Year= | B167: =FLOOR(R[-1]C/10000,1) -> 2008
A168: Month= | B168: =FLOOR((R[-2]C-FLOOR(R[-2]C/10000,1)*10000)/100,1) -> 11
A169: Day= | B169: =R[-3]C-FLOOR(R[-3]C/100,1)*100 -> 12
A170: y = year + floor((month+9)/12)= | B170: =R[-3]C+FLOOR((R[-2]C+9)/12,1) -> 2009
A171: m = (month-2) amod 12= | B171: =12+MOD((R[-3]C-2),-12) -> 9
A172: a1=Fixed date from Gregorian= | B172: =-306+365*(R[-2]C-1) +FLOOR((R[-2]C-1)/4,1)-FLOOR((R[-2]C-1)/100,1)+FLOOR((R[-2]C-1)/400,1)+FLOOR((3*R[-1]C-1)/5,1)+30*(R[-1]C-1)+R[-3]C -> 733358
A173: a2=(Gdayofweek-K)= | B173: =MOD((R[-1]C-1-R[-8]C),7) -> 6
A174: a1-a2= | B174: =R[-2]C-1-R[-1]C -> 733351
A175: x=fixed date+306= | B175: =R[-1]C+306 -> 733657 | C175: approx= | D175: =FLOOR((400/146097*(RC[-2]+1)),1) -> 2008
C176: start= | D176: =1+365*R[-1]C+FLOOR(R[-1]C/4,1)-FLOOR(R[-1]C/100,1)+FLOOR(R[-1]C/400,1) -> 733408
A177: y=Gregorian-year-from-fixed(x)= | B177: =IF(R[-2]C<R[-1]C[2],R[-2]C[2],R[-2]C[2]+1) -> 2009
A178: z=fixed-from-gregorian(y-1,march,1)= | B178: y-1= | C178: =R[-1]C[-1]-1 -> 2008 | E178: y= | F178: =RC[-3]+FLOOR((R[1]C[-3]+9)/12,1) -> 2009
B179: march= | C179: 3 | E179: m= | F179: =12+MOD((RC[-3]-2),-12) -> 1
B180: 1= | C180: 1
A181: z= | B181: =-306+365*(R[-3]C[4]-1) +FLOOR((R[-3]C[4]-1)/4,1)-FLOOR((R[-3]C[4]-1)/100,1)+FLOOR((R[-3]C[4]-1)/400,1)+FLOOR((3*R[-2]C[4]-1)/5,1)+30*(R[-2]C[4]-1)+R[-1]C[1] -> 733102
A182: prior-days = fixed date- z= | B182: =R[-8]C-R[-1]C -> 249
A183: w=(floor(1/153*(5*prior-days+2),1)+3)= | B183: =(FLOOR(1/153*(5*R[-1]C+2),1)+3) -> 11
A184: month=w amod 12= | B184: =12+MOD(R[-1]C,-12) -> 11 | C184: y = | D184: = R[1]C[-2] + FLOOR((RC[-2]+9)/12,1) -> 2009
A185: Year= y- floor((month+9)/12,1)= | B185: =R[-8]C-FLOOR(((R[-1]C+9)/12),1) -> 2008 | C185: m = | D185: =12+MOD((R[-1]C[-2]-2),-12) -> 9
A186: day=1 | B186: 1
A187: t=fixed-from-gregorian( year, month,1)= | B187: =-306+365*(R[-3]C[2]-1) +FLOOR((R[-3]C[2]-1)/4,1)-FLOOR((R[-3]C[2]-1)/100,1)+FLOOR((R[-3]C[2]-1)/400,1)+FLOOR((3*R[-2]C[2]-1)/5,1)+30*(R[-2]C[2]-1)+R[-1]C -> 733347
A188: Day= fixed date- t+1= | B188: =R[-14]C-R[-1]C+1 -> 5
A189: gregorian-date=y*10000+m*100+d | B189: =R[-4]C*10000+R[-5]C*100+R[-1]C -> 20081105 | D189: =define("kdayb",RC[-2],R[-24]C[-2],R[-23]C[-2]) -> #NAME?
A191: KDAYOA Function
A192: input K day: (0=Sunday, 1=M???6=Sat): | B192: 4
A193: Input int date: | B193: 20081112
A194: Year= | B194: =FLOOR(R[-1]C/10000,1) -> 2008
A195: Month= | B195: =FLOOR((R[-2]C-FLOOR(R[-2]C/10000,1)*10000)/100,1) -> 11
A196: Day= | B196: =R[-3]C-FLOOR(R[-3]C/100,1)*100 -> 12
A197: y = year + floor((month+9)/12)= | B197: =R[-3]C+FLOOR((R[-2]C+9)/12,1) -> 2009
A198: m = (month-2) amod 12= | B198: =12+MOD((R[-3]C-2),-12) -> 9
A199: a1=Fixed date from Gregorian= | B199: =-306+365*(R[-2]C-1) +FLOOR((R[-2]C-1)/4,1)-FLOOR((R[-2]C-1)/100,1)+FLOOR((R[-2]C-1)/400,1)+FLOOR((3*R[-1]C-1)/5,1)+30*(R[-1]C-1)+R[-3]C -> 733358
A200: a2=(Gdayofweek-K)= | B200: =MOD((R[-1]C+6-R[-8]C),7) -> 5
A201: a1-a2= | B201: =R[-2]C+6-R[-1]C -> 733359
A202: x=fixed date+306= | B202: =R[-1]C+306 -> 733665 | C202: approx= | D202: =FLOOR((400/146097*(RC[-2]+1)),1) -> 2008
C203: start= | D203: =1+365*R[-1]C+FLOOR(R[-1]C/4,1)-FLOOR(R[-1]C/100,1)+FLOOR(R[-1]C/400,1) -> 733408
A204: y=Gregorian-year-from-fixed(x)= | B204: =IF(R[-2]C<R[-1]C[2],R[-2]C[2],R[-2]C[2]+1) -> 2009
A205: z=fixed-from-gregorian(y-1,march,1)= | B205: y-1= | C205: =R[-1]C[-1]-1 -> 2008 | E205: y= | F205: =RC[-3]+FLOOR((R[1]C[-3]+9)/12,1) -> 2009
B206: march= | C206: 3 | E206: m= | F206: =12+MOD((RC[-3]-2),-12) -> 1
B207: 1= | C207: 1
A208: z= | B208: =-306+365*(R[-3]C[4]-1) +FLOOR((R[-3]C[4]-1)/4,1)-FLOOR((R[-3]C[4]-1)/100,1)+FLOOR((R[-3]C[4]-1)/400,1)+FLOOR((3*R[-2]C[4]-1)/5,1)+30*(R[-2]C[4]-1)+R[-1]C[1] -> 733102
A209: prior-days = fixed date- z= | B209: =R[-8]C-R[-1]C -> 257
A210: w=(floor(1/153*(5*prior-days+2),1)+3)= | B210: =(FLOOR(1/153*(5*R[-1]C+2),1)+3) -> 11
A211: month=w amod 12= | B211: =12+MOD(R[-1]C,-12) -> 11 | C211: y = | D211: = R[1]C[-2] + FLOOR((RC[-2]+9)/12,1) -> 2009
A212: Year= y- floor((month+9)/12,1)= | B212: =R[-8]C-FLOOR(((R[-1]C+9)/12),1) -> 2008 | C212: m = | D212: =12+MOD((R[-1]C[-2]-2),-12) -> 9
A213: day=1 | B213: 1
A214: t=fixed-from-gregorian( year, month,1)= | B214: =-306+365*(R[-3]C[2]-1) +FLOOR((R[-3]C[2]-1)/4,1)-FLOOR((R[-3]C[2]-1)/100,1)+FLOOR((R[-3]C[2]-1)/400,1)+FLOOR((3*R[-2]C[2]-1)/5,1)+30*(R[-2]C[2]-1)+R[-1]C -> 733347
A215: Day= fixed date- t+1= | B215: =R[-14]C-R[-1]C+1 -> 13
A216: gregorian-date=y*10000+m*100+d | B216: =R[-4]C*10000+R[-5]C*100+R[-1]C -> 20081113 | D216: =define("kdayoa",RC[-2],R[-24]C[-2],R[-23]C[-2]) -> #NAME?
A218: KDAYA Function
A219: input K day: (0=Sunday, 1=M???6=Sat): | B219: 3
A220: Input int date: | B220: 20081112
A221: Year= | B221: =FLOOR(R[-1]C/10000,1) -> 2008
A222: Month= | B222: =FLOOR((R[-2]C-FLOOR(R[-2]C/10000,1)*10000)/100,1) -> 11
A223: Day= | B223: =R[-3]C-FLOOR(R[-3]C/100,1)*100 -> 12
A224: y = year + floor((month+9)/12)= | B224: =R[-3]C+FLOOR((R[-2]C+9)/12,1) -> 2009
A225: m = (month-2) amod 12= | B225: =12+MOD((R[-3]C-2),-12) -> 9
A226: a1=Fixed date from Gregorian= | B226: =-306+365*(R[-2]C-1) +FLOOR((R[-2]C-1)/4,1)-FLOOR((R[-2]C-1)/100,1)+FLOOR((R[-2]C-1)/400,1)+FLOOR((3*R[-1]C-1)/5,1)+30*(R[-1]C-1)+R[-3]C -> 733358
A227: a2=(Gdayofweek-K)= | B227: =MOD((R[-1]C+7-R[-8]C),7) -> 0
A228: a1-a2= | B228: =R[-2]C+7-R[-1]C -> 733365
A229: x=fixed date+306= | B229: =R[-1]C+306 -> 733671 | C229: approx= | D229: =FLOOR((400/146097*(RC[-2]+1)),1) -> 2008
C230: start= | D230: =1+365*R[-1]C+FLOOR(R[-1]C/4,1)-FLOOR(R[-1]C/100,1)+FLOOR(R[-1]C/400,1) -> 733408
A231: y=Gregorian-year-from-fixed(x)= | B231: =IF(R[-2]C<R[-1]C[2],R[-2]C[2],R[-2]C[2]+1) -> 2009
A232: z=fixed-from-gregorian(y-1,march,1)= | B232: y-1= | C232: =R[-1]C[-1]-1 -> 2008 | E232: y= | F232: =RC[-3]+FLOOR((R[1]C[-3]+9)/12,1) -> 2009
B233: march= | C233: 3 | E233: m= | F233: =12+MOD((RC[-3]-2),-12) -> 1
B234: 1= | C234: 1
A235: z= | B235: =-306+365*(R[-3]C[4]-1) +FLOOR((R[-3]C[4]-1)/4,1)-FLOOR((R[-3]C[4]-1)/100,1)+FLOOR((R[-3]C[4]-1)/400,1)+FLOOR((3*R[-2]C[4]-1)/5,1)+30*(R[-2]C[4]-1)+R[-1]C[1] -> 733102
A236: prior-days = fixed date- z= | B236: =R[-8]C-R[-1]C -> 263
A237: w=(floor(1/153*(5*prior-days+2),1)+3)= | B237: =(FLOOR(1/153*(5*R[-1]C+2),1)+3) -> 11
A238: month=w amod 12= | B238: =12+MOD(R[-1]C,-12) -> 11 | C238: y = | D238: = R[1]C[-2] + FLOOR((RC[-2]+9)/12,1) -> 2009
A239: Year= y- floor((month+9)/12,1)= | B239: =R[-8]C-FLOOR(((R[-1]C+9)/12),1) -> 2008 | C239: m = | D239: =12+MOD((R[-1]C[-2]-2),-12) -> 9
A240: day=1 | B240: 1
A241: t=fixed-from-gregorian( year, month,1)= | B241: =-306+365*(R[-3]C[2]-1) +FLOOR((R[-3]C[2]-1)/4,1)-FLOOR((R[-3]C[2]-1)/100,1)+FLOOR((R[-3]C[2]-1)/400,1)+FLOOR((3*R[-2]C[2]-1)/5,1)+30*(R[-2]C[2]-1)+R[-1]C -> 733347
A242: Day= fixed date- t+1= | B242: =R[-14]C-R[-1]C+1 -> 19
A243: gregorian-date=y*10000+m*100+d | B243: =R[-4]C*10000+R[-5]C*100+R[-1]C -> 20081119 | D243: =define("kdaya",RC[-2],R[-24]C[-2],R[-23]C[-2]) -> #NAME?
A245: NTHKDAY Function
A246: input N weeks: | B246: -10
A247: input K day : (0=Sunday, 1=M???6=Sat): | B247: 1
A248: Input int date: | B248: 20080229
A249: Year= | B249: =FLOOR(R[-1]C/10000,1) -> 2008
A250: Month= | B250: =FLOOR((R[-2]C-FLOOR(R[-2]C/10000,1)*10000)/100,1) -> 2
A251: Day= | B251: =R[-3]C-FLOOR(R[-3]C/100,1)*100 -> 29
A252: y = year + floor((month+9)/12)= | B252: =R[-3]C+FLOOR((R[-2]C+9)/12,1) -> 2008 | G252: =R[-3]C[-5]+FLOOR((R[-2]C[-5]+9)/12,1) -> 2008
A253: m = (month-2) amod 12= | B253: =12+MOD((R[-3]C-2),-12) -> 12 | G253: =12+MOD((R[-3]C[-5]-2),-12) -> 12
A254: a1=Fixed date from Gregorian= | B254: =-306+365*(R[-2]C-1) +FLOOR((R[-2]C-1)/4,1)-FLOOR((R[-2]C-1)/100,1)+FLOOR((R[-2]C-1)/400,1)+FLOOR((3*R[-1]C-1)/5,1)+30*(R[-1]C-1)+R[-3]C -> 733101 | G254: =-306+365*(R[-2]C-1) +FLOOR((R[-2]C-1)/4,1)-FLOOR((R[-2]C-1)/100,1)+FLOOR((R[-2]C-1)/400,1)+FLOOR((3*R[-1]C-1)/5,1)+30*(R[-1]C-1)+R[-3]C[-5] -> 733101
A255: a2=(Gdayofweek-K)= | B255: =MOD((R[-1]C-1-R[-8]C),7) -> 3 | G255: =MOD((R[-1]C+7-R[-8]C[-5]),7) -> 4
A256: a1-a2= | B256: =(R[-2]C-1-R[-1]C)+7*R[-10]C -> 733027 | G256: =(R[-2]C+7-R[-1]C)+7*R[-10]C[-5] -> 733034
A257: x=fixed date+306= | B257: =R[-1]C+306 -> 733333 | C257: approx= | D257: =FLOOR((400/146097*(RC[-2]+1)),1) -> 2007 | G257: =R[-1]C+306 -> 733340 | H257: approx= | I257: =FLOOR((400/146097*(RC[-2]+1)),1) -> 2007
C258: start= | D258: =1+365*R[-1]C+FLOOR(R[-1]C/4,1)-FLOOR(R[-1]C/100,1)+FLOOR(R[-1]C/400,1) -> 733042 | H258: start= | I258: =1+365*R[-1]C+FLOOR(R[-1]C/4,1)-FLOOR(R[-1]C/100,1)+FLOOR(R[-1]C/400,1) -> 733042
A259: y=Gregorian-year-from-fixed(x)= | B259: =IF(R[-2]C<R[-1]C[2],R[-2]C[2],R[-2]C[2]+1) -> 2008 | G259: =IF(R[-2]C<R[-1]C[2],R[-2]C[2],R[-2]C[2]+1) -> 2008
A260: z=fixed-from-gregorian(y-1,march,1)= | B260: y-1= | C260: =R[-1]C[-1]-1 -> 2007 | E260: y= | F260: =RC[-3]+FLOOR((R[1]C[-3]+9)/12,1) -> 2008 | G260: y-1= | H260: =R[-1]C[-1]-1 -> 2007 | J260: y= | K260: =RC[-3]+FLOOR((R[1]C[-3]+9)/12,1) -> 2008
B261: march= | C261: 3 | E261: m= | F261: =12+MOD((RC[-3]-2),-12) -> 1 | G261: march= | H261: 3 | J261: m= | K261: =12+MOD((RC[-3]-2),-12) -> 1
B262: 1= | C262: 1 | G262: 1= | H262: 1
A263: z= | B263: =-306+365*(R[-3]C[4]-1) +FLOOR((R[-3]C[4]-1)/4,1)-FLOOR((R[-3]C[4]-1)/100,1)+FLOOR((R[-3]C[4]-1)/400,1)+FLOOR((3*R[-2]C[4]-1)/5,1)+30*(R[-2]C[4]-1)+R[-1]C[1] -> 732736 | G263: =-306+365*(R[-3]C[4]-1) +FLOOR((R[-3]C[4]-1)/4,1)-FLOOR((R[-3]C[4]-1)/100,1)+FLOOR((R[-3]C[4]-1)/400,1)+FLOOR((3*R[-2]C[4]-1)/5,1)+30*(R[-2]C[4]-1)+R[-1]C[1] -> 732736
A264: prior-days = fixed date- z= | B264: =R[-8]C-R[-1]C -> 291 | G264: =R[-8]C-R[-1]C -> 298
A265: w=(floor(1/153*(5*prior-days+2),1)+3)= | B265: =(FLOOR(1/153*(5*R[-1]C+2),1)+3) -> 12 | G265: =(FLOOR(1/153*(5*R[-1]C+2),1)+3) -> 12
A266: month=w amod 12= | B266: =12+MOD(R[-1]C,-12) -> 12 | C266: y = | D266: = R[1]C[-2] + FLOOR((RC[-2]+9)/12,1) -> 2008 | G266: =12+MOD(R[-1]C,-12) -> 12 | H266: y = | I266: = R[1]C[-2] + FLOOR((RC[-2]+9)/12,1) -> 2008
A267: Year= y- floor((month+9)/12,1)= | B267: =R[-8]C-FLOOR(((R[-1]C+9)/12),1) -> 2007 | C267: m = | D267: =12+MOD((R[-1]C[-2]-2),-12) -> 10 | G267: =R[-8]C-FLOOR(((R[-1]C+9)/12),1) -> 2007 | H267: m = | I267: =12+MOD((R[-1]C[-2]-2),-12) -> 10
A268: day=1 | B268: 1 | G268: 1
A269: t=fixed-from-gregorian( year, month,1)= | B269: =-306+365*(R[-3]C[2]-1) +FLOOR((R[-3]C[2]-1)/4,1)-FLOOR((R[-3]C[2]-1)/100,1)+FLOOR((R[-3]C[2]-1)/400,1)+FLOOR((3*R[-2]C[2]-1)/5,1)+30*(R[-2]C[2]-1)+R[-1]C -> 733011 | G269: =-306+365*(R[-3]C[2]-1) +FLOOR((R[-3]C[2]-1)/4,1)-FLOOR((R[-3]C[2]-1)/100,1)+FLOOR((R[-3]C[2]-1)/400,1)+FLOOR((3*R[-2]C[2]-1)/5,1)+30*(R[-2]C[2]-1)+R[-1]C -> 733011
A270: Day= fixed date- t+1= | B270: =R[-14]C-R[-1]C+1 -> 17 | G270: =R[-14]C-R[-1]C+1 -> 24
A271: gregorian-date=y*10000+m*100+d | B271: =R[-4]C*10000+R[-5]C*100+R[-1]C -> 20071217 | G271: =R[-4]C*10000+R[-5]C*100+R[-1]C -> 20071224
A272: nth-kday output: int date= | B272: =IF(R[-26]C>0,R[-1]C,R[-1]C[5]) -> 20071224 | D272: =define("nthkday",RC[-2],R[-26]C[-2],R[-25]C[-2],R[-24]C[-2]) -> #NAME?
A274: DATEISO Function
A275: Input int YEAR (yyyy): | B275: 2008
A276: input int WEEKNUM(1-52,53): | B276: 46
A277: input int WEEKDAY(0=Sun, 1=Mon???): | B277: 4
A278: nth=week | B278: =R[-2]C -> 46
A279: Sunday=0 | B279: 0
A280: year-1,12,28= | B280: =(R[-5]C-1)*10000+12*100+28 -> 20071228
A281: Year= | B281: =FLOOR(R[-1]C/10000,1) -> 2007
A282: Month= | B282: =FLOOR((R[-2]C-FLOOR(R[-2]C/10000,1)*10000)/100,1) -> 12
A283: Day= | B283: =R[-3]C-FLOOR(R[-3]C/100,1)*100 -> 28
A284: y = year + floor((month+9)/12)= | B284: =R[-3]C+FLOOR((R[-2]C+9)/12,1) -> 2008 | G284: =R[-3]C[-5]+FLOOR((R[-2]C[-5]+9)/12,1) -> 2008
A285: m = (month-2) amod 12= | B285: =12+MOD((R[-3]C-2),-12) -> 10 | G285: =12+MOD((R[-3]C[-5]-2),-12) -> 10
A286: a1=Fixed date from Gregorian= | B286: =-306+365*(R[-2]C-1) +FLOOR((R[-2]C-1)/4,1)-FLOOR((R[-2]C-1)/100,1)+FLOOR((R[-2]C-1)/400,1)+FLOOR((3*R[-1]C-1)/5,1)+30*(R[-1]C-1)+R[-3]C -> 733038 | G286: =-306+365*(R[-2]C-1) +FLOOR((R[-2]C-1)/4,1)-FLOOR((R[-2]C-1)/100,1)+FLOOR((R[-2]C-1)/400,1)+FLOOR((3*R[-1]C-1)/5,1)+30*(R[-1]C-1)+R[-3]C[-5] -> 733038
A287: a2=(Gdayofweek-K)= | B287: =MOD((R[-1]C-1-R[-8]C),7) -> 4 | G287: =MOD((R[-1]C+7-R[-8]C[-5]),7) -> 5
A288: a1-a2= | B288: =(R[-2]C-1-R[-1]C)+7*R[-10]C -> 733355 | G288: =(R[-2]C+7-R[-1]C)+7*R[-10]C[-5] -> 733362
A289: x=fixed date+306= | B289: =R[-1]C+306 -> 733661 | C289: approx= | D289: =FLOOR((400/146097*(RC[-2]+1)),1) -> 2008 | G289: =R[-1]C+306 -> 733668 | H289: approx= | I289: =FLOOR((400/146097*(RC[-2]+1)),1) -> 2008
C290: start= | D290: =1+365*R[-1]C+FLOOR(R[-1]C/4,1)-FLOOR(R[-1]C/100,1)+FLOOR(R[-1]C/400,1) -> 733408 | H290: start= | I290: =1+365*R[-1]C+FLOOR(R[-1]C/4,1)-FLOOR(R[-1]C/100,1)+FLOOR(R[-1]C/400,1) -> 733408
A291: y=Gregorian-year-from-fixed(x)= | B291: =IF(R[-2]C<R[-1]C[2],R[-2]C[2],R[-2]C[2]+1) -> 2009 | G291: =IF(R[-2]C<R[-1]C[2],R[-2]C[2],R[-2]C[2]+1) -> 2009
A292: z=fixed-from-gregorian(y-1,march,1)= | B292: y-1= | C292: =R[-1]C[-1]-1 -> 2008 | E292: y= | F292: =RC[-3]+FLOOR((R[1]C[-3]+9)/12,1) -> 2009 | G292: y-1= | H292: =R[-1]C[-1]-1 -> 2008 | J292: y= | K292: =RC[-3]+FLOOR((R[1]C[-3]+9)/12,1) -> 2009
B293: march= | C293: 3 | E293: m= | F293: =12+MOD((RC[-3]-2),-12) -> 1 | G293: march= | H293: 3 | J293: m= | K293: =12+MOD((RC[-3]-2),-12) -> 1
B294: 1= | C294: 1 | G294: 1= | H294: 1
A295: z= | B295: =-306+365*(R[-3]C[4]-1) +FLOOR((R[-3]C[4]-1)/4,1)-FLOOR((R[-3]C[4]-1)/100,1)+FLOOR((R[-3]C[4]-1)/400,1)+FLOOR((3*R[-2]C[4]-1)/5,1)+30*(R[-2]C[4]-1)+R[-1]C[1] -> 733102 | G295: =-306+365*(R[-3]C[4]-1) +FLOOR((R[-3]C[4]-1)/4,1)-FLOOR((R[-3]C[4]-1)/100,1)+FLOOR((R[-3]C[4]-1)/400,1)+FLOOR((3*R[-2]C[4]-1)/5,1)+30*(R[-2]C[4]-1)+R[-1]C[1] -> 733102
A296: prior-days = fixed date- z= | B296: =R[-8]C-R[-1]C -> 253 | G296: =R[-8]C-R[-1]C -> 260
A297: w=(floor(1/153*(5*prior-days+2),1)+3)= | B297: =(FLOOR(1/153*(5*R[-1]C+2),1)+3) -> 11 | G297: =(FLOOR(1/153*(5*R[-1]C+2),1)+3) -> 11
A298: month=w amod 12= | B298: =12+MOD(R[-1]C,-12) -> 11 | C298: y = | D298: = R[1]C[-2] + FLOOR((RC[-2]+9)/12,1) -> 2009 | G298: =12+MOD(R[-1]C,-12) -> 11 | H298: y = | I298: = R[1]C[-2] + FLOOR((RC[-2]+9)/12,1) -> 2009
A299: Year= y- floor((month+9)/12,1)= | B299: =R[-8]C-FLOOR(((R[-1]C+9)/12),1) -> 2008 | C299: m = | D299: =12+MOD((R[-1]C[-2]-2),-12) -> 9 | G299: =R[-8]C-FLOOR(((R[-1]C+9)/12),1) -> 2008 | H299: m = | I299: =12+MOD((R[-1]C[-2]-2),-12) -> 9
A300: day=1 | B300: 1 | G300: 1
A301: t=fixed-from-gregorian( year, month,1)= | B301: =-306+365*(R[-3]C[2]-1) +FLOOR((R[-3]C[2]-1)/4,1)-FLOOR((R[-3]C[2]-1)/100,1)+FLOOR((R[-3]C[2]-1)/400,1)+FLOOR((3*R[-2]C[2]-1)/5,1)+30*(R[-2]C[2]-1)+R[-1]C -> 733347 | G301: =-306+365*(R[-3]C[2]-1) +FLOOR((R[-3]C[2]-1)/4,1)-FLOOR((R[-3]C[2]-1)/100,1)+FLOOR((R[-3]C[2]-1)/400,1)+FLOOR((3*R[-2]C[2]-1)/5,1)+30*(R[-2]C[2]-1)+R[-1]C -> 733347
A302: Day= fixed date- t+1= | B302: =R[-14]C-R[-1]C+1 -> 9 | G302: =R[-14]C-R[-1]C+1 -> 16
A303: gregorian-date=y*10000+m*100+d | B303: =R[-4]C*10000+R[-5]C*100+R[-1]C -> 20081109 | G303: =R[-4]C*10000+R[-5]C*100+R[-1]C -> 20081116
A304: nth-kday output: int date= | B304: =IF(R[-26]C>0,R[-1]C,R[-1]C[5]) -> 20081109
A305: int date from ISO date: | B305: =R[-1]C+R[-28]C -> 20081113 | D305: =define("dateiso",RC[-2],R[-30]C[-2],R[-29]C[-2],R[-28]C[-2]) -> #NAME?
A307: FIXDATEISO Function
A308: Input int YEAR (yyyy): | B308: 2008
A309: input int WEEKNUM(1-52,53): | B309: 1
A310: input int WEEKDAY(0=Sun, 1=Mon???): | B310: 1
A311: nth=week | B311: =R[-2]C -> 1
A312: Sunday=0 | B312: 0
A313: year-1,12,28= | B313: =(R[-5]C-1)*10000+12*100+28 -> 20071228
A314: Year= | B314: =FLOOR(R[-1]C/10000,1) -> 2007
A315: Month= | B315: =FLOOR((R[-2]C-FLOOR(R[-2]C/10000,1)*10000)/100,1) -> 12
A316: Day= | B316: =R[-3]C-FLOOR(R[-3]C/100,1)*100 -> 28
A317: y = year + floor((month+9)/12)= | B317: =R[-3]C+FLOOR((R[-2]C+9)/12,1) -> 2008 | G317: =R[-3]C[-5]+FLOOR((R[-2]C[-5]+9)/12,1) -> 2008
A318: m = (month-2) amod 12= | B318: =12+MOD((R[-3]C-2),-12) -> 10 | G318: =12+MOD((R[-3]C[-5]-2),-12) -> 10
A319: a1=Fixed date from Gregorian= | B319: =-306+365*(R[-2]C-1) +FLOOR((R[-2]C-1)/4,1)-FLOOR((R[-2]C-1)/100,1)+FLOOR((R[-2]C-1)/400,1)+FLOOR((3*R[-1]C-1)/5,1)+30*(R[-1]C-1)+R[-3]C -> 733038 | G319: =-306+365*(R[-2]C-1) +FLOOR((R[-2]C-1)/4,1)-FLOOR((R[-2]C-1)/100,1)+FLOOR((R[-2]C-1)/400,1)+FLOOR((3*R[-1]C-1)/5,1)+30*(R[-1]C-1)+R[-3]C[-5] -> 733038
A320: a2=(Gdayofweek-K)= | B320: =MOD((R[-1]C-1-R[-8]C),7) -> 4 | G320: =MOD((R[-1]C+7-R[-8]C[-5]),7) -> 5
A321: a1-a2= | B321: =(R[-2]C-1-R[-1]C)+7*R[-10]C -> 733040 | G321: =(R[-2]C+7-R[-1]C)+7*R[-10]C[-5] -> 733047
A322: fixed-date from ISO date: | B322: =IF(R[-11]C>0,R[-1]C,R[-1]C[5])+R[-12]C -> 733041 | D322: =define("fixdateiso",RC[-2],R[-14]C[-2],R[-13]C[-2],R[-12]C[-2]) -> #NAME?
A324: ISOWEEKNUM Function
A325: input int date: | B325: 20080101
A326: Year= | B326: =FLOOR(R[-1]C/10000,1) -> 2008 | C326: year= | D326: =RC[-2] -> 2008
A327: Month= | B327: =FLOOR((R[-2]C-R[-1]C*10000)/100,1) -> 1 | C327: weeknum=1 | D327: 1
A328: Day= | B328: =R[-3]C-FLOOR(R[-3]C/100,1)*100 -> 1 | C328: weekday=1 | D328: 1
A329: y = year + floor((month+9)/12)= | B329: =R[-3]C+FLOOR((R[-2]C+9)/12,1) -> 2008 | C329: nth=week | D329: =R[-2]C -> 1
A330: m = (month-2) amod 12= | B330: =12+MOD((R[-3]C-2),-12) -> 11 | C330: Sunday=0 | D330: 0
A331: a1=Fixed date from Gregorian= | B331: =-306+365*(R[-2]C-1) +FLOOR((R[-2]C-1)/4,1)-FLOOR((R[-2]C-1)/100,1)+FLOOR((R[-2]C-1)/400,1)+FLOOR((3*R[-1]C-1)/5,1)+30*(R[-1]C-1)+R[-3]C -> 733042 | C331: year-1,12,28= | D331: =(R[-5]C-1)*10000+12*100+28 -> 20071228
C332: Year= | D332: =FLOOR(R[-1]C/10000,1) -> 2007
C333: Month= | D333: =FLOOR((R[-2]C-FLOOR(R[-2]C/10000,1)*10000)/100,1) -> 12
C334: Day= | D334: =R[-3]C-FLOOR(R[-3]C/100,1)*100 -> 28
C335: y = year + floor((month+9)/12)= | D335: =R[-3]C+FLOOR((R[-2]C+9)/12,1) -> 2008 | I335: =R[-3]C[-5]+FLOOR((R[-2]C[-5]+9)/12,1) -> 2008
C336: m = (month-2) amod 12= | D336: =12+MOD((R[-3]C-2),-12) -> 10 | I336: =12+MOD((R[-3]C[-5]-2),-12) -> 10
C337: a1=Fixed date from Gregorian= | D337: =-306+365*(R[-2]C-1) +FLOOR((R[-2]C-1)/4,1)-FLOOR((R[-2]C-1)/100,1)+FLOOR((R[-2]C-1)/400,1)+FLOOR((3*R[-1]C-1)/5,1)+30*(R[-1]C-1)+R[-3]C -> 733038 | I337: =-306+365*(R[-2]C-1) +FLOOR((R[-2]C-1)/4,1)-FLOOR((R[-2]C-1)/100,1)+FLOOR((R[-2]C-1)/400,1)+FLOOR((3*R[-1]C-1)/5,1)+30*(R[-1]C-1)+R[-3]C[-5] -> 733038
C338: a2=(Gdayofweek-K)= | D338: =MOD(R[-1]C-1,7) -> 4 | I338: =MOD((R[-1]C+7-R[-8]C[-5]),7) -> 5
C339: a1-a2= | D339: =(R[-2]C-1-R[-1]C)+7*R[-10]C -> 733040 | I339: =(R[-2]C+7-R[-1]C)+7*R[-10]C[-5] -> 733047
C340: fixed-date from ISO date: | D340: =R[-1]C+R[-12]C -> 733041
A341: x=a1-fixed-date from ISO= | B341: =R[-10]C-R[-1]C[2] -> 1
A342: week number= | B342: =1+FLOOR(R[-1]C/7,1) -> 1 | D342: =define("isoweeknum",RC[-2],R[-17]C[-2]) -> #NAME?
A344: ZELLER Function
A345: year= | B345: 1975 | D345: CKyear= | E345: =IF(RC[-3]>=1582,RC[-3],0) -> 1975 | I345: Nyear= | J345: =IF(R[1]C[-5]<3,RC[-5]-1,RC[-5]) -> 1975
A346: month= | B346: 8 | D346: CKmonth= | E346: =IF(RC[-3]<=12,IF(RC[-3]>=1,RC[-3],0),0) -> 8 | I346: Nmonth= | J346: =IF(RC[-5]<3,RC[-5]+12,RC[-5]) -> 8
A347: day= | B347: 1 | D347: CKday= | E347: =IF(RC[-3]>=1,IF(RC[-3]<=31,RC[-3],0),0) -> 1 | I347: Nday= | J347: =RC[-5] -> 1
D348: CHECK= | E348: =R[-3]C*R[-2]C*R[-1]C -> 15800 | F348: (0 means input invaild)
A353: A=(Nday)= | B353: =R[-6]C[8] -> 1 | G353: 1 | H353: Monday
A354: B=trunc((Nmonth+1)*26/10)= | B354: =FLOOR((R[-8]C[8]+1)*26/10,1) -> 23 | G354: 2 | H354: Tuesday
A355: C=Nyear mod 100= | B355: =MOD(R[-10]C[8],100) -> 75 | G355: 3 | H355: Wednesday
A356: D=trunc(C/4)= | B356: =FLOOR(R[-1]C/4,1) -> 18 | G356: 4 | H356: Thursday
A357: E=trunc(trunc(Nyear/100)/4)= | B357: =FLOOR(R[-12]C[8]/400,1) -> 4 | G357: 5 | H357: Friday
A358: F=5*trunc(Nyear/100)= | B358: =5*FLOOR(R[-13]C[8]/100,1) -> 95 | G358: 6 | H358: Saturday
G359: 7 | H359: Sunday
A360: W=(A+B+C+D+E+F) mod 7= | B360: =MOD((R[-7]C+R[-6]C+R[-5]C+R[-4]C+R[-3]C+R[-2]C),7) -> 6
A361: (0=Saturday, 1=Sunday???
A363: DAY-OF-WEEK (ISO)= | B363: =MOD((R[-3]C+5),7)+1 -> 5
A364: (Monday=1, Sunday=7) | B364: =IF(R[-1]C=R[-11]C[5],R[-11]C[6],(IF(R[-1]C=R[-10]C[5],R[-10]C[6],IF(R[-1]C=R[-9]C[5],R[-9]C[6],IF(R[-1]C=R[-8]C[5],R[-8]C[6],IF(R[-1]C=R[-7]C[5],R[-7]C[6],IF(R[-1]C=R[-6]C[5],R[-6]C[6],R[-5]C[6]))))))) -> Friday | D364: =define("zeller",RC[-2],R[-19]C[-2],R[-18]C[-2],R[-17]C[-2]) -> #NAME?

Sheet: Sheet2
A1: Date cal