Sheet: Sheet1
A1: 1 | B1: =SUM(RC[-1]:R1C1) -> 1
A2: =R[-1]C+1 -> 2 | B2: =SUM(R1C[-1]:RC1) -> 3
A3: =R[-1]C+1 -> 3 | B3: =SUM(R1C[-1]:RC1) -> 6
A4: =R[-1]C+1 -> 4 | B4: =SUM(R1C[-1]:RC1) -> 10
A5: =R[-1]C+1 -> 5 | B5: =SUM(R1C[-1]:RC1) -> 15
A6: =R[-1]C+1 -> 6 | B6: =SUM(R1C[-1]:RC1) -> 21
A7: =R[-1]C+1 -> 7 | B7: =SUM(R1C[-1]:RC1) -> 28
A8: =R[-1]C+1 -> 8 | B8: =SUM(R1C[-1]:RC1) -> 36
A9: =R[-1]C+1 -> 9 | B9: =SUM(R1C[-1]:RC1) -> 45
A10: =R[-1]C+1 -> 10 | B10: =SUM(R1C[-1]:RC1) -> 55
A11: =R[-1]C+1 -> 11 | B11: =SUM(R1C[-1]:RC1) -> 66
A12: =R[-1]C+1 -> 12 | B12: =SUM(R1C[-1]:RC1) -> 78
A13: =R[-1]C+1 -> 13 | B13: =SUM(R1C[-1]:RC1) -> 91
A14: =R[-1]C+1 -> 14 | B14: =SUM(R1C[-1]:RC1) -> 105
A15: =R[-1]C+1 -> 15 | B15: =SUM(R1C[-1]:RC1) -> 120
A16: =R[-1]C+1 -> 16 | B16: =SUM(R1C[-1]:RC1) -> 136
A17: =R[-1]C+1 -> 17 | B17: =SUM(R1C[-1]:RC1) -> 153
A18: =R[-1]C+1 -> 18 | B18: =SUM(R1C[-1]:RC1) -> 171
A19: =R[-1]C+1 -> 19 | B19: =SUM(R1C[-1]:RC1) -> 190
A20: =R[-1]C+1 -> 20 | B20: =SUM(R1C[-1]:RC1) -> 210
A21: =R[-1]C+1 -> 21 | B21: =SUM(R1C[-1]:RC1) -> 231
A22: =R[-1]C+1 -> 22 | B22: =SUM(R1C[-1]:RC1) -> 253
A23: =R[-1]C+1 -> 23 | B23: =SUM(R1C[-1]:RC1) -> 276
A24: =R[-1]C+1 -> 24 | B24: =SUM(R1C[-1]:RC1) -> 300
A25: =R[-1]C+1 -> 25 | B25: =SUM(R1C[-1]:RC1) -> 325
A26: =R[-1]C+1 -> 26 | B26: =SUM(R1C[-1]:RC1) -> 351
A27: =R[-1]C+1 -> 27 | B27: =SUM(R1C[-1]:RC1) -> 378
A28: =R[-1]C+1 -> 28 | B28: =SUM(R1C[-1]:RC1) -> 406
A29: =R[-1]C+1 -> 29 | B29: =SUM(R1C[-1]:RC1) -> 435
A30: =R[-1]C+1 -> 30 | B30: =SUM(R1C[-1]:RC1) -> 465
A31: =R[-1]C+1 -> 31 | B31: =SUM(R1C[-1]:RC1) -> 496
A32: =R[-1]C+1 -> 32 | B32: =SUM(R1C[-1]:RC1) -> 528
A33: =R[-1]C+1 -> 33 | B33: =SUM(R1C[-1]:RC1) -> 561
A34: =R[-1]C+1 -> 34 | B34: =SUM(R1C[-1]:RC1) -> 595
A35: =R[-1]C+1 -> 35 | B35: =SUM(R1C[-1]:RC1) -> 630
A36: =R[-1]C+1 -> 36 | B36: =SUM(R1C[-1]:RC1) -> 666
A37: =R[-1]C+1 -> 37 | B37: =SUM(R1C[-1]:RC1) -> 703
A38: =R[-1]C+1 -> 38 | B38: =SUM(R1C[-1]:RC1) -> 741
A39: =R[-1]C+1 -> 39 | B39: =SUM(R1C[-1]:RC1) -> 780
A40: =R[-1]C+1 -> 40 | B40: =SUM(R1C[-1]:RC1) -> 820
A41: =R[-1]C+1 -> 41 | B41: =SUM(R1C[-1]:RC1) -> 861
A42: =R[-1]C+1 -> 42 | B42: =SUM(R1C[-1]:RC1) -> 903
A43: =R[-1]C+1 -> 43 | B43: =SUM(R1C[-1]:RC1) -> 946
A44: =R[-1]C+1 -> 44 | B44: =SUM(R1C[-1]:RC1) -> 990
A45: =R[-1]C+1 -> 45 | B45: =SUM(R1C[-1]:RC1) -> 1035
A46: =R[-1]C+1 -> 46 | B46: =SUM(R1C[-1]:RC1) -> 1081
A47: =R[-1]C+1 -> 47 | B47: =SUM(R1C[-1]:RC1) -> 1128
A48: =R[-1]C+1 -> 48 | B48: =SUM(R1C[-1]:RC1) -> 1176
A49: =R[-1]C+1 -> 49 | B49: =SUM(R1C[-1]:RC1) -> 1225
A50: =R[-1]C+1 -> 50 | B50: =SUM(R1C[-1]:RC1) -> 1275
A51: =R[-1]C+1 -> 51 | B51: =SUM(R1C[-1]:RC1) -> 1326
A52: =R[-1]C+1 -> 52 | B52: =SUM(R1C[-1]:RC1) -> 1378
A53: =R[-1]C+1 -> 53 | B53: =SUM(R1C[-1]:RC1) -> 1431
A54: =R[-1]C+1 -> 54 | B54: =SUM(R1C[-1]:RC1) -> 1485
A55: =R[-1]C+1 -> 55 | B55: =SUM(R1C[-1]:RC1) -> 1540
A56: =R[-1]C+1 -> 56 | B56: =SUM(R1C[-1]:RC1) -> 1596
A57: =R[-1]C+1 -> 57 | B57: =SUM(R1C[-1]:RC1) -> 1653
A58: =R[-1]C+1 -> 58 | B58: =SUM(R1C[-1]:RC1) -> 1711
A59: =R[-1]C+1 -> 59 | B59: =SUM(R1C[-1]:RC1) -> 1770
A60: =R[-1]C+1 -> 60 | B60: =SUM(R1C[-1]:RC1) -> 1830
A61: =R[-1]C+1 -> 61 | B61: =SUM(R1C[-1]:RC1) -> 1891
A62: =R[-1]C+1 -> 62 | B62: =SUM(R1C[-1]:RC1) -> 1953
A63: =R[-1]C+1 -> 63 | B63: =SUM(R1C[-1]:RC1) -> 2016
A64: =R[-1]C+1 -> 64 | B64: =SUM(R1C[-1]:RC1) -> 2080
A65: =R[-1]C+1 -> 65 | B65: =SUM(R1C[-1]:RC1) -> 2145
A66: =R[-1]C+1 -> 66 | B66: =SUM(R1C[-1]:RC1) -> 2211
A67: =R[-1]C+1 -> 67 | B67: =SUM(R1C[-1]:RC1) -> 2278
A68: =R[-1]C+1 -> 68 | B68: =SUM(R1C[-1]:RC1) -> 2346
A69: =R[-1]C+1 -> 69 | B69: =SUM(R1C[-1]:RC1) -> 2415
A70: =R[-1]C+1 -> 70 | B70: =SUM(R1C[-1]:RC1) -> 2485
A71: =R[-1]C+1 -> 71 | B71: =SUM(R1C[-1]:RC1) -> 2556
A72: =R[-1]C+1 -> 72 | B72: =SUM(R1C[-1]:RC1) -> 2628
A73: =R[-1]C+1 -> 73 | B73: =SUM(R1C[-1]:RC1) -> 2701
A74: =R[-1]C+1 -> 74 | B74: =SUM(R1C[-1]:RC1) -> 2775
A75: =R[-1]C+1 -> 75 | B75: =SUM(R1C[-1]:RC1) -> 2850
A76: =R[-1]C+1 -> 76 | B76: =SUM(R1C[-1]:RC1) -> 2926
A77: =R[-1]C+1 -> 77 | B77: =SUM(R1C[-1]:RC1) -> 3003
A78: =R[-1]C+1 -> 78 | B78: =SUM(R1C[-1]:RC1) -> 3081
A79: =R[-1]C+1 -> 79 | B79: =SUM(R1C[-1]:RC1) -> 3160
A80: =R[-1]C+1 -> 80 | B80: =SUM(R1C[-1]:RC1) -> 3240
A81: =R[-1]C+1 -> 81 | B81: =SUM(R1C[-1]:RC1) -> 3321
A82: =R[-1]C+1 -> 82 | B82: =SUM(R1C[-1]:RC1) -> 3403
A83: =R[-1]C+1 -> 83 | B83: =SUM(R1C[-1]:RC1) -> 3486
A84: =R[-1]C+1 -> 84 | B84: =SUM(R1C[-1]:RC1) -> 3570
A85: =R[-1]C+1 -> 85 | B85: =SUM(R1C[-1]:RC1) -> 3655
A86: =R[-1]C+1 -> 86 | B86: =SUM(R1C[-1]:RC1) -> 3741
A87: =R[-1]C+1 -> 87 | B87: =SUM(R1C[-1]:RC1) -> 3828
A88: =R[-1]C+1 -> 88 | B88: =SUM(R1C[-1]:RC1) -> 3916
A89: =R[-1]C+1 -> 89 | B89: =SUM(R1C[-1]:RC1) -> 4005
A90: =R[-1]C+1 -> 90 | B90: =SUM(R1C[-1]:RC1) -> 4095
A91: =R[-1]C+1 -> 91 | B91: =SUM(R1C[-1]:RC1) -> 4186
A92: =R[-1]C+1 -> 92 | B92: =SUM(R1C[-1]:RC1) -> 4278
A93: =R[-1]C+1 -> 93 | B93: =SUM(R1C[-1]:RC1) -> 4371
A94: =R[-1]C+1 -> 94 | B94: =SUM(R1C[-1]:RC1) -> 4465
A95: =R[-1]C+1 -> 95 | B95: =SUM(R1C[-1]:RC1) -> 4560
A96: =R[-1]C+1 -> 96 | B96: =SUM(R1C[-1]:RC1) -> 4656
A97: =R[-1]C+1 -> 97 | B97: =SUM(R1C[-1]:RC1) -> 4753
A98: =R[-1]C+1 -> 98 | B98: =SUM(R1C[-1]:RC1) -> 4851
A99: =R[-1]C+1 -> 99 | B99: =SUM(R1C[-1]:RC1) -> 4950
A100: =R[-1]C+1 -> 100 | B100: =SUM(R1C[-1]:RC1) -> 5050
A101: =R[-1]C+1 -> 101 | B101: =SUM(R1C[-1]:RC1) -> 5151
A102: =R[-1]C+1 -> 102 | B102: =SUM(R1C[-1]:RC1) -> 5253
A103: =R[-1]C+1 -> 103 | B103: =SUM(R1C[-1]:RC1) -> 5356
A104: =R[-1]C+1 -> 104 | B104: =SUM(R1C[-1]:RC1) -> 5460
A105: =R[-1]C+1 -> 105 | B105: =SUM(R1C[-1]:RC1) -> 5565
A106: =R[-1]C+1 -> 106 | B106: =SUM(R1C[-1]:RC1) -> 5671
A107: =R[-1]C+1 -> 107 | B107: =SUM(R1C[-1]:RC1) -> 5778
A108: =R[-1]C+1 -> 108 | B108: =SUM(R1C[-1]:RC1) -> 5886
A109: =R[-1]C+1 -> 109 | B109: =SUM(R1C[-1]:RC1) -> 5995
A110: =R[-1]C+1 -> 110 | B110: =SUM(R1C[-1]:RC1) -> 6105
A111: =R[-1]C+1 -> 111 | B111: =SUM(R1C[-1]:RC1) -> 6216
A112: =R[-1]C+1 -> 112 | B112: =SUM(R1C[-1]:RC1) -> 6328
A113: =R[-1]C+1 -> 113 | B113: =SUM(R1C[-1]:RC1) -> 6441
A114: =R[-1]C+1 -> 114 | B114: =SUM(R1C[-1]:RC1) -> 6555
A115: =R[-1]C+1 -> 115 | B115: =SUM(R1C[-1]:RC1) -> 6670
A116: =R[-1]C+1 -> 116 | B116: =SUM(R1C[-1]:RC1) -> 6786
A117: =R[-1]C+1 -> 117 | B117: =SUM(R1C[-1]:RC1) -> 6903
A118: =R[-1]C+1 -> 118 | B118: =SUM(R1C[-1]:RC1) -> 7021
A119: =R[-1]C+1 -> 119 | B119: =SUM(R1C[-1]:RC1) -> 7140
A120: =R[-1]C+1 -> 120 | B120: =SUM(R1C[-1]:RC1) -> 7260
A121: =R[-1]C+1 -> 121 | B121: =SUM(R1C[-1]:RC1) -> 7381
A122: =R[-1]C+1 -> 122 | B122: =SUM(R1C[-1]:RC1) -> 7503
A123: =R[-1]C+1 -> 123 | B123: =SUM(R1C[-1]:RC1) -> 7626
A124: =R[-1]C+1 -> 124 | B124: =SUM(R1C[-1]:RC1) -> 7750
A125: =R[-1]C+1 -> 125 | B125: =SUM(R1C[-1]:RC1) -> 7875
A126: =R[-1]C+1 -> 126 | B126: =SUM(R1C[-1]:RC1) -> 8001
A127: =R[-1]C+1 -> 127 | B127: =SUM(R1C[-1]:RC1) -> 8128
A128: =R[-1]C+1 -> 128 | B128: =SUM(R1C[-1]:RC1) -> 8256
A129: =R[-1]C+1 -> 129 | B129: =SUM(R1C[-1]:RC1) -> 8385
A130: =R[-1]C+1 -> 130 | B130: =SUM(R1C[-1]:RC1) -> 8515
A131: =R[-1]C+1 -> 131 | B131: =SUM(R1C[-1]:RC1) -> 8646
A132: =R[-1]C+1 -> 132 | B132: =SUM(R1C[-1]:RC1) -> 8778
A133: =R[-1]C+1 -> 133 | B133: =SUM(R1C[-1]:RC1) -> 8911
A134: =R[-1]C+1 -> 134 | B134: =SUM(R1C[-1]:RC1) -> 9045
A135: =R[-1]C+1 -> 135 | B135: =SUM(R1C[-1]:RC1) -> 9180
A136: =R[-1]C+1 -> 136 | B136: =SUM(R1C[-1]:RC1) -> 9316
A137: =R[-1]C+1 -> 137 | B137: =SUM(R1C[-1]:RC1) -> 9453
A138: =R[-1]C+1 -> 138 | B138: =SUM(R1C[-1]:RC1) -> 9591
A139: =R[-1]C+1 -> 139 | B139: =SUM(R1C[-1]:RC1) -> 9730
A140: =R[-1]C+1 -> 140 | B140: =SUM(R1C[-1]:RC1) -> 9870
A141: =R[-1]C+1 -> 141 | B141: =SUM(R1C[-1]:RC1) -> 10011
A142: =R[-1]C+1 -> 142 | B142: =SUM(R1C[-1]:RC1) -> 10153
A143: =R[-1]C+1 -> 143 | B143: =SUM(R1C[-1]:RC1) -> 10296
A144: =R[-1]C+1 -> 144 | B144: =SUM(R1C[-1]:RC1) -> 10440
A145: =R[-1]C+1 -> 145 | B145: =SUM(R1C[-1]:RC1) -> 10585
A146: =R[-1]C+1 -> 146 | B146: =SUM(R1C[-1]:RC1) -> 10731
A147: =R[-1]C+1 -> 147 | B147: =SUM(R1C[-1]:RC1) -> 10878
A148: =R[-1]C+1 -> 148 | B148: =SUM(R1C[-1]:RC1) -> 11026
A149: =R[-1]C+1 -> 149 | B149: =SUM(R1C[-1]:RC1) -> 11175
A150: =R[-1]C+1 -> 150 | B150: =SUM(R1C[-1]:RC1) -> 11325
A151: =R[-1]C+1 -> 151 | B151: =SUM(R1C[-1]:RC1) -> 11476
A152: =R[-1]C+1 -> 152 | B152: =SUM(R1C[-1]:RC1) -> 11628
A153: =R[-1]C+1 -> 153 | B153: =SUM(R1C[-1]:RC1) -> 11781
A154: =R[-1]C+1 -> 154 | B154: =SUM(R1C[-1]:RC1) -> 11935
A155: =R[-1]C+1 -> 155 | B155: =SUM(R1C[-1]:RC1) -> 12090
A156: =R[-1]C+1 -> 156 | B156: =SUM(R1C[-1]:RC1) -> 12246
A157: =R[-1]C+1 -> 157 | B157: =SUM(R1C[-1]:RC1) -> 12403
A158: =R[-1]C+1 -> 158 | B158: =SUM(R1C[-1]:RC1) -> 12561
A159: =R[-1]C+1 -> 159 | B159: =SUM(R1C[-1]:RC1) -> 12720
A160: =R[-1]C+1 -> 160 | B160: =SUM(R1C[-1]:RC1) -> 12880
A161: =R[-1]C+1 -> 161 | B161: =SUM(R1C[-1]:RC1) -> 13041
A162: =R[-1]C+1 -> 162 | B162: =SUM(R1C[-1]:RC1) -> 13203
A163: =R[-1]C+1 -> 163 | B163: =SUM(R1C[-1]:RC1) -> 13366
A164: =R[-1]C+1 -> 164 | B164: =SUM(R1C[-1]:RC1) -> 13530
A165: =R[-1]C+1 -> 165 | B165: =SUM(R1C[-1]:RC1) -> 13695
A166: =R[-1]C+1 -> 166 | B166: =SUM(R1C[-1]:RC1) -> 13861
A167: =R[-1]C+1 -> 167 | B167: =SUM(R1C[-1]:RC1) -> 14028
A168: =R[-1]C+1 -> 168 | B168: =SUM(R1C[-1]:RC1) -> 14196
A169: =R[-1]C+1 -> 169 | B169: =SUM(R1C[-1]:RC1) -> 14365
A170: =R[-1]C+1 -> 170 | B170: =SUM(R1C[-1]:RC1) -> 14535
A171: =R[-1]C+1 -> 171 | B171: =SUM(R1C[-1]:RC1) -> 14706
A172: =R[-1]C+1 -> 172 | B172: =SUM(R1C[-1]:RC1) -> 14878
A173: =R[-1]C+1 -> 173 | B173: =SUM(R1C[-1]:RC1) -> 15051
A174: =R[-1]C+1 -> 174 | B174: =SUM(R1C[-1]:RC1) -> 15225
A175: =R[-1]C+1 -> 175 | B175: =SUM(R1C[-1]:RC1) -> 15400
A176: =R[-1]C+1 -> 176 | B176: =SUM(R1C[-1]:RC1) -> 15576
A177: =R[-1]C+1 -> 177 | B177: =SUM(R1C[-1]:RC1) -> 15753
A178: =R[-1]C+1 -> 178 | B178: =SUM(R1C[-1]:RC1) -> 15931
A179: =R[-1]C+1 -> 179 | B179: =SUM(R1C[-1]:RC1) -> 16110
A180: =R[-1]C+1 -> 180 | B180: =SUM(R1C[-1]:RC1) -> 16290
A181: =R[-1]C+1 -> 181 | B181: =SUM(R1C[-1]:RC1) -> 16471
A182: =R[-1]C+1 -> 182 | B182: =SUM(R1C[-1]:RC1) -> 16653
A183: =R[-1]C+1 -> 183 | B183: =SUM(R1C[-1]:RC1) -> 16836
A184: =R[-1]C+1 -> 184 | B184: =SUM(R1C[-1]:RC1) -> 17020
A185: =R[-1]C+1 -> 185 | B185: =SUM(R1C[-1]:RC1) -> 17205
A186: =R[-1]C+1 -> 186 | B186: =SUM(R1C[-1]:RC1) -> 17391
A187: =R[-1]C+1 -> 187 | B187: =SUM(R1C[-1]:RC1) -> 17578
A188: =R[-1]C+1 -> 188 | B188: =SUM(R1C[-1]:RC1) -> 17766
A189: =R[-1]C+1 -> 189 | B189: =SUM(R1C[-1]:RC1) -> 17955
A190: =R[-1]C+1 -> 190 | B190: =SUM(R1C[-1]:RC1) -> 18145
A191: =R[-1]C+1 -> 191 | B191: =SUM(R1C[-1]:RC1) -> 18336
A192: =R[-1]C+1 -> 192 | B192: =SUM(R1C[-1]:RC1) -> 18528
A193: =R[-1]C+1 -> 193 | B193: =SUM(R1C[-1]:RC1) -> 18721
A194: =R[-1]C+1 -> 194 | B194: =SUM(R1C[-1]:RC1) -> 18915
A195: =R[-1]C+1 -> 195 | B195: =SUM(R1C[-1]:RC1) -> 19110
A196: =R[-1]C+1 -> 196 | B196: =SUM(R1C[-1]:RC1) -> 19306
A197: =R[-1]C+1 -> 197 | B197: =SUM(R1C[-1]:RC1) -> 19503
A198: =R[-1]C+1 -> 198 | B198: =SUM(R1C[-1]:RC1) -> 19701
A199: =R[-1]C+1 -> 199 | B199: =SUM(R1C[-1]:RC1) -> 19900
A200: =R[-1]C+1 -> 200 | B200: =SUM(R1C[-1]:RC1) -> 20100
A201: =R[-1]C+1 -> 201 | B201: =SUM(R1C[-1]:RC1) -> 20301
A202: =R[-1]C+1 -> 202 | B202: =SUM(R1C[-1]:RC1) -> 20503
A203: =R[-1]C+1 -> 203 | B203: =SUM(R1C[-1]:RC1) -> 20706
A204: =R[-1]C+1 -> 204 | B204: =SUM(R1C[-1]:RC1) -> 20910
A205: =R[-1]C+1 -> 205 | B205: =SUM(R1C[-1]:RC1) -> 21115
A206: =R[-1]C+1 -> 206 | B206: =SUM(R1C[-1]:RC1) -> 21321
A207: =R[-1]C+1 -> 207 | B207: =SUM(R1C[-1]:RC1) -> 21528
A208: =R[-1]C+1 -> 208 | B208: =SUM(R1C[-1]:RC1) -> 21736
A209: =R[-1]C+1 -> 209 | B209: =SUM(R1C[-1]:RC1) -> 21945
A210: =R[-1]C+1 -> 210 | B210: =SUM(R1C[-1]:RC1) -> 22155
A211: =R[-1]C+1 -> 211 | B211: =SUM(R1C[-1]:RC1) -> 22366
A212: =R[-1]C+1 -> 212 | B212: =SUM(R1C[-1]:RC1) -> 22578
A213: =R[-1]C+1 -> 213 | B213: =SUM(R1C[-1]:RC1) -> 22791
A214: =R[-1]C+1 -> 214 | B214: =SUM(R1C[-1]:RC1) -> 23005
A215: =R[-1]C+1 -> 215 | B215: =SUM(R1C[-1]:RC1) -> 23220
A216: =R[-1]C+1 -> 216 | B216: =SUM(R1C[-1]:RC1) -> 23436
A217: =R[-1]C+1 -> 217 | B217: =SUM(R1C[-1]:RC1) -> 23653
A218: =R[-1]C+1 -> 218 | B218: =SUM(R1C[-1]:RC1) -> 23871
A219: =R[-1]C+1 -> 219 | B219: =SUM(R1C[-1]:RC1) -> 24090
A220: =R[-1]C+1 -> 220 | B220: =SUM(R1C[-1]:RC1) -> 24310
A221: =R[-1]C+1 -> 221 | B221: =SUM(R1C[-1]:RC1) -> 24531
A222: =R[-1]C+1 -> 222 | B222: =SUM(R1C[-1]:RC1) -> 24753
A223: =R[-1]C+1 -> 223 | B223: =SUM(R1C[-1]:RC1) -> 24976
A224: =R[-1]C+1 -> 224 | B224: =SUM(R1C[-1]:RC1) -> 25200
A225: =R[-1]C+1 -> 225 | B225: =SUM(R1C[-1]:RC1) -> 25425
A226: =R[-1]C+1 -> 226 | B226: =SUM(R1C[-1]:RC1) -> 25651
A227: =R[-1]C+1 -> 227 | B227: =SUM(R1C[-1]:RC1) -> 25878
A228: =R[-1]C+1 -> 228 | B228: =SUM(R1C[-1]:RC1) -> 26106
A229: =R[-1]C+1 -> 229 | B229: =SUM(R1C[-1]:RC1) -> 26335
A230: =R[-1]C+1 -> 230 | B230: =SUM(R1C[-1]:RC1) -> 26565
A231: =R[-1]C+1 -> 231 | B231: =SUM(R1C[-1]:RC1) -> 26796
A232: =R[-1]C+1 -> 232 | B232: =SUM(R1C[-1]:RC1) -> 27028
A233: =R[-1]C+1 -> 233 | B233: =SUM(R1C[-1]:RC1) -> 27261
A234: =R[-1]C+1 -> 234 | B234: =SUM(R1C[-1]:RC1) -> 27495
A235: =R[-1]C+1 -> 235 | B235: =SUM(R1C[-1]:RC1) -> 27730
A236: =R[-1]C+1 -> 236 | B236: =SUM(R1C[-1]:RC1) -> 27966
A237: =R[-1]C+1 -> 237 | B237: =SUM(R1C[-1]:RC1) -> 28203
A238: =R[-1]C+1 -> 238 | B238: =SUM(R1C[-1]:RC1) -> 28441
A239: =R[-1]C+1 -> 239 | B239: =SUM(R1C[-1]:RC1) -> 28680
A240: =R[-1]C+1 -> 240 | B240: =SUM(R1C[-1]:RC1) -> 28920
A241: =R[-1]C+1 -> 241 | B241: =SUM(R1C[-1]:RC1) -> 29161
A242: =R[-1]C+1 -> 242 | B242: =SUM(R1C[-1]:RC1) -> 29403
A243: =R[-1]C+1 -> 243 | B243: =SUM(R1C[-1]:RC1) -> 29646
A244: =R[-1]C+1 -> 244 | B244: =SUM(R1C[-1]:RC1) -> 29890
A245: =R[-1]C+1 -> 245 | B245: =SUM(R1C[-1]:RC1) -> 30135
A246: =R[-1]C+1 -> 246 | B246: =SUM(R1C[-1]:RC1) -> 30381
A247: =R[-1]C+1 -> 247 | B247: =SUM(R1C[-1]:RC1) -> 30628
A248: =R[-1]C+1 -> 248 | B248: =SUM(R1C[-1]:RC1) -> 30876
A249: =R[-1]C+1 -> 249 | B249: =SUM(R1C[-1]:RC1) -> 31125
A250: =R[-1]C+1 -> 250 | B250: =SUM(R1C[-1]:RC1) -> 31375
A251: =R[-1]C+1 -> 251 | B251: =SUM(R1C[-1]:RC1) -> 31626
A252: =R[-1]C+1 -> 252 | B252: =SUM(R1C[-1]:RC1) -> 31878
A253: =R[-1]C+1 -> 253 | B253: =SUM(R1C[-1]:RC1) -> 32131
A254: =R[-1]C+1 -> 254 | B254: =SUM(R1C[-1]:RC1) -> 32385
A255: =R[-1]C+1 -> 255 | B255: =SUM(R1C[-1]:RC1) -> 32640
A256: =R[-1]C+1 -> 256 | B256: =SUM(R1C[-1]:RC1) -> 32896
A257: =R[-1]C+1 -> 257 | B257: =SUM(R1C[-1]:RC1) -> 33153
A258: =R[-1]C+1 -> 258 | B258: =SUM(R1C[-1]:RC1) -> 33411
A259: =R[-1]C+1 -> 259 | B259: =SUM(R1C[-1]:RC1) -> 33670
A260: =R[-1]C+1 -> 260 | B260: =SUM(R1C[-1]:RC1) -> 33930
A261: =R[-1]C+1 -> 261 | B261: =SUM(R1C[-1]:RC1) -> 34191
A262: =R[-1]C+1 -> 262 | B262: =SUM(R1C[-1]:RC1) -> 34453
A263: =R[-1]C+1 -> 263 | B263: =SUM(R1C[-1]:RC1) -> 34716
A264: =R[-1]C+1 -> 264 | B264: =SUM(R1C[-1]:RC1) -> 34980
A265: =R[-1]C+1 -> 265 | B265: =SUM(R1C[-1]:RC1) -> 35245
A266: =R[-1]C+1 -> 266 | B266: =SUM(R1C[-1]:RC1) -> 35511
A267: =R[-1]C+1 -> 267 | B267: =SUM(R1C[-1]:RC1) -> 35778
A268: =R[-1]C+1 -> 268 | B268: =SUM(R1C[-1]:RC1) -> 36046
A269: =R[-1]C+1 -> 269 | B269: =SUM(R1C[-1]:RC1) -> 36315
A270: =R[-1]C+1 -> 270 | B270: =SUM(R1C[-1]:RC1) -> 36585
A271: =R[-1]C+1 -> 271 | B271: =SUM(R1C[-1]:RC1) -> 36856
A272: =R[-1]C+1 -> 272 | B272: =SUM(R1C[-1]:RC1) -> 37128
A273: =R[-1]C+1 -> 273 | B273: =SUM(R1C[-1]:RC1) -> 37401
A274: =R[-1]C+1 -> 274 | B274: =SUM(R1C[-1]:RC1) -> 37675
A275: =R[-1]C+1 -> 275 | B275: =SUM(R1C[-1]:RC1) -> 37950
A276: =R[-1]C+1 -> 276 | B276: =SUM(R1C[-1]:RC1) -> 38226
A277: =R[-1]C+1 -> 277 | B277: =SUM(R1C[-1]:RC1) -> 38503
A278: =R[-1]C+1 -> 278 | B278: =SUM(R1C[-1]:RC1) -> 38781
A279: =R[-1]C+1 -> 279 | B279: =SUM(R1C[-1]:RC1) -> 39060
A280: =R[-1]C+1 -> 280 | B280: =SUM(R1C[-1]:RC1) -> 39340
A281: =R[-1]C+1 -> 281 | B281: =SUM(R1C[-1]:RC1) -> 39621
A282: =R[-1]C+1 -> 282 | B282: =SUM(R1C[-1]:RC1) -> 39903
A283: =R[-1]C+1 -> 283 | B283: =SUM(R1C[-1]:RC1) -> 40186
A284: =R[-1]C+1 -> 284 | B284: =SUM(R1C[-1]:RC1) -> 40470
A285: =R[-1]C+1 -> 285 | B285: =SUM(R1C[-1]:RC1) -> 40755
A286: =R[-1]C+1 -> 286 | B286: =SUM(R1C[-1]:RC1) -> 41041
A287: =R[-1]C+1 -> 287 | B287: =SUM(R1C[-1]:RC1) -> 41328
A288: =R[-1]C+1 -> 288 | B288: =SUM(R1C[-1]:RC1) -> 41616
A289: =R[-1]C+1 -> 289 | B289: =SUM(R1C[-1]:RC1) -> 41905
A290: =R[-1]C+1 -> 290 | B290: =SUM(R1C[-1]:RC1) -> 42195
A291: =R[-1]C+1 -> 291 | B291: =SUM(R1C[-1]:RC1) -> 42486
A292: =R[-1]C+1 -> 292 | B292: =SUM(R1C[-1]:RC1) -> 42778
A293: =R[-1]C+1 -> 293 | B293: =SUM(R1C[-1]:RC1) -> 43071
A294: =R[-1]C+1 -> 294 | B294: =SUM(R1C[-1]:RC1) -> 43365
A295: =R[-1]C+1 -> 295 | B295: =SUM(R1C[-1]:RC1) -> 43660
A296: =R[-1]C+1 -> 296 | B296: =SUM(R1C[-1]:RC1) -> 43956
A297: =R[-1]C+1 -> 297 | B297: =SUM(R1C[-1]:RC1) -> 44253
A298: =R[-1]C+1 -> 298 | B298: =SUM(R1C[-1]:RC1) -> 44551
A299: =R[-1]C+1 -> 299 | B299: =SUM(R1C[-1]:RC1) -> 44850
A300: =R[-1]C+1 -> 300 | B300: =SUM(R1C[-1]:RC1) -> 45150
A301: =R[-1]C+1 -> 301 | B301: =SUM(R1C[-1]:RC1) -> 45451
A302: =R[-1]C+1 -> 302 | B302: =SUM(R1C[-1]:RC1) -> 45753
A303: =R[-1]C+1 -> 303 | B303: =SUM(R1C[-1]:RC1) -> 46056
A304: =R[-1]C+1 -> 304 | B304: =SUM(R1C[-1]:RC1) -> 46360
A305: =R[-1]C+1 -> 305 | B305: =SUM(R1C[-1]:RC1) -> 46665
A306: =R[-1]C+1 -> 306 | B306: =SUM(R1C[-1]:RC1) -> 46971
A307: =R[-1]C+1 -> 307 | B307: =SUM(R1C[-1]:RC1) -> 47278
A308: =R[-1]C+1 -> 308 | B308: =SUM(R1C[-1]:RC1) -> 47586
A309: =R[-1]C+1 -> 309 | B309: =SUM(R1C[-1]:RC1) -> 47895
A310: =R[-1]C+1 -> 310 | B310: =SUM(R1C[-1]:RC1) -> 48205
A311: =R[-1]C+1 -> 311 | B311: =SUM(R1C[-1]:RC1) -> 48516
A312: =R[-1]C+1 -> 312 | B312: =SUM(R1C[-1]:RC1) -> 48828
A313: =R[-1]C+1 -> 313 | B313: =SUM(R1C[-1]:RC1) -> 49141
A314: =R[-1]C+1 -> 314 | B314: =SUM(R1C[-1]:RC1) -> 49455
A315: =R[-1]C+1 -> 315 | B315: =SUM(R1C[-1]:RC1) -> 49770
A316: =R[-1]C+1 -> 316 | B316: =SUM(R1C[-1]:RC1) -> 50086
A317: =R[-1]C+1 -> 317 | B317: =SUM(R1C[-1]:RC1) -> 50403
A318: =R[-1]C+1 -> 318 | B318: =SUM(R1C[-1]:RC1) -> 50721
A319: =R[-1]C+1 -> 319 | B319: =SUM(R1C[-1]:RC1) -> 51040
A320: =R[-1]C+1 -> 320 | B320: =SUM(R1C[-1]:RC1) -> 51360
A321: =R[-1]C+1 -> 321 | B321: =SUM(R1C[-1]:RC1) -> 51681
A322: =R[-1]C+1 -> 322 | B322: =SUM(R1C[-1]:RC1) -> 52003
A323: =R[-1]C+1 -> 323 | B323: =SUM(R1C[-1]:RC1) -> 52326
A324: =R[-1]C+1 -> 324 | B324: =SUM(R1C[-1]:RC1) -> 52650
A325: =R[-1]C+1 -> 325 | B325: =SUM(R1C[-1]:RC1) -> 52975
A326: =R[-1]C+1 -> 326 | B326: =SUM(R1C[-1]:RC1) -> 53301
A327: =R[-1]C+1 -> 327 | B327: =SUM(R1C[-1]:RC1) -> 53628
A328: =R[-1]C+1 -> 328 | B328: =SUM(R1C[-1]:RC1) -> 53956
A329: =R[-1]C+1 -> 329 | B329: =SUM(R1C[-1]:RC1) -> 54285
A330: =R[-1]C+1 -> 330 | B330: =SUM(R1C[-1]:RC1) -> 54615
A331: =R[-1]C+1 -> 331 | B331: =SUM(R1C[-1]:RC1) -> 54946
A332: =R[-1]C+1 -> 332 | B332: =SUM(R1C[-1]:RC1) -> 55278
A333: =R[-1]C+1 -> 333 | B333: =SUM(R1C[-1]:RC1) -> 55611
A334: =R[-1]C+1 -> 334 | B334: =SUM(R1C[-1]:RC1) -> 55945
A335: =R[-1]C+1 -> 335 | B335: =SUM(R1C[-1]:RC1) -> 56280
A336: =R[-1]C+1 -> 336 | B336: =SUM(R1C[-1]:RC1) -> 56616
A337: =R[-1]C+1 -> 337 | B337: =SUM(R1C[-1]:RC1) -> 56953
A338: =R[-1]C+1 -> 338 | B338: =SUM(R1C[-1]:RC1) -> 57291
A339: =R[-1]C+1 -> 339 | B339: =SUM(R1C[-1]:RC1) -> 57630
A340: =R[-1]C+1 -> 340 | B340: =SUM(R1C[-1]:RC1) -> 57970
A341: =R[-1]C+1 -> 341 | B341: =SUM(R1C[-1]:RC1) -> 58311
A342: =R[-1]C+1 -> 342 | B342: =SUM(R1C[-1]:RC1) -> 58653
A343: =R[-1]C+1 -> 343 | B343: =SUM(R1C[-1]:RC1) -> 58996
A344: =R[-1]C+1 -> 344 | B344: =SUM(R1C[-1]:RC1) -> 59340
A345: =R[-1]C+1 -> 345 | B345: =SUM(R1C[-1]:RC1) -> 59685
A346: =R[-1]C+1 -> 346 | B346: =SUM(R1C[-1]:RC1) -> 60031
A347: =R[-1]C+1 -> 347 | B347: =SUM(R1C[-1]:RC1) -> 60378
A348: =R[-1]C+1 -> 348 | B348: =SUM(R1C[-1]:RC1) -> 60726
A349: =R[-1]C+1 -> 349 | B349: =SUM(R1C[-1]:RC1) -> 61075
A350: =R[-1]C+1 -> 350 | B350: =SUM(R1C[-1]:RC1) -> 61425
A351: =R[-1]C+1 -> 351 | B351: =SUM(R1C[-1]:RC1) -> 61776
A352: =R[-1]C+1 -> 352 | B352: =SUM(R1C[-1]:RC1) -> 62128
A353: =R[-1]C+1 -> 353 | B353: =SUM(R1C[-1]:RC1) -> 62481
A354: =R[-1]C+1 -> 354 | B354: =SUM(R1C[-1]:RC1) -> 62835
A355: =R[-1]C+1 -> 355 | B355: =SUM(R1C[-1]:RC1) -> 63190
A356: =R[-1]C+1 -> 356 | B356: =SUM(R1C[-1]:RC1) -> 63546
A357: =R[-1]C+1 -> 357 | B357: =SUM(R1C[-1]:RC1) -> 63903
A358: =R[-1]C+1 -> 358 | B358: =SUM(R1C[-1]:RC1) -> 64261
A359: =R[-1]C+1 -> 359 | B359: =SUM(R1C[-1]:RC1) -> 64620
A360: =R[-1]C+1 -> 360 | B360: =SUM(R1C[-1]:RC1) -> 64980
A361: =R[-1]C+1 -> 361 | B361: =SUM(R1C[-1]:RC1) -> 65341
A362: =R[-1]C+1 -> 362 | B362: =SUM(R1C[-1]:RC1) -> 65703
A363: =R[-1]C+1 -> 363 | B363: =SUM(R1C[-1]:RC1) -> 66066
A364: =R[-1]C+1 -> 364 | B364: =SUM(R1C[-1]:RC1) -> 66430
A365: =R[-1]C+1 -> 365 | B365: =SUM(R1C[-1]:RC1) -> 66795
A366: =R[-1]C+1 -> 366 | B366: =SUM(R1C[-1]:RC1) -> 67161
A367: =R[-1]C+1 -> 367 | B367: =SUM(R1C[-1]:RC1) -> 67528
A368: =R[-1]C+1 -> 368 | B368: =SUM(R1C[-1]:RC1) -> 67896
A369: =R[-1]C+1 -> 369 | B369: =SUM(R1C[-1]:RC1) -> 68265
A370: =R[-1]C+1 -> 370 | B370: =SUM(R1C[-1]:RC1) -> 68635
A371: =R[-1]C+1 -> 371 | B371: =SUM(R1C[-1]:RC1) -> 69006
A372: =R[-1]C+1 -> 372 | B372: =SUM(R1C[-1]:RC1) -> 69378
A373: =R[-1]C+1 -> 373 | B373: =SUM(R1C[-1]:RC1) -> 69751
A374: =R[-1]C+1 -> 374 | B374: =SUM(R1C[-1]:RC1) -> 70125
A375: =R[-1]C+1 -> 375 | B375: =SUM(R1C[-1]:RC1) -> 70500
A376: =R[-1]C+1 -> 376 | B376: =SUM(R1C[-1]:RC1) -> 70876
A377: =R[-1]C+1 -> 377 | B377: =SUM(R1C[-1]:RC1) -> 71253
A378: =R[-1]C+1 -> 378 | B378: =SUM(R1C[-1]:RC1) -> 71631
A379: =R[-1]C+1 -> 379 | B379: =SUM(R1C[-1]:RC1) -> 72010
A380: =R[-1]C+1 -> 380 | B380: =SUM(R1C[-1]:RC1) -> 72390
A381: =R[-1]C+1 -> 381 | B381: =SUM(R1C[-1]:RC1) -> 72771
A382: =R[-1]C+1 -> 382 | B382: =SUM(R1C[-1]:RC1) -> 73153
A383: =R[-1]C+1 -> 383 | B383: =SUM(R1C[-1]:RC1) -> 73536
A384: =R[-1]C+1 -> 384 | B384: =SUM(R1C[-1]:RC1) -> 73920
A385: =R[-1]C+1 -> 385 | B385: =SUM(R1C[-1]:RC1) -> 74305
A386: =R[-1]C+1 -> 386 | B386: =SUM(R1C[-1]:RC1) -> 74691
A387: =R[-1]C+1 -> 387 | B387: =SUM(R1C[-1]:RC1) -> 75078
A388: =R[-1]C+1 -> 388 | B388: =SUM(R1C[-1]:RC1) -> 75466
A389: =R[-1]C+1 -> 389 | B389: =SUM(R1C[-1]:RC1) -> 75855
A390: =R[-1]C+1 -> 390 | B390: =SUM(R1C[-1]:RC1) -> 76245
A391: =R[-1]C+1 -> 391 | B391: =SUM(R1C[-1]:RC1) -> 76636
A392: =R[-1]C+1 -> 392 | B392: =SUM(R1C[-1]:RC1) -> 77028
A393: =R[-1]C+1 -> 393 | B393: =SUM(R1C[-1]:RC1) -> 77421
A394: =R[-1]C+1 -> 394 | B394: =SUM(R1C[-1]:RC1) -> 77815
A395: =R[-1]C+1 -> 395 | B395: =SUM(R1C[-1]:RC1) -> 78210
A396: =R[-1]C+1 -> 396 | B396: =SUM(R1C[-1]:RC1) -> 78606
A397: =R[-1]C+1 -> 397 | B397: =SUM(R1C[-1]:RC1) -> 79003
A398: =R[-1]C+1 -> 398 | B398: =SUM(R1C[-1]:RC1) -> 79401
A399: =R[-1]C+1 -> 399 | B399: =SUM(R1C[-1]:RC1) -> 79800
A400: =R[-1]C+1 -> 400 | B400: =SUM(R1C[-1]:RC1) -> 80200
A401: =R[-1]C+1 -> 401 | B401: =SUM(R1C[-1]:RC1) -> 80601
A402: =R[-1]C+1 -> 402 | B402: =SUM(R1C[-1]:RC1) -> 81003
A403: =R[-1]C+1 -> 403 | B403: =SUM(R1C[-1]:RC1) -> 81406
A404: =R[-1]C+1 -> 404 | B404: =SUM(R1C[-1]:RC1) -> 81810
A405: =R[-1]C+1 -> 405 | B405: =SUM(R1C[-1]:RC1) -> 82215
A406: =R[-1]C+1 -> 406 | B406: =SUM(R1C[-1]:RC1) -> 82621
A407: =R[-1]C+1 -> 407 | B407: =SUM(R1C[-1]:RC1) -> 83028
A408: =R[-1]C+1 -> 408 | B408: =SUM(R1C[-1]:RC1) -> 83436
A409: =R[-1]C+1 -> 409 | B409: =SUM(R1C[-1]:RC1) -> 83845
A410: =R[-1]C+1 -> 410 | B410: =SUM(R1C[-1]:RC1) -> 84255
A411: =R[-1]C+1 -> 411 | B411: =SUM(R1C[-1]:RC1) -> 84666
A412: =R[-1]C+1 -> 412 | B412: =SUM(R1C[-1]:RC1) -> 85078
A413: =R[-1]C+1 -> 413 | B413: =SUM(R1C[-1]:RC1) -> 85491
A414: =R[-1]C+1 -> 414 | B414: =SUM(R1C[-1]:RC1) -> 85905
A415: =R[-1]C+1 -> 415 | B415: =SUM(R1C[-1]:RC1) -> 86320
A416: =R[-1]C+1 -> 416 | B416: =SUM(R1C[-1]:RC1) -> 86736
A417: =R[-1]C+1 -> 417 | B417: =SUM(R1C[-1]:RC1) -> 87153
A418: =R[-1]C+1 -> 418 | B418: =SUM(R1C[-1]:RC1) -> 87571
A419: =R[-1]C+1 -> 419 | B419: =SUM(R1C[-1]:RC1) -> 87990
A420: =R[-1]C+1 -> 420 | B420: =SUM(R1C[-1]:RC1) -> 88410
A421: =R[-1]C+1 -> 421 | B421: =SUM(R1C[-1]:RC1) -> 88831
A422: =R[-1]C+1 -> 422 | B422: =SUM(R1C[-1]:RC1) -> 89253
A423: =R[-1]C+1 -> 423 | B423: =SUM(R1C[-1]:RC1) -> 89676
A424: =R[-1]C+1 -> 424 | B424: =SUM(R1C[-1]:RC1) -> 90100
A425: =R[-1]C+1 -> 425 | B425: =SUM(R1C[-1]:RC1) -> 90525
A426: =R[-1]C+1 -> 426 | B426: =SUM(R1C[-1]:RC1) -> 90951
A427: =R[-1]C+1 -> 427 | B427: =SUM(R1C[-1]:RC1) -> 91378
A428: =R[-1]C+1 -> 428 | B428: =SUM(R1C[-1]:RC1) -> 91806
A429: =R[-1]C+1 -> 429 | B429: =SUM(R1C[-1]:RC1) -> 92235
A430: =R[-1]C+1 -> 430 | B430: =SUM(R1C[-1]:RC1) -> 92665
A431: =R[-1]C+1 -> 431 | B431: =SUM(R1C[-1]:RC1) -> 93096
A432: =R[-1]C+1 -> 432 | B432: =SUM(R1C[-1]:RC1) -> 93528
A433: =R[-1]C+1 -> 433 | B433: =SUM(R1C[-1]:RC1) -> 93961
A434: =R[-1]C+1 -> 434 | B434: =SUM(R1C[-1]:RC1) -> 94395
A435: =R[-1]C+1 -> 435 | B435: =SUM(R1C[-1]:RC1) -> 94830
A436: =R[-1]C+1 -> 436 | B436: =SUM(R1C[-1]:RC1) -> 95266
A437: =R[-1]C+1 -> 437 | B437: =SUM(R1C[-1]:RC1) -> 95703
A438: =R[-1]C+1 -> 438 | B438: =SUM(R1C[-1]:RC1) -> 96141
A439: =R[-1]C+1 -> 439 | B439: =SUM(R1C[-1]:RC1) -> 96580
A440: =R[-1]C+1 -> 440 | B440: =SUM(R1C[-1]:RC1) -> 97020
A441: =R[-1]C+1 -> 441 | B441: =SUM(R1C[-1]:RC1) -> 97461
A442: =R[-1]C+1 -> 442 | B442: =SUM(R1C[-1]:RC1) -> 97903
A443: =R[-1]C+1 -> 443 | B443: =SUM(R1C[-1]:RC1) -> 98346
A444: =R[-1]C+1 -> 444 | B444: =SUM(R1C[-1]:RC1) -> 98790
A445: =R[-1]C+1 -> 445 | B445: =SUM(R1C[-1]:RC1) -> 99235
A446: =R[-1]C+1 -> 446 | B446: =SUM(R1C[-1]:RC1) -> 99681
A447: =R[-1]C+1 -> 447 | B447: =SUM(R1C[-1]:RC1) -> 100128
A448: =R[-1]C+1 -> 448 | B448: =SUM(R1C[-1]:RC1) -> 100576
A449: =R[-1]C+1 -> 449 | B449: =SUM(R1C[-1]:RC1) -> 101025
A450: =R[-1]C+1 -> 450 | B450: =SUM(R1C[-1]:RC1) -> 101475
A451: =R[-1]C+1 -> 451 | B451: =SUM(R1C[-1]:RC1) -> 101926
A452: =R[-1]C+1 -> 452 | B452: =SUM(R1C[-1]:RC1) -> 102378
A453: =R[-1]C+1 -> 453 | B453: =SUM(R1C[-1]:RC1) -> 102831
A454: =R[-1]C+1 -> 454 | B454: =SUM(R1C[-1]:RC1) -> 103285
A455: =R[-1]C+1 -> 455 | B455: =SUM(R1C[-1]:RC1) -> 103740
A456: =R[-1]C+1 -> 456 | B456: =SUM(R1C[-1]:RC1) -> 104196
A457: =R[-1]C+1 -> 457 | B457: =SUM(R1C[-1]:RC1) -> 104653
A458: =R[-1]C+1 -> 458 | B458: =SUM(R1C[-1]:RC1) -> 105111
A459: =R[-1]C+1 -> 459 | B459: =SUM(R1C[-1]:RC1) -> 105570
A460: =R[-1]C+1 -> 460 | B460: =SUM(R1C[-1]:RC1) -> 106030
A461: =R[-1]C+1 -> 461 | B461: =SUM(R1C[-1]:RC1) -> 106491
A462: =R[-1]C+1 -> 462 | B462: =SUM(R1C[-1]:RC1) -> 106953
A463: =R[-1]C+1 -> 463 | B463: =SUM(R1C[-1]:RC1) -> 107416
A464: =R[-1]C+1 -> 464 | B464: =SUM(R1C[-1]:RC1) -> 107880
A465: =R[-1]C+1 -> 465 | B465: =SUM(R1C[-1]:RC1) -> 108345
A466: =R[-1]C+1 -> 466 | B466: =SUM(R1C[-1]:RC1) -> 108811
A467: =R[-1]C+1 -> 467 | B467: =SUM(R1C[-1]:RC1) -> 109278
A468: =R[-1]C+1 -> 468 | B468: =SUM(R1C[-1]:RC1) -> 109746
A469: =R[-1]C+1 -> 469 | B469: =SUM(R1C[-1]:RC1) -> 110215
A470: =R[-1]C+1 -> 470 | B470: =SUM(R1C[-1]:RC1) -> 110685
A471: =R[-1]C+1 -> 471 | B471: =SUM(R1C[-1]:RC1) -> 111156
A472: =R[-1]C+1 -> 472 | B472: =SUM(R1C[-1]:RC1) -> 111628
A473: =R[-1]C+1 -> 473 | B473: =SUM(R1C[-1]:RC1) -> 112101
A474: =R[-1]C+1 -> 474 | B474: =SUM(R1C[-1]:RC1) -> 112575
A475: =R[-1]C+1 -> 475 | B475: =SUM(R1C[-1]:RC1) -> 113050
A476: =R[-1]C+1 -> 476 | B476: =SUM(R1C[-1]:RC1) -> 113526
A477: =R[-1]C+1 -> 477 | B477: =SUM(R1C[-1]:RC1) -> 114003
A478: =R[-1]C+1 -> 478 | B478: =SUM(R1C[-1]:RC1) -> 114481
A479: =R[-1]C+1 -> 479 | B479: =SUM(R1C[-1]:RC1) -> 114960
A480: =R[-1]C+1 -> 480 | B480: =SUM(R1C[-1]:RC1) -> 115440
A481: =R[-1]C+1 -> 481 | B481: =SUM(R1C[-1]:RC1) -> 115921
A482: =R[-1]C+1 -> 482 | B482: =SUM(R1C[-1]:RC1) -> 116403
A483: =R[-1]C+1 -> 483 | B483: =SUM(R1C[-1]:RC1) -> 116886
A484: =R[-1]C+1 -> 484 | B484: =SUM(R1C[-1]:RC1) -> 117370
A485: =R[-1]C+1 -> 485 | B485: =SUM(R1C[-1]:RC1) -> 117855
A486: =R[-1]C+1 -> 486 | B486: =SUM(R1C[-1]:RC1) -> 118341
A487: =R[-1]C+1 -> 487 | B487: =SUM(R1C[-1]:RC1) -> 118828
A488: =R[-1]C+1 -> 488 | B488: =SUM(R1C[-1]:RC1) -> 119316
A489: =R[-1]C+1 -> 489 | B489: =SUM(R1C[-1]:RC1) -> 119805
A490: =R[-1]C+1 -> 490 | B490: =SUM(R1C[-1]:RC1) -> 120295
A491: =R[-1]C+1 -> 491 | B491: =SUM(R1C[-1]:RC1) -> 120786
A492: =R[-1]C+1 -> 492 | B492: =SUM(R1C[-1]:RC1) -> 121278
A493: =R[-1]C+1 -> 493 | B493: =SUM(R1C[-1]:RC1) -> 121771
A494: =R[-1]C+1 -> 494 | B494: =SUM(R1C[-1]:RC1) -> 122265
A495: =R[-1]C+1 -> 495 | B495: =SUM(R1C[-1]:RC1) -> 122760
A496: =R[-1]C+1 -> 496 | B496: =SUM(R1C[-1]:RC1) -> 123256
A497: =R[-1]C+1 -> 497 | B497: =SUM(R1C[-1]:RC1) -> 123753
A498: =R[-1]C+1 -> 498 | B498: =SUM(R1C[-1]:RC1) -> 124251
A499: =R[-1]C+1 -> 499 | B499: =SUM(R1C[-1]:RC1) -> 124750
A500: =R[-1]C+1 -> 500 | B500: =SUM(R1C[-1]:RC1) -> 125250
A501: =R[-1]C+1 -> 501 | B501: =SUM(R1C[-1]:RC1) -> 125751
A502: =R[-1]C+1 -> 502 | B502: =SUM(R1C[-1]:RC1) -> 126253
A503: =R[-1]C+1 -> 503 | B503: =SUM(R1C[-1]:RC1) -> 126756
A504: =R[-1]C+1 -> 504 | B504: =SUM(R1C[-1]:RC1) -> 127260
A505: =R[-1]C+1 -> 505 | B505: =SUM(R1C[-1]:RC1) -> 127765
A506: =R[-1]C+1 -> 506 | B506: =SUM(R1C[-1]:RC1) -> 128271
A507: =R[-1]C+1 -> 507 | B507: =SUM(R1C[-1]:RC1) -> 128778
A508: =R[-1]C+1 -> 508 | B508: =SUM(R1C[-1]:RC1) -> 129286
A509: =R[-1]C+1 -> 509 | B509: =SUM(R1C[-1]:RC1) -> 129795
A510: =R[-1]C+1 -> 510 | B510: =SUM(R1C[-1]:RC1) -> 130305
A511: =R[-1]C+1 -> 511 | B511: =SUM(R1C[-1]:RC1) -> 130816
A512: =R[-1]C+1 -> 512 | B512: =SUM(R1C[-1]:RC1) -> 131328
A513: =R[-1]C+1 -> 513 | B513: =SUM(R1C[-1]:RC1) -> 131841
A514: =R[-1]C+1 -> 514 | B514: =SUM(R1C[-1]:RC1) -> 132355
A515: =R[-1]C+1 -> 515 | B515: =SUM(R1C[-1]:RC1) -> 132870
A516: =R[-1]C+1 -> 516 | B516: =SUM(R1C[-1]:RC1) -> 133386
A517: =R[-1]C+1 -> 517 | B517: =SUM(R1C[-1]:RC1) -> 133903
A518: =R[-1]C+1 -> 518 | B518: =SUM(R1C[-1]:RC1) -> 134421
A519: =R[-1]C+1 -> 519 | B519: =SUM(R1C[-1]:RC1) -> 134940
A520: =R[-1]C+1 -> 520 | B520: =SUM(R1C[-1]:RC1) -> 135460
A521: =R[-1]C+1 -> 521 | B521: =SUM(R1C[-1]:RC1) -> 135981
A522: =R[-1]C+1 -> 522 | B522: =SUM(R1C[-1]:RC1) -> 136503
A523: =R[-1]C+1 -> 523 | B523: =SUM(R1C[-1]:RC1) -> 137026
A524: =R[-1]C+1 -> 524 | B524: =SUM(R1C[-1]:RC1) -> 137550
A525: =R[-1]C+1 -> 525 | B525: =SUM(R1C[-1]:RC1) -> 138075
A526: =R[-1]C+1 -> 526 | B526: =SUM(R1C[-1]:RC1) -> 138601
A527: =R[-1]C+1 -> 527 | B527: =SUM(R1C[-1]:RC1) -> 139128
A528: =R[-1]C+1 -> 528 | B528: =SUM(R1C[-1]:RC1) -> 139656
A529: =R[-1]C+1 -> 529 | B529: =SUM(R1C[-1]:RC1) -> 140185
A530: =R[-1]C+1 -> 530 | B530: =SUM(R1C[-1]:RC1) -> 140715
A531: =R[-1]C+1 -> 531 | B531: =SUM(R1C[-1]:RC1) -> 141246
A532: =R[-1]C+1 -> 532 | B532: =SUM(R1C[-1]:RC1) -> 141778
A533: =R[-1]C+1 -> 533 | B533: =SUM(R1C[-1]:RC1) -> 142311
A534: =R[-1]C+1 -> 534 | B534: =SUM(R1C[-1]:RC1) -> 142845
A535: =R[-1]C+1 -> 535 | B535: =SUM(R1C[-1]:RC1) -> 143380
A536: =R[-1]C+1 -> 536 | B536: =SUM(R1C[-1]:RC1) -> 143916
A537: =R[-1]C+1 -> 537 | B537: =SUM(R1C[-1]:RC1) -> 144453
A538: =R[-1]C+1 -> 538 | B538: =SUM(R1C[-1]:RC1) -> 144991
A539: =R[-1]C+1 -> 539 | B539: =SUM(R1C[-1]:RC1) -> 145530
A540: =R[-1]C+1 -> 540 | B540: =SUM(R1C[-1]:RC1) -> 146070
A541: =R[-1]C+1 -> 541 | B541: =SUM(R1C[-1]:RC1) -> 146611
A542: =R[-1]C+1 -> 542 | B542: =SUM(R1C[-1]:RC1) -> 147153
A543: =R[-1]C+1 -> 543 | B543: =SUM(R1C[-1]:RC1) -> 147696
A544: =R[-1]C+1 -> 544 | B544: =SUM(R1C[-1]:RC1) -> 148240
A545: =R[-1]C+1 -> 545 | B545: =SUM(R1C[-1]:RC1) -> 148785
A546: =R[-1]C+1 -> 546 | B546: =SUM(R1C[-1]:RC1) -> 149331
A547: =R[-1]C+1 -> 547 | B547: =SUM(R1C[-1]:RC1) -> 149878
A548: =R[-1]C+1 -> 548 | B548: =SUM(R1C[-1]:RC1) -> 150426
A549: =R[-1]C+1 -> 549 | B549: =SUM(R1C[-1]:RC1) -> 150975
A550: =R[-1]C+1 -> 550 | B550: =SUM(R1C[-1]:RC1) -> 151525
A551: =R[-1]C+1 -> 551 | B551: =SUM(R1C[-1]:RC1) -> 152076
A552: =R[-1]C+1 -> 552 | B552: =SUM(R1C[-1]:RC1) -> 152628
A553: =R[-1]C+1 -> 553 | B553: =SUM(R1C[-1]:RC1) -> 153181
A554: =R[-1]C+1 -> 554 | B554: =SUM(R1C[-1]:RC1) -> 153735
A555: =R[-1]C+1 -> 555 | B555: =SUM(R1C[-1]:RC1) -> 154290
A556: =R[-1]C+1 -> 556 | B556: =SUM(R1C[-1]:RC1) -> 154846
A557: =R[-1]C+1 -> 557 | B557: =SUM(R1C[-1]:RC1) -> 155403
A558: =R[-1]C+1 -> 558 | B558: =SUM(R1C[-1]:RC1) -> 155961
A559: =R[-1]C+1 -> 559 | B559: =SUM(R1C[-1]:RC1) -> 156520
A560: =R[-1]C+1 -> 560 | B560: =SUM(R1C[-1]:RC1) -> 157080
A561: =R[-1]C+1 -> 561 | B561: =SUM(R1C[-1]:RC1) -> 157641
A562: =R[-1]C+1 -> 562 | B562: =SUM(R1C[-1]:RC1) -> 158203
A563: =R[-1]C+1 -> 563 | B563: =SUM(R1C[-1]:RC1) -> 158766
A564: =R[-1]C+1 -> 564 | B564: =SUM(R1C[-1]:RC1) -> 159330
A565: =R[-1]C+1 -> 565 | B565: =SUM(R1C[-1]:RC1) -> 159895
A566: =R[-1]C+1 -> 566 | B566: =SUM(R1C[-1]:RC1) -> 160461
A567: =R[-1]C+1 -> 567 | B567: =SUM(R1C[-1]:RC1) -> 161028
A568: =R[-1]C+1 -> 568 | B568: =SUM(R1C[-1]:RC1) -> 161596
A569: =R[-1]C+1 -> 569 | B569: =SUM(R1C[-1]:RC1) -> 162165
A570: =R[-1]C+1 -> 570 | B570: =SUM(R1C[-1]:RC1) -> 162735
A571: =R[-1]C+1 -> 571 | B571: =SUM(R1C[-1]:RC1) -> 163306
A572: =R[-1]C+1 -> 572 | B572: =SUM(R1C[-1]:RC1) -> 163878
A573: =R[-1]C+1 -> 573 | B573: =SUM(R1C[-1]:RC1) -> 164451
A574: =R[-1]C+1 -> 574 | B574: =SUM(R1C[-1]:RC1) -> 165025
A575: =R[-1]C+1 -> 575 | B575: =SUM(R1C[-1]:RC1) -> 165600
A576: =R[-1]C+1 -> 576 | B576: =SUM(R1C[-1]:RC1) -> 166176
A577: =R[-1]C+1 -> 577 | B577: =SUM(R1C[-1]:RC1) -> 166753
A578: =R[-1]C+1 -> 578 | B578: =SUM(R1C[-1]:RC1) -> 167331
A579: =R[-1]C+1 -> 579 | B579: =SUM(R1C[-1]:RC1) -> 167910
A580: =R[-1]C+1 -> 580 | B580: =SUM(R1C[-1]:RC1) -> 168490
A581: =R[-1]C+1 -> 581 | B581: =SUM(R1C[-1]:RC1) -> 169071
A582: =R[-1]C+1 -> 582 | B582: =SUM(R1C[-1]:RC1) -> 169653
A583: =R[-1]C+1 -> 583 | B583: =SUM(R1C[-1]:RC1) -> 170236
A584: =R[-1]C+1 -> 584 | B584: =SUM(R1C[-1]:RC1) -> 170820
A585: =R[-1]C+1 -> 585 | B585: =SUM(R1C[-1]:RC1) -> 171405
A586: =R[-1]C+1 -> 586 | B586: =SUM(R1C[-1]:RC1) -> 171991
A587: =R[-1]C+1 -> 587 | B587: =SUM(R1C[-1]:RC1) -> 172578
A588: =R[-1]C+1 -> 588 | B588: =SUM(R1C[-1]:RC1) -> 173166
A589: =R[-1]C+1 -> 589 | B589: =SUM(R1C[-1]:RC1) -> 173755
A590: =R[-1]C+1 -> 590 | B590: =SUM(R1C[-1]:RC1) -> 174345
A591: =R[-1]C+1 -> 591 | B591: =SUM(R1C[-1]:RC1) -> 174936
A592: =R[-1]C+1 -> 592 | B592: =SUM(R1C[-1]:RC1) -> 175528
A593: =R[-1]C+1 -> 593 | B593: =SUM(R1C[-1]:RC1) -> 176121
A594: =R[-1]C+1 -> 594 | B594: =SUM(R1C[-1]:RC1) -> 176715
A595: =R[-1]C+1 -> 595 | B595: =SUM(R1C[-1]:RC1) -> 177310
A596: =R[-1]C+1 -> 596 | B596: =SUM(R1C[-1]:RC1) -> 177906
A597: =R[-1]C+1 -> 597 | B597: =SUM(R1C[-1]:RC1) -> 178503
A598: =R[-1]C+1 -> 598 | B598: =SUM(R1C[-1]:RC1) -> 179101
A599: =R[-1]C+1 -> 599 | B599: =SUM(R1C[-1]:RC1) -> 179700
A600: =R[-1]C+1 -> 600 | B600: =SUM(R1C[-1]:RC1) -> 180300
A601: =R[-1]C+1 -> 601 | B601: =SUM(R1C[-1]:RC1) -> 180901
A602: =R[-1]C+1 -> 602 | B602: =SUM(R1C[-1]:RC1) -> 181503
A603: =R[-1]C+1 -> 603 | B603: =SUM(R1C[-1]:RC1) -> 182106
A604: =R[-1]C+1 -> 604 | B604: =SUM(R1C[-1]:RC1) -> 182710
A605: =R[-1]C+1 -> 605 | B605: =SUM(R1C[-1]:RC1) -> 183315
A606: =R[-1]C+1 -> 606 | B606: =SUM(R1C[-1]:RC1) -> 183921
A607: =R[-1]C+1 -> 607 | B607: =SUM(R1C[-1]:RC1) -> 184528
A608: =R[-1]C+1 -> 608 | B608: =SUM(R1C[-1]:RC1) -> 185136
A609: =R[-1]C+1 -> 609 | B609: =SUM(R1C[-1]:RC1) -> 185745
A610: =R[-1]C+1 -> 610 | B610: =SUM(R1C[-1]:RC1) -> 186355
A611: =R[-1]C+1 -> 611 | B611: =SUM(R1C[-1]:RC1) -> 186966
A612: =R[-1]C+1 -> 612 | B612: =SUM(R1C[-1]:RC1) -> 187578
A613: =R[-1]C+1 -> 613 | B613: =SUM(R1C[-1]:RC1) -> 188191
A614: =R[-1]C+1 -> 614 | B614: =SUM(R1C[-1]:RC1) -> 188805
A615: =R[-1]C+1 -> 615 | B615: =SUM(R1C[-1]:RC1) -> 189420
A616: =R[-1]C+1 -> 616 | B616: =SUM(R1C[-1]:RC1) -> 190036
A617: =R[-1]C+1 -> 617 | B617: =SUM(R1C[-1]:RC1) -> 190653
A618: =R[-1]C+1 -> 618 | B618: =SUM(R1C[-1]:RC1) -> 191271
A619: =R[-1]C+1 -> 619 | B619: =SUM(R1C[-1]:RC1) -> 191890
A620: =R[-1]C+1 -> 620 | B620: =SUM(R1C[-1]:RC1) -> 192510
A621: =R[-1]C+1 -> 621 | B621: =SUM(R1C[-1]:RC1) -> 193131
A622: =R[-1]C+1 -> 622 | B622: =SUM(R1C[-1]:RC1) -> 193753
A623: =R[-1]C+1 -> 623 | B623: =SUM(R1C[-1]:RC1) -> 194376
A624: =R[-1]C+1 -> 624 | B624: =SUM(R1C[-1]:RC1) -> 195000
A625: =R[-1]C+1 -> 625 | B625: =SUM(R1C[-1]:RC1) -> 195625
A626: =R[-1]C+1 -> 626 | B626: =SUM(R1C[-1]:RC1) -> 196251
A627: =R[-1]C+1 -> 627 | B627: =SUM(R1C[-1]:RC1) -> 196878
A628: =R[-1]C+1 -> 628 | B628: =SUM(R1C[-1]:RC1) -> 197506
A629: =R[-1]C+1 -> 629 | B629: =SUM(R1C[-1]:RC1) -> 198135
A630: =R[-1]C+1 -> 630 | B630: =SUM(R1C[-1]:RC1) -> 198765
A631: =R[-1]C+1 -> 631 | B631: =SUM(R1C[-1]:RC1) -> 199396
A632: =R[-1]C+1 -> 632 | B632: =SUM(R1C[-1]:RC1) -> 200028
A633: =R[-1]C+1 -> 633 | B633: =SUM(R1C[-1]:RC1) -> 200661
A634: =R[-1]C+1 -> 634 | B634: =SUM(R1C[-1]:RC1) -> 201295
A635: =R[-1]C+1 -> 635 | B635: =SUM(R1C[-1]:RC1) -> 201930
A636: =R[-1]C+1 -> 636 | B636: =SUM(R1C[-1]:RC1) -> 202566
A637: =R[-1]C+1 -> 637 | B637: =SUM(R1C[-1]:RC1) -> 203203
A638: =R[-1]C+1 -> 638 | B638: =SUM(R1C[-1]:RC1) -> 203841
A639: =R[-1]C+1 -> 639 | B639: =SUM(R1C[-1]:RC1) -> 204480
A640: =R[-1]C+1 -> 640 | B640: =SUM(R1C[-1]:RC1) -> 205120
A641: =R[-1]C+1 -> 641 | B641: =SUM(R1C[-1]:RC1) -> 205761
A642: =R[-1]C+1 -> 642 | B642: =SUM(R1C[-1]:RC1) -> 206403
A643: =R[-1]C+1 -> 643 | B643: =SUM(R1C[-1]:RC1) -> 207046
A644: =R[-1]C+1 -> 644 | B644: =SUM(R1C[-1]:RC1) -> 207690
A645: =R[-1]C+1 -> 645 | B645: =SUM(R1C[-1]:RC1) -> 208335
A646: =R[-1]C+1 -> 646 | B646: =SUM(R1C[-1]:RC1) -> 208981
A647: =R[-1]C+1 -> 647 | B647: =SUM(R1C[-1]:RC1) -> 209628
A648: =R[-1]C+1 -> 648 | B648: =SUM(R1C[-1]:RC1) -> 210276
A649: =R[-1]C+1 -> 649 | B649: =SUM(R1C[-1]:RC1) -> 210925
A650: =R[-1]C+1 -> 650 | B650: =SUM(R1C[-1]:RC1) -> 211575
A651: =R[-1]C+1 -> 651 | B651: =SUM(R1C[-1]:RC1) -> 212226
A652: =R[-1]C+1 -> 652 | B652: =SUM(R1C[-1]:RC1) -> 212878
A653: =R[-1]C+1 -> 653 | B653: =SUM(R1C[-1]:RC1) -> 213531
A654: =R[-1]C+1 -> 654 | B654: =SUM(R1C[-1]:RC1) -> 214185
A655: =R[-1]C+1 -> 655 | B655: =SUM(R1C[-1]:RC1) -> 214840
A656: =R[-1]C+1 -> 656 | B656: =SUM(R1C[-1]:RC1) -> 215496
A657: =R[-1]C+1 -> 657 | B657: =SUM(R1C[-1]:RC1) -> 216153
A658: =R[-1]C+1 -> 658 | B658: =SUM(R1C[-1]:RC1) -> 216811
A659: =R[-1]C+1 -> 659 | B659: =SUM(R1C[-1]:RC1) -> 217470
A660: =R[-1]C+1 -> 660 | B660: =SUM(R1C[-1]:RC1) -> 218130
A661: =R[-1]C+1 -> 661 | B661: =SUM(R1C[-1]:RC1) -> 218791
A662: =R[-1]C+1 -> 662 | B662: =SUM(R1C[-1]:RC1) -> 219453
A663: =R[-1]C+1 -> 663 | B663: =SUM(R1C[-1]:RC1) -> 220116
A664: =R[-1]C+1 -> 664 | B664: =SUM(R1C[-1]:RC1) -> 220780
A665: =R[-1]C+1 -> 665 | B665: =SUM(R1C[-1]:RC1) -> 221445
A666: =R[-1]C+1 -> 666 | B666: =SUM(R1C[-1]:RC1) -> 222111
A667: =R[-1]C+1 -> 667 | B667: =SUM(R1C[-1]:RC1) -> 222778
A668: =R[-1]C+1 -> 668 | B668: =SUM(R1C[-1]:RC1) -> 223446
A669: =R[-1]C+1 -> 669 | B669: =SUM(R1C[-1]:RC1) -> 224115
A670: =R[-1]C+1 -> 670 | B670: =SUM(R1C[-1]:RC1) -> 224785
A671: =R[-1]C+1 -> 671 | B671: =SUM(R1C[-1]:RC1) -> 225456
A672: =R[-1]C+1 -> 672 | B672: =SUM(R1C[-1]:RC1) -> 226128
A673: =R[-1]C+1 -> 673 | B673: =SUM(R1C[-1]:RC1) -> 226801
A674: =R[-1]C+1 -> 674 | B674: =SUM(R1C[-1]:RC1) -> 227475
A675: =R[-1]C+1 -> 675 | B675: =SUM(R1C[-1]:RC1) -> 228150
A676: =R[-1]C+1 -> 676 | B676: =SUM(R1C[-1]:RC1) -> 228826
A677: =R[-1]C+1 -> 677 | B677: =SUM(R1C[-1]:RC1) -> 229503
A678: =R[-1]C+1 -> 678 | B678: =SUM(R1C[-1]:RC1) -> 230181
A679: =R[-1]C+1 -> 679 | B679: =SUM(R1C[-1]:RC1) -> 230860
A680: =R[-1]C+1 -> 680 | B680: =SUM(R1C[-1]:RC1) -> 231540
A681: =R[-1]C+1 -> 681 | B681: =SUM(R1C[-1]:RC1) -> 232221
A682: =R[-1]C+1 -> 682 | B682: =SUM(R1C[-1]:RC1) -> 232903
A683: =R[-1]C+1 -> 683 | B683: =SUM(R1C[-1]:RC1) -> 233586
A684: =R[-1]C+1 -> 684 | B684: =SUM(R1C[-1]:RC1) -> 234270
A685: =R[-1]C+1 -> 685 | B685: =SUM(R1C[-1]:RC1) -> 234955
A686: =R[-1]C+1 -> 686 | B686: =SUM(R1C[-1]:RC1) -> 235641
A687: =R[-1]C+1 -> 687 | B687: =SUM(R1C[-1]:RC1) -> 236328
A688: =R[-1]C+1 -> 688 | B688: =SUM(R1C[-1]:RC1) -> 237016
A689: =R[-1]C+1 -> 689 | B689: =SUM(R1C[-1]:RC1) -> 237705
A690: =R[-1]C+1 -> 690 | B690: =SUM(R1C[-1]:RC1) -> 238395
A691: =R[-1]C+1 -> 691 | B691: =SUM(R1C[-1]:RC1) -> 239086
A692: =R[-1]C+1 -> 692 | B692: =SUM(R1C[-1]:RC1) -> 239778
A693: =R[-1]C+1 -> 693 | B693: =SUM(R1C[-1]:RC1) -> 240471
A694: =R[-1]C+1 -> 694 | B694: =SUM(R1C[-1]:RC1) -> 241165
A695: =R[-1]C+1 -> 695 | B695: =SUM(R1C[-1]:RC1) -> 241860
A696: =R[-1]C+1 -> 696 | B696: =SUM(R1C[-1]:RC1) -> 242556
A697: =R[-1]C+1 -> 697 | B697: =SUM(R1C[-1]:RC1) -> 243253
A698: =R[-1]C+1 -> 698 | B698: =SUM(R1C[-1]:RC1) -> 243951
A699: =R[-1]C+1 -> 699 | B699: =SUM(R1C[-1]:RC1) -> 244650
A700: =R[-1]C+1 -> 700 | B700: =SUM(R1C[-1]:RC1) -> 245350
A701: =R[-1]C+1 -> 701 | B701: =SUM(R1C[-1]:RC1) -> 246051
A702: =R[-1]C+1 -> 702 | B702: =SUM(R1C[-1]:RC1) -> 246753
A703: =R[-1]C+1 -> 703 | B703: =SUM(R1C[-1]:RC1) -> 247456
A704: =R[-1]C+1 -> 704 | B704: =SUM(R1C[-1]:RC1) -> 248160
A705: =R[-1]C+1 -> 705 | B705: =SUM(R1C[-1]:RC1) -> 248865
A706: =R[-1]C+1 -> 706 | B706: =SUM(R1C[-1]:RC1) -> 249571
A707: =R[-1]C+1 -> 707 | B707: =SUM(R1C[-1]:RC1) -> 250278
A708: =R[-1]C+1 -> 708 | B708: =SUM(R1C[-1]:RC1) -> 250986
A709: =R[-1]C+1 -> 709 | B709: =SUM(R1C[-1]:RC1) -> 251695
A710: =R[-1]C+1 -> 710 | B710: =SUM(R1C[-1]:RC1) -> 252405
A711: =R[-1]C+1 -> 711 | B711: =SUM(R1C[-1]:RC1) -> 253116
A712: =R[-1]C+1 -> 712 | B712: =SUM(R1C[-1]:RC1) -> 253828
A713: =R[-1]C+1 -> 713 | B713: =SUM(R1C[-1]:RC1) -> 254541
A714: =R[-1]C+1 -> 714 | B714: =SUM(R1C[-1]:RC1) -> 255255
A715: =R[-1]C+1 -> 715 | B715: =SUM(R1C[-1]:RC1) -> 255970
A716: =R[-1]C+1 -> 716 | B716: =SUM(R1C[-1]:RC1) -> 256686
A717: =R[-1]C+1 -> 717 | B717: =SUM(R1C[-1]:RC1) -> 257403
A718: =R[-1]C+1 -> 718 | B718: =SUM(R1C[-1]:RC1) -> 258121
A719: =R[-1]C+1 -> 719 | B719: =SUM(R1C[-1]:RC1) -> 258840
A720: =R[-1]C+1 -> 720 | B720: =SUM(R1C[-1]:RC1) -> 259560
A721: =R[-1]C+1 -> 721 | B721: =SUM(R1C[-1]:RC1) -> 260281
A722: =R[-1]C+1 -> 722 | B722: =SUM(R1C[-1]:RC1) -> 261003
A723: =R[-1]C+1 -> 723 | B723: =SUM(R1C[-1]:RC1) -> 261726
A724: =R[-1]C+1 -> 724 | B724: =SUM(R1C[-1]:RC1) -> 262450
A725: =R[-1]C+1 -> 725 | B725: =SUM(R1C[-1]:RC1) -> 263175
A726: =R[-1]C+1 -> 726 | B726: =SUM(R1C[-1]:RC1) -> 263901
A727: =R[-1]C+1 -> 727 | B727: =SUM(R1C[-1]:RC1) -> 264628
A728: =R[-1]C+1 -> 728 | B728: =SUM(R1C[-1]:RC1) -> 265356
A729: =R[-1]C+1 -> 729 | B729: =SUM(R1C[-1]:RC1) -> 266085
A730: =R[-1]C+1 -> 730 | B730: =SUM(R1C[-1]:RC1) -> 266815
A731: =R[-1]C+1 -> 731 | B731: =SUM(R1C[-1]:RC1) -> 267546
A732: =R[-1]C+1 -> 732 | B732: =SUM(R1C[-1]:RC1) -> 268278
A733: =R[-1]C+1 -> 733 | B733: =SUM(R1C[-1]:RC1) -> 269011
A734: =R[-1]C+1 -> 734 | B734: =SUM(R1C[-1]:RC1) -> 269745
A735: =R[-1]C+1 -> 735 | B735: =SUM(R1C[-1]:RC1) -> 270480
A736: =R[-1]C+1 -> 736 | B736: =SUM(R1C[-1]:RC1) -> 271216
A737: =R[-1]C+1 -> 737 | B737: =SUM(R1C[-1]:RC1) -> 271953
A738: =R[-1]C+1 -> 738 | B738: =SUM(R1C[-1]:RC1) -> 272691
A739: =R[-1]C+1 -> 739 | B739: =SUM(R1C[-1]:RC1) -> 273430
A740: =R[-1]C+1 -> 740 | B740: =SUM(R1C[-1]:RC1) -> 274170
A741: =R[-1]C+1 -> 741 | B741: =SUM(R1C[-1]:RC1) -> 274911
A742: =R[-1]C+1 -> 742 | B742: =SUM(R1C[-1]:RC1) -> 275653
A743: =R[-1]C+1 -> 743 | B743: =SUM(R1C[-1]:RC1) -> 276396
A744: =R[-1]C+1 -> 744 | B744: =SUM(R1C[-1]:RC1) -> 277140
A745: =R[-1]C+1 -> 745 | B745: =SUM(R1C[-1]:RC1) -> 277885
A746: =R[-1]C+1 -> 746 | B746: =SUM(R1C[-1]:RC1) -> 278631
A747: =R[-1]C+1 -> 747 | B747: =SUM(R1C[-1]:RC1) -> 279378
A748: =R[-1]C+1 -> 748 | B748: =SUM(R1C[-1]:RC1) -> 280126
A749: =R[-1]C+1 -> 749 | B749: =SUM(R1C[-1]:RC1) -> 280875
A750: =R[-1]C+1 -> 750 | B750: =SUM(R1C[-1]:RC1) -> 281625
A751: =R[-1]C+1 -> 751 | B751: =SUM(R1C[-1]:RC1) -> 282376
A752: =R[-1]C+1 -> 752 | B752: =SUM(R1C[-1]:RC1) -> 283128
A753: =R[-1]C+1 -> 753 | B753: =SUM(R1C[-1]:RC1) -> 283881
A754: =R[-1]C+1 -> 754 | B754: =SUM(R1C[-1]:RC1) -> 284635
A755: =R[-1]C+1 -> 755 | B755: =SUM(R1C[-1]:RC1) -> 285390
A756: =R[-1]C+1 -> 756 | B756: =SUM(R1C[-1]:RC1) -> 286146
A757: =R[-1]C+1 -> 757 | B757: =SUM(R1C[-1]:RC1) -> 286903
A758: =R[-1]C+1 -> 758 | B758: =SUM(R1C[-1]:RC1) -> 287661
A759: =R[-1]C+1 -> 759 | B759: =SUM(R1C[-1]:RC1) -> 288420
A760: =R[-1]C+1 -> 760 | B760: =SUM(R1C[-1]:RC1) -> 289180
A761: =R[-1]C+1 -> 761 | B761: =SUM(R1C[-1]:RC1) -> 289941
A762: =R[-1]C+1 -> 762 | B762: =SUM(R1C[-1]:RC1) -> 290703
A763: =R[-1]C+1 -> 763 | B763: =SUM(R1C[-1]:RC1) -> 291466
A764: =R[-1]C+1 -> 764 | B764: =SUM(R1C[-1]:RC1) -> 292230
A765: =R[-1]C+1 -> 765 | B765: =SUM(R1C[-1]:RC1) -> 292995
A766: =R[-1]C+1 -> 766 | B766: =SUM(R1C[-1]:RC1) -> 293761
A767: =R[-1]C+1 -> 767 | B767: =SUM(R1C[-1]:RC1) -> 294528
A768: =R[-1]C+1 -> 768 | B768: =SUM(R1C[-1]:RC1) -> 295296
A769: =R[-1]C+1 -> 769 | B769: =SUM(R1C[-1]:RC1) -> 296065
A770: =R[-1]C+1 -> 770 | B770: =SUM(R1C[-1]:RC1) -> 296835
A771: =R[-1]C+1 -> 771 | B771: =SUM(R1C[-1]:RC1) -> 297606
A772: =R[-1]C+1 -> 772 | B772: =SUM(R1C[-1]:RC1) -> 298378
A773: =R[-1]C+1 -> 773 | B773: =SUM(R1C[-1]:RC1) -> 299151
A774: =R[-1]C+1 -> 774 | B774: =SUM(R1C[-1]:RC1) -> 299925
A775: =R[-1]C+1 -> 775 | B775: =SUM(R1C[-1]:RC1) -> 300700
A776: =R[-1]C+1 -> 776 | B776: =SUM(R1C[-1]:RC1) -> 301476
A777: =R[-1]C+1 -> 777 | B777: =SUM(R1C[-1]:RC1) -> 302253
A778: =R[-1]C+1 -> 778 | B778: =SUM(R1C[-1]:RC1) -> 303031
A779: =R[-1]C+1 -> 779 | B779: =SUM(R1C[-1]:RC1) -> 303810
A780: =R[-1]C+1 -> 780 | B780: =SUM(R1C[-1]:RC1) -> 304590
A781: =R[-1]C+1 -> 781 | B781: =SUM(R1C[-1]:RC1) -> 305371
A782: =R[-1]C+1 -> 782 | B782: =SUM(R1C[-1]:RC1) -> 306153
A783: =R[-1]C+1 -> 783 | B783: =SUM(R1C[-1]:RC1) -> 306936
A784: =R[-1]C+1 -> 784 | B784: =SUM(R1C[-1]:RC1) -> 307720
A785: =R[-1]C+1 -> 785 | B785: =SUM(R1C[-1]:RC1) -> 308505
A786: =R[-1]C+1 -> 786 | B786: =SUM(R1C[-1]:RC1) -> 309291
A787: =R[-1]C+1 -> 787 | B787: =SUM(R1C[-1]:RC1) -> 310078
A788: =R[-1]C+1 -> 788 | B788: =SUM(R1C[-1]:RC1) -> 310866
A789: =R[-1]C+1 -> 789 | B789: =SUM(R1C[-1]:RC1) -> 311655
A790: =R[-1]C+1 -> 790 | B790: =SUM(R1C[-1]:RC1) -> 312445
A791: =R[-1]C+1 -> 791 | B791: =SUM(R1C[-1]:RC1) -> 313236
A792: =R[-1]C+1 -> 792 | B792: =SUM(R1C[-1]:RC1) -> 314028
A793: =R[-1]C+1 -> 793 | B793: =SUM(R1C[-1]:RC1) -> 314821
A794: =R[-1]C+1 -> 794 | B794: =SUM(R1C[-1]:RC1) -> 315615
A795: =R[-1]C+1 -> 795 | B795: =SUM(R1C[-1]:RC1) -> 316410
A796: =R[-1]C+1 -> 796 | B796: =SUM(R1C[-1]:RC1) -> 317206
A797: =R[-1]C+1 -> 797 | B797: =SUM(R1C[-1]:RC1) -> 318003
A798: =R[-1]C+1 -> 798 | B798: =SUM(R1C[-1]:RC1) -> 318801
A799: =R[-1]C+1 -> 799 | B799: =SUM(R1C[-1]:RC1) -> 319600
A800: =R[-1]C+1 -> 800 | B800: =SUM(R1C[-1]:RC1) -> 320400
A801: =R[-1]C+1 -> 801 | B801: =SUM(R1C[-1]:RC1) -> 321201
A802: =R[-1]C+1 -> 802 | B802: =SUM(R1C[-1]:RC1) -> 322003
A803: =R[-1]C+1 -> 803 | B803: =SUM(R1C[-1]:RC1) -> 322806
A804: =R[-1]C+1 -> 804 | B804: =SUM(R1C[-1]:RC1) -> 323610
A805: =R[-1]C+1 -> 805 | B805: =SUM(R1C[-1]:RC1) -> 324415
A806: =R[-1]C+1 -> 806 | B806: =SUM(R1C[-1]:RC1) -> 325221
A807: =R[-1]C+1 -> 807 | B807: =SUM(R1C[-1]:RC1) -> 326028
A808: =R[-1]C+1 -> 808 | B808: =SUM(R1C[-1]:RC1) -> 326836
A809: =R[-1]C+1 -> 809 | B809: =SUM(R1C[-1]:RC1) -> 327645
A810: =R[-1]C+1 -> 810 | B810: =SUM(R1C[-1]:RC1) -> 328455
A811: =R[-1]C+1 -> 811 | B811: =SUM(R1C[-1]:RC1) -> 329266
A812: =R[-1]C+1 -> 812 | B812: =SUM(R1C[-1]:RC1) -> 330078
A813: =R[-1]C+1 -> 813 | B813: =SUM(R1C[-1]:RC1) -> 330891
A814: =R[-1]C+1 -> 814 | B814: =SUM(R1C[-1]:RC1) -> 331705
A815: =R[-1]C+1 -> 815 | B815: =SUM(R1C[-1]:RC1) -> 332520
A816: =R[-1]C+1 -> 816 | B816: =SUM(R1C[-1]:RC1) -> 333336
A817: =R[-1]C+1 -> 817 | B817: =SUM(R1C[-1]:RC1) -> 334153
A818: =R[-1]C+1 -> 818 | B818: =SUM(R1C[-1]:RC1) -> 334971
A819: =R[-1]C+1 -> 819 | B819: =SUM(R1C[-1]:RC1) -> 335790
A820: =R[-1]C+1 -> 820 | B820: =SUM(R1C[-1]:RC1) -> 336610
A821: =R[-1]C+1 -> 821 | B821: =SUM(R1C[-1]:RC1) -> 337431
A822: =R[-1]C+1 -> 822 | B822: =SUM(R1C[-1]:RC1) -> 338253
A823: =R[-1]C+1 -> 823 | B823: =SUM(R1C[-1]:RC1) -> 339076
A824: =R[-1]C+1 -> 824 | B824: =SUM(R1C[-1]:RC1) -> 339900
A825: =R[-1]C+1 -> 825 | B825: =SUM(R1C[-1]:RC1) -> 340725
A826: =R[-1]C+1 -> 826 | B826: =SUM(R1C[-1]:RC1) -> 341551
A827: =R[-1]C+1 -> 827 | B827: =SUM(R1C[-1]:RC1) -> 342378
A828: =R[-1]C+1 -> 828 | B828: =SUM(R1C[-1]:RC1) -> 343206
A829: =R[-1]C+1 -> 829 | B829: =SUM(R1C[-1]:RC1) -> 344035
A830: =R[-1]C+1 -> 830 | B830: =SUM(R1C[-1]:RC1) -> 344865
A831: =R[-1]C+1 -> 831 | B831: =SUM(R1C[-1]:RC1) -> 345696
A832: =R[-1]C+1 -> 832 | B832: =SUM(R1C[-1]:RC1) -> 346528
A833: =R[-1]C+1 -> 833 | B833: =SUM(R1C[-1]:RC1) -> 347361
A834: =R[-1]C+1 -> 834 | B834: =SUM(R1C[-1]:RC1) -> 348195
A835: =R[-1]C+1 -> 835 | B835: =SUM(R1C[-1]:RC1) -> 349030
A836: =R[-1]C+1 -> 836 | B836: =SUM(R1C[-1]:RC1) -> 349866
A837: =R[-1]C+1 -> 837 | B837: =SUM(R1C[-1]:RC1) -> 350703
A838: =R[-1]C+1 -> 838 | B838: =SUM(R1C[-1]:RC1) -> 351541
A839: =R[-1]C+1 -> 839 | B839: =SUM(R1C[-1]:RC1) -> 352380
A840: =R[-1]C+1 -> 840 | B840: =SUM(R1C[-1]:RC1) -> 353220
A841: =R[-1]C+1 -> 841 | B841: =SUM(R1C[-1]:RC1) -> 354061
A842: =R[-1]C+1 -> 842 | B842: =SUM(R1C[-1]:RC1) -> 354903
A843: =R[-1]C+1 -> 843 | B843: =SUM(R1C[-1]:RC1) -> 355746
A844: =R[-1]C+1 -> 844 | B844: =SUM(R1C[-1]:RC1) -> 356590
A845: =R[-1]C+1 -> 845 | B845: =SUM(R1C[-1]:RC1) -> 357435
A846: =R[-1]C+1 -> 846 | B846: =SUM(R1C[-1]:RC1) -> 358281
A847: =R[-1]C+1 -> 847 | B847: =SUM(R1C[-1]:RC1) -> 359128
A848: =R[-1]C+1 -> 848 | B848: =SUM(R1C[-1]:RC1) -> 359976
A849: =R[-1]C+1 -> 849 | B849: =SUM(R1C[-1]:RC1) -> 360825
A850: =R[-1]C+1 -> 850 | B850: =SUM(R1C[-1]:RC1) -> 361675
A851: =R[-1]C+1 -> 851 | B851: =SUM(R1C[-1]:RC1) -> 362526
A852: =R[-1]C+1 -> 852 | B852: =SUM(R1C[-1]:RC1) -> 363378
A853: =R[-1]C+1 -> 853 | B853: =SUM(R1C[-1]:RC1) -> 364231
A854: =R[-1]C+1 -> 854 | B854: =SUM(R1C[-1]:RC1) -> 365085
A855: =R[-1]C+1 -> 855 | B855: =SUM(R1C[-1]:RC1) -> 365940
A856: =R[-1]C+1 -> 856 | B856: =SUM(R1C[-1]:RC1) -> 366796
A857: =R[-1]C+1 -> 857 | B857: =SUM(R1C[-1]:RC1) -> 367653
A858: =R[-1]C+1 -> 858 | B858: =SUM(R1C[-1]:RC1) -> 368511
A859: =R[-1]C+1 -> 859 | B859: =SUM(R1C[-1]:RC1) -> 369370
A860: =R[-1]C+1 -> 860 | B860: =SUM(R1C[-1]:RC1) -> 370230
A861: =R[-1]C+1 -> 861 | B861: =SUM(R1C[-1]:RC1) -> 371091
A862: =R[-1]C+1 -> 862 | B862: =SUM(R1C[-1]:RC1) -> 371953
A863: =R[-1]C+1 -> 863 | B863: =SUM(R1C[-1]:RC1) -> 372816
A864: =R[-1]C+1 -> 864 | B864: =SUM(R1C[-1]:RC1) -> 373680
A865: =R[-1]C+1 -> 865 | B865: =SUM(R1C[-1]:RC1) -> 374545
A866: =R[-1]C+1 -> 866 | B866: =SUM(R1C[-1]:RC1) -> 375411
A867: =R[-1]C+1 -> 867 | B867: =SUM(R1C[-1]:RC1) -> 376278
A868: =R[-1]C+1 -> 868 | B868: =SUM(R1C[-1]:RC1) -> 377146
A869: =R[-1]C+1 -> 869 | B869: =SUM(R1C[-1]:RC1) -> 378015
A870: =R[-1]C+1 -> 870 | B870: =SUM(R1C[-1]:RC1) -> 378885
A871: =R[-1]C+1 -> 871 | B871: =SUM(R1C[-1]:RC1) -> 379756
A872: =R[-1]C+1 -> 872 | B872: =SUM(R1C[-1]:RC1) -> 380628
A873: =R[-1]C+1 -> 873 | B873: =SUM(R1C[-1]:RC1) -> 381501
A874: =R[-1]C+1 -> 874 | B874: =SUM(R1C[-1]:RC1) -> 382375
A875: =R[-1]C+1 -> 875 | B875: =SUM(R1C[-1]:RC1) -> 383250
A876: =R[-1]C+1 -> 876 | B876: =SUM(R1C[-1]:RC1) -> 384126
A877: =R[-1]C+1 -> 877 | B877: =SUM(R1C[-1]:RC1) -> 385003
A878: =R[-1]C+1 -> 878 | B878: =SUM(R1C[-1]:RC1) -> 385881
A879: =R[-1]C+1 -> 879 | B879: =SUM(R1C[-1]:RC1) -> 386760
A880: =R[-1]C+1 -> 880 | B880: =SUM(R1C[-1]:RC1) -> 387640
A881: =R[-1]C+1 -> 881 | B881: =SUM(R1C[-1]:RC1) -> 388521
A882: =R[-1]C+1 -> 882 | B882: =SUM(R1C[-1]:RC1) -> 389403
A883: =R[-1]C+1 -> 883 | B883: =SUM(R1C[-1]:RC1) -> 390286
A884: =R[-1]C+1 -> 884 | B884: =SUM(R1C[-1]:RC1) -> 391170
A885: =R[-1]C+1 -> 885 | B885: =SUM(R1C[-1]:RC1) -> 392055
A886: =R[-1]C+1 -> 886 | B886: =SUM(R1C[-1]:RC1) -> 392941
A887: =R[-1]C+1 -> 887 | B887: =SUM(R1C[-1]:RC1) -> 393828
A888: =R[-1]C+1 -> 888 | B888: =SUM(R1C[-1]:RC1) -> 394716
A889: =R[-1]C+1 -> 889 | B889: =SUM(R1C[-1]:RC1) -> 395605
A890: =R[-1]C+1 -> 890 | B890: =SUM(R1C[-1]:RC1) -> 396495
A891: =R[-1]C+1 -> 891 | B891: =SUM(R1C[-1]:RC1) -> 397386
A892: =R[-1]C+1 -> 892 | B892: =SUM(R1C[-1]:RC1) -> 398278
A893: =R[-1]C+1 -> 893 | B893: =SUM(R1C[-1]:RC1) -> 399171
A894: =R[-1]C+1 -> 894 | B894: =SUM(R1C[-1]:RC1) -> 400065
A895: =R[-1]C+1 -> 895 | B895: =SUM(R1C[-1]:RC1) -> 400960
A896: =R[-1]C+1 -> 896 | B896: =SUM(R1C[-1]:RC1) -> 401856
A897: =R[-1]C+1 -> 897 | B897: =SUM(R1C[-1]:RC1) -> 402753
A898: =R[-1]C+1 -> 898 | B898: =SUM(R1C[-1]:RC1) -> 403651
A899: =R[-1]C+1 -> 899 | B899: =SUM(R1C[-1]:RC1) -> 404550
A900: =R[-1]C+1 -> 900 | B900: =SUM(R1C[-1]:RC1) -> 405450
A901: =R[-1]C+1 -> 901 | B901: =SUM(R1C[-1]:RC1) -> 406351
A902: =R[-1]C+1 -> 902 | B902: =SUM(R1C[-1]:RC1) -> 407253
A903: =R[-1]C+1 -> 903 | B903: =SUM(R1C[-1]:RC1) -> 408156
A904: =R[-1]C+1 -> 904 | B904: =SUM(R1C[-1]:RC1) -> 409060
A905: =R[-1]C+1 -> 905 | B905: =SUM(R1C[-1]:RC1) -> 409965
A906: =R[-1]C+1 -> 906 | B906: =SUM(R1C[-1]:RC1) -> 410871
A907: =R[-1]C+1 -> 907 | B907: =SUM(R1C[-1]:RC1) -> 411778
A908: =R[-1]C+1 -> 908 | B908: =SUM(R1C[-1]:RC1) -> 412686
A909: =R[-1]C+1 -> 909 | B909: =SUM(R1C[-1]:RC1) -> 413595
A910: =R[-1]C+1 -> 910 | B910: =SUM(R1C[-1]:RC1) -> 414505
A911: =R[-1]C+1 -> 911 | B911: =SUM(R1C[-1]:RC1) -> 415416
A912: =R[-1]C+1 -> 912 | B912: =SUM(R1C[-1]:RC1) -> 416328
A913: =R[-1]C+1 -> 913 | B913: =SUM(R1C[-1]:RC1) -> 417241
A914: =R[-1]C+1 -> 914 | B914: =SUM(R1C[-1]:RC1) -> 418155
A915: =R[-1]C+1 -> 915 | B915: =SUM(R1C[-1]:RC1) -> 419070
A916: =R[-1]C+1 -> 916 | B916: =SUM(R1C[-1]:RC1) -> 419986
A917: =R[-1]C+1 -> 917 | B917: =SUM(R1C[-1]:RC1) -> 420903
A918: =R[-1]C+1 -> 918 | B918: =SUM(R1C[-1]:RC1) -> 421821
A919: =R[-1]C+1 -> 919 | B919: =SUM(R1C[-1]:RC1) -> 422740
A920: =R[-1]C+1 -> 920 | B920: =SUM(R1C[-1]:RC1) -> 423660
A921: =R[-1]C+1 -> 921 | B921: =SUM(R1C[-1]:RC1) -> 424581
A922: =R[-1]C+1 -> 922 | B922: =SUM(R1C[-1]:RC1) -> 425503
A923: =R[-1]C+1 -> 923 | B923: =SUM(R1C[-1]:RC1) -> 426426
A924: =R[-1]C+1 -> 924 | B924: =SUM(R1C[-1]:RC1) -> 427350
A925: =R[-1]C+1 -> 925 | B925: =SUM(R1C[-1]:RC1) -> 428275
A926: =R[-1]C+1 -> 926 | B926: =SUM(R1C[-1]:RC1) -> 429201
A927: =R[-1]C+1 -> 927 | B927: =SUM(R1C[-1]:RC1) -> 430128
A928: =R[-1]C+1 -> 928 | B928: =SUM(R1C[-1]:RC1) -> 431056
A929: =R[-1]C+1 -> 929 | B929: =SUM(R1C[-1]:RC1) -> 431985
A930: =R[-1]C+1 -> 930 | B930: =SUM(R1C[-1]:RC1) -> 432915
A931: =R[-1]C+1 -> 931 | B931: =SUM(R1C[-1]:RC1) -> 433846
A932: =R[-1]C+1 -> 932 | B932: =SUM(R1C[-1]:RC1) -> 434778
A933: =R[-1]C+1 -> 933 | B933: =SUM(R1C[-1]:RC1) -> 435711
A934: =R[-1]C+1 -> 934 | B934: =SUM(R1C[-1]:RC1) -> 436645
A935: =R[-1]C+1 -> 935 | B935: =SUM(R1C[-1]:RC1) -> 437580
A936: =R[-1]C+1 -> 936 | B936: =SUM(R1C[-1]:RC1) -> 438516
A937: =R[-1]C+1 -> 937 | B937: =SUM(R1C[-1]:RC1) -> 439453
A938: =R[-1]C+1 -> 938 | B938: =SUM(R1C[-1]:RC1) -> 440391
A939: =R[-1]C+1 -> 939 | B939: =SUM(R1C[-1]:RC1) -> 441330
A940: =R[-1]C+1 -> 940 | B940: =SUM(R1C[-1]:RC1) -> 442270
A941: =R[-1]C+1 -> 941 | B941: =SUM(R1C[-1]:RC1) -> 443211
A942: =R[-1]C+1 -> 942 | B942: =SUM(R1C[-1]:RC1) -> 444153
A943: =R[-1]C+1 -> 943 | B943: =SUM(R1C[-1]:RC1) -> 445096
A944: =R[-1]C+1 -> 944 | B944: =SUM(R1C[-1]:RC1) -> 446040
A945: =R[-1]C+1 -> 945 | B945: =SUM(R1C[-1]:RC1) -> 446985
A946: =R[-1]C+1 -> 946 | B946: =SUM(R1C[-1]:RC1) -> 447931
A947: =R[-1]C+1 -> 947 | B947: =SUM(R1C[-1]:RC1) -> 448878
A948: =R[-1]C+1 -> 948 | B948: =SUM(R1C[-1]:RC1) -> 449826
A949: =R[-1]C+1 -> 949 | B949: =SUM(R1C[-1]:RC1) -> 450775
A950: =R[-1]C+1 -> 950 | B950: =SUM(R1C[-1]:RC1) -> 451725
A951: =R[-1]C+1 -> 951 | B951: =SUM(R1C[-1]:RC1) -> 452676
A952: =R[-1]C+1 -> 952 | B952: =SUM(R1C[-1]:RC1) -> 453628
A953: =R[-1]C+1 -> 953 | B953: =SUM(R1C[-1]:RC1) -> 454581
A954: =R[-1]C+1 -> 954 | B954: =SUM(R1C[-1]:RC1) -> 455535
A955: =R[-1]C+1 -> 955 | B955: =SUM(R1C[-1]:RC1) -> 456490
A956: =R[-1]C+1 -> 956 | B956: =SUM(R1C[-1]:RC1) -> 457446
A957: =R[-1]C+1 -> 957 | B957: =SUM(R1C[-1]:RC1) -> 458403
A958: =R[-1]C+1 -> 958 | B958: =SUM(R1C[-1]:RC1) -> 459361
A959: =R[-1]C+1 -> 959 | B959: =SUM(R1C[-1]:RC1) -> 460320
A960: =R[-1]C+1 -> 960 | B960: =SUM(R1C[-1]:RC1) -> 461280
A961: =R[-1]C+1 -> 961 | B961: =SUM(R1C[-1]:RC1) -> 462241
A962: =R[-1]C+1 -> 962 | B962: =SUM(R1C[-1]:RC1) -> 463203
A963: =R[-1]C+1 -> 963 | B963: =SUM(R1C[-1]:RC1) -> 464166
A964: =R[-1]C+1 -> 964 | B964: =SUM(R1C[-1]:RC1) -> 465130
A965: =R[-1]C+1 -> 965 | B965: =SUM(R1C[-1]:RC1) -> 466095
A966: =R[-1]C+1 -> 966 | B966: =SUM(R1C[-1]:RC1) -> 467061
A967: =R[-1]C+1 -> 967 | B967: =SUM(R1C[-1]:RC1) -> 468028
A968: =R[-1]C+1 -> 968 | B968: =SUM(R1C[-1]:RC1) -> 468996
A969: =R[-1]C+1 -> 969 | B969: =SUM(R1C[-1]:RC1) -> 469965
A970: =R[-1]C+1 -> 970 | B970: =SUM(R1C[-1]:RC1) -> 470935
A971: =R[-1]C+1 -> 971 | B971: =SUM(R1C[-1]:RC1) -> 471906
A972: =R[-1]C+1 -> 972 | B972: =SUM(R1C[-1]:RC1) -> 472878
A973: =R[-1]C+1 -> 973 | B973: =SUM(R1C[-1]:RC1) -> 473851
A974: =R[-1]C+1 -> 974 | B974: =SUM(R1C[-1]:RC1) -> 474825
A975: =R[-1]C+1 -> 975 | B975: =SUM(R1C[-1]:RC1) -> 475800
A976: =R[-1]C+1 -> 976 | B976: =SUM(R1C[-1]:RC1) -> 476776
A977: =R[-1]C+1 -> 977 | B977: =SUM(R1C[-1]:RC1) -> 477753
A978: =R[-1]C+1 -> 978 | B978: =SUM(R1C[-1]:RC1) -> 478731
A979: =R[-1]C+1 -> 979 | B979: =SUM(R1C[-1]:RC1) -> 479710
A980: =R[-1]C+1 -> 980 | B980: =SUM(R1C[-1]:RC1) -> 480690
A981: =R[-1]C+1 -> 981 | B981: =SUM(R1C[-1]:RC1) -> 481671
A982: =R[-1]C+1 -> 982 | B982: =SUM(R1C[-1]:RC1) -> 482653
A983: =R[-1]C+1 -> 983 | B983: =SUM(R1C[-1]:RC1) -> 483636
A984: =R[-1]C+1 -> 984 | B984: =SUM(R1C[-1]:RC1) -> 484620
A985: =R[-1]C+1 -> 985 | B985: =SUM(R1C[-1]:RC1) -> 485605
A986: =R[-1]C+1 -> 986 | B986: =SUM(R1C[-1]:RC1) -> 486591
A987: =R[-1]C+1 -> 987 | B987: =SUM(R1C[-1]:RC1) -> 487578
A988: =R[-1]C+1 -> 988 | B988: =SUM(R1C[-1]:RC1) -> 488566
A989: =R[-1]C+1 -> 989 | B989: =SUM(R1C[-1]:RC1) -> 489555
A990: =R[-1]C+1 -> 990 | B990: =SUM(R1C[-1]:RC1) -> 490545
A991: =R[-1]C+1 -> 991 | B991: =SUM(R1C[-1]:RC1) -> 491536
A992: =R[-1]C+1 -> 992 | B992: =SUM(R1C[-1]:RC1) -> 492528
A993: =R[-1]C+1 -> 993 | B993: =SUM(R1C[-1]:RC1) -> 493521
A994: =R[-1]C+1 -> 994 | B994: =SUM(R1C[-1]:RC1) -> 494515
A995: =R[-1]C+1 -> 995 | B995: =SUM(R1C[-1]:RC1) -> 495510
A996: =R[-1]C+1 -> 996 | B996: =SUM(R1C[-1]:RC1) -> 496506
A997: =R[-1]C+1 -> 997 | B997: =SUM(R1C[-1]:RC1) -> 497503
A998: =R[-1]C+1 -> 998 | B998: =SUM(R1C[-1]:RC1) -> 498501
A999: =R[-1]C+1 -> 999 | B999: =SUM(R1C[-1]:RC1) -> 499500
A1000: =R[-1]C+1 -> 1000 | B1000: =SUM(R1C[-1]:RC1) -> 500500
A1001: =R[-1]C+1 -> 1001 | B1001: =SUM(R1C[-1]:RC1) -> 501501
A1002: =R[-1]C+1 -> 1002 | B1002: =SUM(R1C[-1]:RC1) -> 502503
A1003: =R[-1]C+1 -> 1003 | B1003: =SUM(R1C[-1]:RC1) -> 503506
A1004: =R[-1]C+1 -> 1004 | B1004: =SUM(R1C[-1]:RC1) -> 504510
A1005: =R[-1]C+1 -> 1005 | B1005: =SUM(R1C[-1]:RC1) -> 505515
A1006: =R[-1]C+1 -> 1006 | B1006: =SUM(R1C[-1]:RC1) -> 506521
A1007: =R[-1]C+1 -> 1007 | B1007: =SUM(R1C[-1]:RC1) -> 507528
A1008: =R[-1]C+1 -> 1008 | B1008: =SUM(R1C[-1]:RC1) -> 508536
A1009: =R[-1]C+1 -> 1009 | B1009: =SUM(R1C[-1]:RC1) -> 509545
A1010: =R[-1]C+1 -> 1010 | B1010: =SUM(R1C[-1]:RC1) -> 510555
A1011: =R[-1]C+1 -> 1011 | B1011: =SUM(R1C[-1]:RC1) -> 511566
A1012: =R[-1]C+1 -> 1012 | B1012: =SUM(R1C[-1]:RC1) -> 512578
A1013: =R[-1]C+1 -> 1013 | B1013: =SUM(R1C[-1]:RC1) -> 513591
A1014: =R[-1]C+1 -> 1014 | B1014: =SUM(R1C[-1]:RC1) -> 514605
A1015: =R[-1]C+1 -> 1015 | B1015: =SUM(R1C[-1]:RC1) -> 515620
A1016: =R[-1]C+1 -> 1016 | B1016: =SUM(R1C[-1]:RC1) -> 516636
A1017: =R[-1]C+1 -> 1017 | B1017: =SUM(R1C[-1]:RC1) -> 517653
A1018: =R[-1]C+1 -> 1018 | B1018: =SUM(R1C[-1]:RC1) -> 518671
A1019: =R[-1]C+1 -> 1019 | B1019: =SUM(R1C[-1]:RC1) -> 519690
A1020: =R[-1]C+1 -> 1020 | B1020: =SUM(R1C[-1]:RC1) -> 520710
A1021: =R[-1]C+1 -> 1021 | B1021: =SUM(R1C[-1]:RC1) -> 521731
A1022: =R[-1]C+1 -> 1022 | B1022: =SUM(R1C[-1]:RC1) -> 522753
A1023: =R[-1]C+1 -> 1023 | B1023: =SUM(R1C[-1]:RC1) -> 523776
A1024: =R[-1]C+1 -> 1024 | B1024: =SUM(R1C[-1]:RC1) -> 524800
A1025: =R[-1]C+1 -> 1025 | B1025: =SUM(R1C[-1]:RC1) -> 525825
A1026: =R[-1]C+1 -> 1026 | B1026: =SUM(R1C[-1]:RC1) -> 526851
A1027: =R[-1]C+1 -> 1027 | B1027: =SUM(R1C[-1]:RC1) -> 527878
A1028: =R[-1]C+1 -> 1028 | B1028: =SUM(R1C[-1]:RC1) -> 528906
A1029: =R[-1]C+1 -> 1029 | B1029: =SUM(R1C[-1]:RC1) -> 529935
A1030: =R[-1]C+1 -> 1030 | B1030: =SUM(R1C[-1]:RC1) -> 530965
A1031: =R[-1]C+1 -> 1031 | B1031: =SUM(R1C[-1]:RC1) -> 531996
A1032: =R[-1]C+1 -> 1032 | B1032: =SUM(R1C[-1]:RC1) -> 533028
A1033: =R[-1]C+1 -> 1033 | B1033: =SUM(R1C[-1]:RC1) -> 534061
A1034: =R[-1]C+1 -> 1034 | B1034: =SUM(R1C[-1]:RC1) -> 535095
A1035: =R[-1]C+1 -> 1035 | B1035: =SUM(R1C[-1]:RC1) -> 536130
A1036: =R[-1]C+1 -> 1036 | B1036: =SUM(R1C[-1]:RC1) -> 537166
A1037: =R[-1]C+1 -> 1037 | B1037: =SUM(R1C[-1]:RC1) -> 538203
A1038: =R[-1]C+1 -> 1038 | B1038: =SUM(R1C[-1]:RC1) -> 539241
A1039: =R[-1]C+1 -> 1039 | B1039: =SUM(R1C[-1]:RC1) -> 540280
A1040: =R[-1]C+1 -> 1040 | B1040: =SUM(R1C[-1]:RC1) -> 541320
A1041: =R[-1]C+1 -> 1041 | B1041: =SUM(R1C[-1]:RC1) -> 542361
A1042: =R[-1]C+1 -> 1042 | B1042: =SUM(R1C[-1]:RC1) -> 543403
A1043: =R[-1]C+1 -> 1043 | B1043: =SUM(R1C[-1]:RC1) -> 544446
A1044: =R[-1]C+1 -> 1044 | B1044: =SUM(R1C[-1]:RC1) -> 545490
A1045: =R[-1]C+1 -> 1045 | B1045: =SUM(R1C[-1]:RC1) -> 546535
A1046: =R[-1]C+1 -> 1046 | B1046: =SUM(R1C[-1]:RC1) -> 547581
A1047: =R[-1]C+1 -> 1047 | B1047: =SUM(R1C[-1]:RC1) -> 548628
A1048: =R[-1]C+1 -> 1048 | B1048: =SUM(R1C[-1]:RC1) -> 549676
A1049: =R[-1]C+1 -> 1049 | B1049: =SUM(R1C[-1]:RC1) -> 550725
A1050: =R[-1]C+1 -> 1050 | B1050: =SUM(R1C[-1]:RC1) -> 551775
A1051: =R[-1]C+1 -> 1051 | B1051: =SUM(R1C[-1]:RC1) -> 552826
A1052: =R[-1]C+1 -> 1052 | B1052: =SUM(R1C[-1]:RC1) -> 553878
A1053: =R[-1]C+1 -> 1053 | B1053: =SUM(R1C[-1]:RC1) -> 554931
A1054: =R[-1]C+1 -> 1054 | B1054: =SUM(R1C[-1]:RC1) -> 555985
A1055: =R[-1]C+1 -> 1055 | B1055: =SUM(R1C[-1]:RC1) -> 557040
A1056: =R[-1]C+1 -> 1056 | B1056: =SUM(R1C[-1]:RC1) -> 558096
A1057: =R[-1]C+1 -> 1057 | B1057: =SUM(R1C[-1]:RC1) -> 559153
A1058: =R[-1]C+1 -> 1058 | B1058: =SUM(R1C[-1]:RC1) -> 560211
A1059: =R[-1]C+1 -> 1059 | B1059: =SUM(R1C[-1]:RC1) -> 561270
A1060: =R[-1]C+1 -> 1060 | B1060: =SUM(R1C[-1]:RC1) -> 562330
A1061: =R[-1]C+1 -> 1061 | B1061: =SUM(R1C[-1]:RC1) -> 563391
A1062: =R[-1]C+1 -> 1062 | B1062: =SUM(R1C[-1]:RC1) -> 564453
A1063: =R[-1]C+1 -> 1063 | B1063: =SUM(R1C[-1]:RC1) -> 565516
A1064: =R[-1]C+1 -> 1064 | B1064: =SUM(R1C[-1]:RC1) -> 566580
A1065: =R[-1]C+1 -> 1065 | B1065: =SUM(R1C[-1]:RC1) -> 567645
A1066: =R[-1]C+1 -> 1066 | B1066: =SUM(R1C[-1]:RC1) -> 568711
A1067: =R[-1]C+1 -> 1067 | B1067: =SUM(R1C[-1]:RC1) -> 569778
A1068: =R[-1]C+1 -> 1068 | B1068: =SUM(R1C[-1]:RC1) -> 570846
A1069: =R[-1]C+1 -> 1069 | B1069: =SUM(R1C[-1]:RC1) -> 571915
A1070: =R[-1]C+1 -> 1070 | B1070: =SUM(R1C[-1]:RC1) -> 572985
A1071: =R[-1]C+1 -> 1071 | B1071: =SUM(R1C[-1]:RC1) -> 574056
A1072: =R[-1]C+1 -> 1072 | B1072: =SUM(R1C[-1]:RC1) -> 575128
A1073: =R[-1]C+1 -> 1073 | B1073: =SUM(R1C[-1]:RC1) -> 576201
A1074: =R[-1]C+1 -> 1074 | B1074: =SUM(R1C[-1]:RC1) -> 577275
A1075: =R[-1]C+1 -> 1075 | B1075: =SUM(R1C[-1]:RC1) -> 578350
A1076: =R[-1]C+1 -> 1076 | B1076: =SUM(R1C[-1]:RC1) -> 579426
A1077: =R[-1]C+1 -> 1077 | B1077: =SUM(R1C[-1]:RC1) -> 580503
A1078: =R[-1]C+1 -> 1078 | B1078: =SUM(R1C[-1]:RC1) -> 581581
A1079: =R[-1]C+1 -> 1079 | B1079: =SUM(R1C[-1]:RC1) -> 582660
A1080: =R[-1]C+1 -> 1080 | B1080: =SUM(R1C[-1]:RC1) -> 583740
A1081: =R[-1]C+1 -> 1081 | B1081: =SUM(R1C[-1]:RC1) -> 584821
A1082: =R[-1]C+1 -> 1082 | B1082: =SUM(R1C[-1]:RC1) -> 585903
A1083: =R[-1]C+1 -> 1083 | B1083: =SUM(R1C[-1]:RC1) -> 586986
A1084: =R[-1]C+1 -> 1084 | B1084: =SUM(R1C[-1]:RC1) -> 588070
A1085: =R[-1]C+1 -> 1085 | B1085: =SUM(R1C[-1]:RC1) -> 589155
A1086: =R[-1]C+1 -> 1086 | B1086: =SUM(R1C[-1]:RC1) -> 590241
A1087: =R[-1]C+1 -> 1087 | B1087: =SUM(R1C[-1]:RC1) -> 591328
A1088: =R[-1]C+1 -> 1088 | B1088: =SUM(R1C[-1]:RC1) -> 592416
A1089: =R[-1]C+1 -> 1089 | B1089: =SUM(R1C[-1]:RC1) -> 593505
A1090: =R[-1]C+1 -> 1090 | B1090: =SUM(R1C[-1]:RC1) -> 594595
A1091: =R[-1]C+1 -> 1091 | B1091: =SUM(R1C[-1]:RC1) -> 595686
A1092: =R[-1]C+1 -> 1092 | B1092: =SUM(R1C[-1]:RC1) -> 596778
A1093: =R[-1]C+1 -> 1093 | B1093: =SUM(R1C[-1]:RC1) -> 597871
A1094: =R[-1]C+1 -> 1094 | B1094: =SUM(R1C[-1]:RC1) -> 598965
A1095: =R[-1]C+1 -> 1095 | B1095: =SUM(R1C[-1]:RC1) -> 600060
A1096: =R[-1]C+1 -> 1096 | B1096: =SUM(R1C[-1]:RC1) -> 601156
A1097: =R[-1]C+1 -> 1097 | B1097: =SUM(R1C[-1]:RC1) -> 602253
A1098: =R[-1]C+1 -> 1098 | B1098: =SUM(R1C[-1]:RC1) -> 603351
A1099: =R[-1]C+1 -> 1099 | B1099: =SUM(R1C[-1]:RC1) -> 604450
A1100: =R[-1]C+1 -> 1100 | B1100: =SUM(R1C[-1]:RC1) -> 605550
A1101: =R[-1]C+1 -> 1101 | B1101: =SUM(R1C[-1]:RC1) -> 606651
A1102: =R[-1]C+1 -> 1102 | B1102: =SUM(R1C[-1]:RC1) -> 607753
A1103: =R[-1]C+1 -> 1103 | B1103: =SUM(R1C[-1]:RC1) -> 608856
A1104: =R[-1]C+1 -> 1104 | B1104: =SUM(R1C[-1]:RC1) -> 609960
A1105: =R[-1]C+1 -> 1105 | B1105: =SUM(R1C[-1]:RC1) -> 611065
A1106: =R[-1]C+1 -> 1106 | B1106: =SUM(R1C[-1]:RC1) -> 612171
A1107: =R[-1]C+1 -> 1107 | B1107: =SUM(R1C[-1]:RC1) -> 613278
A1108: =R[-1]C+1 -> 1108 | B1108: =SUM(R1C[-1]:RC1) -> 614386
A1109: =R[-1]C+1 -> 1109 | B1109: =SUM(R1C[-1]:RC1) -> 615495
A1110: =R[-1]C+1 -> 1110 | B1110: =SUM(R1C[-1]:RC1) -> 616605
A1111: =R[-1]C+1 -> 1111 | B1111: =SUM(R1C[-1]:RC1) -> 617716
A1112: =R[-1]C+1 -> 1112 | B1112: =SUM(R1C[-1]:RC1) -> 618828
A1113: =R[-1]C+1 -> 1113 | B1113: =SUM(R1C[-1]:RC1) -> 619941
A1114: =R[-1]C+1 -> 1114 | B1114: =SUM(R1C[-1]:RC1) -> 621055
A1115: =R[-1]C+1 -> 1115 | B1115: =SUM(R1C[-1]:RC1) -> 622170
A1116: =R[-1]C+1 -> 1116 | B1116: =SUM(R1C[-1]:RC1) -> 623286
A1117: =R[-1]C+1 -> 1117 | B1117: =SUM(R1C[-1]:RC1) -> 624403
A1118: =R[-1]C+1 -> 1118 | B1118: =SUM(R1C[-1]:RC1) -> 625521
A1119: =R[-1]C+1 -> 1119 | B1119: =SUM(R1C[-1]:RC1) -> 626640
A1120: =R[-1]C+1 -> 1120 | B1120: =SUM(R1C[-1]:RC1) -> 627760
A1121: =R[-1]C+1 -> 1121 | B1121: =SUM(R1C[-1]:RC1) -> 628881
A1122: =R[-1]C+1 -> 1122 | B1122: =SUM(R1C[-1]:RC1) -> 630003
A1123: =R[-1]C+1 -> 1123 | B1123: =SUM(R1C[-1]:RC1) -> 631126
A1124: =R[-1]C+1 -> 1124 | B1124: =SUM(R1C[-1]:RC1) -> 632250
A1125: =R[-1]C+1 -> 1125 | B1125: =SUM(R1C[-1]:RC1) -> 633375
A1126: =R[-1]C+1 -> 1126 | B1126: =SUM(R1C[-1]:RC1) -> 634501
A1127: =R[-1]C+1 -> 1127 | B1127: =SUM(R1C[-1]:RC1) -> 635628
A1128: =R[-1]C+1 -> 1128 | B1128: =SUM(R1C[-1]:RC1) -> 636756
A1129: =R[-1]C+1 -> 1129 | B1129: =SUM(R1C[-1]:RC1) -> 637885
A1130: =R[-1]C+1 -> 1130 | B1130: =SUM(R1C[-1]:RC1) -> 639015
A1131: =R[-1]C+1 -> 1131 | B1131: =SUM(R1C[-1]:RC1) -> 640146
A1132: =R[-1]C+1 -> 1132 | B1132: =SUM(R1C[-1]:RC1) -> 641278
A1133: =R[-1]C+1 -> 1133 | B1133: =SUM(R1C[-1]:RC1) -> 642411
A1134: =R[-1]C+1 -> 1134 | B1134: =SUM(R1C[-1]:RC1) -> 643545
A1135: =R[-1]C+1 -> 1135 | B1135: =SUM(R1C[-1]:RC1) -> 644680
A1136: =R[-1]C+1 -> 1136 | B1136: =SUM(R1C[-1]:RC1) -> 645816
A1137: =R[-1]C+1 -> 1137 | B1137: =SUM(R1C[-1]:RC1) -> 646953
A1138: =R[-1]C+1 -> 1138 | B1138: =SUM(R1C[-1]:RC1) -> 648091
A1139: =R[-1]C+1 -> 1139 | B1139: =SUM(R1C[-1]:RC1) -> 649230
A1140: =R[-1]C+1 -> 1140 | B1140: =SUM(R1C[-1]:RC1) -> 650370
A1141: =R[-1]C+1 -> 1141 | B1141: =SUM(R1C[-1]:RC1) -> 651511
A1142: =R[-1]C+1 -> 1142 | B1142: =SUM(R1C[-1]:RC1) -> 652653
A1143: =R[-1]C+1 -> 1143 | B1143: =SUM(R1C[-1]:RC1) -> 653796
A1144: =R[-1]C+1 -> 1144 | B1144: =SUM(R1C[-1]:RC1) -> 654940
A1145: =R[-1]C+1 -> 1145 | B1145: =SUM(R1C[-1]:RC1) -> 656085
A1146: =R[-1]C+1 -> 1146 | B1146: =SUM(R1C[-1]:RC1) -> 657231
A1147: =R[-1]C+1 -> 1147 | B1147: =SUM(R1C[-1]:RC1) -> 658378
A1148: =R[-1]C+1 -> 1148 | B1148: =SUM(R1C[-1]:RC1) -> 659526
A1149: =R[-1]C+1 -> 1149 | B1149: =SUM(R1C[-1]:RC1) -> 660675
A1150: =R[-1]C+1 -> 1150 | B1150: =SUM(R1C[-1]:RC1) -> 661825
A1151: =R[-1]C+1 -> 1151 | B1151: =SUM(R1C[-1]:RC1) -> 662976
A1152: =R[-1]C+1 -> 1152 | B1152: =SUM(R1C[-1]:RC1) -> 664128
A1153: =R[-1]C+1 -> 1153 | B1153: =SUM(R1C[-1]:RC1) -> 665281
A1154: =R[-1]C+1 -> 1154 | B1154: =SUM(R1C[-1]:RC1) -> 666435
A1155: =R[-1]C+1 -> 1155 | B1155: =SUM(R1C[-1]:RC1) -> 667590
A1156: =R[-1]C+1 -> 1156 | B1156: =SUM(R1C[-1]:RC1) -> 668746
A1157: =R[-1]C+1 -> 1157 | B1157: =SUM(R1C[-1]:RC1) -> 669903
A1158: =R[-1]C+1 -> 1158 | B1158: =SUM(R1C[-1]:RC1) -> 671061
A1159: =R[-1]C+1 -> 1159 | B1159: =SUM(R1C[-1]:RC1) -> 672220
A1160: =R[-1]C+1 -> 1160 | B1160: =SUM(R1C[-1]:RC1) -> 673380
A1161: =R[-1]C+1 -> 1161 | B1161: =SUM(R1C[-1]:RC1) -> 674541
A1162: =R[-1]C+1 -> 1162 | B1162: =SUM(R1C[-1]:RC1) -> 675703
A1163: =R[-1]C+1 -> 1163 | B1163: =SUM(R1C[-1]:RC1) -> 676866
A1164: =R[-1]C+1 -> 1164 | B1164: =SUM(R1C[-1]:RC1) -> 678030
A1165: =R[-1]C+1 -> 1165 | B1165: =SUM(R1C[-1]:RC1) -> 679195
A1166: =R[-1]C+1 -> 1166 | B1166: =SUM(R1C[-1]:RC1) -> 680361
A1167: =R[-1]C+1 -> 1167 | B1167: =SUM(R1C[-1]:RC1) -> 681528
A1168: =R[-1]C+1 -> 1168 | B1168: =SUM(R1C[-1]:RC1) -> 682696
A1169: =R[-1]C+1 -> 1169 | B1169: =SUM(R1C[-1]:RC1) -> 683865
A1170: =R[-1]C+1 -> 1170 | B1170: =SUM(R1C[-1]:RC1) -> 685035
A1171: =R[-1]C+1 -> 1171 | B1171: =SUM(R1C[-1]:RC1) -> 686206
A1172: =R[-1]C+1 -> 1172 | B1172: =SUM(R1C[-1]:RC1) -> 687378
A1173: =R[-1]C+1 -> 1173 | B1173: =SUM(R1C[-1]:RC1) -> 688551
A1174: =R[-1]C+1 -> 1174 | B1174: =SUM(R1C[-1]:RC1) -> 689725
A1175: =R[-1]C+1 -> 1175 | B1175: =SUM(R1C[-1]:RC1) -> 690900
A1176: =R[-1]C+1 -> 1176 | B1176: =SUM(R1C[-1]:RC1) -> 692076
A1177: =R[-1]C+1 -> 1177 | B1177: =SUM(R1C[-1]:RC1) -> 693253
A1178: =R[-1]C+1 -> 1178 | B1178: =SUM(R1C[-1]:RC1) -> 694431
A1179: =R[-1]C+1 -> 1179 | B1179: =SUM(R1C[-1]:RC1) -> 695610
A1180: =R[-1]C+1 -> 1180 | B1180: =SUM(R1C[-1]:RC1) -> 696790
A1181: =R[-1]C+1 -> 1181 | B1181: =SUM(R1C[-1]:RC1) -> 697971
A1182: =R[-1]C+1 -> 1182 | B1182: =SUM(R1C[-1]:RC1) -> 699153
A1183: =R[-1]C+1 -> 1183 | B1183: =SUM(R1C[-1]:RC1) -> 700336
A1184: =R[-1]C+1 -> 1184 | B1184: =SUM(R1C[-1]:RC1) -> 701520
A1185: =R[-1]C+1 -> 1185 | B1185: =SUM(R1C[-1]:RC1) -> 702705
A1186: =R[-1]C+1 -> 1186 | B1186: =SUM(R1C[-1]:RC1) -> 703891
A1187: =R[-1]C+1 -> 1187 | B1187: =SUM(R1C[-1]:RC1) -> 705078
A1188: =R[-1]C+1 -> 1188 | B1188: =SUM(R1C[-1]:RC1) -> 706266
A1189: =R[-1]C+1 -> 1189 | B1189: =SUM(R1C[-1]:RC1) -> 707455
A1190: =R[-1]C+1 -> 1190 | B1190: =SUM(R1C[-1]:RC1) -> 708645
A1191: =R[-1]C+1 -> 1191 | B1191: =SUM(R1C[-1]:RC1) -> 709836
A1192: =R[-1]C+1 -> 1192 | B1192: =SUM(R1C[-1]:RC1) -> 711028
A1193: =R[-1]C+1 -> 1193 | B1193: =SUM(R1C[-1]:RC1) -> 712221
A1194: =R[-1]C+1 -> 1194 | B1194: =SUM(R1C[-1]:RC1) -> 713415
A1195: =R[-1]C+1 -> 1195 | B1195: =SUM(R1C[-1]:RC1) -> 714610
A1196: =R[-1]C+1 -> 1196 | B1196: =SUM(R1C[-1]:RC1) -> 715806
A1197: =R[-1]C+1 -> 1197 | B1197: =SUM(R1C[-1]:RC1) -> 717003
A1198: =R[-1]C+1 -> 1198 | B1198: =SUM(R1C[-1]:RC1) -> 718201
A1199: =R[-1]C+1 -> 1199 | B1199: =SUM(R1C[-1]:RC1) -> 719400
A1200: =R[-1]C+1 -> 1200 | B1200: =SUM(R1C[-1]:RC1) -> 720600
A1201: =R[-1]C+1 -> 1201 | B1201: =SUM(R1C[-1]:RC1) -> 721801
A1202: =R[-1]C+1 -> 1202 | B1202: =SUM(R1C[-1]:RC1) -> 723003
A1203: =R[-1]C+1 -> 1203 | B1203: =SUM(R1C[-1]:RC1) -> 724206
A1204: =R[-1]C+1 -> 1204 | B1204: =SUM(R1C[-1]:RC1) -> 725410
A1205: =R[-1]C+1 -> 1205 | B1205: =SUM(R1C[-1]:RC1) -> 726615
A1206: =R[-1]C+1 -> 1206 | B1206: =SUM(R1C[-1]:RC1) -> 727821
A1207: =R[-1]C+1 -> 1207 | B1207: =SUM(R1C[-1]:RC1) -> 729028
A1208: =R[-1]C+1 -> 1208 | B1208: =SUM(R1C[-1]:RC1) -> 730236
A1209: =R[-1]C+1 -> 1209 | B1209: =SUM(R1C[-1]:RC1) -> 731445
A1210: =R[-1]C+1 -> 1210 | B1210: =SUM(R1C[-1]:RC1) -> 732655
A1211: =R[-1]C+1 -> 1211 | B1211: =SUM(R1C[-1]:RC1) -> 733866
A1212: =R[-1]C+1 -> 1212 | B1212: =SUM(R1C[-1]:RC1) -> 735078
A1213: =R[-1]C+1 -> 1213 | B1213: =SUM(R1C[-1]:RC1) -> 736291
A1214: =R[-1]C+1 -> 1214 | B1214: =SUM(R1C[-1]:RC1) -> 737505
A1215: =R[-1]C+1 -> 1215 | B1215: =SUM(R1C[-1]:RC1) -> 738720
A1216: =R[-1]C+1 -> 1216 | B1216: =SUM(R1C[-1]:RC1) -> 739936
A1217: =R[-1]C+1 -> 1217 | B1217: =SUM(R1C[-1]:RC1) -> 741153
A1218: =R[-1]C+1 -> 1218 | B1218: =SUM(R1C[-1]:RC1) -> 742371
A1219: =R[-1]C+1 -> 1219 | B1219: =SUM(R1C[-1]:RC1) -> 743590
A1220: =R[-1]C+1 -> 1220 | B1220: =SUM(R1C[-1]:RC1) -> 744810
A1221: =R[-1]C+1 -> 1221 | B1221: =SUM(R1C[-1]:RC1) -> 746031
A1222: =R[-1]C+1 -> 1222 | B1222: =SUM(R1C[-1]:RC1) -> 747253
A1223: =R[-1]C+1 -> 1223 | B1223: =SUM(R1C[-1]:RC1) -> 748476
A1224: =R[-1]C+1 -> 1224 | B1224: =SUM(R1C[-1]:RC1) -> 749700
A1225: =R[-1]C+1 -> 1225 | B1225: =SUM(R1C[-1]:RC1) -> 750925
A1226: =R[-1]C+1 -> 1226 | B1226: =SUM(R1C[-1]:RC1) -> 752151
A1227: =R[-1]C+1 -> 1227 | B1227: =SUM(R1C[-1]:RC1) -> 753378
A1228: =R[-1]C+1 -> 1228 | B1228: =SUM(R1C[-1]:RC1) -> 754606
A1229: =R[-1]C+1 -> 1229 | B1229: =SUM(R1C[-1]:RC1) -> 755835
A1230: =R[-1]C+1 -> 1230 | B1230: =SUM(R1C[-1]:RC1) -> 757065
A1231: =R[-1]C+1 -> 1231 | B1231: =SUM(R1C[-1]:RC1) -> 758296
A1232: =R[-1]C+1 -> 1232 | B1232: =SUM(R1C[-1]:RC1) -> 759528
A1233: =R[-1]C+1 -> 1233 | B1233: =SUM(R1C[-1]:RC1) -> 760761
A1234: =R[-1]C+1 -> 1234 | B1234: =SUM(R1C[-1]:RC1) -> 761995
A1235: =R[-1]C+1 -> 1235 | B1235: =SUM(R1C[-1]:RC1) -> 763230
A1236: =R[-1]C+1 -> 1236 | B1236: =SUM(R1C[-1]:RC1) -> 764466
A1237: =R[-1]C+1 -> 1237 | B1237: =SUM(R1C[-1]:RC1) -> 765703
A1238: =R[-1]C+1 -> 1238 | B1238: =SUM(R1C[-1]:RC1) -> 766941
A1239: =R[-1]C+1 -> 1239 | B1239: =SUM(R1C[-1]:RC1) -> 768180
A1240: =R[-1]C+1 -> 1240 | B1240: =SUM(R1C[-1]:RC1) -> 769420
A1241: =R[-1]C+1 -> 1241 | B1241: =SUM(R1C[-1]:RC1) -> 770661
A1242: =R[-1]C+1 -> 1242 | B1242: =SUM(R1C[-1]:RC1) -> 771903
A1243: =R[-1]C+1 -> 1243 | B1243: =SUM(R1C[-1]:RC1) -> 773146
A1244: =R[-1]C+1 -> 1244 | B1244: =SUM(R1C[-1]:RC1) -> 774390
A1245: =R[-1]C+1 -> 1245 | B1245: =SUM(R1C[-1]:RC1) -> 775635
A1246: =R[-1]C+1 -> 1246 | B1246: =SUM(R1C[-1]:RC1) -> 776881
A1247: =R[-1]C+1 -> 1247 | B1247: =SUM(R1C[-1]:RC1) -> 778128
A1248: =R[-1]C+1 -> 1248 | B1248: =SUM(R1C[-1]:RC1) -> 779376
A1249: =R[-1]C+1 -> 1249 | B1249: =SUM(R1C[-1]:RC1) -> 780625
A1250: =R[-1]C+1 -> 1250 | B1250: =SUM(R1C[-1]:RC1) -> 781875
A1251: =R[-1]C+1 -> 1251 | B1251: =SUM(R1C[-1]:RC1) -> 783126
A1252: =R[-1]C+1 -> 1252 | B1252: =SUM(R1C[-1]:RC1) -> 784378
A1253: =R[-1]C+1 -> 1253 | B1253: =SUM(R1C[-1]:RC1) -> 785631
A1254: =R[-1]C+1 -> 1254 | B1254: =SUM(R1C[-1]:RC1) -> 786885
A1255: =R[-1]C+1 -> 1255 | B1255: =SUM(R1C[-1]:RC1) -> 788140
A1256: =R[-1]C+1 -> 1256 | B1256: =SUM(R1C[-1]:RC1) -> 789396
A1257: =R[-1]C+1 -> 1257 | B1257: =SUM(R1C[-1]:RC1) -> 790653
A1258: =R[-1]C+1 -> 1258 | B1258: =SUM(R1C[-1]:RC1) -> 791911
A1259: =R[-1]C+1 -> 1259 | B1259: =SUM(R1C[-1]:RC1) -> 793170
A1260: =R[-1]C+1 -> 1260 | B1260: =SUM(R1C[-1]:RC1) -> 794430
A1261: =R[-1]C+1 -> 1261 | B1261: =SUM(R1C[-1]:RC1) -> 795691
A1262: =R[-1]C+1 -> 1262 | B1262: =SUM(R1C[-1]:RC1) -> 796953
A1263: =R[-1]C+1 -> 1263 | B1263: =SUM(R1C[-1]:RC1) -> 798216
A1264: =R[-1]C+1 -> 1264 | B1264: =SUM(R1C[-1]:RC1) -> 799480
A1265: =R[-1]C+1 -> 1265 | B1265: =SUM(R1C[-1]:RC1) -> 800745
A1266: =R[-1]C+1 -> 1266 | B1266: =SUM(R1C[-1]:RC1) -> 802011
A1267: =R[-1]C+1 -> 1267 | B1267: =SUM(R1C[-1]:RC1) -> 803278
A1268: =R[-1]C+1 -> 1268 | B1268: =SUM(R1C[-1]:RC1) -> 804546
A1269: =R[-1]C+1 -> 1269 | B1269: =SUM(R1C[-1]:RC1) -> 805815
A1270: =R[-1]C+1 -> 1270 | B1270: =SUM(R1C[-1]:RC1) -> 807085
A1271: =R[-1]C+1 -> 1271 | B1271: =SUM(R1C[-1]:RC1) -> 808356
A1272: =R[-1]C+1 -> 1272 | B1272: =SUM(R1C[-1]:RC1) -> 809628
A1273: =R[-1]C+1 -> 1273 | B1273: =SUM(R1C[-1]:RC1) -> 810901
A1274: =R[-1]C+1 -> 1274 | B1274: =SUM(R1C[-1]:RC1) -> 812175
A1275: =R[-1]C+1 -> 1275 | B1275: =SUM(R1C[-1]:RC1) -> 813450
A1276: =R[-1]C+1 -> 1276 | B1276: =SUM(R1C[-1]:RC1) -> 814726
A1277: =R[-1]C+1 -> 1277 | B1277: =SUM(R1C[-1]:RC1) -> 816003
A1278: =R[-1]C+1 -> 1278 | B1278: =SUM(R1C[-1]:RC1) -> 817281
A1279: =R[-1]C+1 -> 1279 | B1279: =SUM(R1C[-1]:RC1) -> 818560
A1280: =R[-1]C+1 -> 1280 | B1280: =SUM(R1C[-1]:RC1) -> 819840
A1281: =R[-1]C+1 -> 1281 | B1281: =SUM(R1C[-1]:RC1) -> 821121
A1282: =R[-1]C+1 -> 1282 | B1282: =SUM(R1C[-1]:RC1) -> 822403
A1283: =R[-1]C+1 -> 1283 | B1283: =SUM(R1C[-1]:RC1) -> 823686
A1284: =R[-1]C+1 -> 1284 | B1284: =SUM(R1C[-1]:RC1) -> 824970
A1285: =R[-1]C+1 -> 1285 | B1285: =SUM(R1C[-1]:RC1) -> 826255
A1286: =R[-1]C+1 -> 1286 | B1286: =SUM(R1C[-1]:RC1) -> 827541
A1287: =R[-1]C+1 -> 1287 | B1287: =SUM(R1C[-1]:RC1) -> 828828
A1288: =R[-1]C+1 -> 1288 | B1288: =SUM(R1C[-1]:RC1) -> 830116
A1289: =R[-1]C+1 -> 1289 | B1289: =SUM(R1C[-1]:RC1) -> 831405
A1290: =R[-1]C+1 -> 1290 | B1290: =SUM(R1C[-1]:RC1) -> 832695
A1291: =R[-1]C+1 -> 1291 | B1291: =SUM(R1C[-1]:RC1) -> 833986
A1292: =R[-1]C+1 -> 1292 | B1292: =SUM(R1C[-1]:RC1) -> 835278
A1293: =R[-1]C+1 -> 1293 | B1293: =SUM(R1C[-1]:RC1) -> 836571
A1294: =R[-1]C+1 -> 1294 | B1294: =SUM(R1C[-1]:RC1) -> 837865
A1295: =R[-1]C+1 -> 1295 | B1295: =SUM(R1C[-1]:RC1) -> 839160
A1296: =R[-1]C+1 -> 1296 | B1296: =SUM(R1C[-1]:RC1) -> 840456
A1297: =R[-1]C+1 -> 1297 | B1297: =SUM(R1C[-1]:RC1) -> 841753
A1298: =R[-1]C+1 -> 1298 | B1298: =SUM(R1C[-1]:RC1) -> 843051
A1299: =R[-1]C+1 -> 1299 | B1299: =SUM(R1C[-1]:RC1) -> 844350
A1300: =R[-1]C+1 -> 1300 | B1300: =SUM(R1C[-1]:RC1) -> 845650
A1301: =R[-1]C+1 -> 1301 | B1301: =SUM(R1C[-1]:RC1) -> 846951
A1302: =R[-1]C+1 -> 1302 | B1302: =SUM(R1C[-1]:RC1) -> 848253
A1303: =R[-1]C+1 -> 1303 | B1303: =SUM(R1C[-1]:RC1) -> 849556
A1304: =R[-1]C+1 -> 1304 | B1304: =SUM(R1C[-1]:RC1) -> 850860
A1305: =R[-1]C+1 -> 1305 | B1305: =SUM(R1C[-1]:RC1) -> 852165
A1306: =R[-1]C+1 -> 1306 | B1306: =SUM(R1C[-1]:RC1) -> 853471
A1307: =R[-1]C+1 -> 1307 | B1307: =SUM(R1C[-1]:RC1) -> 854778
A1308: =R[-1]C+1 -> 1308 | B1308: =SUM(R1C[-1]:RC1) -> 856086
A1309: =R[-1]C+1 -> 1309 | B1309: =SUM(R1C[-1]:RC1) -> 857395
A1310: =R[-1]C+1 -> 1310 | B1310: =SUM(R1C[-1]:RC1) -> 858705
A1311: =R[-1]C+1 -> 1311 | B1311: =SUM(R1C[-1]:RC1) -> 860016
A1312: =R[-1]C+1 -> 1312 | B1312: =SUM(R1C[-1]:RC1) -> 861328
A1313: =R[-1]C+1 -> 1313 | B1313: =SUM(R1C[-1]:RC1) -> 862641
A1314: =R[-1]C+1 -> 1314 | B1314: =SUM(R1C[-1]:RC1) -> 863955
A1315: =R[-1]C+1 -> 1315 | B1315: =SUM(R1C[-1]:RC1) -> 865270
A1316: =R[-1]C+1 -> 1316 | B1316: =SUM(R1C[-1]:RC1) -> 866586
A1317: =R[-1]C+1 -> 1317 | B1317: =SUM(R1C[-1]:RC1) -> 867903
A1318: =R[-1]C+1 -> 1318 | B1318: =SUM(R1C[-1]:RC1) -> 869221
A1319: =R[-1]C+1 -> 1319 | B1319: =SUM(R1C[-1]:RC1) -> 870540
A1320: =R[-1]C+1 -> 1320 | B1320: =SUM(R1C[-1]:RC1) -> 871860
A1321: =R[-1]C+1 -> 1321 | B1321: =SUM(R1C[-1]:RC1) -> 873181
A1322: =R[-1]C+1 -> 1322 | B1322: =SUM(R1C[-1]:RC1) -> 874503
A1323: =R[-1]C+1 -> 1323 | B1323: =SUM(R1C[-1]:RC1) -> 875826
A1324: =R[-1]C+1 -> 1324 | B1324: =SUM(R1C[-1]:RC1) -> 877150
A1325: =R[-1]C+1 -> 1325 | B1325: =SUM(R1C[-1]:RC1) -> 878475
A1326: =R[-1]C+1 -> 1326 | B1326: =SUM(R1C[-1]:RC1) -> 879801
A1327: =R[-1]C+1 -> 1327 | B1327: =SUM(R1C[-1]:RC1) -> 881128
A1328: =R[-1]C+1 -> 1328 | B1328: =SUM(R1C[-1]:RC1) -> 882456
A1329: =R[-1]C+1 -> 1329 | B1329: =SUM(R1C[-1]:RC1) -> 883785
A1330: =R[-1]C+1 -> 1330 | B1330: =SUM(R1C[-1]:RC1) -> 885115
A1331: =R[-1]C+1 -> 1331 | B1331: =SUM(R1C[-1]:RC1) -> 886446
A1332: =R[-1]C+1 -> 1332 | B1332: =SUM(R1C[-1]:RC1) -> 887778
A1333: =R[-1]C+1 -> 1333 | B1333: =SUM(R1C[-1]:RC1) -> 889111
A1334: =R[-1]C+1 -> 1334 | B1334: =SUM(R1C[-1]:RC1) -> 890445
A1335: =R[-1]C+1 -> 1335 | B1335: =SUM(R1C[-1]:RC1) -> 891780
A1336: =R[-1]C+1 -> 1336 | B1336: =SUM(R1C[-1]:RC1) -> 893116
A1337: =R[-1]C+1 -> 1337 | B1337: =SUM(R1C[-1]:RC1) -> 894453
A1338: =R[-1]C+1 -> 1338 | B1338: =SUM(R1C[-1]:RC1) -> 895791
A1339: =R[-1]C+1 -> 1339 | B1339: =SUM(R1C[-1]:RC1) -> 897130
A1340: =R[-1]C+1 -> 1340 | B1340: =SUM(R1C[-1]:RC1) -> 898470
A1341: =R[-1]C+1 -> 1341 | B1341: =SUM(R1C[-1]:RC1) -> 899811
A1342: =R[-1]C+1 -> 1342 | B1342: =SUM(R1C[-1]:RC1) -> 901153
A1343: =R[-1]C+1 -> 1343 | B1343: =SUM(R1C[-1]:RC1) -> 902496
A1344: =R[-1]C+1 -> 1344 | B1344: =SUM(R1C[-1]:RC1) -> 903840
A1345: =R[-1]C+1 -> 1345 | B1345: =SUM(R1C[-1]:RC1) -> 905185
A1346: =R[-1]C+1 -> 1346 | B1346: =SUM(R1C[-1]:RC1) -> 906531
A1347: =R[-1]C+1 -> 1347 | B1347: =SUM(R1C[-1]:RC1) -> 907878
A1348: =R[-1]C+1 -> 1348 | B1348: =SUM(R1C[-1]:RC1) -> 909226
A1349: =R[-1]C+1 -> 1349 | B1349: =SUM(R1C[-1]:RC1) -> 910575
A1350: =R[-1]C+1 -> 1350 | B1350: =SUM(R1C[-1]:RC1) -> 911925
A1351: =R[-1]C+1 -> 1351 | B1351: =SUM(R1C[-1]:RC1) -> 913276
A1352: =R[-1]C+1 -> 1352 | B1352: =SUM(R1C[-1]:RC1) -> 914628
A1353: =R[-1]C+1 -> 1353 | B1353: =SUM(R1C[-1]:RC1) -> 915981
A1354: =R[-1]C+1 -> 1354 | B1354: =SUM(R1C[-1]:RC1) -> 917335
A1355: =R[-1]C+1 -> 1355 | B1355: =SUM(R1C[-1]:RC1) -> 918690
A1356: =R[-1]C+1 -> 1356 | B1356: =SUM(R1C[-1]:RC1) -> 920046
A1357: =R[-1]C+1 -> 1357 | B1357: =SUM(R1C[-1]:RC1) -> 921403
A1358: =R[-1]C+1 -> 1358 | B1358: =SUM(R1C[-1]:RC1) -> 922761
A1359: =R[-1]C+1 -> 1359 | B1359: =SUM(R1C[-1]:RC1) -> 924120
A1360: =R[-1]C+1 -> 1360 | B1360: =SUM(R1C[-1]:RC1) -> 925480
A1361: =R[-1]C+1 -> 1361 | B1361: =SUM(R1C[-1]:RC1) -> 926841
A1362: =R[-1]C+1 -> 1362 | B1362: =SUM(R1C[-1]:RC1) -> 928203
A1363: =R[-1]C+1 -> 1363 | B1363: =SUM(R1C[-1]:RC1) -> 929566
A1364: =R[-1]C+1 -> 1364 | B1364: =SUM(R1C[-1]:RC1) -> 930930
A1365: =R[-1]C+1 -> 1365 | B1365: =SUM(R1C[-1]:RC1) -> 932295
A1366: =R[-1]C+1 -> 1366 | B1366: =SUM(R1C[-1]:RC1) -> 933661
A1367: =R[-1]C+1 -> 1367 | B1367: =SUM(R1C[-1]:RC1) -> 935028
A1368: =R[-1]C+1 -> 1368 | B1368: =SUM(R1C[-1]:RC1) -> 936396
A1369: =R[-1]C+1 -> 1369 | B1369: =SUM(R1C[-1]:RC1) -> 937765
A1370: =R[-1]C+1 -> 1370 | B1370: =SUM(R1C[-1]:RC1) -> 939135
A1371: =R[-1]C+1 -> 1371 | B1371: =SUM(R1C[-1]:RC1) -> 940506
A1372: =R[-1]C+1 -> 1372 | B1372: =SUM(R1C[-1]:RC1) -> 941878
A1373: =R[-1]C+1 -> 1373 | B1373: =SUM(R1C[-1]:RC1) -> 943251
A1374: =R[-1]C+1 -> 1374 | B1374: =SUM(R1C[-1]:RC1) -> 944625
A1375: =R[-1]C+1 -> 1375 | B1375: =SUM(R1C[-1]:RC1) -> 946000
A1376: =R[-1]C+1 -> 1376 | B1376: =SUM(R1C[-1]:RC1) -> 947376
A1377: =R[-1]C+1 -> 1377 | B1377: =SUM(R1C[-1]:RC1) -> 948753
A1378: =R[-1]C+1 -> 1378 | B1378: =SUM(R1C[-1]:RC1) -> 950131
A1379: =R[-1]C+1 -> 1379 | B1379: =SUM(R1C[-1]:RC1) -> 951510
A1380: =R[-1]C+1 -> 1380 | B1380: =SUM(R1C[-1]:RC1) -> 952890
A1381: =R[-1]C+1 -> 1381 | B1381: =SUM(R1C[-1]:RC1) -> 954271
A1382: =R[-1]C+1 -> 1382 | B1382: =SUM(R1C[-1]:RC1) -> 955653
A1383: =R[-1]C+1 -> 1383 | B1383: =SUM(R1C[-1]:RC1) -> 957036
A1384: =R[-1]C+1 -> 1384 | B1384: =SUM(R1C[-1]:RC1) -> 958420
A1385: =R[-1]C+1 -> 1385 | B1385: =SUM(R1C[-1]:RC1) -> 959805
A1386: =R[-1]C+1 -> 1386 | B1386: =SUM(R1C[-1]:RC1) -> 961191
A1387: =R[-1]C+1 -> 1387 | B1387: =SUM(R1C[-1]:RC1) -> 962578
A1388: =R[-1]C+1 -> 1388 | B1388: =SUM(R1C[-1]:RC1) -> 963966
A1389: =R[-1]C+1 -> 1389 | B1389: =SUM(R1C[-1]:RC1) -> 965355
A1390: =R[-1]C+1 -> 1390 | B1390: =SUM(R1C[-1]:RC1) -> 966745
A1391: =R[-1]C+1 -> 1391 | B1391: =SUM(R1C[-1]:RC1) -> 968136
A1392: =R[-1]C+1 -> 1392 | B1392: =SUM(R1C[-1]:RC1) -> 969528
A1393: =R[-1]C+1 -> 1393 | B1393: =SUM(R1C[-1]:RC1) -> 970921
A1394: =R[-1]C+1 -> 1394 | B1394: =SUM(R1C[-1]:RC1) -> 972315
A1395: =R[-1]C+1 -> 1395 | B1395: =SUM(R1C[-1]:RC1) -> 973710
A1396: =R[-1]C+1 -> 1396 | B1396: =SUM(R1C[-1]:RC1) -> 975106
A1397: =R[-1]C+1 -> 1397 | B1397: =SUM(R1C[-1]:RC1) -> 976503
A1398: =R[-1]C+1 -> 1398 | B1398: =SUM(R1C[-1]:RC1) -> 977901
A1399: =R[-1]C+1 -> 1399 | B1399: =SUM(R1C[-1]:RC1) -> 979300
A1400: =R[-1]C+1 -> 1400 | B1400: =SUM(R1C[-1]:RC1) -> 980700
A1401: =R[-1]C+1 -> 1401 | B1401: =SUM(R1C[-1]:RC1) -> 982101
A1402: =R[-1]C+1 -> 1402 | B1402: =SUM(R1C[-1]:RC1) -> 983503
A1403: =R[-1]C+1 -> 1403 | B1403: =SUM(R1C[-1]:RC1) -> 984906
A1404: =R[-1]C+1 -> 1404 | B1404: =SUM(R1C[-1]:RC1) -> 986310
A1405: =R[-1]C+1 -> 1405 | B1405: =SUM(R1C[-1]:RC1) -> 987715
A1406: =R[-1]C+1 -> 1406 | B1406: =SUM(R1C[-1]:RC1) -> 989121
A1407: =R[-1]C+1 -> 1407 | B1407: =SUM(R1C[-1]:RC1) -> 990528
A1408: =R[-1]C+1 -> 1408 | B1408: =SUM(R1C[-1]:RC1) -> 991936
A1409: =R[-1]C+1 -> 1409 | B1409: =SUM(R1C[-1]:RC1) -> 993345
A1410: =R[-1]C+1 -> 1410 | B1410: =SUM(R1C[-1]:RC1) -> 994755
A1411: =R[-1]C+1 -> 1411 | B1411: =SUM(R1C[-1]:RC1) -> 996166
A1412: =R[-1]C+1 -> 1412 | B1412: =SUM(R1C[-1]:RC1) -> 997578
A1413: =R[-1]C+1 -> 1413 | B1413: =SUM(R1C[-1]:RC1) -> 998991
A1414: =R[-1]C+1 -> 1414 | B1414: =SUM(R1C[-1]:RC1) -> 1000405
A1415: =R[-1]C+1 -> 1415 | B1415: =SUM(R1C[-1]:RC1) -> 1001820
A1416: =R[-1]C+1 -> 1416 | B1416: =SUM(R1C[-1]:RC1) -> 1003236
A1417: =R[-1]C+1 -> 1417 | B1417: =SUM(R1C[-1]:RC1) -> 1004653
A1418: =R[-1]C+1 -> 1418 | B1418: =SUM(R1C[-1]:RC1) -> 1006071
A1419: =R[-1]C+1 -> 1419 | B1419: =SUM(R1C[-1]:RC1) -> 1007490
A1420: =R[-1]C+1 -> 1420 | B1420: =SUM(R1C[-1]:RC1) -> 1008910
A1421: =R[-1]C+1 -> 1421 | B1421: =SUM(R1C[-1]:RC1) -> 1010331
A1422: =R[-1]C+1 -> 1422 | B1422: =SUM(R1C[-1]:RC1) -> 1011753
A1423: =R[-1]C+1 -> 1423 | B1423: =SUM(R1C[-1]:RC1) -> 1013176
A1424: =R[-1]C+1 -> 1424 | B1424: =SUM(R1C[-1]:RC1) -> 1014600
A1425: =R[-1]C+1 -> 1425 | B1425: =SUM(R1C[-1]:RC1) -> 1016025
A1426: =R[-1]C+1 -> 1426 | B1426: =SUM(R1C[-1]:RC1) -> 1017451
A1427: =R[-1]C+1 -> 1427 | B1427: =SUM(R1C[-1]:RC1) -> 1018878
A1428: =R[-1]C+1 -> 1428 | B1428: =SUM(R1C[-1]:RC1) -> 1020306
A1429: =R[-1]C+1 -> 1429 | B1429: =SUM(R1C[-1]:RC1) -> 1021735
A1430: =R[-1]C+1 -> 1430 | B1430: =SUM(R1C[-1]:RC1) -> 1023165
A1431: =R[-1]C+1 -> 1431 | B1431: =SUM(R1C[-1]:RC1) -> 1024596
A1432: =R[-1]C+1 -> 1432 | B1432: =SUM(R1C[-1]:RC1) -> 1026028
A1433: =R[-1]C+1 -> 1433 | B1433: =SUM(R1C[-1]:RC1) -> 1027461
A1434: =R[-1]C+1 -> 1434 | B1434: =SUM(R1C[-1]:RC1) -> 1028895
A1435: =R[-1]C+1 -> 1435 | B1435: =SUM(R1C[-1]:RC1) -> 1030330
A1436: =R[-1]C+1 -> 1436 | B1436: =SUM(R1C[-1]:RC1) -> 1031766
A1437: =R[-1]C+1 -> 1437 | B1437: =SUM(R1C[-1]:RC1) -> 1033203
A1438: =R[-1]C+1 -> 1438 | B1438: =SUM(R1C[-1]:RC1) -> 1034641
A1439: =R[-1]C+1 -> 1439 | B1439: =SUM(R1C[-1]:RC1) -> 1036080
A1440: =R[-1]C+1 -> 1440 | B1440: =SUM(R1C[-1]:RC1) -> 1037520
A1441: =R[-1]C+1 -> 1441 | B1441: =SUM(R1C[-1]:RC1) -> 1038961
A1442: =R[-1]C+1 -> 1442 | B1442: =SUM(R1C[-1]:RC1) -> 1040403
A1443: =R[-1]C+1 -> 1443 | B1443: =SUM(R1C[-1]:RC1) -> 1041846
A1444: =R[-1]C+1 -> 1444 | B1444: =SUM(R1C[-1]:RC1) -> 1043290
A1445: =R[-1]C+1 -> 1445 | B1445: =SUM(R1C[-1]:RC1) -> 1044735
A1446: =R[-1]C+1 -> 1446 | B1446: =SUM(R1C[-1]:RC1) -> 1046181
A1447: =R[-1]C+1 -> 1447 | B1447: =SUM(R1C[-1]:RC1) -> 1047628
A1448: =R[-1]C+1 -> 1448 | B1448: =SUM(R1C[-1]:RC1) -> 1049076
A1449: =R[-1]C+1 -> 1449 | B1449: =SUM(R1C[-1]:RC1) -> 1050525
A1450: =R[-1]C+1 -> 1450 | B1450: =SUM(R1C[-1]:RC1) -> 1051975
A1451: =R[-1]C+1 -> 1451 | B1451: =SUM(R1C[-1]:RC1) -> 1053426
A1452: =R[-1]C+1 -> 1452 | B1452: =SUM(R1C[-1]:RC1) -> 1054878
A1453: =R[-1]C+1 -> 1453 | B1453: =SUM(R1C[-1]:RC1) -> 1056331
A1454: =R[-1]C+1 -> 1454 | B1454: =SUM(R1C[-1]:RC1) -> 1057785
A1455: =R[-1]C+1 -> 1455 | B1455: =SUM(R1C[-1]:RC1) -> 1059240
A1456: =R[-1]C+1 -> 1456 | B1456: =SUM(R1C[-1]:RC1) -> 1060696
A1457: =R[-1]C+1 -> 1457 | B1457: =SUM(R1C[-1]:RC1) -> 1062153
A1458: =R[-1]C+1 -> 1458 | B1458: =SUM(R1C[-1]:RC1) -> 1063611
A1459: =R[-1]C+1 -> 1459 | B1459: =SUM(R1C[-1]:RC1) -> 1065070
A1460: =R[-1]C+1 -> 1460 | B1460: =SUM(R1C[-1]:RC1) -> 1066530
A1461: =R[-1]C+1 -> 1461 | B1461: =SUM(R1C[-1]:RC1) -> 1067991
A1462: =R[-1]C+1 -> 1462 | B1462: =SUM(R1C[-1]:RC1) -> 1069453
A1463: =R[-1]C+1 -> 1463 | B1463: =SUM(R1C[-1]:RC1) -> 1070916
A1464: =R[-1]C+1 -> 1464 | B1464: =SUM(R1C[-1]:RC1) -> 1072380
A1465: =R[-1]C+1 -> 1465 | B1465: =SUM(R1C[-1]:RC1) -> 1073845
A1466: =R[-1]C+1 -> 1466 | B1466: =SUM(R1C[-1]:RC1) -> 1075311
A1467: =R[-1]C+1 -> 1467 | B1467: =SUM(R1C[-1]:RC1) -> 1076778
A1468: =R[-1]C+1 -> 1468 | B1468: =SUM(R1C[-1]:RC1) -> 1078246
A1469: =R[-1]C+1 -> 1469 | B1469: =SUM(R1C[-1]:RC1) -> 1079715
A1470: =R[-1]C+1 -> 1470 | B1470: =SUM(R1C[-1]:RC1) -> 1081185
A1471: =R[-1]C+1 -> 1471 | B1471: =SUM(R1C[-1]:RC1) -> 1082656
A1472: =R[-1]C+1 -> 1472 | B1472: =SUM(R1C[-1]:RC1) -> 1084128
A1473: =R[-1]C+1 -> 1473 | B1473: =SUM(R1C[-1]:RC1) -> 1085601
A1474: =R[-1]C+1 -> 1474 | B1474: =SUM(R1C[-1]:RC1) -> 1087075
A1475: =R[-1]C+1 -> 1475 | B1475: =SUM(R1C[-1]:RC1) -> 1088550
A1476: =R[-1]C+1 -> 1476 | B1476: =SUM(R1C[-1]:RC1) -> 1090026
A1477: =R[-1]C+1 -> 1477 | B1477: =SUM(R1C[-1]:RC1) -> 1091503
A1478: =R[-1]C+1 -> 1478 | B1478: =SUM(R1C[-1]:RC1) -> 1092981
A1479: =R[-1]C+1 -> 1479 | B1479: =SUM(R1C[-1]:RC1) -> 1094460
A1480: =R[-1]C+1 -> 1480 | B1480: =SUM(R1C[-1]:RC1) -> 1095940
A1481: =R[-1]C+1 -> 1481 | B1481: =SUM(R1C[-1]:RC1) -> 1097421
A1482: =R[-1]C+1 -> 1482 | B1482: =SUM(R1C[-1]:RC1) -> 1098903
A1483: =R[-1]C+1 -> 1483 | B1483: =SUM(R1C[-1]:RC1) -> 1100386
A1484: =R[-1]C+1 -> 1484 | B1484: =SUM(R1C[-1]:RC1) -> 1101870
A1485: =R[-1]C+1 -> 1485 | B1485: =SUM(R1C[-1]:RC1) -> 1103355
A1486: =R[-1]C+1 -> 1486 | B1486: =SUM(R1C[-1]:RC1) -> 1104841
A1487: =R[-1]C+1 -> 1487 | B1487: =SUM(R1C[-1]:RC1) -> 1106328
A1488: =R[-1]C+1 -> 1488 | B1488: =SUM(R1C[-1]:RC1) -> 1107816
A1489: =R[-1]C+1 -> 1489 | B1489: =SUM(R1C[-1]:RC1) -> 1109305
A1490: =R[-1]C+1 -> 1490 | B1490: =SUM(R1C[-1]:RC1) -> 1110795
A1491: =R[-1]C+1 -> 1491 | B1491: =SUM(R1C[-1]:RC1) -> 1112286
A1492: =R[-1]C+1 -> 1492 | B1492: =SUM(R1C[-1]:RC1) -> 1113778
A1493: =R[-1]C+1 -> 1493 | B1493: =SUM(R1C[-1]:RC1) -> 1115271
A1494: =R[-1]C+1 -> 1494 | B1494: =SUM(R1C[-1]:RC1) -> 1116765
A1495: =R[-1]C+1 -> 1495 | B1495: =SUM(R1C[-1]:RC1) -> 1118260
A1496: =R[-1]C+1 -> 1496 | B1496: =SUM(R1C[-1]:RC1) -> 1119756
A1497: =R[-1]C+1 -> 1497 | B1497: =SUM(R1C[-1]:RC1) -> 1121253
A1498: =R[-1]C+1 -> 1498 | B1498: =SUM(R1C[-1]:RC1) -> 1122751
A1499: =R[-1]C+1 -> 1499 | B1499: =SUM(R1C[-1]:RC1) -> 1124250
A1500: =R[-1]C+1 -> 1500 | B1500: =SUM(R1C[-1]:RC1) -> 1125750
A1501: =R[-1]C+1 -> 1501 | B1501: =SUM(R1C[-1]:RC1) -> 1127251
A1502: =R[-1]C+1 -> 1502 | B1502: =SUM(R1C[-1]:RC1) -> 1128753
A1503: =R[-1]C+1 -> 1503 | B1503: =SUM(R1C[-1]:RC1) -> 1130256
A1504: =R[-1]C+1 -> 1504 | B1504: =SUM(R1C[-1]:RC1) -> 1131760
A1505: =R[-1]C+1 -> 1505 | B1505: =SUM(R1C[-1]:RC1) -> 1133265
A1506: =R[-1]C+1 -> 1506 | B1506: =SUM(R1C[-1]:RC1) -> 1134771
A1507: =R[-1]C+1 -> 1507 | B1507: =SUM(R1C[-1]:RC1) -> 1136278
A1508: =R[-1]C+1 -> 1508 | B1508: =SUM(R1C[-1]:RC1) -> 1137786
A1509: =R[-1]C+1 -> 1509 | B1509: =SUM(R1C[-1]:RC1) -> 1139295
A1510: =R[-1]C+1 -> 1510 | B1510: =SUM(R1C[-1]:RC1) -> 1140805
A1511: =R[-1]C+1 -> 1511 | B1511: =SUM(R1C[-1]:RC1) -> 1142316
A1512: =R[-1]C+1 -> 1512 | B1512: =SUM(R1C[-1]:RC1) -> 1143828
A1513: =R[-1]C+1 -> 1513 | B1513: =SUM(R1C[-1]:RC1) -> 1145341
A1514: =R[-1]C+1 -> 1514 | B1514: =SUM(R1C[-1]:RC1) -> 1146855
A1515: =R[-1]C+1 -> 1515 | B1515: =SUM(R1C[-1]:RC1) -> 1148370
A1516: =R[-1]C+1 -> 1516 | B1516: =SUM(R1C[-1]:RC1) -> 1149886
A1517: =R[-1]C+1 -> 1517 | B1517: =SUM(R1C[-1]:RC1) -> 1151403
A1518: =R[-1]C+1 -> 1518 | B1518: =SUM(R1C[-1]:RC1) -> 1152921
A1519: =R[-1]C+1 -> 1519 | B1519: =SUM(R1C[-1]:RC1) -> 1154440
A1520: =R[-1]C+1 -> 1520 | B1520: =SUM(R1C[-1]:RC1) -> 1155960
A1521: =R[-1]C+1 -> 1521 | B1521: =SUM(R1C[-1]:RC1) -> 1157481
A1522: =R[-1]C+1 -> 1522 | B1522: =SUM(R1C[-1]:RC1) -> 1159003
A1523: =R[-1]C+1 -> 1523 | B1523: =SUM(R1C[-1]:RC1) -> 1160526
A1524: =R[-1]C+1 -> 1524 | B1524: =SUM(R1C[-1]:RC1) -> 1162050
A1525: =R[-1]C+1 -> 1525 | B1525: =SUM(R1C[-1]:RC1) -> 1163575
A1526: =R[-1]C+1 -> 1526 | B1526: =SUM(R1C[-1]:RC1) -> 1165101
A1527: =R[-1]C+1 -> 1527 | B1527: =SUM(R1C[-1]:RC1) -> 1166628
A1528: =R[-1]C+1 -> 1528 | B1528: =SUM(R1C[-1]:RC1) -> 1168156
A1529: =R[-1]C+1 -> 1529 | B1529: =SUM(R1C[-1]:RC1) -> 1169685
A1530: =R[-1]C+1 -> 1530 | B1530: =SUM(R1C[-1]:RC1) -> 1171215
A1531: =R[-1]C+1 -> 1531 | B1531: =SUM(R1C[-1]:RC1) -> 1172746
A1532: =R[-1]C+1 -> 1532 | B1532: =SUM(R1C[-1]:RC1) -> 1174278
A1533: =R[-1]C+1 -> 1533 | B1533: =SUM(R1C[-1]:RC1) -> 1175811
A1534: =R[-1]C+1 -> 1534 | B1534: =SUM(R1C[-1]:RC1) -> 1177345
A1535: =R[-1]C+1 -> 1535 | B1535: =SUM(R1C[-1]:RC1) -> 1178880
A1536: =R[-1]C+1 -> 1536 | B1536: =SUM(R1C[-1]:RC1) -> 1180416
A1537: =R[-1]C+1 -> 1537 | B1537: =SUM(R1C[-1]:RC1) -> 1181953
A1538: =R[-1]C+1 -> 1538 | B1538: =SUM(R1C[-1]:RC1) -> 1183491
A1539: =R[-1]C+1 -> 1539 | B1539: =SUM(R1C[-1]:RC1) -> 1185030
A1540: =R[-1]C+1 -> 1540 | B1540: =SUM(R1C[-1]:RC1) -> 1186570
A1541: =R[-1]C+1 -> 1541 | B1541: =SUM(R1C[-1]:RC1) -> 1188111
A1542: =R[-1]C+1 -> 1542 | B1542: =SUM(R1C[-1]:RC1) -> 1189653
A1543: =R[-1]C+1 -> 1543 | B1543: =SUM(R1C[-1]:RC1) -> 1191196
A1544: =R[-1]C+1 -> 1544 | B1544: =SUM(R1C[-1]:RC1) -> 1192740
A1545: =R[-1]C+1 -> 1545 | B1545: =SUM(R1C[-1]:RC1) -> 1194285
A1546: =R[-1]C+1 -> 1546 | B1546: =SUM(R1C[-1]:RC1) -> 1195831
A1547: =R[-1]C+1 -> 1547 | B1547: =SUM(R1C[-1]:RC1) -> 1197378
A1548: =R[-1]C+1 -> 1548 | B1548: =SUM(R1C[-1]:RC1) -> 1198926
A1549: =R[-1]C+1 -> 1549 | B1549: =SUM(R1C[-1]:RC1) -> 1200475
A1550: =R[-1]C+1 -> 1550 | B1550: =SUM(R1C[-1]:RC1) -> 1202025
A1551: =R[-1]C+1 -> 1551 | B1551: =SUM(R1C[-1]:RC1) -> 1203576
A1552: =R[-1]C+1 -> 1552 | B1552: =SUM(R1C[-1]:RC1) -> 1205128
A1553: =R[-1]C+1 -> 1553 | B1553: =SUM(R1C[-1]:RC1) -> 1206681
A1554: =R[-1]C+1 -> 1554 | B1554: =SUM(R1C[-1]:RC1) -> 1208235
A1555: =R[-1]C+1 -> 1555 | B1555: =SUM(R1C[-1]:RC1) -> 1209790
A1556: =R[-1]C+1 -> 1556 | B1556: =SUM(R1C[-1]:RC1) -> 1211346
A1557: =R[-1]C+1 -> 1557 | B1557: =SUM(R1C[-1]:RC1) -> 1212903
A1558: =R[-1]C+1 -> 1558 | B1558: =SUM(R1C[-1]:RC1) -> 1214461
A1559: =R[-1]C+1 -> 1559 | B1559: =SUM(R1C[-1]:RC1) -> 1216020
A1560: =R[-1]C+1 -> 1560 | B1560: =SUM(R1C[-1]:RC1) -> 1217580
A1561: =R[-1]C+1 -> 1561 | B1561: =SUM(R1C[-1]:RC1) -> 1219141
A1562: =R[-1]C+1 -> 1562 | B1562: =SUM(R1C[-1]:RC1) -> 1220703
A1563: =R[-1]C+1 -> 1563 | B1563: =SUM(R1C[-1]:RC1) -> 1222266
A1564: =R[-1]C+1 -> 1564 | B1564: =SUM(R1C[-1]:RC1) -> 1223830
A1565: =R[-1]C+1 -> 1565 | B1565: =SUM(R1C[-1]:RC1) -> 1225395
A1566: =R[-1]C+1 -> 1566 | B1566: =SUM(R1C[-1]:RC1) -> 1226961
A1567: =R[-1]C+1 -> 1567 | B1567: =SUM(R1C[-1]:RC1) -> 1228528
A1568: =R[-1]C+1 -> 1568 | B1568: =SUM(R1C[-1]:RC1) -> 1230096
A1569: =R[-1]C+1 -> 1569 | B1569: =SUM(R1C[-1]:RC1) -> 1231665
A1570: =R[-1]C+1 -> 1570 | B1570: =SUM(R1C[-1]:RC1) -> 1233235
A1571: =R[-1]C+1 -> 1571 | B1571: =SUM(R1C[-1]:RC1) -> 1234806
A1572: =R[-1]C+1 -> 1572 | B1572: =SUM(R1C[-1]:RC1) -> 1236378
A1573: =R[-1]C+1 -> 1573 | B1573: =SUM(R1C[-1]:RC1) -> 1237951
A1574: =R[-1]C+1 -> 1574 | B1574: =SUM(R1C[-1]:RC1) -> 1239525
A1575: =R[-1]C+1 -> 1575 | B1575: =SUM(R1C[-1]:RC1) -> 1241100
A1576: =R[-1]C+1 -> 1576 | B1576: =SUM(R1C[-1]:RC1) -> 1242676
A1577: =R[-1]C+1 -> 1577 | B1577: =SUM(R1C[-1]:RC1) -> 1244253
A1578: =R[-1]C+1 -> 1578 | B1578: =SUM(R1C[-1]:RC1) -> 1245831
A1579: =R[-1]C+1 -> 1579 | B1579: =SUM(R1C[-1]:RC1) -> 1247410
A1580: =R[-1]C+1 -> 1580 | B1580: =SUM(R1C[-1]:RC1) -> 1248990
A1581: =R[-1]C+1 -> 1581 | B1581: =SUM(R1C[-1]:RC1) -> 1250571
A1582: =R[-1]C+1 -> 1582 | B1582: =SUM(R1C[-1]:RC1) -> 1252153
A1583: =R[-1]C+1 -> 1583 | B1583: =SUM(R1C[-1]:RC1) -> 1253736
A1584: =R[-1]C+1 -> 1584 | B1584: =SUM(R1C[-1]:RC1) -> 1255320
A1585: =R[-1]C+1 -> 1585 | B1585: =SUM(R1C[-1]:RC1) -> 1256905
A1586: =R[-1]C+1 -> 1586 | B1586: =SUM(R1C[-1]:RC1) -> 1258491
A1587: =R[-1]C+1 -> 1587 | B1587: =SUM(R1C[-1]:RC1) -> 1260078
A1588: =R[-1]C+1 -> 1588 | B1588: =SUM(R1C[-1]:RC1) -> 1261666
A1589: =R[-1]C+1 -> 1589 | B1589: =SUM(R1C[-1]:RC1) -> 1263255
A1590: =R[-1]C+1 -> 1590 | B1590: =SUM(R1C[-1]:RC1) -> 1264845
A1591: =R[-1]C+1 -> 1591 | B1591: =SUM(R1C[-1]:RC1) -> 1266436
A1592: =R[-1]C+1 -> 1592 | B1592: =SUM(R1C[-1]:RC1) -> 1268028
A1593: =R[-1]C+1 -> 1593 | B1593: =SUM(R1C[-1]:RC1) -> 1269621
A1594: =R[-1]C+1 -> 1594 | B1594: =SUM(R1C[-1]:RC1) -> 1271215
A1595: =R[-1]C+1 -> 1595 | B1595: =SUM(R1C[-1]:RC1) -> 1272810
A1596: =R[-1]C+1 -> 1596 | B1596: =SUM(R1C[-1]:RC1) -> 1274406
A1597: =R[-1]C+1 -> 1597 | B1597: =SUM(R1C[-1]:RC1) -> 1276003
A1598: =R[-1]C+1 -> 1598 | B1598: =SUM(R1C[-1]:RC1) -> 1277601
A1599: =R[-1]C+1 -> 1599 | B1599: =SUM(R1C[-1]:RC1) -> 1279200
A1600: =R[-1]C+1 -> 1600 | B1600: =SUM(R1C[-1]:RC1) -> 1280800
A1601: =R[-1]C+1 -> 1601 | B1601: =SUM(R1C[-1]:RC1) -> 1282401
A1602: =R[-1]C+1 -> 1602 | B1602: =SUM(R1C[-1]:RC1) -> 1284003
A1603: =R[-1]C+1 -> 1603 | B1603: =SUM(R1C[-1]:RC1) -> 1285606
A1604: =R[-1]C+1 -> 1604 | B1604: =SUM(R1C[-1]:RC1) -> 1287210
A1605: =R[-1]C+1 -> 1605 | B1605: =SUM(R1C[-1]:RC1) -> 1288815
A1606: =R[-1]C+1 -> 1606 | B1606: =SUM(R1C[-1]:RC1) -> 1290421
A1607: =R[-1]C+1 -> 1607 | B1607: =SUM(R1C[-1]:RC1) -> 1292028
A1608: =R[-1]C+1 -> 1608 | B1608: =SUM(R1C[-1]:RC1) -> 1293636
A1609: =R[-1]C+1 -> 1609 | B1609: =SUM(R1C[-1]:RC1) -> 1295245
A1610: =R[-1]C+1 -> 1610 | B1610: =SUM(R1C[-1]:RC1) -> 1296855
A1611: =R[-1]C+1 -> 1611 | B1611: =SUM(R1C[-1]:RC1) -> 1298466
A1612: =R[-1]C+1 -> 1612 | B1612: =SUM(R1C[-1]:RC1) -> 1300078
A1613: =R[-1]C+1 -> 1613 | B1613: =SUM(R1C[-1]:RC1) -> 1301691
A1614: =R[-1]C+1 -> 1614 | B1614: =SUM(R1C[-1]:RC1) -> 1303305
A1615: =R[-1]C+1 -> 1615 | B1615: =SUM(R1C[-1]:RC1) -> 1304920
A1616: =R[-1]C+1 -> 1616 | B1616: =SUM(R1C[-1]:RC1) -> 1306536
A1617: =R[-1]C+1 -> 1617 | B1617: =SUM(R1C[-1]:RC1) -> 1308153
A1618: =R[-1]C+1 -> 1618 | B1618: =SUM(R1C[-1]:RC1) -> 1309771
A1619: =R[-1]C+1 -> 1619 | B1619: =SUM(R1C[-1]:RC1) -> 1311390
A1620: =R[-1]C+1 -> 1620 | B1620: =SUM(R1C[-1]:RC1) -> 1313010
A1621: =R[-1]C+1 -> 1621 | B1621: =SUM(R1C[-1]:RC1) -> 1314631
A1622: =R[-1]C+1 -> 1622 | B1622: =SUM(R1C[-1]:RC1) -> 1316253
A1623: =R[-1]C+1 -> 1623 | B1623: =SUM(R1C[-1]:RC1) -> 1317876
A1624: =R[-1]C+1 -> 1624 | B1624: =SUM(R1C[-1]:RC1) -> 1319500
A1625: =R[-1]C+1 -> 1625 | B1625: =SUM(R1C[-1]:RC1) -> 1321125
A1626: =R[-1]C+1 -> 1626 | B1626: =SUM(R1C[-1]:RC1) -> 1322751
A1627: =R[-1]C+1 -> 1627 | B1627: =SUM(R1C[-1]:RC1) -> 1324378
A1628: =R[-1]C+1 -> 1628 | B1628: =SUM(R1C[-1]:RC1) -> 1326006
A1629: =R[-1]C+1 -> 1629 | B1629: =SUM(R1C[-1]:RC1) -> 1327635
A1630: =R[-1]C+1 -> 1630 | B1630: =SUM(R1C[-1]:RC1) -> 1329265
A1631: =R[-1]C+1 -> 1631 | B1631: =SUM(R1C[-1]:RC1) -> 1330896
A1632: =R[-1]C+1 -> 1632 | B1632: =SUM(R1C[-1]:RC1) -> 1332528
A1633: =R[-1]C+1 -> 1633 | B1633: =SUM(R1C[-1]:RC1) -> 1334161
A1634: =R[-1]C+1 -> 1634 | B1634: =SUM(R1C[-1]:RC1) -> 1335795
A1635: =R[-1]C+1 -> 1635 | B1635: =SUM(R1C[-1]:RC1) -> 1337430
A1636: =R[-1]C+1 -> 1636 | B1636: =SUM(R1C[-1]:RC1) -> 1339066
A1637: =R[-1]C+1 -> 1637 | B1637: =SUM(R1C[-1]:RC1) -> 1340703
A1638: =R[-1]C+1 -> 1638 | B1638: =SUM(R1C[-1]:RC1) -> 1342341
A1639: =R[-1]C+1 -> 1639 | B1639: =SUM(R1C[-1]:RC1) -> 1343980
A1640: =R[-1]C+1 -> 1640 | B1640: =SUM(R1C[-1]:RC1) -> 1345620
A1641: =R[-1]C+1 -> 1641 | B1641: =SUM(R1C[-1]:RC1) -> 1347261
A1642: =R[-1]C+1 -> 1642 | B1642: =SUM(R1C[-1]:RC1) -> 1348903
A1643: =R[-1]C+1 -> 1643 | B1643: =SUM(R1C[-1]:RC1) -> 1350546
A1644: =R[-1]C+1 -> 1644 | B1644: =SUM(R1C[-1]:RC1) -> 1352190
A1645: =R[-1]C+1 -> 1645 | B1645: =SUM(R1C[-1]:RC1) -> 1353835
A1646: =R[-1]C+1 -> 1646 | B1646: =SUM(R1C[-1]:RC1) -> 1355481
A1647: =R[-1]C+1 -> 1647 | B1647: =SUM(R1C[-1]:RC1) -> 1357128
A1648: =R[-1]C+1 -> 1648 | B1648: =SUM(R1C[-1]:RC1) -> 1358776
A1649: =R[-1]C+1 -> 1649 | B1649: =SUM(R1C[-1]:RC1) -> 1360425
A1650: =R[-1]C+1 -> 1650 | B1650: =SUM(R1C[-1]:RC1) -> 1362075
A1651: =R[-1]C+1 -> 1651 | B1651: =SUM(R1C[-1]:RC1) -> 1363726
A1652: =R[-1]C+1 -> 1652 | B1652: =SUM(R1C[-1]:RC1) -> 1365378
A1653: =R[-1]C+1 -> 1653 | B1653: =SUM(R1C[-1]:RC1) -> 1367031
A1654: =R[-1]C+1 -> 1654 | B1654: =SUM(R1C[-1]:RC1) -> 1368685
A1655: =R[-1]C+1 -> 1655 | B1655: =SUM(R1C[-1]:RC1) -> 1370340
A1656: =R[-1]C+1 -> 1656 | B1656: =SUM(R1C[-1]:RC1) -> 1371996
A1657: =R[-1]C+1 -> 1657 | B1657: =SUM(R1C[-1]:RC1) -> 1373653
A1658: =R[-1]C+1 -> 1658 | B1658: =SUM(R1C[-1]:RC1) -> 1375311
A1659: =R[-1]C+1 -> 1659 | B1659: =SUM(R1C[-1]:RC1) -> 1376970
A1660: =R[-1]C+1 -> 1660 | B1660: =SUM(R1C[-1]:RC1) -> 1378630
A1661: =R[-1]C+1 -> 1661 | B1661: =SUM(R1C[-1]:RC1) -> 1380291
A1662: =R[-1]C+1 -> 1662 | B1662: =SUM(R1C[-1]:RC1) -> 1381953
A1663: =R[-1]C+1 -> 1663 | B1663: =SUM(R1C[-1]:RC1) -> 1383616
A1664: =R[-1]C+1 -> 1664 | B1664: =SUM(R1C[-1]:RC1) -> 1385280
A1665: =R[-1]C+1 -> 1665 | B1665: =SUM(R1C[-1]:RC1) -> 1386945
A1666: =R[-1]C+1 -> 1666 | B1666: =SUM(R1C[-1]:RC1) -> 1388611
A1667: =R[-1]C+1 -> 1667 | B1667: =SUM(R1C[-1]:RC1) -> 1390278
A1668: =R[-1]C+1 -> 1668 | B1668: =SUM(R1C[-1]:RC1) -> 1391946
A1669: =R[-1]C+1 -> 1669 | B1669: =SUM(R1C[-1]:RC1) -> 1393615
A1670: =R[-1]C+1 -> 1670 | B1670: =SUM(R1C[-1]:RC1) -> 1395285
A1671: =R[-1]C+1 -> 1671 | B1671: =SUM(R1C[-1]:RC1) -> 1396956
A1672: =R[-1]C+1 -> 1672 | B1672: =SUM(R1C[-1]:RC1) -> 1398628
A1673: =R[-1]C+1 -> 1673 | B1673: =SUM(R1C[-1]:RC1) -> 1400301
A1674: =R[-1]C+1 -> 1674 | B1674: =SUM(R1C[-1]:RC1) -> 1401975
A1675: =R[-1]C+1 -> 1675 | B1675: =SUM(R1C[-1]:RC1) -> 1403650
A1676: =R[-1]C+1 -> 1676 | B1676: =SUM(R1C[-1]:RC1) -> 1405326
A1677: =R[-1]C+1 -> 1677 | B1677: =SUM(R1C[-1]:RC1) -> 1407003
A1678: =R[-1]C+1 -> 1678 | B1678: =SUM(R1C[-1]:RC1) -> 1408681
A1679: =R[-1]C+1 -> 1679 | B1679: =SUM(R1C[-1]:RC1) -> 1410360
A1680: =R[-1]C+1 -> 1680 | B1680: =SUM(R1C[-1]:RC1) -> 1412040
A1681: =R[-1]C+1 -> 1681 | B1681: =SUM(R1C[-1]:RC1) -> 1413721
A1682: =R[-1]C+1 -> 1682 | B1682: =SUM(R1C[-1]:RC1) -> 1415403
A1683: =R[-1]C+1 -> 1683 | B1683: =SUM(R1C[-1]:RC1) -> 1417086
A1684: =R[-1]C+1 -> 1684 | B1684: =SUM(R1C[-1]:RC1) -> 1418770
A1685: =R[-1]C+1 -> 1685 | B1685: =SUM(R1C[-1]:RC1) -> 1420455
A1686: =R[-1]C+1 -> 1686 | B1686: =SUM(R1C[-1]:RC1) -> 1422141
A1687: =R[-1]C+1 -> 1687 | B1687: =SUM(R1C[-1]:RC1) -> 1423828
A1688: =R[-1]C+1 -> 1688 | B1688: =SUM(R1C[-1]:RC1) -> 1425516
A1689: =R[-1]C+1 -> 1689 | B1689: =SUM(R1C[-1]:RC1) -> 1427205
A1690: =R[-1]C+1 -> 1690 | B1690: =SUM(R1C[-1]:RC1) -> 1428895
A1691: =R[-1]C+1 -> 1691 | B1691: =SUM(R1C[-1]:RC1) -> 1430586
A1692: =R[-1]C+1 -> 1692 | B1692: =SUM(R1C[-1]:RC1) -> 1432278
A1693: =R[-1]C+1 -> 1693 | B1693: =SUM(R1C[-1]:RC1) -> 1433971
A1694: =R[-1]C+1 -> 1694 | B1694: =SUM(R1C[-1]:RC1) -> 1435665
A1695: =R[-1]C+1 -> 1695 | B1695: =SUM(R1C[-1]:RC1) -> 1437360
A1696: =R[-1]C+1 -> 1696 | B1696: =SUM(R1C[-1]:RC1) -> 1439056
A1697: =R[-1]C+1 -> 1697 | B1697: =SUM(R1C[-1]:RC1) -> 1440753
A1698: =R[-1]C+1 -> 1698 | B1698: =SUM(R1C[-1]:RC1) -> 1442451
A1699: =R[-1]C+1 -> 1699 | B1699: =SUM(R1C[-1]:RC1) -> 1444150
A1700: =R[-1]C+1 -> 1700 | B1700: =SUM(R1C[-1]:RC1) -> 1445850
A1701: =R[-1]C+1 -> 1701 | B1701: =SUM(R1C[-1]:RC1) -> 1447551
A1702: =R[-1]C+1 -> 1702 | B1702: =SUM(R1C[-1]:RC1) -> 1449253
A1703: =R[-1]C+1 -> 1703 | B1703: =SUM(R1C[-1]:RC1) -> 1450956
A1704: =R[-1]C+1 -> 1704 | B1704: =SUM(R1C[-1]:RC1) -> 1452660
A1705: =R[-1]C+1 -> 1705 | B1705: =SUM(R1C[-1]:RC1) -> 1454365
A1706: =R[-1]C+1 -> 1706 | B1706: =SUM(R1C[-1]:RC1) -> 1456071
A1707: =R[-1]C+1 -> 1707 | B1707: =SUM(R1C[-1]:RC1) -> 1457778
A1708: =R[-1]C+1 -> 1708 | B1708: =SUM(R1C[-1]:RC1) -> 1459486
A1709: =R[-1]C+1 -> 1709 | B1709: =SUM(R1C[-1]:RC1) -> 1461195
A1710: =R[-1]C+1 -> 1710 | B1710: =SUM(R1C[-1]:RC1) -> 1462905
A1711: =R[-1]C+1 -> 1711 | B1711: =SUM(R1C[-1]:RC1) -> 1464616
A1712: =R[-1]C+1 -> 1712 | B1712: =SUM(R1C[-1]:RC1) -> 1466328
A1713: =R[-1]C+1 -> 1713 | B1713: =SUM(R1C[-1]:RC1) -> 1468041
A1714: =R[-1]C+1 -> 1714 | B1714: =SUM(R1C[-1]:RC1) -> 1469755
A1715: =R[-1]C+1 -> 1715 | B1715: =SUM(R1C[-1]:RC1) -> 1471470
A1716: =R[-1]C+1 -> 1716 | B1716: =SUM(R1C[-1]:RC1) -> 1473186
A1717: =R[-1]C+1 -> 1717 | B1717: =SUM(R1C[-1]:RC1) -> 1474903
A1718: =R[-1]C+1 -> 1718 | B1718: =SUM(R1C[-1]:RC1) -> 1476621
A1719: =R[-1]C+1 -> 1719 | B1719: =SUM(R1C[-1]:RC1) -> 1478340
A1720: =R[-1]C+1 -> 1720 | B1720: =SUM(R1C[-1]:RC1) -> 1480060
A1721: =R[-1]C+1 -> 1721 | B1721: =SUM(R1C[-1]:RC1) -> 1481781
A1722: =R[-1]C+1 -> 1722 | B1722: =SUM(R1C[-1]:RC1) -> 1483503
A1723: =R[-1]C+1 -> 1723 | B1723: =SUM(R1C[-1]:RC1) -> 1485226
A1724: =R[-1]C+1 -> 1724 | B1724: =SUM(R1C[-1]:RC1) -> 1486950
A1725: =R[-1]C+1 -> 1725 | B1725: =SUM(R1C[-1]:RC1) -> 1488675
A1726: =R[-1]C+1 -> 1726 | B1726: =SUM(R1C[-1]:RC1) -> 1490401
A1727: =R[-1]C+1 -> 1727 | B1727: =SUM(R1C[-1]:RC1) -> 1492128
A1728: =R[-1]C+1 -> 1728 | B1728: =SUM(R1C[-1]:RC1) -> 1493856
A1729: =R[-1]C+1 -> 1729 | B1729: =SUM(R1C[-1]:RC1) -> 1495585
A1730: =R[-1]C+1 -> 1730 | B1730: =SUM(R1C[-1]:RC1) -> 1497315
A1731: =R[-1]C+1 -> 1731 | B1731: =SUM(R1C[-1]:RC1) -> 1499046
A1732: =R[-1]C+1 -> 1732 | B1732: =SUM(R1C[-1]:RC1) -> 1500778
A1733: =R[-1]C+1 -> 1733 | B1733: =SUM(R1C[-1]:RC1) -> 1502511
A1734: =R[-1]C+1 -> 1734 | B1734: =SUM(R1C[-1]:RC1) -> 1504245
A1735: =R[-1]C+1 -> 1735 | B1735: =SUM(R1C[-1]:RC1) -> 1505980
A1736: =R[-1]C+1 -> 1736 | B1736: =SUM(R1C[-1]:RC1) -> 1507716
A1737: =R[-1]C+1 -> 1737 | B1737: =SUM(R1C[-1]:RC1) -> 1509453
A1738: =R[-1]C+1 -> 1738 | B1738: =SUM(R1C[-1]:RC1) -> 1511191
A1739: =R[-1]C+1 -> 1739 | B1739: =SUM(R1C[-1]:RC1) -> 1512930
A1740: =R[-1]C+1 -> 1740 | B1740: =SUM(R1C[-1]:RC1) -> 1514670
A1741: =R[-1]C+1 -> 1741 | B1741: =SUM(R1C[-1]:RC1) -> 1516411
A1742: =R[-1]C+1 -> 1742 | B1742: =SUM(R1C[-1]:RC1) -> 1518153
A1743: =R[-1]C+1 -> 1743 | B1743: =SUM(R1C[-1]:RC1) -> 1519896
A1744: =R[-1]C+1 -> 1744 | B1744: =SUM(R1C[-1]:RC1) -> 1521640
A1745: =R[-1]C+1 -> 1745 | B1745: =SUM(R1C[-1]:RC1) -> 1523385
A1746: =R[-1]C+1 -> 1746 | B1746: =SUM(R1C[-1]:RC1) -> 1525131
A1747: =R[-1]C+1 -> 1747 | B1747: =SUM(R1C[-1]:RC1) -> 1526878
A1748: =R[-1]C+1 -> 1748 | B1748: =SUM(R1C[-1]:RC1) -> 1528626
A1749: =R[-1]C+1 -> 1749 | B1749: =SUM(R1C[-1]:RC1) -> 1530375
A1750: =R[-1]C+1 -> 1750 | B1750: =SUM(R1C[-1]:RC1) -> 1532125
A1751: =R[-1]C+1 -> 1751 | B1751: =SUM(R1C[-1]:RC1) -> 1533876
A1752: =R[-1]C+1 -> 1752 | B1752: =SUM(R1C[-1]:RC1) -> 1535628
A1753: =R[-1]C+1 -> 1753 | B1753: =SUM(R1C[-1]:RC1) -> 1537381
A1754: =R[-1]C+1 -> 1754 | B1754: =SUM(R1C[-1]:RC1) -> 1539135
A1755: =R[-1]C+1 -> 1755 | B1755: =SUM(R1C[-1]:RC1) -> 1540890
A1756: =R[-1]C+1 -> 1756 | B1756: =SUM(R1C[-1]:RC1) -> 1542646
A1757: =R[-1]C+1 -> 1757 | B1757: =SUM(R1C[-1]:RC1) -> 1544403
A1758: =R[-1]C+1 -> 1758 | B1758: =SUM(R1C[-1]:RC1) -> 1546161
A1759: =R[-1]C+1 -> 1759 | B1759: =SUM(R1C[-1]:RC1) -> 1547920
A1760: =R[-1]C+1 -> 1760 | B1760: =SUM(R1C[-1]:RC1) -> 1549680
A1761: =R[-1]C+1 -> 1761 | B1761: =SUM(R1C[-1]:RC1) -> 1551441
A1762: =R[-1]C+1 -> 1762 | B1762: =SUM(R1C[-1]:RC1) -> 1553203
A1763: =R[-1]C+1 -> 1763 | B1763: =SUM(R1C[-1]:RC1) -> 1554966
A1764: =R[-1]C+1 -> 1764 | B1764: =SUM(R1C[-1]:RC1) -> 1556730
A1765: =R[-1]C+1 -> 1765 | B1765: =SUM(R1C[-1]:RC1) -> 1558495
A1766: =R[-1]C+1 -> 1766 | B1766: =SUM(R1C[-1]:RC1) -> 1560261
A1767: =R[-1]C+1 -> 1767 | B1767: =SUM(R1C[-1]:RC1) -> 1562028
A1768: =R[-1]C+1 -> 1768 | B1768: =SUM(R1C[-1]:RC1) -> 1563796
A1769: =R[-1]C+1 -> 1769 | B1769: =SUM(R1C[-1]:RC1) -> 1565565
A1770: =R[-1]C+1 -> 1770 | B1770: =SUM(R1C[-1]:RC1) -> 1567335
A1771: =R[-1]C+1 -> 1771 | B1771: =SUM(R1C[-1]:RC1) -> 1569106
A1772: =R[-1]C+1 -> 1772 | B1772: =SUM(R1C[-1]:RC1) -> 1570878
A1773: =R[-1]C+1 -> 1773 | B1773: =SUM(R1C[-1]:RC1) -> 1572651
A1774: =R[-1]C+1 -> 1774 | B1774: =SUM(R1C[-1]:RC1) -> 1574425
A1775: =R[-1]C+1 -> 1775 | B1775: =SUM(R1C[-1]:RC1) -> 1576200
A1776: =R[-1]C+1 -> 1776 | B1776: =SUM(R1C[-1]:RC1) -> 1577976
A1777: =R[-1]C+1 -> 1777 | B1777: =SUM(R1C[-1]:RC1) -> 1579753
A1778: =R[-1]C+1 -> 1778 | B1778: =SUM(R1C[-1]:RC1) -> 1581531
A1779: =R[-1]C+1 -> 1779 | B1779: =SUM(R1C[-1]:RC1) -> 1583310
A1780: =R[-1]C+1 -> 1780 | B1780: =SUM(R1C[-1]:RC1) -> 1585090
A1781: =R[-1]C+1 -> 1781 | B1781: =SUM(R1C[-1]:RC1) -> 1586871
A1782: =R[-1]C+1 -> 1782 | B1782: =SUM(R1C[-1]:RC1) -> 1588653
A1783: =R[-1]C+1 -> 1783 | B1783: =SUM(R1C[-1]:RC1) -> 1590436
A1784: =R[-1]C+1 -> 1784 | B1784: =SUM(R1C[-1]:RC1) -> 1592220
A1785: =R[-1]C+1 -> 1785 | B1785: =SUM(R1C[-1]:RC1) -> 1594005
A1786: =R[-1]C+1 -> 1786 | B1786: =SUM(R1C[-1]:RC1) -> 1595791
A1787: =R[-1]C+1 -> 1787 | B1787: =SUM(R1C[-1]:RC1) -> 1597578
A1788: =R[-1]C+1 -> 1788 | B1788: =SUM(R1C[-1]:RC1) -> 1599366
A1789: =R[-1]C+1 -> 1789 | B1789: =SUM(R1C[-1]:RC1) -> 1601155
A1790: =R[-1]C+1 -> 1790 | B1790: =SUM(R1C[-1]:RC1) -> 1602945
A1791: =R[-1]C+1 -> 1791 | B1791: =SUM(R1C[-1]:RC1) -> 1604736
A1792: =R[-1]C+1 -> 1792 | B1792: =SUM(R1C[-1]:RC1) -> 1606528
A1793: =R[-1]C+1 -> 1793 | B1793: =SUM(R1C[-1]:RC1) -> 1608321
A1794: =R[-1]C+1 -> 1794 | B1794: =SUM(R1C[-1]:RC1) -> 1610115
A1795: =R[-1]C+1 -> 1795 | B1795: =SUM(R1C[-1]:RC1) -> 1611910
A1796: =R[-1]C+1 -> 1796 | B1796: =SUM(R1C[-1]:RC1) -> 1613706
A1797: =R[-1]C+1 -> 1797 | B1797: =SUM(R1C[-1]:RC1) -> 1615503
A1798: =R[-1]C+1 -> 1798 | B1798: =SUM(R1C[-1]:RC1) -> 1617301
A1799: =R[-1]C+1 -> 1799 | B1799: =SUM(R1C[-1]:RC1) -> 1619100
A1800: =R[-1]C+1 -> 1800 | B1800: =SUM(R1C[-1]:RC1) -> 1620900
A1801: =R[-1]C+1 -> 1801 | B1801: =SUM(R1C[-1]:RC1) -> 1622701
A1802: =R[-1]C+1 -> 1802 | B1802: =SUM(R1C[-1]:RC1) -> 1624503
A1803: =R[-1]C+1 -> 1803 | B1803: =SUM(R1C[-1]:RC1) -> 1626306
A1804: =R[-1]C+1 -> 1804 | B1804: =SUM(R1C[-1]:RC1) -> 1628110
A1805: =R[-1]C+1 -> 1805 | B1805: =SUM(R1C[-1]:RC1) -> 1629915
A1806: =R[-1]C+1 -> 1806 | B1806: =SUM(R1C[-1]:RC1) -> 1631721
A1807: =R[-1]C+1 -> 1807 | B1807: =SUM(R1C[-1]:RC1) -> 1633528
A1808: =R[-1]C+1 -> 1808 | B1808: =SUM(R1C[-1]:RC1) -> 1635336
A1809: =R[-1]C+1 -> 1809 | B1809: =SUM(R1C[-1]:RC1) -> 1637145
A1810: =R[-1]C+1 -> 1810 | B1810: =SUM(R1C[-1]:RC1) -> 1638955
A1811: =R[-1]C+1 -> 1811 | B1811: =SUM(R1C[-1]:RC1) -> 1640766
A1812: =R[-1]C+1 -> 1812 | B1812: =SUM(R1C[-1]:RC1) -> 1642578
A1813: =R[-1]C+1 -> 1813 | B1813: =SUM(R1C[-1]:RC1) -> 1644391
A1814: =R[-1]C+1 -> 1814 | B1814: =SUM(R1C[-1]:RC1) -> 1646205
A1815: =R[-1]C+1 -> 1815 | B1815: =SUM(R1C[-1]:RC1) -> 1648020
A1816: =R[-1]C+1 -> 1816 | B1816: =SUM(R1C[-1]:RC1) -> 1649836
A1817: =R[-1]C+1 -> 1817 | B1817: =SUM(R1C[-1]:RC1) -> 1651653
A1818: =R[-1]C+1 -> 1818 | B1818: =SUM(R1C[-1]:RC1) -> 1653471
A1819: =R[-1]C+1 -> 1819 | B1819: =SUM(R1C[-1]:RC1) -> 1655290
A1820: =R[-1]C+1 -> 1820 | B1820: =SUM(R1C[-1]:RC1) -> 1657110
A1821: =R[-1]C+1 -> 1821 | B1821: =SUM(R1C[-1]:RC1) -> 1658931
A1822: =R[-1]C+1 -> 1822 | B1822: =SUM(R1C[-1]:RC1) -> 1660753
A1823: =R[-1]C+1 -> 1823 | B1823: =SUM(R1C[-1]:RC1) -> 1662576
A1824: =R[-1]C+1 -> 1824 | B1824: =SUM(R1C[-1]:RC1) -> 1664400
A1825: =R[-1]C+1 -> 1825 | B1825: =SUM(R1C[-1]:RC1) -> 1666225
A1826: =R[-1]C+1 -> 1826 | B1826: =SUM(R1C[-1]:RC1) -> 1668051
A1827: =R[-1]C+1 -> 1827 | B1827: =SUM(R1C[-1]:RC1) -> 1669878
A1828: =R[-1]C+1 -> 1828 | B1828: =SUM(R1C[-1]:RC1) -> 1671706
A1829: =R[-1]C+1 -> 1829 | B1829: =SUM(R1C[-1]:RC1) -> 1673535
A1830: =R[-1]C+1 -> 1830 | B1830: =SUM(R1C[-1]:RC1) -> 1675365
A1831: =R[-1]C+1 -> 1831 | B1831: =SUM(R1C[-1]:RC1) -> 1677196
A1832: =R[-1]C+1 -> 1832 | B1832: =SUM(R1C[-1]:RC1) -> 1679028
A1833: =R[-1]C+1 -> 1833 | B1833: =SUM(R1C[-1]:RC1) -> 1680861
A1834: =R[-1]C+1 -> 1834 | B1834: =SUM(R1C[-1]:RC1) -> 1682695
A1835: =R[-1]C+1 -> 1835 | B1835: =SUM(R1C[-1]:RC1) -> 1684530
A1836: =R[-1]C+1 -> 1836 | B1836: =SUM(R1C[-1]:RC1) -> 1686366
A1837: =R[-1]C+1 -> 1837 | B1837: =SUM(R1C[-1]:RC1) -> 1688203
A1838: =R[-1]C+1 -> 1838 | B1838: =SUM(R1C[-1]:RC1) -> 1690041
A1839: =R[-1]C+1 -> 1839 | B1839: =SUM(R1C[-1]:RC1) -> 1691880
A1840: =R[-1]C+1 -> 1840 | B1840: =SUM(R1C[-1]:RC1) -> 1693720
A1841: =R[-1]C+1 -> 1841 | B1841: =SUM(R1C[-1]:RC1) -> 1695561
A1842: =R[-1]C+1 -> 1842 | B1842: =SUM(R1C[-1]:RC1) -> 1697403
A1843: =R[-1]C+1 -> 1843 | B1843: =SUM(R1C[-1]:RC1) -> 1699246
A1844: =R[-1]C+1 -> 1844 | B1844: =SUM(R1C[-1]:RC1) -> 1701090
A1845: =R[-1]C+1 -> 1845 | B1845: =SUM(R1C[-1]:RC1) -> 1702935
A1846: =R[-1]C+1 -> 1846 | B1846: =SUM(R1C[-1]:RC1) -> 1704781
A1847: =R[-1]C+1 -> 1847 | B1847: =SUM(R1C[-1]:RC1) -> 1706628
A1848: =R[-1]C+1 -> 1848 | B1848: =SUM(R1C[-1]:RC1) -> 1708476
A1849: =R[-1]C+1 -> 1849 | B1849: =SUM(R1C[-1]:RC1) -> 1710325
A1850: =R[-1]C+1 -> 1850 | B1850: =SUM(R1C[-1]:RC1) -> 1712175
A1851: =R[-1]C+1 -> 1851 | B1851: =SUM(R1C[-1]:RC1) -> 1714026
A1852: =R[-1]C+1 -> 1852 | B1852: =SUM(R1C[-1]:RC1) -> 1715878
A1853: =R[-1]C+1 -> 1853 | B1853: =SUM(R1C[-1]:RC1) -> 1717731
A1854: =R[-1]C+1 -> 1854 | B1854: =SUM(R1C[-1]:RC1) -> 1719585
A1855: =R[-1]C+1 -> 1855 | B1855: =SUM(R1C[-1]:RC1) -> 1721440
A1856: =R[-1]C+1 -> 1856 | B1856: =SUM(R1C[-1]:RC1) -> 1723296
A1857: =R[-1]C+1 -> 1857 | B1857: =SUM(R1C[-1]:RC1) -> 1725153
A1858: =R[-1]C+1 -> 1858 | B1858: =SUM(R1C[-1]:RC1) -> 1727011
A1859: =R[-1]C+1 -> 1859 | B1859: =SUM(R1C[-1]:RC1) -> 1728870
A1860: =R[-1]C+1 -> 1860 | B1860: =SUM(R1C[-1]:RC1) -> 1730730
A1861: =R[-1]C+1 -> 1861 | B1861: =SUM(R1C[-1]:RC1) -> 1732591
A1862: =R[-1]C+1 -> 1862 | B1862: =SUM(R1C[-1]:RC1) -> 1734453
A1863: =R[-1]C+1 -> 1863 | B1863: =SUM(R1C[-1]:RC1) -> 1736316
A1864: =R[-1]C+1 -> 1864 | B1864: =SUM(R1C[-1]:RC1) -> 1738180
A1865: =R[-1]C+1 -> 1865 | B1865: =SUM(R1C[-1]:RC1) -> 1740045
A1866: =R[-1]C+1 -> 1866 | B1866: =SUM(R1C[-1]:RC1) -> 1741911
A1867: =R[-1]C+1 -> 1867 | B1867: =SUM(R1C[-1]:RC1) -> 1743778
A1868: =R[-1]C+1 -> 1868 | B1868: =SUM(R1C[-1]:RC1) -> 1745646
A1869: =R[-1]C+1 -> 1869 | B1869: =SUM(R1C[-1]:RC1) -> 1747515
A1870: =R[-1]C+1 -> 1870 | B1870: =SUM(R1C[-1]:RC1) -> 1749385
A1871: =R[-1]C+1 -> 1871 | B1871: =SUM(R1C[-1]:RC1) -> 1751256
A1872: =R[-1]C+1 -> 1872 | B1872: =SUM(R1C[-1]:RC1) -> 1753128
A1873: =R[-1]C+1 -> 1873 | B1873: =SUM(R1C[-1]:RC1) -> 1755001
A1874: =R[-1]C+1 -> 1874 | B1874: =SUM(R1C[-1]:RC1) -> 1756875
A1875: =R[-1]C+1 -> 1875 | B1875: =SUM(R1C[-1]:RC1) -> 1758750
A1876: =R[-1]C+1 -> 1876 | B1876: =SUM(R1C[-1]:RC1) -> 1760626
A1877: =R[-1]C+1 -> 1877 | B1877: =SUM(R1C[-1]:RC1) -> 1762503
A1878: =R[-1]C+1 -> 1878 | B1878: =SUM(R1C[-1]:RC1) -> 1764381
A1879: =R[-1]C+1 -> 1879 | B1879: =SUM(R1C[-1]:RC1) -> 1766260
A1880: =R[-1]C+1 -> 1880 | B1880: =SUM(R1C[-1]:RC1) -> 1768140
A1881: =R[-1]C+1 -> 1881 | B1881: =SUM(R1C[-1]:RC1) -> 1770021
A1882: =R[-1]C+1 -> 1882 | B1882: =SUM(R1C[-1]:RC1) -> 1771903
A1883: =R[-1]C+1 -> 1883 | B1883: =SUM(R1C[-1]:RC1) -> 1773786
A1884: =R[-1]C+1 -> 1884 | B1884: =SUM(R1C[-1]:RC1) -> 1775670
A1885: =R[-1]C+1 -> 1885 | B1885: =SUM(R1C[-1]:RC1) -> 1777555
A1886: =R[-1]C+1 -> 1886 | B1886: =SUM(R1C[-1]:RC1) -> 1779441
A1887: =R[-1]C+1 -> 1887 | B1887: =SUM(R1C[-1]:RC1) -> 1781328
A1888: =R[-1]C+1 -> 1888 | B1888: =SUM(R1C[-1]:RC1) -> 1783216
A1889: =R[-1]C+1 -> 1889 | B1889: =SUM(R1C[-1]:RC1) -> 1785105
A1890: =R[-1]C+1 -> 1890 | B1890: =SUM(R1C[-1]:RC1) -> 1786995
A1891: =R[-1]C+1 -> 1891 | B1891: =SUM(R1C[-1]:RC1) -> 1788886
A1892: =R[-1]C+1 -> 1892 | B1892: =SUM(R1C[-1]:RC1) -> 1790778
A1893: =R[-1]C+1 -> 1893 | B1893: =SUM(R1C[-1]:RC1) -> 1792671
A1894: =R[-1]C+1 -> 1894 | B1894: =SUM(R1C[-1]:RC1) -> 1794565
A1895: =R[-1]C+1 -> 1895 | B1895: =SUM(R1C[-1]:RC1) -> 1796460
A1896: =R[-1]C+1 -> 1896 | B1896: =SUM(R1C[-1]:RC1) -> 1798356
A1897: =R[-1]C+1 -> 1897 | B1897: =SUM(R1C[-1]:RC1) -> 1800253
A1898: =R[-1]C+1 -> 1898 | B1898: =SUM(R1C[-1]:RC1) -> 1802151
A1899: =R[-1]C+1 -> 1899 | B1899: =SUM(R1C[-1]:RC1) -> 1804050
A1900: =R[-1]C+1 -> 1900 | B1900: =SUM(R1C[-1]:RC1) -> 1805950
A1901: =R[-1]C+1 -> 1901 | B1901: =SUM(R1C[-1]:RC1) -> 1807851
A1902: =R[-1]C+1 -> 1902 | B1902: =SUM(R1C[-1]:RC1) -> 1809753
A1903: =R[-1]C+1 -> 1903 | B1903: =SUM(R1C[-1]:RC1) -> 1811656
A1904: =R[-1]C+1 -> 1904 | B1904: =SUM(R1C[-1]:RC1) -> 1813560
A1905: =R[-1]C+1 -> 1905 | B1905: =SUM(R1C[-1]:RC1) -> 1815465
A1906: =R[-1]C+1 -> 1906 | B1906: =SUM(R1C[-1]:RC1) -> 1817371
A1907: =R[-1]C+1 -> 1907 | B1907: =SUM(R1C[-1]:RC1) -> 1819278
A1908: =R[-1]C+1 -> 1908 | B1908: =SUM(R1C[-1]:RC1) -> 1821186
A1909: =R[-1]C+1 -> 1909 | B1909: =SUM(R1C[-1]:RC1) -> 1823095
A1910: =R[-1]C+1 -> 1910 | B1910: =SUM(R1C[-1]:RC1) -> 1825005
A1911: =R[-1]C+1 -> 1911 | B1911: =SUM(R1C[-1]:RC1) -> 1826916
A1912: =R[-1]C+1 -> 1912 | B1912: =SUM(R1C[-1]:RC1) -> 1828828
A1913: =R[-1]C+1 -> 1913 | B1913: =SUM(R1C[-1]:RC1) -> 1830741
A1914: =R[-1]C+1 -> 1914 | B1914: =SUM(R1C[-1]:RC1) -> 1832655
A1915: =R[-1]C+1 -> 1915 | B1915: =SUM(R1C[-1]:RC1) -> 1834570
A1916: =R[-1]C+1 -> 1916 | B1916: =SUM(R1C[-1]:RC1) -> 1836486
A1917: =R[-1]C+1 -> 1917 | B1917: =SUM(R1C[-1]:RC1) -> 1838403
A1918: =R[-1]C+1 -> 1918 | B1918: =SUM(R1C[-1]:RC1) -> 1840321
A1919: =R[-1]C+1 -> 1919 | B1919: =SUM(R1C[-1]:RC1) -> 1842240
A1920: =R[-1]C+1 -> 1920 | B1920: =SUM(R1C[-1]:RC1) -> 1844160
A1921: =R[-1]C+1 -> 1921 | B1921: =SUM(R1C[-1]:RC1) -> 1846081
A1922: =R[-1]C+1 -> 1922 | B1922: =SUM(R1C[-1]:RC1) -> 1848003
A1923: =R[-1]C+1 -> 1923 | B1923: =SUM(R1C[-1]:RC1) -> 1849926
A1924: =R[-1]C+1 -> 1924 | B1924: =SUM(R1C[-1]:RC1) -> 1851850
A1925: =R[-1]C+1 -> 1925 | B1925: =SUM(R1C[-1]:RC1) -> 1853775
A1926: =R[-1]C+1 -> 1926 | B1926: =SUM(R1C[-1]:RC1) -> 1855701
A1927: =R[-1]C+1 -> 1927 | B1927: =SUM(R1C[-1]:RC1) -> 1857628
A1928: =R[-1]C+1 -> 1928 | B1928: =SUM(R1C[-1]:RC1) -> 1859556
A1929: =R[-1]C+1 -> 1929 | B1929: =SUM(R1C[-1]:RC1) -> 1861485
A1930: =R[-1]C+1 -> 1930 | B1930: =SUM(R1C[-1]:RC1) -> 1863415
A1931: =R[-1]C+1 -> 1931 | B1931: =SUM(R1C[-1]:RC1) -> 1865346
A1932: =R[-1]C+1 -> 1932 | B1932: =SUM(R1C[-1]:RC1) -> 1867278
A1933: =R[-1]C+1 -> 1933 | B1933: =SUM(R1C[-1]:RC1) -> 1869211
A1934: =R[-1]C+1 -> 1934 | B1934: =SUM(R1C[-1]:RC1) -> 1871145
A1935: =R[-1]C+1 -> 1935 | B1935: =SUM(R1C[-1]:RC1) -> 1873080
A1936: =R[-1]C+1 -> 1936 | B1936: =SUM(R1C[-1]:RC1) -> 1875016
A1937: =R[-1]C+1 -> 1937 | B1937: =SUM(R1C[-1]:RC1) -> 1876953
A1938: =R[-1]C+1 -> 1938 | B1938: =SUM(R1C[-1]:RC1) -> 1878891
A1939: =R[-1]C+1 -> 1939 | B1939: =SUM(R1C[-1]:RC1) -> 1880830
A1940: =R[-1]C+1 -> 1940 | B1940: =SUM(R1C[-1]:RC1) -> 1882770
A1941: =R[-1]C+1 -> 1941 | B1941: =SUM(R1C[-1]:RC1) -> 1884711
A1942: =R[-1]C+1 -> 1942 | B1942: =SUM(R1C[-1]:RC1) -> 1886653
A1943: =R[-1]C+1 -> 1943 | B1943: =SUM(R1C[-1]:RC1) -> 1888596
A1944: =R[-1]C+1 -> 1944 | B1944: =SUM(R1C[-1]:RC1) -> 1890540
A1945: =R[-1]C+1 -> 1945 | B1945: =SUM(R1C[-1]:RC1) -> 1892485
A1946: =R[-1]C+1 -> 1946 | B1946: =SUM(R1C[-1]:RC1) -> 1894431
A1947: =R[-1]C+1 -> 1947 | B1947: =SUM(R1C[-1]:RC1) -> 1896378
A1948: =R[-1]C+1 -> 1948 | B1948: =SUM(R1C[-1]:RC1) -> 1898326
A1949: =R[-1]C+1 -> 1949 | B1949: =SUM(R1C[-1]:RC1) -> 1900275
A1950: =R[-1]C+1 -> 1950 | B1950: =SUM(R1C[-1]:RC1) -> 1902225
A1951: =R[-1]C+1 -> 1951 | B1951: =SUM(R1C[-1]:RC1) -> 1904176
A1952: =R[-1]C+1 -> 1952 | B1952: =SUM(R1C[-1]:RC1) -> 1906128
A1953: =R[-1]C+1 -> 1953 | B1953: =SUM(R1C[-1]:RC1) -> 1908081
A1954: =R[-1]C+1 -> 1954 | B1954: =SUM(R1C[-1]:RC1) -> 1910035
A1955: =R[-1]C+1 -> 1955 | B1955: =SUM(R1C[-1]:RC1) -> 1911990
A1956: =R[-1]C+1 -> 1956 | B1956: =SUM(R1C[-1]:RC1) -> 1913946
A1957: =R[-1]C+1 -> 1957 | B1957: =SUM(R1C[-1]:RC1) -> 1915903
A1958: =R[-1]C+1 -> 1958 | B1958: =SUM(R1C[-1]:RC1) -> 1917861
A1959: =R[-1]C+1 -> 1959 | B1959: =SUM(R1C[-1]:RC1) -> 1919820
A1960: =R[-1]C+1 -> 1960 | B1960: =SUM(R1C[-1]:RC1) -> 1921780
A1961: =R[-1]C+1 -> 1961 | B1961: =SUM(R1C[-1]:RC1) -> 1923741
A1962: =R[-1]C+1 -> 1962 | B1962: =SUM(R1C[-1]:RC1) -> 1925703
A1963: =R[-1]C+1 -> 1963 | B1963: =SUM(R1C[-1]:RC1) -> 1927666
A1964: =R[-1]C+1 -> 1964 | B1964: =SUM(R1C[-1]:RC1) -> 1929630
A1965: =R[-1]C+1 -> 1965 | B1965: =SUM(R1C[-1]:RC1) -> 1931595
A1966: =R[-1]C+1 -> 1966 | B1966: =SUM(R1C[-1]:RC1) -> 1933561
A1967: =R[-1]C+1 -> 1967 | B1967: =SUM(R1C[-1]:RC1) -> 1935528
A1968: =R[-1]C+1 -> 1968 | B1968: =SUM(R1C[-1]:RC1) -> 1937496
A1969: =R[-1]C+1 -> 1969 | B1969: =SUM(R1C[-1]:RC1) -> 1939465
A1970: =R[-1]C+1 -> 1970 | B1970: =SUM(R1C[-1]:RC1) -> 1941435
A1971: =R[-1]C+1 -> 1971 | B1971: =SUM(R1C[-1]:RC1) -> 1943406
A1972: =R[-1]C+1 -> 1972 | B1972: =SUM(R1C[-1]:RC1) -> 1945378
A1973: =R[-1]C+1 -> 1973 | B1973: =SUM(R1C[-1]:RC1) -> 1947351
A1974: =R[-1]C+1 -> 1974 | B1974: =SUM(R1C[-1]:RC1) -> 1949325
A1975: =R[-1]C+1 -> 1975 | B1975: =SUM(R1C[-1]:RC1) -> 1951300
A1976: =R[-1]C+1 -> 1976 | B1976: =SUM(R1C[-1]:RC1) -> 1953276
A1977: =R[-1]C+1 -> 1977 | B1977: =SUM(R1C[-1]:RC1) -> 1955253
A1978: =R[-1]C+1 -> 1978 | B1978: =SUM(R1C[-1]:RC1) -> 1957231
A1979: =R[-1]C+1 -> 1979 | B1979: =SUM(R1C[-1]:RC1) -> 1959210
A1980: =R[-1]C+1 -> 1980 | B1980: =SUM(R1C[-1]:RC1) -> 1961190
A1981: =R[-1]C+1 -> 1981 | B1981: =SUM(R1C[-1]:RC1) -> 1963171
A1982: =R[-1]C+1 -> 1982 | B1982: =SUM(R1C[-1]:RC1) -> 1965153
A1983: =R[-1]C+1 -> 1983 | B1983: =SUM(R1C[-1]:RC1) -> 1967136
A1984: =R[-1]C+1 -> 1984 | B1984: =SUM(R1C[-1]:RC1) -> 1969120
A1985: =R[-1]C+1 -> 1985 | B1985: =SUM(R1C[-1]:RC1) -> 1971105
A1986: =R[-1]C+1 -> 1986 | B1986: =SUM(R1C[-1]:RC1) -> 1973091
A1987: =R[-1]C+1 -> 1987 | B1987: =SUM(R1C[-1]:RC1) -> 1975078
A1988: =R[-1]C+1 -> 1988 | B1988: =SUM(R1C[-1]:RC1) -> 1977066
A1989: =R[-1]C+1 -> 1989 | B1989: =SUM(R1C[-1]:RC1) -> 1979055
A1990: =R[-1]C+1 -> 1990 | B1990: =SUM(R1C[-1]:RC1) -> 1981045
A1991: =R[-1]C+1 -> 1991 | B1991: =SUM(R1C[-1]:RC1) -> 1983036
A1992: =R[-1]C+1 -> 1992 | B1992: =SUM(R1C[-1]:RC1) -> 1985028
A1993: =R[-1]C+1 -> 1993 | B1993: =SUM(R1C[-1]:RC1) -> 1987021
A1994: =R[-1]C+1 -> 1994 | B1994: =SUM(R1C[-1]:RC1) -> 1989015
A1995: =R[-1]C+1 -> 1995 | B1995: =SUM(R1C[-1]:RC1) -> 1991010
A1996: =R[-1]C+1 -> 1996 | B1996: =SUM(R1C[-1]:RC1) -> 1993006
A1997: =R[-1]C+1 -> 1997 | B1997: =SUM(R1C[-1]:RC1) -> 1995003
A1998: =R[-1]C+1 -> 1998 | B1998: =SUM(R1C[-1]:RC1) -> 1997001
A1999: =R[-1]C+1 -> 1999 | B1999: =SUM(R1C[-1]:RC1) -> 1999000
A2000: =R[-1]C+1 -> 2000 | B2000: =SUM(R1C[-1]:RC1) -> 2001000
A2001: =R[-1]C+1 -> 2001 | B2001: =SUM(R1C[-1]:RC1) -> 2003001
A2002: =R[-1]C+1 -> 2002 | B2002: =SUM(R1C[-1]:RC1) -> 2005003
A2003: =R[-1]C+1 -> 2003 | B2003: =SUM(R1C[-1]:RC1) -> 2007006
A2004: =R[-1]C+1 -> 2004 | B2004: =SUM(R1C[-1]:RC1) -> 2009010
A2005: =R[-1]C+1 -> 2005 | B2005: =SUM(R1C[-1]:RC1) -> 2011015
A2006: =R[-1]C+1 -> 2006 | B2006: =SUM(R1C[-1]:RC1) -> 2013021
A2007: =R[-1]C+1 -> 2007 | B2007: =SUM(R1C[-1]:RC1) -> 2015028
A2008: =R[-1]C+1 -> 2008 | B2008: =SUM(R1C[-1]:RC1) -> 2017036
A2009: =R[-1]C+1 -> 2009 | B2009: =SUM(R1C[-1]:RC1) -> 2019045
A2010: =R[-1]C+1 -> 2010 | B2010: =SUM(R1C[-1]:RC1) -> 2021055
A2011: =R[-1]C+1 -> 2011 | B2011: =SUM(R1C[-1]:RC1) -> 2023066
A2012: =R[-1]C+1 -> 2012 | B2012: =SUM(R1C[-1]:RC1) -> 2025078
A2013: =R[-1]C+1 -> 2013 | B2013: =SUM(R1C[-1]:RC1) -> 2027091
A2014: =R[-1]C+1 -> 2014 | B2014: =SUM(R1C[-1]:RC1) -> 2029105
A2015: =R[-1]C+1 -> 2015 | B2015: =SUM(R1C[-1]:RC1) -> 2031120
A2016: =R[-1]C+1 -> 2016 | B2016: =SUM(R1C[-1]:RC1) -> 2033136
A2017: =R[-1]C+1 -> 2017 | B2017: =SUM(R1C[-1]:RC1) -> 2035153
A2018: =R[-1]C+1 -> 2018 | B2018: =SUM(R1C[-1]:RC1) -> 2037171
A2019: =R[-1]C+1 -> 2019 | B2019: =SUM(R1C[-1]:RC1) -> 2039190
A2020: =R[-1]C+1 -> 2020 | B2020: =SUM(R1C[-1]:RC1) -> 2041210
A2021: =R[-1]C+1 -> 2021 | B2021: =SUM(R1C[-1]:RC1) -> 2043231
A2022: =R[-1]C+1 -> 2022 | B2022: =SUM(R1C[-1]:RC1) -> 2045253
A2023: =R[-1]C+1 -> 2023 | B2023: =SUM(R1C[-1]:RC1) -> 2047276
A2024: =R[-1]C+1 -> 2024 | B2024: =SUM(R1C[-1]:RC1) -> 2049300
A2025: =R[-1]C+1 -> 2025 | B2025: =SUM(R1C[-1]:RC1) -> 2051325
A2026: =R[-1]C+1 -> 2026 | B2026: =SUM(R1C[-1]:RC1) -> 2053351
A2027: =R[-1]C+1 -> 2027 | B2027: =SUM(R1C[-1]:RC1) -> 2055378
A2028: =R[-1]C+1 -> 2028 | B2028: =SUM(R1C[-1]:RC1) -> 2057406
A2029: =R[-1]C+1 -> 2029 | B2029: =SUM(R1C[-1]:RC1) -> 2059435
A2030: =R[-1]C+1 -> 2030 | B2030: =SUM(R1C[-1]:RC1) -> 2061465
A2031: =R[-1]C+1 -> 2031 | B2031: =SUM(R1C[-1]:RC1) -> 2063496
A2032: =R[-1]C+1 -> 2032 | B2032: =SUM(R1C[-1]:RC1) -> 2065528
A2033: =R[-1]C+1 -> 2033 | B2033: =SUM(R1C[-1]:RC1) -> 2067561
A2034: =R[-1]C+1 -> 2034 | B2034: =SUM(R1C[-1]:RC1) -> 2069595
A2035: =R[-1]C+1 -> 2035 | B2035: =SUM(R1C[-1]:RC1) -> 2071630
A2036: =R[-1]C+1 -> 2036 | B2036: =SUM(R1C[-1]:RC1) -> 2073666
A2037: =R[-1]C+1 -> 2037 | B2037: =SUM(R1C[-1]:RC1) -> 2075703
A2038: =R[-1]C+1 -> 2038 | B2038: =SUM(R1C[-1]:RC1) -> 2077741
A2039: =R[-1]C+1 -> 2039 | B2039: =SUM(R1C[-1]:RC1) -> 2079780
A2040: =R[-1]C+1 -> 2040 | B2040: =SUM(R1C[-1]:RC1) -> 2081820
A2041: =R[-1]C+1 -> 2041 | B2041: =SUM(R1C[-1]:RC1) -> 2083861
A2042: =R[-1]C+1 -> 2042 | B2042: =SUM(R1C[-1]:RC1) -> 2085903
A2043: =R[-1]C+1 -> 2043 | B2043: =SUM(R1C[-1]:RC1) -> 2087946
A2044: =R[-1]C+1 -> 2044 | B2044: =SUM(R1C[-1]:RC1) -> 2089990
A2045: =R[-1]C+1 -> 2045 | B2045: =SUM(R1C[-1]:RC1) -> 2092035
A2046: =R[-1]C+1 -> 2046 | B2046: =SUM(R1C[-1]:RC1) -> 2094081
A2047: =R[-1]C+1 -> 2047 | B2047: =SUM(R1C[-1]:RC1) -> 2096128
A2048: =R[-1]C+1 -> 2048 | B2048: =SUM(R1C[-1]:RC1) -> 2098176
A2049: =R[-1]C+1 -> 2049 | B2049: =SUM(R1C[-1]:RC1) -> 2100225
A2050: =R[-1]C+1 -> 2050 | B2050: =SUM(R1C[-1]:RC1) -> 2102275
A2051: =R[-1]C+1 -> 2051 | B2051: =SUM(R1C[-1]:RC1) -> 2104326
A2052: =R[-1]C+1 -> 2052 | B2052: =SUM(R1C[-1]:RC1) -> 2106378
A2053: =R[-1]C+1 -> 2053 | B2053: =SUM(R1C[-1]:RC1) -> 2108431
A2054: =R[-1]C+1 -> 2054 | B2054: =SUM(R1C[-1]:RC1) -> 2110485
A2055: =R[-1]C+1 -> 2055 | B2055: =SUM(R1C[-1]:RC1) -> 2112540
A2056: =R[-1]C+1 -> 2056 | B2056: =SUM(R1C[-1]:RC1) -> 2114596
A2057: =R[-1]C+1 -> 2057 | B2057: =SUM(R1C[-1]:RC1) -> 2116653
A2058: =R[-1]C+1 -> 2058 | B2058: =SUM(R1C[-1]:RC1) -> 2118711
A2059: =R[-1]C+1 -> 2059 | B2059: =SUM(R1C[-1]:RC1) -> 2120770
A2060: =R[-1]C+1 -> 2060 | B2060: =SUM(R1C[-1]:RC1) -> 2122830
A2061: =R[-1]C+1 -> 2061 | B2061: =SUM(R1C[-1]:RC1) -> 2124891
A2062: =R[-1]C+1 -> 2062 | B2062: =SUM(R1C[-1]:RC1) -> 2126953
A2063: =R[-1]C+1 -> 2063 | B2063: =SUM(R1C[-1]:RC1) -> 2129016
A2064: =R[-1]C+1 -> 2064 | B2064: =SUM(R1C[-1]:RC1) -> 2131080
A2065: =R[-1]C+1 -> 2065 | B2065: =SUM(R1C[-1]:RC1) -> 2133145
A2066: =R[-1]C+1 -> 2066 | B2066: =SUM(R1C[-1]:RC1) -> 2135211
A2067: =R[-1]C+1 -> 2067 | B2067: =SUM(R1C[-1]:RC1) -> 2137278
A2068: =R[-1]C+1 -> 2068 | B2068: =SUM(R1C[-1]:RC1) -> 2139346
A2069: =R[-1]C+1 -> 2069 | B2069: =SUM(R1C[-1]:RC1) -> 2141415
A2070: =R[-1]C+1 -> 2070 | B2070: =SUM(R1C[-1]:RC1) -> 2143485
A2071: =R[-1]C+1 -> 2071 | B2071: =SUM(R1C[-1]:RC1) -> 2145556
A2072: =R[-1]C+1 -> 2072 | B2072: =SUM(R1C[-1]:RC1) -> 2147628
A2073: =R[-1]C+1 -> 2073 | B2073: =SUM(R1C[-1]:RC1) -> 2149701
A2074: =R[-1]C+1 -> 2074 | B2074: =SUM(R1C[-1]:RC1) -> 2151775
A2075: =R[-1]C+1 -> 2075 | B2075: =SUM(R1C[-1]:RC1) -> 2153850
A2076: =R[-1]C+1 -> 2076 | B2076: =SUM(R1C[-1]:RC1) -> 2155926
A2077: =R[-1]C+1 -> 2077 | B2077: =SUM(R1C[-1]:RC1) -> 2158003
A2078: =R[-1]C+1 -> 2078 | B2078: =SUM(R1C[-1]:RC1) -> 2160081
A2079: =R[-1]C+1 -> 2079 | B2079: =SUM(R1C[-1]:RC1) -> 2162160
A2080: =R[-1]C+1 -> 2080 | B2080: =SUM(R1C[-1]:RC1) -> 2164240
A2081: =R[-1]C+1 -> 2081 | B2081: =SUM(R1C[-1]:RC1) -> 2166321
A2082: =R[-1]C+1 -> 2082 | B2082: =SUM(R1C[-1]:RC1) -> 2168403
A2083: =R[-1]C+1 -> 2083 | B2083: =SUM(R1C[-1]:RC1) -> 2170486
A2084: =R[-1]C+1 -> 2084 | B2084: =SUM(R1C[-1]:RC1) -> 2172570
A2085: =R[-1]C+1 -> 2085 | B2085: =SUM(R1C[-1]:RC1) -> 2174655
A2086: =R[-1]C+1 -> 2086 | B2086: =SUM(R1C[-1]:RC1) -> 2176741
A2087: =R[-1]C+1 -> 2087 | B2087: =SUM(R1C[-1]:RC1) -> 2178828
A2088: =R[-1]C+1 -> 2088 | B2088: =SUM(R1C[-1]:RC1) -> 2180916
A2089: =R[-1]C+1 -> 2089 | B2089: =SUM(R1C[-1]:RC1) -> 2183005
A2090: =R[-1]C+1 -> 2090 | B2090: =SUM(R1C[-1]:RC1) -> 2185095
A2091: =R[-1]C+1 -> 2091 | B2091: =SUM(R1C[-1]:RC1) -> 2187186
A2092: =R[-1]C+1 -> 2092 | B2092: =SUM(R1C[-1]:RC1) -> 2189278
A2093: =R[-1]C+1 -> 2093 | B2093: =SUM(R1C[-1]:RC1) -> 2191371
A2094: =R[-1]C+1 -> 2094 | B2094: =SUM(R1C[-1]:RC1) -> 2193465
A2095: =R[-1]C+1 -> 2095 | B2095: =SUM(R1C[-1]:RC1) -> 2195560
A2096: =R[-1]C+1 -> 2096 | B2096: =SUM(R1C[-1]:RC1) -> 2197656
A2097: =R[-1]C+1 -> 2097 | B2097: =SUM(R1C[-1]:RC1) -> 2199753
A2098: =R[-1]C+1 -> 2098 | B2098: =SUM(R1C[-1]:RC1) -> 2201851
A2099: =R[-1]C+1 -> 2099 | B2099: =SUM(R1C[-1]:RC1) -> 2203950
A2100: =R[-1]C+1 -> 2100 | B2100: =SUM(R1C[-1]:RC1) -> 2206050
A2101: =R[-1]C+1 -> 2101 | B2101: =SUM(R1C[-1]:RC1) -> 2208151
A2102: =R[-1]C+1 -> 2102 | B2102: =SUM(R1C[-1]:RC1) -> 2210253
A2103: =R[-1]C+1 -> 2103 | B2103: =SUM(R1C[-1]:RC1) -> 2212356
A2104: =R[-1]C+1 -> 2104 | B2104: =SUM(R1C[-1]:RC1) -> 2214460
A2105: =R[-1]C+1 -> 2105 | B2105: =SUM(R1C[-1]:RC1) -> 2216565
A2106: =R[-1]C+1 -> 2106 | B2106: =SUM(R1C[-1]:RC1) -> 2218671
A2107: =R[-1]C+1 -> 2107 | B2107: =SUM(R1C[-1]:RC1) -> 2220778
A2108: =R[-1]C+1 -> 2108 | B2108: =SUM(R1C[-1]:RC1) -> 2222886
A2109: =R[-1]C+1 -> 2109 | B2109: =SUM(R1C[-1]:RC1) -> 2224995
A2110: =R[-1]C+1 -> 2110 | B2110: =SUM(R1C[-1]:RC1) -> 2227105
A2111: =R[-1]C+1 -> 2111 | B2111: =SUM(R1C[-1]:RC1) -> 2229216
A2112: =R[-1]C+1 -> 2112 | B2112: =SUM(R1C[-1]:RC1) -> 2231328
A2113: =R[-1]C+1 -> 2113 | B2113: =SUM(R1C[-1]:RC1) -> 2233441
A2114: =R[-1]C+1 -> 2114 | B2114: =SUM(R1C[-1]:RC1) -> 2235555
A2115: =R[-1]C+1 -> 2115 | B2115: =SUM(R1C[-1]:RC1) -> 2237670
A2116: =R[-1]C+1 -> 2116 | B2116: =SUM(R1C[-1]:RC1) -> 2239786
A2117: =R[-1]C+1 -> 2117 | B2117: =SUM(R1C[-1]:RC1) -> 2241903
A2118: =R[-1]C+1 -> 2118 | B2118: =SUM(R1C[-1]:RC1) -> 2244021
A2119: =R[-1]C+1 -> 2119 | B2119: =SUM(R1C[-1]:RC1) -> 2246140
A2120: =R[-1]C+1 -> 2120 | B2120: =SUM(R1C[-1]:RC1) -> 2248260
A2121: =R[-1]C+1 -> 2121 | B2121: =SUM(R1C[-1]:RC1) -> 2250381
A2122: =R[-1]C+1 -> 2122 | B2122: =SUM(R1C[-1]:RC1) -> 2252503
A2123: =R[-1]C+1 -> 2123 | B2123: =SUM(R1C[-1]:RC1) -> 2254626
A2124: =R[-1]C+1 -> 2124 | B2124: =SUM(R1C[-1]:RC1) -> 2256750
A2125: =R[-1]C+1 -> 2125 | B2125: =SUM(R1C[-1]:RC1) -> 2258875
A2126: =R[-1]C+1 -> 2126 | B2126: =SUM(R1C[-1]:RC1) -> 2261001
A2127: =R[-1]C+1 -> 2127 | B2127: =SUM(R1C[-1]:RC1) -> 2263128
A2128: =R[-1]C+1 -> 2128 | B2128: =SUM(R1C[-1]:RC1) -> 2265256
A2129: =R[-1]C+1 -> 2129 | B2129: =SUM(R1C[-1]:RC1) -> 2267385
A2130: =R[-1]C+1 -> 2130 | B2130: =SUM(R1C[-1]:RC1) -> 2269515
A2131: =R[-1]C+1 -> 2131 | B2131: =SUM(R1C[-1]:RC1) -> 2271646
A2132: =R[-1]C+1 -> 2132 | B2132: =SUM(R1C[-1]:RC1) -> 2273778
A2133: =R[-1]C+1 -> 2133 | B2133: =SUM(R1C[-1]:RC1) -> 2275911
A2134: =R[-1]C+1 -> 2134 | B2134: =SUM(R1C[-1]:RC1) -> 2278045
A2135: =R[-1]C+1 -> 2135 | B2135: =SUM(R1C[-1]:RC1) -> 2280180
A2136: =R[-1]C+1 -> 2136 | B2136: =SUM(R1C[-1]:RC1) -> 2282316
A2137: =R[-1]C+1 -> 2137 | B2137: =SUM(R1C[-1]:RC1) -> 2284453
A2138: =R[-1]C+1 -> 2138 | B2138: =SUM(R1C[-1]:RC1) -> 2286591
A2139: =R[-1]C+1 -> 2139 | B2139: =SUM(R1C[-1]:RC1) -> 2288730
A2140: =R[-1]C+1 -> 2140 | B2140: =SUM(R1C[-1]:RC1) -> 2290870
A2141: =R[-1]C+1 -> 2141 | B2141: =SUM(R1C[-1]:RC1) -> 2293011
A2142: =R[-1]C+1 -> 2142 | B2142: =SUM(R1C[-1]:RC1) -> 2295153
A2143: =R[-1]C+1 -> 2143 | B2143: =SUM(R1C[-1]:RC1) -> 2297296
A2144: =R[-1]C+1 -> 2144 | B2144: =SUM(R1C[-1]:RC1) -> 2299440
A2145: =R[-1]C+1 -> 2145 | B2145: =SUM(R1C[-1]:RC1) -> 2301585
A2146: =R[-1]C+1 -> 2146 | B2146: =SUM(R1C[-1]:RC1) -> 2303731
A2147: =R[-1]C+1 -> 2147 | B2147: =SUM(R1C[-1]:RC1) -> 2305878
A2148: =R[-1]C+1 -> 2148 | B2148: =SUM(R1C[-1]:RC1) -> 2308026
A2149: =R[-1]C+1 -> 2149 | B2149: =SUM(R1C[-1]:RC1) -> 2310175
A2150: =R[-1]C+1 -> 2150 | B2150: =SUM(R1C[-1]:RC1) -> 2312325
A2151: =R[-1]C+1 -> 2151 | B2151: =SUM(R1C[-1]:RC1) -> 2314476
A2152: =R[-1]C+1 -> 2152 | B2152: =SUM(R1C[-1]:RC1) -> 2316628
A2153: =R[-1]C+1 -> 2153 | B2153: =SUM(R1C[-1]:RC1) -> 2318781
A2154: =R[-1]C+1 -> 2154 | B2154: =SUM(R1C[-1]:RC1) -> 2320935
A2155: =R[-1]C+1 -> 2155 | B2155: =SUM(R1C[-1]:RC1) -> 2323090
A2156: =R[-1]C+1 -> 2156 | B2156: =SUM(R1C[-1]:RC1) -> 2325246
A2157: =R[-1]C+1 -> 2157 | B2157: =SUM(R1C[-1]:RC1) -> 2327403
A2158: =R[-1]C+1 -> 2158 | B2158: =SUM(R1C[-1]:RC1) -> 2329561
A2159: =R[-1]C+1 -> 2159 | B2159: =SUM(R1C[-1]:RC1) -> 2331720
A2160: =R[-1]C+1 -> 2160 | B2160: =SUM(R1C[-1]:RC1) -> 2333880
A2161: =R[-1]C+1 -> 2161 | B2161: =SUM(R1C[-1]:RC1) -> 2336041
A2162: =R[-1]C+1 -> 2162 | B2162: =SUM(R1C[-1]:RC1) -> 2338203
A2163: =R[-1]C+1 -> 2163 | B2163: =SUM(R1C[-1]:RC1) -> 2340366
A2164: =R[-1]C+1 -> 2164 | B2164: =SUM(R1C[-1]:RC1) -> 2342530
A2165: =R[-1]C+1 -> 2165 | B2165: =SUM(R1C[-1]:RC1) -> 2344695
A2166: =R[-1]C+1 -> 2166 | B2166: =SUM(R1C[-1]:RC1) -> 2346861
A2167: =R[-1]C+1 -> 2167 | B2167: =SUM(R1C[-1]:RC1) -> 2349028
A2168: =R[-1]C+1 -> 2168 | B2168: =SUM(R1C[-1]:RC1) -> 2351196
A2169: =R[-1]C+1 -> 2169 | B2169: =SUM(R1C[-1]:RC1) -> 2353365
A2170: =R[-1]C+1 -> 2170 | B2170: =SUM(R1C[-1]:RC1) -> 2355535
A2171: =R[-1]C+1 -> 2171 | B2171: =SUM(R1C[-1]:RC1) -> 2357706
A2172: =R[-1]C+1 -> 2172 | B2172: =SUM(R1C[-1]:RC1) -> 2359878
A2173: =R[-1]C+1 -> 2173 | B2173: =SUM(R1C[-1]:RC1) -> 2362051
A2174: =R[-1]C+1 -> 2174 | B2174: =SUM(R1C[-1]:RC1) -> 2364225
A2175: =R[-1]C+1 -> 2175 | B2175: =SUM(R1C[-1]:RC1) -> 2366400
A2176: =R[-1]C+1 -> 2176 | B2176: =SUM(R1C[-1]:RC1) -> 2368576
A2177: =R[-1]C+1 -> 2177 | B2177: =SUM(R1C[-1]:RC1) -> 2370753
A2178: =R[-1]C+1 -> 2178 | B2178: =SUM(R1C[-1]:RC1) -> 2372931
A2179: =R[-1]C+1 -> 2179 | B2179: =SUM(R1C[-1]:RC1) -> 2375110
A2180: =R[-1]C+1 -> 2180 | B2180: =SUM(R1C[-1]:RC1) -> 2377290
A2181: =R[-1]C+1 -> 2181 | B2181: =SUM(R1C[-1]:RC1) -> 2379471
A2182: =R[-1]C+1 -> 2182 | B2182: =SUM(R1C[-1]:RC1) -> 2381653
A2183: =R[-1]C+1 -> 2183 | B2183: =SUM(R1C[-1]:RC1) -> 2383836
A2184: =R[-1]C+1 -> 2184 | B2184: =SUM(R1C[-1]:RC1) -> 2386020
A2185: =R[-1]C+1 -> 2185 | B2185: =SUM(R1C[-1]:RC1) -> 2388205
A2186: =R[-1]C+1 -> 2186 | B2186: =SUM(R1C[-1]:RC1) -> 2390391
A2187: =R[-1]C+1 -> 2187 | B2187: =SUM(R1C[-1]:RC1) -> 2392578
A2188: =R[-1]C+1 -> 2188 | B2188: =SUM(R1C[-1]:RC1) -> 2394766
A2189: =R[-1]C+1 -> 2189 | B2189: =SUM(R1C[-1]:RC1) -> 2396955
A2190: =R[-1]C+1 -> 2190 | B2190: =SUM(R1C[-1]:RC1) -> 2399145
A2191: =R[-1]C+1 -> 2191 | B2191: =SUM(R1C[-1]:RC1) -> 2401336
A2192: =R[-1]C+1 -> 2192 | B2192: =SUM(R1C[-1]:RC1) -> 2403528
A2193: =R[-1]C+1 -> 2193 | B2193: =SUM(R1C[-1]:RC1) -> 2405721
A2194: =R[-1]C+1 -> 2194 | B2194: =SUM(R1C[-1]:RC1) -> 2407915
A2195: =R[-1]C+1 -> 2195 | B2195: =SUM(R1C[-1]:RC1) -> 2410110
A2196: =R[-1]C+1 -> 2196 | B2196: =SUM(R1C[-1]:RC1) -> 2412306
A2197: =R[-1]C+1 -> 2197 | B2197: =SUM(R1C[-1]:RC1) -> 2414503
A2198: =R[-1]C+1 -> 2198 | B2198: =SUM(R1C[-1]:RC1) -> 2416701
A2199: =R[-1]C+1 -> 2199 | B2199: =SUM(R1C[-1]:RC1) -> 2418900
A2200: =R[-1]C+1 -> 2200 | B2200: =SUM(R1C[-1]:RC1) -> 2421100
A2201: =R[-1]C+1 -> 2201 | B2201: =SUM(R1C[-1]:RC1) -> 2423301
A2202: =R[-1]C+1 -> 2202 | B2202: =SUM(R1C[-1]:RC1) -> 2425503
A2203: =R[-1]C+1 -> 2203 | B2203: =SUM(R1C[-1]:RC1) -> 2427706
A2204: =R[-1]C+1 -> 2204 | B2204: =SUM(R1C[-1]:RC1) -> 2429910
A2205: =R[-1]C+1 -> 2205 | B2205: =SUM(R1C[-1]:RC1) -> 2432115
A2206: =R[-1]C+1 -> 2206 | B2206: =SUM(R1C[-1]:RC1) -> 2434321
A2207: =R[-1]C+1 -> 2207 | B2207: =SUM(R1C[-1]:RC1) -> 2436528
A2208: =R[-1]C+1 -> 2208 | B2208: =SUM(R1C[-1]:RC1) -> 2438736
A2209: =R[-1]C+1 -> 2209 | B2209: =SUM(R1C[-1]:RC1) -> 2440945
A2210: =R[-1]C+1 -> 2210 | B2210: =SUM(R1C[-1]:RC1) -> 2443155
A2211: =R[-1]C+1 -> 2211 | B2211: =SUM(R1C[-1]:RC1) -> 2445366
A2212: =R[-1]C+1 -> 2212 | B2212: =SUM(R1C[-1]:RC1) -> 2447578
A2213: =R[-1]C+1 -> 2213 | B2213: =SUM(R1C[-1]:RC1) -> 2449791
A2214: =R[-1]C+1 -> 2214 | B2214: =SUM(R1C[-1]:RC1) -> 2452005
A2215: =R[-1]C+1 -> 2215 | B2215: =SUM(R1C[-1]:RC1) -> 2454220
A2216: =R[-1]C+1 -> 2216 | B2216: =SUM(R1C[-1]:RC1) -> 2456436
A2217: =R[-1]C+1 -> 2217 | B2217: =SUM(R1C[-1]:RC1) -> 2458653
A2218: =R[-1]C+1 -> 2218 | B2218: =SUM(R1C[-1]:RC1) -> 2460871
A2219: =R[-1]C+1 -> 2219 | B2219: =SUM(R1C[-1]:RC1) -> 2463090
A2220: =R[-1]C+1 -> 2220 | B2220: =SUM(R1C[-1]:RC1) -> 2465310
A2221: =R[-1]C+1 -> 2221 | B2221: =SUM(R1C[-1]:RC1) -> 2467531
A2222: =R[-1]C+1 -> 2222 | B2222: =SUM(R1C[-1]:RC1) -> 2469753
A2223: =R[-1]C+1 -> 2223 | B2223: =SUM(R1C[-1]:RC1) -> 2471976
A2224: =R[-1]C+1 -> 2224 | B2224: =SUM(R1C[-1]:RC1) -> 2474200
A2225: =R[-1]C+1 -> 2225 | B2225: =SUM(R1C[-1]:RC1) -> 2476425
A2226: =R[-1]C+1 -> 2226 | B2226: =SUM(R1C[-1]:RC1) -> 2478651
A2227: =R[-1]C+1 -> 2227 | B2227: =SUM(R1C[-1]:RC1) -> 2480878
A2228: =R[-1]C+1 -> 2228 | B2228: =SUM(R1C[-1]:RC1) -> 2483106
A2229: =R[-1]C+1 -> 2229 | B2229: =SUM(R1C[-1]:RC1) -> 2485335
A2230: =R[-1]C+1 -> 2230 | B2230: =SUM(R1C[-1]:RC1) -> 2487565
A2231: =R[-1]C+1 -> 2231 | B2231: =SUM(R1C[-1]:RC1) -> 2489796
A2232: =R[-1]C+1 -> 2232 | B2232: =SUM(R1C[-1]:RC1) -> 2492028
A2233: =R[-1]C+1 -> 2233 | B2233: =SUM(R1C[-1]:RC1) -> 2494261
A2234: =R[-1]C+1 -> 2234 | B2234: =SUM(R1C[-1]:RC1) -> 2496495
A2235: =R[-1]C+1 -> 2235 | B2235: =SUM(R1C[-1]:RC1) -> 2498730
A2236: =R[-1]C+1 -> 2236 | B2236: =SUM(R1C[-1]:RC1) -> 2500966
A2237: =R[-1]C+1 -> 2237 | B2237: =SUM(R1C[-1]:RC1) -> 2503203
A2238: =R[-1]C+1 -> 2238 | B2238: =SUM(R1C[-1]:RC1) -> 2505441
A2239: =R[-1]C+1 -> 2239 | B2239: =SUM(R1C[-1]:RC1) -> 2507680
A2240: =R[-1]C+1 -> 2240 | B2240: =SUM(R1C[-1]:RC1) -> 2509920
A2241: =R[-1]C+1 -> 2241 | B2241: =SUM(R1C[-1]:RC1) -> 2512161
A2242: =R[-1]C+1 -> 2242 | B2242: =SUM(R1C[-1]:RC1) -> 2514403
A2243: =R[-1]C+1 -> 2243 | B2243: =SUM(R1C[-1]:RC1) -> 2516646
A2244: =R[-1]C+1 -> 2244 | B2244: =SUM(R1C[-1]:RC1) -> 2518890
A2245: =R[-1]C+1 -> 2245 | B2245: =SUM(R1C[-1]:RC1) -> 2521135
A2246: =R[-1]C+1 -> 2246 | B2246: =SUM(R1C[-1]:RC1) -> 2523381
A2247: =R[-1]C+1 -> 2247 | B2247: =SUM(R1C[-1]:RC1) -> 2525628
A2248: =R[-1]C+1 -> 2248 | B2248: =SUM(R1C[-1]:RC1) -> 2527876
A2249: =R[-1]C+1 -> 2249 | B2249: =SUM(R1C[-1]:RC1) -> 2530125
A2250: =R[-1]C+1 -> 2250 | B2250: =SUM(R1C[-1]:RC1) -> 2532375
A2251: =R[-1]C+1 -> 2251 | B2251: =SUM(R1C[-1]:RC1) -> 2534626
A2252: =R[-1]C+1 -> 2252 | B2252: =SUM(R1C[-1]:RC1) -> 2536878
A2253: =R[-1]C+1 -> 2253 | B2253: =SUM(R1C[-1]:RC1) -> 2539131
A2254: =R[-1]C+1 -> 2254 | B2254: =SUM(R1C[-1]:RC1) -> 2541385
A2255: =R[-1]C+1 -> 2255 | B2255: =SUM(R1C[-1]:RC1) -> 2543640
A2256: =R[-1]C+1 -> 2256 | B2256: =SUM(R1C[-1]:RC1) -> 2545896
A2257: =R[-1]C+1 -> 2257 | B2257: =SUM(R1C[-1]:RC1) -> 2548153
A2258: =R[-1]C+1 -> 2258 | B2258: =SUM(R1C[-1]:RC1) -> 2550411
A2259: =R[-1]C+1 -> 2259 | B2259: =SUM(R1C[-1]:RC1) -> 2552670
A2260: =R[-1]C+1 -> 2260 | B2260: =SUM(R1C[-1]:RC1) -> 2554930
A2261: =R[-1]C+1 -> 2261 | B2261: =SUM(R1C[-1]:RC1) -> 2557191
A2262: =R[-1]C+1 -> 2262 | B2262: =SUM(R1C[-1]:RC1) -> 2559453
A2263: =R[-1]C+1 -> 2263 | B2263: =SUM(R1C[-1]:RC1) -> 2561716
A2264: =R[-1]C+1 -> 2264 | B2264: =SUM(R1C[-1]:RC1) -> 2563980
A2265: =R[-1]C+1 -> 2265 | B2265: =SUM(R1C[-1]:RC1) -> 2566245
A2266: =R[-1]C+1 -> 2266 | B2266: =SUM(R1C[-1]:RC1) -> 2568511
A2267: =R[-1]C+1 -> 2267 | B2267: =SUM(R1C[-1]:RC1) -> 2570778
A2268: =R[-1]C+1 -> 2268 | B2268: =SUM(R1C[-1]:RC1) -> 2573046
A2269: =R[-1]C+1 -> 2269 | B2269: =SUM(R1C[-1]:RC1) -> 2575315
A2270: =R[-1]C+1 -> 2270 | B2270: =SUM(R1C[-1]:RC1) -> 2577585
A2271: =R[-1]C+1 -> 2271 | B2271: =SUM(R1C[-1]:RC1) -> 2579856
A2272: =R[-1]C+1 -> 2272 | B2272: =SUM(R1C[-1]:RC1) -> 2582128
A2273: =R[-1]C+1 -> 2273 | B2273: =SUM(R1C[-1]:RC1) -> 2584401
A2274: =R[-1]C+1 -> 2274 | B2274: =SUM(R1C[-1]:RC1) -> 2586675
A2275: =R[-1]C+1 -> 2275 | B2275: =SUM(R1C[-1]:RC1) -> 2588950
A2276: =R[-1]C+1 -> 2276 | B2276: =SUM(R1C[-1]:RC1) -> 2591226
A2277: =R[-1]C+1 -> 2277 | B2277: =SUM(R1C[-1]:RC1) -> 2593503
A2278: =R[-1]C+1 -> 2278 | B2278: =SUM(R1C[-1]:RC1) -> 2595781
A2279: =R[-1]C+1 -> 2279 | B2279: =SUM(R1C[-1]:RC1) -> 2598060
A2280: =R[-1]C+1 -> 2280 | B2280: =SUM(R1C[-1]:RC1) -> 2600340
A2281: =R[-1]C+1 -> 2281 | B2281: =SUM(R1C[-1]:RC1) -> 2602621
A2282: =R[-1]C+1 -> 2282 | B2282: =SUM(R1C[-1]:RC1) -> 2604903
A2283: =R[-1]C+1 -> 2283 | B2283: =SUM(R1C[-1]:RC1) -> 2607186
A2284: =R[-1]C+1 -> 2284 | B2284: =SUM(R1C[-1]:RC1) -> 2609470
A2285: =R[-1]C+1 -> 2285 | B2285: =SUM(R1C[-1]:RC1) -> 2611755
A2286: =R[-1]C+1 -> 2286 | B2286: =SUM(R1C[-1]:RC1) -> 2614041
A2287: =R[-1]C+1 -> 2287 | B2287: =SUM(R1C[-1]:RC1) -> 2616328
A2288: =R[-1]C+1 -> 2288 | B2288: =SUM(R1C[-1]:RC1) -> 2618616
A2289: =R[-1]C+1 -> 2289 | B2289: =SUM(R1C[-1]:RC1) -> 2620905
A2290: =R[-1]C+1 -> 2290 | B2290: =SUM(R1C[-1]:RC1) -> 2623195
A2291: =R[-1]C+1 -> 2291 | B2291: =SUM(R1C[-1]:RC1) -> 2625486
A2292: =R[-1]C+1 -> 2292 | B2292: =SUM(R1C[-1]:RC1) -> 2627778
A2293: =R[-1]C+1 -> 2293 | B2293: =SUM(R1C[-1]:RC1) -> 2630071
A2294: =R[-1]C+1 -> 2294 | B2294: =SUM(R1C[-1]:RC1) -> 2632365
A2295: =R[-1]C+1 -> 2295 | B2295: =SUM(R1C[-1]:RC1) -> 2634660
A2296: =R[-1]C+1 -> 2296 | B2296: =SUM(R1C[-1]:RC1) -> 2636956
A2297: =R[-1]C+1 -> 2297 | B2297: =SUM(R1C[-1]:RC1) -> 2639253
A2298: =R[-1]C+1 -> 2298 | B2298: =SUM(R1C[-1]:RC1) -> 2641551
A2299: =R[-1]C+1 -> 2299 | B2299: =SUM(R1C[-1]:RC1) -> 2643850
A2300: =R[-1]C+1 -> 2300 | B2300: =SUM(R1C[-1]:RC1) -> 2646150
A2301: =R[-1]C+1 -> 2301 | B2301: =SUM(R1C[-1]:RC1) -> 2648451
A2302: =R[-1]C+1 -> 2302 | B2302: =SUM(R1C[-1]:RC1) -> 2650753
A2303: =R[-1]C+1 -> 2303 | B2303: =SUM(R1C[-1]:RC1) -> 2653056
A2304: =R[-1]C+1 -> 2304 | B2304: =SUM(R1C[-1]:RC1) -> 2655360
A2305: =R[-1]C+1 -> 2305 | B2305: =SUM(R1C[-1]:RC1) -> 2657665
A2306: =R[-1]C+1 -> 2306 | B2306: =SUM(R1C[-1]:RC1) -> 2659971
A2307: =R[-1]C+1 -> 2307 | B2307: =SUM(R1C[-1]:RC1) -> 2662278
A2308: =R[-1]C+1 -> 2308 | B2308: =SUM(R1C[-1]:RC1) -> 2664586
A2309: =R[-1]C+1 -> 2309 | B2309: =SUM(R1C[-1]:RC1) -> 2666895
A2310: =R[-1]C+1 -> 2310 | B2310: =SUM(R1C[-1]:RC1) -> 2669205
A2311: =R[-1]C+1 -> 2311 | B2311: =SUM(R1C[-1]:RC1) -> 2671516
A2312: =R[-1]C+1 -> 2312 | B2312: =SUM(R1C[-1]:RC1) -> 2673828
A2313: =R[-1]C+1 -> 2313 | B2313: =SUM(R1C[-1]:RC1) -> 2676141
A2314: =R[-1]C+1 -> 2314 | B2314: =SUM(R1C[-1]:RC1) -> 2678455
A2315: =R[-1]C+1 -> 2315 | B2315: =SUM(R1C[-1]:RC1) -> 2680770
A2316: =R[-1]C+1 -> 2316 | B2316: =SUM(R1C[-1]:RC1) -> 2683086
A2317: =R[-1]C+1 -> 2317 | B2317: =SUM(R1C[-1]:RC1) -> 2685403
A2318: =R[-1]C+1 -> 2318 | B2318: =SUM(R1C[-1]:RC1) -> 2687721
A2319: =R[-1]C+1 -> 2319 | B2319: =SUM(R1C[-1]:RC1) -> 2690040
A2320: =R[-1]C+1 -> 2320 | B2320: =SUM(R1C[-1]:RC1) -> 2692360
A2321: =R[-1]C+1 -> 2321 | B2321: =SUM(R1C[-1]:RC1) -> 2694681
A2322: =R[-1]C+1 -> 2322 | B2322: =SUM(R1C[-1]:RC1) -> 2697003
A2323: =R[-1]C+1 -> 2323 | B2323: =SUM(R1C[-1]:RC1) -> 2699326
A2324: =R[-1]C+1 -> 2324 | B2324: =SUM(R1C[-1]:RC1) -> 2701650
A2325: =R[-1]C+1 -> 2325 | B2325: =SUM(R1C[-1]:RC1) -> 2703975
A2326: =R[-1]C+1 -> 2326 | B2326: =SUM(R1C[-1]:RC1) -> 2706301
A2327: =R[-1]C+1 -> 2327 | B2327: =SUM(R1C[-1]:RC1) -> 2708628
A2328: =R[-1]C+1 -> 2328 | B2328: =SUM(R1C[-1]:RC1) -> 2710956
A2329: =R[-1]C+1 -> 2329 | B2329: =SUM(R1C[-1]:RC1) -> 2713285
A2330: =R[-1]C+1 -> 2330 | B2330: =SUM(R1C[-1]:RC1) -> 2715615
A2331: =R[-1]C+1 -> 2331 | B2331: =SUM(R1C[-1]:RC1) -> 2717946
A2332: =R[-1]C+1 -> 2332 | B2332: =SUM(R1C[-1]:RC1) -> 2720278
A2333: =R[-1]C+1 -> 2333 | B2333: =SUM(R1C[-1]:RC1) -> 2722611
A2334: =R[-1]C+1 -> 2334 | B2334: =SUM(R1C[-1]:RC1) -> 2724945
A2335: =R[-1]C+1 -> 2335 | B2335: =SUM(R1C[-1]:RC1) -> 2727280
A2336: =R[-1]C+1 -> 2336 | B2336: =SUM(R1C[-1]:RC1) -> 2729616
A2337: =R[-1]C+1 -> 2337 | B2337: =SUM(R1C[-1]:RC1) -> 2731953
A2338: =R[-1]C+1 -> 2338 | B2338: =SUM(R1C[-1]:RC1) -> 2734291
A2339: =R[-1]C+1 -> 2339 | B2339: =SUM(R1C[-1]:RC1) -> 2736630
A2340: =R[-1]C+1 -> 2340 | B2340: =SUM(R1C[-1]:RC1) -> 2738970
A2341: =R[-1]C+1 -> 2341 | B2341: =SUM(R1C[-1]:RC1) -> 2741311
A2342: =R[-1]C+1 -> 2342 | B2342: =SUM(R1C[-1]:RC1) -> 2743653
A2343: =R[-1]C+1 -> 2343 | B2343: =SUM(R1C[-1]:RC1) -> 2745996
A2344: =R[-1]C+1 -> 2344 | B2344: =SUM(R1C[-1]:RC1) -> 2748340
A2345: =R[-1]C+1 -> 2345 | B2345: =SUM(R1C[-1]:RC1) -> 2750685
A2346: =R[-1]C+1 -> 2346 | B2346: =SUM(R1C[-1]:RC1) -> 2753031
A2347: =R[-1]C+1 -> 2347 | B2347: =SUM(R1C[-1]:RC1) -> 2755378
A2348: =R[-1]C+1 -> 2348 | B2348: =SUM(R1C[-1]:RC1) -> 2757726
A2349: =R[-1]C+1 -> 2349 | B2349: =SUM(R1C[-1]:RC1) -> 2760075
A2350: =R[-1]C+1 -> 2350 | B2350: =SUM(R1C[-1]:RC1) -> 2762425
A2351: =R[-1]C+1 -> 2351 | B2351: =SUM(R1C[-1]:RC1) -> 2764776
A2352: =R[-1]C+1 -> 2352 | B2352: =SUM(R1C[-1]:RC1) -> 2767128
A2353: =R[-1]C+1 -> 2353 | B2353: =SUM(R1C[-1]:RC1) -> 2769481
A2354: =R[-1]C+1 -> 2354 | B2354: =SUM(R1C[-1]:RC1) -> 2771835
A2355: =R[-1]C+1 -> 2355 | B2355: =SUM(R1C[-1]:RC1) -> 2774190
A2356: =R[-1]C+1 -> 2356 | B2356: =SUM(R1C[-1]:RC1) -> 2776546
A2357: =R[-1]C+1 -> 2357 | B2357: =SUM(R1C[-1]:RC1) -> 2778903
A2358: =R[-1]C+1 -> 2358 | B2358: =SUM(R1C[-1]:RC1) -> 2781261
A2359: =R[-1]C+1 -> 2359 | B2359: =SUM(R1C[-1]:RC1) -> 2783620
A2360: =R[-1]C+1 -> 2360 | B2360: =SUM(R1C[-1]:RC1) -> 2785980
A2361: =R[-1]C+1 -> 2361 | B2361: =SUM(R1C[-1]:RC1) -> 2788341
A2362: =R[-1]C+1 -> 2362 | B2362: =SUM(R1C[-1]:RC1) -> 2790703
A2363: =R[-1]C+1 -> 2363 | B2363: =SUM(R1C[-1]:RC1) -> 2793066
A2364: =R[-1]C+1 -> 2364 | B2364: =SUM(R1C[-1]:RC1) -> 2795430
A2365: =R[-1]C+1 -> 2365 | B2365: =SUM(R1C[-1]:RC1) -> 2797795
A2366: =R[-1]C+1 -> 2366 | B2366: =SUM(R1C[-1]:RC1) -> 2800161
A2367: =R[-1]C+1 -> 2367 | B2367: =SUM(R1C[-1]:RC1) -> 2802528
A2368: =R[-1]C+1 -> 2368 | B2368: =SUM(R1C[-1]:RC1) -> 2804896
A2369: =R[-1]C+1 -> 2369 | B2369: =SUM(R1C[-1]:RC1) -> 2807265
A2370: =R[-1]C+1 -> 2370 | B2370: =SUM(R1C[-1]:RC1) -> 2809635
A2371: =R[-1]C+1 -> 2371 | B2371: =SUM(R1C[-1]:RC1) -> 2812006
A2372: =R[-1]C+1 -> 2372 | B2372: =SUM(R1C[-1]:RC1) -> 2814378
A2373: =R[-1]C+1 -> 2373 | B2373: =SUM(R1C[-1]:RC1) -> 2816751
A2374: =R[-1]C+1 -> 2374 | B2374: =SUM(R1C[-1]:RC1) -> 2819125
A2375: =R[-1]C+1 -> 2375 | B2375: =SUM(R1C[-1]:RC1) -> 2821500
A2376: =R[-1]C+1 -> 2376 | B2376: =SUM(R1C[-1]:RC1) -> 2823876
A2377: =R[-1]C+1 -> 2377 | B2377: =SUM(R1C[-1]:RC1) -> 2826253
A2378: =R[-1]C+1 -> 2378 | B2378: =SUM(R1C[-1]:RC1) -> 2828631
A2379: =R[-1]C+1 -> 2379 | B2379: =SUM(R1C[-1]:RC1) -> 2831010
A2380: =R[-1]C+1 -> 2380 | B2380: =SUM(R1C[-1]:RC1) -> 2833390
A2381: =R[-1]C+1 -> 2381 | B2381: =SUM(R1C[-1]:RC1) -> 2835771
A2382: =R[-1]C+1 -> 2382 | B2382: =SUM(R1C[-1]:RC1) -> 2838153
A2383: =R[-1]C+1 -> 2383 | B2383: =SUM(R1C[-1]:RC1) -> 2840536
A2384: =R[-1]C+1 -> 2384 | B2384: =SUM(R1C[-1]:RC1) -> 2842920
A2385: =R[-1]C+1 -> 2385 | B2385: =SUM(R1C[-1]:RC1) -> 2845305
A2386: =R[-1]C+1 -> 2386 | B2386: =SUM(R1C[-1]:RC1) -> 2847691
A2387: =R[-1]C+1 -> 2387 | B2387: =SUM(R1C[-1]:RC1) -> 2850078
A2388: =R[-1]C+1 -> 2388 | B2388: =SUM(R1C[-1]:RC1) -> 2852466
A2389: =R[-1]C+1 -> 2389 | B2389: =SUM(R1C[-1]:RC1) -> 2854855
A2390: =R[-1]C+1 -> 2390 | B2390: =SUM(R1C[-1]:RC1) -> 2857245
A2391: =R[-1]C+1 -> 2391 | B2391: =SUM(R1C[-1]:RC1) -> 2859636
A2392: =R[-1]C+1 -> 2392 | B2392: =SUM(R1C[-1]:RC1) -> 2862028
A2393: =R[-1]C+1 -> 2393 | B2393: =SUM(R1C[-1]:RC1) -> 2864421
A2394: =R[-1]C+1 -> 2394 | B2394: =SUM(R1C[-1]:RC1) -> 2866815
A2395: =R[-1]C+1 -> 2395 | B2395: =SUM(R1C[-1]:RC1) -> 2869210
A2396: =R[-1]C+1 -> 2396 | B2396: =SUM(R1C[-1]:RC1) -> 2871606
A2397: =R[-1]C+1 -> 2397 | B2397: =SUM(R1C[-1]:RC1) -> 2874003
A2398: =R[-1]C+1 -> 2398 | B2398: =SUM(R1C[-1]:RC1) -> 2876401
A2399: =R[-1]C+1 -> 2399 | B2399: =SUM(R1C[-1]:RC1) -> 2878800
A2400: =R[-1]C+1 -> 2400 | B2400: =SUM(R1C[-1]:RC1) -> 2881200
A2401: =R[-1]C+1 -> 2401 | B2401: =SUM(R1C[-1]:RC1) -> 2883601
A2402: =R[-1]C+1 -> 2402 | B2402: =SUM(R1C[-1]:RC1) -> 2886003
A2403: =R[-1]C+1 -> 2403 | B2403: =SUM(R1C[-1]:RC1) -> 2888406
A2404: =R[-1]C+1 -> 2404 | B2404: =SUM(R1C[-1]:RC1) -> 2890810
A2405: =R[-1]C+1 -> 2405 | B2405: =SUM(R1C[-1]:RC1) -> 2893215
A2406: =R[-1]C+1 -> 2406 | B2406: =SUM(R1C[-1]:RC1) -> 2895621
A2407: =R[-1]C+1 -> 2407 | B2407: =SUM(R1C[-1]:RC1) -> 2898028
A2408: =R[-1]C+1 -> 2408 | B2408: =SUM(R1C[-1]:RC1) -> 2900436
A2409: =R[-1]C+1 -> 2409 | B2409: =SUM(R1C[-1]:RC1) -> 2902845
A2410: =R[-1]C+1 -> 2410 | B2410: =SUM(R1C[-1]:RC1) -> 2905255
A2411: =R[-1]C+1 -> 2411 | B2411: =SUM(R1C[-1]:RC1) -> 2907666
A2412: =R[-1]C+1 -> 2412 | B2412: =SUM(R1C[-1]:RC1) -> 2910078
A2413: =R[-1]C+1 -> 2413 | B2413: =SUM(R1C[-1]:RC1) -> 2912491
A2414: =R[-1]C+1 -> 2414 | B2414: =SUM(R1C[-1]:RC1) -> 2914905
A2415: =R[-1]C+1 -> 2415 | B2415: =SUM(R1C[-1]:RC1) -> 2917320
A2416: =R[-1]C+1 -> 2416 | B2416: =SUM(R1C[-1]:RC1) -> 2919736
A2417: =R[-1]C+1 -> 2417 | B2417: =SUM(R1C[-1]:RC1) -> 2922153
A2418: =R[-1]C+1 -> 2418 | B2418: =SUM(R1C[-1]:RC1) -> 2924571
A2419: =R[-1]C+1 -> 2419 | B2419: =SUM(R1C[-1]:RC1) -> 2926990
A2420: =R[-1]C+1 -> 2420 | B2420: =SUM(R1C[-1]:RC1) -> 2929410
A2421: =R[-1]C+1 -> 2421 | B2421: =SUM(R1C[-1]:RC1) -> 2931831
A2422: =R[-1]C+1 -> 2422 | B2422: =SUM(R1C[-1]:RC1) -> 2934253
A2423: =R[-1]C+1 -> 2423 | B2423: =SUM(R1C[-1]:RC1) -> 2936676
A2424: =R[-1]C+1 -> 2424 | B2424: =SUM(R1C[-1]:RC1) -> 2939100
A2425: =R[-1]C+1 -> 2425 | B2425: =SUM(R1C[-1]:RC1) -> 2941525
A2426: =R[-1]C+1 -> 2426 | B2426: =SUM(R1C[-1]:RC1) -> 2943951
A2427: =R[-1]C+1 -> 2427 | B2427: =SUM(R1C[-1]:RC1) -> 2946378
A2428: =R[-1]C+1 -> 2428 | B2428: =SUM(R1C[-1]:RC1) -> 2948806
A2429: =R[-1]C+1 -> 2429 | B2429: =SUM(R1C[-1]:RC1) -> 2951235
A2430: =R[-1]C+1 -> 2430 | B2430: =SUM(R1C[-1]:RC1) -> 2953665
A2431: =R[-1]C+1 -> 2431 | B2431: =SUM(R1C[-1]:RC1) -> 2956096
A2432: =R[-1]C+1 -> 2432 | B2432: =SUM(R1C[-1]:RC1) -> 2958528
A2433: =R[-1]C+1 -> 2433 | B2433: =SUM(R1C[-1]:RC1) -> 2960961
A2434: =R[-1]C+1 -> 2434 | B2434: =SUM(R1C[-1]:RC1) -> 2963395
A2435: =R[-1]C+1 -> 2435 | B2435: =SUM(R1C[-1]:RC1) -> 2965830
A2436: =R[-1]C+1 -> 2436 | B2436: =SUM(R1C[-1]:RC1) -> 2968266
A2437: =R[-1]C+1 -> 2437 | B2437: =SUM(R1C[-1]:RC1) -> 2970703
A2438: =R[-1]C+1 -> 2438 | B2438: =SUM(R1C[-1]:RC1) -> 2973141
A2439: =R[-1]C+1 -> 2439 | B2439: =SUM(R1C[-1]:RC1) -> 2975580
A2440: =R[-1]C+1 -> 2440 | B2440: =SUM(R1C[-1]:RC1) -> 2978020
A2441: =R[-1]C+1 -> 2441 | B2441: =SUM(R1C[-1]:RC1) -> 2980461
A2442: =R[-1]C+1 -> 2442 | B2442: =SUM(R1C[-1]:RC1) -> 2982903
A2443: =R[-1]C+1 -> 2443 | B2443: =SUM(R1C[-1]:RC1) -> 2985346
A2444: =R[-1]C+1 -> 2444 | B2444: =SUM(R1C[-1]:RC1) -> 2987790
A2445: =R[-1]C+1 -> 2445 | B2445: =SUM(R1C[-1]:RC1) -> 2990235
A2446: =R[-1]C+1 -> 2446 | B2446: =SUM(R1C[-1]:RC1) -> 2992681
A2447: =R[-1]C+1 -> 2447 | B2447: =SUM(R1C[-1]:RC1) -> 2995128
A2448: =R[-1]C+1 -> 2448 | B2448: =SUM(R1C[-1]:RC1) -> 2997576
A2449: =R[-1]C+1 -> 2449 | B2449: =SUM(R1C[-1]:RC1) -> 3000025
A2450: =R[-1]C+1 -> 2450 | B2450: =SUM(R1C[-1]:RC1) -> 3002475
A2451: =R[-1]C+1 -> 2451 | B2451: =SUM(R1C[-1]:RC1) -> 3004926
A2452: =R[-1]C+1 -> 2452 | B2452: =SUM(R1C[-1]:RC1) -> 3007378
A2453: =R[-1]C+1 -> 2453 | B2453: =SUM(R1C[-1]:RC1) -> 3009831
A2454: =R[-1]C+1 -> 2454 | B2454: =SUM(R1C[-1]:RC1) -> 3012285
A2455: =R[-1]C+1 -> 2455 | B2455: =SUM(R1C[-1]:RC1) -> 3014740
A2456: =R[-1]C+1 -> 2456 | B2456: =SUM(R1C[-1]:RC1) -> 3017196
A2457: =R[-1]C+1 -> 2457 | B2457: =SUM(R1C[-1]:RC1) -> 3019653
A2458: =R[-1]C+1 -> 2458 | B2458: =SUM(R1C[-1]:RC1) -> 3022111
A2459: =R[-1]C+1 -> 2459 | B2459: =SUM(R1C[-1]:RC1) -> 3024570
A2460: =R[-1]C+1 -> 2460 | B2460: =SUM(R1C[-1]:RC1) -> 3027030
A2461: =R[-1]C+1 -> 2461 | B2461: =SUM(R1C[-1]:RC1) -> 3029491
A2462: =R[-1]C+1 -> 2462 | B2462: =SUM(R1C[-1]:RC1) -> 3031953
A2463: =R[-1]C+1 -> 2463 | B2463: =SUM(R1C[-1]:RC1) -> 3034416
A2464: =R[-1]C+1 -> 2464 | B2464: =SUM(R1C[-1]:RC1) -> 3036880
A2465: =R[-1]C+1 -> 2465 | B2465: =SUM(R1C[-1]:RC1) -> 3039345
A2466: =R[-1]C+1 -> 2466 | B2466: =SUM(R1C[-1]:RC1) -> 3041811
A2467: =R[-1]C+1 -> 2467 | B2467: =SUM(R1C[-1]:RC1) -> 3044278
A2468: =R[-1]C+1 -> 2468 | B2468: =SUM(R1C[-1]:RC1) -> 3046746
A2469: =R[-1]C+1 -> 2469 | B2469: =SUM(R1C[-1]:RC1) -> 3049215
A2470: =R[-1]C+1 -> 2470 | B2470: =SUM(R1C[-1]:RC1) -> 3051685
A2471: =R[-1]C+1 -> 2471 | B2471: =SUM(R1C[-1]:RC1) -> 3054156
A2472: =R[-1]C+1 -> 2472 | B2472: =SUM(R1C[-1]:RC1) -> 3056628
A2473: =R[-1]C+1 -> 2473 | B2473: =SUM(R1C[-1]:RC1) -> 3059101
A2474: =R[-1]C+1 -> 2474 | B2474: =SUM(R1C[-1]:RC1) -> 3061575
A2475: =R[-1]C+1 -> 2475 | B2475: =SUM(R1C[-1]:RC1) -> 3064050
A2476: =R[-1]C+1 -> 2476 | B2476: =SUM(R1C[-1]:RC1) -> 3066526
A2477: =R[-1]C+1 -> 2477 | B2477: =SUM(R1C[-1]:RC1) -> 3069003
A2478: =R[-1]C+1 -> 2478 | B2478: =SUM(R1C[-1]:RC1) -> 3071481
A2479: =R[-1]C+1 -> 2479 | B2479: =SUM(R1C[-1]:RC1) -> 3073960
A2480: =R[-1]C+1 -> 2480 | B2480: =SUM(R1C[-1]:RC1) -> 3076440
A2481: =R[-1]C+1 -> 2481 | B2481: =SUM(R1C[-1]:RC1) -> 3078921
A2482: =R[-1]C+1 -> 2482 | B2482: =SUM(R1C[-1]:RC1) -> 3081403
A2483: =R[-1]C+1 -> 2483 | B2483: =SUM(R1C[-1]:RC1) -> 3083886
A2484: =R[-1]C+1 -> 2484 | B2484: =SUM(R1C[-1]:RC1) -> 3086370
A2485: =R[-1]C+1 -> 2485 | B2485: =SUM(R1C[-1]:RC1) -> 3088855
A2486: =R[-1]C+1 -> 2486 | B2486: =SUM(R1C[-1]:RC1) -> 3091341
A2487: =R[-1]C+1 -> 2487 | B2487: =SUM(R1C[-1]:RC1) -> 3093828
A2488: =R[-1]C+1 -> 2488 | B2488: =SUM(R1C[-1]:RC1) -> 3096316
A2489: =R[-1]C+1 -> 2489 | B2489: =SUM(R1C[-1]:RC1) -> 3098805
A2490: =R[-1]C+1 -> 2490 | B2490: =SUM(R1C[-1]:RC1) -> 3101295
A2491: =R[-1]C+1 -> 2491 | B2491: =SUM(R1C[-1]:RC1) -> 3103786
A2492: =R[-1]C+1 -> 2492 | B2492: =SUM(R1C[-1]:RC1) -> 3106278
A2493: =R[-1]C+1 -> 2493 | B2493: =SUM(R1C[-1]:RC1) -> 3108771
A2494: =R[-1]C+1 -> 2494 | B2494: =SUM(R1C[-1]:RC1) -> 3111265
A2495: =R[-1]C+1 -> 2495 | B2495: =SUM(R1C[-1]:RC1) -> 3113760
A2496: =R[-1]C+1 -> 2496 | B2496: =SUM(R1C[-1]:RC1) -> 3116256
A2497: =R[-1]C+1 -> 2497 | B2497: =SUM(R1C[-1]:RC1) -> 3118753
A2498: =R[-1]C+1 -> 2498 | B2498: =SUM(R1C[-1]:RC1) -> 3121251
A2499: =R[-1]C+1 -> 2499 | B2499: =SUM(R1C[-1]:RC1) -> 3123750
A2500: =R[-1]C+1 -> 2500 | B2500: =SUM(R1C[-1]:RC1) -> 3126250
A2501: =R[-1]C+1 -> 2501 | B2501: =SUM(R1C[-1]:RC1) -> 3128751
A2502: =R[-1]C+1 -> 2502 | B2502: =SUM(R1C[-1]:RC1) -> 3131253
A2503: =R[-1]C+1 -> 2503 | B2503: =SUM(R1C[-1]:RC1) -> 3133756
A2504: =R[-1]C+1 -> 2504 | B2504: =SUM(R1C[-1]:RC1) -> 3136260
A2505: =R[-1]C+1 -> 2505 | B2505: =SUM(R1C[-1]:RC1) -> 3138765
A2506: =R[-1]C+1 -> 2506 | B2506: =SUM(R1C[-1]:RC1) -> 3141271
A2507: =R[-1]C+1 -> 2507 | B2507: =SUM(R1C[-1]:RC1) -> 3143778
A2508: =R[-1]C+1 -> 2508 | B2508: =SUM(R1C[-1]:RC1) -> 3146286
A2509: =R[-1]C+1 -> 2509 | B2509: =SUM(R1C[-1]:RC1) -> 3148795
A2510: =R[-1]C+1 -> 2510 | B2510: =SUM(R1C[-1]:RC1) -> 3151305
A2511: =R[-1]C+1 -> 2511 | B2511: =SUM(R1C[-1]:RC1) -> 3153816
A2512: =R[-1]C+1 -> 2512 | B2512: =SUM(R1C[-1]:RC1) -> 3156328
A2513: =R[-1]C+1 -> 2513 | B2513: =SUM(R1C[-1]:RC1) -> 3158841
A2514: =R[-1]C+1 -> 2514 | B2514: =SUM(R1C[-1]:RC1) -> 3161355
A2515: =R[-1]C+1 -> 2515 | B2515: =SUM(R1C[-1]:RC1) -> 3163870
A2516: =R[-1]C+1 -> 2516 | B2516: =SUM(R1C[-1]:RC1) -> 3166386
A2517: =R[-1]C+1 -> 2517 | B2517: =SUM(R1C[-1]:RC1) -> 3168903
A2518: =R[-1]C+1 -> 2518 | B2518: =SUM(R1C[-1]:RC1) -> 3171421
A2519: =R[-1]C+1 -> 2519 | B2519: =SUM(R1C[-1]:RC1) -> 3173940
A2520: =R[-1]C+1 -> 2520 | B2520: =SUM(R1C[-1]:RC1) -> 3176460
A2521: =R[-1]C+1 -> 2521 | B2521: =SUM(R1C[-1]:RC1) -> 3178981
A2522: =R[-1]C+1 -> 2522 | B2522: =SUM(R1C[-1]:RC1) -> 3181503
A2523: =R[-1]C+1 -> 2523 | B2523: =SUM(R1C[-1]:RC1) -> 3184026
A2524: =R[-1]C+1 -> 2524 | B2524: =SUM(R1C[-1]:RC1) -> 3186550
A2525: =R[-1]C+1 -> 2525 | B2525: =SUM(R1C[-1]:RC1) -> 3189075
A2526: =R[-1]C+1 -> 2526 | B2526: =SUM(R1C[-1]:RC1) -> 3191601
A2527: =R[-1]C+1 -> 2527 | B2527: =SUM(R1C[-1]:RC1) -> 3194128
A2528: =R[-1]C+1 -> 2528 | B2528: =SUM(R1C[-1]:RC1) -> 3196656
A2529: =R[-1]C+1 -> 2529 | B2529: =SUM(R1C[-1]:RC1) -> 3199185
A2530: =R[-1]C+1 -> 2530 | B2530: =SUM(R1C[-1]:RC1) -> 3201715
A2531: =R[-1]C+1 -> 2531 | B2531: =SUM(R1C[-1]:RC1) -> 3204246
A2532: =R[-1]C+1 -> 2532 | B2532: =SUM(R1C[-1]:RC1) -> 3206778
A2533: =R[-1]C+1 -> 2533 | B2533: =SUM(R1C[-1]:RC1) -> 3209311
A2534: =R[-1]C+1 -> 2534 | B2534: =SUM(R1C[-1]:RC1) -> 3211845
A2535: =R[-1]C+1 -> 2535 | B2535: =SUM(R1C[-1]:RC1) -> 3214380
A2536: =R[-1]C+1 -> 2536 | B2536: =SUM(R1C[-1]:RC1) -> 3216916
A2537: =R[-1]C+1 -> 2537 | B2537: =SUM(R1C[-1]:RC1) -> 3219453
A2538: =R[-1]C+1 -> 2538 | B2538: =SUM(R1C[-1]:RC1) -> 3221991
A2539: =R[-1]C+1 -> 2539 | B2539: =SUM(R1C[-1]:RC1) -> 3224530
A2540: =R[-1]C+1 -> 2540 | B2540: =SUM(R1C[-1]:RC1) -> 3227070
A2541: =R[-1]C+1 -> 2541 | B2541: =SUM(R1C[-1]:RC1) -> 3229611
A2542: =R[-1]C+1 -> 2542 | B2542: =SUM(R1C[-1]:RC1) -> 3232153
A2543: =R[-1]C+1 -> 2543 | B2543: =SUM(R1C[-1]:RC1) -> 3234696
A2544: =R[-1]C+1 -> 2544 | B2544: =SUM(R1C[-1]:RC1) -> 3237240
A2545: =R[-1]C+1 -> 2545 | B2545: =SUM(R1C[-1]:RC1) -> 3239785
A2546: =R[-1]C+1 -> 2546 | B2546: =SUM(R1C[-1]:RC1) -> 3242331
A2547: =R[-1]C+1 -> 2547 | B2547: =SUM(R1C[-1]:RC1) -> 3244878
A2548: =R[-1]C+1 -> 2548 | B2548: =SUM(R1C[-1]:RC1) -> 3247426
A2549: =R[-1]C+1 -> 2549 | B2549: =SUM(R1C[-1]:RC1) -> 3249975
A2550: =R[-1]C+1 -> 2550 | B2550: =SUM(R1C[-1]:RC1) -> 3252525
A2551: =R[-1]C+1 -> 2551 | B2551: =SUM(R1C[-1]:RC1) -> 3255076
A2552: =R[-1]C+1 -> 2552 | B2552: =SUM(R1C[-1]:RC1) -> 3257628
A2553: =R[-1]C+1 -> 2553 | B2553: =SUM(R1C[-1]:RC1) -> 3260181
A2554: =R[-1]C+1 -> 2554 | B2554: =SUM(R1C[-1]:RC1) -> 3262735
A2555: =R[-1]C+1 -> 2555 | B2555: =SUM(R1C[-1]:RC1) -> 3265290
A2556: =R[-1]C+1 -> 2556 | B2556: =SUM(R1C[-1]:RC1) -> 3267846
A2557: =R[-1]C+1 -> 2557 | B2557: =SUM(R1C[-1]:RC1) -> 3270403
A2558: =R[-1]C+1 -> 2558 | B2558: =SUM(R1C[-1]:RC1) -> 3272961
A2559: =R[-1]C+1 -> 2559 | B2559: =SUM(R1C[-1]:RC1) -> 3275520
A2560: =R[-1]C+1 -> 2560 | B2560: =SUM(R1C[-1]:RC1) -> 3278080
A2561: =R[-1]C+1 -> 2561 | B2561: =SUM(R1C[-1]:RC1) -> 3280641
A2562: =R[-1]C+1 -> 2562 | B2562: =SUM(R1C[-1]:RC1) -> 3283203
A2563: =R[-1]C+1 -> 2563 | B2563: =SUM(R1C[-1]:RC1) -> 3285766
A2564: =R[-1]C+1 -> 2564 | B2564: =SUM(R1C[-1]:RC1) -> 3288330
A2565: =R[-1]C+1 -> 2565 | B2565: =SUM(R1C[-1]:RC1) -> 3290895
A2566: =R[-1]C+1 -> 2566 | B2566: =SUM(R1C[-1]:RC1) -> 3293461
A2567: =R[-1]C+1 -> 2567 | B2567: =SUM(R1C[-1]:RC1) -> 3296028
A2568: =R[-1]C+1 -> 2568 | B2568: =SUM(R1C[-1]:RC1) -> 3298596
A2569: =R[-1]C+1 -> 2569 | B2569: =SUM(R1C[-1]:RC1) -> 3301165
A2570: =R[-1]C+1 -> 2570 | B2570: =SUM(R1C[-1]:RC1) -> 3303735
A2571: =R[-1]C+1 -> 2571 | B2571: =SUM(R1C[-1]:RC1) -> 3306306
A2572: =R[-1]C+1 -> 2572 | B2572: =SUM(R1C[-1]:RC1) -> 3308878
A2573: =R[-1]C+1 -> 2573 | B2573: =SUM(R1C[-1]:RC1) -> 3311451
A2574: =R[-1]C+1 -> 2574 | B2574: =SUM(R1C[-1]:RC1) -> 3314025
A2575: =R[-1]C+1 -> 2575 | B2575: =SUM(R1C[-1]:RC1) -> 3316600
A2576: =R[-1]C+1 -> 2576 | B2576: =SUM(R1C[-1]:RC1) -> 3319176
A2577: =R[-1]C+1 -> 2577 | B2577: =SUM(R1C[-1]:RC1) -> 3321753
A2578: =R[-1]C+1 -> 2578 | B2578: =SUM(R1C[-1]:RC1) -> 3324331
A2579: =R[-1]C+1 -> 2579 | B2579: =SUM(R1C[-1]:RC1) -> 3326910
A2580: =R[-1]C+1 -> 2580 | B2580: =SUM(R1C[-1]:RC1) -> 3329490
A2581: =R[-1]C+1 -> 2581 | B2581: =SUM(R1C[-1]:RC1) -> 3332071
A2582: =R[-1]C+1 -> 2582 | B2582: =SUM(R1C[-1]:RC1) -> 3334653
A2583: =R[-1]C+1 -> 2583 | B2583: =SUM(R1C[-1]:RC1) -> 3337236
A2584: =R[-1]C+1 -> 2584 | B2584: =SUM(R1C[-1]:RC1) -> 3339820
A2585: =R[-1]C+1 -> 2585 | B2585: =SUM(R1C[-1]:RC1) -> 3342405
A2586: =R[-1]C+1 -> 2586 | B2586: =SUM(R1C[-1]:RC1) -> 3344991
A2587: =R[-1]C+1 -> 2587 | B2587: =SUM(R1C[-1]:RC1) -> 3347578
A2588: =R[-1]C+1 -> 2588 | B2588: =SUM(R1C[-1]:RC1) -> 3350166
A2589: =R[-1]C+1 -> 2589 | B2589: =SUM(R1C[-1]:RC1) -> 3352755
A2590: =R[-1]C+1 -> 2590 | B2590: =SUM(R1C[-1]:RC1) -> 3355345
A2591: =R[-1]C+1 -> 2591 | B2591: =SUM(R1C[-1]:RC1) -> 3357936
A2592: =R[-1]C+1 -> 2592 | B2592: =SUM(R1C[-1]:RC1) -> 3360528
A2593: =R[-1]C+1 -> 2593 | B2593: =SUM(R1C[-1]:RC1) -> 3363121
A2594: =R[-1]C+1 -> 2594 | B2594: =SUM(R1C[-1]:RC1) -> 3365715
A2595: =R[-1]C+1 -> 2595 | B2595: =SUM(R1C[-1]:RC1) -> 3368310
A2596: =R[-1]C+1 -> 2596 | B2596: =SUM(R1C[-1]:RC1) -> 3370906
A2597: =R[-1]C+1 -> 2597 | B2597: =SUM(R1C[-1]:RC1) -> 3373503
A2598: =R[-1]C+1 -> 2598 | B2598: =SUM(R1C[-1]:RC1) -> 3376101
A2599: =R[-1]C+1 -> 2599 | B2599: =SUM(R1C[-1]:RC1) -> 3378700
A2600: =R[-1]C+1 -> 2600 | B2600: =SUM(R1C[-1]:RC1) -> 3381300
A2601: =R[-1]C+1 -> 2601 | B2601: =SUM(R1C[-1]:RC1) -> 3383901
A2602: =R[-1]C+1 -> 2602 | B2602: =SUM(R1C[-1]:RC1) -> 3386503
A2603: =R[-1]C+1 -> 2603 | B2603: =SUM(R1C[-1]:RC1) -> 3389106
A2604: =R[-1]C+1 -> 2604 | B2604: =SUM(R1C[-1]:RC1) -> 3391710
A2605: =R[-1]C+1 -> 2605 | B2605: =SUM(R1C[-1]:RC1) -> 3394315
A2606: =R[-1]C+1 -> 2606 | B2606: =SUM(R1C[-1]:RC1) -> 3396921
A2607: =R[-1]C+1 -> 2607 | B2607: =SUM(R1C[-1]:RC1) -> 3399528
A2608: =R[-1]C+1 -> 2608 | B2608: =SUM(R1C[-1]:RC1) -> 3402136
A2609: =R[-1]C+1 -> 2609 | B2609: =SUM(R1C[-1]:RC1) -> 3404745
A2610: =R[-1]C+1 -> 2610 | B2610: =SUM(R1C[-1]:RC1) -> 3407355
A2611: =R[-1]C+1 -> 2611 | B2611: =SUM(R1C[-1]:RC1) -> 3409966
A2612: =R[-1]C+1 -> 2612 | B2612: =SUM(R1C[-1]:RC1) -> 3412578
A2613: =R[-1]C+1 -> 2613 | B2613: =SUM(R1C[-1]:RC1) -> 3415191
A2614: =R[-1]C+1 -> 2614 | B2614: =SUM(R1C[-1]:RC1) -> 3417805
A2615: =R[-1]C+1 -> 2615 | B2615: =SUM(R1C[-1]:RC1) -> 3420420
A2616: =R[-1]C+1 -> 2616 | B2616: =SUM(R1C[-1]:RC1) -> 3423036
A2617: =R[-1]C+1 -> 2617 | B2617: =SUM(R1C[-1]:RC1) -> 3425653
A2618: =R[-1]C+1 -> 2618 | B2618: =SUM(R1C[-1]:RC1) -> 3428271
A2619: =R[-1]C+1 -> 2619 | B2619: =SUM(R1C[-1]:RC1) -> 3430890
A2620: =R[-1]C+1 -> 2620 | B2620: =SUM(R1C[-1]:RC1) -> 3433510
A2621: =R[-1]C+1 -> 2621 | B2621: =SUM(R1C[-1]:RC1) -> 3436131
A2622: =R[-1]C+1 -> 2622 | B2622: =SUM(R1C[-1]:RC1) -> 3438753
A2623: =R[-1]C+1 -> 2623 | B2623: =SUM(R1C[-1]:RC1) -> 3441376
A2624: =R[-1]C+1 -> 2624 | B2624: =SUM(R1C[-1]:RC1) -> 3444000
A2625: =R[-1]C+1 -> 2625 | B2625: =SUM(R1C[-1]:RC1) -> 3446625
A2626: =R[-1]C+1 -> 2626 | B2626: =SUM(R1C[-1]:RC1) -> 3449251
A2627: =R[-1]C+1 -> 2627 | B2627: =SUM(R1C[-1]:RC1) -> 3451878
A2628: =R[-1]C+1 -> 2628 | B2628: =SUM(R1C[-1]:RC1) -> 3454506
A2629: =R[-1]C+1 -> 2629 | B2629: =SUM(R1C[-1]:RC1) -> 3457135
A2630: =R[-1]C+1 -> 2630 | B2630: =SUM(R1C[-1]:RC1) -> 3459765
A2631: =R[-1]C+1 -> 2631 | B2631: =SUM(R1C[-1]:RC1) -> 3462396
A2632: =R[-1]C+1 -> 2632 | B2632: =SUM(R1C[-1]:RC1) -> 3465028
A2633: =R[-1]C+1 -> 2633 | B2633: =SUM(R1C[-1]:RC1) -> 3467661
A2634: =R[-1]C+1 -> 2634 | B2634: =SUM(R1C[-1]:RC1) -> 3470295
A2635: =R[-1]C+1 -> 2635 | B2635: =SUM(R1C[-1]:RC1) -> 3472930
A2636: =R[-1]C+1 -> 2636 | B2636: =SUM(R1C[-1]:RC1) -> 3475566
A2637: =R[-1]C+1 -> 2637 | B2637: =SUM(R1C[-1]:RC1) -> 3478203
A2638: =R[-1]C+1 -> 2638 | B2638: =SUM(R1C[-1]:RC1) -> 3480841
A2639: =R[-1]C+1 -> 2639 | B2639: =SUM(R1C[-1]:RC1) -> 3483480
A2640: =R[-1]C+1 -> 2640 | B2640: =SUM(R1C[-1]:RC1) -> 3486120
A2641: =R[-1]C+1 -> 2641 | B2641: =SUM(R1C[-1]:RC1) -> 3488761
A2642: =R[-1]C+1 -> 2642 | B2642: =SUM(R1C[-1]:RC1) -> 3491403
A2643: =R[-1]C+1 -> 2643 | B2643: =SUM(R1C[-1]:RC1) -> 3494046
A2644: =R[-1]C+1 -> 2644 | B2644: =SUM(R1C[-1]:RC1) -> 3496690
A2645: =R[-1]C+1 -> 2645 | B2645: =SUM(R1C[-1]:RC1) -> 3499335
A2646: =R[-1]C+1 -> 2646 | B2646: =SUM(R1C[-1]:RC1) -> 3501981
A2647: =R[-1]C+1 -> 2647 | B2647: =SUM(R1C[-1]:RC1) -> 3504628
A2648: =R[-1]C+1 -> 2648 | B2648: =SUM(R1C[-1]:RC1) -> 3507276
A2649: =R[-1]C+1 -> 2649 | B2649: =SUM(R1C[-1]:RC1) -> 3509925
A2650: =R[-1]C+1 -> 2650 | B2650: =SUM(R1C[-1]:RC1) -> 3512575
A2651: =R[-1]C+1 -> 2651 | B2651: =SUM(R1C[-1]:RC1) -> 3515226
A2652: =R[-1]C+1 -> 2652 | B2652: =SUM(R1C[-1]:RC1) -> 3517878
A2653: =R[-1]C+1 -> 2653 | B2653: =SUM(R1C[-1]:RC1) -> 3520531
A2654: =R[-1]C+1 -> 2654 | B2654: =SUM(R1C[-1]:RC1) -> 3523185
A2655: =R[-1]C+1 -> 2655 | B2655: =SUM(R1C[-1]:RC1) -> 3525840
A2656: =R[-1]C+1 -> 2656 | B2656: =SUM(R1C[-1]:RC1) -> 3528496
A2657: =R[-1]C+1 -> 2657 | B2657: =SUM(R1C[-1]:RC1) -> 3531153
A2658: =R[-1]C+1 -> 2658 | B2658: =SUM(R1C[-1]:RC1) -> 3533811
A2659: =R[-1]C+1 -> 2659 | B2659: =SUM(R1C[-1]:RC1) -> 3536470
A2660: =R[-1]C+1 -> 2660 | B2660: =SUM(R1C[-1]:RC1) -> 3539130
A2661: =R[-1]C+1 -> 2661 | B2661: =SUM(R1C[-1]:RC1) -> 3541791
A2662: =R[-1]C+1 -> 2662 | B2662: =SUM(R1C[-1]:RC1) -> 3544453
A2663: =R[-1]C+1 -> 2663 | B2663: =SUM(R1C[-1]:RC1) -> 3547116
A2664: =R[-1]C+1 -> 2664 | B2664: =SUM(R1C[-1]:RC1) -> 3549780
A2665: =R[-1]C+1 -> 2665 | B2665: =SUM(R1C[-1]:RC1) -> 3552445
A2666: =R[-1]C+1 -> 2666 | B2666: =SUM(R1C[-1]:RC1) -> 3555111
A2667: =R[-1]C+1 -> 2667 | B2667: =SUM(R1C[-1]:RC1) -> 3557778
A2668: =R[-1]C+1 -> 2668 | B2668: =SUM(R1C[-1]:RC1) -> 3560446
A2669: =R[-1]C+1 -> 2669 | B2669: =SUM(R1C[-1]:RC1) -> 3563115
A2670: =R[-1]C+1 -> 2670 | B2670: =SUM(R1C[-1]:RC1) -> 3565785
A2671: =R[-1]C+1 -> 2671 | B2671: =SUM(R1C[-1]:RC1) -> 3568456
A2672: =R[-1]C+1 -> 2672 | B2672: =SUM(R1C[-1]:RC1) -> 3571128
A2673: =R[-1]C+1 -> 2673 | B2673: =SUM(R1C[-1]:RC1) -> 3573801
A2674: =R[-1]C+1 -> 2674 | B2674: =SUM(R1C[-1]:RC1) -> 3576475
A2675: =R[-1]C+1 -> 2675 | B2675: =SUM(R1C[-1]:RC1) -> 3579150
A2676: =R[-1]C+1 -> 2676 | B2676: =SUM(R1C[-1]:RC1) -> 3581826
A2677: =R[-1]C+1 -> 2677 | B2677: =SUM(R1C[-1]:RC1) -> 3584503
A2678: =R[-1]C+1 -> 2678 | B2678: =SUM(R1C[-1]:RC1) -> 3587181
A2679: =R[-1]C+1 -> 2679 | B2679: =SUM(R1C[-1]:RC1) -> 3589860
A2680: =R[-1]C+1 -> 2680 | B2680: =SUM(R1C[-1]:RC1) -> 3592540
A2681: =R[-1]C+1 -> 2681 | B2681: =SUM(R1C[-1]:RC1) -> 3595221
A2682: =R[-1]C+1 -> 2682 | B2682: =SUM(R1C[-1]:RC1) -> 3597903
A2683: =R[-1]C+1 -> 2683 | B2683: =SUM(R1C[-1]:RC1) -> 3600586
A2684: =R[-1]C+1 -> 2684 | B2684: =SUM(R1C[-1]:RC1) -> 3603270
A2685: =R[-1]C+1 -> 2685 | B2685: =SUM(R1C[-1]:RC1) -> 3605955
A2686: =R[-1]C+1 -> 2686 | B2686: =SUM(R1C[-1]:RC1) -> 3608641
A2687: =R[-1]C+1 -> 2687 | B2687: =SUM(R1C[-1]:RC1) -> 3611328
A2688: =R[-1]C+1 -> 2688 | B2688: =SUM(R1C[-1]:RC1) -> 3614016
A2689: =R[-1]C+1 -> 2689 | B2689: =SUM(R1C[-1]:RC1) -> 3616705
A2690: =R[-1]C+1 -> 2690 | B2690: =SUM(R1C[-1]:RC1) -> 3619395
A2691: =R[-1]C+1 -> 2691 | B2691: =SUM(R1C[-1]:RC1) -> 3622086
A2692: =R[-1]C+1 -> 2692 | B2692: =SUM(R1C[-1]:RC1) -> 3624778
A2693: =R[-1]C+1 -> 2693 | B2693: =SUM(R1C[-1]:RC1) -> 3627471
A2694: =R[-1]C+1 -> 2694 | B2694: =SUM(R1C[-1]:RC1) -> 3630165
A2695: =R[-1]C+1 -> 2695 | B2695: =SUM(R1C[-1]:RC1) -> 3632860
A2696: =R[-1]C+1 -> 2696 | B2696: =SUM(R1C[-1]:RC1) -> 3635556
A2697: =R[-1]C+1 -> 2697 | B2697: =SUM(R1C[-1]:RC1) -> 3638253
A2698: =R[-1]C+1 -> 2698 | B2698: =SUM(R1C[-1]:RC1) -> 3640951
A2699: =R[-1]C+1 -> 2699 | B2699: =SUM(R1C[-1]:RC1) -> 3643650
A2700: =R[-1]C+1 -> 2700 | B2700: =SUM(R1C[-1]:RC1) -> 3646350
A2701: =R[-1]C+1 -> 2701 | B2701: =SUM(R1C[-1]:RC1) -> 3649051
A2702: =R[-1]C+1 -> 2702 | B2702: =SUM(R1C[-1]:RC1) -> 3651753
A2703: =R[-1]C+1 -> 2703 | B2703: =SUM(R1C[-1]:RC1) -> 3654456
A2704: =R[-1]C+1 -> 2704 | B2704: =SUM(R1C[-1]:RC1) -> 3657160
A2705: =R[-1]C+1 -> 2705 | B2705: =SUM(R1C[-1]:RC1) -> 3659865
A2706: =R[-1]C+1 -> 2706 | B2706: =SUM(R1C[-1]:RC1) -> 3662571
A2707: =R[-1]C+1 -> 2707 | B2707: =SUM(R1C[-1]:RC1) -> 3665278
A2708: =R[-1]C+1 -> 2708 | B2708: =SUM(R1C[-1]:RC1) -> 3667986
A2709: =R[-1]C+1 -> 2709 | B2709: =SUM(R1C[-1]:RC1) -> 3670695
A2710: =R[-1]C+1 -> 2710 | B2710: =SUM(R1C[-1]:RC1) -> 3673405
A2711: =R[-1]C+1 -> 2711 | B2711: =SUM(R1C[-1]:RC1) -> 3676116
A2712: =R[-1]C+1 -> 2712 | B2712: =SUM(R1C[-1]:RC1) -> 3678828
A2713: =R[-1]C+1 -> 2713 | B2713: =SUM(R1C[-1]:RC1) -> 3681541
A2714: =R[-1]C+1 -> 2714 | B2714: =SUM(R1C[-1]:RC1) -> 3684255
A2715: =R[-1]C+1 -> 2715 | B2715: =SUM(R1C[-1]:RC1) -> 3686970
A2716: =R[-1]C+1 -> 2716 | B2716: =SUM(R1C[-1]:RC1) -> 3689686
A2717: =R[-1]C+1 -> 2717 | B2717: =SUM(R1C[-1]:RC1) -> 3692403
A2718: =R[-1]C+1 -> 2718 | B2718: =SUM(R1C[-1]:RC1) -> 3695121
A2719: =R[-1]C+1 -> 2719 | B2719: =SUM(R1C[-1]:RC1) -> 3697840
A2720: =R[-1]C+1 -> 2720 | B2720: =SUM(R1C[-1]:RC1) -> 3700560
A2721: =R[-1]C+1 -> 2721 | B2721: =SUM(R1C[-1]:RC1) -> 3703281
A2722: =R[-1]C+1 -> 2722 | B2722: =SUM(R1C[-1]:RC1) -> 3706003
A2723: =R[-1]C+1 -> 2723 | B2723: =SUM(R1C[-1]:RC1) -> 3708726
A2724: =R[-1]C+1 -> 2724 | B2724: =SUM(R1C[-1]:RC1) -> 3711450
A2725: =R[-1]C+1 -> 2725 | B2725: =SUM(R1C[-1]:RC1) -> 3714175
A2726: =R[-1]C+1 -> 2726 | B2726: =SUM(R1C[-1]:RC1) -> 3716901
A2727: =R[-1]C+1 -> 2727 | B2727: =SUM(R1C[-1]:RC1) -> 3719628
A2728: =R[-1]C+1 -> 2728 | B2728: =SUM(R1C[-1]:RC1) -> 3722356
A2729: =R[-1]C+1 -> 2729 | B2729: =SUM(R1C[-1]:RC1) -> 3725085
A2730: =R[-1]C+1 -> 2730 | B2730: =SUM(R1C[-1]:RC1) -> 3727815
A2731: =R[-1]C+1 -> 2731 | B2731: =SUM(R1C[-1]:RC1) -> 3730546
A2732: =R[-1]C+1 -> 2732 | B2732: =SUM(R1C[-1]:RC1) -> 3733278
A2733: =R[-1]C+1 -> 2733 | B2733: =SUM(R1C[-1]:RC1) -> 3736011
A2734: =R[-1]C+1 -> 2734 | B2734: =SUM(R1C[-1]:RC1) -> 3738745
A2735: =R[-1]C+1 -> 2735 | B2735: =SUM(R1C[-1]:RC1) -> 3741480
A2736: =R[-1]C+1 -> 2736 | B2736: =SUM(R1C[-1]:RC1) -> 3744216
A2737: =R[-1]C+1 -> 2737 | B2737: =SUM(R1C[-1]:RC1) -> 3746953
A2738: =R[-1]C+1 -> 2738 | B2738: =SUM(R1C[-1]:RC1) -> 3749691
A2739: =R[-1]C+1 -> 2739 | B2739: =SUM(R1C[-1]:RC1) -> 3752430
A2740: =R[-1]C+1 -> 2740 | B2740: =SUM(R1C[-1]:RC1) -> 3755170
A2741: =R[-1]C+1 -> 2741 | B2741: =SUM(R1C[-1]:RC1) -> 3757911
A2742: =R[-1]C+1 -> 2742 | B2742: =SUM(R1C[-1]:RC1) -> 3760653
A2743: =R[-1]C+1 -> 2743 | B2743: =SUM(R1C[-1]:RC1) -> 3763396
A2744: =R[-1]C+1 -> 2744 | B2744: =SUM(R1C[-1]:RC1) -> 3766140
A2745: =R[-1]C+1 -> 2745 | B2745: =SUM(R1C[-1]:RC1) -> 3768885
A2746: =R[-1]C+1 -> 2746 | B2746: =SUM(R1C[-1]:RC1) -> 3771631
A2747: =R[-1]C+1 -> 2747 | B2747: =SUM(R1C[-1]:RC1) -> 3774378
A2748: =R[-1]C+1 -> 2748 | B2748: =SUM(R1C[-1]:RC1) -> 3777126
A2749: =R[-1]C+1 -> 2749 | B2749: =SUM(R1C[-1]:RC1) -> 3779875
A2750: =R[-1]C+1 -> 2750 | B2750: =SUM(R1C[-1]:RC1) -> 3782625
A2751: =R[-1]C+1 -> 2751 | B2751: =SUM(R1C[-1]:RC1) -> 3785376
A2752: =R[-1]C+1 -> 2752 | B2752: =SUM(R1C[-1]:RC1) -> 3788128
A2753: =R[-1]C+1 -> 2753 | B2753: =SUM(R1C[-1]:RC1) -> 3790881
A2754: =R[-1]C+1 -> 2754 | B2754: =SUM(R1C[-1]:RC1) -> 3793635
A2755: =R[-1]C+1 -> 2755 | B2755: =SUM(R1C[-1]:RC1) -> 3796390
A2756: =R[-1]C+1 -> 2756 | B2756: =SUM(R1C[-1]:RC1) -> 3799146
A2757: =R[-1]C+1 -> 2757 | B2757: =SUM(R1C[-1]:RC1) -> 3801903
A2758: =R[-1]C+1 -> 2758 | B2758: =SUM(R1C[-1]:RC1) -> 3804661
A2759: =R[-1]C+1 -> 2759 | B2759: =SUM(R1C[-1]:RC1) -> 3807420
A2760: =R[-1]C+1 -> 2760 | B2760: =SUM(R1C[-1]:RC1) -> 3810180
A2761: =R[-1]C+1 -> 2761 | B2761: =SUM(R1C[-1]:RC1) -> 3812941
A2762: =R[-1]C+1 -> 2762 | B2762: =SUM(R1C[-1]:RC1) -> 3815703
A2763: =R[-1]C+1 -> 2763 | B2763: =SUM(R1C[-1]:RC1) -> 3818466
A2764: =R[-1]C+1 -> 2764 | B2764: =SUM(R1C[-1]:RC1) -> 3821230
A2765: =R[-1]C+1 -> 2765 | B2765: =SUM(R1C[-1]:RC1) -> 3823995
A2766: =R[-1]C+1 -> 2766 | B2766: =SUM(R1C[-1]:RC1) -> 3826761
A2767: =R[-1]C+1 -> 2767 | B2767: =SUM(R1C[-1]:RC1) -> 3829528
A2768: =R[-1]C+1 -> 2768 | B2768: =SUM(R1C[-1]:RC1) -> 3832296
A2769: =R[-1]C+1 -> 2769 | B2769: =SUM(R1C[-1]:RC1) -> 3835065
A2770: =R[-1]C+1 -> 2770 | B2770: =SUM(R1C[-1]:RC1) -> 3837835
A2771: =R[-1]C+1 -> 2771 | B2771: =SUM(R1C[-1]:RC1) -> 3840606
A2772: =R[-1]C+1 -> 2772 | B2772: =SUM(R1C[-1]:RC1) -> 3843378
A2773: =R[-1]C+1 -> 2773 | B2773: =SUM(R1C[-1]:RC1) -> 3846151
A2774: =R[-1]C+1 -> 2774 | B2774: =SUM(R1C[-1]:RC1) -> 3848925
A2775: =R[-1]C+1 -> 2775 | B2775: =SUM(R1C[-1]:RC1) -> 3851700
A2776: =R[-1]C+1 -> 2776 | B2776: =SUM(R1C[-1]:RC1) -> 3854476
A2777: =R[-1]C+1 -> 2777 | B2777: =SUM(R1C[-1]:RC1) -> 3857253
A2778: =R[-1]C+1 -> 2778 | B2778: =SUM(R1C[-1]:RC1) -> 3860031
A2779: =R[-1]C+1 -> 2779 | B2779: =SUM(R1C[-1]:RC1) -> 3862810
A2780: =R[-1]C+1 -> 2780 | B2780: =SUM(R1C[-1]:RC1) -> 3865590
A2781: =R[-1]C+1 -> 2781 | B2781: =SUM(R1C[-1]:RC1) -> 3868371
A2782: =R[-1]C+1 -> 2782 | B2782: =SUM(R1C[-1]:RC1) -> 3871153
A2783: =R[-1]C+1 -> 2783 | B2783: =SUM(R1C[-1]:RC1) -> 3873936
A2784: =R[-1]C+1 -> 2784 | B2784: =SUM(R1C[-1]:RC1) -> 3876720
A2785: =R[-1]C+1 -> 2785 | B2785: =SUM(R1C[-1]:RC1) -> 3879505
A2786: =R[-1]C+1 -> 2786 | B2786: =SUM(R1C[-1]:RC1) -> 3882291
A2787: =R[-1]C+1 -> 2787 | B2787: =SUM(R1C[-1]:RC1) -> 3885078
A2788: =R[-1]C+1 -> 2788 | B2788: =SUM(R1C[-1]:RC1) -> 3887866
A2789: =R[-1]C+1 -> 2789 | B2789: =SUM(R1C[-1]:RC1) -> 3890655
A2790: =R[-1]C+1 -> 2790 | B2790: =SUM(R1C[-1]:RC1) -> 3893445
A2791: =R[-1]C+1 -> 2791 | B2791: =SUM(R1C[-1]:RC1) -> 3896236
A2792: =R[-1]C+1 -> 2792 | B2792: =SUM(R1C[-1]:RC1) -> 3899028
A2793: =R[-1]C+1 -> 2793 | B2793: =SUM(R1C[-1]:RC1) -> 3901821
A2794: =R[-1]C+1 -> 2794 | B2794: =SUM(R1C[-1]:RC1) -> 3904615
A2795: =R[-1]C+1 -> 2795 | B2795: =SUM(R1C[-1]:RC1) -> 3907410
A2796: =R[-1]C+1 -> 2796 | B2796: =SUM(R1C[-1]:RC1) -> 3910206
A2797: =R[-1]C+1 -> 2797 | B2797: =SUM(R1C[-1]:RC1) -> 3913003
A2798: =R[-1]C+1 -> 2798 | B2798: =SUM(R1C[-1]:RC1) -> 3915801
A2799: =R[-1]C+1 -> 2799 | B2799: =SUM(R1C[-1]:RC1) -> 3918600
A2800: =R[-1]C+1 -> 2800 | B2800: =SUM(R1C[-1]:RC1) -> 3921400
A2801: =R[-1]C+1 -> 2801 | B2801: =SUM(R1C[-1]:RC1) -> 3924201
A2802: =R[-1]C+1 -> 2802 | B2802: =SUM(R1C[-1]:RC1) -> 3927003
A2803: =R[-1]C+1 -> 2803 | B2803: =SUM(R1C[-1]:RC1) -> 3929806
A2804: =R[-1]C+1 -> 2804 | B2804: =SUM(R1C[-1]:RC1) -> 3932610
A2805: =R[-1]C+1 -> 2805 | B2805: =SUM(R1C[-1]:RC1) -> 3935415
A2806: =R[-1]C+1 -> 2806 | B2806: =SUM(R1C[-1]:RC1) -> 3938221
A2807: =R[-1]C+1 -> 2807 | B2807: =SUM(R1C[-1]:RC1) -> 3941028
A2808: =R[-1]C+1 -> 2808 | B2808: =SUM(R1C[-1]:RC1) -> 3943836
A2809: =R[-1]C+1 -> 2809 | B2809: =SUM(R1C[-1]:RC1) -> 3946645
A2810: =R[-1]C+1 -> 2810 | B2810: =SUM(R1C[-1]:RC1) -> 3949455
A2811: =R[-1]C+1 -> 2811 | B2811: =SUM(R1C[-1]:RC1) -> 3952266
A2812: =R[-1]C+1 -> 2812 | B2812: =SUM(R1C[-1]:RC1) -> 3955078
A2813: =R[-1]C+1 -> 2813 | B2813: =SUM(R1C[-1]:RC1) -> 3957891
A2814: =R[-1]C+1 -> 2814 | B2814: =SUM(R1C[-1]:RC1) -> 3960705
A2815: =R[-1]C+1 -> 2815 | B2815: =SUM(R1C[-1]:RC1) -> 3963520
A2816: =R[-1]C+1 -> 2816 | B2816: =SUM(R1C[-1]:RC1) -> 3966336
A2817: =R[-1]C+1 -> 2817 | B2817: =SUM(R1C[-1]:RC1) -> 3969153
A2818: =R[-1]C+1 -> 2818 | B2818: =SUM(R1C[-1]:RC1) -> 3971971
A2819: =R[-1]C+1 -> 2819 | B2819: =SUM(R1C[-1]:RC1) -> 3974790
A2820: =R[-1]C+1 -> 2820 | B2820: =SUM(R1C[-1]:RC1) -> 3977610
A2821: =R[-1]C+1 -> 2821 | B2821: =SUM(R1C[-1]:RC1) -> 3980431
A2822: =R[-1]C+1 -> 2822 | B2822: =SUM(R1C[-1]:RC1) -> 3983253
A2823: =R[-1]C+1 -> 2823 | B2823: =SUM(R1C[-1]:RC1) -> 3986076
A2824: =R[-1]C+1 -> 2824 | B2824: =SUM(R1C[-1]:RC1) -> 3988900
A2825: =R[-1]C+1 -> 2825 | B2825: =SUM(R1C[-1]:RC1) -> 3991725
A2826: =R[-1]C+1 -> 2826 | B2826: =SUM(R1C[-1]:RC1) -> 3994551
A2827: =R[-1]C+1 -> 2827 | B2827: =SUM(R1C[-1]:RC1) -> 3997378
A2828: =R[-1]C+1 -> 2828 | B2828: =SUM(R1C[-1]:RC1) -> 4000206
A2829: =R[-1]C+1 -> 2829 | B2829: =SUM(R1C[-1]:RC1) -> 4003035
A2830: =R[-1]C+1 -> 2830 | B2830: =SUM(R1C[-1]:RC1) -> 4005865
A2831: =R[-1]C+1 -> 2831 | B2831: =SUM(R1C[-1]:RC1) -> 4008696
A2832: =R[-1]C+1 -> 2832 | B2832: =SUM(R1C[-1]:RC1) -> 4011528
A2833: =R[-1]C+1 -> 2833 | B2833: =SUM(R1C[-1]:RC1) -> 4014361
A2834: =R[-1]C+1 -> 2834 | B2834: =SUM(R1C[-1]:RC1) -> 4017195
A2835: =R[-1]C+1 -> 2835 | B2835: =SUM(R1C[-1]:RC1) -> 4020030
A2836: =R[-1]C+1 -> 2836 | B2836: =SUM(R1C[-1]:RC1) -> 4022866
A2837: =R[-1]C+1 -> 2837 | B2837: =SUM(R1C[-1]:RC1) -> 4025703
A2838: =R[-1]C+1 -> 2838 | B2838: =SUM(R1C[-1]:RC1) -> 4028541
A2839: =R[-1]C+1 -> 2839 | B2839: =SUM(R1C[-1]:RC1) -> 4031380
A2840: =R[-1]C+1 -> 2840 | B2840: =SUM(R1C[-1]:RC1) -> 4034220
A2841: =R[-1]C+1 -> 2841 | B2841: =SUM(R1C[-1]:RC1) -> 4037061
A2842: =R[-1]C+1 -> 2842 | B2842: =SUM(R1C[-1]:RC1) -> 4039903
A2843: =R[-1]C+1 -> 2843 | B2843: =SUM(R1C[-1]:RC1) -> 4042746
A2844: =R[-1]C+1 -> 2844 | B2844: =SUM(R1C[-1]:RC1) -> 4045590
A2845: =R[-1]C+1 -> 2845 | B2845: =SUM(R1C[-1]:RC1) -> 4048435
A2846: =R[-1]C+1 -> 2846 | B2846: =SUM(R1C[-1]:RC1) -> 4051281
A2847: =R[-1]C+1 -> 2847 | B2847: =SUM(R1C[-1]:RC1) -> 4054128
A2848: =R[-1]C+1 -> 2848 | B2848: =SUM(R1C[-1]:RC1) -> 4056976
A2849: =R[-1]C+1 -> 2849 | B2849: =SUM(R1C[-1]:RC1) -> 4059825
A2850: =R[-1]C+1 -> 2850 | B2850: =SUM(R1C[-1]:RC1) -> 4062675
A2851: =R[-1]C+1 -> 2851 | B2851: =SUM(R1C[-1]:RC1) -> 4065526
A2852: =R[-1]C+1 -> 2852 | B2852: =SUM(R1C[-1]:RC1) -> 4068378
A2853: =R[-1]C+1 -> 2853 | B2853: =SUM(R1C[-1]:RC1) -> 4071231
A2854: =R[-1]C+1 -> 2854 | B2854: =SUM(R1C[-1]:RC1) -> 4074085
A2855: =R[-1]C+1 -> 2855 | B2855: =SUM(R1C[-1]:RC1) -> 4076940
A2856: =R[-1]C+1 -> 2856 | B2856: =SUM(R1C[-1]:RC1) -> 4079796
A2857: =R[-1]C+1 -> 2857 | B2857: =SUM(R1C[-1]:RC1) -> 4082653
A2858: =R[-1]C+1 -> 2858 | B2858: =SUM(R1C[-1]:RC1) -> 4085511
A2859: =R[-1]C+1 -> 2859 | B2859: =SUM(R1C[-1]:RC1) -> 4088370
A2860: =R[-1]C+1 -> 2860 | B2860: =SUM(R1C[-1]:RC1) -> 4091230
A2861: =R[-1]C+1 -> 2861 | B2861: =SUM(R1C[-1]:RC1) -> 4094091
A2862: =R[-1]C+1 -> 2862 | B2862: =SUM(R1C[-1]:RC1) -> 4096953
A2863: =R[-1]C+1 -> 2863 | B2863: =SUM(R1C[-1]:RC1) -> 4099816
A2864: =R[-1]C+1 -> 2864 | B2864: =SUM(R1C[-1]:RC1) -> 4102680
A2865: =R[-1]C+1 -> 2865 | B2865: =SUM(R1C[-1]:RC1) -> 4105545
A2866: =R[-1]C+1 -> 2866 | B2866: =SUM(R1C[-1]:RC1) -> 4108411
A2867: =R[-1]C+1 -> 2867 | B2867: =SUM(R1C[-1]:RC1) -> 4111278
A2868: =R[-1]C+1 -> 2868 | B2868: =SUM(R1C[-1]:RC1) -> 4114146
A2869: =R[-1]C+1 -> 2869 | B2869: =SUM(R1C[-1]:RC1) -> 4117015
A2870: =R[-1]C+1 -> 2870 | B2870: =SUM(R1C[-1]:RC1) -> 4119885
A2871: =R[-1]C+1 -> 2871 | B2871: =SUM(R1C[-1]:RC1) -> 4122756
A2872: =R[-1]C+1 -> 2872 | B2872: =SUM(R1C[-1]:RC1) -> 4125628
A2873: =R[-1]C+1 -> 2873 | B2873: =SUM(R1C[-1]:RC1) -> 4128501
A2874: =R[-1]C+1 -> 2874 | B2874: =SUM(R1C[-1]:RC1) -> 4131375
A2875: =R[-1]C+1 -> 2875 | B2875: =SUM(R1C[-1]:RC1) -> 4134250
A2876: =R[-1]C+1 -> 2876 | B2876: =SUM(R1C[-1]:RC1) -> 4137126
A2877: =R[-1]C+1 -> 2877 | B2877: =SUM(R1C[-1]:RC1) -> 4140003
A2878: =R[-1]C+1 -> 2878 | B2878: =SUM(R1C[-1]:RC1) -> 4142881
A2879: =R[-1]C+1 -> 2879 | B2879: =SUM(R1C[-1]:RC1) -> 4145760
A2880: =R[-1]C+1 -> 2880 | B2880: =SUM(R1C[-1]:RC1) -> 4148640
A2881: =R[-1]C+1 -> 2881 | B2881: =SUM(R1C[-1]:RC1) -> 4151521
A2882: =R[-1]C+1 -> 2882 | B2882: =SUM(R1C[-1]:RC1) -> 4154403
A2883: =R[-1]C+1 -> 2883 | B2883: =SUM(R1C[-1]:RC1) -> 4157286
A2884: =R[-1]C+1 -> 2884 | B2884: =SUM(R1C[-1]:RC1) -> 4160170
A2885: =R[-1]C+1 -> 2885 | B2885: =SUM(R1C[-1]:RC1) -> 4163055
A2886: =R[-1]C+1 -> 2886 | B2886: =SUM(R1C[-1]:RC1) -> 4165941
A2887: =R[-1]C+1 -> 2887 | B2887: =SUM(R1C[-1]:RC1) -> 4168828
A2888: =R[-1]C+1 -> 2888 | B2888: =SUM(R1C[-1]:RC1) -> 4171716
A2889: =R[-1]C+1 -> 2889 | B2889: =SUM(R1C[-1]:RC1) -> 4174605
A2890: =R[-1]C+1 -> 2890 | B2890: =SUM(R1C[-1]:RC1) -> 4177495
A2891: =R[-1]C+1 -> 2891 | B2891: =SUM(R1C[-1]:RC1) -> 4180386
A2892: =R[-1]C+1 -> 2892 | B2892: =SUM(R1C[-1]:RC1) -> 4183278
A2893: =R[-1]C+1 -> 2893 | B2893: =SUM(R1C[-1]:RC1) -> 4186171
A2894: =R[-1]C+1 -> 2894 | B2894: =SUM(R1C[-1]:RC1) -> 4189065
A2895: =R[-1]C+1 -> 2895 | B2895: =SUM(R1C[-1]:RC1) -> 4191960
A2896: =R[-1]C+1 -> 2896 | B2896: =SUM(R1C[-1]:RC1) -> 4194856
A2897: =R[-1]C+1 -> 2897 | B2897: =SUM(R1C[-1]:RC1) -> 4197753
A2898: =R[-1]C+1 -> 2898 | B2898: =SUM(R1C[-1]:RC1) -> 4200651
A2899: =R[-1]C+1 -> 2899 | B2899: =SUM(R1C[-1]:RC1) -> 4203550
A2900: =R[-1]C+1 -> 2900 | B2900: =SUM(R1C[-1]:RC1) -> 4206450
A2901: =R[-1]C+1 -> 2901 | B2901: =SUM(R1C[-1]:RC1) -> 4209351
A2902: =R[-1]C+1 -> 2902 | B2902: =SUM(R1C[-1]:RC1) -> 4212253
A2903: =R[-1]C+1 -> 2903 | B2903: =SUM(R1C[-1]:RC1) -> 4215156
A2904: =R[-1]C+1 -> 2904 | B2904: =SUM(R1C[-1]:RC1) -> 4218060
A2905: =R[-1]C+1 -> 2905 | B2905: =SUM(R1C[-1]:RC1) -> 4220965
A2906: =R[-1]C+1 -> 2906 | B2906: =SUM(R1C[-1]:RC1) -> 4223871
A2907: =R[-1]C+1 -> 2907 | B2907: =SUM(R1C[-1]:RC1) -> 4226778
A2908: =R[-1]C+1 -> 2908 | B2908: =SUM(R1C[-1]:RC1) -> 4229686
A2909: =R[-1]C+1 -> 2909 | B2909: =SUM(R1C[-1]:RC1) -> 4232595
A2910: =R[-1]C+1 -> 2910 | B2910: =SUM(R1C[-1]:RC1) -> 4235505
A2911: =R[-1]C+1 -> 2911 | B2911: =SUM(R1C[-1]:RC1) -> 4238416
A2912: =R[-1]C+1 -> 2912 | B2912: =SUM(R1C[-1]:RC1) -> 4241328
A2913: =R[-1]C+1 -> 2913 | B2913: =SUM(R1C[-1]:RC1) -> 4244241
A2914: =R[-1]C+1 -> 2914 | B2914: =SUM(R1C[-1]:RC1) -> 4247155
A2915: =R[-1]C+1 -> 2915 | B2915: =SUM(R1C[-1]:RC1) -> 4250070
A2916: =R[-1]C+1 -> 2916 | B2916: =SUM(R1C[-1]:RC1) -> 4252986
A2917: =R[-1]C+1 -> 2917 | B2917: =SUM(R1C[-1]:RC1) -> 4255903
A2918: =R[-1]C+1 -> 2918 | B2918: =SUM(R1C[-1]:RC1) -> 4258821
A2919: =R[-1]C+1 -> 2919 | B2919: =SUM(R1C[-1]:RC1) -> 4261740
A2920: =R[-1]C+1 -> 2920 | B2920: =SUM(R1C[-1]:RC1) -> 4264660
A2921: =R[-1]C+1 -> 2921 | B2921: =SUM(R1C[-1]:RC1) -> 4267581
A2922: =R[-1]C+1 -> 2922 | B2922: =SUM(R1C[-1]:RC1) -> 4270503
A2923: =R[-1]C+1 -> 2923 | B2923: =SUM(R1C[-1]:RC1) -> 4273426
A2924: =R[-1]C+1 -> 2924 | B2924: =SUM(R1C[-1]:RC1) -> 4276350
A2925: =R[-1]C+1 -> 2925 | B2925: =SUM(R1C[-1]:RC1) -> 4279275
A2926: =R[-1]C+1 -> 2926 | B2926: =SUM(R1C[-1]:RC1) -> 4282201
A2927: =R[-1]C+1 -> 2927 | B2927: =SUM(R1C[-1]:RC1) -> 4285128
A2928: =R[-1]C+1 -> 2928 | B2928: =SUM(R1C[-1]:RC1) -> 4288056
A2929: =R[-1]C+1 -> 2929 | B2929: =SUM(R1C[-1]:RC1) -> 4290985
A2930: =R[-1]C+1 -> 2930 | B2930: =SUM(R1C[-1]:RC1) -> 4293915
A2931: =R[-1]C+1 -> 2931 | B2931: =SUM(R1C[-1]:RC1) -> 4296846
A2932: =R[-1]C+1 -> 2932 | B2932: =SUM(R1C[-1]:RC1) -> 4299778
A2933: =R[-1]C+1 -> 2933 | B2933: =SUM(R1C[-1]:RC1) -> 4302711
A2934: =R[-1]C+1 -> 2934 | B2934: =SUM(R1C[-1]:RC1) -> 4305645
A2935: =R[-1]C+1 -> 2935 | B2935: =SUM(R1C[-1]:RC1) -> 4308580
A2936: =R[-1]C+1 -> 2936 | B2936: =SUM(R1C[-1]:RC1) -> 4311516
A2937: =R[-1]C+1 -> 2937 | B2937: =SUM(R1C[-1]:RC1) -> 4314453
A2938: =R[-1]C+1 -> 2938 | B2938: =SUM(R1C[-1]:RC1) -> 4317391
A2939: =R[-1]C+1 -> 2939 | B2939: =SUM(R1C[-1]:RC1) -> 4320330
A2940: =R[-1]C+1 -> 2940 | B2940: =SUM(R1C[-1]:RC1) -> 4323270
A2941: =R[-1]C+1 -> 2941 | B2941: =SUM(R1C[-1]:RC1) -> 4326211
A2942: =R[-1]C+1 -> 2942 | B2942: =SUM(R1C[-1]:RC1) -> 4329153
A2943: =R[-1]C+1 -> 2943 | B2943: =SUM(R1C[-1]:RC1) -> 4332096
A2944: =R[-1]C+1 -> 2944 | B2944: =SUM(R1C[-1]:RC1) -> 4335040
A2945: =R[-1]C+1 -> 2945 | B2945: =SUM(R1C[-1]:RC1) -> 4337985
A2946: =R[-1]C+1 -> 2946 | B2946: =SUM(R1C[-1]:RC1) -> 4340931
A2947: =R[-1]C+1 -> 2947 | B2947: =SUM(R1C[-1]:RC1) -> 4343878
A2948: =R[-1]C+1 -> 2948 | B2948: =SUM(R1C[-1]:RC1) -> 4346826
A2949: =R[-1]C+1 -> 2949 | B2949: =SUM(R1C[-1]:RC1) -> 4349775
A2950: =R[-1]C+1 -> 2950 | B2950: =SUM(R1C[-1]:RC1) -> 4352725
A2951: =R[-1]C+1 -> 2951 | B2951: =SUM(R1C[-1]:RC1) -> 4355676
A2952: =R[-1]C+1 -> 2952 | B2952: =SUM(R1C[-1]:RC1) -> 4358628
A2953: =R[-1]C+1 -> 2953 | B2953: =SUM(R1C[-1]:RC1) -> 4361581
A2954: =R[-1]C+1 -> 2954 | B2954: =SUM(R1C[-1]:RC1) -> 4364535
A2955: =R[-1]C+1 -> 2955 | B2955: =SUM(R1C[-1]:RC1) -> 4367490
A2956: =R[-1]C+1 -> 2956 | B2956: =SUM(R1C[-1]:RC1) -> 4370446
A2957: =R[-1]C+1 -> 2957 | B2957: =SUM(R1C[-1]:RC1) -> 4373403
A2958: =R[-1]C+1 -> 2958 | B2958: =SUM(R1C[-1]:RC1) -> 4376361
A2959: =R[-1]C+1 -> 2959 | B2959: =SUM(R1C[-1]:RC1) -> 4379320
A2960: =R[-1]C+1 -> 2960 | B2960: =SUM(R1C[-1]:RC1) -> 4382280
A2961: =R[-1]C+1 -> 2961 | B2961: =SUM(R1C[-1]:RC1) -> 4385241
A2962: =R[-1]C+1 -> 2962 | B2962: =SUM(R1C[-1]:RC1) -> 4388203
A2963: =R[-1]C+1 -> 2963 | B2963: =SUM(R1C[-1]:RC1) -> 4391166
A2964: =R[-1]C+1 -> 2964 | B2964: =SUM(R1C[-1]:RC1) -> 4394130
A2965: =R[-1]C+1 -> 2965 | B2965: =SUM(R1C[-1]:RC1) -> 4397095
A2966: =R[-1]C+1 -> 2966 | B2966: =SUM(R1C[-1]:RC1) -> 4400061
A2967: =R[-1]C+1 -> 2967 | B2967: =SUM(R1C[-1]:RC1) -> 4403028
A2968: =R[-1]C+1 -> 2968 | B2968: =SUM(R1C[-1]:RC1) -> 4405996
A2969: =R[-1]C+1 -> 2969 | B2969: =SUM(R1C[-1]:RC1) -> 4408965
A2970: =R[-1]C+1 -> 2970 | B2970: =SUM(R1C[-1]:RC1) -> 4411935
A2971: =R[-1]C+1 -> 2971 | B2971: =SUM(R1C[-1]:RC1) -> 4414906
A2972: =R[-1]C+1 -> 2972 | B2972: =SUM(R1C[-1]:RC1) -> 4417878
A2973: =R[-1]C+1 -> 2973 | B2973: =SUM(R1C[-1]:RC1) -> 4420851
A2974: =R[-1]C+1 -> 2974 | B2974: =SUM(R1C[-1]:RC1) -> 4423825
A2975: =R[-1]C+1 -> 2975 | B2975: =SUM(R1C[-1]:RC1) -> 4426800
A2976: =R[-1]C+1 -> 2976 | B2976: =SUM(R1C[-1]:RC1) -> 4429776
A2977: =R[-1]C+1 -> 2977 | B2977: =SUM(R1C[-1]:RC1) -> 4432753
A2978: =R[-1]C+1 -> 2978 | B2978: =SUM(R1C[-1]:RC1) -> 4435731
A2979: =R[-1]C+1 -> 2979 | B2979: =SUM(R1C[-1]:RC1) -> 4438710
A2980: =R[-1]C+1 -> 2980 | B2980: =SUM(R1C[-1]:RC1) -> 4441690
A2981: =R[-1]C+1 -> 2981 | B2981: =SUM(R1C[-1]:RC1) -> 4444671
A2982: =R[-1]C+1 -> 2982 | B2982: =SUM(R1C[-1]:RC1) -> 4447653
A2983: =R[-1]C+1 -> 2983 | B2983: =SUM(R1C[-1]:RC1) -> 4450636
A2984: =R[-1]C+1 -> 2984 | B2984: =SUM(R1C[-1]:RC1) -> 4453620
A2985: =R[-1]C+1 -> 2985 | B2985: =SUM(R1C[-1]:RC1) -> 4456605
A2986: =R[-1]C+1 -> 2986 | B2986: =SUM(R1C[-1]:RC1) -> 4459591
A2987: =R[-1]C+1 -> 2987 | B2987: =SUM(R1C[-1]:RC1) -> 4462578
A2988: =R[-1]C+1 -> 2988 | B2988: =SUM(R1C[-1]:RC1) -> 4465566
A2989: =R[-1]C+1 -> 2989 | B2989: =SUM(R1C[-1]:RC1) -> 4468555
A2990: =R[-1]C+1 -> 2990 | B2990: =SUM(R1C[-1]:RC1) -> 4471545
A2991: =R[-1]C+1 -> 2991 | B2991: =SUM(R1C[-1]:RC1) -> 4474536
A2992: =R[-1]C+1 -> 2992 | B2992: =SUM(R1C[-1]:RC1) -> 4477528
A2993: =R[-1]C+1 -> 2993 | B2993: =SUM(R1C[-1]:RC1) -> 4480521
A2994: =R[-1]C+1 -> 2994 | B2994: =SUM(R1C[-1]:RC1) -> 4483515
A2995: =R[-1]C+1 -> 2995 | B2995: =SUM(R1C[-1]:RC1) -> 4486510
A2996: =R[-1]C+1 -> 2996 | B2996: =SUM(R1C[-1]:RC1) -> 4489506
A2997: =R[-1]C+1 -> 2997 | B2997: =SUM(R1C[-1]:RC1) -> 4492503
A2998: =R[-1]C+1 -> 2998 | B2998: =SUM(R1C[-1]:RC1) -> 4495501
A2999: =R[-1]C+1 -> 2999 | B2999: =SUM(R1C[-1]:RC1) -> 4498500
A3000: =R[-1]C+1 -> 3000 | B3000: =SUM(R1C[-1]:RC1) -> 4501500
A3001: =R[-1]C+1 -> 3001 | B3001: =SUM(R1C[-1]:RC1) -> 4504501
A3002: =R[-1]C+1 -> 3002 | B3002: =SUM(R1C[-1]:RC1) -> 4507503
A3003: =R[-1]C+1 -> 3003 | B3003: =SUM(R1C[-1]:RC1) -> 4510506
A3004: =R[-1]C+1 -> 3004 | B3004: =SUM(R1C[-1]:RC1) -> 4513510
A3005: =R[-1]C+1 -> 3005 | B3005: =SUM(R1C[-1]:RC1) -> 4516515
A3006: =R[-1]C+1 -> 3006 | B3006: =SUM(R1C[-1]:RC1) -> 4519521
A3007: =R[-1]C+1 -> 3007 | B3007: =SUM(R1C[-1]:RC1) -> 4522528
A3008: =R[-1]C+1 -> 3008 | B3008: =SUM(R1C[-1]:RC1) -> 4525536
A3009: =R[-1]C+1 -> 3009 | B3009: =SUM(R1C[-1]:RC1) -> 4528545
A3010: =R[-1]C+1 -> 3010 | B3010: =SUM(R1C[-1]:RC1) -> 4531555
A3011: =R[-1]C+1 -> 3011 | B3011: =SUM(R1C[-1]:RC1) -> 4534566
A3012: =R[-1]C+1 -> 3012 | B3012: =SUM(R1C[-1]:RC1) -> 4537578
A3013: =R[-1]C+1 -> 3013 | B3013: =SUM(R1C[-1]:RC1) -> 4540591
A3014: =R[-1]C+1 -> 3014 | B3014: =SUM(R1C[-1]:RC1) -> 4543605
A3015: =R[-1]C+1 -> 3015 | B3015: =SUM(R1C[-1]:RC1) -> 4546620
A3016: =R[-1]C+1 -> 3016 | B3016: =SUM(R1C[-1]:RC1) -> 4549636
A3017: =R[-1]C+1 -> 3017 | B3017: =SUM(R1C[-1]:RC1) -> 4552653
A3018: =R[-1]C+1 -> 3018 | B3018: =SUM(R1C[-1]:RC1) -> 4555671
A3019: =R[-1]C+1 -> 3019 | B3019: =SUM(R1C[-1]:RC1) -> 4558690
A3020: =R[-1]C+1 -> 3020 | B3020: =SUM(R1C[-1]:RC1) -> 4561710
A3021: =R[-1]C+1 -> 3021 | B3021: =SUM(R1C[-1]:RC1) -> 4564731
A3022: =R[-1]C+1 -> 3022 | B3022: =SUM(R1C[-1]:RC1) -> 4567753
A3023: =R[-1]C+1 -> 3023 | B3023: =SUM(R1C[-1]:RC1) -> 4570776
A3024: =R[-1]C+1 -> 3024 | B3024: =SUM(R1C[-1]:RC1) -> 4573800
A3025: =R[-1]C+1 -> 3025 | B3025: =SUM(R1C[-1]:RC1) -> 4576825
A3026: =R[-1]C+1 -> 3026 | B3026: =SUM(R1C[-1]:RC1) -> 4579851
A3027: =R[-1]C+1 -> 3027 | B3027: =SUM(R1C[-1]:RC1) -> 4582878
A3028: =R[-1]C+1 -> 3028 | B3028: =SUM(R1C[-1]:RC1) -> 4585906
A3029: =R[-1]C+1 -> 3029 | B3029: =SUM(R1C[-1]:RC1) -> 4588935
A3030: =R[-1]C+1 -> 3030 | B3030: =SUM(R1C[-1]:RC1) -> 4591965
A3031: =R[-1]C+1 -> 3031 | B3031: =SUM(R1C[-1]:RC1) -> 4594996
A3032: =R[-1]C+1 -> 3032 | B3032: =SUM(R1C[-1]:RC1) -> 4598028
A3033: =R[-1]C+1 -> 3033 | B3033: =SUM(R1C[-1]:RC1) -> 4601061
A3034: =R[-1]C+1 -> 3034 | B3034: =SUM(R1C[-1]:RC1) -> 4604095
A3035: =R[-1]C+1 -> 3035 | B3035: =SUM(R1C[-1]:RC1) -> 4607130
A3036: =R[-1]C+1 -> 3036 | B3036: =SUM(R1C[-1]:RC1) -> 4610166
A3037: =R[-1]C+1 -> 3037 | B3037: =SUM(R1C[-1]:RC1) -> 4613203
A3038: =R[-1]C+1 -> 3038 | B3038: =SUM(R1C[-1]:RC1) -> 4616241
A3039: =R[-1]C+1 -> 3039 | B3039: =SUM(R1C[-1]:RC1) -> 4619280
A3040: =R[-1]C+1 -> 3040 | B3040: =SUM(R1C[-1]:RC1) -> 4622320
A3041: =R[-1]C+1 -> 3041 | B3041: =SUM(R1C[-1]:RC1) -> 4625361
A3042: =R[-1]C+1 -> 3042 | B3042: =SUM(R1C[-1]:RC1) -> 4628403
A3043: =R[-1]C+1 -> 3043 | B3043: =SUM(R1C[-1]:RC1) -> 4631446
A3044: =R[-1]C+1 -> 3044 | B3044: =SUM(R1C[-1]:RC1) -> 4634490
A3045: =R[-1]C+1 -> 3045 | B3045: =SUM(R1C[-1]:RC1) -> 4637535
A3046: =R[-1]C+1 -> 3046 | B3046: =SUM(R1C[-1]:RC1) -> 4640581
A3047: =R[-1]C+1 -> 3047 | B3047: =SUM(R1C[-1]:RC1) -> 4643628
A3048: =R[-1]C+1 -> 3048 | B3048: =SUM(R1C[-1]:RC1) -> 4646676
A3049: =R[-1]C+1 -> 3049 | B3049: =SUM(R1C[-1]:RC1) -> 4649725
A3050: =R[-1]C+1 -> 3050 | B3050: =SUM(R1C[-1]:RC1) -> 4652775
A3051: =R[-1]C+1 -> 3051 | B3051: =SUM(R1C[-1]:RC1) -> 4655826
A3052: =R[-1]C+1 -> 3052 | B3052: =SUM(R1C[-1]:RC1) -> 4658878
A3053: =R[-1]C+1 -> 3053 | B3053: =SUM(R1C[-1]:RC1) -> 4661931
A3054: =R[-1]C+1 -> 3054 | B3054: =SUM(R1C[-1]:RC1) -> 4664985
A3055: =R[-1]C+1 -> 3055 | B3055: =SUM(R1C[-1]:RC1) -> 4668040
A3056: =R[-1]C+1 -> 3056 | B3056: =SUM(R1C[-1]:RC1) -> 4671096
A3057: =R[-1]C+1 -> 3057 | B3057: =SUM(R1C[-1]:RC1) -> 4674153
A3058: =R[-1]C+1 -> 3058 | B3058: =SUM(R1C[-1]:RC1) -> 4677211
A3059: =R[-1]C+1 -> 3059 | B3059: =SUM(R1C[-1]:RC1) -> 4680270
A3060: =R[-1]C+1 -> 3060 | B3060: =SUM(R1C[-1]:RC1) -> 4683330
A3061: =R[-1]C+1 -> 3061 | B3061: =SUM(R1C[-1]:RC1) -> 4686391
A3062: =R[-1]C+1 -> 3062 | B3062: =SUM(R1C[-1]:RC1) -> 4689453
A3063: =R[-1]C+1 -> 3063 | B3063: =SUM(R1C[-1]:RC1) -> 4692516
A3064: =R[-1]C+1 -> 3064 | B3064: =SUM(R1C[-1]:RC1) -> 4695580
A3065: =R[-1]C+1 -> 3065 | B3065: =SUM(R1C[-1]:RC1) -> 4698645
A3066: =R[-1]C+1 -> 3066 | B3066: =SUM(R1C[-1]:RC1) -> 4701711
A3067: =R[-1]C+1 -> 3067 | B3067: =SUM(R1C[-1]:RC1) -> 4704778
A3068: =R[-1]C+1 -> 3068 | B3068: =SUM(R1C[-1]:RC1) -> 4707846
A3069: =R[-1]C+1 -> 3069 | B3069: =SUM(R1C[-1]:RC1) -> 4710915
A3070: =R[-1]C+1 -> 3070 | B3070: =SUM(R1C[-1]:RC1) -> 4713985
A3071: =R[-1]C+1 -> 3071 | B3071: =SUM(R1C[-1]:RC1) -> 4717056
A3072: =R[-1]C+1 -> 3072 | B3072: =SUM(R1C[-1]:RC1) -> 4720128
A3073: =R[-1]C+1 -> 3073 | B3073: =SUM(R1C[-1]:RC1) -> 4723201
A3074: =R[-1]C+1 -> 3074 | B3074: =SUM(R1C[-1]:RC1) -> 4726275
A3075: =R[-1]C+1 -> 3075 | B3075: =SUM(R1C[-1]:RC1) -> 4729350
A3076: =R[-1]C+1 -> 3076 | B3076: =SUM(R1C[-1]:RC1) -> 4732426
A3077: =R[-1]C+1 -> 3077 | B3077: =SUM(R1C[-1]:RC1) -> 4735503
A3078: =R[-1]C+1 -> 3078 | B3078: =SUM(R1C[-1]:RC1) -> 4738581
A3079: =R[-1]C+1 -> 3079 | B3079: =SUM(R1C[-1]:RC1) -> 4741660
A3080: =R[-1]C+1 -> 3080 | B3080: =SUM(R1C[-1]:RC1) -> 4744740
A3081: =R[-1]C+1 -> 3081 | B3081: =SUM(R1C[-1]:RC1) -> 4747821
A3082: =R[-1]C+1 -> 3082 | B3082: =SUM(R1C[-1]:RC1) -> 4750903
A3083: =R[-1]C+1 -> 3083 | B3083: =SUM(R1C[-1]:RC1) -> 4753986
A3084: =R[-1]C+1 -> 3084 | B3084: =SUM(R1C[-1]:RC1) -> 4757070
A3085: =R[-1]C+1 -> 3085 | B3085: =SUM(R1C[-1]:RC1) -> 4760155
A3086: =R[-1]C+1 -> 3086 | B3086: =SUM(R1C[-1]:RC1) -> 4763241
A3087: =R[-1]C+1 -> 3087 | B3087: =SUM(R1C[-1]:RC1) -> 4766328
A3088: =R[-1]C+1 -> 3088 | B3088: =SUM(R1C[-1]:RC1) -> 4769416
A3089: =R[-1]C+1 -> 3089 | B3089: =SUM(R1C[-1]:RC1) -> 4772505
A3090: =R[-1]C+1 -> 3090 | B3090: =SUM(R1C[-1]:RC1) -> 4775595
A3091: =R[-1]C+1 -> 3091 | B3091: =SUM(R1C[-1]:RC1) -> 4778686
A3092: =R[-1]C+1 -> 3092 | B3092: =SUM(R1C[-1]:RC1) -> 4781778
A3093: =R[-1]C+1 -> 3093 | B3093: =SUM(R1C[-1]:RC1) -> 4784871
A3094: =R[-1]C+1 -> 3094 | B3094: =SUM(R1C[-1]:RC1) -> 4787965
A3095: =R[-1]C+1 -> 3095 | B3095: =SUM(R1C[-1]:RC1) -> 4791060
A3096: =R[-1]C+1 -> 3096 | B3096: =SUM(R1C[-1]:RC1) -> 4794156
A3097: =R[-1]C+1 -> 3097 | B3097: =SUM(R1C[-1]:RC1) -> 4797253
A3098: =R[-1]C+1 -> 3098 | B3098: =SUM(R1C[-1]:RC1) -> 4800351
A3099: =R[-1]C+1 -> 3099 | B3099: =SUM(R1C[-1]:RC1) -> 4803450
A3100: =R[-1]C+1 -> 3100 | B3100: =SUM(R1C[-1]:RC1) -> 4806550
A3101: =R[-1]C+1 -> 3101 | B3101: =SUM(R1C[-1]:RC1) -> 4809651
A3102: =R[-1]C+1 -> 3102 | B3102: =SUM(R1C[-1]:RC1) -> 4812753
A3103: =R[-1]C+1 -> 3103 | B3103: =SUM(R1C[-1]:RC1) -> 4815856
A3104: =R[-1]C+1 -> 3104 | B3104: =SUM(R1C[-1]:RC1) -> 4818960
A3105: =R[-1]C+1 -> 3105 | B3105: =SUM(R1C[-1]:RC1) -> 4822065
A3106: =R[-1]C+1 -> 3106 | B3106: =SUM(R1C[-1]:RC1) -> 4825171
A3107: =R[-1]C+1 -> 3107 | B3107: =SUM(R1C[-1]:RC1) -> 4828278
A3108: =R[-1]C+1 -> 3108 | B3108: =SUM(R1C[-1]:RC1) -> 4831386
A3109: =R[-1]C+1 -> 3109 | B3109: =SUM(R1C[-1]:RC1) -> 4834495
A3110: =R[-1]C+1 -> 3110 | B3110: =SUM(R1C[-1]:RC1) -> 4837605
A3111: =R[-1]C+1 -> 3111 | B3111: =SUM(R1C[-1]:RC1) -> 4840716
A3112: =R[-1]C+1 -> 3112 | B3112: =SUM(R1C[-1]:RC1) -> 4843828
A3113: =R[-1]C+1 -> 3113 | B3113: =SUM(R1C[-1]:RC1) -> 4846941
A3114: =R[-1]C+1 -> 3114 | B3114: =SUM(R1C[-1]:RC1) -> 4850055
A3115: =R[-1]C+1 -> 3115 | B3115: =SUM(R1C[-1]:RC1) -> 4853170
A3116: =R[-1]C+1 -> 3116 | B3116: =SUM(R1C[-1]:RC1) -> 4856286
A3117: =R[-1]C+1 -> 3117 | B3117: =SUM(R1C[-1]:RC1) -> 4859403
A3118: =R[-1]C+1 -> 3118 | B3118: =SUM(R1C[-1]:RC1) -> 4862521
A3119: =R[-1]C+1 -> 3119 | B3119: =SUM(R1C[-1]:RC1) -> 4865640
A3120: =R[-1]C+1 -> 3120 | B3120: =SUM(R1C[-1]:RC1) -> 4868760
A3121: =R[-1]C+1 -> 3121 | B3121: =SUM(R1C[-1]:RC1) -> 4871881
A3122: =R[-1]C+1 -> 3122 | B3122: =SUM(R1C[-1]:RC1) -> 4875003
A3123: =R[-1]C+1 -> 3123 | B3123: =SUM(R1C[-1]:RC1) -> 4878126
A3124: =R[-1]C+1 -> 3124 | B3124: =SUM(R1C[-1]:RC1) -> 4881250
A3125: =R[-1]C+1 -> 3125 | B3125: =SUM(R1C[-1]:RC1) -> 4884375
A3126: =R[-1]C+1 -> 3126 | B3126: =SUM(R1C[-1]:RC1) -> 4887501
A3127: =R[-1]C+1 -> 3127 | B3127: =SUM(R1C[-1]:RC1) -> 4890628
A3128: =R[-1]C+1 -> 3128 | B3128: =SUM(R1C[-1]:RC1) -> 4893756
A3129: =R[-1]C+1 -> 3129 | B3129: =SUM(R1C[-1]:RC1) -> 4896885
A3130: =R[-1]C+1 -> 3130 | B3130: =SUM(R1C[-1]:RC1) -> 4900015
A3131: =R[-1]C+1 -> 3131 | B3131: =SUM(R1C[-1]:RC1) -> 4903146
A3132: =R[-1]C+1 -> 3132 | B3132: =SUM(R1C[-1]:RC1) -> 4906278
A3133: =R[-1]C+1 -> 3133 | B3133: =SUM(R1C[-1]:RC1) -> 4909411
A3134: =R[-1]C+1 -> 3134 | B3134: =SUM(R1C[-1]:RC1) -> 4912545
A3135: =R[-1]C+1 -> 3135 | B3135: =SUM(R1C[-1]:RC1) -> 4915680
A3136: =R[-1]C+1 -> 3136 | B3136: =SUM(R1C[-1]:RC1) -> 4918816
A3137: =R[-1]C+1 -> 3137 | B3137: =SUM(R1C[-1]:RC1) -> 4921953
A3138: =R[-1]C+1 -> 3138 | B3138: =SUM(R1C[-1]:RC1) -> 4925091
A3139: =R[-1]C+1 -> 3139 | B3139: =SUM(R1C[-1]:RC1) -> 4928230
A3140: =R[-1]C+1 -> 3140 | B3140: =SUM(R1C[-1]:RC1) -> 4931370
A3141: =R[-1]C+1 -> 3141 | B3141: =SUM(R1C[-1]:RC1) -> 4934511
A3142: =R[-1]C+1 -> 3142 | B3142: =SUM(R1C[-1]:RC1) -> 4937653
A3143: =R[-1]C+1 -> 3143 | B3143: =SUM(R1C[-1]:RC1) -> 4940796
A3144: =R[-1]C+1 -> 3144 | B3144: =SUM(R1C[-1]:RC1) -> 4943940
A3145: =R[-1]C+1 -> 3145 | B3145: =SUM(R1C[-1]:RC1) -> 4947085
A3146: =R[-1]C+1 -> 3146 | B3146: =SUM(R1C[-1]:RC1) -> 4950231
A3147: =R[-1]C+1 -> 3147 | B3147: =SUM(R1C[-1]:RC1) -> 4953378
A3148: =R[-1]C+1 -> 3148 | B3148: =SUM(R1C[-1]:RC1) -> 4956526
A3149: =R[-1]C+1 -> 3149 | B3149: =SUM(R1C[-1]:RC1) -> 4959675
A3150: =R[-1]C+1 -> 3150 | B3150: =SUM(R1C[-1]:RC1) -> 4962825
A3151: =R[-1]C+1 -> 3151 | B3151: =SUM(R1C[-1]:RC1) -> 4965976
A3152: =R[-1]C+1 -> 3152 | B3152: =SUM(R1C[-1]:RC1) -> 4969128
A3153: =R[-1]C+1 -> 3153 | B3153: =SUM(R1C[-1]:RC1) -> 4972281
A3154: =R[-1]C+1 -> 3154 | B3154: =SUM(R1C[-1]:RC1) -> 4975435
A3155: =R[-1]C+1 -> 3155 | B3155: =SUM(R1C[-1]:RC1) -> 4978590
A3156: =R[-1]C+1 -> 3156 | B3156: =SUM(R1C[-1]:RC1) -> 4981746
A3157: =R[-1]C+1 -> 3157 | B3157: =SUM(R1C[-1]:RC1) -> 4984903
A3158: =R[-1]C+1 -> 3158 | B3158: =SUM(R1C[-1]:RC1) -> 4988061
A3159: =R[-1]C+1 -> 3159 | B3159: =SUM(R1C[-1]:RC1) -> 4991220
A3160: =R[-1]C+1 -> 3160 | B3160: =SUM(R1C[-1]:RC1) -> 4994380
A3161: =R[-1]C+1 -> 3161 | B3161: =SUM(R1C[-1]:RC1) -> 4997541
A3162: =R[-1]C+1 -> 3162 | B3162: =SUM(R1C[-1]:RC1) -> 5000703
A3163: =R[-1]C+1 -> 3163 | B3163: =SUM(R1C[-1]:RC1) -> 5003866
A3164: =R[-1]C+1 -> 3164 | B3164: =SUM(R1C[-1]:RC1) -> 5007030
A3165: =R[-1]C+1 -> 3165 | B3165: =SUM(R1C[-1]:RC1) -> 5010195
A3166: =R[-1]C+1 -> 3166 | B3166: =SUM(R1C[-1]:RC1) -> 5013361
A3167: =R[-1]C+1 -> 3167 | B3167: =SUM(R1C[-1]:RC1) -> 5016528
A3168: =R[-1]C+1 -> 3168 | B3168: =SUM(R1C[-1]:RC1) -> 5019696
A3169: =R[-1]C+1 -> 3169 | B3169: =SUM(R1C[-1]:RC1) -> 5022865
A3170: =R[-1]C+1 -> 3170 | B3170: =SUM(R1C[-1]:RC1) -> 5026035
A3171: =R[-1]C+1 -> 3171 | B3171: =SUM(R1C[-1]:RC1) -> 5029206
A3172: =R[-1]C+1 -> 3172 | B3172: =SUM(R1C[-1]:RC1) -> 5032378
A3173: =R[-1]C+1 -> 3173 | B3173: =SUM(R1C[-1]:RC1) -> 5035551
A3174: =R[-1]C+1 -> 3174 | B3174: =SUM(R1C[-1]:RC1) -> 5038725
A3175: =R[-1]C+1 -> 3175 | B3175: =SUM(R1C[-1]:RC1) -> 5041900
A3176: =R[-1]C+1 -> 3176 | B3176: =SUM(R1C[-1]:RC1) -> 5045076
A3177: =R[-1]C+1 -> 3177 | B3177: =SUM(R1C[-1]:RC1) -> 5048253
A3178: =R[-1]C+1 -> 3178 | B3178: =SUM(R1C[-1]:RC1) -> 5051431
A3179: =R[-1]C+1 -> 3179 | B3179: =SUM(R1C[-1]:RC1) -> 5054610
A3180: =R[-1]C+1 -> 3180 | B3180: =SUM(R1C[-1]:RC1) -> 5057790
A3181: =R[-1]C+1 -> 3181 | B3181: =SUM(R1C[-1]:RC1) -> 5060971
A3182: =R[-1]C+1 -> 3182 | B3182: =SUM(R1C[-1]:RC1) -> 5064153
A3183: =R[-1]C+1 -> 3183 | B3183: =SUM(R1C[-1]:RC1) -> 5067336
A3184: =R[-1]C+1 -> 3184 | B3184: =SUM(R1C[-1]:RC1) -> 5070520
A3185: =R[-1]C+1 -> 3185 | B3185: =SUM(R1C[-1]:RC1) -> 5073705
A3186: =R[-1]C+1 -> 3186 | B3186: =SUM(R1C[-1]:RC1) -> 5076891
A3187: =R[-1]C+1 -> 3187 | B3187: =SUM(R1C[-1]:RC1) -> 5080078
A3188: =R[-1]C+1 -> 3188 | B3188: =SUM(R1C[-1]:RC1) -> 5083266
A3189: =R[-1]C+1 -> 3189 | B3189: =SUM(R1C[-1]:RC1) -> 5086455
A3190: =R[-1]C+1 -> 3190 | B3190: =SUM(R1C[-1]:RC1) -> 5089645
A3191: =R[-1]C+1 -> 3191 | B3191: =SUM(R1C[-1]:RC1) -> 5092836
A3192: =R[-1]C+1 -> 3192 | B3192: =SUM(R1C[-1]:RC1) -> 5096028
A3193: =R[-1]C+1 -> 3193 | B3193: =SUM(R1C[-1]:RC1) -> 5099221
A3194: =R[-1]C+1 -> 3194 | B3194: =SUM(R1C[-1]:RC1) -> 5102415
A3195: =R[-1]C+1 -> 3195 | B3195: =SUM(R1C[-1]:RC1) -> 5105610
A3196: =R[-1]C+1 -> 3196 | B3196: =SUM(R1C[-1]:RC1) -> 5108806
A3197: =R[-1]C+1 -> 3197 | B3197: =SUM(R1C[-1]:RC1) -> 5112003
A3198: =R[-1]C+1 -> 3198 | B3198: =SUM(R1C[-1]:RC1) -> 5115201
A3199: =R[-1]C+1 -> 3199 | B3199: =SUM(R1C[-1]:RC1) -> 5118400
A3200: =R[-1]C+1 -> 3200 | B3200: =SUM(R1C[-1]:RC1) -> 5121600
A3201: =R[-1]C+1 -> 3201 | B3201: =SUM(R1C[-1]:RC1) -> 5124801
A3202: =R[-1]C+1 -> 3202 | B3202: =SUM(R1C[-1]:RC1) -> 5128003
A3203: =R[-1]C+1 -> 3203 | B3203: =SUM(R1C[-1]:RC1) -> 5131206
A3204: =R[-1]C+1 -> 3204 | B3204: =SUM(R1C[-1]:RC1) -> 5134410
A3205: =R[-1]C+1 -> 3205 | B3205: =SUM(R1C[-1]:RC1) -> 5137615
A3206: =R[-1]C+1 -> 3206 | B3206: =SUM(R1C[-1]:RC1) -> 5140821
A3207: =R[-1]C+1 -> 3207 | B3207: =SUM(R1C[-1]:RC1) -> 5144028
A3208: =R[-1]C+1 -> 3208 | B3208: =SUM(R1C[-1]:RC1) -> 5147236
A3209: =R[-1]C+1 -> 3209 | B3209: =SUM(R1C[-1]:RC1) -> 5150445
A3210: =R[-1]C+1 -> 3210 | B3210: =SUM(R1C[-1]:RC1) -> 5153655
A3211: =R[-1]C+1 -> 3211 | B3211: =SUM(R1C[-1]:RC1) -> 5156866
A3212: =R[-1]C+1 -> 3212 | B3212: =SUM(R1C[-1]:RC1) -> 5160078
A3213: =R[-1]C+1 -> 3213 | B3213: =SUM(R1C[-1]:RC1) -> 5163291
A3214: =R[-1]C+1 -> 3214 | B3214: =SUM(R1C[-1]:RC1) -> 5166505
A3215: =R[-1]C+1 -> 3215 | B3215: =SUM(R1C[-1]:RC1) -> 5169720
A3216: =R[-1]C+1 -> 3216 | B3216: =SUM(R1C[-1]:RC1) -> 5172936
A3217: =R[-1]C+1 -> 3217 | B3217: =SUM(R1C[-1]:RC1) -> 5176153
A3218: =R[-1]C+1 -> 3218 | B3218: =SUM(R1C[-1]:RC1) -> 5179371
A3219: =R[-1]C+1 -> 3219 | B3219: =SUM(R1C[-1]:RC1) -> 5182590
A3220: =R[-1]C+1 -> 3220 | B3220: =SUM(R1C[-1]:RC1) -> 5185810
A3221: =R[-1]C+1 -> 3221 | B3221: =SUM(R1C[-1]:RC1) -> 5189031
A3222: =R[-1]C+1 -> 3222 | B3222: =SUM(R1C[-1]:RC1) -> 5192253
A3223: =R[-1]C+1 -> 3223 | B3223: =SUM(R1C[-1]:RC1) -> 5195476
A3224: =R[-1]C+1 -> 3224 | B3224: =SUM(R1C[-1]:RC1) -> 5198700
A3225: =R[-1]C+1 -> 3225 | B3225: =SUM(R1C[-1]:RC1) -> 5201925
A3226: =R[-1]C+1 -> 3226 | B3226: =SUM(R1C[-1]:RC1) -> 5205151
A3227: =R[-1]C+1 -> 3227 | B3227: =SUM(R1C[-1]:RC1) -> 5208378
A3228: =R[-1]C+1 -> 3228 | B3228: =SUM(R1C[-1]:RC1) -> 5211606
A3229: =R[-1]C+1 -> 3229 | B3229: =SUM(R1C[-1]:RC1) -> 5214835
A3230: =R[-1]C+1 -> 3230 | B3230: =SUM(R1C[-1]:RC1) -> 5218065
A3231: =R[-1]C+1 -> 3231 | B3231: =SUM(R1C[-1]:RC1) -> 5221296
A3232: =R[-1]C+1 -> 3232 | B3232: =SUM(R1C[-1]:RC1) -> 5224528
A3233: =R[-1]C+1 -> 3233 | B3233: =SUM(R1C[-1]:RC1) -> 5227761
A3234: =R[-1]C+1 -> 3234 | B3234: =SUM(R1C[-1]:RC1) -> 5230995
A3235: =R[-1]C+1 -> 3235 | B3235: =SUM(R1C[-1]:RC1) -> 5234230
A3236: =R[-1]C+1 -> 3236 | B3236: =SUM(R1C[-1]:RC1) -> 5237466
A3237: =R[-1]C+1 -> 3237 | B3237: =SUM(R1C[-1]:RC1) -> 5240703
A3238: =R[-1]C+1 -> 3238 | B3238: =SUM(R1C[-1]:RC1) -> 5243941
A3239: =R[-1]C+1 -> 3239 | B3239: =SUM(R1C[-1]:RC1) -> 5247180
A3240: =R[-1]C+1 -> 3240 | B3240: =SUM(R1C[-1]:RC1) -> 5250420
A3241: =R[-1]C+1 -> 3241 | B3241: =SUM(R1C[-1]:RC1) -> 5253661
A3242: =R[-1]C+1 -> 3242 | B3242: =SUM(R1C[-1]:RC1) -> 5256903
A3243: =R[-1]C+1 -> 3243 | B3243: =SUM(R1C[-1]:RC1) -> 5260146
A3244: =R[-1]C+1 -> 3244 | B3244: =SUM(R1C[-1]:RC1) -> 5263390
A3245: =R[-1]C+1 -> 3245 | B3245: =SUM(R1C[-1]:RC1) -> 5266635
A3246: =R[-1]C+1 -> 3246 | B3246: =SUM(R1C[-1]:RC1) -> 5269881
A3247: =R[-1]C+1 -> 3247 | B3247: =SUM(R1C[-1]:RC1) -> 5273128
A3248: =R[-1]C+1 -> 3248 | B3248: =SUM(R1C[-1]:RC1) -> 5276376
A3249: =R[-1]C+1 -> 3249 | B3249: =SUM(R1C[-1]:RC1) -> 5279625
A3250: =R[-1]C+1 -> 3250 | B3250: =SUM(R1C[-1]:RC1) -> 5282875
A3251: =R[-1]C+1 -> 3251 | B3251: =SUM(R1C[-1]:RC1) -> 5286126
A3252: =R[-1]C+1 -> 3252 | B3252: =SUM(R1C[-1]:RC1) -> 5289378
A3253: =R[-1]C+1 -> 3253 | B3253: =SUM(R1C[-1]:RC1) -> 5292631
A3254: =R[-1]C+1 -> 3254 | B3254: =SUM(R1C[-1]:RC1) -> 5295885
A3255: =R[-1]C+1 -> 3255 | B3255: =SUM(R1C[-1]:RC1) -> 5299140
A3256: =R[-1]C+1 -> 3256 | B3256: =SUM(R1C[-1]:RC1) -> 5302396
A3257: =R[-1]C+1 -> 3257 | B3257: =SUM(R1C[-1]:RC1) -> 5305653
A3258: =R[-1]C+1 -> 3258 | B3258: =SUM(R1C[-1]:RC1) -> 5308911
A3259: =R[-1]C+1 -> 3259 | B3259: =SUM(R1C[-1]:RC1) -> 5312170
A3260: =R[-1]C+1 -> 3260 | B3260: =SUM(R1C[-1]:RC1) -> 5315430
A3261: =R[-1]C+1 -> 3261 | B3261: =SUM(R1C[-1]:RC1) -> 5318691
A3262: =R[-1]C+1 -> 3262 | B3262: =SUM(R1C[-1]:RC1) -> 5321953
A3263: =R[-1]C+1 -> 3263 | B3263: =SUM(R1C[-1]:RC1) -> 5325216
A3264: =R[-1]C+1 -> 3264 | B3264: =SUM(R1C[-1]:RC1) -> 5328480
A3265: =R[-1]C+1 -> 3265 | B3265: =SUM(R1C[-1]:RC1) -> 5331745
A3266: =R[-1]C+1 -> 3266 | B3266: =SUM(R1C[-1]:RC1) -> 5335011
A3267: =R[-1]C+1 -> 3267 | B3267: =SUM(R1C[-1]:RC1) -> 5338278
A3268: =R[-1]C+1 -> 3268 | B3268: =SUM(R1C[-1]:RC1) -> 5341546
A3269: =R[-1]C+1 -> 3269 | B3269: =SUM(R1C[-1]:RC1) -> 5344815
A3270: =R[-1]C+1 -> 3270 | B3270: =SUM(R1C[-1]:RC1) -> 5348085
A3271: =R[-1]C+1 -> 3271 | B3271: =SUM(R1C[-1]:RC1) -> 5351356
A3272: =R[-1]C+1 -> 3272 | B3272: =SUM(R1C[-1]:RC1) -> 5354628
A3273: =R[-1]C+1 -> 3273 | B3273: =SUM(R1C[-1]:RC1) -> 5357901
A3274: =R[-1]C+1 -> 3274 | B3274: =SUM(R1C[-1]:RC1) -> 5361175
A3275: =R[-1]C+1 -> 3275 | B3275: =SUM(R1C[-1]:RC1) -> 5364450
A3276: =R[-1]C+1 -> 3276 | B3276: =SUM(R1C[-1]:RC1) -> 5367726
A3277: =R[-1]C+1 -> 3277 | B3277: =SUM(R1C[-1]:RC1) -> 5371003
A3278: =R[-1]C+1 -> 3278 | B3278: =SUM(R1C[-1]:RC1) -> 5374281
A3279: =R[-1]C+1 -> 3279 | B3279: =SUM(R1C[-1]:RC1) -> 5377560
A3280: =R[-1]C+1 -> 3280 | B3280: =SUM(R1C[-1]:RC1) -> 5380840
A3281: =R[-1]C+1 -> 3281 | B3281: =SUM(R1C[-1]:RC1) -> 5384121
A3282: =R[-1]C+1 -> 3282 | B3282: =SUM(R1C[-1]:RC1) -> 5387403
A3283: =R[-1]C+1 -> 3283 | B3283: =SUM(R1C[-1]:RC1) -> 5390686
A3284: =R[-1]C+1 -> 3284 | B3284: =SUM(R1C[-1]:RC1) -> 5393970
A3285: =R[-1]C+1 -> 3285 | B3285: =SUM(R1C[-1]:RC1) -> 5397255
A3286: =R[-1]C+1 -> 3286 | B3286: =SUM(R1C[-1]:RC1) -> 5400541
A3287: =R[-1]C+1 -> 3287 | B3287: =SUM(R1C[-1]:RC1) -> 5403828
A3288: =R[-1]C+1 -> 3288 | B3288: =SUM(R1C[-1]:RC1) -> 5407116
A3289: =R[-1]C+1 -> 3289 | B3289: =SUM(R1C[-1]:RC1) -> 5410405
A3290: =R[-1]C+1 -> 3290 | B3290: =SUM(R1C[-1]:RC1) -> 5413695
A3291: =R[-1]C+1 -> 3291 | B3291: =SUM(R1C[-1]:RC1) -> 5416986
A3292: =R[-1]C+1 -> 3292 | B3292: =SUM(R1C[-1]:RC1) -> 5420278
A3293: =R[-1]C+1 -> 3293 | B3293: =SUM(R1C[-1]:RC1) -> 5423571
A3294: =R[-1]C+1 -> 3294 | B3294: =SUM(R1C[-1]:RC1) -> 5426865
A3295: =R[-1]C+1 -> 3295 | B3295: =SUM(R1C[-1]:RC1) -> 5430160
A3296: =R[-1]C+1 -> 3296 | B3296: =SUM(R1C[-1]:RC1) -> 5433456
A3297: =R[-1]C+1 -> 3297 | B3297: =SUM(R1C[-1]:RC1) -> 5436753
A3298: =R[-1]C+1 -> 3298 | B3298: =SUM(R1C[-1]:RC1) -> 5440051
A3299: =R[-1]C+1 -> 3299 | B3299: =SUM(R1C[-1]:RC1) -> 5443350
A3300: =R[-1]C+1 -> 3300 | B3300: =SUM(R1C[-1]:RC1) -> 5446650
A3301: =R[-1]C+1 -> 3301 | B3301: =SUM(R1C[-1]:RC1) -> 5449951
A3302: =R[-1]C+1 -> 3302 | B3302: =SUM(R1C[-1]:RC1) -> 5453253
A3303: =R[-1]C+1 -> 3303 | B3303: =SUM(R1C[-1]:RC1) -> 5456556
A3304: =R[-1]C+1 -> 3304 | B3304: =SUM(R1C[-1]:RC1) -> 5459860
A3305: =R[-1]C+1 -> 3305 | B3305: =SUM(R1C[-1]:RC1) -> 5463165
A3306: =R[-1]C+1 -> 3306 | B3306: =SUM(R1C[-1]:RC1) -> 5466471
A3307: =R[-1]C+1 -> 3307 | B3307: =SUM(R1C[-1]:RC1) -> 5469778
A3308: =R[-1]C+1 -> 3308 | B3308: =SUM(R1C[-1]:RC1) -> 5473086
A3309: =R[-1]C+1 -> 3309 | B3309: =SUM(R1C[-1]:RC1) -> 5476395
A3310: =R[-1]C+1 -> 3310 | B3310: =SUM(R1C[-1]:RC1) -> 5479705
A3311: =R[-1]C+1 -> 3311 | B3311: =SUM(R1C[-1]:RC1) -> 5483016
A3312: =R[-1]C+1 -> 3312 | B3312: =SUM(R1C[-1]:RC1) -> 5486328
A3313: =R[-1]C+1 -> 3313 | B3313: =SUM(R1C[-1]:RC1) -> 5489641
A3314: =R[-1]C+1 -> 3314 | B3314: =SUM(R1C[-1]:RC1) -> 5492955
A3315: =R[-1]C+1 -> 3315 | B3315: =SUM(R1C[-1]:RC1) -> 5496270
A3316: =R[-1]C+1 -> 3316 | B3316: =SUM(R1C[-1]:RC1) -> 5499586
A3317: =R[-1]C+1 -> 3317 | B3317: =SUM(R1C[-1]:RC1) -> 5502903
A3318: =R[-1]C+1 -> 3318 | B3318: =SUM(R1C[-1]:RC1) -> 5506221
A3319: =R[-1]C+1 -> 3319 | B3319: =SUM(R1C[-1]:RC1) -> 5509540
A3320: =R[-1]C+1 -> 3320 | B3320: =SUM(R1C[-1]:RC1) -> 5512860
A3321: =R[-1]C+1 -> 3321 | B3321: =SUM(R1C[-1]:RC1) -> 5516181
A3322: =R[-1]C+1 -> 3322 | B3322: =SUM(R1C[-1]:RC1) -> 5519503
A3323: =R[-1]C+1 -> 3323 | B3323: =SUM(R1C[-1]:RC1) -> 5522826
A3324: =R[-1]C+1 -> 3324 | B3324: =SUM(R1C[-1]:RC1) -> 5526150
A3325: =R[-1]C+1 -> 3325 | B3325: =SUM(R1C[-1]:RC1) -> 5529475
A3326: =R[-1]C+1 -> 3326 | B3326: =SUM(R1C[-1]:RC1) -> 5532801
A3327: =R[-1]C+1 -> 3327 | B3327: =SUM(R1C[-1]:RC1) -> 5536128
A3328: =R[-1]C+1 -> 3328 | B3328: =SUM(R1C[-1]:RC1) -> 5539456
A3329: =R[-1]C+1 -> 3329 | B3329: =SUM(R1C[-1]:RC1) -> 5542785
A3330: =R[-1]C+1 -> 3330 | B3330: =SUM(R1C[-1]:RC1) -> 5546115
A3331: =R[-1]C+1 -> 3331 | B3331: =SUM(R1C[-1]:RC1) -> 5549446
A3332: =R[-1]C+1 -> 3332 | B3332: =SUM(R1C[-1]:RC1) -> 5552778
A3333: =R[-1]C+1 -> 3333 | B3333: =SUM(R1C[-1]:RC1) -> 5556111
A3334: =R[-1]C+1 -> 3334 | B3334: =SUM(R1C[-1]:RC1) -> 5559445
A3335: =R[-1]C+1 -> 3335 | B3335: =SUM(R1C[-1]:RC1) -> 5562780
A3336: =R[-1]C+1 -> 3336 | B3336: =SUM(R1C[-1]:RC1) -> 5566116
A3337: =R[-1]C+1 -> 3337 | B3337: =SUM(R1C[-1]:RC1) -> 5569453
A3338: =R[-1]C+1 -> 3338 | B3338: =SUM(R1C[-1]:RC1) -> 5572791
A3339: =R[-1]C+1 -> 3339 | B3339: =SUM(R1C[-1]:RC1) -> 5576130
A3340: =R[-1]C+1 -> 3340 | B3340: =SUM(R1C[-1]:RC1) -> 5579470
A3341: =R[-1]C+1 -> 3341 | B3341: =SUM(R1C[-1]:RC1) -> 5582811
A3342: =R[-1]C+1 -> 3342 | B3342: =SUM(R1C[-1]:RC1) -> 5586153
A3343: =R[-1]C+1 -> 3343 | B3343: =SUM(R1C[-1]:RC1) -> 5589496
A3344: =R[-1]C+1 -> 3344 | B3344: =SUM(R1C[-1]:RC1) -> 5592840
A3345: =R[-1]C+1 -> 3345 | B3345: =SUM(R1C[-1]:RC1) -> 5596185
A3346: =R[-1]C+1 -> 3346 | B3346: =SUM(R1C[-1]:RC1) -> 5599531
A3347: =R[-1]C+1 -> 3347 | B3347: =SUM(R1C[-1]:RC1) -> 5602878
A3348: =R[-1]C+1 -> 3348 | B3348: =SUM(R1C[-1]:RC1) -> 5606226
A3349: =R[-1]C+1 -> 3349 | B3349: =SUM(R1C[-1]:RC1) -> 5609575
A3350: =R[-1]C+1 -> 3350 | B3350: =SUM(R1C[-1]:RC1) -> 5612925
A3351: =R[-1]C+1 -> 3351 | B3351: =SUM(R1C[-1]:RC1) -> 5616276
A3352: =R[-1]C+1 -> 3352 | B3352: =SUM(R1C[-1]:RC1) -> 5619628
A3353: =R[-1]C+1 -> 3353 | B3353: =SUM(R1C[-1]:RC1) -> 5622981
A3354: =R[-1]C+1 -> 3354 | B3354: =SUM(R1C[-1]:RC1) -> 5626335
A3355: =R[-1]C+1 -> 3355 | B3355: =SUM(R1C[-1]:RC1) -> 5629690
A3356: =R[-1]C+1 -> 3356 | B3356: =SUM(R1C[-1]:RC1) -> 5633046
A3357: =R[-1]C+1 -> 3357 | B3357: =SUM(R1C[-1]:RC1) -> 5636403
A3358: =R[-1]C+1 -> 3358 | B3358: =SUM(R1C[-1]:RC1) -> 5639761
A3359: =R[-1]C+1 -> 3359 | B3359: =SUM(R1C[-1]:RC1) -> 5643120
A3360: =R[-1]C+1 -> 3360 | B3360: =SUM(R1C[-1]:RC1) -> 5646480
A3361: =R[-1]C+1 -> 3361 | B3361: =SUM(R1C[-1]:RC1) -> 5649841
A3362: =R[-1]C+1 -> 3362 | B3362: =SUM(R1C[-1]:RC1) -> 5653203
A3363: =R[-1]C+1 -> 3363 | B3363: =SUM(R1C[-1]:RC1) -> 5656566
A3364: =R[-1]C+1 -> 3364 | B3364: =SUM(R1C[-1]:RC1) -> 5659930
A3365: =R[-1]C+1 -> 3365 | B3365: =SUM(R1C[-1]:RC1) -> 5663295
A3366: =R[-1]C+1 -> 3366 | B3366: =SUM(R1C[-1]:RC1) -> 5666661
A3367: =R[-1]C+1 -> 3367 | B3367: =SUM(R1C[-1]:RC1) -> 5670028
A3368: =R[-1]C+1 -> 3368 | B3368: =SUM(R1C[-1]:RC1) -> 5673396
A3369: =R[-1]C+1 -> 3369 | B3369: =SUM(R1C[-1]:RC1) -> 5676765
A3370: =R[-1]C+1 -> 3370 | B3370: =SUM(R1C[-1]:RC1) -> 5680135
A3371: =R[-1]C+1 -> 3371 | B3371: =SUM(R1C[-1]:RC1) -> 5683506
A3372: =R[-1]C+1 -> 3372 | B3372: =SUM(R1C[-1]:RC1) -> 5686878
A3373: =R[-1]C+1 -> 3373 | B3373: =SUM(R1C[-1]:RC1) -> 5690251
A3374: =R[-1]C+1 -> 3374 | B3374: =SUM(R1C[-1]:RC1) -> 5693625
A3375: =R[-1]C+1 -> 3375 | B3375: =SUM(R1C[-1]:RC1) -> 5697000
A3376: =R[-1]C+1 -> 3376 | B3376: =SUM(R1C[-1]:RC1) -> 5700376
A3377: =R[-1]C+1 -> 3377 | B3377: =SUM(R1C[-1]:RC1) -> 5703753
A3378: =R[-1]C+1 -> 3378 | B3378: =SUM(R1C[-1]:RC1) -> 5707131
A3379: =R[-1]C+1 -> 3379 | B3379: =SUM(R1C[-1]:RC1) -> 5710510
A3380: =R[-1]C+1 -> 3380 | B3380: =SUM(R1C[-1]:RC1) -> 5713890
A3381: =R[-1]C+1 -> 3381 | B3381: =SUM(R1C[-1]:RC1) -> 5717271
A3382: =R[-1]C+1 -> 3382 | B3382: =SUM(R1C[-1]:RC1) -> 5720653
A3383: =R[-1]C+1 -> 3383 | B3383: =SUM(R1C[-1]:RC1) -> 5724036
A3384: =R[-1]C+1 -> 3384 | B3384: =SUM(R1C[-1]:RC1) -> 5727420
A3385: =R[-1]C+1 -> 3385 | B3385: =SUM(R1C[-1]:RC1) -> 5730805
A3386: =R[-1]C+1 -> 3386 | B3386: =SUM(R1C[-1]:RC1) -> 5734191
A3387: =R[-1]C+1 -> 3387 | B3387: =SUM(R1C[-1]:RC1) -> 5737578
A3388: =R[-1]C+1 -> 3388 | B3388: =SUM(R1C[-1]:RC1) -> 5740966
A3389: =R[-1]C+1 -> 3389 | B3389: =SUM(R1C[-1]:RC1) -> 5744355
A3390: =R[-1]C+1 -> 3390 | B3390: =SUM(R1C[-1]:RC1) -> 5747745
A3391: =R[-1]C+1 -> 3391 | B3391: =SUM(R1C[-1]:RC1) -> 5751136
A3392: =R[-1]C+1 -> 3392 | B3392: =SUM(R1C[-1]:RC1) -> 5754528
A3393: =R[-1]C+1 -> 3393 | B3393: =SUM(R1C[-1]:RC1) -> 5757921
A3394: =R[-1]C+1 -> 3394 | B3394: =SUM(R1C[-1]:RC1) -> 5761315
A3395: =R[-1]C+1 -> 3395 | B3395: =SUM(R1C[-1]:RC1) -> 5764710
A3396: =R[-1]C+1 -> 3396 | B3396: =SUM(R1C[-1]:RC1) -> 5768106
A3397: =R[-1]C+1 -> 3397 | B3397: =SUM(R1C[-1]:RC1) -> 5771503
A3398: =R[-1]C+1 -> 3398 | B3398: =SUM(R1C[-1]:RC1) -> 5774901
A3399: =R[-1]C+1 -> 3399 | B3399: =SUM(R1C[-1]:RC1) -> 5778300
A3400: =R[-1]C+1 -> 3400 | B3400: =SUM(R1C[-1]:RC1) -> 5781700
A3401: =R[-1]C+1 -> 3401 | B3401: =SUM(R1C[-1]:RC1) -> 5785101
A3402: =R[-1]C+1 -> 3402 | B3402: =SUM(R1C[-1]:RC1) -> 5788503
A3403: =R[-1]C+1 -> 3403 | B3403: =SUM(R1C[-1]:RC1) -> 5791906
A3404: =R[-1]C+1 -> 3404 | B3404: =SUM(R1C[-1]:RC1) -> 5795310
A3405: =R[-1]C+1 -> 3405 | B3405: =SUM(R1C[-1]:RC1) -> 5798715
A3406: =R[-1]C+1 -> 3406 | B3406: =SUM(R1C[-1]:RC1) -> 5802121
A3407: =R[-1]C+1 -> 3407 | B3407: =SUM(R1C[-1]:RC1) -> 5805528
A3408: =R[-1]C+1 -> 3408 | B3408: =SUM(R1C[-1]:RC1) -> 5808936
A3409: =R[-1]C+1 -> 3409 | B3409: =SUM(R1C[-1]:RC1) -> 5812345
A3410: =R[-1]C+1 -> 3410 | B3410: =SUM(R1C[-1]:RC1) -> 5815755
A3411: =R[-1]C+1 -> 3411 | B3411: =SUM(R1C[-1]:RC1) -> 5819166
A3412: =R[-1]C+1 -> 3412 | B3412: =SUM(R1C[-1]:RC1) -> 5822578
A3413: =R[-1]C+1 -> 3413 | B3413: =SUM(R1C[-1]:RC1) -> 5825991
A3414: =R[-1]C+1 -> 3414 | B3414: =SUM(R1C[-1]:RC1) -> 5829405
A3415: =R[-1]C+1 -> 3415 | B3415: =SUM(R1C[-1]:RC1) -> 5832820
A3416: =R[-1]C+1 -> 3416 | B3416: =SUM(R1C[-1]:RC1) -> 5836236
A3417: =R[-1]C+1 -> 3417 | B3417: =SUM(R1C[-1]:RC1) -> 5839653
A3418: =R[-1]C+1 -> 3418 | B3418: =SUM(R1C[-1]:RC1) -> 5843071
A3419: =R[-1]C+1 -> 3419 | B3419: =SUM(R1C[-1]:RC1) -> 5846490
A3420: =R[-1]C+1 -> 3420 | B3420: =SUM(R1C[-1]:RC1) -> 5849910
A3421: =R[-1]C+1 -> 3421 | B3421: =SUM(R1C[-1]:RC1) -> 5853331
A3422: =R[-1]C+1 -> 3422 | B3422: =SUM(R1C[-1]:RC1) -> 5856753
A3423: =R[-1]C+1 -> 3423 | B3423: =SUM(R1C[-1]:RC1) -> 5860176
A3424: =R[-1]C+1 -> 3424 | B3424: =SUM(R1C[-1]:RC1) -> 5863600
A3425: =R[-1]C+1 -> 3425 | B3425: =SUM(R1C[-1]:RC1) -> 5867025
A3426: =R[-1]C+1 -> 3426 | B3426: =SUM(R1C[-1]:RC1) -> 5870451
A3427: =R[-1]C+1 -> 3427 | B3427: =SUM(R1C[-1]:RC1) -> 5873878
A3428: =R[-1]C+1 -> 3428 | B3428: =SUM(R1C[-1]:RC1) -> 5877306
A3429: =R[-1]C+1 -> 3429 | B3429: =SUM(R1C[-1]:RC1) -> 5880735
A3430: =R[-1]C+1 -> 3430 | B3430: =SUM(R1C[-1]:RC1) -> 5884165
A3431: =R[-1]C+1 -> 3431 | B3431: =SUM(R1C[-1]:RC1) -> 5887596
A3432: =R[-1]C+1 -> 3432 | B3432: =SUM(R1C[-1]:RC1) -> 5891028
A3433: =R[-1]C+1 -> 3433 | B3433: =SUM(R1C[-1]:RC1) -> 5894461
A3434: =R[-1]C+1 -> 3434 | B3434: =SUM(R1C[-1]:RC1) -> 5897895
A3435: =R[-1]C+1 -> 3435 | B3435: =SUM(R1C[-1]:RC1) -> 5901330
A3436: =R[-1]C+1 -> 3436 | B3436: =SUM(R1C[-1]:RC1) -> 5904766
A3437: =R[-1]C+1 -> 3437 | B3437: =SUM(R1C[-1]:RC1) -> 5908203
A3438: =R[-1]C+1 -> 3438 | B3438: =SUM(R1C[-1]:RC1) -> 5911641
A3439: =R[-1]C+1 -> 3439 | B3439: =SUM(R1C[-1]:RC1) -> 5915080
A3440: =R[-1]C+1 -> 3440 | B3440: =SUM(R1C[-1]:RC1) -> 5918520
A3441: =R[-1]C+1 -> 3441 | B3441: =SUM(R1C[-1]:RC1) -> 5921961
A3442: =R[-1]C+1 -> 3442 | B3442: =SUM(R1C[-1]:RC1) -> 5925403
A3443: =R[-1]C+1 -> 3443 | B3443: =SUM(R1C[-1]:RC1) -> 5928846
A3444: =R[-1]C+1 -> 3444 | B3444: =SUM(R1C[-1]:RC1) -> 5932290
A3445: =R[-1]C+1 -> 3445 | B3445: =SUM(R1C[-1]:RC1) -> 5935735
A3446: =R[-1]C+1 -> 3446 | B3446: =SUM(R1C[-1]:RC1) -> 5939181
A3447: =R[-1]C+1 -> 3447 | B3447: =SUM(R1C[-1]:RC1) -> 5942628
A3448: =R[-1]C+1 -> 3448 | B3448: =SUM(R1C[-1]:RC1) -> 5946076
A3449: =R[-1]C+1 -> 3449 | B3449: =SUM(R1C[-1]:RC1) -> 5949525
A3450: =R[-1]C+1 -> 3450 | B3450: =SUM(R1C[-1]:RC1) -> 5952975
A3451: =R[-1]C+1 -> 3451 | B3451: =SUM(R1C[-1]:RC1) -> 5956426
A3452: =R[-1]C+1 -> 3452 | B3452: =SUM(R1C[-1]:RC1) -> 5959878
A3453: =R[-1]C+1 -> 3453 | B3453: =SUM(R1C[-1]:RC1) -> 5963331
A3454: =R[-1]C+1 -> 3454 | B3454: =SUM(R1C[-1]:RC1) -> 5966785
A3455: =R[-1]C+1 -> 3455 | B3455: =SUM(R1C[-1]:RC1) -> 5970240
A3456: =R[-1]C+1 -> 3456 | B3456: =SUM(R1C[-1]:RC1) -> 5973696
A3457: =R[-1]C+1 -> 3457 | B3457: =SUM(R1C[-1]:RC1) -> 5977153
A3458: =R[-1]C+1 -> 3458 | B3458: =SUM(R1C[-1]:RC1) -> 5980611
A3459: =R[-1]C+1 -> 3459 | B3459: =SUM(R1C[-1]:RC1) -> 5984070
A3460: =R[-1]C+1 -> 3460 | B3460: =SUM(R1C[-1]:RC1) -> 5987530
A3461: =R[-1]C+1 -> 3461 | B3461: =SUM(R1C[-1]:RC1) -> 5990991
A3462: =R[-1]C+1 -> 3462 | B3462: =SUM(R1C[-1]:RC1) -> 5994453
A3463: =R[-1]C+1 -> 3463 | B3463: =SUM(R1C[-1]:RC1) -> 5997916
A3464: =R[-1]C+1 -> 3464 | B3464: =SUM(R1C[-1]:RC1) -> 6001380
A3465: =R[-1]C+1 -> 3465 | B3465: =SUM(R1C[-1]:RC1) -> 6004845
A3466: =R[-1]C+1 -> 3466 | B3466: =SUM(R1C[-1]:RC1) -> 6008311
A3467: =R[-1]C+1 -> 3467 | B3467: =SUM(R1C[-1]:RC1) -> 6011778
A3468: =R[-1]C+1 -> 3468 | B3468: =SUM(R1C[-1]:RC1) -> 6015246
A3469: =R[-1]C+1 -> 3469 | B3469: =SUM(R1C[-1]:RC1) -> 6018715
A3470: =R[-1]C+1 -> 3470 | B3470: =SUM(R1C[-1]:RC1) -> 6022185
A3471: =R[-1]C+1 -> 3471 | B3471: =SUM(R1C[-1]:RC1) -> 6025656
A3472: =R[-1]C+1 -> 3472 | B3472: =SUM(R1C[-1]:RC1) -> 6029128
A3473: =R[-1]C+1 -> 3473 | B3473: =SUM(R1C[-1]:RC1) -> 6032601
A3474: =R[-1]C+1 -> 3474 | B3474: =SUM(R1C[-1]:RC1) -> 6036075
A3475: =R[-1]C+1 -> 3475 | B3475: =SUM(R1C[-1]:RC1) -> 6039550
A3476: =R[-1]C+1 -> 3476 | B3476: =SUM(R1C[-1]:RC1) -> 6043026
A3477: =R[-1]C+1 -> 3477 | B3477: =SUM(R1C[-1]:RC1) -> 6046503
A3478: =R[-1]C+1 -> 3478 | B3478: =SUM(R1C[-1]:RC1) -> 6049981
A3479: =R[-1]C+1 -> 3479 | B3479: =SUM(R1C[-1]:RC1) -> 6053460
A3480: =R[-1]C+1 -> 3480 | B3480: =SUM(R1C[-1]:RC1) -> 6056940
A3481: =R[-1]C+1 -> 3481 | B3481: =SUM(R1C[-1]:RC1) -> 6060421
A3482: =R[-1]C+1 -> 3482 | B3482: =SUM(R1C[-1]:RC1) -> 6063903
A3483: =R[-1]C+1 -> 3483 | B3483: =SUM(R1C[-1]:RC1) -> 6067386
A3484: =R[-1]C+1 -> 3484 | B3484: =SUM(R1C[-1]:RC1) -> 6070870
A3485: =R[-1]C+1 -> 3485 | B3485: =SUM(R1C[-1]:RC1) -> 6074355
A3486: =R[-1]C+1 -> 3486 | B3486: =SUM(R1C[-1]:RC1) -> 6077841
A3487: =R[-1]C+1 -> 3487 | B3487: =SUM(R1C[-1]:RC1) -> 6081328
A3488: =R[-1]C+1 -> 3488 | B3488: =SUM(R1C[-1]:RC1) -> 6084816
A3489: =R[-1]C+1 -> 3489 | B3489: =SUM(R1C[-1]:RC1) -> 6088305
A3490: =R[-1]C+1 -> 3490 | B3490: =SUM(R1C[-1]:RC1) -> 6091795
A3491: =R[-1]C+1 -> 3491 | B3491: =SUM(R1C[-1]:RC1) -> 6095286
A3492: =R[-1]C+1 -> 3492 | B3492: =SUM(R1C[-1]:RC1) -> 6098778
A3493: =R[-1]C+1 -> 3493 | B3493: =SUM(R1C[-1]:RC1) -> 6102271
A3494: =R[-1]C+1 -> 3494 | B3494: =SUM(R1C[-1]:RC1) -> 6105765
A3495: =R[-1]C+1 -> 3495 | B3495: =SUM(R1C[-1]:RC1) -> 6109260
A3496: =R[-1]C+1 -> 3496 | B3496: =SUM(R1C[-1]:RC1) -> 6112756
A3497: =R[-1]C+1 -> 3497 | B3497: =SUM(R1C[-1]:RC1) -> 6116253
A3498: =R[-1]C+1 -> 3498 | B3498: =SUM(R1C[-1]:RC1) -> 6119751
A3499: =R[-1]C+1 -> 3499 | B3499: =SUM(R1C[-1]:RC1) -> 6123250
A3500: =R[-1]C+1 -> 3500 | B3500: =SUM(R1C[-1]:RC1) -> 6126750
A3501: =R[-1]C+1 -> 3501 | B3501: =SUM(R1C[-1]:RC1) -> 6130251
A3502: =R[-1]C+1 -> 3502 | B3502: =SUM(R1C[-1]:RC1) -> 6133753
A3503: =R[-1]C+1 -> 3503 | B3503: =SUM(R1C[-1]:RC1) -> 6137256
A3504: =R[-1]C+1 -> 3504 | B3504: =SUM(R1C[-1]:RC1) -> 6140760
A3505: =R[-1]C+1 -> 3505 | B3505: =SUM(R1C[-1]:RC1) -> 6144265
A3506: =R[-1]C+1 -> 3506 | B3506: =SUM(R1C[-1]:RC1) -> 6147771
A3507: =R[-1]C+1 -> 3507 | B3507: =SUM(R1C[-1]:RC1) -> 6151278
A3508: =R[-1]C+1 -> 3508 | B3508: =SUM(R1C[-1]:RC1) -> 6154786
A3509: =R[-1]C+1 -> 3509 | B3509: =SUM(R1C[-1]:RC1) -> 6158295
A3510: =R[-1]C+1 -> 3510 | B3510: =SUM(R1C[-1]:RC1) -> 6161805
A3511: =R[-1]C+1 -> 3511 | B3511: =SUM(R1C[-1]:RC1) -> 6165316
A3512: =R[-1]C+1 -> 3512 | B3512: =SUM(R1C[-1]:RC1) -> 6168828
A3513: =R[-1]C+1 -> 3513 | B3513: =SUM(R1C[-1]:RC1) -> 6172341
A3514: =R[-1]C+1 -> 3514 | B3514: =SUM(R1C[-1]:RC1) -> 6175855
A3515: =R[-1]C+1 -> 3515 | B3515: =SUM(R1C[-1]:RC1) -> 6179370
A3516: =R[-1]C+1 -> 3516 | B3516: =SUM(R1C[-1]:RC1) -> 6182886
A3517: =R[-1]C+1 -> 3517 | B3517: =SUM(R1C[-1]:RC1) -> 6186403
A3518: =R[-1]C+1 -> 3518 | B3518: =SUM(R1C[-1]:RC1) -> 6189921
A3519: =R[-1]C+1 -> 3519 | B3519: =SUM(R1C[-1]:RC1) -> 6193440
A3520: =R[-1]C+1 -> 3520 | B3520: =SUM(R1C[-1]:RC1) -> 6196960
A3521: =R[-1]C+1 -> 3521 | B3521: =SUM(R1C[-1]:RC1) -> 6200481
A3522: =R[-1]C+1 -> 3522 | B3522: =SUM(R1C[-1]:RC1) -> 6204003
A3523: =R[-1]C+1 -> 3523 | B3523: =SUM(R1C[-1]:RC1) -> 6207526
A3524: =R[-1]C+1 -> 3524 | B3524: =SUM(R1C[-1]:RC1) -> 6211050
A3525: =R[-1]C+1 -> 3525 | B3525: =SUM(R1C[-1]:RC1) -> 6214575
A3526: =R[-1]C+1 -> 3526 | B3526: =SUM(R1C[-1]:RC1) -> 6218101
A3527: =R[-1]C+1 -> 3527 | B3527: =SUM(R1C[-1]:RC1) -> 6221628
A3528: =R[-1]C+1 -> 3528 | B3528: =SUM(R1C[-1]:RC1) -> 6225156
A3529: =R[-1]C+1 -> 3529 | B3529: =SUM(R1C[-1]:RC1) -> 6228685
A3530: =R[-1]C+1 -> 3530 | B3530: =SUM(R1C[-1]:RC1) -> 6232215
A3531: =R[-1]C+1 -> 3531 | B3531: =SUM(R1C[-1]:RC1) -> 6235746
A3532: =R[-1]C+1 -> 3532 | B3532: =SUM(R1C[-1]:RC1) -> 6239278
A3533: =R[-1]C+1 -> 3533 | B3533: =SUM(R1C[-1]:RC1) -> 6242811
A3534: =R[-1]C+1 -> 3534 | B3534: =SUM(R1C[-1]:RC1) -> 6246345
A3535: =R[-1]C+1 -> 3535 | B3535: =SUM(R1C[-1]:RC1) -> 6249880
A3536: =R[-1]C+1 -> 3536 | B3536: =SUM(R1C[-1]:RC1) -> 6253416
A3537: =R[-1]C+1 -> 3537 | B3537: =SUM(R1C[-1]:RC1) -> 6256953
A3538: =R[-1]C+1 -> 3538 | B3538: =SUM(R1C[-1]:RC1) -> 6260491
A3539: =R[-1]C+1 -> 3539 | B3539: =SUM(R1C[-1]:RC1) -> 6264030
A3540: =R[-1]C+1 -> 3540 | B3540: =SUM(R1C[-1]:RC1) -> 6267570
A3541: =R[-1]C+1 -> 3541 | B3541: =SUM(R1C[-1]:RC1) -> 6271111
A3542: =R[-1]C+1 -> 3542 | B3542: =SUM(R1C[-1]:RC1) -> 6274653
A3543: =R[-1]C+1 -> 3543 | B3543: =SUM(R1C[-1]:RC1) -> 6278196
A3544: =R[-1]C+1 -> 3544 | B3544: =SUM(R1C[-1]:RC1) -> 6281740
A3545: =R[-1]C+1 -> 3545 | B3545: =SUM(R1C[-1]:RC1) -> 6285285
A3546: =R[-1]C+1 -> 3546 | B3546: =SUM(R1C[-1]:RC1) -> 6288831
A3547: =R[-1]C+1 -> 3547 | B3547: =SUM(R1C[-1]:RC1) -> 6292378
A3548: =R[-1]C+1 -> 3548 | B3548: =SUM(R1C[-1]:RC1) -> 6295926
A3549: =R[-1]C+1 -> 3549 | B3549: =SUM(R1C[-1]:RC1) -> 6299475
A3550: =R[-1]C+1 -> 3550 | B3550: =SUM(R1C[-1]:RC1) -> 6303025
A3551: =R[-1]C+1 -> 3551 | B3551: =SUM(R1C[-1]:RC1) -> 6306576
A3552: =R[-1]C+1 -> 3552 | B3552: =SUM(R1C[-1]:RC1) -> 6310128
A3553: =R[-1]C+1 -> 3553 | B3553: =SUM(R1C[-1]:RC1) -> 6313681
A3554: =R[-1]C+1 -> 3554 | B3554: =SUM(R1C[-1]:RC1) -> 6317235
A3555: =R[-1]C+1 -> 3555 | B3555: =SUM(R1C[-1]:RC1) -> 6320790
A3556: =R[-1]C+1 -> 3556 | B3556: =SUM(R1C[-1]:RC1) -> 6324346
A3557: =R[-1]C+1 -> 3557 | B3557: =SUM(R1C[-1]:RC1) -> 6327903
A3558: =R[-1]C+1 -> 3558 | B3558: =SUM(R1C[-1]:RC1) -> 6331461
A3559: =R[-1]C+1 -> 3559 | B3559: =SUM(R1C[-1]:RC1) -> 6335020
A3560: =R[-1]C+1 -> 3560 | B3560: =SUM(R1C[-1]:RC1) -> 6338580
A3561: =R[-1]C+1 -> 3561 | B3561: =SUM(R1C[-1]:RC1) -> 6342141
A3562: =R[-1]C+1 -> 3562 | B3562: =SUM(R1C[-1]:RC1) -> 6345703
A3563: =R[-1]C+1 -> 3563 | B3563: =SUM(R1C[-1]:RC1) -> 6349266
A3564: =R[-1]C+1 -> 3564 | B3564: =SUM(R1C[-1]:RC1) -> 6352830
A3565: =R[-1]C+1 -> 3565 | B3565: =SUM(R1C[-1]:RC1) -> 6356395
A3566: =R[-1]C+1 -> 3566 | B3566: =SUM(R1C[-1]:RC1) -> 6359961
A3567: =R[-1]C+1 -> 3567 | B3567: =SUM(R1C[-1]:RC1) -> 6363528
A3568: =R[-1]C+1 -> 3568 | B3568: =SUM(R1C[-1]:RC1) -> 6367096
A3569: =R[-1]C+1 -> 3569 | B3569: =SUM(R1C[-1]:RC1) -> 6370665
A3570: =R[-1]C+1 -> 3570 | B3570: =SUM(R1C[-1]:RC1) -> 6374235
A3571: =R[-1]C+1 -> 3571 | B3571: =SUM(R1C[-1]:RC1) -> 6377806
A3572: =R[-1]C+1 -> 3572 | B3572: =SUM(R1C[-1]:RC1) -> 6381378
A3573: =R[-1]C+1 -> 3573 | B3573: =SUM(R1C[-1]:RC1) -> 6384951
A3574: =R[-1]C+1 -> 3574 | B3574: =SUM(R1C[-1]:RC1) -> 6388525
A3575: =R[-1]C+1 -> 3575 | B3575: =SUM(R1C[-1]:RC1) -> 6392100
A3576: =R[-1]C+1 -> 3576 | B3576: =SUM(R1C[-1]:RC1) -> 6395676
A3577: =R[-1]C+1 -> 3577 | B3577: =SUM(R1C[-1]:RC1) -> 6399253
A3578: =R[-1]C+1 -> 3578 | B3578: =SUM(R1C[-1]:RC1) -> 6402831
A3579: =R[-1]C+1 -> 3579 | B3579: =SUM(R1C[-1]:RC1) -> 6406410
A3580: =R[-1]C+1 -> 3580 | B3580: =SUM(R1C[-1]:RC1) -> 6409990
A3581: =R[-1]C+1 -> 3581 | B3581: =SUM(R1C[-1]:RC1) -> 6413571
A3582: =R[-1]C+1 -> 3582 | B3582: =SUM(R1C[-1]:RC1) -> 6417153
A3583: =R[-1]C+1 -> 3583 | B3583: =SUM(R1C[-1]:RC1) -> 6420736
A3584: =R[-1]C+1 -> 3584 | B3584: =SUM(R1C[-1]:RC1) -> 6424320
A3585: =R[-1]C+1 -> 3585 | B3585: =SUM(R1C[-1]:RC1) -> 6427905
A3586: =R[-1]C+1 -> 3586 | B3586: =SUM(R1C[-1]:RC1) -> 6431491
A3587: =R[-1]C+1 -> 3587 | B3587: =SUM(R1C[-1]:RC1) -> 6435078
A3588: =R[-1]C+1 -> 3588 | B3588: =SUM(R1C[-1]:RC1) -> 6438666
A3589: =R[-1]C+1 -> 3589 | B3589: =SUM(R1C[-1]:RC1) -> 6442255
A3590: =R[-1]C+1 -> 3590 | B3590: =SUM(R1C[-1]:RC1) -> 6445845
A3591: =R[-1]C+1 -> 3591 | B3591: =SUM(R1C[-1]:RC1) -> 6449436
A3592: =R[-1]C+1 -> 3592 | B3592: =SUM(R1C[-1]:RC1) -> 6453028
A3593: =R[-1]C+1 -> 3593 | B3593: =SUM(R1C[-1]:RC1) -> 6456621
A3594: =R[-1]C+1 -> 3594 | B3594: =SUM(R1C[-1]:RC1) -> 6460215
A3595: =R[-1]C+1 -> 3595 | B3595: =SUM(R1C[-1]:RC1) -> 6463810
A3596: =R[-1]C+1 -> 3596 | B3596: =SUM(R1C[-1]:RC1) -> 6467406
A3597: =R[-1]C+1 -> 3597 | B3597: =SUM(R1C[-1]:RC1) -> 6471003
A3598: =R[-1]C+1 -> 3598 | B3598: =SUM(R1C[-1]:RC1) -> 6474601
A3599: =R[-1]C+1 -> 3599 | B3599: =SUM(R1C[-1]:RC1) -> 6478200
A3600: =R[-1]C+1 -> 3600 | B3600: =SUM(R1C[-1]:RC1) -> 6481800
A3601: =R[-1]C+1 -> 3601 | B3601: =SUM(R1C[-1]:RC1) -> 6485401
A3602: =R[-1]C+1 -> 3602 | B3602: =SUM(R1C[-1]:RC1) -> 6489003
A3603: =R[-1]C+1 -> 3603 | B3603: =SUM(R1C[-1]:RC1) -> 6492606
A3604: =R[-1]C+1 -> 3604 | B3604: =SUM(R1C[-1]:RC1) -> 6496210
A3605: =R[-1]C+1 -> 3605 | B3605: =SUM(R1C[-1]:RC1) -> 6499815
A3606: =R[-1]C+1 -> 3606 | B3606: =SUM(R1C[-1]:RC1) -> 6503421
A3607: =R[-1]C+1 -> 3607 | B3607: =SUM(R1C[-1]:RC1) -> 6507028
A3608: =R[-1]C+1 -> 3608 | B3608: =SUM(R1C[-1]:RC1) -> 6510636
A3609: =R[-1]C+1 -> 3609 | B3609: =SUM(R1C[-1]:RC1) -> 6514245
A3610: =R[-1]C+1 -> 3610 | B3610: =SUM(R1C[-1]:RC1) -> 6517855
A3611: =R[-1]C+1 -> 3611 | B3611: =SUM(R1C[-1]:RC1) -> 6521466
A3612: =R[-1]C+1 -> 3612 | B3612: =SUM(R1C[-1]:RC1) -> 6525078
A3613: =R[-1]C+1 -> 3613 | B3613: =SUM(R1C[-1]:RC1) -> 6528691
A3614: =R[-1]C+1 -> 3614 | B3614: =SUM(R1C[-1]:RC1) -> 6532305
A3615: =R[-1]C+1 -> 3615 | B3615: =SUM(R1C[-1]:RC1) -> 6535920
A3616: =R[-1]C+1 -> 3616 | B3616: =SUM(R1C[-1]:RC1) -> 6539536
A3617: =R[-1]C+1 -> 3617 | B3617: =SUM(R1C[-1]:RC1) -> 6543153
A3618: =R[-1]C+1 -> 3618 | B3618: =SUM(R1C[-1]:RC1) -> 6546771
A3619: =R[-1]C+1 -> 3619 | B3619: =SUM(R1C[-1]:RC1) -> 6550390
A3620: =R[-1]C+1 -> 3620 | B3620: =SUM(R1C[-1]:RC1) -> 6554010
A3621: =R[-1]C+1 -> 3621 | B3621: =SUM(R1C[-1]:RC1) -> 6557631
A3622: =R[-1]C+1 -> 3622 | B3622: =SUM(R1C[-1]:RC1) -> 6561253
A3623: =R[-1]C+1 -> 3623 | B3623: =SUM(R1C[-1]:RC1) -> 6564876
A3624: =R[-1]C+1 -> 3624 | B3624: =SUM(R1C[-1]:RC1) -> 6568500
A3625: =R[-1]C+1 -> 3625 | B3625: =SUM(R1C[-1]:RC1) -> 6572125
A3626: =R[-1]C+1 -> 3626 | B3626: =SUM(R1C[-1]:RC1) -> 6575751
A3627: =R[-1]C+1 -> 3627 | B3627: =SUM(R1C[-1]:RC1) -> 6579378
A3628: =R[-1]C+1 -> 3628 | B3628: =SUM(R1C[-1]:RC1) -> 6583006
A3629: =R[-1]C+1 -> 3629 | B3629: =SUM(R1C[-1]:RC1) -> 6586635
A3630: =R[-1]C+1 -> 3630 | B3630: =SUM(R1C[-1]:RC1) -> 6590265
A3631: =R[-1]C+1 -> 3631 | B3631: =SUM(R1C[-1]:RC1) -> 6593896
A3632: =R[-1]C+1 -> 3632 | B3632: =SUM(R1C[-1]:RC1) -> 6597528
A3633: =R[-1]C+1 -> 3633 | B3633: =SUM(R1C[-1]:RC1) -> 6601161
A3634: =R[-1]C+1 -> 3634 | B3634: =SUM(R1C[-1]:RC1) -> 6604795
A3635: =R[-1]C+1 -> 3635 | B3635: =SUM(R1C[-1]:RC1) -> 6608430
A3636: =R[-1]C+1 -> 3636 | B3636: =SUM(R1C[-1]:RC1) -> 6612066
A3637: =R[-1]C+1 -> 3637 | B3637: =SUM(R1C[-1]:RC1) -> 6615703
A3638: =R[-1]C+1 -> 3638 | B3638: =SUM(R1C[-1]:RC1) -> 6619341
A3639: =R[-1]C+1 -> 3639 | B3639: =SUM(R1C[-1]:RC1) -> 6622980
A3640: =R[-1]C+1 -> 3640 | B3640: =SUM(R1C[-1]:RC1) -> 6626620
A3641: =R[-1]C+1 -> 3641 | B3641: =SUM(R1C[-1]:RC1) -> 6630261
A3642: =R[-1]C+1 -> 3642 | B3642: =SUM(R1C[-1]:RC1) -> 6633903
A3643: =R[-1]C+1 -> 3643 | B3643: =SUM(R1C[-1]:RC1) -> 6637546
A3644: =R[-1]C+1 -> 3644 | B3644: =SUM(R1C[-1]:RC1) -> 6641190
A3645: =R[-1]C+1 -> 3645 | B3645: =SUM(R1C[-1]:RC1) -> 6644835
A3646: =R[-1]C+1 -> 3646 | B3646: =SUM(R1C[-1]:RC1) -> 6648481
A3647: =R[-1]C+1 -> 3647 | B3647: =SUM(R1C[-1]:RC1) -> 6652128
A3648: =R[-1]C+1 -> 3648 | B3648: =SUM(R1C[-1]:RC1) -> 6655776
A3649: =R[-1]C+1 -> 3649 | B3649: =SUM(R1C[-1]:RC1) -> 6659425
A3650: =R[-1]C+1 -> 3650 | B3650: =SUM(R1C[-1]:RC1) -> 6663075
A3651: =R[-1]C+1 -> 3651 | B3651: =SUM(R1C[-1]:RC1) -> 6666726
A3652: =R[-1]C+1 -> 3652 | B3652: =SUM(R1C[-1]:RC1) -> 6670378
A3653: =R[-1]C+1 -> 3653 | B3653: =SUM(R1C[-1]:RC1) -> 6674031
A3654: =R[-1]C+1 -> 3654 | B3654: =SUM(R1C[-1]:RC1) -> 6677685
A3655: =R[-1]C+1 -> 3655 | B3655: =SUM(R1C[-1]:RC1) -> 6681340
A3656: =R[-1]C+1 -> 3656 | B3656: =SUM(R1C[-1]:RC1) -> 6684996
A3657: =R[-1]C+1 -> 3657 | B3657: =SUM(R1C[-1]:RC1) -> 6688653
A3658: =R[-1]C+1 -> 3658 | B3658: =SUM(R1C[-1]:RC1) -> 6692311
A3659: =R[-1]C+1 -> 3659 | B3659: =SUM(R1C[-1]:RC1) -> 6695970
A3660: =R[-1]C+1 -> 3660 | B3660: =SUM(R1C[-1]:RC1) -> 6699630
A3661: =R[-1]C+1 -> 3661 | B3661: =SUM(R1C[-1]:RC1) -> 6703291
A3662: =R[-1]C+1 -> 3662 | B3662: =SUM(R1C[-1]:RC1) -> 6706953
A3663: =R[-1]C+1 -> 3663 | B3663: =SUM(R1C[-1]:RC1) -> 6710616
A3664: =R[-1]C+1 -> 3664 | B3664: =SUM(R1C[-1]:RC1) -> 6714280
A3665: =R[-1]C+1 -> 3665 | B3665: =SUM(R1C[-1]:RC1) -> 6717945
A3666: =R[-1]C+1 -> 3666 | B3666: =SUM(R1C[-1]:RC1) -> 6721611
A3667: =R[-1]C+1 -> 3667 | B3667: =SUM(R1C[-1]:RC1) -> 6725278
A3668: =R[-1]C+1 -> 3668 | B3668: =SUM(R1C[-1]:RC1) -> 6728946
A3669: =R[-1]C+1 -> 3669 | B3669: =SUM(R1C[-1]:RC1) -> 6732615
A3670: =R[-1]C+1 -> 3670 | B3670: =SUM(R1C[-1]:RC1) -> 6736285
A3671: =R[-1]C+1 -> 3671 | B3671: =SUM(R1C[-1]:RC1) -> 6739956
A3672: =R[-1]C+1 -> 3672 | B3672: =SUM(R1C[-1]:RC1) -> 6743628
A3673: =R[-1]C+1 -> 3673 | B3673: =SUM(R1C[-1]:RC1) -> 6747301
A3674: =R[-1]C+1 -> 3674 | B3674: =SUM(R1C[-1]:RC1) -> 6750975
A3675: =R[-1]C+1 -> 3675 | B3675: =SUM(R1C[-1]:RC1) -> 6754650
A3676: =R[-1]C+1 -> 3676 | B3676: =SUM(R1C[-1]:RC1) -> 6758326
A3677: =R[-1]C+1 -> 3677 | B3677: =SUM(R1C[-1]:RC1) -> 6762003
A3678: =R[-1]C+1 -> 3678 | B3678: =SUM(R1C[-1]:RC1) -> 6765681
A3679: =R[-1]C+1 -> 3679 | B3679: =SUM(R1C[-1]:RC1) -> 6769360
A3680: =R[-1]C+1 -> 3680 | B3680: =SUM(R1C[-1]:RC1) -> 6773040
A3681: =R[-1]C+1 -> 3681 | B3681: =SUM(R1C[-1]:RC1) -> 6776721
A3682: =R[-1]C+1 -> 3682 | B3682: =SUM(R1C[-1]:RC1) -> 6780403
A3683: =R[-1]C+1 -> 3683 | B3683: =SUM(R1C[-1]:RC1) -> 6784086
A3684: =R[-1]C+1 -> 3684 | B3684: =SUM(R1C[-1]:RC1) -> 6787770
A3685: =R[-1]C+1 -> 3685 | B3685: =SUM(R1C[-1]:RC1) -> 6791455
A3686: =R[-1]C+1 -> 3686 | B3686: =SUM(R1C[-1]:RC1) -> 6795141
A3687: =R[-1]C+1 -> 3687 | B3687: =SUM(R1C[-1]:RC1) -> 6798828
A3688: =R[-1]C+1 -> 3688 | B3688: =SUM(R1C[-1]:RC1) -> 6802516
A3689: =R[-1]C+1 -> 3689 | B3689: =SUM(R1C[-1]:RC1) -> 6806205
A3690: =R[-1]C+1 -> 3690 | B3690: =SUM(R1C[-1]:RC1) -> 6809895
A3691: =R[-1]C+1 -> 3691 | B3691: =SUM(R1C[-1]:RC1) -> 6813586
A3692: =R[-1]C+1 -> 3692 | B3692: =SUM(R1C[-1]:RC1) -> 6817278
A3693: =R[-1]C+1 -> 3693 | B3693: =SUM(R1C[-1]:RC1) -> 6820971
A3694: =R[-1]C+1 -> 3694 | B3694: =SUM(R1C[-1]:RC1) -> 6824665
A3695: =R[-1]C+1 -> 3695 | B3695: =SUM(R1C[-1]:RC1) -> 6828360
A3696: =R[-1]C+1 -> 3696 | B3696: =SUM(R1C[-1]:RC1) -> 6832056
A3697: =R[-1]C+1 -> 3697 | B3697: =SUM(R1C[-1]:RC1) -> 6835753
A3698: =R[-1]C+1 -> 3698 | B3698: =SUM(R1C[-1]:RC1) -> 6839451
A3699: =R[-1]C+1 -> 3699 | B3699: =SUM(R1C[-1]:RC1) -> 6843150
A3700: =R[-1]C+1 -> 3700 | B3700: =SUM(R1C[-1]:RC1) -> 6846850
A3701: =R[-1]C+1 -> 3701 | B3701: =SUM(R1C[-1]:RC1) -> 6850551
A3702: =R[-1]C+1 -> 3702 | B3702: =SUM(R1C[-1]:RC1) -> 6854253
A3703: =R[-1]C+1 -> 3703 | B3703: =SUM(R1C[-1]:RC1) -> 6857956
A3704: =R[-1]C+1 -> 3704 | B3704: =SUM(R1C[-1]:RC1) -> 6861660
A3705: =R[-1]C+1 -> 3705 | B3705: =SUM(R1C[-1]:RC1) -> 6865365
A3706: =R[-1]C+1 -> 3706 | B3706: =SUM(R1C[-1]:RC1) -> 6869071
A3707: =R[-1]C+1 -> 3707 | B3707: =SUM(R1C[-1]:RC1) -> 6872778
A3708: =R[-1]C+1 -> 3708 | B3708: =SUM(R1C[-1]:RC1) -> 6876486
A3709: =R[-1]C+1 -> 3709 | B3709: =SUM(R1C[-1]:RC1) -> 6880195
A3710: =R[-1]C+1 -> 3710 | B3710: =SUM(R1C[-1]:RC1) -> 6883905
A3711: =R[-1]C+1 -> 3711 | B3711: =SUM(R1C[-1]:RC1) -> 6887616
A3712: =R[-1]C+1 -> 3712 | B3712: =SUM(R1C[-1]:RC1) -> 6891328
A3713: =R[-1]C+1 -> 3713 | B3713: =SUM(R1C[-1]:RC1) -> 6895041
A3714: =R[-1]C+1 -> 3714 | B3714: =SUM(R1C[-1]:RC1) -> 6898755
A3715: =R[-1]C+1 -> 3715 | B3715: =SUM(R1C[-1]:RC1) -> 6902470
A3716: =R[-1]C+1 -> 3716 | B3716: =SUM(R1C[-1]:RC1) -> 6906186
A3717: =R[-1]C+1 -> 3717 | B3717: =SUM(R1C[-1]:RC1) -> 6909903
A3718: =R[-1]C+1 -> 3718 | B3718: =SUM(R1C[-1]:RC1) -> 6913621
A3719: =R[-1]C+1 -> 3719 | B3719: =SUM(R1C[-1]:RC1) -> 6917340
A3720: =R[-1]C+1 -> 3720 | B3720: =SUM(R1C[-1]:RC1) -> 6921060
A3721: =R[-1]C+1 -> 3721 | B3721: =SUM(R1C[-1]:RC1) -> 6924781
A3722: =R[-1]C+1 -> 3722 | B3722: =SUM(R1C[-1]:RC1) -> 6928503
A3723: =R[-1]C+1 -> 3723 | B3723: =SUM(R1C[-1]:RC1) -> 6932226
A3724: =R[-1]C+1 -> 3724 | B3724: =SUM(R1C[-1]:RC1) -> 6935950
A3725: =R[-1]C+1 -> 3725 | B3725: =SUM(R1C[-1]:RC1) -> 6939675
A3726: =R[-1]C+1 -> 3726 | B3726: =SUM(R1C[-1]:RC1) -> 6943401
A3727: =R[-1]C+1 -> 3727 | B3727: =SUM(R1C[-1]:RC1) -> 6947128
A3728: =R[-1]C+1 -> 3728 | B3728: =SUM(R1C[-1]:RC1) -> 6950856
A3729: =R[-1]C+1 -> 3729 | B3729: =SUM(R1C[-1]:RC1) -> 6954585
A3730: =R[-1]C+1 -> 3730 | B3730: =SUM(R1C[-1]:RC1) -> 6958315
A3731: =R[-1]C+1 -> 3731 | B3731: =SUM(R1C[-1]:RC1) -> 6962046
A3732: =R[-1]C+1 -> 3732 | B3732: =SUM(R1C[-1]:RC1) -> 6965778
A3733: =R[-1]C+1 -> 3733 | B3733: =SUM(R1C[-1]:RC1) -> 6969511
A3734: =R[-1]C+1 -> 3734 | B3734: =SUM(R1C[-1]:RC1) -> 6973245
A3735: =R[-1]C+1 -> 3735 | B3735: =SUM(R1C[-1]:RC1) -> 6976980
A3736: =R[-1]C+1 -> 3736 | B3736: =SUM(R1C[-1]:RC1) -> 6980716
A3737: =R[-1]C+1 -> 3737 | B3737: =SUM(R1C[-1]:RC1) -> 6984453
A3738: =R[-1]C+1 -> 3738 | B3738: =SUM(R1C[-1]:RC1) -> 6988191
A3739: =R[-1]C+1 -> 3739 | B3739: =SUM(R1C[-1]:RC1) -> 6991930
A3740: =R[-1]C+1 -> 3740 | B3740: =SUM(R1C[-1]:RC1) -> 6995670
A3741: =R[-1]C+1 -> 3741 | B3741: =SUM(R1C[-1]:RC1) -> 6999411
A3742: =R[-1]C+1 -> 3742 | B3742: =SUM(R1C[-1]:RC1) -> 7003153
A3743: =R[-1]C+1 -> 3743 | B3743: =SUM(R1C[-1]:RC1) -> 7006896
A3744: =R[-1]C+1 -> 3744 | B3744: =SUM(R1C[-1]:RC1) -> 7010640
A3745: =R[-1]C+1 -> 3745 | B3745: =SUM(R1C[-1]:RC1) -> 7014385
A3746: =R[-1]C+1 -> 3746 | B3746: =SUM(R1C[-1]:RC1) -> 7018131
A3747: =R[-1]C+1 -> 3747 | B3747: =SUM(R1C[-1]:RC1) -> 7021878
A3748: =R[-1]C+1 -> 3748 | B3748: =SUM(R1C[-1]:RC1) -> 7025626
A3749: =R[-1]C+1 -> 3749 | B3749: =SUM(R1C[-1]:RC1) -> 7029375
A3750: =R[-1]C+1 -> 3750 | B3750: =SUM(R1C[-1]:RC1) -> 7033125
A3751: =R[-1]C+1 -> 3751 | B3751: =SUM(R1C[-1]:RC1) -> 7036876
A3752: =R[-1]C+1 -> 3752 | B3752: =SUM(R1C[-1]:RC1) -> 7040628
A3753: =R[-1]C+1 -> 3753 | B3753: =SUM(R1C[-1]:RC1) -> 7044381
A3754: =R[-1]C+1 -> 3754 | B3754: =SUM(R1C[-1]:RC1) -> 7048135
A3755: =R[-1]C+1 -> 3755 | B3755: =SUM(R1C[-1]:RC1) -> 7051890
A3756: =R[-1]C+1 -> 3756 | B3756: =SUM(R1C[-1]:RC1) -> 7055646
A3757: =R[-1]C+1 -> 3757 | B3757: =SUM(R1C[-1]:RC1) -> 7059403
A3758: =R[-1]C+1 -> 3758 | B3758: =SUM(R1C[-1]:RC1) -> 7063161
A3759: =R[-1]C+1 -> 3759 | B3759: =SUM(R1C[-1]:RC1) -> 7066920
A3760: =R[-1]C+1 -> 3760 | B3760: =SUM(R1C[-1]:RC1) -> 7070680
A3761: =R[-1]C+1 -> 3761 | B3761: =SUM(R1C[-1]:RC1) -> 7074441
A3762: =R[-1]C+1 -> 3762 | B3762: =SUM(R1C[-1]:RC1) -> 7078203
A3763: =R[-1]C+1 -> 3763 | B3763: =SUM(R1C[-1]:RC1) -> 7081966
A3764: =R[-1]C+1 -> 3764 | B3764: =SUM(R1C[-1]:RC1) -> 7085730
A3765: =R[-1]C+1 -> 3765 | B3765: =SUM(R1C[-1]:RC1) -> 7089495
A3766: =R[-1]C+1 -> 3766 | B3766: =SUM(R1C[-1]:RC1) -> 7093261
A3767: =R[-1]C+1 -> 3767 | B3767: =SUM(R1C[-1]:RC1) -> 7097028
A3768: =R[-1]C+1 -> 3768 | B3768: =SUM(R1C[-1]:RC1) -> 7100796
A3769: =R[-1]C+1 -> 3769 | B3769: =SUM(R1C[-1]:RC1) -> 7104565
A3770: =R[-1]C+1 -> 3770 | B3770: =SUM(R1C[-1]:RC1) -> 7108335
A3771: =R[-1]C+1 -> 3771 | B3771: =SUM(R1C[-1]:RC1) -> 7112106
A3772: =R[-1]C+1 -> 3772 | B3772: =SUM(R1C[-1]:RC1) -> 7115878
A3773: =R[-1]C+1 -> 3773 | B3773: =SUM(R1C[-1]:RC1) -> 7119651
A3774: =R[-1]C+1 -> 3774 | B3774: =SUM(R1C[-1]:RC1) -> 7123425
A3775: =R[-1]C+1 -> 3775 | B3775: =SUM(R1C[-1]:RC1) -> 7127200
A3776: =R[-1]C+1 -> 3776 | B3776: =SUM(R1C[-1]:RC1) -> 7130976
A3777: =R[-1]C+1 -> 3777 | B3777: =SUM(R1C[-1]:RC1) -> 7134753
A3778: =R[-1]C+1 -> 3778 | B3778: =SUM(R1C[-1]:RC1) -> 7138531
A3779: =R[-1]C+1 -> 3779 | B3779: =SUM(R1C[-1]:RC1) -> 7142310
A3780: =R[-1]C+1 -> 3780 | B3780: =SUM(R1C[-1]:RC1) -> 7146090
A3781: =R[-1]C+1 -> 3781 | B3781: =SUM(R1C[-1]:RC1) -> 7149871
A3782: =R[-1]C+1 -> 3782 | B3782: =SUM(R1C[-1]:RC1) -> 7153653
A3783: =R[-1]C+1 -> 3783 | B3783: =SUM(R1C[-1]:RC1) -> 7157436
A3784: =R[-1]C+1 -> 3784 | B3784: =SUM(R1C[-1]:RC1) -> 7161220
A3785: =R[-1]C+1 -> 3785 | B3785: =SUM(R1C[-1]:RC1) -> 7165005
A3786: =R[-1]C+1 -> 3786 | B3786: =SUM(R1C[-1]:RC1) -> 7168791
A3787: =R[-1]C+1 -> 3787 | B3787: =SUM(R1C[-1]:RC1) -> 7172578
A3788: =R[-1]C+1 -> 3788 | B3788: =SUM(R1C[-1]:RC1) -> 7176366
A3789: =R[-1]C+1 -> 3789 | B3789: =SUM(R1C[-1]:RC1) -> 7180155
A3790: =R[-1]C+1 -> 3790 | B3790: =SUM(R1C[-1]:RC1) -> 7183945
A3791: =R[-1]C+1 -> 3791 | B3791: =SUM(R1C[-1]:RC1) -> 7187736
A3792: =R[-1]C+1 -> 3792 | B3792: =SUM(R1C[-1]:RC1) -> 7191528
A3793: =R[-1]C+1 -> 3793 | B3793: =SUM(R1C[-1]:RC1) -> 7195321
A3794: =R[-1]C+1 -> 3794 | B3794: =SUM(R1C[-1]:RC1) -> 7199115
A3795: =R[-1]C+1 -> 3795 | B3795: =SUM(R1C[-1]:RC1) -> 7202910
A3796: =R[-1]C+1 -> 3796 | B3796: =SUM(R1C[-1]:RC1) -> 7206706
A3797: =R[-1]C+1 -> 3797 | B3797: =SUM(R1C[-1]:RC1) -> 7210503
A3798: =R[-1]C+1 -> 3798 | B3798: =SUM(R1C[-1]:RC1) -> 7214301
A3799: =R[-1]C+1 -> 3799 | B3799: =SUM(R1C[-1]:RC1) -> 7218100
A3800: =R[-1]C+1 -> 3800 | B3800: =SUM(R1C[-1]:RC1) -> 7221900
A3801: =R[-1]C+1 -> 3801 | B3801: =SUM(R1C[-1]:RC1) -> 7225701
A3802: =R[-1]C+1 -> 3802 | B3802: =SUM(R1C[-1]:RC1) -> 7229503
A3803: =R[-1]C+1 -> 3803 | B3803: =SUM(R1C[-1]:RC1) -> 7233306
A3804: =R[-1]C+1 -> 3804 | B3804: =SUM(R1C[-1]:RC1) -> 7237110
A3805: =R[-1]C+1 -> 3805 | B3805: =SUM(R1C[-1]:RC1) -> 7240915
A3806: =R[-1]C+1 -> 3806 | B3806: =SUM(R1C[-1]:RC1) -> 7244721
A3807: =R[-1]C+1 -> 3807 | B3807: =SUM(R1C[-1]:RC1) -> 7248528
A3808: =R[-1]C+1 -> 3808 | B3808: =SUM(R1C[-1]:RC1) -> 7252336
A3809: =R[-1]C+1 -> 3809 | B3809: =SUM(R1C[-1]:RC1) -> 7256145
A3810: =R[-1]C+1 -> 3810 | B3810: =SUM(R1C[-1]:RC1) -> 7259955
A3811: =R[-1]C+1 -> 3811 | B3811: =SUM(R1C[-1]:RC1) -> 7263766
A3812: =R[-1]C+1 -> 3812 | B3812: =SUM(R1C[-1]:RC1) -> 7267578
A3813: =R[-1]C+1 -> 3813 | B3813: =SUM(R1C[-1]:RC1) -> 7271391
A3814: =R[-1]C+1 -> 3814 | B3814: =SUM(R1C[-1]:RC1) -> 7275205
A3815: =R[-1]C+1 -> 3815 | B3815: =SUM(R1C[-1]:RC1) -> 7279020
A3816: =R[-1]C+1 -> 3816 | B3816: =SUM(R1C[-1]:RC1) -> 7282836
A3817: =R[-1]C+1 -> 3817 | B3817: =SUM(R1C[-1]:RC1) -> 7286653
A3818: =R[-1]C+1 -> 3818 | B3818: =SUM(R1C[-1]:RC1) -> 7290471
A3819: =R[-1]C+1 -> 3819 | B3819: =SUM(R1C[-1]:RC1) -> 7294290
A3820: =R[-1]C+1 -> 3820 | B3820: =SUM(R1C[-1]:RC1) -> 7298110
A3821: =R[-1]C+1 -> 3821 | B3821: =SUM(R1C[-1]:RC1) -> 7301931
A3822: =R[-1]C+1 -> 3822 | B3822: =SUM(R1C[-1]:RC1) -> 7305753
A3823: =R[-1]C+1 -> 3823 | B3823: =SUM(R1C[-1]:RC1) -> 7309576
A3824: =R[-1]C+1 -> 3824 | B3824: =SUM(R1C[-1]:RC1) -> 7313400
A3825: =R[-1]C+1 -> 3825 | B3825: =SUM(R1C[-1]:RC1) -> 7317225
A3826: =R[-1]C+1 -> 3826 | B3826: =SUM(R1C[-1]:RC1) -> 7321051
A3827: =R[-1]C+1 -> 3827 | B3827: =SUM(R1C[-1]:RC1) -> 7324878
A3828: =R[-1]C+1 -> 3828 | B3828: =SUM(R1C[-1]:RC1) -> 7328706
A3829: =R[-1]C+1 -> 3829 | B3829: =SUM(R1C[-1]:RC1) -> 7332535
A3830: =R[-1]C+1 -> 3830 | B3830: =SUM(R1C[-1]:RC1) -> 7336365
A3831: =R[-1]C+1 -> 3831 | B3831: =SUM(R1C[-1]:RC1) -> 7340196
A3832: =R[-1]C+1 -> 3832 | B3832: =SUM(R1C[-1]:RC1) -> 7344028
A3833: =R[-1]C+1 -> 3833 | B3833: =SUM(R1C[-1]:RC1) -> 7347861
A3834: =R[-1]C+1 -> 3834 | B3834: =SUM(R1C[-1]:RC1) -> 7351695
A3835: =R[-1]C+1 -> 3835 | B3835: =SUM(R1C[-1]:RC1) -> 7355530
A3836: =R[-1]C+1 -> 3836 | B3836: =SUM(R1C[-1]:RC1) -> 7359366
A3837: =R[-1]C+1 -> 3837 | B3837: =SUM(R1C[-1]:RC1) -> 7363203
A3838: =R[-1]C+1 -> 3838 | B3838: =SUM(R1C[-1]:RC1) -> 7367041
A3839: =R[-1]C+1 -> 3839 | B3839: =SUM(R1C[-1]:RC1) -> 7370880
A3840: =R[-1]C+1 -> 3840 | B3840: =SUM(R1C[-1]:RC1) -> 7374720
A3841: =R[-1]C+1 -> 3841 | B3841: =SUM(R1C[-1]:RC1) -> 7378561
A3842: =R[-1]C+1 -> 3842 | B3842: =SUM(R1C[-1]:RC1) -> 7382403
A3843: =R[-1]C+1 -> 3843 | B3843: =SUM(R1C[-1]:RC1) -> 7386246
A3844: =R[-1]C+1 -> 3844 | B3844: =SUM(R1C[-1]:RC1) -> 7390090
A3845: =R[-1]C+1 -> 3845 | B3845: =SUM(R1C[-1]:RC1) -> 7393935
A3846: =R[-1]C+1 -> 3846 | B3846: =SUM(R1C[-1]:RC1) -> 7397781
A3847: =R[-1]C+1 -> 3847 | B3847: =SUM(R1C[-1]:RC1) -> 7401628
A3848: =R[-1]C+1 -> 3848 | B3848: =SUM(R1C[-1]:RC1) -> 7405476
A3849: =R[-1]C+1 -> 3849 | B3849: =SUM(R1C[-1]:RC1) -> 7409325
A3850: =R[-1]C+1 -> 3850 | B3850: =SUM(R1C[-1]:RC1) -> 7413175
A3851: =R[-1]C+1 -> 3851 | B3851: =SUM(R1C[-1]:RC1) -> 7417026
A3852: =R[-1]C+1 -> 3852 | B3852: =SUM(R1C[-1]:RC1) -> 7420878
A3853: =R[-1]C+1 -> 3853 | B3853: =SUM(R1C[-1]:RC1) -> 7424731
A3854: =R[-1]C+1 -> 3854 | B3854: =SUM(R1C[-1]:RC1) -> 7428585
A3855: =R[-1]C+1 -> 3855 | B3855: =SUM(R1C[-1]:RC1) -> 7432440
A3856: =R[-1]C+1 -> 3856 | B3856: =SUM(R1C[-1]:RC1) -> 7436296
A3857: =R[-1]C+1 -> 3857 | B3857: =SUM(R1C[-1]:RC1) -> 7440153
A3858: =R[-1]C+1 -> 3858 | B3858: =SUM(R1C[-1]:RC1) -> 7444011
A3859: =R[-1]C+1 -> 3859 | B3859: =SUM(R1C[-1]:RC1) -> 7447870
A3860: =R[-1]C+1 -> 3860 | B3860: =SUM(R1C[-1]:RC1) -> 7451730
A3861: =R[-1]C+1 -> 3861 | B3861: =SUM(R1C[-1]:RC1) -> 7455591
A3862: =R[-1]C+1 -> 3862 | B3862: =SUM(R1C[-1]:RC1) -> 7459453
A3863: =R[-1]C+1 -> 3863 | B3863: =SUM(R1C[-1]:RC1) -> 7463316
A3864: =R[-1]C+1 -> 3864 | B3864: =SUM(R1C[-1]:RC1) -> 7467180
A3865: =R[-1]C+1 -> 3865 | B3865: =SUM(R1C[-1]:RC1) -> 7471045
A3866: =R[-1]C+1 -> 3866 | B3866: =SUM(R1C[-1]:RC1) -> 7474911
A3867: =R[-1]C+1 -> 3867 | B3867: =SUM(R1C[-1]:RC1) -> 7478778
A3868: =R[-1]C+1 -> 3868 | B3868: =SUM(R1C[-1]:RC1) -> 7482646
A3869: =R[-1]C+1 -> 3869 | B3869: =SUM(R1C[-1]:RC1) -> 7486515
A3870: =R[-1]C+1 -> 3870 | B3870: =SUM(R1C[-1]:RC1) -> 7490385
A3871: =R[-1]C+1 -> 3871 | B3871: =SUM(R1C[-1]:RC1) -> 7494256
A3872: =R[-1]C+1 -> 3872 | B3872: =SUM(R1C[-1]:RC1) -> 7498128
A3873: =R[-1]C+1 -> 3873 | B3873: =SUM(R1C[-1]:RC1) -> 7502001
A3874: =R[-1]C+1 -> 3874 | B3874: =SUM(R1C[-1]:RC1) -> 7505875
A3875: =R[-1]C+1 -> 3875 | B3875: =SUM(R1C[-1]:RC1) -> 7509750
A3876: =R[-1]C+1 -> 3876 | B3876: =SUM(R1C[-1]:RC1) -> 7513626
A3877: =R[-1]C+1 -> 3877 | B3877: =SUM(R1C[-1]:RC1) -> 7517503
A3878: =R[-1]C+1 -> 3878 | B3878: =SUM(R1C[-1]:RC1) -> 7521381
A3879: =R[-1]C+1 -> 3879 | B3879: =SUM(R1C[-1]:RC1) -> 7525260
A3880: =R[-1]C+1 -> 3880 | B3880: =SUM(R1C[-1]:RC1) -> 7529140
A3881: =R[-1]C+1 -> 3881 | B3881: =SUM(R1C[-1]:RC1) -> 7533021
A3882: =R[-1]C+1 -> 3882 | B3882: =SUM(R1C[-1]:RC1) -> 7536903
A3883: =R[-1]C+1 -> 3883 | B3883: =SUM(R1C[-1]:RC1) -> 7540786
A3884: =R[-1]C+1 -> 3884 | B3884: =SUM(R1C[-1]:RC1) -> 7544670
A3885: =R[-1]C+1 -> 3885 | B3885: =SUM(R1C[-1]:RC1) -> 7548555
A3886: =R[-1]C+1 -> 3886 | B3886: =SUM(R1C[-1]:RC1) -> 7552441
A3887: =R[-1]C+1 -> 3887 | B3887: =SUM(R1C[-1]:RC1) -> 7556328
A3888: =R[-1]C+1 -> 3888 | B3888: =SUM(R1C[-1]:RC1) -> 7560216
A3889: =R[-1]C+1 -> 3889 | B3889: =SUM(R1C[-1]:RC1) -> 7564105
A3890: =R[-1]C+1 -> 3890 | B3890: =SUM(R1C[-1]:RC1) -> 7567995
A3891: =R[-1]C+1 -> 3891 | B3891: =SUM(R1C[-1]:RC1) -> 7571886
A3892: =R[-1]C+1 -> 3892 | B3892: =SUM(R1C[-1]:RC1) -> 7575778
A3893: =R[-1]C+1 -> 3893 | B3893: =SUM(R1C[-1]:RC1) -> 7579671
A3894: =R[-1]C+1 -> 3894 | B3894: =SUM(R1C[-1]:RC1) -> 7583565
A3895: =R[-1]C+1 -> 3895 | B3895: =SUM(R1C[-1]:RC1) -> 7587460
A3896: =R[-1]C+1 -> 3896 | B3896: =SUM(R1C[-1]:RC1) -> 7591356
A3897: =R[-1]C+1 -> 3897 | B3897: =SUM(R1C[-1]:RC1) -> 7595253
A3898: =R[-1]C+1 -> 3898 | B3898: =SUM(R1C[-1]:RC1) -> 7599151
A3899: =R[-1]C+1 -> 3899 | B3899: =SUM(R1C[-1]:RC1) -> 7603050
A3900: =R[-1]C+1 -> 3900 | B3900: =SUM(R1C[-1]:RC1) -> 7606950
A3901: =R[-1]C+1 -> 3901 | B3901: =SUM(R1C[-1]:RC1) -> 7610851
A3902: =R[-1]C+1 -> 3902 | B3902: =SUM(R1C[-1]:RC1) -> 7614753
A3903: =R[-1]C+1 -> 3903 | B3903: =SUM(R1C[-1]:RC1) -> 7618656
A3904: =R[-1]C+1 -> 3904 | B3904: =SUM(R1C[-1]:RC1) -> 7622560
A3905: =R[-1]C+1 -> 3905 | B3905: =SUM(R1C[-1]:RC1) -> 7626465
A3906: =R[-1]C+1 -> 3906 | B3906: =SUM(R1C[-1]:RC1) -> 7630371
A3907: =R[-1]C+1 -> 3907 | B3907: =SUM(R1C[-1]:RC1) -> 7634278
A3908: =R[-1]C+1 -> 3908 | B3908: =SUM(R1C[-1]:RC1) -> 7638186
A3909: =R[-1]C+1 -> 3909 | B3909: =SUM(R1C[-1]:RC1) -> 7642095
A3910: =R[-1]C+1 -> 3910 | B3910: =SUM(R1C[-1]:RC1) -> 7646005
A3911: =R[-1]C+1 -> 3911 | B3911: =SUM(R1C[-1]:RC1) -> 7649916
A3912: =R[-1]C+1 -> 3912 | B3912: =SUM(R1C[-1]:RC1) -> 7653828
A3913: =R[-1]C+1 -> 3913 | B3913: =SUM(R1C[-1]:RC1) -> 7657741
A3914: =R[-1]C+1 -> 3914 | B3914: =SUM(R1C[-1]:RC1) -> 7661655
A3915: =R[-1]C+1 -> 3915 | B3915: =SUM(R1C[-1]:RC1) -> 7665570
A3916: =R[-1]C+1 -> 3916 | B3916: =SUM(R1C[-1]:RC1) -> 7669486
A3917: =R[-1]C+1 -> 3917 | B3917: =SUM(R1C[-1]:RC1) -> 7673403
A3918: =R[-1]C+1 -> 3918 | B3918: =SUM(R1C[-1]:RC1) -> 7677321
A3919: =R[-1]C+1 -> 3919 | B3919: =SUM(R1C[-1]:RC1) -> 7681240
A3920: =R[-1]C+1 -> 3920 | B3920: =SUM(R1C[-1]:RC1) -> 7685160
A3921: =R[-1]C+1 -> 3921 | B3921: =SUM(R1C[-1]:RC1) -> 7689081
A3922: =R[-1]C+1 -> 3922 | B3922: =SUM(R1C[-1]:RC1) -> 7693003
A3923: =R[-1]C+1 -> 3923 | B3923: =SUM(R1C[-1]:RC1) -> 7696926
A3924: =R[-1]C+1 -> 3924 | B3924: =SUM(R1C[-1]:RC1) -> 7700850
A3925: =R[-1]C+1 -> 3925 | B3925: =SUM(R1C[-1]:RC1) -> 7704775
A3926: =R[-1]C+1 -> 3926 | B3926: =SUM(R1C[-1]:RC1) -> 7708701
A3927: =R[-1]C+1 -> 3927 | B3927: =SUM(R1C[-1]:RC1) -> 7712628
A3928: =R[-1]C+1 -> 3928 | B3928: =SUM(R1C[-1]:RC1) -> 7716556
A3929: =R[-1]C+1 -> 3929 | B3929: =SUM(R1C[-1]:RC1) -> 7720485
A3930: =R[-1]C+1 -> 3930 | B3930: =SUM(R1C[-1]:RC1) -> 7724415
A3931: =R[-1]C+1 -> 3931 | B3931: =SUM(R1C[-1]:RC1) -> 7728346
A3932: =R[-1]C+1 -> 3932 | B3932: =SUM(R1C[-1]:RC1) -> 7732278
A3933: =R[-1]C+1 -> 3933 | B3933: =SUM(R1C[-1]:RC1) -> 7736211
A3934: =R[-1]C+1 -> 3934 | B3934: =SUM(R1C[-1]:RC1) -> 7740145
A3935: =R[-1]C+1 -> 3935 | B3935: =SUM(R1C[-1]:RC1) -> 7744080
A3936: =R[-1]C+1 -> 3936 | B3936: =SUM(R1C[-1]:RC1) -> 7748016
A3937: =R[-1]C+1 -> 3937 | B3937: =SUM(R1C[-1]:RC1) -> 7751953
A3938: =R[-1]C+1 -> 3938 | B3938: =SUM(R1C[-1]:RC1) -> 7755891
A3939: =R[-1]C+1 -> 3939 | B3939: =SUM(R1C[-1]:RC1) -> 7759830
A3940: =R[-1]C+1 -> 3940 | B3940: =SUM(R1C[-1]:RC1) -> 7763770
A3941: =R[-1]C+1 -> 3941 | B3941: =SUM(R1C[-1]:RC1) -> 7767711
A3942: =R[-1]C+1 -> 3942 | B3942: =SUM(R1C[-1]:RC1) -> 7771653
A3943: =R[-1]C+1 -> 3943 | B3943: =SUM(R1C[-1]:RC1) -> 7775596
A3944: =R[-1]C+1 -> 3944 | B3944: =SUM(R1C[-1]:RC1) -> 7779540
A3945: =R[-1]C+1 -> 3945 | B3945: =SUM(R1C[-1]:RC1) -> 7783485
A3946: =R[-1]C+1 -> 3946 | B3946: =SUM(R1C[-1]:RC1) -> 7787431
A3947: =R[-1]C+1 -> 3947 | B3947: =SUM(R1C[-1]:RC1) -> 7791378
A3948: =R[-1]C+1 -> 3948 | B3948: =SUM(R1C[-1]:RC1) -> 7795326
A3949: =R[-1]C+1 -> 3949 | B3949: =SUM(R1C[-1]:RC1) -> 7799275
A3950: =R[-1]C+1 -> 3950 | B3950: =SUM(R1C[-1]:RC1) -> 7803225
A3951: =R[-1]C+1 -> 3951 | B3951: =SUM(R1C[-1]:RC1) -> 7807176
A3952: =R[-1]C+1 -> 3952 | B3952: =SUM(R1C[-1]:RC1) -> 7811128
A3953: =R[-1]C+1 -> 3953 | B3953: =SUM(R1C[-1]:RC1) -> 7815081
A3954: =R[-1]C+1 -> 3954 | B3954: =SUM(R1C[-1]:RC1) -> 7819035
A3955: =R[-1]C+1 -> 3955 | B3955: =SUM(R1C[-1]:RC1) -> 7822990
A3956: =R[-1]C+1 -> 3956 | B3956: =SUM(R1C[-1]:RC1) -> 7826946
A3957: =R[-1]C+1 -> 3957 | B3957: =SUM(R1C[-1]:RC1) -> 7830903
A3958: =R[-1]C+1 -> 3958 | B3958: =SUM(R1C[-1]:RC1) -> 7834861
A3959: =R[-1]C+1 -> 3959 | B3959: =SUM(R1C[-1]:RC1) -> 7838820
A3960: =R[-1]C+1 -> 3960 | B3960: =SUM(R1C[-1]:RC1) -> 7842780
A3961: =R[-1]C+1 -> 3961 | B3961: =SUM(R1C[-1]:RC1) -> 7846741
A3962: =R[-1]C+1 -> 3962 | B3962: =SUM(R1C[-1]:RC1) -> 7850703
A3963: =R[-1]C+1 -> 3963 | B3963: =SUM(R1C[-1]:RC1) -> 7854666
A3964: =R[-1]C+1 -> 3964 | B3964: =SUM(R1C[-1]:RC1) -> 7858630
A3965: =R[-1]C+1 -> 3965 | B3965: =SUM(R1C[-1]:RC1) -> 7862595
A3966: =R[-1]C+1 -> 3966 | B3966: =SUM(R1C[-1]:RC1) -> 7866561
A3967: =R[-1]C+1 -> 3967 | B3967: =SUM(R1C[-1]:RC1) -> 7870528
A3968: =R[-1]C+1 -> 3968 | B3968: =SUM(R1C[-1]:RC1) -> 7874496
A3969: =R[-1]C+1 -> 3969 | B3969: =SUM(R1C[-1]:RC1) -> 7878465
A3970: =R[-1]C+1 -> 3970 | B3970: =SUM(R1C[-1]:RC1) -> 7882435
A3971: =R[-1]C+1 -> 3971 | B3971: =SUM(R1C[-1]:RC1) -> 7886406
A3972: =R[-1]C+1 -> 3972 | B3972: =SUM(R1C[-1]:RC1) -> 7890378
A3973: =R[-1]C+1 -> 3973 | B3973: =SUM(R1C[-1]:RC1) -> 7894351
A3974: =R[-1]C+1 -> 3974 | B3974: =SUM(R1C[-1]:RC1) -> 7898325
A3975: =R[-1]C+1 -> 3975 | B3975: =SUM(R1C[-1]:RC1) -> 7902300
A3976: =R[-1]C+1 -> 3976 | B3976: =SUM(R1C[-1]:RC1) -> 7906276
A3977: =R[-1]C+1 -> 3977 | B3977: =SUM(R1C[-1]:RC1) -> 7910253
A3978: =R[-1]C+1 -> 3978 | B3978: =SUM(R1C[-1]:RC1) -> 7914231
A3979: =R[-1]C+1 -> 3979 | B3979: =SUM(R1C[-1]:RC1) -> 7918210
A3980: =R[-1]C+1 -> 3980 | B3980: =SUM(R1C[-1]:RC1) -> 7922190
A3981: =R[-1]C+1 -> 3981 | B3981: =SUM(R1C[-1]:RC1) -> 7926171
A3982: =R[-1]C+1 -> 3982 | B3982: =SUM(R1C[-1]:RC1) -> 7930153
A3983: =R[-1]C+1 -> 3983 | B3983: =SUM(R1C[-1]:RC1) -> 7934136
A3984: =R[-1]C+1 -> 3984 | B3984: =SUM(R1C[-1]:RC1) -> 7938120
A3985: =R[-1]C+1 -> 3985 | B3985: =SUM(R1C[-1]:RC1) -> 7942105
A3986: =R[-1]C+1 -> 3986 | B3986: =SUM(R1C[-1]:RC1) -> 7946091
A3987: =R[-1]C+1 -> 3987 | B3987: =SUM(R1C[-1]:RC1) -> 7950078
A3988: =R[-1]C+1 -> 3988 | B3988: =SUM(R1C[-1]:RC1) -> 7954066
A3989: =R[-1]C+1 -> 3989 | B3989: =SUM(R1C[-1]:RC1) -> 7958055
A3990: =R[-1]C+1 -> 3990 | B3990: =SUM(R1C[-1]:RC1) -> 7962045
A3991: =R[-1]C+1 -> 3991 | B3991: =SUM(R1C[-1]:RC1) -> 7966036
A3992: =R[-1]C+1 -> 3992 | B3992: =SUM(R1C[-1]:RC1) -> 7970028
A3993: =R[-1]C+1 -> 3993 | B3993: =SUM(R1C[-1]:RC1) -> 7974021
A3994: =R[-1]C+1 -> 3994 | B3994: =SUM(R1C[-1]:RC1) -> 7978015
A3995: =R[-1]C+1 -> 3995 | B3995: =SUM(R1C[-1]:RC1) -> 7982010
A3996: =R[-1]C+1 -> 3996 | B3996: =SUM(R1C[-1]:RC1) -> 7986006
A3997: =R[-1]C+1 -> 3997 | B3997: =SUM(R1C[-1]:RC1) -> 7990003
A3998: =R[-1]C+1 -> 3998 | B3998: =SUM(R1C[-1]:RC1) -> 7994001
A3999: =R[-1]C+1 -> 3999 | B3999: =SUM(R1C[-1]:RC1) -> 7998000
A4000: =R[-1]C+1 -> 4000 | B4000: =SUM(R1C[-1]:RC1) -> 8002000
A4001: =R[-1]C+1 -> 4001 | B4001: =SUM(R1C[-1]:RC1) -> 8006001
A4002: =R[-1]C+1 -> 4002 | B4002: =SUM(R1C[-1]:RC1) -> 8010003
A4003: =R[-1]C+1 -> 4003 | B4003: =SUM(R1C[-1]:RC1) -> 8014006
A4004: =R[-1]C+1 -> 4004 | B4004: =SUM(R1C[-1]:RC1) -> 8018010
A4005: =R[-1]C+1 -> 4005 | B4005: =SUM(R1C[-1]:RC1) -> 8022015
A4006: =R[-1]C+1 -> 4006 | B4006: =SUM(R1C[-1]:RC1) -> 8026021
A4007: =R[-1]C+1 -> 4007 | B4007: =SUM(R1C[-1]:RC1) -> 8030028
A4008: =R[-1]C+1 -> 4008 | B4008: =SUM(R1C[-1]:RC1) -> 8034036
A4009: =R[-1]C+1 -> 4009 | B4009: =SUM(R1C[-1]:RC1) -> 8038045
A4010: =R[-1]C+1 -> 4010 | B4010: =SUM(R1C[-1]:RC1) -> 8042055
A4011: =R[-1]C+1 -> 4011 | B4011: =SUM(R1C[-1]:RC1) -> 8046066
A4012: =R[-1]C+1 -> 4012 | B4012: =SUM(R1C[-1]:RC1) -> 8050078
A4013: =R[-1]C+1 -> 4013 | B4013: =SUM(R1C[-1]:RC1) -> 8054091
A4014: =R[-1]C+1 -> 4014 | B4014: =SUM(R1C[-1]:RC1) -> 8058105
A4015: =R[-1]C+1 -> 4015 | B4015: =SUM(R1C[-1]:RC1) -> 8062120
A4016: =R[-1]C+1 -> 4016 | B4016: =SUM(R1C[-1]:RC1) -> 8066136
A4017: =R[-1]C+1 -> 4017 | B4017: =SUM(R1C[-1]:RC1) -> 8070153
A4018: =R[-1]C+1 -> 4018 | B4018: =SUM(R1C[-1]:RC1) -> 8074171
A4019: =R[-1]C+1 -> 4019 | B4019: =SUM(R1C[-1]:RC1) -> 8078190
A4020: =R[-1]C+1 -> 4020 | B4020: =SUM(R1C[-1]:RC1) -> 8082210
A4021: =R[-1]C+1 -> 4021 | B4021: =SUM(R1C[-1]:RC1) -> 8086231
A4022: =R[-1]C+1 -> 4022 | B4022: =SUM(R1C[-1]:RC1) -> 8090253
A4023: =R[-1]C+1 -> 4023 | B4023: =SUM(R1C[-1]:RC1) -> 8094276
A4024: =R[-1]C+1 -> 4024 | B4024: =SUM(R1C[-1]:RC1) -> 8098300
A4025: =R[-1]C+1 -> 4025 | B4025: =SUM(R1C[-1]:RC1) -> 8102325
A4026: =R[-1]C+1 -> 4026 | B4026: =SUM(R1C[-1]:RC1) -> 8106351
A4027: =R[-1]C+1 -> 4027 | B4027: =SUM(R1C[-1]:RC1) -> 8110378
A4028: =R[-1]C+1 -> 4028 | B4028: =SUM(R1C[-1]:RC1) -> 8114406
A4029: =R[-1]C+1 -> 4029 | B4029: =SUM(R1C[-1]:RC1) -> 8118435
A4030: =R[-1]C+1 -> 4030 | B4030: =SUM(R1C[-1]:RC1) -> 8122465
A4031: =R[-1]C+1 -> 4031 | B4031: =SUM(R1C[-1]:RC1) -> 8126496
A4032: =R[-1]C+1 -> 4032 | B4032: =SUM(R1C[-1]:RC1) -> 8130528
A4033: =R[-1]C+1 -> 4033 | B4033: =SUM(R1C[-1]:RC1) -> 8134561
A4034: =R[-1]C+1 -> 4034 | B4034: =SUM(R1C[-1]:RC1) -> 8138595
A4035: =R[-1]C+1 -> 4035 | B4035: =SUM(R1C[-1]:RC1) -> 8142630
A4036: =R[-1]C+1 -> 4036 | B4036: =SUM(R1C[-1]:RC1) -> 8146666
A4037: =R[-1]C+1 -> 4037 | B4037: =SUM(R1C[-1]:RC1) -> 8150703
A4038: =R[-1]C+1 -> 4038 | B4038: =SUM(R1C[-1]:RC1) -> 8154741
A4039: =R[-1]C+1 -> 4039 | B4039: =SUM(R1C[-1]:RC1) -> 8158780
A4040: =R[-1]C+1 -> 4040 | B4040: =SUM(R1C[-1]:RC1) -> 8162820
A4041: =R[-1]C+1 -> 4041 | B4041: =SUM(R1C[-1]:RC1) -> 8166861
A4042: =R[-1]C+1 -> 4042 | B4042: =SUM(R1C[-1]:RC1) -> 8170903
A4043: =R[-1]C+1 -> 4043 | B4043: =SUM(R1C[-1]:RC1) -> 8174946
A4044: =R[-1]C+1 -> 4044 | B4044: =SUM(R1C[-1]:RC1) -> 8178990
A4045: =R[-1]C+1 -> 4045 | B4045: =SUM(R1C[-1]:RC1) -> 8183035
A4046: =R[-1]C+1 -> 4046 | B4046: =SUM(R1C[-1]:RC1) -> 8187081
A4047: =R[-1]C+1 -> 4047 | B4047: =SUM(R1C[-1]:RC1) -> 8191128
A4048: =R[-1]C+1 -> 4048 | B4048: =SUM(R1C[-1]:RC1) -> 8195176
A4049: =R[-1]C+1 -> 4049 | B4049: =SUM(R1C[-1]:RC1) -> 8199225
A4050: =R[-1]C+1 -> 4050 | B4050: =SUM(R1C[-1]:RC1) -> 8203275
A4051: =R[-1]C+1 -> 4051 | B4051: =SUM(R1C[-1]:RC1) -> 8207326
A4052: =R[-1]C+1 -> 4052 | B4052: =SUM(R1C[-1]:RC1) -> 8211378
A4053: =R[-1]C+1 -> 4053 | B4053: =SUM(R1C[-1]:RC1) -> 8215431
A4054: =R[-1]C+1 -> 4054 | B4054: =SUM(R1C[-1]:RC1) -> 8219485
A4055: =R[-1]C+1 -> 4055 | B4055: =SUM(R1C[-1]:RC1) -> 8223540
A4056: =R[-1]C+1 -> 4056 | B4056: =SUM(R1C[-1]:RC1) -> 8227596
A4057: =R[-1]C+1 -> 4057 | B4057: =SUM(R1C[-1]:RC1) -> 8231653
A4058: =R[-1]C+1 -> 4058 | B4058: =SUM(R1C[-1]:RC1) -> 8235711
A4059: =R[-1]C+1 -> 4059 | B4059: =SUM(R1C[-1]:RC1) -> 8239770
A4060: =R[-1]C+1 -> 4060 | B4060: =SUM(R1C[-1]:RC1) -> 8243830
A4061: =R[-1]C+1 -> 4061 | B4061: =SUM(R1C[-1]:RC1) -> 8247891
A4062: =R[-1]C+1 -> 4062 | B4062: =SUM(R1C[-1]:RC1) -> 8251953
A4063: =R[-1]C+1 -> 4063 | B4063: =SUM(R1C[-1]:RC1) -> 8256016
A4064: =R[-1]C+1 -> 4064 | B4064: =SUM(R1C[-1]:RC1) -> 8260080
A4065: =R[-1]C+1 -> 4065 | B4065: =SUM(R1C[-1]:RC1) -> 8264145
A4066: =R[-1]C+1 -> 4066 | B4066: =SUM(R1C[-1]:RC1) -> 8268211
A4067: =R[-1]C+1 -> 4067 | B4067: =SUM(R1C[-1]:RC1) -> 8272278
A4068: =R[-1]C+1 -> 4068 | B4068: =SUM(R1C[-1]:RC1) -> 8276346
A4069: =R[-1]C+1 -> 4069 | B4069: =SUM(R1C[-1]:RC1) -> 8280415
A4070: =R[-1]C+1 -> 4070 | B4070: =SUM(R1C[-1]:RC1) -> 8284485
A4071: =R[-1]C+1 -> 4071 | B4071: =SUM(R1C[-1]:RC1) -> 8288556
A4072: =R[-1]C+1 -> 4072 | B4072: =SUM(R1C[-1]:RC1) -> 8292628
A4073: =R[-1]C+1 -> 4073 | B4073: =SUM(R1C[-1]:RC1) -> 8296701
A4074: =R[-1]C+1 -> 4074 | B4074: =SUM(R1C[-1]:RC1) -> 8300775
A4075: =R[-1]C+1 -> 4075 | B4075: =SUM(R1C[-1]:RC1) -> 8304850
A4076: =R[-1]C+1 -> 4076 | B4076: =SUM(R1C[-1]:RC1) -> 8308926
A4077: =R[-1]C+1 -> 4077 | B4077: =SUM(R1C[-1]:RC1) -> 8313003
A4078: =R[-1]C+1 -> 4078 | B4078: =SUM(R1C[-1]:RC1) -> 8317081
A4079: =R[-1]C+1 -> 4079 | B4079: =SUM(R1C[-1]:RC1) -> 8321160
A4080: =R[-1]C+1 -> 4080 | B4080: =SUM(R1C[-1]:RC1) -> 8325240
A4081: =R[-1]C+1 -> 4081 | B4081: =SUM(R1C[-1]:RC1) -> 8329321
A4082: =R[-1]C+1 -> 4082 | B4082: =SUM(R1C[-1]:RC1) -> 8333403
A4083: =R[-1]C+1 -> 4083 | B4083: =SUM(R1C[-1]:RC1) -> 8337486
A4084: =R[-1]C+1 -> 4084 | B4084: =SUM(R1C[-1]:RC1) -> 8341570
A4085: =R[-1]C+1 -> 4085 | B4085: =SUM(R1C[-1]:RC1) -> 8345655
A4086: =R[-1]C+1 -> 4086 | B4086: =SUM(R1C[-1]:RC1) -> 8349741
A4087: =R[-1]C+1 -> 4087 | B4087: =SUM(R1C[-1]:RC1) -> 8353828
A4088: =R[-1]C+1 -> 4088 | B4088: =SUM(R1C[-1]:RC1) -> 8357916
A4089: =R[-1]C+1 -> 4089 | B4089: =SUM(R1C[-1]:RC1) -> 8362005
A4090: =R[-1]C+1 -> 4090 | B4090: =SUM(R1C[-1]:RC1) -> 8366095
A4091: =R[-1]C+1 -> 4091 | B4091: =SUM(R1C[-1]:RC1) -> 8370186
A4092: =R[-1]C+1 -> 4092 | B4092: =SUM(R1C[-1]:RC1) -> 8374278
A4093: =R[-1]C+1 -> 4093 | B4093: =SUM(R1C[-1]:RC1) -> 8378371
A4094: =R[-1]C+1 -> 4094 | B4094: =SUM(R1C[-1]:RC1) -> 8382465
A4095: =R[-1]C+1 -> 4095 | B4095: =SUM(R1C[-1]:RC1) -> 8386560
A4096: =R[-1]C+1 -> 4096 | B4096: =SUM(R1C[-1]:RC1) -> 8390656
A4097: =R[-1]C+1 -> 4097 | B4097: =SUM(R1C[-1]:RC1) -> 8394753
A4098: =R[-1]C+1 -> 4098 | B4098: =SUM(R1C[-1]:RC1) -> 8398851
A4099: =R[-1]C+1 -> 4099 | B4099: =SUM(R1C[-1]:RC1) -> 8402950
A4100: =R[-1]C+1 -> 4100 | B4100: =SUM(R1C[-1]:RC1) -> 8407050
A4101: =R[-1]C+1 -> 4101 | B4101: =SUM(R1C[-1]:RC1) -> 8411151
A4102: =R[-1]C+1 -> 4102 | B4102: =SUM(R1C[-1]:RC1) -> 8415253
A4103: =R[-1]C+1 -> 4103 | B4103: =SUM(R1C[-1]:RC1) -> 8419356
A4104: =R[-1]C+1 -> 4104 | B4104: =SUM(R1C[-1]:RC1) -> 8423460
A4105: =R[-1]C+1 -> 4105 | B4105: =SUM(R1C[-1]:RC1) -> 8427565
A4106: =R[-1]C+1 -> 4106 | B4106: =SUM(R1C[-1]:RC1) -> 8431671
A4107: =R[-1]C+1 -> 4107 | B4107: =SUM(R1C[-1]:RC1) -> 8435778
A4108: =R[-1]C+1 -> 4108 | B4108: =SUM(R1C[-1]:RC1) -> 8439886
A4109: =R[-1]C+1 -> 4109 | B4109: =SUM(R1C[-1]:RC1) -> 8443995
A4110: =R[-1]C+1 -> 4110 | B4110: =SUM(R1C[-1]:RC1) -> 8448105
A4111: =R[-1]C+1 -> 4111 | B4111: =SUM(R1C[-1]:RC1) -> 8452216
A4112: =R[-1]C+1 -> 4112 | B4112: =SUM(R1C[-1]:RC1) -> 8456328
A4113: =R[-1]C+1 -> 4113 | B4113: =SUM(R1C[-1]:RC1) -> 8460441
A4114: =R[-1]C+1 -> 4114 | B4114: =SUM(R1C[-1]:RC1) -> 8464555
A4115: =R[-1]C+1 -> 4115 | B4115: =SUM(R1C[-1]:RC1) -> 8468670
A4116: =R[-1]C+1 -> 4116 | B4116: =SUM(R1C[-1]:RC1) -> 8472786
A4117: =R[-1]C+1 -> 4117 | B4117: =SUM(R1C[-1]:RC1) -> 8476903
A4118: =R[-1]C+1 -> 4118 | B4118: =SUM(R1C[-1]:RC1) -> 8481021
A4119: =R[-1]C+1 -> 4119 | B4119: =SUM(R1C[-1]:RC1) -> 8485140
A4120: =R[-1]C+1 -> 4120 | B4120: =SUM(R1C[-1]:RC1) -> 8489260
A4121: =R[-1]C+1 -> 4121 | B4121: =SUM(R1C[-1]:RC1) -> 8493381
A4122: =R[-1]C+1 -> 4122 | B4122: =SUM(R1C[-1]:RC1) -> 8497503
A4123: =R[-1]C+1 -> 4123 | B4123: =SUM(R1C[-1]:RC1) -> 8501626
A4124: =R[-1]C+1 -> 4124 | B4124: =SUM(R1C[-1]:RC1) -> 8505750
A4125: =R[-1]C+1 -> 4125 | B4125: =SUM(R1C[-1]:RC1) -> 8509875
A4126: =R[-1]C+1 -> 4126 | B4126: =SUM(R1C[-1]:RC1) -> 8514001
A4127: =R[-1]C+1 -> 4127 | B4127: =SUM(R1C[-1]:RC1) -> 8518128
A4128: =R[-1]C+1 -> 4128 | B4128: =SUM(R1C[-1]:RC1) -> 8522256
A4129: =R[-1]C+1 -> 4129 | B4129: =SUM(R1C[-1]:RC1) -> 8526385
A4130: =R[-1]C+1 -> 4130 | B4130: =SUM(R1C[-1]:RC1) -> 8530515
A4131: =R[-1]C+1 -> 4131 | B4131: =SUM(R1C[-1]:RC1) -> 8534646
A4132: =R[-1]C+1 -> 4132 | B4132: =SUM(R1C[-1]:RC1) -> 8538778
A4133: =R[-1]C+1 -> 4133 | B4133: =SUM(R1C[-1]:RC1) -> 8542911
A4134: =R[-1]C+1 -> 4134 | B4134: =SUM(R1C[-1]:RC1) -> 8547045
A4135: =R[-1]C+1 -> 4135 | B4135: =SUM(R1C[-1]:RC1) -> 8551180
A4136: =R[-1]C+1 -> 4136 | B4136: =SUM(R1C[-1]:RC1) -> 8555316
A4137: =R[-1]C+1 -> 4137 | B4137: =SUM(R1C[-1]:RC1) -> 8559453
A4138: =R[-1]C+1 -> 4138 | B4138: =SUM(R1C[-1]:RC1) -> 8563591
A4139: =R[-1]C+1 -> 4139 | B4139: =SUM(R1C[-1]:RC1) -> 8567730
A4140: =R[-1]C+1 -> 4140 | B4140: =SUM(R1C[-1]:RC1) -> 8571870
A4141: =R[-1]C+1 -> 4141 | B4141: =SUM(R1C[-1]:RC1) -> 8576011
A4142: =R[-1]C+1 -> 4142 | B4142: =SUM(R1C[-1]:RC1) -> 8580153
A4143: =R[-1]C+1 -> 4143 | B4143: =SUM(R1C[-1]:RC1) -> 8584296
A4144: =R[-1]C+1 -> 4144 | B4144: =SUM(R1C[-1]:RC1) -> 8588440
A4145: =R[-1]C+1 -> 4145 | B4145: =SUM(R1C[-1]:RC1) -> 8592585
A4146: =R[-1]C+1 -> 4146 | B4146: =SUM(R1C[-1]:RC1) -> 8596731
A4147: =R[-1]C+1 -> 4147 | B4147: =SUM(R1C[-1]:RC1) -> 8600878
A4148: =R[-1]C+1 -> 4148 | B4148: =SUM(R1C[-1]:RC1) -> 8605026
A4149: =R[-1]C+1 -> 4149 | B4149: =SUM(R1C[-1]:RC1) -> 8609175
A4150: =R[-1]C+1 -> 4150 | B4150: =SUM(R1C[-1]:RC1) -> 8613325
A4151: =R[-1]C+1 -> 4151 | B4151: =SUM(R1C[-1]:RC1) -> 8617476
A4152: =R[-1]C+1 -> 4152 | B4152: =SUM(R1C[-1]:RC1) -> 8621628
A4153: =R[-1]C+1 -> 4153 | B4153: =SUM(R1C[-1]:RC1) -> 8625781
A4154: =R[-1]C+1 -> 4154 | B4154: =SUM(R1C[-1]:RC1) -> 8629935
A4155: =R[-1]C+1 -> 4155 | B4155: =SUM(R1C[-1]:RC1) -> 8634090
A4156: =R[-1]C+1 -> 4156 | B4156: =SUM(R1C[-1]:RC1) -> 8638246
A4157: =R[-1]C+1 -> 4157 | B4157: =SUM(R1C[-1]:RC1) -> 8642403
A4158: =R[-1]C+1 -> 4158 | B4158: =SUM(R1C[-1]:RC1) -> 8646561
A4159: =R[-1]C+1 -> 4159 | B4159: =SUM(R1C[-1]:RC1) -> 8650720
A4160: =R[-1]C+1 -> 4160 | B4160: =SUM(R1C[-1]:RC1) -> 8654880
A4161: =R[-1]C+1 -> 4161 | B4161: =SUM(R1C[-1]:RC1) -> 8659041
A4162: =R[-1]C+1 -> 4162 | B4162: =SUM(R1C[-1]:RC1) -> 8663203
A4163: =R[-1]C+1 -> 4163 | B4163: =SUM(R1C[-1]:RC1) -> 8667366
A4164: =R[-1]C+1 -> 4164 | B4164: =SUM(R1C[-1]:RC1) -> 8671530
A4165: =R[-1]C+1 -> 4165 | B4165: =SUM(R1C[-1]:RC1) -> 8675695
A4166: =R[-1]C+1 -> 4166 | B4166: =SUM(R1C[-1]:RC1) -> 8679861
A4167: =R[-1]C+1 -> 4167 | B4167: =SUM(R1C[-1]:RC1) -> 8684028
A4168: =R[-1]C+1 -> 4168 | B4168: =SUM(R1C[-1]:RC1) -> 8688196
A4169: =R[-1]C+1 -> 4169 | B4169: =SUM(R1C[-1]:RC1) -> 8692365
A4170: =R[-1]C+1 -> 4170 | B4170: =SUM(R1C[-1]:RC1) -> 8696535
A4171: =R[-1]C+1 -> 4171 | B4171: =SUM(R1C[-1]:RC1) -> 8700706
A4172: =R[-1]C+1 -> 4172 | B4172: =SUM(R1C[-1]:RC1) -> 8704878
A4173: =R[-1]C+1 -> 4173 | B4173: =SUM(R1C[-1]:RC1) -> 8709051
A4174: =R[-1]C+1 -> 4174 | B4174: =SUM(R1C[-1]:RC1) -> 8713225
A4175: =R[-1]C+1 -> 4175 | B4175: =SUM(R1C[-1]:RC1) -> 8717400
A4176: =R[-1]C+1 -> 4176 | B4176: =SUM(R1C[-1]:RC1) -> 8721576
A4177: =R[-1]C+1 -> 4177 | B4177: =SUM(R1C[-1]:RC1) -> 8725753
A4178: =R[-1]C+1 -> 4178 | B4178: =SUM(R1C[-1]:RC1) -> 8729931
A4179: =R[-1]C+1 -> 4179 | B4179: =SUM(R1C[-1]:RC1) -> 8734110
A4180: =R[-1]C+1 -> 4180 | B4180: =SUM(R1C[-1]:RC1) -> 8738290
A4181: =R[-1]C+1 -> 4181 | B4181: =SUM(R1C[-1]:RC1) -> 8742471
A4182: =R[-1]C+1 -> 4182 | B4182: =SUM(R1C[-1]:RC1) -> 8746653
A4183: =R[-1]C+1 -> 4183 | B4183: =SUM(R1C[-1]:RC1) -> 8750836
A4184: =R[-1]C+1 -> 4184 | B4184: =SUM(R1C[-1]:RC1) -> 8755020
A4185: =R[-1]C+1 -> 4185 | B4185: =SUM(R1C[-1]:RC1) -> 8759205
A4186: =R[-1]C+1 -> 4186 | B4186: =SUM(R1C[-1]:RC1) -> 8763391
A4187: =R[-1]C+1 -> 4187 | B4187: =SUM(R1C[-1]:RC1) -> 8767578
A4188: =R[-1]C+1 -> 4188 | B4188: =SUM(R1C[-1]:RC1) -> 8771766
A4189: =R[-1]C+1 -> 4189 | B4189: =SUM(R1C[-1]:RC1) -> 8775955
A4190: =R[-1]C+1 -> 4190 | B4190: =SUM(R1C[-1]:RC1) -> 8780145
A4191: =R[-1]C+1 -> 4191 | B4191: =SUM(R1C[-1]:RC1) -> 8784336
A4192: =R[-1]C+1 -> 4192 | B4192: =SUM(R1C[-1]:RC1) -> 8788528
A4193: =R[-1]C+1 -> 4193 | B4193: =SUM(R1C[-1]:RC1) -> 8792721
A4194: =R[-1]C+1 -> 4194 | B4194: =SUM(R1C[-1]:RC1) -> 8796915
A4195: =R[-1]C+1 -> 4195 | B4195: =SUM(R1C[-1]:RC1) -> 8801110
A4196: =R[-1]C+1 -> 4196 | B4196: =SUM(R1C[-1]:RC1) -> 8805306
A4197: =R[-1]C+1 -> 4197 | B4197: =SUM(R1C[-1]:RC1) -> 8809503
A4198: =R[-1]C+1 -> 4198 | B4198: =SUM(R1C[-1]:RC1) -> 8813701
A4199: =R[-1]C+1 -> 4199 | B4199: =SUM(R1C[-1]:RC1) -> 8817900
A4200: =R[-1]C+1 -> 4200 | B4200: =SUM(R1C[-1]:RC1) -> 8822100
A4201: =R[-1]C+1 -> 4201 | B4201: =SUM(R1C[-1]:RC1) -> 8826301
A4202: =R[-1]C+1 -> 4202 | B4202: =SUM(R1C[-1]:RC1) -> 8830503
A4203: =R[-1]C+1 -> 4203 | B4203: =SUM(R1C[-1]:RC1) -> 8834706
A4204: =R[-1]C+1 -> 4204 | B4204: =SUM(R1C[-1]:RC1) -> 8838910
A4205: =R[-1]C+1 -> 4205 | B4205: =SUM(R1C[-1]:RC1) -> 8843115
A4206: =R[-1]C+1 -> 4206 | B4206: =SUM(R1C[-1]:RC1) -> 8847321
A4207: =R[-1]C+1 -> 4207 | B4207: =SUM(R1C[-1]:RC1) -> 8851528
A4208: =R[-1]C+1 -> 4208 | B4208: =SUM(R1C[-1]:RC1) -> 8855736
A4209: =R[-1]C+1 -> 4209 | B4209: =SUM(R1C[-1]:RC1) -> 8859945
A4210: =R[-1]C+1 -> 4210 | B4210: =SUM(R1C[-1]:RC1) -> 8864155
A4211: =R[-1]C+1 -> 4211 | B4211: =SUM(R1C[-1]:RC1) -> 8868366
A4212: =R[-1]C+1 -> 4212 | B4212: =SUM(R1C[-1]:RC1) -> 8872578
A4213: =R[-1]C+1 -> 4213 | B4213: =SUM(R1C[-1]:RC1) -> 8876791
A4214: =R[-1]C+1 -> 4214 | B4214: =SUM(R1C[-1]:RC1) -> 8881005
A4215: =R[-1]C+1 -> 4215 | B4215: =SUM(R1C[-1]:RC1) -> 8885220
A4216: =R[-1]C+1 -> 4216 | B4216: =SUM(R1C[-1]:RC1) -> 8889436
A4217: =R[-1]C+1 -> 4217 | B4217: =SUM(R1C[-1]:RC1) -> 8893653
A4218: =R[-1]C+1 -> 4218 | B4218: =SUM(R1C[-1]:RC1) -> 8897871
A4219: =R[-1]C+1 -> 4219 | B4219: =SUM(R1C[-1]:RC1) -> 8902090
A4220: =R[-1]C+1 -> 4220 | B4220: =SUM(R1C[-1]:RC1) -> 8906310
A4221: =R[-1]C+1 -> 4221 | B4221: =SUM(R1C[-1]:RC1) -> 8910531
A4222: =R[-1]C+1 -> 4222 | B4222: =SUM(R1C[-1]:RC1) -> 8914753
A4223: =R[-1]C+1 -> 4223 | B4223: =SUM(R1C[-1]:RC1) -> 8918976
A4224: =R[-1]C+1 -> 4224 | B4224: =SUM(R1C[-1]:RC1) -> 8923200
A4225: =R[-1]C+1 -> 4225 | B4225: =SUM(R1C[-1]:RC1) -> 8927425
A4226: =R[-1]C+1 -> 4226 | B4226: =SUM(R1C[-1]:RC1) -> 8931651
A4227: =R[-1]C+1 -> 4227 | B4227: =SUM(R1C[-1]:RC1) -> 8935878
A4228: =R[-1]C+1 -> 4228 | B4228: =SUM(R1C[-1]:RC1) -> 8940106
A4229: =R[-1]C+1 -> 4229 | B4229: =SUM(R1C[-1]:RC1) -> 8944335
A4230: =R[-1]C+1 -> 4230 | B4230: =SUM(R1C[-1]:RC1) -> 8948565
A4231: =R[-1]C+1 -> 4231 | B4231: =SUM(R1C[-1]:RC1) -> 8952796
A4232: =R[-1]C+1 -> 4232 | B4232: =SUM(R1C[-1]:RC1) -> 8957028
A4233: =R[-1]C+1 -> 4233 | B4233: =SUM(R1C[-1]:RC1) -> 8961261
A4234: =R[-1]C+1 -> 4234 | B4234: =SUM(R1C[-1]:RC1) -> 8965495
A4235: =R[-1]C+1 -> 4235 | B4235: =SUM(R1C[-1]:RC1) -> 8969730
A4236: =R[-1]C+1 -> 4236 | B4236: =SUM(R1C[-1]:RC1) -> 8973966
A4237: =R[-1]C+1 -> 4237 | B4237: =SUM(R1C[-1]:RC1) -> 8978203
A4238: =R[-1]C+1 -> 4238 | B4238: =SUM(R1C[-1]:RC1) -> 8982441
A4239: =R[-1]C+1 -> 4239 | B4239: =SUM(R1C[-1]:RC1) -> 8986680
A4240: =R[-1]C+1 -> 4240 | B4240: =SUM(R1C[-1]:RC1) -> 8990920
A4241: =R[-1]C+1 -> 4241 | B4241: =SUM(R1C[-1]:RC1) -> 8995161
A4242: =R[-1]C+1 -> 4242 | B4242: =SUM(R1C[-1]:RC1) -> 8999403
A4243: =R[-1]C+1 -> 4243 | B4243: =SUM(R1C[-1]:RC1) -> 9003646
A4244: =R[-1]C+1 -> 4244 | B4244: =SUM(R1C[-1]:RC1) -> 9007890
A4245: =R[-1]C+1 -> 4245 | B4245: =SUM(R1C[-1]:RC1) -> 9012135
A4246: =R[-1]C+1 -> 4246 | B4246: =SUM(R1C[-1]:RC1) -> 9016381
A4247: =R[-1]C+1 -> 4247 | B4247: =SUM(R1C[-1]:RC1) -> 9020628
A4248: =R[-1]C+1 -> 4248 | B4248: =SUM(R1C[-1]:RC1) -> 9024876
A4249: =R[-1]C+1 -> 4249 | B4249: =SUM(R1C[-1]:RC1) -> 9029125
A4250: =R[-1]C+1 -> 4250 | B4250: =SUM(R1C[-1]:RC1) -> 9033375
A4251: =R[-1]C+1 -> 4251 | B4251: =SUM(R1C[-1]:RC1) -> 9037626
A4252: =R[-1]C+1 -> 4252 | B4252: =SUM(R1C[-1]:RC1) -> 9041878
A4253: =R[-1]C+1 -> 4253 | B4253: =SUM(R1C[-1]:RC1) -> 9046131
A4254: =R[-1]C+1 -> 4254 | B4254: =SUM(R1C[-1]:RC1) -> 9050385
A4255: =R[-1]C+1 -> 4255 | B4255: =SUM(R1C[-1]:RC1) -> 9054640
A4256: =R[-1]C+1 -> 4256 | B4256: =SUM(R1C[-1]:RC1) -> 9058896
A4257: =R[-1]C+1 -> 4257 | B4257: =SUM(R1C[-1]:RC1) -> 9063153
A4258: =R[-1]C+1 -> 4258 | B4258: =SUM(R1C[-1]:RC1) -> 9067411
A4259: =R[-1]C+1 -> 4259 | B4259: =SUM(R1C[-1]:RC1) -> 9071670
A4260: =R[-1]C+1 -> 4260 | B4260: =SUM(R1C[-1]:RC1) -> 9075930
A4261: =R[-1]C+1 -> 4261 | B4261: =SUM(R1C[-1]:RC1) -> 9080191
A4262: =R[-1]C+1 -> 4262 | B4262: =SUM(R1C[-1]:RC1) -> 9084453
A4263: =R[-1]C+1 -> 4263 | B4263: =SUM(R1C[-1]:RC1) -> 9088716
A4264: =R[-1]C+1 -> 4264 | B4264: =SUM(R1C[-1]:RC1) -> 9092980
A4265: =R[-1]C+1 -> 4265 | B4265: =SUM(R1C[-1]:RC1) -> 9097245
A4266: =R[-1]C+1 -> 4266 | B4266: =SUM(R1C[-1]:RC1) -> 9101511
A4267: =R[-1]C+1 -> 4267 | B4267: =SUM(R1C[-1]:RC1) -> 9105778
A4268: =R[-1]C+1 -> 4268 | B4268: =SUM(R1C[-1]:RC1) -> 9110046
A4269: =R[-1]C+1 -> 4269 | B4269: =SUM(R1C[-1]:RC1) -> 9114315
A4270: =R[-1]C+1 -> 4270 | B4270: =SUM(R1C[-1]:RC1) -> 9118585
A4271: =R[-1]C+1 -> 4271 | B4271: =SUM(R1C[-1]:RC1) -> 9122856
A4272: =R[-1]C+1 -> 4272 | B4272: =SUM(R1C[-1]:RC1) -> 9127128
A4273: =R[-1]C+1 -> 4273 | B4273: =SUM(R1C[-1]:RC1) -> 9131401
A4274: =R[-1]C+1 -> 4274 | B4274: =SUM(R1C[-1]:RC1) -> 9135675
A4275: =R[-1]C+1 -> 4275 | B4275: =SUM(R1C[-1]:RC1) -> 9139950
A4276: =R[-1]C+1 -> 4276 | B4276: =SUM(R1C[-1]:RC1) -> 9144226
A4277: =R[-1]C+1 -> 4277 | B4277: =SUM(R1C[-1]:RC1) -> 9148503
A4278: =R[-1]C+1 -> 4278 | B4278: =SUM(R1C[-1]:RC1) -> 9152781
A4279: =R[-1]C+1 -> 4279 | B4279: =SUM(R1C[-1]:RC1) -> 9157060
A4280: =R[-1]C+1 -> 4280 | B4280: =SUM(R1C[-1]:RC1) -> 9161340
A4281: =R[-1]C+1 -> 4281 | B4281: =SUM(R1C[-1]:RC1) -> 9165621
A4282: =R[-1]C+1 -> 4282 | B4282: =SUM(R1C[-1]:RC1) -> 9169903
A4283: =R[-1]C+1 -> 4283 | B4283: =SUM(R1C[-1]:RC1) -> 9174186
A4284: =R[-1]C+1 -> 4284 | B4284: =SUM(R1C[-1]:RC1) -> 9178470
A4285: =R[-1]C+1 -> 4285 | B4285: =SUM(R1C[-1]:RC1) -> 9182755
A4286: =R[-1]C+1 -> 4286 | B4286: =SUM(R1C[-1]:RC1) -> 9187041
A4287: =R[-1]C+1 -> 4287 | B4287: =SUM(R1C[-1]:RC1) -> 9191328
A4288: =R[-1]C+1 -> 4288 | B4288: =SUM(R1C[-1]:RC1) -> 9195616
A4289: =R[-1]C+1 -> 4289 | B4289: =SUM(R1C[-1]:RC1) -> 9199905
A4290: =R[-1]C+1 -> 4290 | B4290: =SUM(R1C[-1]:RC1) -> 9204195
A4291: =R[-1]C+1 -> 4291 | B4291: =SUM(R1C[-1]:RC1) -> 9208486
A4292: =R[-1]C+1 -> 4292 | B4292: =SUM(R1C[-1]:RC1) -> 9212778
A4293: =R[-1]C+1 -> 4293 | B4293: =SUM(R1C[-1]:RC1) -> 9217071
A4294: =R[-1]C+1 -> 4294 | B4294: =SUM(R1C[-1]:RC1) -> 9221365
A4295: =R[-1]C+1 -> 4295 | B4295: =SUM(R1C[-1]:RC1) -> 9225660
A4296: =R[-1]C+1 -> 4296 | B4296: =SUM(R1C[-1]:RC1) -> 9229956
A4297: =R[-1]C+1 -> 4297 | B4297: =SUM(R1C[-1]:RC1) -> 9234253
A4298: =R[-1]C+1 -> 4298 | B4298: =SUM(R1C[-1]:RC1) -> 9238551
A4299: =R[-1]C+1 -> 4299 | B4299: =SUM(R1C[-1]:RC1) -> 9242850
A4300: =R[-1]C+1 -> 4300 | B4300: =SUM(R1C[-1]:RC1) -> 9247150
A4301: =R[-1]C+1 -> 4301 | B4301: =SUM(R1C[-1]:RC1) -> 9251451
A4302: =R[-1]C+1 -> 4302 | B4302: =SUM(R1C[-1]:RC1) -> 9255753
A4303: =R[-1]C+1 -> 4303 | B4303: =SUM(R1C[-1]:RC1) -> 9260056
A4304: =R[-1]C+1 -> 4304 | B4304: =SUM(R1C[-1]:RC1) -> 9264360
A4305: =R[-1]C+1 -> 4305 | B4305: =SUM(R1C[-1]:RC1) -> 9268665
A4306: =R[-1]C+1 -> 4306 | B4306: =SUM(R1C[-1]:RC1) -> 9272971
A4307: =R[-1]C+1 -> 4307 | B4307: =SUM(R1C[-1]:RC1) -> 9277278
A4308: =R[-1]C+1 -> 4308 | B4308: =SUM(R1C[-1]:RC1) -> 9281586
A4309: =R[-1]C+1 -> 4309 | B4309: =SUM(R1C[-1]:RC1) -> 9285895
A4310: =R[-1]C+1 -> 4310 | B4310: =SUM(R1C[-1]:RC1) -> 9290205
A4311: =R[-1]C+1 -> 4311 | B4311: =SUM(R1C[-1]:RC1) -> 9294516
A4312: =R[-1]C+1 -> 4312 | B4312: =SUM(R1C[-1]:RC1) -> 9298828
A4313: =R[-1]C+1 -> 4313 | B4313: =SUM(R1C[-1]:RC1) -> 9303141
A4314: =R[-1]C+1 -> 4314 | B4314: =SUM(R1C[-1]:RC1) -> 9307455
A4315: =R[-1]C+1 -> 4315 | B4315: =SUM(R1C[-1]:RC1) -> 9311770
A4316: =R[-1]C+1 -> 4316 | B4316: =SUM(R1C[-1]:RC1) -> 9316086
A4317: =R[-1]C+1 -> 4317 | B4317: =SUM(R1C[-1]:RC1) -> 9320403
A4318: =R[-1]C+1 -> 4318 | B4318: =SUM(R1C[-1]:RC1) -> 9324721
A4319: =R[-1]C+1 -> 4319 | B4319: =SUM(R1C[-1]:RC1) -> 9329040
A4320: =R[-1]C+1 -> 4320 | B4320: =SUM(R1C[-1]:RC1) -> 9333360
A4321: =R[-1]C+1 -> 4321 | B4321: =SUM(R1C[-1]:RC1) -> 9337681
A4322: =R[-1]C+1 -> 4322 | B4322: =SUM(R1C[-1]:RC1) -> 9342003
A4323: =R[-1]C+1 -> 4323 | B4323: =SUM(R1C[-1]:RC1) -> 9346326
A4324: =R[-1]C+1 -> 4324 | B4324: =SUM(R1C[-1]:RC1) -> 9350650
A4325: =R[-1]C+1 -> 4325 | B4325: =SUM(R1C[-1]:RC1) -> 9354975
A4326: =R[-1]C+1 -> 4326 | B4326: =SUM(R1C[-1]:RC1) -> 9359301
A4327: =R[-1]C+1 -> 4327 | B4327: =SUM(R1C[-1]:RC1) -> 9363628
A4328: =R[-1]C+1 -> 4328 | B4328: =SUM(R1C[-1]:RC1) -> 9367956
A4329: =R[-1]C+1 -> 4329 | B4329: =SUM(R1C[-1]:RC1) -> 9372285
A4330: =R[-1]C+1 -> 4330 | B4330: =SUM(R1C[-1]:RC1) -> 9376615
A4331: =R[-1]C+1 -> 4331 | B4331: =SUM(R1C[-1]:RC1) -> 9380946
A4332: =R[-1]C+1 -> 4332 | B4332: =SUM(R1C[-1]:RC1) -> 9385278
A4333: =R[-1]C+1 -> 4333 | B4333: =SUM(R1C[-1]:RC1) -> 9389611
A4334: =R[-1]C+1 -> 4334 | B4334: =SUM(R1C[-1]:RC1) -> 9393945
A4335: =R[-1]C+1 -> 4335 | B4335: =SUM(R1C[-1]:RC1) -> 9398280
A4336: =R[-1]C+1 -> 4336 | B4336: =SUM(R1C[-1]:RC1) -> 9402616
A4337: =R[-1]C+1 -> 4337 | B4337: =SUM(R1C[-1]:RC1) -> 9406953
A4338: =R[-1]C+1 -> 4338 | B4338: =SUM(R1C[-1]:RC1) -> 9411291
A4339: =R[-1]C+1 -> 4339 | B4339: =SUM(R1C[-1]:RC1) -> 9415630
A4340: =R[-1]C+1 -> 4340 | B4340: =SUM(R1C[-1]:RC1) -> 9419970
A4341: =R[-1]C+1 -> 4341 | B4341: =SUM(R1C[-1]:RC1) -> 9424311
A4342: =R[-1]C+1 -> 4342 | B4342: =SUM(R1C[-1]:RC1) -> 9428653
A4343: =R[-1]C+1 -> 4343 | B4343: =SUM(R1C[-1]:RC1) -> 9432996
A4344: =R[-1]C+1 -> 4344 | B4344: =SUM(R1C[-1]:RC1) -> 9437340
A4345: =R[-1]C+1 -> 4345 | B4345: =SUM(R1C[-1]:RC1) -> 9441685
A4346: =R[-1]C+1 -> 4346 | B4346: =SUM(R1C[-1]:RC1) -> 9446031
A4347: =R[-1]C+1 -> 4347 | B4347: =SUM(R1C[-1]:RC1) -> 9450378
A4348: =R[-1]C+1 -> 4348 | B4348: =SUM(R1C[-1]:RC1) -> 9454726
A4349: =R[-1]C+1 -> 4349 | B4349: =SUM(R1C[-1]:RC1) -> 9459075
A4350: =R[-1]C+1 -> 4350 | B4350: =SUM(R1C[-1]:RC1) -> 9463425
A4351: =R[-1]C+1 -> 4351 | B4351: =SUM(R1C[-1]:RC1) -> 9467776
A4352: =R[-1]C+1 -> 4352 | B4352: =SUM(R1C[-1]:RC1) -> 9472128
A4353: =R[-1]C+1 -> 4353 | B4353: =SUM(R1C[-1]:RC1) -> 9476481
A4354: =R[-1]C+1 -> 4354 | B4354: =SUM(R1C[-1]:RC1) -> 9480835
A4355: =R[-1]C+1 -> 4355 | B4355: =SUM(R1C[-1]:RC1) -> 9485190
A4356: =R[-1]C+1 -> 4356 | B4356: =SUM(R1C[-1]:RC1) -> 9489546
A4357: =R[-1]C+1 -> 4357 | B4357: =SUM(R1C[-1]:RC1) -> 9493903
A4358: =R[-1]C+1 -> 4358 | B4358: =SUM(R1C[-1]:RC1) -> 9498261
A4359: =R[-1]C+1 -> 4359 | B4359: =SUM(R1C[-1]:RC1) -> 9502620
A4360: =R[-1]C+1 -> 4360 | B4360: =SUM(R1C[-1]:RC1) -> 9506980
A4361: =R[-1]C+1 -> 4361 | B4361: =SUM(R1C[-1]:RC1) -> 9511341
A4362: =R[-1]C+1 -> 4362 | B4362: =SUM(R1C[-1]:RC1) -> 9515703
A4363: =R[-1]C+1 -> 4363 | B4363: =SUM(R1C[-1]:RC1) -> 9520066
A4364: =R[-1]C+1 -> 4364 | B4364: =SUM(R1C[-1]:RC1) -> 9524430
A4365: =R[-1]C+1 -> 4365 | B4365: =SUM(R1C[-1]:RC1) -> 9528795
A4366: =R[-1]C+1 -> 4366 | B4366: =SUM(R1C[-1]:RC1) -> 9533161
A4367: =R[-1]C+1 -> 4367 | B4367: =SUM(R1C[-1]:RC1) -> 9537528
A4368: =R[-1]C+1 -> 4368 | B4368: =SUM(R1C[-1]:RC1) -> 9541896
A4369: =R[-1]C+1 -> 4369 | B4369: =SUM(R1C[-1]:RC1) -> 9546265
A4370: =R[-1]C+1 -> 4370 | B4370: =SUM(R1C[-1]:RC1) -> 9550635
A4371: =R[-1]C+1 -> 4371 | B4371: =SUM(R1C[-1]:RC1) -> 9555006
A4372: =R[-1]C+1 -> 4372 | B4372: =SUM(R1C[-1]:RC1) -> 9559378
A4373: =R[-1]C+1 -> 4373 | B4373: =SUM(R1C[-1]:RC1) -> 9563751
A4374: =R[-1]C+1 -> 4374 | B4374: =SUM(R1C[-1]:RC1) -> 9568125
A4375: =R[-1]C+1 -> 4375 | B4375: =SUM(R1C[-1]:RC1) -> 9572500
A4376: =R[-1]C+1 -> 4376 | B4376: =SUM(R1C[-1]:RC1) -> 9576876
A4377: =R[-1]C+1 -> 4377 | B4377: =SUM(R1C[-1]:RC1) -> 9581253
A4378: =R[-1]C+1 -> 4378 | B4378: =SUM(R1C[-1]:RC1) -> 9585631
A4379: =R[-1]C+1 -> 4379 | B4379: =SUM(R1C[-1]:RC1) -> 9590010
A4380: =R[-1]C+1 -> 4380 | B4380: =SUM(R1C[-1]:RC1) -> 9594390
A4381: =R[-1]C+1 -> 4381 | B4381: =SUM(R1C[-1]:RC1) -> 9598771
A4382: =R[-1]C+1 -> 4382 | B4382: =SUM(R1C[-1]:RC1) -> 9603153
A4383: =R[-1]C+1 -> 4383 | B4383: =SUM(R1C[-1]:RC1) -> 9607536
A4384: =R[-1]C+1 -> 4384 | B4384: =SUM(R1C[-1]:RC1) -> 9611920
A4385: =R[-1]C+1 -> 4385 | B4385: =SUM(R1C[-1]:RC1) -> 9616305
A4386: =R[-1]C+1 -> 4386 | B4386: =SUM(R1C[-1]:RC1) -> 9620691
A4387: =R[-1]C+1 -> 4387 | B4387: =SUM(R1C[-1]:RC1) -> 9625078
A4388: =R[-1]C+1 -> 4388 | B4388: =SUM(R1C[-1]:RC1) -> 9629466
A4389: =R[-1]C+1 -> 4389 | B4389: =SUM(R1C[-1]:RC1) -> 9633855
A4390: =R[-1]C+1 -> 4390 | B4390: =SUM(R1C[-1]:RC1) -> 9638245
A4391: =R[-1]C+1 -> 4391 | B4391: =SUM(R1C[-1]:RC1) -> 9642636
A4392: =R[-1]C+1 -> 4392 | B4392: =SUM(R1C[-1]:RC1) -> 9647028
A4393: =R[-1]C+1 -> 4393 | B4393: =SUM(R1C[-1]:RC1) -> 9651421
A4394: =R[-1]C+1 -> 4394 | B4394: =SUM(R1C[-1]:RC1) -> 9655815
A4395: =R[-1]C+1 -> 4395 | B4395: =SUM(R1C[-1]:RC1) -> 9660210
A4396: =R[-1]C+1 -> 4396 | B4396: =SUM(R1C[-1]:RC1) -> 9664606
A4397: =R[-1]C+1 -> 4397 | B4397: =SUM(R1C[-1]:RC1) -> 9669003
A4398: =R[-1]C+1 -> 4398 | B4398: =SUM(R1C[-1]:RC1) -> 9673401
A4399: =R[-1]C+1 -> 4399 | B4399: =SUM(R1C[-1]:RC1) -> 9677800
A4400: =R[-1]C+1 -> 4400 | B4400: =SUM(R1C[-1]:RC1) -> 9682200
A4401: =R[-1]C+1 -> 4401 | B4401: =SUM(R1C[-1]:RC1) -> 9686601
A4402: =R[-1]C+1 -> 4402 | B4402: =SUM(R1C[-1]:RC1) -> 9691003
A4403: =R[-1]C+1 -> 4403 | B4403: =SUM(R1C[-1]:RC1) -> 9695406
A4404: =R[-1]C+1 -> 4404 | B4404: =SUM(R1C[-1]:RC1) -> 9699810
A4405: =R[-1]C+1 -> 4405 | B4405: =SUM(R1C[-1]:RC1) -> 9704215
A4406: =R[-1]C+1 -> 4406 | B4406: =SUM(R1C[-1]:RC1) -> 9708621
A4407: =R[-1]C+1 -> 4407 | B4407: =SUM(R1C[-1]:RC1) -> 9713028
A4408: =R[-1]C+1 -> 4408 | B4408: =SUM(R1C[-1]:RC1) -> 9717436
A4409: =R[-1]C+1 -> 4409 | B4409: =SUM(R1C[-1]:RC1) -> 9721845
A4410: =R[-1]C+1 -> 4410 | B4410: =SUM(R1C[-1]:RC1) -> 9726255
A4411: =R[-1]C+1 -> 4411 | B4411: =SUM(R1C[-1]:RC1) -> 9730666
A4412: =R[-1]C+1 -> 4412 | B4412: =SUM(R1C[-1]:RC1) -> 9735078
A4413: =R[-1]C+1 -> 4413 | B4413: =SUM(R1C[-1]:RC1) -> 9739491
A4414: =R[-1]C+1 -> 4414 | B4414: =SUM(R1C[-1]:RC1) -> 9743905
A4415: =R[-1]C+1 -> 4415 | B4415: =SUM(R1C[-1]:RC1) -> 9748320
A4416: =R[-1]C+1 -> 4416 | B4416: =SUM(R1C[-1]:RC1) -> 9752736
A4417: =R[-1]C+1 -> 4417 | B4417: =SUM(R1C[-1]:RC1) -> 9757153
A4418: =R[-1]C+1 -> 4418 | B4418: =SUM(R1C[-1]:RC1) -> 9761571
A4419: =R[-1]C+1 -> 4419 | B4419: =SUM(R1C[-1]:RC1) -> 9765990
A4420: =R[-1]C+1 -> 4420 | B4420: =SUM(R1C[-1]:RC1) -> 9770410
A4421: =R[-1]C+1 -> 4421 | B4421: =SUM(R1C[-1]:RC1) -> 9774831
A4422: =R[-1]C+1 -> 4422 | B4422: =SUM(R1C[-1]:RC1) -> 9779253
A4423: =R[-1]C+1 -> 4423 | B4423: =SUM(R1C[-1]:RC1) -> 9783676
A4424: =R[-1]C+1 -> 4424 | B4424: =SUM(R1C[-1]:RC1) -> 9788100
A4425: =R[-1]C+1 -> 4425 | B4425: =SUM(R1C[-1]:RC1) -> 9792525
A4426: =R[-1]C+1 -> 4426 | B4426: =SUM(R1C[-1]:RC1) -> 9796951
A4427: =R[-1]C+1 -> 4427 | B4427: =SUM(R1C[-1]:RC1) -> 9801378
A4428: =R[-1]C+1 -> 4428 | B4428: =SUM(R1C[-1]:RC1) -> 9805806
A4429: =R[-1]C+1 -> 4429 | B4429: =SUM(R1C[-1]:RC1) -> 9810235
A4430: =R[-1]C+1 -> 4430 | B4430: =SUM(R1C[-1]:RC1) -> 9814665
A4431: =R[-1]C+1 -> 4431 | B4431: =SUM(R1C[-1]:RC1) -> 9819096
A4432: =R[-1]C+1 -> 4432 | B4432: =SUM(R1C[-1]:RC1) -> 9823528
A4433: =R[-1]C+1 -> 4433 | B4433: =SUM(R1C[-1]:RC1) -> 9827961
A4434: =R[-1]C+1 -> 4434 | B4434: =SUM(R1C[-1]:RC1) -> 9832395
A4435: =R[-1]C+1 -> 4435 | B4435: =SUM(R1C[-1]:RC1) -> 9836830
A4436: =R[-1]C+1 -> 4436 | B4436: =SUM(R1C[-1]:RC1) -> 9841266
A4437: =R[-1]C+1 -> 4437 | B4437: =SUM(R1C[-1]:RC1) -> 9845703
A4438: =R[-1]C+1 -> 4438 | B4438: =SUM(R1C[-1]:RC1) -> 9850141
A4439: =R[-1]C+1 -> 4439 | B4439: =SUM(R1C[-1]:RC1) -> 9854580
A4440: =R[-1]C+1 -> 4440 | B4440: =SUM(R1C[-1]:RC1) -> 9859020
A4441: =R[-1]C+1 -> 4441 | B4441: =SUM(R1C[-1]:RC1) -> 9863461
A4442: =R[-1]C+1 -> 4442 | B4442: =SUM(R1C[-1]:RC1) -> 9867903
A4443: =R[-1]C+1 -> 4443 | B4443: =SUM(R1C[-1]:RC1) -> 9872346
A4444: =R[-1]C+1 -> 4444 | B4444: =SUM(R1C[-1]:RC1) -> 9876790
A4445: =R[-1]C+1 -> 4445 | B4445: =SUM(R1C[-1]:RC1) -> 9881235
A4446: =R[-1]C+1 -> 4446 | B4446: =SUM(R1C[-1]:RC1) -> 9885681
A4447: =R[-1]C+1 -> 4447 | B4447: =SUM(R1C[-1]:RC1) -> 9890128
A4448: =R[-1]C+1 -> 4448 | B4448: =SUM(R1C[-1]:RC1) -> 9894576
A4449: =R[-1]C+1 -> 4449 | B4449: =SUM(R1C[-1]:RC1) -> 9899025
A4450: =R[-1]C+1 -> 4450 | B4450: =SUM(R1C[-1]:RC1) -> 9903475
A4451: =R[-1]C+1 -> 4451 | B4451: =SUM(R1C[-1]:RC1) -> 9907926
A4452: =R[-1]C+1 -> 4452 | B4452: =SUM(R1C[-1]:RC1) -> 9912378
A4453: =R[-1]C+1 -> 4453 | B4453: =SUM(R1C[-1]:RC1) -> 9916831
A4454: =R[-1]C+1 -> 4454 | B4454: =SUM(R1C[-1]:RC1) -> 9921285
A4455: =R[-1]C+1 -> 4455 | B4455: =SUM(R1C[-1]:RC1) -> 9925740
A4456: =R[-1]C+1 -> 4456 | B4456: =SUM(R1C[-1]:RC1) -> 9930196
A4457: =R[-1]C+1 -> 4457 | B4457: =SUM(R1C[-1]:RC1) -> 9934653
A4458: =R[-1]C+1 -> 4458 | B4458: =SUM(R1C[-1]:RC1) -> 9939111
A4459: =R[-1]C+1 -> 4459 | B4459: =SUM(R1C[-1]:RC1) -> 9943570
A4460: =R[-1]C+1 -> 4460 | B4460: =SUM(R1C[-1]:RC1) -> 9948030
A4461: =R[-1]C+1 -> 4461 | B4461: =SUM(R1C[-1]:RC1) -> 9952491
A4462: =R[-1]C+1 -> 4462 | B4462: =SUM(R1C[-1]:RC1) -> 9956953
A4463: =R[-1]C+1 -> 4463 | B4463: =SUM(R1C[-1]:RC1) -> 9961416
A4464: =R[-1]C+1 -> 4464 | B4464: =SUM(R1C[-1]:RC1) -> 9965880
A4465: =R[-1]C+1 -> 4465 | B4465: =SUM(R1C[-1]:RC1) -> 9970345
A4466: =R[-1]C+1 -> 4466 | B4466: =SUM(R1C[-1]:RC1) -> 9974811
A4467: =R[-1]C+1 -> 4467 | B4467: =SUM(R1C[-1]:RC1) -> 9979278
A4468: =R[-1]C+1 -> 4468 | B4468: =SUM(R1C[-1]:RC1) -> 9983746
A4469: =R[-1]C+1 -> 4469 | B4469: =SUM(R1C[-1]:RC1) -> 9988215
A4470: =R[-1]C+1 -> 4470 | B4470: =SUM(R1C[-1]:RC1) -> 9992685
A4471: =R[-1]C+1 -> 4471 | B4471: =SUM(R1C[-1]:RC1) -> 9997156
A4472: =R[-1]C+1 -> 4472 | B4472: =SUM(R1C[-1]:RC1) -> 10001628
A4473: =R[-1]C+1 -> 4473 | B4473: =SUM(R1C[-1]:RC1) -> 10006101
A4474: =R[-1]C+1 -> 4474 | B4474: =SUM(R1C[-1]:RC1) -> 10010575
A4475: =R[-1]C+1 -> 4475 | B4475: =SUM(R1C[-1]:RC1) -> 10015050
A4476: =R[-1]C+1 -> 4476 | B4476: =SUM(R1C[-1]:RC1) -> 10019526
A4477: =R[-1]C+1 -> 4477 | B4477: =SUM(R1C[-1]:RC1) -> 10024003
A4478: =R[-1]C+1 -> 4478 | B4478: =SUM(R1C[-1]:RC1) -> 10028481
A4479: =R[-1]C+1 -> 4479 | B4479: =SUM(R1C[-1]:RC1) -> 10032960
A4480: =R[-1]C+1 -> 4480 | B4480: =SUM(R1C[-1]:RC1) -> 10037440
A4481: =R[-1]C+1 -> 4481 | B4481: =SUM(R1C[-1]:RC1) -> 10041921
A4482: =R[-1]C+1 -> 4482 | B4482: =SUM(R1C[-1]:RC1) -> 10046403
A4483: =R[-1]C+1 -> 4483 | B4483: =SUM(R1C[-1]:RC1) -> 10050886
A4484: =R[-1]C+1 -> 4484 | B4484: =SUM(R1C[-1]:RC1) -> 10055370
A4485: =R[-1]C+1 -> 4485 | B4485: =SUM(R1C[-1]:RC1) -> 10059855
A4486: =R[-1]C+1 -> 4486 | B4486: =SUM(R1C[-1]:RC1) -> 10064341
A4487: =R[-1]C+1 -> 4487 | B4487: =SUM(R1C[-1]:RC1) -> 10068828
A4488: =R[-1]C+1 -> 4488 | B4488: =SUM(R1C[-1]:RC1) -> 10073316
A4489: =R[-1]C+1 -> 4489 | B4489: =SUM(R1C[-1]:RC1) -> 10077805
A4490: =R[-1]C+1 -> 4490 | B4490: =SUM(R1C[-1]:RC1) -> 10082295
A4491: =R[-1]C+1 -> 4491 | B4491: =SUM(R1C[-1]:RC1) -> 10086786
A4492: =R[-1]C+1 -> 4492 | B4492: =SUM(R1C[-1]:RC1) -> 10091278
A4493: =R[-1]C+1 -> 4493 | B4493: =SUM(R1C[-1]:RC1) -> 10095771
A4494: =R[-1]C+1 -> 4494 | B4494: =SUM(R1C[-1]:RC1) -> 10100265
A4495: =R[-1]C+1 -> 4495 | B4495: =SUM(R1C[-1]:RC1) -> 10104760
A4496: =R[-1]C+1 -> 4496 | B4496: =SUM(R1C[-1]:RC1) -> 10109256
A4497: =R[-1]C+1 -> 4497 | B4497: =SUM(R1C[-1]:RC1) -> 10113753
A4498: =R[-1]C+1 -> 4498 | B4498: =SUM(R1C[-1]:RC1) -> 10118251
A4499: =R[-1]C+1 -> 4499 | B4499: =SUM(R1C[-1]:RC1) -> 10122750
A4500: =R[-1]C+1 -> 4500 | B4500: =SUM(R1C[-1]:RC1) -> 10127250
A4501: =R[-1]C+1 -> 4501 | B4501: =SUM(R1C[-1]:RC1) -> 10131751
A4502: =R[-1]C+1 -> 4502 | B4502: =SUM(R1C[-1]:RC1) -> 10136253
A4503: =R[-1]C+1 -> 4503 | B4503: =SUM(R1C[-1]:RC1) -> 10140756
A4504: =R[-1]C+1 -> 4504 | B4504: =SUM(R1C[-1]:RC1) -> 10145260
A4505: =R[-1]C+1 -> 4505 | B4505: =SUM(R1C[-1]:RC1) -> 10149765
A4506: =R[-1]C+1 -> 4506 | B4506: =SUM(R1C[-1]:RC1) -> 10154271
A4507: =R[-1]C+1 -> 4507 | B4507: =SUM(R1C[-1]:RC1) -> 10158778
A4508: =R[-1]C+1 -> 4508 | B4508: =SUM(R1C[-1]:RC1) -> 10163286
A4509: =R[-1]C+1 -> 4509 | B4509: =SUM(R1C[-1]:RC1) -> 10167795
A4510: =R[-1]C+1 -> 4510 | B4510: =SUM(R1C[-1]:RC1) -> 10172305
A4511: =R[-1]C+1 -> 4511 | B4511: =SUM(R1C[-1]:RC1) -> 10176816
A4512: =R[-1]C+1 -> 4512 | B4512: =SUM(R1C[-1]:RC1) -> 10181328
A4513: =R[-1]C+1 -> 4513 | B4513: =SUM(R1C[-1]:RC1) -> 10185841
A4514: =R[-1]C+1 -> 4514 | B4514: =SUM(R1C[-1]:RC1) -> 10190355
A4515: =R[-1]C+1 -> 4515 | B4515: =SUM(R1C[-1]:RC1) -> 10194870
A4516: =R[-1]C+1 -> 4516 | B4516: =SUM(R1C[-1]:RC1) -> 10199386
A4517: =R[-1]C+1 -> 4517 | B4517: =SUM(R1C[-1]:RC1) -> 10203903
A4518: =R[-1]C+1 -> 4518 | B4518: =SUM(R1C[-1]:RC1) -> 10208421
A4519: =R[-1]C+1 -> 4519 | B4519: =SUM(R1C[-1]:RC1) -> 10212940
A4520: =R[-1]C+1 -> 4520 | B4520: =SUM(R1C[-1]:RC1) -> 10217460
A4521: =R[-1]C+1 -> 4521 | B4521: =SUM(R1C[-1]:RC1) -> 10221981
A4522: =R[-1]C+1 -> 4522 | B4522: =SUM(R1C[-1]:RC1) -> 10226503
A4523: =R[-1]C+1 -> 4523 | B4523: =SUM(R1C[-1]:RC1) -> 10231026
A4524: =R[-1]C+1 -> 4524 | B4524: =SUM(R1C[-1]:RC1) -> 10235550
A4525: =R[-1]C+1 -> 4525 | B4525: =SUM(R1C[-1]:RC1) -> 10240075
A4526: =R[-1]C+1 -> 4526 | B4526: =SUM(R1C[-1]:RC1) -> 10244601
A4527: =R[-1]C+1 -> 4527 | B4527: =SUM(R1C[-1]:RC1) -> 10249128
A4528: =R[-1]C+1 -> 4528 | B4528: =SUM(R1C[-1]:RC1) -> 10253656
A4529: =R[-1]C+1 -> 4529 | B4529: =SUM(R1C[-1]:RC1) -> 10258185
A4530: =R[-1]C+1 -> 4530 | B4530: =SUM(R1C[-1]:RC1) -> 10262715
A4531: =R[-1]C+1 -> 4531 | B4531: =SUM(R1C[-1]:RC1) -> 10267246
A4532: =R[-1]C+1 -> 4532 | B4532: =SUM(R1C[-1]:RC1) -> 10271778
A4533: =R[-1]C+1 -> 4533 | B4533: =SUM(R1C[-1]:RC1) -> 10276311
A4534: =R[-1]C+1 -> 4534 | B4534: =SUM(R1C[-1]:RC1) -> 10280845
A4535: =R[-1]C+1 -> 4535 | B4535: =SUM(R1C[-1]:RC1) -> 10285380
A4536: =R[-1]C+1 -> 4536 | B4536: =SUM(R1C[-1]:RC1) -> 10289916
A4537: =R[-1]C+1 -> 4537 | B4537: =SUM(R1C[-1]:RC1) -> 10294453
A4538: =R[-1]C+1 -> 4538 | B4538: =SUM(R1C[-1]:RC1) -> 10298991
A4539: =R[-1]C+1 -> 4539 | B4539: =SUM(R1C[-1]:RC1) -> 10303530
A4540: =R[-1]C+1 -> 4540 | B4540: =SUM(R1C[-1]:RC1) -> 10308070
A4541: =R[-1]C+1 -> 4541 | B4541: =SUM(R1C[-1]:RC1) -> 10312611
A4542: =R[-1]C+1 -> 4542 | B4542: =SUM(R1C[-1]:RC1) -> 10317153
A4543: =R[-1]C+1 -> 4543 | B4543: =SUM(R1C[-1]:RC1) -> 10321696
A4544: =R[-1]C+1 -> 4544 | B4544: =SUM(R1C[-1]:RC1) -> 10326240
A4545: =R[-1]C+1 -> 4545 | B4545: =SUM(R1C[-1]:RC1) -> 10330785
A4546: =R[-1]C+1 -> 4546 | B4546: =SUM(R1C[-1]:RC1) -> 10335331
A4547: =R[-1]C+1 -> 4547 | B4547: =SUM(R1C[-1]:RC1) -> 10339878
A4548: =R[-1]C+1 -> 4548 | B4548: =SUM(R1C[-1]:RC1) -> 10344426
A4549: =R[-1]C+1 -> 4549 | B4549: =SUM(R1C[-1]:RC1) -> 10348975
A4550: =R[-1]C+1 -> 4550 | B4550: =SUM(R1C[-1]:RC1) -> 10353525
A4551: =R[-1]C+1 -> 4551 | B4551: =SUM(R1C[-1]:RC1) -> 10358076
A4552: =R[-1]C+1 -> 4552 | B4552: =SUM(R1C[-1]:RC1) -> 10362628
A4553: =R[-1]C+1 -> 4553 | B4553: =SUM(R1C[-1]:RC1) -> 10367181
A4554: =R[-1]C+1 -> 4554 | B4554: =SUM(R1C[-1]:RC1) -> 10371735
A4555: =R[-1]C+1 -> 4555 | B4555: =SUM(R1C[-1]:RC1) -> 10376290
A4556: =R[-1]C+1 -> 4556 | B4556: =SUM(R1C[-1]:RC1) -> 10380846
A4557: =R[-1]C+1 -> 4557 | B4557: =SUM(R1C[-1]:RC1) -> 10385403
A4558: =R[-1]C+1 -> 4558 | B4558: =SUM(R1C[-1]:RC1) -> 10389961
A4559: =R[-1]C+1 -> 4559 | B4559: =SUM(R1C[-1]:RC1) -> 10394520
A4560: =R[-1]C+1 -> 4560 | B4560: =SUM(R1C[-1]:RC1) -> 10399080
A4561: =R[-1]C+1 -> 4561 | B4561: =SUM(R1C[-1]:RC1) -> 10403641
A4562: =R[-1]C+1 -> 4562 | B4562: =SUM(R1C[-1]:RC1) -> 10408203
A4563: =R[-1]C+1 -> 4563 | B4563: =SUM(R1C[-1]:RC1) -> 10412766
A4564: =R[-1]C+1 -> 4564 | B4564: =SUM(R1C[-1]:RC1) -> 10417330
A4565: =R[-1]C+1 -> 4565 | B4565: =SUM(R1C[-1]:RC1) -> 10421895
A4566: =R[-1]C+1 -> 4566 | B4566: =SUM(R1C[-1]:RC1) -> 10426461
A4567: =R[-1]C+1 -> 4567 | B4567: =SUM(R1C[-1]:RC1) -> 10431028
A4568: =R[-1]C+1 -> 4568 | B4568: =SUM(R1C[-1]:RC1) -> 10435596
A4569: =R[-1]C+1 -> 4569 | B4569: =SUM(R1C[-1]:RC1) -> 10440165
A4570: =R[-1]C+1 -> 4570 | B4570: =SUM(R1C[-1]:RC1) -> 10444735
A4571: =R[-1]C+1 -> 4571 | B4571: =SUM(R1C[-1]:RC1) -> 10449306
A4572: =R[-1]C+1 -> 4572 | B4572: =SUM(R1C[-1]:RC1) -> 10453878
A4573: =R[-1]C+1 -> 4573 | B4573: =SUM(R1C[-1]:RC1) -> 10458451
A4574: =R[-1]C+1 -> 4574 | B4574: =SUM(R1C[-1]:RC1) -> 10463025
A4575: =R[-1]C+1 -> 4575 | B4575: =SUM(R1C[-1]:RC1) -> 10467600
A4576: =R[-1]C+1 -> 4576 | B4576: =SUM(R1C[-1]:RC1) -> 10472176
A4577: =R[-1]C+1 -> 4577 | B4577: =SUM(R1C[-1]:RC1) -> 10476753
A4578: =R[-1]C+1 -> 4578 | B4578: =SUM(R1C[-1]:RC1) -> 10481331
A4579: =R[-1]C+1 -> 4579 | B4579: =SUM(R1C[-1]:RC1) -> 10485910
A4580: =R[-1]C+1 -> 4580 | B4580: =SUM(R1C[-1]:RC1) -> 10490490
A4581: =R[-1]C+1 -> 4581 | B4581: =SUM(R1C[-1]:RC1) -> 10495071
A4582: =R[-1]C+1 -> 4582 | B4582: =SUM(R1C[-1]:RC1) -> 10499653
A4583: =R[-1]C+1 -> 4583 | B4583: =SUM(R1C[-1]:RC1) -> 10504236
A4584: =R[-1]C+1 -> 4584 | B4584: =SUM(R1C[-1]:RC1) -> 10508820
A4585: =R[-1]C+1 -> 4585 | B4585: =SUM(R1C[-1]:RC1) -> 10513405
A4586: =R[-1]C+1 -> 4586 | B4586: =SUM(R1C[-1]:RC1) -> 10517991
A4587: =R[-1]C+1 -> 4587 | B4587: =SUM(R1C[-1]:RC1) -> 10522578
A4588: =R[-1]C+1 -> 4588 | B4588: =SUM(R1C[-1]:RC1) -> 10527166
A4589: =R[-1]C+1 -> 4589 | B4589: =SUM(R1C[-1]:RC1) -> 10531755
A4590: =R[-1]C+1 -> 4590 | B4590: =SUM(R1C[-1]:RC1) -> 10536345
A4591: =R[-1]C+1 -> 4591 | B4591: =SUM(R1C[-1]:RC1) -> 10540936
A4592: =R[-1]C+1 -> 4592 | B4592: =SUM(R1C[-1]:RC1) -> 10545528
A4593: =R[-1]C+1 -> 4593 | B4593: =SUM(R1C[-1]:RC1) -> 10550121
A4594: =R[-1]C+1 -> 4594 | B4594: =SUM(R1C[-1]:RC1) -> 10554715
A4595: =R[-1]C+1 -> 4595 | B4595: =SUM(R1C[-1]:RC1) -> 10559310
A4596: =R[-1]C+1 -> 4596 | B4596: =SUM(R1C[-1]:RC1) -> 10563906
A4597: =R[-1]C+1 -> 4597 | B4597: =SUM(R1C[-1]:RC1) -> 10568503
A4598: =R[-1]C+1 -> 4598 | B4598: =SUM(R1C[-1]:RC1) -> 10573101
A4599: =R[-1]C+1 -> 4599 | B4599: =SUM(R1C[-1]:RC1) -> 10577700
A4600: =R[-1]C+1 -> 4600 | B4600: =SUM(R1C[-1]:RC1) -> 10582300
A4601: =R[-1]C+1 -> 4601 | B4601: =SUM(R1C[-1]:RC1) -> 10586901
A4602: =R[-1]C+1 -> 4602 | B4602: =SUM(R1C[-1]:RC1) -> 10591503
A4603: =R[-1]C+1 -> 4603 | B4603: =SUM(R1C[-1]:RC1) -> 10596106
A4604: =R[-1]C+1 -> 4604 | B4604: =SUM(R1C[-1]:RC1) -> 10600710
A4605: =R[-1]C+1 -> 4605 | B4605: =SUM(R1C[-1]:RC1) -> 10605315
A4606: =R[-1]C+1 -> 4606 | B4606: =SUM(R1C[-1]:RC1) -> 10609921
A4607: =R[-1]C+1 -> 4607 | B4607: =SUM(R1C[-1]:RC1) -> 10614528
A4608: =R[-1]C+1 -> 4608 | B4608: =SUM(R1C[-1]:RC1) -> 10619136
A4609: =R[-1]C+1 -> 4609 | B4609: =SUM(R1C[-1]:RC1) -> 10623745
A4610: =R[-1]C+1 -> 4610 | B4610: =SUM(R1C[-1]:RC1) -> 10628355
A4611: =R[-1]C+1 -> 4611 | B4611: =SUM(R1C[-1]:RC1) -> 10632966
A4612: =R[-1]C+1 -> 4612 | B4612: =SUM(R1C[-1]:RC1) -> 10637578
A4613: =R[-1]C+1 -> 4613 | B4613: =SUM(R1C[-1]:RC1) -> 10642191
A4614: =R[-1]C+1 -> 4614 | B4614: =SUM(R1C[-1]:RC1) -> 10646805
A4615: =R[-1]C+1 -> 4615 | B4615: =SUM(R1C[-1]:RC1) -> 10651420
A4616: =R[-1]C+1 -> 4616 | B4616: =SUM(R1C[-1]:RC1) -> 10656036
A4617: =R[-1]C+1 -> 4617 | B4617: =SUM(R1C[-1]:RC1) -> 10660653
A4618: =R[-1]C+1 -> 4618 | B4618: =SUM(R1C[-1]:RC1) -> 10665271
A4619: =R[-1]C+1 -> 4619 | B4619: =SUM(R1C[-1]:RC1) -> 10669890
A4620: =R[-1]C+1 -> 4620 | B4620: =SUM(R1C[-1]:RC1) -> 10674510
A4621: =R[-1]C+1 -> 4621 | B4621: =SUM(R1C[-1]:RC1) -> 10679131
A4622: =R[-1]C+1 -> 4622 | B4622: =SUM(R1C[-1]:RC1) -> 10683753
A4623: =R[-1]C+1 -> 4623 | B4623: =SUM(R1C[-1]:RC1) -> 10688376
A4624: =R[-1]C+1 -> 4624 | B4624: =SUM(R1C[-1]:RC1) -> 10693000
A4625: =R[-1]C+1 -> 4625 | B4625: =SUM(R1C[-1]:RC1) -> 10697625
A4626: =R[-1]C+1 -> 4626 | B4626: =SUM(R1C[-1]:RC1) -> 10702251
A4627: =R[-1]C+1 -> 4627 | B4627: =SUM(R1C[-1]:RC1) -> 10706878
A4628: =R[-1]C+1 -> 4628 | B4628: =SUM(R1C[-1]:RC1) -> 10711506
A4629: =R[-1]C+1 -> 4629 | B4629: =SUM(R1C[-1]:RC1) -> 10716135
A4630: =R[-1]C+1 -> 4630 | B4630: =SUM(R1C[-1]:RC1) -> 10720765
A4631: =R[-1]C+1 -> 4631 | B4631: =SUM(R1C[-1]:RC1) -> 10725396
A4632: =R[-1]C+1 -> 4632 | B4632: =SUM(R1C[-1]:RC1) -> 10730028
A4633: =R[-1]C+1 -> 4633 | B4633: =SUM(R1C[-1]:RC1) -> 10734661
A4634: =R[-1]C+1 -> 4634 | B4634: =SUM(R1C[-1]:RC1) -> 10739295
A4635: =R[-1]C+1 -> 4635 | B4635: =SUM(R1C[-1]:RC1) -> 10743930
A4636: =R[-1]C+1 -> 4636 | B4636: =SUM(R1C[-1]:RC1) -> 10748566
A4637: =R[-1]C+1 -> 4637 | B4637: =SUM(R1C[-1]:RC1) -> 10753203
A4638: =R[-1]C+1 -> 4638 | B4638: =SUM(R1C[-1]:RC1) -> 10757841
A4639: =R[-1]C+1 -> 4639 | B4639: =SUM(R1C[-1]:RC1) -> 10762480
A4640: =R[-1]C+1 -> 4640 | B4640: =SUM(R1C[-1]:RC1) -> 10767120
A4641: =R[-1]C+1 -> 4641 | B4641: =SUM(R1C[-1]:RC1) -> 10771761
A4642: =R[-1]C+1 -> 4642 | B4642: =SUM(R1C[-1]:RC1) -> 10776403
A4643: =R[-1]C+1 -> 4643 | B4643: =SUM(R1C[-1]:RC1) -> 10781046
A4644: =R[-1]C+1 -> 4644 | B4644: =SUM(R1C[-1]:RC1) -> 10785690
A4645: =R[-1]C+1 -> 4645 | B4645: =SUM(R1C[-1]:RC1) -> 10790335
A4646: =R[-1]C+1 -> 4646 | B4646: =SUM(R1C[-1]:RC1) -> 10794981
A4647: =R[-1]C+1 -> 4647 | B4647: =SUM(R1C[-1]:RC1) -> 10799628
A4648: =R[-1]C+1 -> 4648 | B4648: =SUM(R1C[-1]:RC1) -> 10804276
A4649: =R[-1]C+1 -> 4649 | B4649: =SUM(R1C[-1]:RC1) -> 10808925
A4650: =R[-1]C+1 -> 4650 | B4650: =SUM(R1C[-1]:RC1) -> 10813575
A4651: =R[-1]C+1 -> 4651 | B4651: =SUM(R1C[-1]:RC1) -> 10818226
A4652: =R[-1]C+1 -> 4652 | B4652: =SUM(R1C[-1]:RC1) -> 10822878
A4653: =R[-1]C+1 -> 4653 | B4653: =SUM(R1C[-1]:RC1) -> 10827531
A4654: =R[-1]C+1 -> 4654 | B4654: =SUM(R1C[-1]:RC1) -> 10832185
A4655: =R[-1]C+1 -> 4655 | B4655: =SUM(R1C[-1]:RC1) -> 10836840
A4656: =R[-1]C+1 -> 4656 | B4656: =SUM(R1C[-1]:RC1) -> 10841496
A4657: =R[-1]C+1 -> 4657 | B4657: =SUM(R1C[-1]:RC1) -> 10846153
A4658: =R[-1]C+1 -> 4658 | B4658: =SUM(R1C[-1]:RC1) -> 10850811
A4659: =R[-1]C+1 -> 4659 | B4659: =SUM(R1C[-1]:RC1) -> 10855470
A4660: =R[-1]C+1 -> 4660 | B4660: =SUM(R1C[-1]:RC1) -> 10860130
A4661: =R[-1]C+1 -> 4661 | B4661: =SUM(R1C[-1]:RC1) -> 10864791
A4662: =R[-1]C+1 -> 4662 | B4662: =SUM(R1C[-1]:RC1) -> 10869453
A4663: =R[-1]C+1 -> 4663 | B4663: =SUM(R1C[-1]:RC1) -> 10874116
A4664: =R[-1]C+1 -> 4664 | B4664: =SUM(R1C[-1]:RC1) -> 10878780
A4665: =R[-1]C+1 -> 4665 | B4665: =SUM(R1C[-1]:RC1) -> 10883445
A4666: =R[-1]C+1 -> 4666 | B4666: =SUM(R1C[-1]:RC1) -> 10888111
A4667: =R[-1]C+1 -> 4667 | B4667: =SUM(R1C[-1]:RC1) -> 10892778
A4668: =R[-1]C+1 -> 4668 | B4668: =SUM(R1C[-1]:RC1) -> 10897446
A4669: =R[-1]C+1 -> 4669 | B4669: =SUM(R1C[-1]:RC1) -> 10902115
A4670: =R[-1]C+1 -> 4670 | B4670: =SUM(R1C[-1]:RC1) -> 10906785
A4671: =R[-1]C+1 -> 4671 | B4671: =SUM(R1C[-1]:RC1) -> 10911456
A4672: =R[-1]C+1 -> 4672 | B4672: =SUM(R1C[-1]:RC1) -> 10916128
A4673: =R[-1]C+1 -> 4673 | B4673: =SUM(R1C[-1]:RC1) -> 10920801
A4674: =R[-1]C+1 -> 4674 | B4674: =SUM(R1C[-1]:RC1) -> 10925475
A4675: =R[-1]C+1 -> 4675 | B4675: =SUM(R1C[-1]:RC1) -> 10930150
A4676: =R[-1]C+1 -> 4676 | B4676: =SUM(R1C[-1]:RC1) -> 10934826
A4677: =R[-1]C+1 -> 4677 | B4677: =SUM(R1C[-1]:RC1) -> 10939503
A4678: =R[-1]C+1 -> 4678 | B4678: =SUM(R1C[-1]:RC1) -> 10944181
A4679: =R[-1]C+1 -> 4679 | B4679: =SUM(R1C[-1]:RC1) -> 10948860
A4680: =R[-1]C+1 -> 4680 | B4680: =SUM(R1C[-1]:RC1) -> 10953540
A4681: =R[-1]C+1 -> 4681 | B4681: =SUM(R1C[-1]:RC1) -> 10958221
A4682: =R[-1]C+1 -> 4682 | B4682: =SUM(R1C[-1]:RC1) -> 10962903
A4683: =R[-1]C+1 -> 4683 | B4683: =SUM(R1C[-1]:RC1) -> 10967586
A4684: =R[-1]C+1 -> 4684 | B4684: =SUM(R1C[-1]:RC1) -> 10972270
A4685: =R[-1]C+1 -> 4685 | B4685: =SUM(R1C[-1]:RC1) -> 10976955
A4686: =R[-1]C+1 -> 4686 | B4686: =SUM(R1C[-1]:RC1) -> 10981641
A4687: =R[-1]C+1 -> 4687 | B4687: =SUM(R1C[-1]:RC1) -> 10986328
A4688: =R[-1]C+1 -> 4688 | B4688: =SUM(R1C[-1]:RC1) -> 10991016
A4689: =R[-1]C+1 -> 4689 | B4689: =SUM(R1C[-1]:RC1) -> 10995705
A4690: =R[-1]C+1 -> 4690 | B4690: =SUM(R1C[-1]:RC1) -> 11000395
A4691: =R[-1]C+1 -> 4691 | B4691: =SUM(R1C[-1]:RC1) -> 11005086
A4692: =R[-1]C+1 -> 4692 | B4692: =SUM(R1C[-1]:RC1) -> 11009778
A4693: =R[-1]C+1 -> 4693 | B4693: =SUM(R1C[-1]:RC1) -> 11014471
A4694: =R[-1]C+1 -> 4694 | B4694: =SUM(R1C[-1]:RC1) -> 11019165
A4695: =R[-1]C+1 -> 4695 | B4695: =SUM(R1C[-1]:RC1) -> 11023860
A4696: =R[-1]C+1 -> 4696 | B4696: =SUM(R1C[-1]:RC1) -> 11028556
A4697: =R[-1]C+1 -> 4697 | B4697: =SUM(R1C[-1]:RC1) -> 11033253
A4698: =R[-1]C+1 -> 4698 | B4698: =SUM(R1C[-1]:RC1) -> 11037951
A4699: =R[-1]C+1 -> 4699 | B4699: =SUM(R1C[-1]:RC1) -> 11042650
A4700: =R[-1]C+1 -> 4700 | B4700: =SUM(R1C[-1]:RC1) -> 11047350
A4701: =R[-1]C+1 -> 4701 | B4701: =SUM(R1C[-1]:RC1) -> 11052051
A4702: =R[-1]C+1 -> 4702 | B4702: =SUM(R1C[-1]:RC1) -> 11056753
A4703: =R[-1]C+1 -> 4703 | B4703: =SUM(R1C[-1]:RC1) -> 11061456
A4704: =R[-1]C+1 -> 4704 | B4704: =SUM(R1C[-1]:RC1) -> 11066160
A4705: =R[-1]C+1 -> 4705 | B4705: =SUM(R1C[-1]:RC1) -> 11070865
A4706: =R[-1]C+1 -> 4706 | B4706: =SUM(R1C[-1]:RC1) -> 11075571
A4707: =R[-1]C+1 -> 4707 | B4707: =SUM(R1C[-1]:RC1) -> 11080278
A4708: =R[-1]C+1 -> 4708 | B4708: =SUM(R1C[-1]:RC1) -> 11084986
A4709: =R[-1]C+1 -> 4709 | B4709: =SUM(R1C[-1]:RC1) -> 11089695
A4710: =R[-1]C+1 -> 4710 | B4710: =SUM(R1C[-1]:RC1) -> 11094405
A4711: =R[-1]C+1 -> 4711 | B4711: =SUM(R1C[-1]:RC1) -> 11099116
A4712: =R[-1]C+1 -> 4712 | B4712: =SUM(R1C[-1]:RC1) -> 11103828
A4713: =R[-1]C+1 -> 4713 | B4713: =SUM(R1C[-1]:RC1) -> 11108541
A4714: =R[-1]C+1 -> 4714 | B4714: =SUM(R1C[-1]:RC1) -> 11113255
A4715: =R[-1]C+1 -> 4715 | B4715: =SUM(R1C[-1]:RC1) -> 11117970
A4716: =R[-1]C+1 -> 4716 | B4716: =SUM(R1C[-1]:RC1) -> 11122686
A4717: =R[-1]C+1 -> 4717 | B4717: =SUM(R1C[-1]:RC1) -> 11127403
A4718: =R[-1]C+1 -> 4718 | B4718: =SUM(R1C[-1]:RC1) -> 11132121
A4719: =R[-1]C+1 -> 4719 | B4719: =SUM(R1C[-1]:RC1) -> 11136840
A4720: =R[-1]C+1 -> 4720 | B4720: =SUM(R1C[-1]:RC1) -> 11141560
A4721: =R[-1]C+1 -> 4721 | B4721: =SUM(R1C[-1]:RC1) -> 11146281
A4722: =R[-1]C+1 -> 4722 | B4722: =SUM(R1C[-1]:RC1) -> 11151003
A4723: =R[-1]C+1 -> 4723 | B4723: =SUM(R1C[-1]:RC1) -> 11155726
A4724: =R[-1]C+1 -> 4724 | B4724: =SUM(R1C[-1]:RC1) -> 11160450
A4725: =R[-1]C+1 -> 4725 | B4725: =SUM(R1C[-1]:RC1) -> 11165175
A4726: =R[-1]C+1 -> 4726 | B4726: =SUM(R1C[-1]:RC1) -> 11169901
A4727: =R[-1]C+1 -> 4727 | B4727: =SUM(R1C[-1]:RC1) -> 11174628
A4728: =R[-1]C+1 -> 4728 | B4728: =SUM(R1C[-1]:RC1) -> 11179356
A4729: =R[-1]C+1 -> 4729 | B4729: =SUM(R1C[-1]:RC1) -> 11184085
A4730: =R[-1]C+1 -> 4730 | B4730: =SUM(R1C[-1]:RC1) -> 11188815
A4731: =R[-1]C+1 -> 4731 | B4731: =SUM(R1C[-1]:RC1) -> 11193546
A4732: =R[-1]C+1 -> 4732 | B4732: =SUM(R1C[-1]:RC1) -> 11198278
A4733: =R[-1]C+1 -> 4733 | B4733: =SUM(R1C[-1]:RC1) -> 11203011
A4734: =R[-1]C+1 -> 4734 | B4734: =SUM(R1C[-1]:RC1) -> 11207745
A4735: =R[-1]C+1 -> 4735 | B4735: =SUM(R1C[-1]:RC1) -> 11212480
A4736: =R[-1]C+1 -> 4736 | B4736: =SUM(R1C[-1]:RC1) -> 11217216
A4737: =R[-1]C+1 -> 4737 | B4737: =SUM(R1C[-1]:RC1) -> 11221953
A4738: =R[-1]C+1 -> 4738 | B4738: =SUM(R1C[-1]:RC1) -> 11226691
A4739: =R[-1]C+1 -> 4739 | B4739: =SUM(R1C[-1]:RC1) -> 11231430
A4740: =R[-1]C+1 -> 4740 | B4740: =SUM(R1C[-1]:RC1) -> 11236170
A4741: =R[-1]C+1 -> 4741 | B4741: =SUM(R1C[-1]:RC1) -> 11240911
A4742: =R[-1]C+1 -> 4742 | B4742: =SUM(R1C[-1]:RC1) -> 11245653
A4743: =R[-1]C+1 -> 4743 | B4743: =SUM(R1C[-1]:RC1) -> 11250396
A4744: =R[-1]C+1 -> 4744 | B4744: =SUM(R1C[-1]:RC1) -> 11255140
A4745: =R[-1]C+1 -> 4745 | B4745: =SUM(R1C[-1]:RC1) -> 11259885
A4746: =R[-1]C+1 -> 4746 | B4746: =SUM(R1C[-1]:RC1) -> 11264631
A4747: =R[-1]C+1 -> 4747 | B4747: =SUM(R1C[-1]:RC1) -> 11269378
A4748: =R[-1]C+1 -> 4748 | B4748: =SUM(R1C[-1]:RC1) -> 11274126
A4749: =R[-1]C+1 -> 4749 | B4749: =SUM(R1C[-1]:RC1) -> 11278875
A4750: =R[-1]C+1 -> 4750 | B4750: =SUM(R1C[-1]:RC1) -> 11283625
A4751: =R[-1]C+1 -> 4751 | B4751: =SUM(R1C[-1]:RC1) -> 11288376
A4752: =R[-1]C+1 -> 4752 | B4752: =SUM(R1C[-1]:RC1) -> 11293128
A4753: =R[-1]C+1 -> 4753 | B4753: =SUM(R1C[-1]:RC1) -> 11297881
A4754: =R[-1]C+1 -> 4754 | B4754: =SUM(R1C[-1]:RC1) -> 11302635
A4755: =R[-1]C+1 -> 4755 | B4755: =SUM(R1C[-1]:RC1) -> 11307390
A4756: =R[-1]C+1 -> 4756 | B4756: =SUM(R1C[-1]:RC1) -> 11312146
A4757: =R[-1]C+1 -> 4757 | B4757: =SUM(R1C[-1]:RC1) -> 11316903
A4758: =R[-1]C+1 -> 4758 | B4758: =SUM(R1C[-1]:RC1) -> 11321661
A4759: =R[-1]C+1 -> 4759 | B4759: =SUM(R1C[-1]:RC1) -> 11326420
A4760: =R[-1]C+1 -> 4760 | B4760: =SUM(R1C[-1]:RC1) -> 11331180
A4761: =R[-1]C+1 -> 4761 | B4761: =SUM(R1C[-1]:RC1) -> 11335941
A4762: =R[-1]C+1 -> 4762 | B4762: =SUM(R1C[-1]:RC1) -> 11340703
A4763: =R[-1]C+1 -> 4763 | B4763: =SUM(R1C[-1]:RC1) -> 11345466
A4764: =R[-1]C+1 -> 4764 | B4764: =SUM(R1C[-1]:RC1) -> 11350230
A4765: =R[-1]C+1 -> 4765 | B4765: =SUM(R1C[-1]:RC1) -> 11354995
A4766: =R[-1]C+1 -> 4766 | B4766: =SUM(R1C[-1]:RC1) -> 11359761
A4767: =R[-1]C+1 -> 4767 | B4767: =SUM(R1C[-1]:RC1) -> 11364528
A4768: =R[-1]C+1 -> 4768 | B4768: =SUM(R1C[-1]:RC1) -> 11369296
A4769: =R[-1]C+1 -> 4769 | B4769: =SUM(R1C[-1]:RC1) -> 11374065
A4770: =R[-1]C+1 -> 4770 | B4770: =SUM(R1C[-1]:RC1) -> 11378835
A4771: =R[-1]C+1 -> 4771 | B4771: =SUM(R1C[-1]:RC1) -> 11383606
A4772: =R[-1]C+1 -> 4772 | B4772: =SUM(R1C[-1]:RC1) -> 11388378
A4773: =R[-1]C+1 -> 4773 | B4773: =SUM(R1C[-1]:RC1) -> 11393151
A4774: =R[-1]C+1 -> 4774 | B4774: =SUM(R1C[-1]:RC1) -> 11397925
A4775: =R[-1]C+1 -> 4775 | B4775: =SUM(R1C[-1]:RC1) -> 11402700
A4776: =R[-1]C+1 -> 4776 | B4776: =SUM(R1C[-1]:RC1) -> 11407476
A4777: =R[-1]C+1 -> 4777 | B4777: =SUM(R1C[-1]:RC1) -> 11412253
A4778: =R[-1]C+1 -> 4778 | B4778: =SUM(R1C[-1]:RC1) -> 11417031
A4779: =R[-1]C+1 -> 4779 | B4779: =SUM(R1C[-1]:RC1) -> 11421810
A4780: =R[-1]C+1 -> 4780 | B4780: =SUM(R1C[-1]:RC1) -> 11426590
A4781: =R[-1]C+1 -> 4781 | B4781: =SUM(R1C[-1]:RC1) -> 11431371
A4782: =R[-1]C+1 -> 4782 | B4782: =SUM(R1C[-1]:RC1) -> 11436153
A4783: =R[-1]C+1 -> 4783 | B4783: =SUM(R1C[-1]:RC1) -> 11440936
A4784: =R[-1]C+1 -> 4784 | B4784: =SUM(R1C[-1]:RC1) -> 11445720
A4785: =R[-1]C+1 -> 4785 | B4785: =SUM(R1C[-1]:RC1) -> 11450505
A4786: =R[-1]C+1 -> 4786 | B4786: =SUM(R1C[-1]:RC1) -> 11455291
A4787: =R[-1]C+1 -> 4787 | B4787: =SUM(R1C[-1]:RC1) -> 11460078
A4788: =R[-1]C+1 -> 4788 | B4788: =SUM(R1C[-1]:RC1) -> 11464866
A4789: =R[-1]C+1 -> 4789 | B4789: =SUM(R1C[-1]:RC1) -> 11469655
A4790: =R[-1]C+1 -> 4790 | B4790: =SUM(R1C[-1]:RC1) -> 11474445
A4791: =R[-1]C+1 -> 4791 | B4791: =SUM(R1C[-1]:RC1) -> 11479236
A4792: =R[-1]C+1 -> 4792 | B4792: =SUM(R1C[-1]:RC1) -> 11484028
A4793: =R[-1]C+1 -> 4793 | B4793: =SUM(R1C[-1]:RC1) -> 11488821
A4794: =R[-1]C+1 -> 4794 | B4794: =SUM(R1C[-1]:RC1) -> 11493615
A4795: =R[-1]C+1 -> 4795 | B4795: =SUM(R1C[-1]:RC1) -> 11498410
A4796: =R[-1]C+1 -> 4796 | B4796: =SUM(R1C[-1]:RC1) -> 11503206
A4797: =R[-1]C+1 -> 4797 | B4797: =SUM(R1C[-1]:RC1) -> 11508003
A4798: =R[-1]C+1 -> 4798 | B4798: =SUM(R1C[-1]:RC1) -> 11512801
A4799: =R[-1]C+1 -> 4799 | B4799: =SUM(R1C[-1]:RC1) -> 11517600
A4800: =R[-1]C+1 -> 4800 | B4800: =SUM(R1C[-1]:RC1) -> 11522400
A4801: =R[-1]C+1 -> 4801 | B4801: =SUM(R1C[-1]:RC1) -> 11527201
A4802: =R[-1]C+1 -> 4802 | B4802: =SUM(R1C[-1]:RC1) -> 11532003
A4803: =R[-1]C+1 -> 4803 | B4803: =SUM(R1C[-1]:RC1) -> 11536806
A4804: =R[-1]C+1 -> 4804 | B4804: =SUM(R1C[-1]:RC1) -> 11541610
A4805: =R[-1]C+1 -> 4805 | B4805: =SUM(R1C[-1]:RC1) -> 11546415
A4806: =R[-1]C+1 -> 4806 | B4806: =SUM(R1C[-1]:RC1) -> 11551221
A4807: =R[-1]C+1 -> 4807 | B4807: =SUM(R1C[-1]:RC1) -> 11556028
A4808: =R[-1]C+1 -> 4808 | B4808: =SUM(R1C[-1]:RC1) -> 11560836
A4809: =R[-1]C+1 -> 4809 | B4809: =SUM(R1C[-1]:RC1) -> 11565645
A4810: =R[-1]C+1 -> 4810 | B4810: =SUM(R1C[-1]:RC1) -> 11570455
A4811: =R[-1]C+1 -> 4811 | B4811: =SUM(R1C[-1]:RC1) -> 11575266
A4812: =R[-1]C+1 -> 4812 | B4812: =SUM(R1C[-1]:RC1) -> 11580078
A4813: =R[-1]C+1 -> 4813 | B4813: =SUM(R1C[-1]:RC1) -> 11584891
A4814: =R[-1]C+1 -> 4814 | B4814: =SUM(R1C[-1]:RC1) -> 11589705
A4815: =R[-1]C+1 -> 4815 | B4815: =SUM(R1C[-1]:RC1) -> 11594520
A4816: =R[-1]C+1 -> 4816 | B4816: =SUM(R1C[-1]:RC1) -> 11599336
A4817: =R[-1]C+1 -> 4817 | B4817: =SUM(R1C[-1]:RC1) -> 11604153
A4818: =R[-1]C+1 -> 4818 | B4818: =SUM(R1C[-1]:RC1) -> 11608971
A4819: =R[-1]C+1 -> 4819 | B4819: =SUM(R1C[-1]:RC1) -> 11613790
A4820: =R[-1]C+1 -> 4820 | B4820: =SUM(R1C[-1]:RC1) -> 11618610
A4821: =R[-1]C+1 -> 4821 | B4821: =SUM(R1C[-1]:RC1) -> 11623431
A4822: =R[-1]C+1 -> 4822 | B4822: =SUM(R1C[-1]:RC1) -> 11628253
A4823: =R[-1]C+1 -> 4823 | B4823: =SUM(R1C[-1]:RC1) -> 11633076
A4824: =R[-1]C+1 -> 4824 | B4824: =SUM(R1C[-1]:RC1) -> 11637900
A4825: =R[-1]C+1 -> 4825 | B4825: =SUM(R1C[-1]:RC1) -> 11642725
A4826: =R[-1]C+1 -> 4826 | B4826: =SUM(R1C[-1]:RC1) -> 11647551
A4827: =R[-1]C+1 -> 4827 | B4827: =SUM(R1C[-1]:RC1) -> 11652378
A4828: =R[-1]C+1 -> 4828 | B4828: =SUM(R1C[-1]:RC1) -> 11657206
A4829: =R[-1]C+1 -> 4829 | B4829: =SUM(R1C[-1]:RC1) -> 11662035
A4830: =R[-1]C+1 -> 4830 | B4830: =SUM(R1C[-1]:RC1) -> 11666865
A4831: =R[-1]C+1 -> 4831 | B4831: =SUM(R1C[-1]:RC1) -> 11671696
A4832: =R[-1]C+1 -> 4832 | B4832: =SUM(R1C[-1]:RC1) -> 11676528
A4833: =R[-1]C+1 -> 4833 | B4833: =SUM(R1C[-1]:RC1) -> 11681361
A4834: =R[-1]C+1 -> 4834 | B4834: =SUM(R1C[-1]:RC1) -> 11686195
A4835: =R[-1]C+1 -> 4835 | B4835: =SUM(R1C[-1]:RC1) -> 11691030
A4836: =R[-1]C+1 -> 4836 | B4836: =SUM(R1C[-1]:RC1) -> 11695866
A4837: =R[-1]C+1 -> 4837 | B4837: =SUM(R1C[-1]:RC1) -> 11700703
A4838: =R[-1]C+1 -> 4838 | B4838: =SUM(R1C[-1]:RC1) -> 11705541
A4839: =R[-1]C+1 -> 4839 | B4839: =SUM(R1C[-1]:RC1) -> 11710380
A4840: =R[-1]C+1 -> 4840 | B4840: =SUM(R1C[-1]:RC1) -> 11715220
A4841: =R[-1]C+1 -> 4841 | B4841: =SUM(R1C[-1]:RC1) -> 11720061
A4842: =R[-1]C+1 -> 4842 | B4842: =SUM(R1C[-1]:RC1) -> 11724903
A4843: =R[-1]C+1 -> 4843 | B4843: =SUM(R1C[-1]:RC1) -> 11729746
A4844: =R[-1]C+1 -> 4844 | B4844: =SUM(R1C[-1]:RC1) -> 11734590
A4845: =R[-1]C+1 -> 4845 | B4845: =SUM(R1C[-1]:RC1) -> 11739435
A4846: =R[-1]C+1 -> 4846 | B4846: =SUM(R1C[-1]:RC1) -> 11744281
A4847: =R[-1]C+1 -> 4847 | B4847: =SUM(R1C[-1]:RC1) -> 11749128
A4848: =R[-1]C+1 -> 4848 | B4848: =SUM(R1C[-1]:RC1) -> 11753976
A4849: =R[-1]C+1 -> 4849 | B4849: =SUM(R1C[-1]:RC1) -> 11758825
A4850: =R[-1]C+1 -> 4850 | B4850: =SUM(R1C[-1]:RC1) -> 11763675
A4851: =R[-1]C+1 -> 4851 | B4851: =SUM(R1C[-1]:RC1) -> 11768526
A4852: =R[-1]C+1 -> 4852 | B4852: =SUM(R1C[-1]:RC1) -> 11773378
A4853: =R[-1]C+1 -> 4853 | B4853: =SUM(R1C[-1]:RC1) -> 11778231
A4854: =R[-1]C+1 -> 4854 | B4854: =SUM(R1C[-1]:RC1) -> 11783085
A4855: =R[-1]C+1 -> 4855 | B4855: =SUM(R1C[-1]:RC1) -> 11787940
A4856: =R[-1]C+1 -> 4856 | B4856: =SUM(R1C[-1]:RC1) -> 11792796
A4857: =R[-1]C+1 -> 4857 | B4857: =SUM(R1C[-1]:RC1) -> 11797653
A4858: =R[-1]C+1 -> 4858 | B4858: =SUM(R1C[-1]:RC1) -> 11802511
A4859: =R[-1]C+1 -> 4859 | B4859: =SUM(R1C[-1]:RC1) -> 11807370
A4860: =R[-1]C+1 -> 4860 | B4860: =SUM(R1C[-1]:RC1) -> 11812230
A4861: =R[-1]C+1 -> 4861 | B4861: =SUM(R1C[-1]:RC1) -> 11817091
A4862: =R[-1]C+1 -> 4862 | B4862: =SUM(R1C[-1]:RC1) -> 11821953
A4863: =R[-1]C+1 -> 4863 | B4863: =SUM(R1C[-1]:RC1) -> 11826816
A4864: =R[-1]C+1 -> 4864 | B4864: =SUM(R1C[-1]:RC1) -> 11831680
A4865: =R[-1]C+1 -> 4865 | B4865: =SUM(R1C[-1]:RC1) -> 11836545
A4866: =R[-1]C+1 -> 4866 | B4866: =SUM(R1C[-1]:RC1) -> 11841411
A4867: =R[-1]C+1 -> 4867 | B4867: =SUM(R1C[-1]:RC1) -> 11846278
A4868: =R[-1]C+1 -> 4868 | B4868: =SUM(R1C[-1]:RC1) -> 11851146
A4869: =R[-1]C+1 -> 4869 | B4869: =SUM(R1C[-1]:RC1) -> 11856015
A4870: =R[-1]C+1 -> 4870 | B4870: =SUM(R1C[-1]:RC1) -> 11860885
A4871: =R[-1]C+1 -> 4871 | B4871: =SUM(R1C[-1]:RC1) -> 11865756
A4872: =R[-1]C+1 -> 4872 | B4872: =SUM(R1C[-1]:RC1) -> 11870628
A4873: =R[-1]C+1 -> 4873 | B4873: =SUM(R1C[-1]:RC1) -> 11875501
A4874: =R[-1]C+1 -> 4874 | B4874: =SUM(R1C[-1]:RC1) -> 11880375
A4875: =R[-1]C+1 -> 4875 | B4875: =SUM(R1C[-1]:RC1) -> 11885250
A4876: =R[-1]C+1 -> 4876 | B4876: =SUM(R1C[-1]:RC1) -> 11890126
A4877: =R[-1]C+1 -> 4877 | B4877: =SUM(R1C[-1]:RC1) -> 11895003
A4878: =R[-1]C+1 -> 4878 | B4878: =SUM(R1C[-1]:RC1) -> 11899881
A4879: =R[-1]C+1 -> 4879 | B4879: =SUM(R1C[-1]:RC1) -> 11904760
A4880: =R[-1]C+1 -> 4880 | B4880: =SUM(R1C[-1]:RC1) -> 11909640
A4881: =R[-1]C+1 -> 4881 | B4881: =SUM(R1C[-1]:RC1) -> 11914521
A4882: =R[-1]C+1 -> 4882 | B4882: =SUM(R1C[-1]:RC1) -> 11919403
A4883: =R[-1]C+1 -> 4883 | B4883: =SUM(R1C[-1]:RC1) -> 11924286
A4884: =R[-1]C+1 -> 4884 | B4884: =SUM(R1C[-1]:RC1) -> 11929170
A4885: =R[-1]C+1 -> 4885 | B4885: =SUM(R1C[-1]:RC1) -> 11934055
A4886: =R[-1]C+1 -> 4886 | B4886: =SUM(R1C[-1]:RC1) -> 11938941
A4887: =R[-1]C+1 -> 4887 | B4887: =SUM(R1C[-1]:RC1) -> 11943828
A4888: =R[-1]C+1 -> 4888 | B4888: =SUM(R1C[-1]:RC1) -> 11948716
A4889: =R[-1]C+1 -> 4889 | B4889: =SUM(R1C[-1]:RC1) -> 11953605
A4890: =R[-1]C+1 -> 4890 | B4890: =SUM(R1C[-1]:RC1) -> 11958495
A4891: =R[-1]C+1 -> 4891 | B4891: =SUM(R1C[-1]:RC1) -> 11963386
A4892: =R[-1]C+1 -> 4892 | B4892: =SUM(R1C[-1]:RC1) -> 11968278
A4893: =R[-1]C+1 -> 4893 | B4893: =SUM(R1C[-1]:RC1) -> 11973171
A4894: =R[-1]C+1 -> 4894 | B4894: =SUM(R1C[-1]:RC1) -> 11978065
A4895: =R[-1]C+1 -> 4895 | B4895: =SUM(R1C[-1]:RC1) -> 11982960
A4896: =R[-1]C+1 -> 4896 | B4896: =SUM(R1C[-1]:RC1) -> 11987856
A4897: =R[-1]C+1 -> 4897 | B4897: =SUM(R1C[-1]:RC1) -> 11992753
A4898: =R[-1]C+1 -> 4898 | B4898: =SUM(R1C[-1]:RC1) -> 11997651
A4899: =R[-1]C+1 -> 4899 | B4899: =SUM(R1C[-1]:RC1) -> 12002550
A4900: =R[-1]C+1 -> 4900 | B4900: =SUM(R1C[-1]:RC1) -> 12007450
A4901: =R[-1]C+1 -> 4901 | B4901: =SUM(R1C[-1]:RC1) -> 12012351
A4902: =R[-1]C+1 -> 4902 | B4902: =SUM(R1C[-1]:RC1) -> 12017253
A4903: =R[-1]C+1 -> 4903 | B4903: =SUM(R1C[-1]:RC1) -> 12022156
A4904: =R[-1]C+1 -> 4904 | B4904: =SUM(R1C[-1]:RC1) -> 12027060
A4905: =R[-1]C+1 -> 4905 | B4905: =SUM(R1C[-1]:RC1) -> 12031965
A4906: =R[-1]C+1 -> 4906 | B4906: =SUM(R1C[-1]:RC1) -> 12036871
A4907: =R[-1]C+1 -> 4907 | B4907: =SUM(R1C[-1]:RC1) -> 12041778
A4908: =R[-1]C+1 -> 4908 | B4908: =SUM(R1C[-1]:RC1) -> 12046686
A4909: =R[-1]C+1 -> 4909 | B4909: =SUM(R1C[-1]:RC1) -> 12051595
A4910: =R[-1]C+1 -> 4910 | B4910: =SUM(R1C[-1]:RC1) -> 12056505
A4911: =R[-1]C+1 -> 4911 | B4911: =SUM(R1C[-1]:RC1) -> 12061416
A4912: =R[-1]C+1 -> 4912 | B4912: =SUM(R1C[-1]:RC1) -> 12066328
A4913: =R[-1]C+1 -> 4913 | B4913: =SUM(R1C[-1]:RC1) -> 12071241
A4914: =R[-1]C+1 -> 4914 | B4914: =SUM(R1C[-1]:RC1) -> 12076155
A4915: =R[-1]C+1 -> 4915 | B4915: =SUM(R1C[-1]:RC1) -> 12081070
A4916: =R[-1]C+1 -> 4916 | B4916: =SUM(R1C[-1]:RC1) -> 12085986
A4917: =R[-1]C+1 -> 4917 | B4917: =SUM(R1C[-1]:RC1) -> 12090903
A4918: =R[-1]C+1 -> 4918 | B4918: =SUM(R1C[-1]:RC1) -> 12095821
A4919: =R[-1]C+1 -> 4919 | B4919: =SUM(R1C[-1]:RC1) -> 12100740
A4920: =R[-1]C+1 -> 4920 | B4920: =SUM(R1C[-1]:RC1) -> 12105660
A4921: =R[-1]C+1 -> 4921 | B4921: =SUM(R1C[-1]:RC1) -> 12110581
A4922: =R[-1]C+1 -> 4922 | B4922: =SUM(R1C[-1]:RC1) -> 12115503
A4923: =R[-1]C+1 -> 4923 | B4923: =SUM(R1C[-1]:RC1) -> 12120426
A4924: =R[-1]C+1 -> 4924 | B4924: =SUM(R1C[-1]:RC1) -> 12125350
A4925: =R[-1]C+1 -> 4925 | B4925: =SUM(R1C[-1]:RC1) -> 12130275
A4926: =R[-1]C+1 -> 4926 | B4926: =SUM(R1C[-1]:RC1) -> 12135201
A4927: =R[-1]C+1 -> 4927 | B4927: =SUM(R1C[-1]:RC1) -> 12140128
A4928: =R[-1]C+1 -> 4928 | B4928: =SUM(R1C[-1]:RC1) -> 12145056
A4929: =R[-1]C+1 -> 4929 | B4929: =SUM(R1C[-1]:RC1) -> 12149985
A4930: =R[-1]C+1 -> 4930 | B4930: =SUM(R1C[-1]:RC1) -> 12154915
A4931: =R[-1]C+1 -> 4931 | B4931: =SUM(R1C[-1]:RC1) -> 12159846
A4932: =R[-1]C+1 -> 4932 | B4932: =SUM(R1C[-1]:RC1) -> 12164778
A4933: =R[-1]C+1 -> 4933 | B4933: =SUM(R1C[-1]:RC1) -> 12169711
A4934: =R[-1]C+1 -> 4934 | B4934: =SUM(R1C[-1]:RC1) -> 12174645
A4935: =R[-1]C+1 -> 4935 | B4935: =SUM(R1C[-1]:RC1) -> 12179580
A4936: =R[-1]C+1 -> 4936 | B4936: =SUM(R1C[-1]:RC1) -> 12184516
A4937: =R[-1]C+1 -> 4937 | B4937: =SUM(R1C[-1]:RC1) -> 12189453
A4938: =R[-1]C+1 -> 4938 | B4938: =SUM(R1C[-1]:RC1) -> 12194391
A4939: =R[-1]C+1 -> 4939 | B4939: =SUM(R1C[-1]:RC1) -> 12199330
A4940: =R[-1]C+1 -> 4940 | B4940: =SUM(R1C[-1]:RC1) -> 12204270
A4941: =R[-1]C+1 -> 4941 | B4941: =SUM(R1C[-1]:RC1) -> 12209211
A4942: =R[-1]C+1 -> 4942 | B4942: =SUM(R1C[-1]:RC1) -> 12214153
A4943: =R[-1]C+1 -> 4943 | B4943: =SUM(R1C[-1]:RC1) -> 12219096
A4944: =R[-1]C+1 -> 4944 | B4944: =SUM(R1C[-1]:RC1) -> 12224040
A4945: =R[-1]C+1 -> 4945 | B4945: =SUM(R1C[-1]:RC1) -> 12228985
A4946: =R[-1]C+1 -> 4946 | B4946: =SUM(R1C[-1]:RC1) -> 12233931
A4947: =R[-1]C+1 -> 4947 | B4947: =SUM(R1C[-1]:RC1) -> 12238878
A4948: =R[-1]C+1 -> 4948 | B4948: =SUM(R1C[-1]:RC1) -> 12243826
A4949: =R[-1]C+1 -> 4949 | B4949: =SUM(R1C[-1]:RC1) -> 12248775
A4950: =R[-1]C+1 -> 4950 | B4950: =SUM(R1C[-1]:RC1) -> 12253725
A4951: =R[-1]C+1 -> 4951 | B4951: =SUM(R1C[-1]:RC1) -> 12258676
A4952: =R[-1]C+1 -> 4952 | B4952: =SUM(R1C[-1]:RC1) -> 12263628
A4953: =R[-1]C+1 -> 4953 | B4953: =SUM(R1C[-1]:RC1) -> 12268581
A4954: =R[-1]C+1 -> 4954 | B4954: =SUM(R1C[-1]:RC1) -> 12273535
A4955: =R[-1]C+1 -> 4955 | B4955: =SUM(R1C[-1]:RC1) -> 12278490
A4956: =R[-1]C+1 -> 4956 | B4956: =SUM(R1C[-1]:RC1) -> 12283446
A4957: =R[-1]C+1 -> 4957 | B4957: =SUM(R1C[-1]:RC1) -> 12288403
A4958: =R[-1]C+1 -> 4958 | B4958: =SUM(R1C[-1]:RC1) -> 12293361
A4959: =R[-1]C+1 -> 4959 | B4959: =SUM(R1C[-1]:RC1) -> 12298320
A4960: =R[-1]C+1 -> 4960 | B4960: =SUM(R1C[-1]:RC1) -> 12303280
A4961: =R[-1]C+1 -> 4961 | B4961: =SUM(R1C[-1]:RC1) -> 12308241
A4962: =R[-1]C+1 -> 4962 | B4962: =SUM(R1C[-1]:RC1) -> 12313203
A4963: =R[-1]C+1 -> 4963 | B4963: =SUM(R1C[-1]:RC1) -> 12318166
A4964: =R[-1]C+1 -> 4964 | B4964: =SUM(R1C[-1]:RC1) -> 12323130
A4965: =R[-1]C+1 -> 4965 | B4965: =SUM(R1C[-1]:RC1) -> 12328095
A4966: =R[-1]C+1 -> 4966 | B4966: =SUM(R1C[-1]:RC1) -> 12333061
A4967: =R[-1]C+1 -> 4967 | B4967: =SUM(R1C[-1]:RC1) -> 12338028
A4968: =R[-1]C+1 -> 4968 | B4968: =SUM(R1C[-1]:RC1) -> 12342996
A4969: =R[-1]C+1 -> 4969 | B4969: =SUM(R1C[-1]:RC1) -> 12347965
A4970: =R[-1]C+1 -> 4970 | B4970: =SUM(R1C[-1]:RC1) -> 12352935
A4971: =R[-1]C+1 -> 4971 | B4971: =SUM(R1C[-1]:RC1) -> 12357906
A4972: =R[-1]C+1 -> 4972 | B4972: =SUM(R1C[-1]:RC1) -> 12362878
A4973: =R[-1]C+1 -> 4973 | B4973: =SUM(R1C[-1]:RC1) -> 12367851
A4974: =R[-1]C+1 -> 4974 | B4974: =SUM(R1C[-1]:RC1) -> 12372825
A4975: =R[-1]C+1 -> 4975 | B4975: =SUM(R1C[-1]:RC1) -> 12377800
A4976: =R[-1]C+1 -> 4976 | B4976: =SUM(R1C[-1]:RC1) -> 12382776
A4977: =R[-1]C+1 -> 4977 | B4977: =SUM(R1C[-1]:RC1) -> 12387753
A4978: =R[-1]C+1 -> 4978 | B4978: =SUM(R1C[-1]:RC1) -> 12392731
A4979: =R[-1]C+1 -> 4979 | B4979: =SUM(R1C[-1]:RC1) -> 12397710
A4980: =R[-1]C+1 -> 4980 | B4980: =SUM(R1C[-1]:RC1) -> 12402690
A4981: =R[-1]C+1 -> 4981 | B4981: =SUM(R1C[-1]:RC1) -> 12407671
A4982: =R[-1]C+1 -> 4982 | B4982: =SUM(R1C[-1]:RC1) -> 12412653
A4983: =R[-1]C+1 -> 4983 | B4983: =SUM(R1C[-1]:RC1) -> 12417636
A4984: =R[-1]C+1 -> 4984 | B4984: =SUM(R1C[-1]:RC1) -> 12422620
A4985: =R[-1]C+1 -> 4985 | B4985: =SUM(R1C[-1]:RC1) -> 12427605
A4986: =R[-1]C+1 -> 4986 | B4986: =SUM(R1C[-1]:RC1) -> 12432591
A4987: =R[-1]C+1 -> 4987 | B4987: =SUM(R1C[-1]:RC1) -> 12437578
A4988: =R[-1]C+1 -> 4988 | B4988: =SUM(R1C[-1]:RC1) -> 12442566
A4989: =R[-1]C+1 -> 4989 | B4989: =SUM(R1C[-1]:RC1) -> 12447555
A4990: =R[-1]C+1 -> 4990 | B4990: =SUM(R1C[-1]:RC1) -> 12452545
A4991: =R[-1]C+1 -> 4991 | B4991: =SUM(R1C[-1]:RC1) -> 12457536
A4992: =R[-1]C+1 -> 4992 | B4992: =SUM(R1C[-1]:RC1) -> 12462528
A4993: =R[-1]C+1 -> 4993 | B4993: =SUM(R1C[-1]:RC1) -> 12467521
A4994: =R[-1]C+1 -> 4994 | B4994: =SUM(R1C[-1]:RC1) -> 12472515
A4995: =R[-1]C+1 -> 4995 | B4995: =SUM(R1C[-1]:RC1) -> 12477510
A4996: =R[-1]C+1 -> 4996 | B4996: =SUM(R1C[-1]:RC1) -> 12482506
A4997: =R[-1]C+1 -> 4997 | B4997: =SUM(R1C[-1]:RC1) -> 12487503
A4998: =R[-1]C+1 -> 4998 | B4998: =SUM(R1C[-1]:RC1) -> 12492501
A4999: =R[-1]C+1 -> 4999 | B4999: =SUM(R1C[-1]:RC1) -> 12497500
A5000: =R[-1]C+1 -> 5000 | B5000: =SUM(R1C[-1]:RC1) -> 12502500