Sheet: @Functions
A1: Test cases for partial evaluation of sheet-defined functions | G1: 2013-03-10
A3: =AND(R[11]C[6],R[12]C[6]) -> #NAME?
A7: Static evaluation of IF, inlining of constants, non-inlining of expressions:
A8: x | B8: 5
A9: y | B9: 6
B10: =R[-2]C*R[-2]C/2 -> 12.5
B11: =SIN(R[-2]C) -> -0.27941549819892586
B12: =IF(R[-4]C>5, R[-2]C+R[-2]C, R[-1]C*R[-1]C) -> 7.8073020633753945E-2 | C12: =define("if_1", RC[-1],R[-4]C[-1],R[-3]C[-1]) -> #NAME?
B14: 4 | C14: =specialize("if_1",RC[-1],NA()) -> #NAME? | D14: =apply(RC[-1],10) -> #NAME? | E14: =IF_1(RC[-3],10) -> #NAME? | G14: =(RC[-3]=RC[-2]) -> #NAME?
B15: 7 | C15: =specialize("if_1",RC[-1],NA()) -> #NAME? | D15: =apply(RC[-1],10) -> #NAME? | E15: =IF_1(RC[-3],10) -> #NAME? | G15: =(RC[-3]=RC[-2]) -> #NAME?
A17: Residual IF, residualization of RAND():
A18: x | B18: 0.4
A19: y | B19: 5
B20: =IF(RAND()<R[-2]C, R[-2]C*10, R[-1]C*R[-2]C) -> 4 | C20: =define("if2", RC[-1],R[-2]C[-1],R[-1]C[-1]) -> #NAME?
B22: =specialize("if2", 0.5, NA()) -> #NAME? | C22: =apply(RC[-1], 25) -> #NAME?
A24: Same with CHOOSE:
A25: x | B25: 0.4
A26: y | B26: 5
B27: =CHOOSE(2-(RAND()<R[-2]C), R[-2]C*10, R[-1]C*R[-2]C) -> 2 | C27: =define("choose1", RC[-1],R[-2]C[-1],R[-1]C[-1]) -> #NAME?
B29: =specialize("choose1", 0.5, NA()) -> #NAME? | C29: =apply(RC[-1], 25) -> #NAME?
A31: Specialization wrt function value, residualize static function values, test caching
A32: f
A33: x
B34: =apply(R[-2]C,R[-1]C)+R[-1]C -> #NAME? | C34: =define("applyadd", RC[-1],R[-2]C[-1],R[-1]C[-1]) -> #NAME?
B36: =specialize("applyadd",closure("if2", 0.7, NA()),NA()) -> #NAME? | C36: =apply(RC[-1],5) -> #NAME?
A38: Specialization wrt array value, residualize static array value, test caching
A39: table | B39: =tabulate(closure("add",NA(),NA()),4,4) -> #NAME?
A40: index | B40: 3
B41: =INDEX(R[-2]C,R[-1]C,R[-1]C) -> #REF! | C41: =define("dynamicindex",RC[-1],R[-2]C[-1],R[-1]C[-1]) -> #NAME?
B43: =specialize("dynamicindex",tabulate(closure("add",NA(),NA()),4,4),NA()) -> #NAME? | C43: =apply(RC[-1],3) -> #NAME?
A45: Specialization wrt array value, inline static array value because of static index
A46: table | B46: =tabulate(closure("add",NA(),NA()),4,4) -> #NAME?
A47: scale | B47: 100
B48: =INDEX(R[-2]C,2,3)*R[-1]C -> #REF! | C48: =define("staticindex",RC[-1],R[-2]C[-1],R[-1]C[-1]) -> #NAME?
B50: =specialize("staticindex",tabulate(closure("add",NA(),NA()),4,4),NA()) -> #NAME? | C50: =apply(RC[-1],100) -> #NAME?
A52: Partial evaluation in multiple stages
A53: a | B53: 4
A54: b | B54: 5
A55: c | B55: 6
B56: =R[-3]C+R[-2]C+R[-1]C -> 15 | C56: =define("add3", RC[-1],R[-3]C[-1],R[-2]C[-1],R[-1]C[-1]) -> #NAME? | E56: count = | F56: 1
F57: =benchmark(closure("add3",11,23,32),R56C6) -> #NAME?
B58: =specialize("add3",11,NA(),NA()) -> #NAME? | C58: =apply(RC[-1],23, 32) -> #NAME? | F58: =benchmark(closure(RC[-4],23,32),R56C6) -> #NAME?
B59: =specialize(R[-1]C, 23, NA()) -> #NAME? | C59: =apply(RC[-1],32) -> #NAME? | F59: =benchmark(closure(RC[-4],32),R56C6) -> #NAME?
B60: =specialize(R[-1]C, 32) -> #NAME? | C60: =apply(RC[-1]) -> #NAME? | F60: =benchmark(RC[-4],R56C6) -> #NAME?
A62: Benchmarking specialized functions | C62: count = | D62: 1
B63: 101 | C63: =closure("add3",RC[-1],R[1]C[-1],R[2]C[-1]) -> #NAME? | D63: =benchmark(RC[-1],R62C4) -> #NAME?
B64: 201 | C64: =specialize("add3",R[-1]C[-1],NA(),NA()) -> #NAME? | D64: =benchmark(closure(RC[-1],RC[-2],R[1]C[-2]),R62C4) -> #NAME?
B65: 301 | C65: =specialize("add3",R[-2]C[-1],R[-1]C[-1],NA()) -> #NAME? | D65: =benchmark(closure(RC[-1],RC[-2]),R62C4) -> #NAME?
C66: =specialize("add3",R[-3]C[-1],R[-2]C[-1],R[-1]C[-1]) -> #NAME? | D66: =benchmark(closure(RC[-1]),R62C4) -> #NAME?
A68: Auxiliaries, also for making van der Corput numbers
A69: ADD(x,y)
A70: x
A71: y
B72: =R[-2]C+R[-1]C -> 0 | C72: =define("add", RC[-1],R[-2]C[-1],R[-1]C[-1]) -> #NAME?
A74: NEXTVDC(x,v)
A75: x
A76: v
B77: =map(hcat(0,R[-1]C), closure("add",R[-2]C,NA())) -> #NAME? | C77: =define("nextvdc",RC[-1],R[-2]C[-1],R[-1]C[-1]) -> #NAME?
A79: NTHVDC(n)
A80: n =
B81: =INDEX(Data!R[-68]C,1,R[-1]C) -> #NAME? | C81: =define("nthvdc",RC[-1],R[-1]C[-1]) -> #NAME?
E84: m = | F84: 2
A85: ACKER1(m,n) | B85: 1 | E85: n = | F85: 2 | G85: count = | H85: 10
A86: m = | B86: 1
A87: n = | B87: =IF(R[-2]C=0,R[-1]C+1,IF(R[-1]C=0,ACKer1(R[-2]C-1,1),ACKer1(R[-2]C-1,ACKer1(R[-2]C,R[-1]C-1)))) -> #NAME? | C87: =define("acker1",RC[-1],R[-2]C[-1],R[-1]C[-1]) -> #NAME? | E87: =ACKer1(R84C6,R85C6) -> #NAME? | F87: =benchmark(closure("acker1",R84C6,R85C6),R85C8) -> #NAME? | G87: =specialize("acker1",R84C6,NA()) -> #NAME? | H87: =apply(RC[-1],R85C6) -> #NAME? | I87: =benchmark(closure(RC[-2],R85C6),R85C8) -> #NAME?
A88: res =
E89: =acker2(R84C6,R85C6) -> #NAME? | F89: =benchmark(closure("acker2",R84C6,R85C6),R85C8) -> #NAME? | G89: =specialize("acker2",R84C6,NA()) -> #NAME? | H89: =apply(RC[-1],R85C6) -> #NAME? | I89: =benchmark(closure(RC[-2],R85C6),R85C8) -> #NAME?
A90: ACKER2(m,n) | B90: 1
A91: m = | B91: 1
A92: n = | B92: =IF(R[-2]C=0,R[-1]C+1,acker2(R[-2]C-1,IF(R[-1]C=0,1,acker2(R[-2]C,R[-1]C-1)))) -> #NAME? | C92: =define("acker2",RC[-1],R[-2]C[-1],R[-1]C[-1]) -> #NAME?
A93: res =
A95: Sampling from the exponential distribution, with arrival rate p
A96: EXPSAMPLE(P,N) | E96: p = | F96: 0.15 | G96: count = | H96: 500
A97: p = | B97: 0.2
A98: n = | B98: 1 | F98: =expsample(R96C6, 1) -> #NAME? | H98: =benchmark(closure("expsample", R96C6,1),R96C8) -> #NAME?
B99: =IF(R[-2]C<=0, err("p must be positive"), IF(RAND()<R[-2]C,R[-1]C,expsample(R[-2]C,R[-1]C+1))) -> #NAME? | C99: =define("expsample",RC[-1],R[-2]C[-1],R[-1]C[-1]) -> #NAME? | E99: =specialize("expsample",R96C6,1) -> #NAME? | F99: =apply(RC[-1]) -> #NAME? | H99: =benchmark(RC[-3],R96C8) -> #NAME?
A101: Countdown factorial, Weise et al 1991, page 172
A102: n = | B102: 10
A103: res = | B103: =IF(R[-1]C=0, 1, R[-1]C * facd(R[-1]C-1)) -> #NAME? | C103: =define("facd",RC[-1],R[-1]C[-1]) -> #NAME?
A105: Countup factorial, Weise et al 1991, page 173
A106: n = | B106: 10
A107: res = | B107: =facloop(R[-1]C,1,1) -> #NAME? | C107: =define("facu",RC[-1],R[-1]C[-1]) -> #NAME?
A109: n =
A110: m =
A111: ans =
A112: res = | B112: =IF(R[-2]C>R[-3]C,R[-1]C,facloop(R[-3]C,R[-2]C+1,R[-2]C*R[-1]C)) -> #NAME? | C112: =define("facloop",RC[-1],R[-3]C[-1],R[-2]C[-1],R[-1]C[-1]) -> #NAME?

Sheet: ExpSamples
A1: lambda = | B1: 0.15 | D1: average = | E1: =AVERAGE(R4C1:R23C10) -> #NAME?
A2: =specialize("expsample",R1C2,1) -> #NAME? | D2: max = | E2: =MAX(R4C1:R23C10) -> #NAME?
A4: =apply(R2C1) -> #NAME? | B4: =apply(R2C1) -> #NAME? | C4: =apply(R2C1) -> #NAME? | D4: =apply(R2C1) -> #NAME? | E4: =apply(R2C1) -> #NAME? | F4: =apply(R2C1) -> #NAME? | G4: =apply(R2C1) -> #NAME? | H4: =apply(R2C1) -> #NAME? | I4: =apply(R2C1) -> #NAME? | J4: =apply(R2C1) -> #NAME?
A5: =apply(R2C1) -> #NAME? | B5: =apply(R2C1) -> #NAME? | C5: =apply(R2C1) -> #NAME? | D5: =apply(R2C1) -> #NAME? | E5: =apply(R2C1) -> #NAME? | F5: =apply(R2C1) -> #NAME? | G5: =apply(R2C1) -> #NAME? | H5: =apply(R2C1) -> #NAME? | I5: =apply(R2C1) -> #NAME? | J5: =apply(R2C1) -> #NAME?
A6: =apply(R2C1) -> #NAME? | B6: =apply(R2C1) -> #NAME? | C6: =apply(R2C1) -> #NAME? | D6: =apply(R2C1) -> #NAME? | E6: =apply(R2C1) -> #NAME? | F6: =apply(R2C1) -> #NAME? | G6: =apply(R2C1) -> #NAME? | H6: =apply(R2C1) -> #NAME? | I6: =apply(R2C1) -> #NAME? | J6: =apply(R2C1) -> #NAME?
A7: =apply(R2C1) -> #NAME? | B7: =apply(R2C1) -> #NAME? | C7: =apply(R2C1) -> #NAME? | D7: =apply(R2C1) -> #NAME? | E7: =apply(R2C1) -> #NAME? | F7: =apply(R2C1) -> #NAME? | G7: =apply(R2C1) -> #NAME? | H7: =apply(R2C1) -> #NAME? | I7: =apply(R2C1) -> #NAME? | J7: =apply(R2C1) -> #NAME?
A8: =apply(R2C1) -> #NAME? | B8: =apply(R2C1) -> #NAME? | C8: =apply(R2C1) -> #NAME? | D8: =apply(R2C1) -> #NAME? | E8: =apply(R2C1) -> #NAME? | F8: =apply(R2C1) -> #NAME? | G8: =apply(R2C1) -> #NAME? | H8: =apply(R2C1) -> #NAME? | I8: =apply(R2C1) -> #NAME? | J8: =apply(R2C1) -> #NAME?
A9: =apply(R2C1) -> #NAME? | B9: =apply(R2C1) -> #NAME? | C9: =apply(R2C1) -> #NAME? | D9: =apply(R2C1) -> #NAME? | E9: =apply(R2C1) -> #NAME? | F9: =apply(R2C1) -> #NAME? | G9: =apply(R2C1) -> #NAME? | H9: =apply(R2C1) -> #NAME? | I9: =apply(R2C1) -> #NAME? | J9: =apply(R2C1) -> #NAME?
A10: =apply(R2C1) -> #NAME? | B10: =apply(R2C1) -> #NAME? | C10: =apply(R2C1) -> #NAME? | D10: =apply(R2C1) -> #NAME? | E10: =apply(R2C1) -> #NAME? | F10: =apply(R2C1) -> #NAME? | G10: =apply(R2C1) -> #NAME? | H10: =apply(R2C1) -> #NAME? | I10: =apply(R2C1) -> #NAME? | J10: =apply(R2C1) -> #NAME?
A11: =apply(R2C1) -> #NAME? | B11: =apply(R2C1) -> #NAME? | C11: =apply(R2C1) -> #NAME? | D11: =apply(R2C1) -> #NAME? | E11: =apply(R2C1) -> #NAME? | F11: =apply(R2C1) -> #NAME? | G11: =apply(R2C1) -> #NAME? | H11: =apply(R2C1) -> #NAME? | I11: =apply(R2C1) -> #NAME? | J11: =apply(R2C1) -> #NAME?
A12: =apply(R2C1) -> #NAME? | B12: =apply(R2C1) -> #NAME? | C12: =apply(R2C1) -> #NAME? | D12: =apply(R2C1) -> #NAME? | E12: =apply(R2C1) -> #NAME? | F12: =apply(R2C1) -> #NAME? | G12: =apply(R2C1) -> #NAME? | H12: =apply(R2C1) -> #NAME? | I12: =apply(R2C1) -> #NAME? | J12: =apply(R2C1) -> #NAME?
A13: =apply(R2C1) -> #NAME? | B13: =apply(R2C1) -> #NAME? | C13: =apply(R2C1) -> #NAME? | D13: =apply(R2C1) -> #NAME? | E13: =apply(R2C1) -> #NAME? | F13: =apply(R2C1) -> #NAME? | G13: =apply(R2C1) -> #NAME? | H13: =apply(R2C1) -> #NAME? | I13: =apply(R2C1) -> #NAME? | J13: =apply(R2C1) -> #NAME?
A14: =apply(R2C1) -> #NAME? | B14: =apply(R2C1) -> #NAME? | C14: =apply(R2C1) -> #NAME? | D14: =apply(R2C1) -> #NAME? | E14: =apply(R2C1) -> #NAME? | F14: =apply(R2C1) -> #NAME? | G14: =apply(R2C1) -> #NAME? | H14: =apply(R2C1) -> #NAME? | I14: =apply(R2C1) -> #NAME? | J14: =apply(R2C1) -> #NAME?
A15: =apply(R2C1) -> #NAME? | B15: =apply(R2C1) -> #NAME? | C15: =apply(R2C1) -> #NAME? | D15: =apply(R2C1) -> #NAME? | E15: =apply(R2C1) -> #NAME? | F15: =apply(R2C1) -> #NAME? | G15: =apply(R2C1) -> #NAME? | H15: =apply(R2C1) -> #NAME? | I15: =apply(R2C1) -> #NAME? | J15: =apply(R2C1) -> #NAME?
A16: =apply(R2C1) -> #NAME? | B16: =apply(R2C1) -> #NAME? | C16: =apply(R2C1) -> #NAME? | D16: =apply(R2C1) -> #NAME? | E16: =apply(R2C1) -> #NAME? | F16: =apply(R2C1) -> #NAME? | G16: =apply(R2C1) -> #NAME? | H16: =apply(R2C1) -> #NAME? | I16: =apply(R2C1) -> #NAME? | J16: =apply(R2C1) -> #NAME?
A17: =apply(R2C1) -> #NAME? | B17: =apply(R2C1) -> #NAME? | C17: =apply(R2C1) -> #NAME? | D17: =apply(R2C1) -> #NAME? | E17: =apply(R2C1) -> #NAME? | F17: =apply(R2C1) -> #NAME? | G17: =apply(R2C1) -> #NAME? | H17: =apply(R2C1) -> #NAME? | I17: =apply(R2C1) -> #NAME? | J17: =apply(R2C1) -> #NAME?
A18: =apply(R2C1) -> #NAME? | B18: =apply(R2C1) -> #NAME? | C18: =apply(R2C1) -> #NAME? | D18: =apply(R2C1) -> #NAME? | E18: =apply(R2C1) -> #NAME? | F18: =apply(R2C1) -> #NAME? | G18: =apply(R2C1) -> #NAME? | H18: =apply(R2C1) -> #NAME? | I18: =apply(R2C1) -> #NAME? | J18: =apply(R2C1) -> #NAME?
A19: =apply(R2C1) -> #NAME? | B19: =apply(R2C1) -> #NAME? | C19: =apply(R2C1) -> #NAME? | D19: =apply(R2C1) -> #NAME? | E19: =apply(R2C1) -> #NAME? | F19: =apply(R2C1) -> #NAME? | G19: =apply(R2C1) -> #NAME? | H19: =apply(R2C1) -> #NAME? | I19: =apply(R2C1) -> #NAME? | J19: =apply(R2C1) -> #NAME?
A20: =apply(R2C1) -> #NAME? | B20: =apply(R2C1) -> #NAME? | C20: =apply(R2C1) -> #NAME? | D20: =apply(R2C1) -> #NAME? | E20: =apply(R2C1) -> #NAME? | F20: =apply(R2C1) -> #NAME? | G20: =apply(R2C1) -> #NAME? | H20: =apply(R2C1) -> #NAME? | I20: =apply(R2C1) -> #NAME? | J20: =apply(R2C1) -> #NAME?
A21: =apply(R2C1) -> #NAME? | B21: =apply(R2C1) -> #NAME? | C21: =apply(R2C1) -> #NAME? | D21: =apply(R2C1) -> #NAME? | E21: =apply(R2C1) -> #NAME? | F21: =apply(R2C1) -> #NAME? | G21: =apply(R2C1) -> #NAME? | H21: =apply(R2C1) -> #NAME? | I21: =apply(R2C1) -> #NAME? | J21: =apply(R2C1) -> #NAME?
A22: =apply(R2C1) -> #NAME? | B22: =apply(R2C1) -> #NAME? | C22: =apply(R2C1) -> #NAME? | D22: =apply(R2C1) -> #NAME? | E22: =apply(R2C1) -> #NAME? | F22: =apply(R2C1) -> #NAME? | G22: =apply(R2C1) -> #NAME? | H22: =apply(R2C1) -> #NAME? | I22: =apply(R2C1) -> #NAME? | J22: =apply(R2C1) -> #NAME?
A23: =apply(R2C1) -> #NAME? | B23: =apply(R2C1) -> #NAME? | C23: =apply(R2C1) -> #NAME? | D23: =apply(R2C1) -> #NAME? | E23: =apply(R2C1) -> #NAME? | F23: =apply(R2C1) -> #NAME? | G23: =apply(R2C1) -> #NAME? | H23: =apply(R2C1) -> #NAME? | I23: =apply(R2C1) -> #NAME? | J23: =apply(R2C1) -> #NAME?

Sheet: Data
A1: Making van der Corput numbers
A3: Base 2
A4: 0.5 | B4: =hcat(RC[-1]) -> #NAME?
A5: =R[-1]C/2 -> 0.25 | B5: =hcat(R[-1]C,nextvdc(RC[-1],R[-1]C)) -> #NAME?
A6: =R[-1]C/2 -> 0.125 | B6: =hcat(R[-1]C,nextvdc(RC[-1],R[-1]C)) -> #NAME?
A7: =R[-1]C/2 -> 6.25E-2 | B7: =hcat(R[-1]C,nextvdc(RC[-1],R[-1]C)) -> #NAME?
A8: =R[-1]C/2 -> 3.125E-2 | B8: =hcat(R[-1]C,nextvdc(RC[-1],R[-1]C)) -> #NAME?
A9: =R[-1]C/2 -> 1.5625E-2 | B9: =hcat(R[-1]C,nextvdc(RC[-1],R[-1]C)) -> #NAME?
A10: =R[-1]C/2 -> 7.8125E-3 | B10: =hcat(R[-1]C,nextvdc(RC[-1],R[-1]C)) -> #NAME?
A11: =R[-1]C/2 -> 3.90625E-3 | B11: =hcat(R[-1]C,nextvdc(RC[-1],R[-1]C)) -> #NAME?
A12: =R[-1]C/2 -> 1.953125E-3 | B12: =hcat(R[-1]C,nextvdc(RC[-1],R[-1]C)) -> #NAME?
A13: =R[-1]C/2 -> 9.765625E-4 | B13: =hcat(R[-1]C,nextvdc(RC[-1],R[-1]C)) -> #NAME?