Sheet: @NormalDist
A1: Some function sheet examples | C1: sestoft@itu.dk 2007-09-25
A3: The distribution function of the Gaussian distribution N(0,1)
A4: Algorithm 66 in Statlib, based on alg. 5666 from JF Hart: Computer approximations, 1968
A6: z = | B6: -5
A7: p = | B7: =IF(R[-1]C<0, R[4]C, 1-R[4]C) -> 2.8665157189233346E-7 | D7: =define("normdistcdf", RC[-2],R[-1]C[-2]) -> #NAME?
A8: zabs = | B8: =ABS(R[-2]C) -> 5
A9: expntl = | B9: =EXP(-1*R[-1]C*R[-1]C/2) -> 3.7266531720786709E-6
A10: pdf = | B10: =R[-1]C/SQRT(2*PI()) -> 1.4867195147342979E-6
A11: p' = | B11: =IF(R[-3]C>37,0,IF(R[-3]C<7.071,R[-2]C*R[3]C/R[3]C[2],R[-1]C/(R[-3]C+1/(R[-3]C+2/(R[-3]C+3/(R[-3]C+4/(R[-3]C+0.65))))))) -> 2.8665157189233346E-7
A13: pi | C13: qi
A14: 220.206867912376 | B14: =RC[-1]+R8C2*R[1]C -> 15090.76535897376 | C14: 440.413735824752 | D14: =RC[-1]+R8C2*R[1]C -> 196189.56987697084
A15: 221.21359616993101 | B15: =RC[-1]+R8C2*R[1]C -> 2974.1116982122767 | C15: 793.82651251994798 | D15: =RC[-1]+R8C2*R[1]C -> 39149.831228229217
A16: 112.07929149787 | B16: =RC[-1]+R8C2*R[1]C -> 550.57962040846917 | C16: 637.333633378831 | D16: =RC[-1]+R8C2*R[1]C -> 7671.2009431418537
A17: 33.912866078382997 | B17: =RC[-1]+R8C2*R[1]C -> 87.700065782119822 | C17: 296.56424877967299 | D17: =RC[-1]+R8C2*R[1]C -> 1406.7734619526045
A18: 6.3739622035316499 | B18: =RC[-1]+R8C2*R[1]C -> 10.757439940747364 | C18: 86.780732202945998 | D18: =RC[-1]+R8C2*R[1]C -> 222.04184263458632
A19: 0.70038306444368803 | B19: =RC[-1]+R8C2*R[1]C -> 0.87669554744314304 | C19: 16.064177579206898 | D19: =RC[-1]+R8C2*R[1]C -> 27.052222086328058
A20: 3.5262496599891002E-2 | B20: =RC[-1] -> 3.5262496599891002E-2 | C20: 1.7556671631826399 | D20: =RC[-1]+R8C2*R[1]C -> 2.1976089014242319
C21: 8.8388347648318405E-2 | D21: =RC[-1] -> 8.8388347648318405E-2
A23: The inverse distribution function of the Gaussian distribution N(0,1)
A24: Algorithm AS241 from Applied Statistics 37, 3, 1988
A25: This agrees well with the R qnorm() function and hence seems more precise than Excel's built-in function
A27: p = | B27: 0.49
A28: z = | B28: =IF(ABS(R29C2)<=0.425, R29C2*R40C2/R40C4, R31C2) -> -2.5068908258711046E-2 | D28: =define("invnormdistcdf",RC[-2],R[-1]C[-2]) -> #NAME?
A29: q = | B29: =R[-2]C-0.5 -> -1.0000000000000009E-2
A30: r = | B30: =0.180625-R[-1]C*R[-1]C -> 0.18052500000000002
A31: z' = | B31: =IF(R43C2<=5,R53C2/R53C4, R62C2/R62C4)*IF(R[-2]C<0, -1, 1) -> -2.50689292653569E-2
A33: 2509.0809287301199 | B33: =RC[-1]*R30C2 -> 452.95183465900493 | C33: 5226.4952788528499 | D33: =RC[-1]*R30C2 -> 943.51306021491087
A34: 33430.575583588099 | B34: =(R[-1]C+RC[-1])*R30C2 -> 6116.8237871790589 | C34: 28729.085735721899 | D34: =(R[-1]C+RC[-1])*R30C2 -> 5356.6458976364929
A35: 67265.770927008707 | B35: =(R[-1]C+RC[-1])*R30C2 -> 13247.392910778748 | C35: 39307.895800092701 | D35: =(R[-1]C+RC[-1])*R30C2 -> 8063.066389982564
A36: 45921.953931549797 | B36: =(R[-1]C+RC[-1])*R30C2 -> 10681.546338711361 | C36: 21213.794301586498 | D36: =(R[-1]C+RC[-1])*R30C2 -> 5285.2052763455058
A37: 13731.693765509401 | B37: =(R[-1]C+RC[-1])*R30C2 -> 4407.2001698144541 | C37: 5394.1960214247501 | D37: =(R[-1]C+RC[-1])*R30C2 -> 1927.8989192799754
A38: 1971.59095030655 | B38: =(R[-1]C+RC[-1])*R30C2 -> 1151.5312669598445 | C38: 687.18700749205698 | D38: =(R[-1]C+RC[-1])*R30C2 -> 472.08838693052121
A39: 133.14166789178401 | B39: =(R[-1]C+RC[-1])*R30C2 -> 231.91558156409025 | C39: 42.313330701600897 | D39: =(R[-1]C+RC[-1])*R30C2 -> 92.862370075538848
A40: 3.3871328727963599 | B40: =R[-1]C+RC[-1] -> 235.30271443688662 | C40: 1 | D40: =R[-1]C+RC[-1] -> 93.862370075538848
A42: r' = | B42: =IF(R[-13]C<0, R[-15]C, 1-R[-15]C) -> 0.49
A43: r'' = | B43: =SQRT(-1*LN(R[-1]C)) -> 0.84460043090059145
A44: r''' = | B44: =IF(R43C2<=5, R43C2-1.6, R43C2-5) -> -0.75539956909940864
A46: 7.7454501427834095E-4 | B46: =RC[-1]*R44C2 -> -5.8509097003395412E-4 | C46: 1.0507500716444101E-9 | D46: =RC[-1]*R44C2 -> -7.9373615135136011E-10
A47: 2.2723844989269101E-2 | B47: =(R[-1]C+RC[-1])*R44C2 -> -1.672360524652803E-2 | C47: 5.47593808499534E-4 | D47: =(R[-1]C+RC[-1])*R44C2 -> -4.136515273941054E-4
A48: 0.24178072517745 | B48: =(R[-1]C+RC[-1])*R44C2 -> -0.17000805141857239 | C48: 1.51986665636164E-2 | D48: =(R[-1]C+RC[-1])*R44C2 -> -1.1168593987490599E-2
A49: 1.27045825245236 | B49: =(R[-1]C+RC[-1])*R44C2 -> -0.83127960767628073 | C49: 0.14810397642747999 | D49: =(R[-1]C+RC[-1])*R44C2 -> -0.10344092888963072
A50: 3.6478483247632001 | B50: =(R[-1]C+RC[-1])*R44C2 -> -2.1276347952263333 | C50: 0.68976733498510001 | D50: =(R[-1]C+RC[-1])*R44C2 -> -0.44291071451612235
A51: 5.7694972214606901 | B51: =(R[-1]C+RC[-1])*R44C2 -> -2.75106130749676 | C51: 1.6763848301838 | D51: =(R[-1]C+RC[-1])*R44C2 -> -0.93176581547063786
A52: 4.6303378461565403 | B52: =(R[-1]C+RC[-1])*R44C2 -> -1.4196046875222261 | C52: 2.0531916266377501 | D52: =(R[-1]C+RC[-1])*R44C2 -> -0.84712457453259138
A53: 1.4234371107496799 | B53: =R[-1]C+RC[-1] -> 3.8324232274538073E-3 | C53: 1 | D53: =R[-1]C+RC[-1] -> 0.15287542546740862
A55: 2.0103343992922799E-7 | B55: =RC[-1]*R44C2 -> -1.5186057389711067E-7 | C55: 2.0442631033899298E-15 | D55: =RC[-1]*R44C2 -> -1.5442354674265729E-15
A56: 2.7115555687434801E-5 | B56: =(R[-1]C+RC[-1])*R44C2 -> -2.03683636700942E-5 | C56: 1.4215117583164401E-7 | D56: =(R[-1]C+RC[-1])*R44C2 -> -1.0738093580368334E-7
A57: 1.2426609473880699E-3 | B57: =(R[-1]C+RC[-1])*R44C2 -> -9.2331929105396167E-4 | C57: 1.8463183175100501E-5 | D57: =(R[-1]C+RC[-1])*R44C2 -> -1.3865965102038776E-5
A58: 2.65321895265761E-2 | B58: =(R[-1]C+RC[-1])*R44C2 -> -1.9344929541036095E-2 | C58: 7.8686913114561297E-4 | D58: =(R[-1]C+RC[-1])*R44C2 -> -5.8392625854179455E-4
A59: 0.29656057182850398 | B59: =(R[-1]C+RC[-1])*R44C2 -> -0.20940857673156904 | C59: 1.4875361290850601E-2 | D59: =(R[-1]C+RC[-1])*R44C2 -> -1.0795743865218265E-2
A60: 1.78482653991729 | B60: =(R[-1]C+RC[-1])*R44C2 -> -1.1900700505419617 | C60: 0.136929880922735 | D60: =(R[-1]C+RC[-1])*R44C2 -> -9.52816727819739E-2
A61: 5.4637849111641099 | B61: =(R[-1]C+RC[-1])*R44C2 -> -3.2283623641677095 | C61: 0.59983220655588698 | D61: =(R[-1]C+RC[-1])*R44C2 -> -0.38113725580169061
A62: 6.6579046435010998 | B62: =R[-1]C+RC[-1] -> 3.4295422793333903 | C62: 1 | D62: =R[-1]C+RC[-1] -> 0.61886274419830944

Sheet: Sheet2
A1: Testing and benchmarking NORMDISTCDF and INVNORMDISTCDF
A3: =normdistcdf(-3) -> #NAME? | B3: =invnormdistcdf(RC[-1]) -> #NAME?
A4: 1.3498980316301035E-3 | B4: -3
A7: 1000 | D7: 1000
A8: NORMDISTCDF | D8: INVNORMDISTCDF
A9: =closure("normdistcdf",-3) -> #NAME? | D9: =closure("invnormdistcdf",0.03) -> #NAME?
A11: =benchmark(R9C,R7C) -> #NAME? | D11: =benchmark(R9C,R7C) -> #NAME?
A12: =benchmark(R9C,R7C) -> #NAME? | D12: =benchmark(R9C,R7C) -> #NAME?
A13: =benchmark(R9C,R7C) -> #NAME? | D13: =benchmark(R9C,R7C) -> #NAME?
A14: =benchmark(R9C,R7C) -> #NAME? | D14: =benchmark(R9C,R7C) -> #NAME?
A15: =benchmark(R9C,R7C) -> #NAME? | D15: =benchmark(R9C,R7C) -> #NAME?
A16: =benchmark(R9C,R7C) -> #NAME? | D16: =benchmark(R9C,R7C) -> #NAME?
A17: =benchmark(R9C,R7C) -> #NAME? | D17: =benchmark(R9C,R7C) -> #NAME?
A18: =benchmark(R9C,R7C) -> #NAME? | D18: =benchmark(R9C,R7C) -> #NAME?
A20: =AVERAGE(R[-9]C:R[-2]C) -> #NAME? | D20: =AVERAGE(R[-9]C:R[-2]C) -> #NAME?