Sheet: Sheet1
A1: 0.5 | B1: =SUM(R1C1:R10C1) -> 5.0002250060001057
A2: =R[-1]C*1.00001 -> 0.50000500000000003 | B2: =SUM(R1C1:R10C1) -> 5.0002250060001057
A3: =R[-1]C*1.00001 -> 0.50001000005000007 | B3: =SUM(R1C1:R10C1) -> 5.0002250060001057
A4: =R[-1]C*1.00001 -> 0.50001500015000055 | B4: =SUM(R1C1:R10C1) -> 5.0002250060001057
A5: =R[-1]C*1.00001 -> 0.50002000030000204 | B5: =SUM(R1C1:R10C1) -> 5.0002250060001057
A6: =R[-1]C*1.00001 -> 0.50002500050000509 | B6: =SUM(R1C1:R10C1) -> 5.0002250060001057
A7: =R[-1]C*1.00001 -> 0.50003000075001014 | B7: =SUM(R1C1:R10C1) -> 5.0002250060001057
A8: =R[-1]C*1.00001 -> 0.50003500105001764 | B8: =SUM(R1C1:R10C1) -> 5.0002250060001057
A9: =R[-1]C*1.00001 -> 0.50004000140002813 | B9: =SUM(R1C1:R10C1) -> 5.0002250060001057
A10: =R[-1]C*1.00001 -> 0.50004500180004219 | B10: =SUM(R1C1:R10C1) -> 5.0002250060001057

Sheet: Sheet2
A1: 0.5 | B1: =R1C1 -> 0.5
B2: =R1C1 -> 0.5
B3: =R1C1 -> 0.5
B4: =R1C1 -> 0.5
B5: =R1C1 -> 0.5
B6: =R1C1 -> 0.5
B7: =R1C1 -> 0.5
B8: =R1C1 -> 0.5
B9: =R1C1 -> 0.5
B10: =R1C1 -> 0.5