Sheet: Results
A1: Test results for compiled built-ins and for sheet-defined functions | H1: Today = | I1: =gdate(TODAY()) -> #NAME?
A2: Ones here: | B2: =testall() -> #NAME? | C2: =AND(R[5]C,R[6]C) -> #NAME? | D2: =ABS(R[45]C[-2])<0.000001 -> #NAME? | E2: =AND(R[26]C[5],R[26]C[8]) -> #NAME? | F2: =AND(R[79]C[-2],R[79]C[1],R[79]C[4],R[79]C[7],R[107]C[-1]) -> #NAME? | G2: =R[120]C[-2] -> #NAME?
B3: =testapply() -> #NAME? | C3: =testmanyargs() -> #NAME? | D3: =R[157]C[3] -> 1 | E3: =R[162]C[2] -> #NAME? | F3: =R[169]C[1] -> #NAME? | G3: =R[179]C -> #NAME?
B4: =AND(R[56]C,R[56]C[10]) -> #NAME? | C4: =AND(R[58]C[-1],R[58]C[9]) -> #NAME? | D4: =testiserror() -> #NAME? | E4: =R[37]C[5] -> #NAME? | F4: =AND(R[120]C[-2],R[121]C[-2]) -> #NAME? | G4: =R[184]C -> #NAME?
B5: =testvscan() -> #NAME? | C5: =testhscan() -> #NAME? | D5: =testspecmonthlen() -> #NAME?
A7: =normdensity(1) -> #NAME? | B7: 0.241970724519143 | C7: =ABS(RC[-2]-RC[-1])<0.00001 -> #NAME?
A8: =normdensitygeneral(1,2,3) -> #NAME? | B8: 0.12579440923099799 | C8: =ABS(RC[-2]-RC[-1])<0.00001 -> #NAME?
A10: a | B10: b | C10: c | D10: area
A11: 3 | B11: 4 | C11: 5 | D11: =triarea(RC[-3],RC[-2],RC[-1]) -> #NAME?
A12: 30 | B12: 40 | C12: 50 | D12: =triarea(RC[-3],RC[-2],RC[-1]) -> #NAME?
A13: 100 | B13: 100 | C13: 100 | D13: =triarea(RC[-3],RC[-2],RC[-1]) -> #NAME?
A15: Table of leap years | G15: Binomial | L15: Log binomial
A16: 1880 | B16: =leapyear(RC[-1]) -> #NAME? | D16: =RC[-3]+100 -> 1980 | E16: =leapyear(RC[-1]) -> #NAME? | G16: 0 | H16: =BINOM(52-RC[-1],RC[-1]) -> #NAME? | I16: 1 | J16: =ABS(RC8-RC[-1])<0.5 -> #NAME? | L16: =binomlog(52-RC[-5],RC[-5]) -> #NAME? | M16: =ABS(RC8-RC[-1])<0.5 -> #NAME?
A17: 1881 | B17: =leapyear(RC[-1]) -> #NAME? | D17: =RC[-3]+100 -> 1981 | E17: =leapyear(RC[-1]) -> #NAME? | G17: =R[-1]C+1 -> 1 | H17: =BINOM(52-RC[-1],RC[-1]) -> #NAME? | I17: 52 | J17: =ABS(RC8-RC[-1])<0.5 -> #NAME? | L17: =binomlog(52-RC[-5],RC[-5]) -> #NAME? | M17: =ABS(RC8-RC[-1])<0.5 -> #NAME?
A18: 1890 | B18: =leapyear(RC[-1]) -> #NAME? | D18: =RC[-3]+100 -> 1990 | E18: =leapyear(RC[-1]) -> #NAME? | G18: =R[-1]C+1 -> 2 | H18: =BINOM(52-RC[-1],RC[-1]) -> #NAME? | I18: 1326 | J18: =ABS(RC8-RC[-1])<0.5 -> #NAME? | L18: =binomlog(52-RC[-5],RC[-5]) -> #NAME? | M18: =ABS(RC8-RC[-1])<0.5 -> #NAME?
A19: 1891 | B19: =leapyear(RC[-1]) -> #NAME? | D19: =RC[-3]+100 -> 1991 | E19: =leapyear(RC[-1]) -> #NAME? | G19: =R[-1]C+1 -> 3 | H19: =BINOM(52-RC[-1],RC[-1]) -> #NAME? | I19: 22100 | J19: =ABS(RC8-RC[-1])<0.5 -> #NAME? | L19: =binomlog(52-RC[-5],RC[-5]) -> #NAME? | M19: =ABS(RC8-RC[-1])<0.5 -> #NAME?
A20: 1892 | B20: =leapyear(RC[-1]) -> #NAME? | D20: =RC[-3]+100 -> 1992 | E20: =leapyear(RC[-1]) -> #NAME? | G20: =R[-1]C+1 -> 4 | H20: =BINOM(52-RC[-1],RC[-1]) -> #NAME? | I20: 270725 | J20: =ABS(RC8-RC[-1])<0.5 -> #NAME? | L20: =binomlog(52-RC[-5],RC[-5]) -> #NAME? | M20: =ABS(RC8-RC[-1])<0.5 -> #NAME?
A21: 1899 | B21: =leapyear(RC[-1]) -> #NAME? | D21: =RC[-3]+100 -> 1999 | E21: =leapyear(RC[-1]) -> #NAME? | G21: =R[-1]C+1 -> 5 | H21: =BINOM(52-RC[-1],RC[-1]) -> #NAME? | I21: 2598960 | J21: =ABS(RC8-RC[-1])<0.5 -> #NAME? | L21: =binomlog(52-RC[-5],RC[-5]) -> #NAME? | M21: =ABS(RC8-RC[-1])<0.5 -> #NAME?
A22: =R[-1]C+1 -> 1900 | B22: =leapyear(RC[-1]) -> #NAME? | D22: =RC[-3]+100 -> 2000 | E22: =leapyear(RC[-1]) -> #NAME? | G22: =R[-1]C+1 -> 6 | H22: =BINOM(52-RC[-1],RC[-1]) -> #NAME? | I22: 20358520 | J22: =ABS(RC8-RC[-1])<0.5 -> #NAME? | L22: =binomlog(52-RC[-5],RC[-5]) -> #NAME? | M22: =ABS(RC8-RC[-1])<0.5 -> #NAME?
A23: =R[-1]C+1 -> 1901 | B23: =leapyear(RC[-1]) -> #NAME? | D23: =RC[-3]+100 -> 2001 | E23: =leapyear(RC[-1]) -> #NAME? | G23: =R[-1]C+1 -> 7 | H23: =BINOM(52-RC[-1],RC[-1]) -> #NAME? | I23: 133784560 | J23: =ABS(RC8-RC[-1])<0.5 -> #NAME? | L23: =binomlog(52-RC[-5],RC[-5]) -> #NAME? | M23: =ABS(RC8-RC[-1])<0.5 -> #NAME?
A24: 1904 | B24: =leapyear(RC[-1]) -> #NAME? | D24: =RC[-3]+100 -> 2004 | E24: =leapyear(RC[-1]) -> #NAME? | G24: =R[-1]C+1 -> 8 | H24: =BINOM(52-RC[-1],RC[-1]) -> #NAME? | I24: 752538150 | J24: =ABS(RC8-RC[-1])<0.5 -> #NAME? | L24: =binomlog(52-RC[-5],RC[-5]) -> #NAME? | M24: =ABS(RC8-RC[-1])<0.5 -> #NAME?
G25: =R[-1]C+1 -> 9 | H25: =BINOM(52-RC[-1],RC[-1]) -> #NAME? | I25: 3679075400 | J25: =ABS(RC8-RC[-1])<0.5 -> #NAME? | L25: =binomlog(52-RC[-5],RC[-5]) -> #NAME? | M25: =ABS(RC8-RC[-1])<0.5 -> #NAME?
G26: =R[-1]C+1 -> 10 | H26: =BINOM(52-RC[-1],RC[-1]) -> #NAME? | I26: 15820024220 | J26: =ABS(RC8-RC[-1])<0.5 -> #NAME? | L26: =binomlog(52-RC[-5],RC[-5]) -> #NAME? | M26: =ABS(RC8-RC[-1])<0.5 -> #NAME?
G27: =R[-1]C+1 -> 11 | H27: =BINOM(52-RC[-1],RC[-1]) -> #NAME? | I27: 60403728840 | J27: =ABS(RC8-RC[-1])<0.5 -> #NAME? | L27: =binomlog(52-RC[-5],RC[-5]) -> #NAME? | M27: =ABS(RC8-RC[-1])<0.5 -> #NAME?
A28: Die rolls | J28: =AND(R[-12]C,R[-11]C,R[-10]C,R[-9]C,R[-8]C,R[-7]C,R[-6]C,R[-5]C,R[-4]C,R[-3]C,R[-2]C,R[-1]C) -> #NAME? | M28: =AND(R[-12]C,R[-11]C,R[-10]C,R[-9]C,R[-8]C,R[-7]C,R[-6]C,R[-5]C,R[-4]C,R[-3]C,R[-2]C,R[-1]C) -> #NAME?
A29: =CLOSURE("ndie",6) -> #NAME? | B29: =CLOSURE("ndie",40) -> #NAME? | D29: REPT1 | E29: REPT3 | F29: REPT4
A30: =apply(R29C) -> #NAME? | B30: =apply(R29C) -> #NAME? | D30: =rept1("|", RC[-2]) -> #NAME? | E30: =rept3("|", RC[-3]) -> #NAME? | F30: =rept4("|",RC[-4]) -> #NAME? | G30: =LEN(RC[-3])=RC2 -> #NAME? | H30: =LEN(RC[-3])=RC2 -> #NAME? | I30: =LEN(RC[-3])=RC2 -> #NAME? | J30: =AND(RC[-3],RC[-2],RC[-1]) -> #NAME?
A31: =apply(R29C) -> #NAME? | B31: =apply(R29C) -> #NAME? | D31: =rept1("|", RC[-2]) -> #NAME? | E31: =rept3("|", RC[-3]) -> #NAME? | F31: =rept4("|",RC[-4]) -> #NAME? | G31: =LEN(RC[-3])=RC2 -> #NAME? | H31: =LEN(RC[-3])=RC2 -> #NAME? | I31: =LEN(RC[-3])=RC2 -> #NAME? | J31: =AND(RC[-3],RC[-2],RC[-1]) -> #NAME?
A32: =apply(R29C) -> #NAME? | B32: =apply(R29C) -> #NAME? | D32: =rept1("|", RC[-2]) -> #NAME? | E32: =rept3("|", RC[-3]) -> #NAME? | F32: =rept4("|",RC[-4]) -> #NAME? | G32: =LEN(RC[-3])=RC2 -> #NAME? | H32: =LEN(RC[-3])=RC2 -> #NAME? | I32: =LEN(RC[-3])=RC2 -> #NAME? | J32: =AND(RC[-3],RC[-2],RC[-1]) -> #NAME?
A33: =apply(R29C) -> #NAME? | B33: =apply(R29C) -> #NAME? | D33: =rept1("|", RC[-2]) -> #NAME? | E33: =rept3("|", RC[-3]) -> #NAME? | F33: =rept4("|",RC[-4]) -> #NAME? | G33: =LEN(RC[-3])=RC2 -> #NAME? | H33: =LEN(RC[-3])=RC2 -> #NAME? | I33: =LEN(RC[-3])=RC2 -> #NAME? | J33: =AND(RC[-3],RC[-2],RC[-1]) -> #NAME?
A34: =apply(R29C) -> #NAME? | B34: =apply(R29C) -> #NAME? | D34: =rept1("|", RC[-2]) -> #NAME? | E34: =rept3("|", RC[-3]) -> #NAME? | F34: =rept4("|",RC[-4]) -> #NAME? | G34: =LEN(RC[-3])=RC2 -> #NAME? | H34: =LEN(RC[-3])=RC2 -> #NAME? | I34: =LEN(RC[-3])=RC2 -> #NAME? | J34: =AND(RC[-3],RC[-2],RC[-1]) -> #NAME?
A35: =apply(R29C) -> #NAME? | B35: =apply(R29C) -> #NAME? | D35: =rept1("|", RC[-2]) -> #NAME? | E35: =rept3("|", RC[-3]) -> #NAME? | F35: =rept4("|",RC[-4]) -> #NAME? | G35: =LEN(RC[-3])=RC2 -> #NAME? | H35: =LEN(RC[-3])=RC2 -> #NAME? | I35: =LEN(RC[-3])=RC2 -> #NAME? | J35: =AND(RC[-3],RC[-2],RC[-1]) -> #NAME?
A36: =apply(R29C) -> #NAME? | B36: =apply(R29C) -> #NAME? | D36: =rept1("|", RC[-2]) -> #NAME? | E36: =rept3("|", RC[-3]) -> #NAME? | F36: =rept4("|",RC[-4]) -> #NAME? | G36: =LEN(RC[-3])=RC2 -> #NAME? | H36: =LEN(RC[-3])=RC2 -> #NAME? | I36: =LEN(RC[-3])=RC2 -> #NAME? | J36: =AND(RC[-3],RC[-2],RC[-1]) -> #NAME?
A37: =apply(R29C) -> #NAME? | B37: =apply(R29C) -> #NAME? | D37: =rept1("|", RC[-2]) -> #NAME? | E37: =rept3("|", RC[-3]) -> #NAME? | F37: =rept4("|",RC[-4]) -> #NAME? | G37: =LEN(RC[-3])=RC2 -> #NAME? | H37: =LEN(RC[-3])=RC2 -> #NAME? | I37: =LEN(RC[-3])=RC2 -> #NAME? | J37: =AND(RC[-3],RC[-2],RC[-1]) -> #NAME?
A38: =apply(R29C) -> #NAME? | B38: =apply(R29C) -> #NAME? | D38: =rept1("|", RC[-2]) -> #NAME? | E38: =rept3("|", RC[-3]) -> #NAME? | F38: =rept4("|",RC[-4]) -> #NAME? | G38: =LEN(RC[-3])=RC2 -> #NAME? | H38: =LEN(RC[-3])=RC2 -> #NAME? | I38: =LEN(RC[-3])=RC2 -> #NAME? | J38: =AND(RC[-3],RC[-2],RC[-1]) -> #NAME?
A39: =apply(R29C) -> #NAME? | B39: =apply(R29C) -> #NAME? | D39: =rept1("|", RC[-2]) -> #NAME? | E39: =rept3("|", RC[-3]) -> #NAME? | F39: =rept4("|",RC[-4]) -> #NAME? | G39: =LEN(RC[-3])=RC2 -> #NAME? | H39: =LEN(RC[-3])=RC2 -> #NAME? | I39: =LEN(RC[-3])=RC2 -> #NAME? | J39: =AND(RC[-3],RC[-2],RC[-1]) -> #NAME?
A40: =apply(R29C) -> #NAME? | B40: =apply(R29C) -> #NAME? | D40: =rept1("|", RC[-2]) -> #NAME? | E40: =rept3("|", RC[-3]) -> #NAME? | F40: =rept4("|",RC[-4]) -> #NAME? | G40: =LEN(RC[-3])=RC2 -> #NAME? | H40: =LEN(RC[-3])=RC2 -> #NAME? | I40: =LEN(RC[-3])=RC2 -> #NAME? | J40: =AND(RC[-3],RC[-2],RC[-1]) -> #NAME?
J41: =AND(R[-11]C,R[-10]C,R[-9]C,R[-8]C,R[-7]C,R[-6]C,R[-5]C,R[-4]C,R[-3]C,R[-2]C,R[-1]C) -> #NAME?
A42: Test of adaptive integration of 1/x
A43: x = | B43: 100000
B44: =CLOSURE("recip",NA()) -> #NAME?
A45: int(1/x,1,x) = | B45: =INTEGRATE(R[-1]C,1,R[-2]C) -> #NAME?
A46: ln(x) = | B46: =LN(R[-3]C) -> 11.512925464970229
A47: difference = | B47: =R[-2]C-R[-1]C -> #NAME?
A50: Solution to x=cos(x)
A51: a0 = | B51: 0
A52: root = | B52: =goalseek(CLOSURE("xcosx"),0,R[-1]C) -> #NAME? | C52: =xcosx(RC[-1]) -> #NAME?
A54: Effective interest rate of bullet loan
A55: 4% coupon, 10 years
A56: price = | B56: 90 | C56: =RC[-1]+1 -> 91 | D56: =RC[-1]+1 -> 92 | E56: =RC[-1]+1 -> 93 | F56: =RC[-1]+1 -> 94 | G56: =RC[-1]+1 -> 95 | H56: =RC[-1]+1 -> 96 | I56: =RC[-1]+1 -> 97 | J56: =RC[-1]+1 -> 98 | K56: =RC[-1]+1 -> 99 | L56: =RC[-1]+1 -> 100 | M56: =RC[-1]+1 -> 101
A57: yield = | B57: 4
B58: =CLOSURE("bulletPV",R57C2,10,NA()) -> #NAME?
A59: Eff. int. = | B59: =goalseek(R58C2,R56C,R57C2) -> #NAME? | C59: =goalseek(R58C2,R56C,R57C2) -> #NAME? | D59: =goalseek(R58C2,R56C,R57C2) -> #NAME? | E59: =goalseek(R58C2,R56C,R57C2) -> #NAME? | F59: =goalseek(R58C2,R56C,R57C2) -> #NAME? | G59: =goalseek(R58C2,R56C,R57C2) -> #NAME? | H59: =goalseek(R58C2,R56C,R57C2) -> #NAME? | I59: =goalseek(R58C2,R56C,R57C2) -> #NAME? | J59: =goalseek(R58C2,R56C,R57C2) -> #NAME? | K59: =goalseek(R58C2,R56C,R57C2) -> #NAME? | L59: =goalseek(R58C2,R56C,R57C2) -> #NAME? | M59: =goalseek(R58C2,R56C,R57C2) -> #NAME?
B60: =ABS(R[-1]C-5.314925821498)<0.0000001 -> #NAME? | L60: =ABS(R[-1]C-R57C2)<0.000000001 -> #NAME?
A61: Eff. int. = | B61: =goalseekr(R58C2,R56C,R57C2) -> #NAME? | C61: =goalseekr(R58C2,R56C,R57C2) -> #NAME? | D61: =goalseekr(R58C2,R56C,R57C2) -> #NAME? | E61: =goalseekr(R58C2,R56C,R57C2) -> #NAME? | F61: =goalseekr(R58C2,R56C,R57C2) -> #NAME? | G61: =goalseekr(R58C2,R56C,R57C2) -> #NAME? | H61: =goalseekr(R58C2,R56C,R57C2) -> #NAME? | I61: =goalseekr(R58C2,R56C,R57C2) -> #NAME? | J61: =goalseekr(R58C2,R56C,R57C2) -> #NAME? | K61: =goalseekr(R58C2,R56C,R57C2) -> #NAME? | L61: =goalseekr(R58C2,R56C,R57C2) -> #NAME? | M61: =goalseekr(R58C2,R56C,R57C2) -> #NAME?
B62: =ABS(R[-1]C-5.314925821498)<0.0000001 -> #NAME? | L62: =ABS(R[-1]C-R57C2)<0.000000001 -> #NAME?
A64: Effective interest after tax, 3% coupon, 6 year, taxrate 32%, PV=98.1
A65: =goalseek(CLOSURE("bulletpvaftertax",3,6,32,NA()),98.1,3) -> #NAME?
A67: Test calendar functions
B68: efixdate | D68: OK | E68: weekday | G68: OK | H68: kdayoa(sun) | J68: OK | K68: isoweek | M68: OK
A69: 19991231 | B69: =efixdate(RC[-1]) -> #NAME? | C69: 730119 | D69: =(RC[-2]=RC[-1]) -> #NAME? | E69: =WEEKDAY(RC[-3]) -> #NAME? | F69: 4 | G69: =(RC[-2]=RC[-1]) -> #NAME? | H69: =kdayoa(RC2,6) -> #NAME? | I69: 730121 | J69: =(RC[-2]=RC[-1]) -> #NAME? | K69: =isoweek(RC[-9]) -> #NAME? | L69: 52 | M69: =(RC[-2]=RC[-1]) -> #NAME?
A70: 20000101 | B70: =efixdate(RC[-1]) -> #NAME? | C70: =R[-1]C+1 -> 730120 | D70: =(RC[-2]=RC[-1]) -> #NAME? | E70: =WEEKDAY(RC[-3]) -> #NAME? | F70: 5 | G70: =(RC[-2]=RC[-1]) -> #NAME? | H70: =kdayoa(RC2,6) -> #NAME? | I70: 730121 | J70: =(RC[-2]=RC[-1]) -> #NAME? | K70: =isoweek(RC[-9]) -> #NAME? | L70: 52 | M70: =(RC[-2]=RC[-1]) -> #NAME?
A71: 20000229 | B71: =efixdate(RC[-1]) -> #NAME? | C71: =R[-2]C+60 -> 730179 | D71: =(RC[-2]=RC[-1]) -> #NAME? | E71: =WEEKDAY(RC[-3]) -> #NAME? | F71: 1 | G71: =(RC[-2]=RC[-1]) -> #NAME? | H71: =kdayoa(RC2,6) -> #NAME? | I71: 730184 | J71: =(RC[-2]=RC[-1]) -> #NAME? | K71: =isoweek(RC[-9]) -> #NAME? | L71: 9 | M71: =(RC[-2]=RC[-1]) -> #NAME?
A72: 20000301 | B72: =efixdate(RC[-1]) -> #NAME? | C72: =R[-1]C+1 -> 730180 | D72: =(RC[-2]=RC[-1]) -> #NAME? | E72: =WEEKDAY(RC[-3]) -> #NAME? | F72: 2 | G72: =(RC[-2]=RC[-1]) -> #NAME? | H72: =kdayoa(RC2,6) -> #NAME? | I72: 730184 | J72: =(RC[-2]=RC[-1]) -> #NAME? | K72: =isoweek(RC[-9]) -> #NAME? | L72: 9 | M72: =(RC[-2]=RC[-1]) -> #NAME?
A73: 20001231 | B73: =efixdate(RC[-1]) -> #NAME? | C73: =R[-4]C+366 -> 730485 | D73: =(RC[-2]=RC[-1]) -> #NAME? | E73: =WEEKDAY(RC[-3]) -> #NAME? | F73: 6 | G73: =(RC[-2]=RC[-1]) -> #NAME? | H73: =kdayoa(RC2,6) -> #NAME? | I73: 730485 | J73: =(RC[-2]=RC[-1]) -> #NAME? | K73: =isoweek(RC[-9]) -> #NAME? | L73: 52 | M73: =(RC[-2]=RC[-1]) -> #NAME?
A74: 20010101 | B74: =efixdate(RC[-1]) -> #NAME? | C74: =R[-1]C+1 -> 730486 | D74: =(RC[-2]=RC[-1]) -> #NAME? | E74: =WEEKDAY(RC[-3]) -> #NAME? | F74: 0 | G74: =(RC[-2]=RC[-1]) -> #NAME? | H74: =kdayoa(RC2,6) -> #NAME? | I74: =R[-1]C+7 -> 730492 | J74: =(RC[-2]=RC[-1]) -> #NAME? | K74: =isoweek(RC[-9]) -> #NAME? | L74: 1 | M74: =(RC[-2]=RC[-1]) -> #NAME?
A75: 20010228 | B75: =efixdate(RC[-1]) -> #NAME? | C75: =R[-2]C+59 -> 730544 | D75: =(RC[-2]=RC[-1]) -> #NAME? | E75: =WEEKDAY(RC[-3]) -> #NAME? | F75: 2 | G75: =(RC[-2]=RC[-1]) -> #NAME? | H75: =kdayoa(RC2,6) -> #NAME? | I75: =730548 -> 730548 | J75: =(RC[-2]=RC[-1]) -> #NAME? | K75: =isoweek(RC[-9]) -> #NAME? | L75: 9 | M75: =(RC[-2]=RC[-1]) -> #NAME?
A76: 20010301 | B76: =efixdate(RC[-1]) -> #NAME? | C76: =R[-1]C+1 -> 730545 | D76: =(RC[-2]=RC[-1]) -> #NAME? | E76: =WEEKDAY(RC[-3]) -> #NAME? | F76: 3 | G76: =(RC[-2]=RC[-1]) -> #NAME? | H76: =kdayoa(RC2,6) -> #NAME? | I76: =730548 -> 730548 | J76: =(RC[-2]=RC[-1]) -> #NAME? | K76: =isoweek(RC[-9]) -> #NAME? | L76: 9 | M76: =(RC[-2]=RC[-1]) -> #NAME?
A77: 20040229 | B77: =efixdate(RC[-1]) -> #NAME? | C77: 731640 | D77: =(RC[-2]=RC[-1]) -> #NAME? | E77: =WEEKDAY(RC[-3]) -> #NAME? | F77: 6 | G77: =(RC[-2]=RC[-1]) -> #NAME? | H77: =kdayoa(RC2,6) -> #NAME? | I77: =731640 -> 731640 | J77: =(RC[-2]=RC[-1]) -> #NAME? | K77: =isoweek(RC[-9]) -> #NAME? | L77: 9 | M77: =(RC[-2]=RC[-1]) -> #NAME?
A78: 20040301 | B78: =efixdate(RC[-1]) -> #NAME? | C78: =R[-1]C+1 -> 731641 | D78: =(RC[-2]=RC[-1]) -> #NAME? | E78: =WEEKDAY(RC[-3]) -> #NAME? | F78: 0 | G78: =(RC[-2]=RC[-1]) -> #NAME? | H78: =kdayoa(RC2,6) -> #NAME? | I78: =R[-1]C+7 -> 731647 | J78: =(RC[-2]=RC[-1]) -> #NAME? | K78: =isoweek(RC[-9]) -> #NAME? | L78: 10 | M78: =(RC[-2]=RC[-1]) -> #NAME?
A79: 21000228 | B79: =efixdate(RC[-1]) -> #NAME? | C79: 766703 | D79: =(RC[-2]=RC[-1]) -> #NAME? | E79: =WEEKDAY(RC[-3]) -> #NAME? | F79: 6 | G79: =(RC[-2]=RC[-1]) -> #NAME? | H79: =kdayoa(RC2,6) -> #NAME? | I79: 766703 | J79: =(RC[-2]=RC[-1]) -> #NAME? | K79: =isoweek(RC[-9]) -> #NAME? | L79: 8 | M79: =(RC[-2]=RC[-1]) -> #NAME?
A80: 21000301 | B80: =efixdate(RC[-1]) -> #NAME? | C80: =R[-1]C+1 -> 766704 | D80: =(RC[-2]=RC[-1]) -> #NAME? | E80: =WEEKDAY(RC[-3]) -> #NAME? | F80: 0 | G80: =(RC[-2]=RC[-1]) -> #NAME? | H80: =kdayoa(RC2,6) -> #NAME? | I80: =R[-1]C+7 -> 766710 | J80: =(RC[-2]=RC[-1]) -> #NAME? | K80: =isoweek(RC[-9]) -> #NAME? | L80: 9 | M80: =(RC[-2]=RC[-1]) -> #NAME?
D81: =AND(R[-12]C,R[-11]C,R[-10]C,R[-9]C,R[-8]C,R[-7]C,R[-6]C,R[-5]C,R[-4]C,R[-3]C,R[-2]C,R[-1]C) -> #NAME? | G81: =AND(R[-12]C,R[-11]C,R[-10]C,R[-9]C,R[-8]C,R[-7]C,R[-6]C,R[-5]C,R[-4]C,R[-3]C,R[-2]C,R[-1]C) -> #NAME? | J81: =AND(R[-12]C,R[-11]C,R[-10]C,R[-9]C,R[-8]C,R[-7]C,R[-6]C,R[-5]C,R[-4]C,R[-3]C,R[-2]C,R[-1]C) -> #NAME? | M81: =AND(R[-12]C,R[-11]C,R[-10]C,R[-9]C,R[-8]C,R[-7]C,R[-6]C,R[-5]C,R[-4]C,R[-3]C,R[-2]C,R[-1]C) -> #NAME?
A83: yyyy | B83: easterfixed | C83: Easter | D83: Correct | E83: OK | F83: St.bededag | G83: Ascension | H83: Pentecost
A84: 2008 | B84: =easter(RC1) -> #NAME? | C84: =gdate(RC2) -> #NAME? | D84: 20080323 | E84: =(RC[-2]=RC[-1]) -> #NAME? | F84: =gdate(RC2+26) -> #NAME? | G84: =gdate(RC2+39) -> #NAME? | H84: =gdate(RC2+49) -> #NAME?
A85: =R[-1]C+1 -> 2009 | B85: =easter(RC1) -> #NAME? | C85: =gdate(RC2) -> #NAME? | D85: 20090412 | E85: =(RC[-2]=RC[-1]) -> #NAME? | F85: =gdate(RC2+26) -> #NAME? | G85: =gdate(RC2+39) -> #NAME? | H85: =gdate(RC2+49) -> #NAME?
A86: =R[-1]C+1 -> 2010 | B86: =easter(RC1) -> #NAME? | C86: =gdate(RC2) -> #NAME? | D86: 20100404 | E86: =(RC[-2]=RC[-1]) -> #NAME? | F86: =gdate(RC2+26) -> #NAME? | G86: =gdate(RC2+39) -> #NAME? | H86: =gdate(RC2+49) -> #NAME?
A87: =R[-1]C+1 -> 2011 | B87: =easter(RC1) -> #NAME? | C87: =gdate(RC2) -> #NAME? | D87: 20110424 | E87: =(RC[-2]=RC[-1]) -> #NAME? | F87: =gdate(RC2+26) -> #NAME? | G87: =gdate(RC2+39) -> #NAME? | H87: =gdate(RC2+49) -> #NAME?
A88: =R[-1]C+1 -> 2012 | B88: =easter(RC1) -> #NAME? | C88: =gdate(RC2) -> #NAME? | D88: 20120408 | E88: =(RC[-2]=RC[-1]) -> #NAME? | F88: =gdate(RC2+26) -> #NAME? | G88: =gdate(RC2+39) -> #NAME? | H88: =gdate(RC2+49) -> #NAME?
A89: =R[-1]C+1 -> 2013 | B89: =easter(RC1) -> #NAME? | C89: =gdate(RC2) -> #NAME? | D89: 20130331 | E89: =(RC[-2]=RC[-1]) -> #NAME? | F89: =gdate(RC2+26) -> #NAME? | G89: =gdate(RC2+39) -> #NAME? | H89: =gdate(RC2+49) -> #NAME?
A90: =R[-1]C+1 -> 2014 | B90: =easter(RC1) -> #NAME? | C90: =gdate(RC2) -> #NAME? | D90: 20140420 | E90: =(RC[-2]=RC[-1]) -> #NAME? | F90: =gdate(RC2+26) -> #NAME? | G90: =gdate(RC2+39) -> #NAME? | H90: =gdate(RC2+49) -> #NAME?
A91: =R[-1]C+1 -> 2015 | B91: =easter(RC1) -> #NAME? | C91: =gdate(RC2) -> #NAME? | D91: 20150405 | E91: =(RC[-2]=RC[-1]) -> #NAME? | F91: =gdate(RC2+26) -> #NAME? | G91: =gdate(RC2+39) -> #NAME? | H91: =gdate(RC2+49) -> #NAME?
A92: =R[-1]C+1 -> 2016 | B92: =easter(RC1) -> #NAME? | C92: =gdate(RC2) -> #NAME? | D92: 20160327 | E92: =(RC[-2]=RC[-1]) -> #NAME? | F92: =gdate(RC2+26) -> #NAME? | G92: =gdate(RC2+39) -> #NAME? | H92: =gdate(RC2+49) -> #NAME?
A93: =R[-1]C+1 -> 2017 | B93: =easter(RC1) -> #NAME? | C93: =gdate(RC2) -> #NAME? | D93: 20170416 | E93: =(RC[-2]=RC[-1]) -> #NAME? | F93: =gdate(RC2+26) -> #NAME? | G93: =gdate(RC2+39) -> #NAME? | H93: =gdate(RC2+49) -> #NAME?
A94: =R[-1]C+1 -> 2018 | B94: =easter(RC1) -> #NAME? | C94: =gdate(RC2) -> #NAME? | D94: 20180401 | E94: =(RC[-2]=RC[-1]) -> #NAME? | F94: =gdate(RC2+26) -> #NAME? | G94: =gdate(RC2+39) -> #NAME? | H94: =gdate(RC2+49) -> #NAME?
A95: =R[-1]C+1 -> 2019 | B95: =easter(RC1) -> #NAME? | C95: =gdate(RC2) -> #NAME? | D95: 20190421 | E95: =(RC[-2]=RC[-1]) -> #NAME? | F95: =gdate(RC2+26) -> #NAME? | G95: =gdate(RC2+39) -> #NAME? | H95: =gdate(RC2+49) -> #NAME?
A96: =R[-1]C+1 -> 2020 | B96: =easter(RC1) -> #NAME? | C96: =gdate(RC2) -> #NAME? | D96: 20200412 | E96: =(RC[-2]=RC[-1]) -> #NAME? | F96: =gdate(RC2+26) -> #NAME? | G96: =gdate(RC2+39) -> #NAME? | H96: =gdate(RC2+49) -> #NAME?
A97: =R[-1]C+1 -> 2021 | B97: =easter(RC1) -> #NAME? | C97: =gdate(RC2) -> #NAME? | D97: 20210404 | E97: =(RC[-2]=RC[-1]) -> #NAME? | F97: =gdate(RC2+26) -> #NAME? | G97: =gdate(RC2+39) -> #NAME? | H97: =gdate(RC2+49) -> #NAME?
A98: =R[-1]C+1 -> 2022 | B98: =easter(RC1) -> #NAME? | C98: =gdate(RC2) -> #NAME? | D98: 20220417 | E98: =(RC[-2]=RC[-1]) -> #NAME? | F98: =gdate(RC2+26) -> #NAME? | G98: =gdate(RC2+39) -> #NAME? | H98: =gdate(RC2+49) -> #NAME?
A99: =R[-1]C+1 -> 2023 | B99: =easter(RC1) -> #NAME? | C99: =gdate(RC2) -> #NAME? | D99: 20230409 | E99: =(RC[-2]=RC[-1]) -> #NAME? | F99: =gdate(RC2+26) -> #NAME? | G99: =gdate(RC2+39) -> #NAME? | H99: =gdate(RC2+49) -> #NAME?
A100: =R[-1]C+1 -> 2024 | B100: =easter(RC1) -> #NAME? | C100: =gdate(RC2) -> #NAME? | D100: 20240331 | E100: =(RC[-2]=RC[-1]) -> #NAME? | F100: =gdate(RC2+26) -> #NAME? | G100: =gdate(RC2+39) -> #NAME? | H100: =gdate(RC2+49) -> #NAME?
A101: =R[-1]C+1 -> 2025 | B101: =easter(RC1) -> #NAME? | C101: =gdate(RC2) -> #NAME? | D101: 20250420 | E101: =(RC[-2]=RC[-1]) -> #NAME? | F101: =gdate(RC2+26) -> #NAME? | G101: =gdate(RC2+39) -> #NAME? | H101: =gdate(RC2+49) -> #NAME?
A102: =R[-1]C+1 -> 2026 | B102: =easter(RC1) -> #NAME? | C102: =gdate(RC2) -> #NAME? | D102: 20260405 | E102: =(RC[-2]=RC[-1]) -> #NAME? | F102: =gdate(RC2+26) -> #NAME? | G102: =gdate(RC2+39) -> #NAME? | H102: =gdate(RC2+49) -> #NAME?
A103: =R[-1]C+1 -> 2027 | B103: =easter(RC1) -> #NAME? | C103: =gdate(RC2) -> #NAME? | D103: 20270328 | E103: =(RC[-2]=RC[-1]) -> #NAME? | F103: =gdate(RC2+26) -> #NAME? | G103: =gdate(RC2+39) -> #NAME? | H103: =gdate(RC2+49) -> #NAME?
A104: =R[-1]C+1 -> 2028 | B104: =easter(RC1) -> #NAME? | C104: =gdate(RC2) -> #NAME? | D104: 20280416 | E104: =(RC[-2]=RC[-1]) -> #NAME? | F104: =gdate(RC2+26) -> #NAME? | G104: =gdate(RC2+39) -> #NAME? | H104: =gdate(RC2+49) -> #NAME?
A105: =R[-1]C+1 -> 2029 | B105: =easter(RC1) -> #NAME? | C105: =gdate(RC2) -> #NAME? | D105: 20290401 | E105: =(RC[-2]=RC[-1]) -> #NAME? | F105: =gdate(RC2+26) -> #NAME? | G105: =gdate(RC2+39) -> #NAME? | H105: =gdate(RC2+49) -> #NAME?
A106: =R[-1]C+1 -> 2030 | B106: =easter(RC1) -> #NAME? | C106: =gdate(RC2) -> #NAME? | D106: 20300421 | E106: =(RC[-2]=RC[-1]) -> #NAME? | F106: =gdate(RC2+26) -> #NAME? | G106: =gdate(RC2+39) -> #NAME? | H106: =gdate(RC2+49) -> #NAME?
A107: =R[-1]C+1 -> 2031 | B107: =easter(RC1) -> #NAME? | C107: =gdate(RC2) -> #NAME? | D107: 20310413 | E107: =(RC[-2]=RC[-1]) -> #NAME? | F107: =gdate(RC2+26) -> #NAME? | G107: =gdate(RC2+39) -> #NAME? | H107: =gdate(RC2+49) -> #NAME?
A108: =R[-1]C+1 -> 2032 | B108: =easter(RC1) -> #NAME? | C108: =gdate(RC2) -> #NAME? | D108: 20320328 | E108: =(RC[-2]=RC[-1]) -> #NAME? | F108: =gdate(RC2+26) -> #NAME? | G108: =gdate(RC2+39) -> #NAME? | H108: =gdate(RC2+49) -> #NAME?
E109: =AND(R[-25]C,R[-24]C,R[-23]C,R[-22]C,R[-21]C,R[-20]C,R[-19]C,R[-18]C,R[-17]C,R[-16]C,R[-15]C,R[-14]C,R[-13]C,R[-12]C,R[-11]C,R[-10]C,R[-9]C,R[-8]C,R[-7]C,R[-6]C,R[-5]C,R[-4]C,R[-3]C,R[-2]C,R[-1]C) -> #NAME?
A111: Calls to external functions
A112: indexof | B112: =indexof("","cde") -> #NAME? | C112: -1 | D112: =ABS(RC[-2]-RC[-1])<0.000000001 -> #NAME?
B113: =indexof("abcdef","cde") -> #NAME? | C113: 2 | D113: =ABS(RC[-2]-RC[-1])<0.000000001 -> #NAME?
A114: log16 | B114: =log16(1024) -> #NAME? | C114: 2.5 | D114: =ABS(RC[-2]-RC[-1])<0.000000001 -> #NAME?
A115: startswith | B115: =startswith("abcde", "bcd") -> #NAME? | C115: 0 | D115: =ABS(RC[-2]-RC[-1])<0.000000001 -> #NAME?
B116: =startswith("abcde", "ab") -> #NAME? | C116: 1 | D116: =ABS(RC[-2]-RC[-1])<0.000000001 -> #NAME?
A117: len | B117: =LEN("abcdef") -> 6 | C117: 6 | D117: =ABS(RC[-2]-RC[-1])<0.000000001 -> 1
A118: isoformat | B118: =isoformat(2012,1,22) -> #NAME? | C118: 2012-01-22 | D118: =equal(RC[-2],RC[-1]) -> #NAME?
A119: println | B119: =println("The result sheet got evaluated") -> #NAME?
A120: islower | D120: =AND(islower("g"), NOT(islower("G"))) -> #NAME?
E122: =AND(R[-10]C[-1],R[-9]C[-1],R[-8]C[-1],R[-7]C[-1],R[-6]C[-1],R[-5]C[-1],R[-4]C[-1],R[-2]C[-1]) -> #NAME?
A124: COUNTIF and SUMIF | C124: =COUNTIF(CLOSURE("normalbmi",NA()),R125C1:R129C2) -> #NAME? | D124: =(RC[-1]=5) -> #NAME?
A125: 15 | B125: 25 | C125: =SUMIF(CLOSURE("normalbmi",NA()),R125C1:R129C2) -> #NAME? | D125: =(RC[-1]=109.6) -> #NAME?
A126: 18.5 | B126: 24.9
A127: 18.399999999999999 | B127: 22
A128: 21 | B128: 32
A129: 30 | B129: 23.2 | E129: 11 | F129: 2004 | G129: 5000
E130: 22 | F130: 2003 | G130: 4000
C131: 11 | D131: 22 | E131: 33 | F131: 44 | G131: 2000
C132: 1004 | D132: 1003 | E132: 44 | F132: 1001 | G132: 1000
A135: MATCH, HLOOKUP and VLOOKUP
A136: =MATCH(5,R131C3:R131C6) -> #N/A
A137: =MATCH(11,R131C3:R131C6) -> 1 | B137: 1 | C137: =(RC[-2]=RC[-1]) -> 1
A138: =MATCH(21.9999,R131C3:R131C6) -> 1 | B138: 1 | C138: =(RC[-2]=RC[-1]) -> 1
A139: =MATCH(22,R131C3:R131C6) -> 2 | B139: 2 | C139: =(RC[-2]=RC[-1]) -> 1
A140: =MATCH(43.999,R131C3:R131C6) -> 3 | B140: 3 | C140: =(RC[-2]=RC[-1]) -> 1
A141: =MATCH(1E+99,R131C3:R131C6) -> 4 | B141: 4 | C141: =(RC[-2]=RC[-1]) -> 1 | E141: =AND(R[-4]C[-2],R[-3]C[-2],R[-2]C[-2],R[-1]C[-2],RC[-2]) -> 1
A143: =MATCH(5,R129C5:R132C5) -> #N/A
A144: =MATCH(11,R129C5:R132C5) -> 1 | B144: 1 | C144: =(RC[-2]=RC[-1]) -> 1
A145: =MATCH(21.999999,R129C5:R132C5) -> 1 | B145: 1 | C145: =(RC[-2]=RC[-1]) -> 1
A146: =MATCH(22,R129C5:R132C5) -> 2 | B146: 2 | C146: =(RC[-2]=RC[-1]) -> 1
A147: =MATCH(43.9999,R129C5:R132C5) -> 3 | B147: 3 | C147: =(RC[-2]=RC[-1]) -> 1
A148: =MATCH(1E+99,R129C5:R132C5) -> 4 | B148: 4 | C148: =(RC[-2]=RC[-1]) -> 1 | E148: =AND(R[-4]C[-2],R[-3]C[-2],R[-2]C[-2],R[-1]C[-2],RC[-2]) -> 1
A150: =HLOOKUP(10.999, R131C3:R132C7,2) -> #N/A
A151: =HLOOKUP(15, R131C3:R132C7,2) -> 1004 | B151: 1004 | C151: =(RC[-2]=RC[-1]) -> 1
A152: =HLOOKUP(15, R131C3:R132C7,3) -> #REF!
A153: =HLOOKUP(100, R131C3:R132C7,2) -> 1001 | B153: 1001 | C153: =(RC[-2]=RC[-1]) -> 1
A154: =HLOOKUP(5000, R131C3:R132C7,2) -> 1000 | B154: 1000 | C154: =(RC[-2]=RC[-1]) -> 1
A156: =VLOOKUP(10.999, R129C5:R132C7,3) -> #N/A
A157: =VLOOKUP(25, R129C5:R132C7,3) -> 4000 | B157: 4000 | C157: =(RC[-2]=RC[-1]) -> 1
A158: =VLOOKUP(25, R129C5:R132C7,4) -> #REF!
A159: =VLOOKUP(5000, R129C5:R132C7,2) -> 1001 | B159: 1001 | C159: =(RC[-2]=RC[-1]) -> 1
A160: =VLOOKUP(5000, R129C5:R132C7,3) -> 1000 | B160: 1000 | C160: =(RC[-2]=RC[-1]) -> 1 | E160: =AND(R[-9]C[-2],R[-7]C[-2],R[-6]C[-2],R[-3]C[-2],R[-1]C[-2],RC[-2]) -> 1 | G160: =AND(R[-19]C[-2],R[-12]C[-2],RC[-2]) -> 1
A162: TAIL RECURSION
A163: =TAILREC1(10000) -> #NAME? | B163: 117 | C163: =(RC[-2]=RC[-1]) -> #NAME?
A164: =TAILREC2(10000) -> #NAME? | B164: 117 | C164: =(RC[-2]=RC[-1]) -> #NAME?
G165: =AND(R[-2]C[-4],R[-1]C[-4]) -> #NAME?
A167: NESTED CALLS
A168: =SUB(2,SUB(5,11)) -> #NAME? | B168: 8 | C168: =(RC[-2]=RC[-1]) -> #NAME?
A169: =SUB(SUB(5,11),13) -> #NAME? | B169: -19 | C169: =(RC[-2]=RC[-1]) -> #NAME?
A170: =CLOSURE("sub",NA(),NA()) -> #NAME?
A171: =apply(R170C1,2,apply(R170C1,5,11)) -> #NAME? | B171: 8 | C171: =(RC[-2]=RC[-1]) -> #NAME?
A172: =apply(R170C1,apply(R170C1,5,11),13) -> #NAME? | B172: -19 | C172: =(RC[-2]=RC[-1]) -> #NAME? | G172: =AND(R[-4]C[-4],R[-3]C[-4],R[-1]C[-4],RC[-4]) -> #NAME?
A174: Y COMBINATOR AND LISTS
A175: =yfac(6) -> #NAME? | C175: 720 | D175: =(RC[-3]=RC[-1]) -> #NAME?
A176: =makelist(5) -> #NAME? | B176: =car(RC[-1]) -> #NAME? | C176: 5 | D176: =(RC[-2]=RC[-1]) -> #NAME?
A177: =cdr(R[-1]C) -> #NAME? | B177: =car(RC[-1]) -> #NAME? | C177: 4 | D177: =(RC[-2]=RC[-1]) -> #NAME?
A178: =cdr(R[-1]C) -> #NAME? | B178: =car(RC[-1]) -> #NAME? | C178: 3 | D178: =(RC[-2]=RC[-1]) -> #NAME?
A179: =cdr(R[-1]C) -> #NAME? | B179: =car(RC[-1]) -> #NAME? | C179: 2 | D179: =(RC[-2]=RC[-1]) -> #NAME?
A180: =cdr(R[-1]C) -> #NAME? | B180: =car(RC[-1]) -> #NAME? | C180: 1 | D180: =(RC[-2]=RC[-1]) -> #NAME?
A181: =cdr(R[-1]C) -> #NAME?
A182: =length(R[-6]C) -> #NAME? | C182: 5 | D182: =(RC[-3]=RC[-1]) -> #NAME? | G182: =AND(R[-7]C[-3],R[-6]C[-3],R[-5]C[-3],R[-4]C[-3],R[-3]C[-3],R[-2]C[-3],RC[-3]) -> #NAME?
A184: MUTUAL RECURSION
A185: =MYISEVEN(100) -> #NAME?
A186: =MYISODD(201) -> #NAME?
A187: =MYISEVEN(1001) -> #NAME?
A188: =MYISODD(30) -> #NAME? | G188: =AND(R[-3]C[-6],R[-2]C[-6],NOT(R[-1]C[-6]),NOT(RC[-6])) -> #NAME?
A190: CLOSURE AND SPECIALIZE | D190: =SUB(2,5) -> #NAME?
A191: =CLOSURE("sub",2,NA()) -> #NAME? | B191: =apply(RC[-1],5) -> #NAME? | D191: =(RC[-2]=R190C4) -> #NAME?
A192: =CLOSURE("sub",NA(),5) -> #NAME? | B192: =apply(RC[-1],2) -> #NAME? | D192: =(RC[-2]=R190C4) -> #NAME?
A193: =SPECIALIZE("sub",2,NA()) -> #NAME? | B193: =apply(RC[-1],5) -> #NAME? | D193: =(RC[-2]=R190C4) -> #NAME? | G193: =AND(R[-3]C[-3],R[-2]C[-3],R[-1]C[-3],RC[-3]) -> #NAME?
A194: =SPECIALIZE("sub",NA(),5) -> #NAME? | B194: =apply(RC[-1],2) -> #NAME? | D194: =(RC[-2]=R190C4) -> #NAME?
A195: =CLOSURE("sub",2,NA()) -> #NAME? | B195: =CLOSURE(RC[-1],5) -> #NAME? | C195: =apply(RC[-1]) -> #NAME? | D195: =(RC[-1]=R190C4) -> #NAME?
A196: =CLOSURE("sub",2,NA()) -> #NAME? | B196: =SPECIALIZE(RC[-1],5) -> #NAME? | C196: =apply(RC[-1]) -> #NAME? | D196: =(RC[-1]=R190C4) -> #NAME?
A197: =CLOSURE("sub",NA(),5) -> #NAME? | B197: =CLOSURE(RC[-1],2) -> #NAME? | C197: =apply(RC[-1]) -> #NAME? | D197: =(RC[-1]=R190C4) -> #NAME?
A198: =CLOSURE("sub",NA(),5) -> #NAME? | B198: =SPECIALIZE(RC[-1],2) -> #NAME? | C198: =apply(RC[-1]) -> #NAME? | D198: =(RC[-1]=R190C4) -> #NAME?
A199: =SPECIALIZE("sub",2,NA()) -> #NAME? | B199: =CLOSURE(RC[-1],5) -> #NAME? | C199: =apply(RC[-1]) -> #NAME? | D199: =(RC[-1]=R190C4) -> #NAME?
A200: =SPECIALIZE("sub",2,NA()) -> #NAME? | B200: =SPECIALIZE(RC[-1],5) -> #NAME? | C200: =apply(RC[-1]) -> #NAME? | D200: =(RC[-1]=R190C4) -> #NAME?
A201: =SPECIALIZE("sub",NA(),5) -> #NAME? | B201: =CLOSURE(RC[-1],2) -> #NAME? | C201: =apply(RC[-1]) -> #NAME? | D201: =(RC[-1]=R190C4) -> #NAME?
A202: =SPECIALIZE("sub",NA(),5) -> #NAME? | B202: =SPECIALIZE(RC[-1],2) -> #NAME? | C202: =apply(RC[-1]) -> #NAME? | D202: =(RC[-1]=R190C4) -> #NAME? | G202: =AND(R[-7]C[-3],R[-6]C[-3],R[-5]C[-3],R[-4]C[-3],R[-3]C[-3],R[-2]C[-3],R[-1]C[-3],RC[-3]) -> #NAME?

Sheet: Benchmarks
A1: Benchmarks on 2.66 GHz Core 2 Duo | B1: Set number of benchmarks in C2
A2: ="RAN " & gdate(TODAY()) -> #NAME? | B2: 2012-01-05 | C2: 0
B3: Output | C3: Benchmarks | H3: Average
A4: =CLOSURE("identity", 42) -> #NAME? | B4: =apply(RC1) -> #NAME? | C4: 1000 | D4: =benchmark(RC1,RC3*R2C3) -> #NAME? | E4: =benchmark(RC1,RC3*R2C3) -> #NAME? | F4: =benchmark(RC1,RC3*R2C3) -> #NAME? | G4: =benchmark(RC1,RC3*R2C3) -> #NAME? | H4: =AVERAGE(RC[-4]:RC[-1]) -> #NAME?
A5: =CLOSURE("const0_1") -> #NAME? | B5: =apply(RC1) -> #NAME? | C5: 1000 | D5: =benchmark(RC1,RC3*R2C3) -> #NAME? | E5: =benchmark(RC1,RC3*R2C3) -> #NAME? | F5: =benchmark(RC1,RC3*R2C3) -> #NAME? | G5: =benchmark(RC1,RC3*R2C3) -> #NAME? | H5: =AVERAGE(RC[-4]:RC[-1]) -> #NAME?
A6: =CLOSURE("const1_1", 42) -> #NAME? | B6: =apply(RC1) -> #NAME? | C6: 1000 | D6: =benchmark(RC1,RC3*R2C3) -> #NAME? | E6: =benchmark(RC1,RC3*R2C3) -> #NAME? | F6: =benchmark(RC1,RC3*R2C3) -> #NAME? | G6: =benchmark(RC1,RC3*R2C3) -> #NAME? | H6: =AVERAGE(RC[-4]:RC[-1]) -> #NAME? | J6: Pass one arg: | K6: =RC[-3]-R[-1]C[-3] -> #NAME?
A7: =CLOSURE("const1_17", 42) -> #NAME? | B7: =apply(RC1) -> #NAME? | C7: 1000 | D7: =benchmark(RC1,RC3*R2C3) -> #NAME? | E7: =benchmark(RC1,RC3*R2C3) -> #NAME? | F7: =benchmark(RC1,RC3*R2C3) -> #NAME? | G7: =benchmark(RC1,RC3*R2C3) -> #NAME? | H7: =AVERAGE(RC[-4]:RC[-1]) -> #NAME? | J7: Wrap number: | K7: =RC[-3]-R[-1]C[-3] -> #NAME?
A8: =CLOSURE("ADD_1", 42) -> #NAME? | B8: =apply(RC1) -> #NAME? | C8: 1000 | D8: =benchmark(RC1,RC3*R2C3) -> #NAME? | E8: =benchmark(RC1,RC3*R2C3) -> #NAME? | F8: =benchmark(RC1,RC3*R2C3) -> #NAME? | G8: =benchmark(RC1,RC3*R2C3) -> #NAME? | H8: =AVERAGE(RC[-4]:RC[-1]) -> #NAME? | J8: Unwrap, add: | K8: =RC[-3]-R[-1]C[-3] -> #NAME?
A9: =CLOSURE("ADD_1_NONTAIL", 42) -> #NAME? | B9: =apply(RC1) -> #NAME? | C9: 1000 | D9: =benchmark(RC1,RC3*R2C3) -> #NAME? | E9: =benchmark(RC1,RC3*R2C3) -> #NAME? | F9: =benchmark(RC1,RC3*R2C3) -> #NAME? | G9: =benchmark(RC1,RC3*R2C3) -> #NAME? | H9: =AVERAGE(RC[-4]:RC[-1]) -> #NAME? | J9: Call SDF: | K9: =RC[-3]-R[-1]C[-3] -> #NAME?
A10: =CLOSURE("ADD_1_TAIL", 42) -> #NAME? | B10: =apply(RC1) -> #NAME? | C10: 1000 | D10: =benchmark(RC1,RC3*R2C3) -> #NAME? | E10: =benchmark(RC1,RC3*R2C3) -> #NAME? | F10: =benchmark(RC1,RC3*R2C3) -> #NAME? | G10: =benchmark(RC1,RC3*R2C3) -> #NAME? | H10: =AVERAGE(RC[-4]:RC[-1]) -> #NAME? | J10: Tailcall SDF: | K10: =RC[-3]-R[-2]C[-3] -> #NAME?
A11: =CLOSURE("APPLY_1", CLOSURE("IDENTITY",NA())) -> #NAME? | B11: =apply(RC1) -> #NAME? | C11: 1000 | D11: =benchmark(RC1,RC3*R2C3) -> #NAME? | E11: =benchmark(RC1,RC3*R2C3) -> #NAME? | F11: =benchmark(RC1,RC3*R2C3) -> #NAME? | G11: =benchmark(RC1,RC3*R2C3) -> #NAME? | H11: =AVERAGE(RC[-4]:RC[-1]) -> #NAME? | J11: Call closure: | K11: =RC[-3]-R[-3]C[-3] -> #NAME?
A12: =CLOSURE("NORMDISTCDF", -3) -> #NAME? | B12: =apply(RC1) -> #NAME? | C12: 1000 | D12: =benchmark(RC1,RC3*R2C3) -> #NAME? | E12: =benchmark(RC1,RC3*R2C3) -> #NAME? | F12: =benchmark(RC1,RC3*R2C3) -> #NAME? | G12: =benchmark(RC1,RC3*R2C3) -> #NAME?
A13: =CLOSURE("INVNORMDISTCDF", 0.03) -> #NAME? | B13: =apply(RC1) -> #NAME? | C13: 1000 | D13: =benchmark(RC1,RC3*R2C3) -> #NAME? | E13: =benchmark(RC1,RC3*R2C3) -> #NAME? | F13: =benchmark(RC1,RC3*R2C3) -> #NAME? | G13: =benchmark(RC1,RC3*R2C3) -> #NAME?
A14: =CLOSURE("easter", 2009) -> #NAME? | B14: =apply(RC1) -> #NAME? | C14: 1000 | D14: =benchmark(RC1,RC3*R2C3) -> #NAME? | E14: =benchmark(RC1,RC3*R2C3) -> #NAME? | F14: =benchmark(RC1,RC3*R2C3) -> #NAME? | G14: =benchmark(RC1,RC3*R2C3) -> #NAME?
A15: =CLOSURE("isoweek", fixdate(2009,1,11)) -> #NAME? | B15: =apply(RC1) -> #NAME? | C15: 100 | D15: =benchmark(RC1,RC3*R2C3) -> #NAME? | E15: =benchmark(RC1,RC3*R2C3) -> #NAME? | F15: =benchmark(RC1,RC3*R2C3) -> #NAME? | G15: =benchmark(RC1,RC3*R2C3) -> #NAME?
A16: =CLOSURE("goalseek",CLOSURE("bulletPV",4,10,NA()),91,4) -> #NAME? | B16: =apply(RC1) -> #NAME? | C16: 5 | D16: =benchmark(RC1,RC3*R2C3) -> #NAME? | E16: =benchmark(RC1,RC3*R2C3) -> #NAME? | F16: =benchmark(RC1,RC3*R2C3) -> #NAME? | G16: =benchmark(RC1,RC3*R2C3) -> #NAME?
A17: =CLOSURE("goalseekr",CLOSURE("bulletPV",4,10,NA()),91,4) -> #NAME? | B17: =apply(RC1) -> #NAME? | C17: 5 | D17: =benchmark(RC1,RC3*R2C3) -> #NAME? | E17: =benchmark(RC1,RC3*R2C3) -> #NAME? | F17: =benchmark(RC1,RC3*R2C3) -> #NAME? | G17: =benchmark(RC1,RC3*R2C3) -> #NAME?
A18: =SPECIALIZE("goalseekr",SPECIALIZE("bulletPV",4,10,NA()),91,4) -> #NAME? | B18: =apply(RC1) -> #NAME? | C18: 5 | D18: =benchmark(RC1,RC3*R2C3) -> #NAME? | E18: =benchmark(RC1,RC3*R2C3) -> #NAME? | F18: =benchmark(RC1,RC3*R2C3) -> #NAME? | G18: =benchmark(RC1,RC3*R2C3) -> #NAME?
A19: =CLOSURE("tailrec1", 10000) -> #NAME? | B19: =apply(RC1) -> #NAME? | C19: 1 | D19: =benchmark(RC1,RC3*R2C3) -> #NAME? | E19: =benchmark(RC1,RC3*R2C3) -> #NAME? | F19: =benchmark(RC1,RC3*R2C3) -> #NAME? | G19: =benchmark(RC1,RC3*R2C3) -> #NAME?
A20: =CLOSURE("tailrec2", 10000) -> #NAME? | B20: =apply(RC1) -> #NAME? | C20: 1 | D20: =benchmark(RC1,RC3*R2C3) -> #NAME? | E20: =benchmark(RC1,RC3*R2C3) -> #NAME? | F20: =benchmark(RC1,RC3*R2C3) -> #NAME? | G20: =benchmark(RC1,RC3*R2C3) -> #NAME?
A21: =CLOSURE("normdensity", -3) -> #NAME? | B21: =apply(RC1) -> #NAME? | C21: 1000 | D21: =benchmark(RC1,RC3*R2C3) -> #NAME? | E21: =benchmark(RC1,RC3*R2C3) -> #NAME? | F21: =benchmark(RC1,RC3*R2C3) -> #NAME? | G21: =benchmark(RC1,RC3*R2C3) -> #NAME?
A22: =CLOSURE("normdensitygeneral",-3,0,1) -> #NAME? | B22: =apply(RC1) -> #NAME? | C22: 1000 | D22: =benchmark(RC1,RC3*R2C3) -> #NAME? | E22: =benchmark(RC1,RC3*R2C3) -> #NAME? | F22: =benchmark(RC1,RC3*R2C3) -> #NAME? | G22: =benchmark(RC1,RC3*R2C3) -> #NAME?
A23: =CLOSURE(SPECIALIZE("normdensitygeneral",NA(),0,1), -3) -> #NAME? | B23: =apply(RC1) -> #NAME? | C23: 1000 | D23: =benchmark(RC1,RC3*R2C3) -> #NAME? | E23: =benchmark(RC1,RC3*R2C3) -> #NAME? | F23: =benchmark(RC1,RC3*R2C3) -> #NAME? | G23: =benchmark(RC1,RC3*R2C3) -> #NAME?

Sheet: Data
A1: Table for BINOM sheet-defined function
A2: n | B2: n! | G2: n | H2: log(n!)
A3: 1 | B3: 1 | C3: 11 | D3: 12 | E3: 13 | G3: 1 | H3: 0 | J3: =RC[-7]*RC[-7] -> 121 | K3: =RC[-7]*RC[-7] -> 144 | L3: =RC[-7]*RC[-7] -> 169
A4: =R[-1]C+1 -> 2 | B4: =RC[-1]*R[-1]C -> 2 | C4: 21 | D4: 22 | E4: 23 | G4: =R[-1]C+1 -> 2 | H4: =LN(RC[-1])+R[-1]C -> 0.69314718055994529 | J4: =RC[-7]*RC[-7] -> 441 | K4: =RC[-7]*RC[-7] -> 484 | L4: =RC[-7]*RC[-7] -> 529
A5: =R[-1]C+1 -> 3 | B5: =RC[-1]*R[-1]C -> 6 | G5: =R[-1]C+1 -> 3 | H5: =LN(RC[-1])+R[-1]C -> 1.791759469228055
A6: =R[-1]C+1 -> 4 | B6: =RC[-1]*R[-1]C -> 24 | G6: =R[-1]C+1 -> 4 | H6: =LN(RC[-1])+R[-1]C -> 3.1780538303479453 | J6: =SUM(R[-3]C:R[-2]C[2]) -> 1888
A7: =R[-1]C+1 -> 5 | B7: =RC[-1]*R[-1]C -> 120 | D7: Monday | G7: =R[-1]C+1 -> 5 | H7: =LN(RC[-1])+R[-1]C -> 4.7874917427820458
A8: =R[-1]C+1 -> 6 | B8: =RC[-1]*R[-1]C -> 720 | D8: Tuesday | G8: =R[-1]C+1 -> 6 | H8: =LN(RC[-1])+R[-1]C -> 6.5792512120101012
A9: =R[-1]C+1 -> 7 | B9: =RC[-1]*R[-1]C -> 5040 | D9: Wednesday | G9: =R[-1]C+1 -> 7 | H9: =LN(RC[-1])+R[-1]C -> 8.5251613610654147
A10: =R[-1]C+1 -> 8 | B10: =RC[-1]*R[-1]C -> 40320 | D10: Thursday | G10: =R[-1]C+1 -> 8 | H10: =LN(RC[-1])+R[-1]C -> 10.604602902745251
A11: =R[-1]C+1 -> 9 | B11: =RC[-1]*R[-1]C -> 362880 | D11: Friday | G11: =R[-1]C+1 -> 9 | H11: =LN(RC[-1])+R[-1]C -> 12.801827480081471
A12: =R[-1]C+1 -> 10 | B12: =RC[-1]*R[-1]C -> 3628800 | D12: Saturday | G12: =R[-1]C+1 -> 10 | H12: =LN(RC[-1])+R[-1]C -> 15.104412573075518
A13: =R[-1]C+1 -> 11 | B13: =RC[-1]*R[-1]C -> 39916800 | D13: Sunday | G13: =R[-1]C+1 -> 11 | H13: =LN(RC[-1])+R[-1]C -> 17.502307845873887
A14: =R[-1]C+1 -> 12 | B14: =RC[-1]*R[-1]C -> 479001600 | G14: =R[-1]C+1 -> 12 | H14: =LN(RC[-1])+R[-1]C -> 19.987214495661888
A15: =R[-1]C+1 -> 13 | B15: =RC[-1]*R[-1]C -> 6227020800 | D15: arrayvalue = | E15: =R3C3:R4C5 -> #VALUE! | G15: =R[-1]C+1 -> 13 | H15: =LN(RC[-1])+R[-1]C -> 22.552163853123425
A16: =R[-1]C+1 -> 14 | B16: =RC[-1]*R[-1]C -> 87178291200 | E16: 100 | G16: =R[-1]C+1 -> 14 | H16: =LN(RC[-1])+R[-1]C -> 25.191221182738683
A17: =R[-1]C+1 -> 15 | B17: =RC[-1]*R[-1]C -> 1307674368000 | E17: 200 | G17: =R[-1]C+1 -> 15 | H17: =LN(RC[-1])+R[-1]C -> 27.899271383840894
A18: =R[-1]C+1 -> 16 | B18: =RC[-1]*R[-1]C -> 20922789888000 | G18: =R[-1]C+1 -> 16 | H18: =LN(RC[-1])+R[-1]C -> 30.671860106080675
A19: =R[-1]C+1 -> 17 | B19: =RC[-1]*R[-1]C -> 355687428096000 | G19: =R[-1]C+1 -> 17 | H19: =LN(RC[-1])+R[-1]C -> 33.505073450136891
A20: =R[-1]C+1 -> 18 | B20: =RC[-1]*R[-1]C -> 6402373705728000 | G20: =R[-1]C+1 -> 18 | H20: =LN(RC[-1])+R[-1]C -> 36.395445208033053
A21: =R[-1]C+1 -> 19 | B21: =RC[-1]*R[-1]C -> 1.21645100408832E+17 | G21: =R[-1]C+1 -> 19 | H21: =LN(RC[-1])+R[-1]C -> 39.339884187199495
A22: =R[-1]C+1 -> 20 | B22: =RC[-1]*R[-1]C -> 2.43290200817664E+18 | G22: =R[-1]C+1 -> 20 | H22: =LN(RC[-1])+R[-1]C -> 42.335616460753485
A23: =R[-1]C+1 -> 21 | B23: =RC[-1]*R[-1]C -> 5.109094217170944E+19 | G23: =R[-1]C+1 -> 21 | H23: =LN(RC[-1])+R[-1]C -> 45.380138898476908
A24: =R[-1]C+1 -> 22 | B24: =RC[-1]*R[-1]C -> 1.1240007277776077E+21 | G24: =R[-1]C+1 -> 22 | H24: =LN(RC[-1])+R[-1]C -> 48.471181351835227
A25: =R[-1]C+1 -> 23 | B25: =RC[-1]*R[-1]C -> 2.5852016738884978E+22 | G25: =R[-1]C+1 -> 23 | H25: =LN(RC[-1])+R[-1]C -> 51.606675567764377
A26: =R[-1]C+1 -> 24 | B26: =RC[-1]*R[-1]C -> 6.2044840173323941E+23 | G26: =R[-1]C+1 -> 24 | H26: =LN(RC[-1])+R[-1]C -> 54.784729398112326
A27: =R[-1]C+1 -> 25 | B27: =RC[-1]*R[-1]C -> 1.5511210043330986E+25 | G27: =R[-1]C+1 -> 25 | H27: =LN(RC[-1])+R[-1]C -> 58.003605222980525
A28: =R[-1]C+1 -> 26 | B28: =RC[-1]*R[-1]C -> 4.0329146112660565E+26 | G28: =R[-1]C+1 -> 26 | H28: =LN(RC[-1])+R[-1]C -> 61.261701761002008
A29: =R[-1]C+1 -> 27 | B29: =RC[-1]*R[-1]C -> 1.0888869450418352E+28 | G29: =R[-1]C+1 -> 27 | H29: =LN(RC[-1])+R[-1]C -> 64.557538627006338
A30: =R[-1]C+1 -> 28 | B30: =RC[-1]*R[-1]C -> 3.0488834461171384E+29 | G30: =R[-1]C+1 -> 28 | H30: =LN(RC[-1])+R[-1]C -> 67.88974313718154
A31: =R[-1]C+1 -> 29 | B31: =RC[-1]*R[-1]C -> 8.8417619937397008E+30 | G31: =R[-1]C+1 -> 29 | H31: =LN(RC[-1])+R[-1]C -> 71.257038967168015
A32: =R[-1]C+1 -> 30 | B32: =RC[-1]*R[-1]C -> 2.6525285981219103E+32 | G32: =R[-1]C+1 -> 30 | H32: =LN(RC[-1])+R[-1]C -> 74.658236348830172
A33: =R[-1]C+1 -> 31 | B33: =RC[-1]*R[-1]C -> 8.2228386541779224E+33 | G33: =R[-1]C+1 -> 31 | H33: =LN(RC[-1])+R[-1]C -> 78.092223553315321
A34: =R[-1]C+1 -> 32 | B34: =RC[-1]*R[-1]C -> 2.6313083693369352E+35 | G34: =R[-1]C+1 -> 32 | H34: =LN(RC[-1])+R[-1]C -> 81.557959456115043
A35: =R[-1]C+1 -> 33 | B35: =RC[-1]*R[-1]C -> 8.6833176188118859E+36 | G35: =R[-1]C+1 -> 33 | H35: =LN(RC[-1])+R[-1]C -> 85.05446701758153
A36: =R[-1]C+1 -> 34 | B36: =RC[-1]*R[-1]C -> 2.9523279903960412E+38 | G36: =R[-1]C+1 -> 34 | H36: =LN(RC[-1])+R[-1]C -> 88.580827542197696
A37: =R[-1]C+1 -> 35 | B37: =RC[-1]*R[-1]C -> 1.0333147966386144E+40 | G37: =R[-1]C+1 -> 35 | H37: =LN(RC[-1])+R[-1]C -> 92.136175603687107
A38: =R[-1]C+1 -> 36 | B38: =RC[-1]*R[-1]C -> 3.7199332678990118E+41 | G38: =R[-1]C+1 -> 36 | H38: =LN(RC[-1])+R[-1]C -> 95.719694542143216
A39: =R[-1]C+1 -> 37 | B39: =RC[-1]*R[-1]C -> 1.3763753091226343E+43 | G39: =R[-1]C+1 -> 37 | H39: =LN(RC[-1])+R[-1]C -> 99.330612454787442
A40: =R[-1]C+1 -> 38 | B40: =RC[-1]*R[-1]C -> 5.2302261746660104E+44 | G40: =R[-1]C+1 -> 38 | H40: =LN(RC[-1])+R[-1]C -> 102.96819861451382
A41: =R[-1]C+1 -> 39 | B41: =RC[-1]*R[-1]C -> 2.0397882081197442E+46 | G41: =R[-1]C+1 -> 39 | H41: =LN(RC[-1])+R[-1]C -> 106.63176026064347
A42: =R[-1]C+1 -> 40 | B42: =RC[-1]*R[-1]C -> 8.1591528324789768E+47 | G42: =R[-1]C+1 -> 40 | H42: =LN(RC[-1])+R[-1]C -> 110.32063971475741
A43: =R[-1]C+1 -> 41 | B43: =RC[-1]*R[-1]C -> 3.3452526613163803E+49 | G43: =R[-1]C+1 -> 41 | H43: =LN(RC[-1])+R[-1]C -> 114.03421178146171
A44: =R[-1]C+1 -> 42 | B44: =RC[-1]*R[-1]C -> 1.4050061177528798E+51 | G44: =R[-1]C+1 -> 42 | H44: =LN(RC[-1])+R[-1]C -> 117.77188139974507
A45: =R[-1]C+1 -> 43 | B45: =RC[-1]*R[-1]C -> 6.0415263063373834E+52 | G45: =R[-1]C+1 -> 43 | H45: =LN(RC[-1])+R[-1]C -> 121.53308151543864
A46: =R[-1]C+1 -> 44 | B46: =RC[-1]*R[-1]C -> 2.6582715747884485E+54 | G46: =R[-1]C+1 -> 44 | H46: =LN(RC[-1])+R[-1]C -> 125.3172711493569
A47: =R[-1]C+1 -> 45 | B47: =RC[-1]*R[-1]C -> 1.1962222086548019E+56 | G47: =R[-1]C+1 -> 45 | H47: =LN(RC[-1])+R[-1]C -> 129.12393363912722
A48: =R[-1]C+1 -> 46 | B48: =RC[-1]*R[-1]C -> 5.5026221598120885E+57 | G48: =R[-1]C+1 -> 46 | H48: =LN(RC[-1])+R[-1]C -> 132.95257503561632
A49: =R[-1]C+1 -> 47 | B49: =RC[-1]*R[-1]C -> 2.5862324151116818E+59 | G49: =R[-1]C+1 -> 47 | H49: =LN(RC[-1])+R[-1]C -> 136.80272263732638
A50: =R[-1]C+1 -> 48 | B50: =RC[-1]*R[-1]C -> 1.2413915592536073E+61 | G50: =R[-1]C+1 -> 48 | H50: =LN(RC[-1])+R[-1]C -> 140.67392364823428
A51: =R[-1]C+1 -> 49 | B51: =RC[-1]*R[-1]C -> 6.0828186403426752E+62 | G51: =R[-1]C+1 -> 49 | H51: =LN(RC[-1])+R[-1]C -> 144.5657439463449
A52: =R[-1]C+1 -> 50 | B52: =RC[-1]*R[-1]C -> 3.0414093201713376E+64 | G52: =R[-1]C+1 -> 50 | H52: =LN(RC[-1])+R[-1]C -> 148.47776695177305
A53: =R[-1]C+1 -> 51 | B53: =RC[-1]*R[-1]C -> 1.5511187532873822E+66 | G53: =R[-1]C+1 -> 51 | H53: =LN(RC[-1])+R[-1]C -> 152.40959258449737
A54: =R[-1]C+1 -> 52 | B54: =RC[-1]*R[-1]C -> 8.0658175170943877E+67 | G54: =R[-1]C+1 -> 52 | H54: =LN(RC[-1])+R[-1]C -> 156.3608363030788
A55: =R[-1]C+1 -> 53 | B55: =RC[-1]*R[-1]C -> 4.2748832840600255E+69 | G55: =R[-1]C+1 -> 53 | H55: =LN(RC[-1])+R[-1]C -> 160.33112821663093
A56: =R[-1]C+1 -> 54 | B56: =RC[-1]*R[-1]C -> 2.3084369733924138E+71 | G56: =R[-1]C+1 -> 54 | H56: =LN(RC[-1])+R[-1]C -> 164.3201122631952
A57: =R[-1]C+1 -> 55 | B57: =RC[-1]*R[-1]C -> 1.2696403353658276E+73 | G57: =R[-1]C+1 -> 55 | H57: =LN(RC[-1])+R[-1]C -> 168.32744544842768
A58: =R[-1]C+1 -> 56 | B58: =RC[-1]*R[-1]C -> 7.1099858780486348E+74 | G58: =R[-1]C+1 -> 56 | H58: =LN(RC[-1])+R[-1]C -> 172.35279713916282
A59: =R[-1]C+1 -> 57 | B59: =RC[-1]*R[-1]C -> 4.0526919504877221E+76 | G59: =R[-1]C+1 -> 57 | H59: =LN(RC[-1])+R[-1]C -> 176.39584840699737
A60: =R[-1]C+1 -> 58 | B60: =RC[-1]*R[-1]C -> 2.3505613312828789E+78 | G60: =R[-1]C+1 -> 58 | H60: =LN(RC[-1])+R[-1]C -> 180.45629141754378
A61: =R[-1]C+1 -> 59 | B61: =RC[-1]*R[-1]C -> 1.3868311854568986E+80 | G61: =R[-1]C+1 -> 59 | H61: =LN(RC[-1])+R[-1]C -> 184.53382886144951
A62: =R[-1]C+1 -> 60 | B62: =RC[-1]*R[-1]C -> 8.3209871127413916E+81 | G62: =R[-1]C+1 -> 60 | H62: =LN(RC[-1])+R[-1]C -> 188.6281734236716
A63: =R[-1]C+1 -> 61 | B63: =RC[-1]*R[-1]C -> 5.0758021387722484E+83 | G63: =R[-1]C+1 -> 61 | H63: =LN(RC[-1])+R[-1]C -> 192.7390472878449
A64: =R[-1]C+1 -> 62 | B64: =RC[-1]*R[-1]C -> 3.1469973260387939E+85 | G64: =R[-1]C+1 -> 62 | H64: =LN(RC[-1])+R[-1]C -> 196.86618167288998
A65: =R[-1]C+1 -> 63 | B65: =RC[-1]*R[-1]C -> 1.9826083154044401E+87 | G65: =R[-1]C+1 -> 63 | H65: =LN(RC[-1])+R[-1]C -> 201.00931639928152
A66: =R[-1]C+1 -> 64 | B66: =RC[-1]*R[-1]C -> 1.2688693218588417E+89 | G66: =R[-1]C+1 -> 64 | H66: =LN(RC[-1])+R[-1]C -> 205.1681994826412
A67: =R[-1]C+1 -> 65 | B67: =RC[-1]*R[-1]C -> 8.2476505920824715E+90 | G67: =R[-1]C+1 -> 65 | H67: =LN(RC[-1])+R[-1]C -> 209.34258675253685
A68: =R[-1]C+1 -> 66 | B68: =RC[-1]*R[-1]C -> 5.4434493907744307E+92 | G68: =R[-1]C+1 -> 66 | H68: =LN(RC[-1])+R[-1]C -> 213.53224149456327
A69: =R[-1]C+1 -> 67 | B69: =RC[-1]*R[-1]C -> 3.6471110918188683E+94 | G69: =R[-1]C+1 -> 67 | H69: =LN(RC[-1])+R[-1]C -> 217.73693411395422
A70: =R[-1]C+1 -> 68 | B70: =RC[-1]*R[-1]C -> 2.4800355424368305E+96 | G70: =R[-1]C+1 -> 68 | H70: =LN(RC[-1])+R[-1]C -> 221.95644181913033
A71: =R[-1]C+1 -> 69 | B71: =RC[-1]*R[-1]C -> 1.711224524281413E+98 | G71: =R[-1]C+1 -> 69 | H71: =LN(RC[-1])+R[-1]C -> 226.1905483237276
A72: =R[-1]C+1 -> 70 | B72: =RC[-1]*R[-1]C -> 1.197857166996989E+100 | G72: =R[-1]C+1 -> 70 | H72: =LN(RC[-1])+R[-1]C -> 230.43904356577696
A73: =R[-1]C+1 -> 71 | B73: =RC[-1]*R[-1]C -> 8.5047858856786218E+101 | G73: =R[-1]C+1 -> 71 | H73: =LN(RC[-1])+R[-1]C -> 234.70172344281826
A74: =R[-1]C+1 -> 72 | B74: =RC[-1]*R[-1]C -> 6.1234458376886077E+103 | G74: =R[-1]C+1 -> 72 | H74: =LN(RC[-1])+R[-1]C -> 238.97838956183432
A75: =R[-1]C+1 -> 73 | B75: =RC[-1]*R[-1]C -> 4.4701154615126834E+105 | G75: =R[-1]C+1 -> 73 | H75: =LN(RC[-1])+R[-1]C -> 243.26884900298271
A76: =R[-1]C+1 -> 74 | B76: =RC[-1]*R[-1]C -> 3.3078854415193856E+107 | G76: =R[-1]C+1 -> 74 | H76: =LN(RC[-1])+R[-1]C -> 247.57291409618688
A77: =R[-1]C+1 -> 75 | B77: =RC[-1]*R[-1]C -> 2.4809140811395391E+109 | G77: =R[-1]C+1 -> 75 | H77: =LN(RC[-1])+R[-1]C -> 251.89040220972319
A78: =R[-1]C+1 -> 76 | B78: =RC[-1]*R[-1]C -> 1.8854947016660498E+111 | G78: =R[-1]C+1 -> 76 | H78: =LN(RC[-1])+R[-1]C -> 256.22113555000954
A79: =R[-1]C+1 -> 77 | B79: =RC[-1]*R[-1]C -> 1.4518309202828584E+113 | G79: =R[-1]C+1 -> 77 | H79: =LN(RC[-1])+R[-1]C -> 260.56494097186322
A80: =R[-1]C+1 -> 78 | B80: =RC[-1]*R[-1]C -> 1.1324281178206295E+115 | G80: =R[-1]C+1 -> 78 | H80: =LN(RC[-1])+R[-1]C -> 264.92164979855283
A81: =R[-1]C+1 -> 79 | B81: =RC[-1]*R[-1]C -> 8.9461821307829729E+116 | G81: =R[-1]C+1 -> 79 | H81: =LN(RC[-1])+R[-1]C -> 269.29109765101987
A82: =R[-1]C+1 -> 80 | B82: =RC[-1]*R[-1]C -> 7.1569457046263779E+118 | G82: =R[-1]C+1 -> 80 | H82: =LN(RC[-1])+R[-1]C -> 273.67312428569375
A83: =R[-1]C+1 -> 81 | B83: =RC[-1]*R[-1]C -> 5.7971260207473655E+120 | G83: =R[-1]C+1 -> 81 | H83: =LN(RC[-1])+R[-1]C -> 278.06757344036617
A84: =R[-1]C+1 -> 82 | B84: =RC[-1]*R[-1]C -> 4.7536433370128398E+122 | G84: =R[-1]C+1 -> 82 | H84: =LN(RC[-1])+R[-1]C -> 282.47429268763045
A85: =R[-1]C+1 -> 83 | B85: =RC[-1]*R[-1]C -> 3.9455239697206569E+124 | G85: =R[-1]C+1 -> 83 | H85: =LN(RC[-1])+R[-1]C -> 286.89313329542705
A86: =R[-1]C+1 -> 84 | B86: =RC[-1]*R[-1]C -> 3.314240134565352E+126 | G86: =R[-1]C+1 -> 84 | H86: =LN(RC[-1])+R[-1]C -> 291.32395009427034
A87: =R[-1]C+1 -> 85 | B87: =RC[-1]*R[-1]C -> 2.8171041143805494E+128 | G87: =R[-1]C+1 -> 85 | H87: =LN(RC[-1])+R[-1]C -> 295.76660135076065
A88: =R[-1]C+1 -> 86 | B88: =RC[-1]*R[-1]C -> 2.4227095383672724E+130 | G88: =R[-1]C+1 -> 86 | H88: =LN(RC[-1])+R[-1]C -> 300.22094864701415
A89: =R[-1]C+1 -> 87 | B89: =RC[-1]*R[-1]C -> 2.1077572983795269E+132 | G89: =R[-1]C+1 -> 87 | H89: =LN(RC[-1])+R[-1]C -> 304.68685676566872
A90: =R[-1]C+1 -> 88 | B90: =RC[-1]*R[-1]C -> 1.8548264225739836E+134 | G90: =R[-1]C+1 -> 88 | H90: =LN(RC[-1])+R[-1]C -> 309.16419358014696
A91: =R[-1]C+1 -> 89 | B91: =RC[-1]*R[-1]C -> 1.6507955160908452E+136 | G91: =R[-1]C+1 -> 89 | H91: =LN(RC[-1])+R[-1]C -> 313.65282994987911
A92: =R[-1]C+1 -> 90 | B92: =RC[-1]*R[-1]C -> 1.4857159644817607E+138 | G92: =R[-1]C+1 -> 90 | H92: =LN(RC[-1])+R[-1]C -> 318.15263962020936
A93: =R[-1]C+1 -> 91 | B93: =RC[-1]*R[-1]C -> 1.3520015276784023E+140 | G93: =R[-1]C+1 -> 91 | H93: =LN(RC[-1])+R[-1]C -> 322.66349912672621
A94: =R[-1]C+1 -> 92 | B94: =RC[-1]*R[-1]C -> 1.24384140546413E+142 | G94: =R[-1]C+1 -> 92 | H94: =LN(RC[-1])+R[-1]C -> 327.18528770377526
A95: =R[-1]C+1 -> 93 | B95: =RC[-1]*R[-1]C -> 1.1567725070816409E+144 | G95: =R[-1]C+1 -> 93 | H95: =LN(RC[-1])+R[-1]C -> 331.71788719692853
A96: =R[-1]C+1 -> 94 | B96: =RC[-1]*R[-1]C -> 1.0873661566567424E+146 | G96: =R[-1]C+1 -> 94 | H96: =LN(RC[-1])+R[-1]C -> 336.26118197919851
A97: =R[-1]C+1 -> 95 | B97: =RC[-1]*R[-1]C -> 1.0329978488239052E+148 | G97: =R[-1]C+1 -> 95 | H97: =LN(RC[-1])+R[-1]C -> 340.81505887079908
A98: =R[-1]C+1 -> 96 | B98: =RC[-1]*R[-1]C -> 9.916779348709491E+149 | G98: =R[-1]C+1 -> 96 | H98: =LN(RC[-1])+R[-1]C -> 345.37940706226692
A99: =R[-1]C+1 -> 97 | B99: =RC[-1]*R[-1]C -> 9.6192759682482062E+151 | G99: =R[-1]C+1 -> 97 | H99: =LN(RC[-1])+R[-1]C -> 349.95411804077031
A100: =R[-1]C+1 -> 98 | B100: =RC[-1]*R[-1]C -> 9.426890448883242E+153 | G100: =R[-1]C+1 -> 98 | H100: =LN(RC[-1])+R[-1]C -> 354.5390855194409
A101: =R[-1]C+1 -> 99 | B101: =RC[-1]*R[-1]C -> 9.3326215443944096E+155 | G101: =R[-1]C+1 -> 99 | H101: =LN(RC[-1])+R[-1]C -> 359.13420536957551
A102: =R[-1]C+1 -> 100 | B102: =RC[-1]*R[-1]C -> 9.3326215443944102E+157 | G102: =R[-1]C+1 -> 100 | H102: =LN(RC[-1])+R[-1]C -> 363.73937555556358

Sheet: DataTable
A1: Savings table
A2: r and n | B2: 5 | C2: 10 | D2: 15
A3: 0.01 | B3: =saving(RC1,R2C) -> #NAME? | C3: =saving(RC1,R2C) -> #NAME? | D3: =saving(RC1,R2C) -> #NAME?
A4: 0.02 | B4: =saving(RC1,R2C) -> #NAME? | C4: =saving(RC1,R2C) -> #NAME? | D4: =saving(RC1,R2C) -> #NAME?
A5: 0.03 | B5: =saving(RC1,R2C) -> #NAME? | C5: =saving(RC1,R2C) -> #NAME? | D5: =saving(RC1,R2C) -> #NAME?
A6: 0.04 | B6: =saving(RC1,R2C) -> #NAME? | C6: =saving(RC1,R2C) -> #NAME? | D6: =saving(RC1,R2C) -> #NAME?
A9: 12

Sheet: @Functions
A1: Various examples of sheet-defined functions | E1: 2011-12-30
A3: =DEFINE("normdensity",R[2]C[1],R[1]C[1]) -> #NAME? | B3: The density of the normal distribution N(0,1)
A4: x = | B4: -2
A5: f(x) = | B5: =0.398942280401432*EXP(-0.5*R[-1]C*R[-1]C) -> 5.3990966513187959E-2
A7: =DEFINE("normdensitygeneral",R[5]C[1],R[1]C[1],R[2]C[1],R[3]C[1]) -> #NAME? | B7: The density of the normal distribution N(0,1)
A8: x = | B8: -2
A9: mu = | B9: 0
A10: sigma = | B10: 1
B11: =(R[-3]C-R[-2]C)/R[-1]C -> -2
A12: f(x) = | B12: =0.398942280401432*EXP(-0.5*R[-1]C*R[-1]C)/R[-2]C -> 5.3990966513187959E-2
A14: =DEFINE("triarea",R[5]C[1],R[1]C[1],R[2]C[1],R[3]C[1]) -> #NAME? | B14: Area of a triangle
A15: a = | B15: 30
A16: b = | B16: 40
A17: c = | B17: 50
A18: s = | B18: =(R[-3]C+R[-2]C+R[-1]C)/2 -> 60
A19: area = | B19: =SQRT(R[-1]C*(R[-1]C-R[-4]C)*(R[-1]C-R[-3]C)*(R[-1]C-R[-2]C)) -> 600
A21: =DEFINE("binom",R[3]C[1],R[1]C[1],R[2]C[1]) -> #NAME? | B21: Binomial coefficients
A22: a = | B22: 49
A23: b = | B23: 3
A24: binom(n,k) = | B24: =IF(AND(R[-2]C>0,R[-1]C>0),INDEX(Data!R[-21]C:R[78]C,R[-2]C+R[-1]C,1)/INDEX(Data!R[-21]C:R[78]C,R[-2]C,1)/INDEX(Data!R[-21]C:R[78]C,R[-1]C,1),1) -> 22100
A26: =DEFINE("binomlog",R[6]C[1],R[1]C[1],R[2]C[1]) -> #NAME? | B26: Binomial coefficients using table of logarithms
A27: a = | B27: 49
A28: b = | B28: 3
B29: =INDEX(Data!R[-26]C[6]:R[73]C[6],R[-2]C+R[-1]C,1) -> 156.3608363030788
B30: =INDEX(Data!R[-27]C[6]:R[72]C[6],R[-3]C,1) -> 144.5657439463449
B31: =INDEX(Data!R[-28]C[6]:R[71]C[6],R[-3]C,1) -> 1.791759469228055
A32: binomlog(n,k) = | B32: =IF(AND(R[-5]C>0,R[-4]C>0),ROUND(EXP(R[-3]C-R[-2]C-R[-1]C),0),1) -> 22100
A34: =DEFINE("ndie",R[2]C[1],R[1]C[1]) -> #NAME? | B34: General n-side die
A35: n = | B35: 6
A36: eyes = | B36: =FLOOR(RAND()*R[-1]C,1)+1 -> 3
A38: =DEFINE("weekdayname",R[2]C[1],R[1]C[1]) -> #NAME? | B38: Weekday name
A39: wdayno = | B39: 0
A40: dayname = | B40: =INDEX(Data!R[-33]C[2]:R[-27]C[2],R[-1]C+1,1) -> Monday
A42: =DEFINE("rept1",R[3]C[1],R[1]C[1],R[2]C[1]) -> #NAME? | B42: REPT1(s,n), non-recursive implementation
A43: s = | B43: ab
A44: n = | B44: 5
A45: result = | B45: =R[10]C[5] -> ababababab
B46: 1 | C46: =R44C2>=RC[-1] -> 1 | D46: =IF(RC[-1],R43C2,"") -> ab | E46: =R[1]C-RC[-3]*RC[1] -> 0 | F46: =R[1]C[-1]>=RC[-4] -> 1 | G46: =IF(RC[-1],RC[-3],"") -> ab
B47: 2 | C47: =R44C2>=RC[-1] -> 1 | D47: =IF(RC[-1],R[-1]C&R[-1]C,"") -> abab | E47: =R[1]C-RC[-3]*RC[1] -> 1 | F47: =R[1]C[-1]>=RC[-4] -> 0 | G47: =IF(RC[-1],R[-1]C&RC[-3],R[-1]C) -> ab
B48: 4 | C48: =R44C2>=RC[-1] -> 1 | D48: =IF(RC[-1],R[-1]C&R[-1]C,"") -> abababab | E48: =R[1]C-RC[-3]*RC[1] -> 1 | F48: =R[1]C[-1]>=RC[-4] -> 1 | G48: =IF(RC[-1],R[-1]C&RC[-3],R[-1]C) -> ababababab
B49: 8 | C49: =R44C2>=RC[-1] -> 0 | D49: =IF(RC[-1],R[-1]C&R[-1]C,"") ->  | E49: =R[1]C-RC[-3]*RC[1] -> 5 | F49: =R[1]C[-1]>=RC[-4] -> 0 | G49: =IF(RC[-1],R[-1]C&RC[-3],R[-1]C) -> ababababab
B50: 16 | C50: =R44C2>=RC[-1] -> 0 | D50: =IF(RC[-1],R[-1]C&R[-1]C,"") ->  | E50: =R[1]C-RC[-3]*RC[1] -> 5 | F50: =R[1]C[-1]>=RC[-4] -> 0 | G50: =IF(RC[-1],R[-1]C&RC[-3],R[-1]C) -> ababababab
B51: 32 | C51: =R44C2>=RC[-1] -> 0 | D51: =IF(RC[-1],R[-1]C&R[-1]C,"") ->  | E51: =R[1]C-RC[-3]*RC[1] -> 5 | F51: =R[1]C[-1]>=RC[-4] -> 0 | G51: =IF(RC[-1],R[-1]C&RC[-3],R[-1]C) -> ababababab
B52: 64 | C52: =R44C2>=RC[-1] -> 0 | D52: =IF(RC[-1],R[-1]C&R[-1]C,"") ->  | E52: =R[1]C-RC[-3]*RC[1] -> 5 | F52: =R[1]C[-1]>=RC[-4] -> 0 | G52: =IF(RC[-1],R[-1]C&RC[-3],R[-1]C) -> ababababab
B53: 128 | C53: =R44C2>=RC[-1] -> 0 | D53: =IF(RC[-1],R[-1]C&R[-1]C,"") ->  | E53: =R[1]C-RC[-3]*RC[1] -> 5 | F53: =R[1]C[-1]>=RC[-4] -> 0 | G53: =IF(RC[-1],R[-1]C&RC[-3],R[-1]C) -> ababababab
B54: 256 | C54: =R44C2>=RC[-1] -> 0 | D54: =IF(RC[-1],R[-1]C&R[-1]C,"") ->  | E54: =R[1]C-RC[-3]*RC[1] -> 5 | F54: =R[1]C[-1]>=RC[-4] -> 0 | G54: =IF(RC[-1],R[-1]C&RC[-3],R[-1]C) -> ababababab
B55: 512 | C55: =R44C2>=RC[-1] -> 0 | D55: =IF(RC[-1],R[-1]C&R[-1]C,"") ->  | E55: =R[1]C-RC[-3]*RC[1] -> 5 | F55: =R[1]C[-1]>=RC[-4] -> 0 | G55: =IF(RC[-1],R[-1]C&RC[-3],R[-1]C) -> ababababab
E56: =R44C2 -> 5
A58: =DEFINE("rept2",R[3]C[1],R[1]C[1],R[2]C[1]) -> #NAME? | B58: REPT2(s,n), naïve recursive implementation | F58: abc | G58: 7
A59: s = | B59: a | G59: =rept2(R58C6,R58C7) -> #NAME? | H59: =LEN(RC[-1]) -> #NAME?
A60: n = | B60: 3 | F60: =SPECIALIZE("rept2", R58C6,NA()) -> #NAME? | G60: =apply(RC[-1],R58C7) -> #NAME? | H60: =LEN(RC[-1]) -> #NAME?
A61: result = | B61: =IF(R[-1]C=0,"",R[-2]C&rept2(R[-2]C,R[-1]C-1)) -> #NAME? | F61: =SPECIALIZE("rept3", R58C6,NA()) -> #NAME? | G61: =apply(RC[-1],R58C7) -> #NAME? | H61: =LEN(RC[-1]) -> #NAME?
F62: =SPECIALIZE("rept4", R58C6,NA()) -> #NAME? | G62: =apply(RC[-1],R58C7) -> #NAME? | H62: =LEN(RC[-1]) -> #NAME?
A63: =DEFINE("rept3",R[3]C[1],R[1]C[1],R[2]C[1]) -> #NAME? | B63: REPT3(s,n), fast recursive implementation, no evaluation conditions required | F63: =SPECIALIZE("rept4",NA(),R58C7) -> #NAME? | G63: =apply(RC[-1],R[-5]C[-1]) -> #NAME? | H63: =LEN(RC[-1]) -> #NAME?
A64: s =
A65: n =
B66: =IF(R[-1]C=0,"",IF(R[-1]C=1, R[-2]C, IF(MOD(R[-1]C,2),R[-2]C&rept3(R[-2]C&R[-2]C, FLOOR(R[-1]C/2,1)), rept3(R[-2]C&R[-2]C,FLOOR(R[-1]C/2,1))))) ->  | F66: count = | G66: 1
A68: =DEFINE("rept4",R[4]C[1],R[1]C[1],R[2]C[1]) -> #NAME? | B68: REPT4(s,n), fast recursive implementation, relies on evaluation conditions | F68: REPT4(F55,G55) | G68: =benchmark(CLOSURE("rept4",R58C6,R58C7),R66C7) -> #NAME?
A69: s = | F69: REPT4(F55,NA)(G55) | G69: =benchmark(CLOSURE(SPECIALIZE("rept4",R58C6,NA()),R58C7),R66C7) -> #NAME?
A70: n = | F70: REPT4(NA,G55)(F55) | G70: =benchmark(CLOSURE(SPECIALIZE("rept4",NA(),R58C7),R58C6),R66C7) -> #NAME?
A71: rept4(s,n/2) = | B71: =rept4(R[-2]C, FLOOR(R[-1]C/2,1)) -> #NAME?
A72: result = | B72: =IF(R[-2]C=0,"",IF(MOD(R[-2]C,2),R[-3]C&R[-1]C&R[-1]C, R[-1]C&R[-1]C)) -> 
A74: =DEFINE("integrate",R[7]C[1],R[1]C[1],R[2]C[1],R[3]C[1]) -> #NAME? | B74: INTEGRATE(f,a,b) | F74: =DEFINE("recip",R[2]C[1],R[1]C[1]) -> #NAME? | G74: RECIP(x) = 1/x
A75: f = | C75: f(x) | F75: x =
A76: a = | C76: =apply(R75C2,RC[-1]) -> #NAME? | F76: result = | G76: =1/R[-1]C -> #DIV/0!
A77: b = | C77: =apply(R75C2,RC[-1]) -> #NAME?
A78: m = | B78: =(R[-2]C+R[-1]C)/2 -> 0 | C78: =apply(R75C2,RC[-1]) -> #NAME?
A79: simpson = | B79: =(R77C2-R76C2)/6*(R[-3]C[1]+4*R[-1]C[1]+R[-2]C[1]) -> #NAME?
A80: midpoint = | B80: =(R77C2-R76C2)*R[-2]C[1] -> #NAME?
A81: result = | B81: =IF(ABS(R[-2]C-R[-1]C)<0.0000001, R[-2]C, INTEGRATE(R[-6]C,R[-5]C,R[-3]C)+INTEGRATE(R[-6]C,R[-3]C,R[-4]C)) -> #NAME?
A83: =DEFINE("identity",R[2]C[1],R[1]C[1]) -> #NAME? | B83: IDENTITY(x)
A84: x =
A85: result = | B85: =R[-1]C -> 0
A87: =DEFINE("yearlength",R[2]C[1],R[1]C[1]) -> #NAME? | B87: YEARLENGTH(yyyy)
A88: y = | B88: 2000
A89: result = | B89: =IF(OR(AND(NOT(MOD(R[-1]C,4)),MOD(R[-1]C,100)),NOT(MOD(R[-1]C,400))),366,365) -> 366
A91: =DEFINE("normalbmi",R[2]C[1],R[1]C[1]) -> #NAME? | B91: NORMALBMI(bmi)
A92: bmi =
A93: isnormal = | B93: =AND(18.5<=R[-1]C, R[-1]C<25) -> 0
B95: BINOM0, BINOM1, BINOM2 partial applications of BINOM
B96: =CLOSURE("binom",NA(),NA()) -> #NAME? | C96: =DEFINE("binom0",RC[-1]) -> #NAME?
B97: =CLOSURE("binom",49,NA()) -> #NAME? | C97: =DEFINE("binom1",RC[-1]) -> #NAME?
B98: =CLOSURE("binom",49,3) -> #NAME? | C98: =DEFINE("binom2",RC[-1]) -> #NAME?
A100: =DEFINE("manyargs",R[10]C[1],R[1]C[1],R[2]C[1],R[3]C[1],R[4]C[1],R[5]C[1],R[6]C[1],R[7]C[1],R[8]C[1],R[9]C[1]) -> #NAME? | B100: MANYARGS
B101: 1
B102: 2
B103: 3
B104: 4
B105: 5
B106: 6
B107: 7
B108: 8
B109: 9
A110: result = | B110: =R[-9]C+R[-8]C+R[-7]C+R[-6]C+R[-5]C+R[-4]C+R[-3]C+R[-2]C+R[-1]C -> 45
A112: =DEFINE("WEEKDAYNAMECHOOSE", R[2]C[1],R[1]C[1]) -> #NAME? | B112: WEEKDAYNAMECHOOSE
A113: weekday = | B113: 3
A114: weekdayname = | B114: =CHOOSE(R[-1]C+1,"Mon", "Tue", "Wed", "Thu", "Fri", "Sat", "Sun") -> Thu
A116: =DEFINE("monthlen",R[3]C[1],R[1]C[1],R[2]C[1]) -> #NAME? | B116: MONTHLEN | J116: =SPECIALIZE("monthlen",NA(),2) -> #NAME? | K116: =SPECIALIZE("monthlen",NA(),3) -> #NAME?
A117: year = | B117: 2008 | D117: 2010 | E117: =SPECIALIZE("monthlen",RC[-1],NA()) -> #NAME? | F117: =apply(RC[-1],2) -> #NAME? | G117: 28 | H117: =RC[-2]=RC[-1] -> #NAME? | J117: =RC[-3]=apply(R116C,RC[-6]) -> #NAME? | K117: =31=apply(R116C,RC[-6]) -> #NAME?
A118: month = | B118: 2 | D118: 2012 | E118: =SPECIALIZE("monthlen",RC[-1],NA()) -> #NAME? | F118: =apply(RC[-1],2) -> #NAME? | G118: 29 | H118: =RC[-2]=RC[-1] -> #NAME? | J118: =RC[-3]=apply(R116C,RC[-6]) -> #NAME? | K118: =31=apply(R116C,RC[-6]) -> #NAME?
A119: monthlen = | B119: =CHOOSE(R[-1]C,31,28+OR(AND(NOT(MOD(R[-2]C,4)),MOD(R[-2]C,100)),NOT(MOD(R[-2]C,400))),31,30,31,30,31,31,30,31,30,31) -> 29 | D119: 2100 | E119: =SPECIALIZE("monthlen",RC[-1],NA()) -> #NAME? | F119: =apply(RC[-1],2) -> #NAME? | G119: 28 | H119: =RC[-2]=RC[-1] -> #NAME? | J119: =RC[-3]=apply(R116C,RC[-6]) -> #NAME? | K119: =31=apply(R116C,RC[-6]) -> #NAME? | M119: =DEFINE("testspecmonthlen",R[1]C[-1]) -> #NAME?
H120: =AND(R[-3]C,R[-2]C,R[-1]C) -> #NAME? | J120: =AND(R[-3]C,R[-2]C,R[-1]C) -> #NAME? | K120: =AND(R[-3]C,R[-2]C,R[-1]C) -> #NAME? | L120: =AND(RC[-4],RC[-2],RC[-1]) -> #NAME? | M120: =testspecmonthlen() -> #NAME?
A121: =DEFINE("square", R[2]C[1],R[1]C[1]) -> #NAME? | B121: SQUARE
A122: x =
A123: x * x = | B123: =R[-1]C*R[-1]C -> 0
A125: =DEFINE("tailrec1",R[2]C[1],R[1]C[1]) -> #NAME? | B125: TAILREC1
A126: n =
A127: result = | B127: =IF(R[-1]C,TAILREC1(R[-1]C-1),117) -> 117
A129: =DEFINE("tailrec2",R[2]C[1],R[1]C[1]) -> #NAME? | B129: TAILREC2
A130: n =
A131: result = | B131: =CHOOSE(IF(R[-1]C,1,2), TAILREC2(R[-1]C-1),117) -> 117
A133: =DEFINE("partialapp",R[6]C[1],R[1]C[1],R[2]C[1],R[3]C[1],R[4]C[1],R[5]C[1]) -> #NAME? | B133: PARTIALAPP
A134: x1 =
A135: x2 =
A136: x3 =
A137: x4 =
A138: x5 =
B139: =10000*R[-5]C+1000*R[-4]C+100*R[-3]C+10*R[-2]C+R[-1]C -> 0
A141: =DEFINE("tailrec3",R[3]C[1],R[1]C[1],R[2]C[1]) -> #NAME? | B141: TAILREC3
A142: f =
A143: n =
B144: =IF(R[-1]C=0,117,apply(R[-2]C,R[-2]C, R[-1]C-1)) -> 117
A146: =DEFINE("sub",R[3]C[1],R[1]C[1],R[2]C[1]) -> #NAME? | B146: SUB(x,y) for testing nested calls
A147: x =
A148: y =
B149: =R[-2]C-R[-1]C -> 0
A151: =DEFINE("rowcol",R[3]C[1],R[1]C[1],R[2]C[1]) -> #NAME? | B151: ROWCOL(r,c)
A152: r =
A153: c =
A154: result = | B154: =R[-2]C*10+R[-1]C -> 0
A156: =DEFINE("checkslice",R[8]C[7],R[1]C[1]) -> #NAME? | B156: CHECKSLICE, used also for checking array views, TABULATE, HARRAY, VARRAY etc
A157: arr =
A158: =slice(R[-1]C[1],1,1,2,3) -> #NAME? | B158: =INDEX(RC1,1,1) -> #NAME? | C158: 11 | D158: =ROWS(RC1) -> 1 | E158: =COLUMNS(RC1) -> 1 | F158: 2 | G158: 3 | H158: =AND(RC[-6]=RC[-5],RC[-4]=RC[-2],RC[-3]=RC[-1]) -> #NAME?
A159: =slice(R[-2]C[1],1,1,1,1) -> #NAME? | B159: =INDEX(RC1,1,1) -> #NAME? | C159: 11 | D159: =ROWS(RC1) -> 1 | E159: =COLUMNS(RC1) -> 1 | F159: 1 | G159: 1 | H159: =AND(RC[-6]=RC[-5],RC[-4]=RC[-2],RC[-3]=RC[-1]) -> #NAME?
A160: =slice(R[-3]C[1],2,3,2,3) -> #NAME? | B160: =INDEX(RC1,1,1) -> #NAME? | C160: 23 | D160: =ROWS(RC1) -> 1 | E160: =COLUMNS(RC1) -> 1 | F160: 1 | G160: 1 | H160: =AND(RC[-6]=RC[-5],RC[-4]=RC[-2],RC[-3]=RC[-1]) -> #NAME?
A161: =slice(R[-4]C[1],2,2,1,1) -> #NAME? | D161: =ROWS(RC1) -> 1 | E161: =COLUMNS(RC1) -> 1 | F161: 0 | G161: 0 | H161: =AND(RC[-4]=RC[-2],RC[-3]=RC[-1]) -> 0
A162: =slice(R[-5]C[1],2,1,2,3) -> #NAME? | B162: =INDEX(RC1,1,1) -> #NAME? | C162: 21 | D162: =ROWS(RC1) -> 1 | E162: =COLUMNS(RC1) -> 1 | F162: 1 | G162: 3 | H162: =AND(RC[-6]=RC[-5],RC[-4]=RC[-2],RC[-3]=RC[-1]) -> #NAME?
A163: =slice(R[-6]C[1],1,3,2,3) -> #NAME? | B163: =INDEX(RC1,1,1) -> #NAME? | C163: 13 | D163: =ROWS(RC1) -> 1 | E163: =COLUMNS(RC1) -> 1 | F163: 2 | G163: 1 | H163: =AND(RC[-6]=RC[-5],RC[-4]=RC[-2],RC[-3]=RC[-1]) -> #NAME?
H164: =AND(R[-6]C,R[-5]C,R[-4]C,R[-3]C,R[-2]C,R[-1]C) -> #NAME?
A165: =DEFINE("rowmapcheck",R[4]C[1],R[1]C[1],R[2]C[1],R[3]C[1]) -> #NAME? | B165: ROWMAPCHECK
A166: x =
A167: y =
A168: z =
A169: xyz = | B169: =R[-3]C*10000+R[-2]C*100+R[-1]C -> 0
A171: =DEFINE("colmapcheck",R[3]C[1],R[1]C[1],R[2]C[1]) -> #NAME? | B171: COLMAPCHECK
A172: x =
A173: y =
A174: xy = | B174: =R[-2]C*100+R[-1]C -> 0
A176: =DEFINE("testevalcond1",R[4]C[1],R[1]C[1],R[2]C[1]) -> #NAME? | B176: TESTEVALCOND1
A177: r =
A178: c =
A179: serious = | B179: =extern("System.Math.Sin$(D)D",PI()/2) -> #NAME?
B180: =IF(RAND()<0.2, R[-1]C*R[-1]C, 10) -> 10
A182: =DEFINE("testevalcond2",R[4]C[1],R[1]C[1],R[2]C[1]) -> #NAME? | B182: TESTEVALCOND2
A183: r =
A184: c =
A185: serious = | B185: =extern("System.Math.Sin$(D)D",PI()/2) -> #NAME?
B186: =IF(RAND()<0.2, R[-1]C*R[-1]C, IF(RAND()<0.2, R[-1]C*R[-1]C, 10)) -> 10
A188: =DEFINE("myiseven",R[2]C[1],R[1]C[1]) -> #NAME? | B188: MYISEVEN | C188: Test mutual recursion
A189: n =
B190: =IF(R[-1]C=0,1,MYISODD(R[-1]C-1)) -> 1
A192: =DEFINE("myisodd",R[2]C[1],R[1]C[1]) -> #NAME? | B192: MYISODD | C192: Test mutual recursion
A193: n =
B194: =IF(R[-1]C=0,0,MYISEVEN(R[-1]C-1)) -> 0
A196: =DEFINE("nextfibrow",R[4]C[1],R[1]C[1]) -> #NAME? | B196: NEXTFIBROW | C196: Generate next Fibonacci pair as row vector
A197: arg =
A198: a = | B198: =INDEX(R197C2,1,1) -> 0
A199: b = | B199: =INDEX(R197C2,1,2) -> #REF!
A200: res = | B200: =hcat(R[-1]C,R[-2]C+R[-1]C) -> #NAME?
A203: =DEFINE("nextfibcol",R[4]C[1],R[1]C[1]) -> #NAME? | B203: NEXTFIBCOL | C203: Generate next Fibonacci pair as column vector
A204: arg =
A205: a = | B205: =INDEX(R204C2,1,1) -> 0
A206: b = | B206: =INDEX(R204C2,2,1) -> #REF!
A207: res = | B207: =vcat(R[-1]C,R[-2]C+R[-1]C) -> #NAME?
A210: =DEFINE("saving",R[3]C[1],R[1]C[1],R[2]C[1]) -> #NAME? | B210: SAVING | C210: Future value of $100 after n years at interest rate r
A211: r = | B211: 0.01
A212: n = | B212: 10
A213: result = | B213: =100*(1+R[-2]C)^R[-1]C -> 110.46221254112048
A217: =DEFINE("const0_1",R[1]C[1]) -> #NAME? | B217: CONST0_1 | C217: Return preallocated number
A218: res = | B218: 1
A221: =DEFINE("const1_1",R[2]C[1],R[1]C[1]) -> #NAME? | B221: CONST1_1 | C221: Return preallocated number
A222: arg =
A223: res = | B223: 1
A226: =DEFINE("const1_17",R[2]C[1],R[1]C[1]) -> #NAME? | B226: CONST1_17 | C226: Return newly allocated number
A227: arg =
A228: res = | B228: =17 -> 17
A231: =DEFINE("add_1",R[2]C[1],R[1]C[1]) -> #NAME? | B231: ADD_1 | C231: Unwrap, add, wrap
A232: arg =
A233: res = | B233: =R[-1]C+1 -> 1
A236: =DEFINE("add_1_nontail",R[2]C[1],R[1]C[1]) -> #NAME? | B236: ADD_1_NONTAIL | C236: Nontail call, unwrap, add, wrap
A237: arg =
A238: res = | B238: =identity(R[-1]C)+1 -> #NAME?
A241: =DEFINE("add_1_tail",R[2]C[1],R[1]C[1]) -> #NAME? | B241: ADD_1_TAIL | C241: Unwrap, add, wrap, tail call
A242: arg =
A243: res = | B243: =identity(R[-1]C+1) -> #NAME?
A245: =DEFINE("apply_1",R[2]C[1],R[1]C[1]) -> #NAME? | B245: APPLY_1 | C245: Call 1-arg closure, add 1, wrap
A246: f =
A247: f(1)+1 = | B247: =apply(R[-1]C,1)+1 -> #NAME?
A249: =DEFINE("nestedifs",R[3]C[1],R[1]C[1],R[2]C[1]) -> #NAME? | B249: NESTED IFS
A250: x =
A251: y =
A252: result = | B252: =IF(R[-2]C>R[-1]C,111,IF(R[-2]C*2>R[-1]C,222,IF(R[-1]C*3>R[-1]C,333,444))) -> 444

Sheet: @TestBuiltins
A1: Test code generation of builtins, 2012-01-08 | F1: =AND(R[14]C,R[20]C,R[30]C,R[45]C,R[58]C,R[66]C,R[72]C,R[78]C,R[81]C,R[86]C,R[92]C,R[94]C[-1],R[105]C,R[111]C,R[117]C,R[123]C,R[129]C,R[134]C,R[140]C,R[149]C,R[156]C,R[161]C,R[176]C,R[182]C,R[186]C,R[190]C,R[193]C,R[199]C,R[204]C,R[207]C,R[211]C,R[227]C,R[234]C) -> #NAME? | G1: =DEFINE("testall",RC[-1]) -> #NAME?
A2: ARITHMETICS
A3: =2+5 -> 7 | B3: 7 | E3: =RC[-4]=RC[-3] -> 1
A4: =2-5 -> -3 | B4: -3 | E4: =RC[-4]=RC[-3] -> 1
A5: =2*5 -> 10 | B5: 10 | E5: =RC[-4]=RC[-3] -> 1
A6: =2/5 -> 0.4 | B6: 0.4 | E6: =RC[-4]=RC[-3] -> 1
A7: =2^5 -> 32 | B7: 32 | E7: =RC[-4]=RC[-3] -> 1
A8: =MOD(7,3) -> 1 | B8: 1 | E8: =ABS(RC[-4]-RC[-3])<0.0000000001 -> 1
A9: =MOD(7,-3) -> -2 | B9: -2 | E9: =ABS(RC[-4]-RC[-3])<0.0000000001 -> 1
A10: =MOD(-7,3) -> 2 | B10: 2 | E10: =ABS(RC[-4]-RC[-3])<0.0000000001 -> 1
A11: =MOD(-7,-3) -> -1 | B11: -1 | E11: =ABS(RC[-4]-RC[-3])<0.0000000001 -> 1
A12: =MOD(2.4, 0.7) -> 0.30000000000000004 | B12: 0.3 | E12: =ABS(RC[-4]-RC[-3])<0.0000000001 -> 1
A13: =-R[-1]C -> -0.30000000000000004 | B13: -0.3 | E13: =ABS(RC[-4]-RC[-3])<0.0000000001 -> 1
A14: =--R[-2]C -> 0.30000000000000004 | B14: 0.3 | E14: =ABS(RC[-4]-RC[-3])<0.0000000001 -> 1
F15: =AND(R[-12]C[-1],AND(R[-11]C[-1],AND(R[-10]C[-1],AND(R[-9]C[-1],AND(R[-8]C[-1],AND(R[-7]C[-1],R[-6]C[-1],R[-5]C[-1],R[-4]C[-1],R[-3]C[-1]),R[-2]C[-1],R[-1]C[-1]))))) -> 1 | G15: =DEFINE("testarith",RC[-1]) -> #NAME?
A16: COMPARISONS
A17: =2<5 -> 1 | B17: =5<2 -> 0 | C17: =2<2 -> 0 | E17: =AND(RC[-4],AND(NOT(RC[-3]),NOT(RC[-2]))) -> 1
A18: =2<=5 -> 1 | B18: =5<=2 -> 0 | C18: =2<=2 -> 1 | E18: =AND(RC[-4],AND(NOT(RC[-3]),RC[-2])) -> 1
A19: =2>5 -> 0 | B19: =5>2 -> 1 | C19: =2>2 -> 0 | E19: =AND(NOT(RC[-4]),AND(RC[-3],NOT(RC[-2]))) -> 1
A20: =2>=5 -> 0 | B20: =5>=2 -> 1 | C20: =2>=2 -> 1 | E20: =AND(NOT(RC[-4]),AND(RC[-3],RC[-2])) -> 1
F21: =AND(R[-4]C[-1],R[-3]C[-1],R[-2]C[-1],R[-1]C[-1]) -> 1 | G21: =DEFINE("testcompare",RC[-1]) -> #NAME?
A22: LOGIC AND IF
A23: =IF(1,20,10)/10-1 -> 1 | B23: =IF(0,20,10)/10 -> 1 | E23: =ABS(RC[-4]-RC[-3])<0.0000000001 -> 1
A24: =AND(0,0) -> 0 | B24: =AND(0,1) -> 0 | C24: =AND(1,0) -> 0 | D24: =AND(1,1) -> 1 | E24: =AND(NOT(OR(RC[-4],OR(RC[-3],RC[-2]))),RC[-1]) -> 1
A25: =OR(0,0) -> 0 | B25: =OR(0,1) -> 1 | C25: =OR(1,0) -> 1 | D25: =OR(1,1) -> 1 | E25: =AND(NOT(RC[-4]),AND(RC[-3],AND(RC[-2],RC[-1]))) -> 1
A26: =NOT(0) -> 1 | B26: =NOT(1) -> 0 | C26: =NOT(NOT(0)) -> 0 | D26: =NOT(NOT(1)) -> 1 | E26: =AND(AND(RC[-4],NOT(RC[-3])),AND(NOT(RC[-2]),RC[-1])) -> 1
A27: =AND(RC6) -> 1 | B27: =AND(0,RC6,RC6) -> 0 | C27: =AND(RC6,0,RC6) -> 0 | D27: =AND(RC6,RC6,0) -> 0 | E27: =AND(RC[-4],NOT(OR(RC[-3],RC[-2],RC[-1]))) -> 1 | F27: 1
A28: =AND(RC6) -> 0 | B28: =AND(1,RC6,RC6) -> 0 | C28: =AND(RC6,1,RC6) -> 0 | D28: =AND(RC6,RC6,1) -> 0 | E28: =NOT(OR(RC[-4],RC[-3],RC[-2],RC[-1])) -> 1 | F28: 0
A29: =OR(RC6) -> 0 | B29: =OR(0,RC6,RC6) -> 0 | C29: =OR(RC6,0,RC6) -> 0 | D29: =OR(RC6,RC6,0) -> 0 | E29: =NOT(OR(RC[-4],RC[-3],RC[-2],RC[-1])) -> 1 | F29: 0
A30: =OR(RC6) -> 1 | B30: =OR(1,RC6,RC6) -> 1 | C30: =OR(RC6,1,RC6) -> 1 | D30: =OR(RC6,RC6,1) -> 1 | E30: =AND(RC[-4],RC[-3],RC[-2],RC[-1]) -> 1 | F30: 1
F31: =AND(R[-8]C[-1],R[-7]C[-1],R[-6]C[-1],R[-5]C[-1],R[-4]C[-1],R[-3]C[-1],R[-2]C[-1],R[-1]C[-1]) -> 1 | G31: =DEFINE("testif",RC[-1],R[-4]C[-1],R[-3]C[-1],R[-2]C[-1],R[-1]C[-1]) -> #NAME?
A32: MATHEMATICAL FUNCTIONS
A33: =ABS(3) -> 3 | B33: 3 | E33: =ABS(RC[-4]-RC[-3])<0.0000000001 -> 1
A34: =ABS(-3) -> 3 | B34: 3 | E34: =ABS(RC[-4]-RC[-3])<0.0000000001 -> 1
A35: =ACOS(1) -> 0 | B35: 0 | E35: =ABS(RC[-4]-RC[-3])<0.0000000001 -> 1
A36: =ACOS(0) -> 1.5707963267948966 | B36: =PI()/2 -> 1.5707963267948966 | E36: =ABS(RC[-4]-RC[-3])<0.0000000001 -> 1
A37: =ASIN(1) -> 1.5707963267948966 | B37: =PI()/2 -> 1.5707963267948966 | E37: =ABS(RC[-4]-RC[-3])<0.0000000001 -> 1 | F37: =AND(R[-4]C[-1],R[-3]C[-1],R[-2]C[-1],R[-1]C[-1]) -> 1
A38: =ASIN(0) -> 0 | B38: 0 | E38: =ABS(RC[-4]-RC[-3])<0.0000000001 -> 1
A39: =ATAN(1) -> 0.78539816339744828 | B39: =PI()/4 -> 0.78539816339744828 | E39: =ABS(RC[-4]-RC[-3])<0.0000000001 -> 1
A40: =ATAN(0) -> 0 | B40: 0 | E40: =ABS(RC[-4]-RC[-3])<0.0000000001 -> 1
A41: =COS(PI()/2) -> 6.1257422745431001E-17 | B41: 0 | E41: =ABS(RC[-4]-RC[-3])<0.0000000001 -> 1 | F41: =AND(R[-4]C[-1],R[-3]C[-1],R[-2]C[-1],R[-1]C[-1]) -> 1
A42: =SIN(PI()/2) -> 1 | B42: 1 | E42: =ABS(RC[-4]-RC[-3])<0.0000000001 -> 1
A43: =TAN(PI()/4) -> 0.99999999999999989 | B43: 1 | E43: =ABS(RC[-4]-RC[-3])<0.0000000001 -> 1
A44: =ATAN2(1,-1) -> -0.78539816339744828 | B44: =-PI()/4 -> -0.78539816339744828 | E44: =ABS(RC[-4]-RC[-3])<0.0000000001 -> 1
A45: =ATAN2(-1,-1) -> -2.3561944901923448 | B45: =-3/4*PI() -> -2.3561944901923448 | E45: =ABS(RC[-4]-RC[-3])<0.0000000001 -> 1
F46: =AND(R[-9]C,R[-5]C,R[-5]C[-1],R[-4]C[-1],R[-3]C[-1],R[-2]C[-1],R[-1]C[-1]) -> 1 | G46: =DEFINE("testtrig",RC[-1]) -> #NAME?
A47: =CEILING(11.234,0.1) -> 11.3 | B47: 11.3 | E47: =ABS(RC[-4]-RC[-3])<0.0000000001 -> 1
A48: =CEILING(11.234,1) -> 12 | B48: 12 | E48: =ABS(RC[-4]-RC[-3])<0.0000000001 -> 1
A49: =CEILING(-11.234,-1) -> -12 | B49: -12 | E49: =ABS(RC[-4]-RC[-3])<0.0000000001 -> 1
A50: =FLOOR(11.234,0.1) -> 11.200000000000001 | B50: 11.2 | E50: =ABS(RC[-4]-RC[-3])<0.0000000001 -> 1
A51: =FLOOR(11.234,1) -> 11 | B51: 11 | E51: =ABS(RC[-4]-RC[-3])<0.0000000001 -> 1
A52: =FLOOR(-11.234,-1) -> -11 | B52: -11 | E52: =ABS(RC[-4]-RC[-3])<0.0000000001 -> 1
A53: =ROUND(2.5,0) -> 3 | B53: 3 | E53: =ABS(RC[-4]-RC[-3])<0.0000000001 -> 1
A54: =ROUND(11.2345,3) -> 11.234999999999999 | B54: 11.234999999999999 | E54: =ABS(RC[-4]-RC[-3])<0.0000000001 -> 1
A55: =ROUND(11.234,0) -> 11 | B55: 11 | E55: =ABS(RC[-4]-RC[-3])<0.0000000001 -> 1
A56: =ROUND(11.234,1) -> 11.2 | B56: 11.2 | E56: =ABS(RC[-4]-RC[-3])<0.0000000001 -> 1
A57: =ROUND(-11.5,0) -> -12 | B57: -12 | E57: =ABS(RC[-4]-RC[-3])<0.0000000001 -> 1
A58: =ROUND(115,-1) -> 120 | B58: 120 | E58: =ABS(RC[-4]-RC[-3])<0.0000000001 -> 1
F59: =AND(R[-12]C[-1],R[-11]C[-1],R[-10]C[-1],R[-9]C[-1],R[-8]C[-1],R[-7]C[-1],R[-6]C[-1],R[-5]C[-1],R[-4]C[-1],R[-3]C[-1],R[-2]C[-1],R[-1]C[-1]) -> 1 | G59: =DEFINE("testfloor",RC[-1]) -> #NAME?
A60: =LN(1) -> 0 | B60: 0 | E60: =ABS(RC[-4]-RC[-3])<0.0000000001 -> 1
A61: =LN(EXP(2.5)) -> 2.5 | B61: 2.5 | E61: =ABS(RC[-4]-RC[-3])<0.0000000001 -> 1
A62: =EXP(LN(117)) -> 117.00000000000003 | B62: 117 | E62: =ABS(RC[-4]-RC[-3])<0.0000000001 -> 1
A63: =EXP(0) -> 1 | B63: 1 | E63: =ABS(RC[-4]-RC[-3])<0.0000000001 -> 1
A64: =LOG(0.001) -> -3 | B64: -3 | E64: =ABS(RC[-4]-RC[-3])<0.0000000001 -> 1
A65: =LOG10(10000) -> 4 | B65: 4 | E65: =ABS(RC[-4]-RC[-3])<0.0000000001 -> 1
A66: =SQRT(64) -> 8 | B66: 8 | E66: =ABS(RC[-4]-RC[-3])<0.0000000001 -> 1
F67: =AND(R[-7]C[-1],R[-6]C[-1],R[-5]C[-1],R[-4]C[-1],R[-3]C[-1],R[-2]C[-1],R[-1]C[-1]) -> 1 | G67: =DEFINE("testlnexp",RC[-1]) -> #NAME?
A68: RAND AND NOW
A69: =RAND() -> 0.55578388842015003 | B69: =SQRT(RC[-1]) -> 0.74550914710696203 | C69: =RC[-1]*RC[-1] -> 0.55578388842014992 | E69: =ABS(RC[-4]-RC[-2])<0.0000000001 -> 1
A70: =RAND() -> 0.16268499975793937 | E70: =AND(0<=RC[-4],RC[-4]<1) -> 1
A71: =NOW() -> 41698.600439236114 | E71: =AND(39766<RC[-4],RC[-4]<50000) -> 1
A72: =NOW() -> 41698.600439236114 | B72: =SQRT(RC[-1]) -> 204.20235169859362 | C72: =RC[-1]*RC[-1] -> 41698.600439236121 | E72: =ABS(RC[-4]-RC[-2])<0.0000000001 -> 1
F73: =AND(R[-4]C[-1],R[-3]C[-1],R[-2]C[-1],R[-1]C[-1]) -> 1 | G73: =DEFINE("testrandnowsqrt",RC[-1]) -> #NAME?
A74: INDEX
A75: =INDEX(Data!R[-72]C[2]:R[-71]C[4],1,1) -> 11 | B75: 11 | E75: =ABS(RC[-4]-RC[-3])<0.0000000001 -> 1
A76: =INDEX(Data!R[-72]C[2]:R[-72]C[4],1,1) -> 21 | B76: 21 | E76: =ABS(RC[-4]-RC[-3])<0.0000000001 -> 1
A77: =INDEX(Data!R3C3:R4C5,1,2) -> 12 | B77: 12 | E77: =ABS(RC[-4]-RC[-3])<0.0000000001 -> 1
A78: =INDEX(Data!R3C3:R4C5,2,1) -> 21 | B78: 21 | E78: =ABS(RC[-4]-RC[-3])<0.0000000001 -> 1
F79: =AND(R[-4]C[-1],R[-3]C[-1],R[-2]C[-1],R[-1]C[-1]) -> 1 | G79: =DEFINE("testindex",RC[-1]) -> #NAME?
A80: =Data!R[-76]C[2] -> 21 | B80: 21 | E80: =ABS(RC[-4]-RC[-3])<0.0000000001 -> 1
A81: =Data!R[-77]C[2]+Data!R[-77]C[2] -> 42 | B81: 42 | E81: =ABS(RC[-4]-RC[-3])<0.0000000001 -> 1
F82: =AND(R[-2]C[-1],R[-1]C[-1]) -> 1 | G82: =DEFINE("testextref",RC[-1]) -> #NAME?
A83: STRING CONCATENATION
A84: =12&23 -> 1223 | B84: =LEN(RC[-1]) -> 4 | C84: =RC[-1]=4 -> 1 | D84: =equal(RC[-3],"1223") -> #NAME?
A85: ="abc"&34 -> abc34 | B85: =LEN(RC[-1]) -> 5 | C85: =RC[-1]=5 -> 1 | D85: =equal(RC[-3],"abc34") -> #NAME?
A86: =12&"abc" -> 12abc | B86: =LEN(RC[-1]) -> 5 | C86: =RC[-1]=5 -> 1 | D86: =equal(RC[-3],"12abc") -> #NAME?
A87: ="abc"&"def" -> abcdef | B87: =LEN(RC[-1]) -> 6 | C87: =RC[-1]=6 -> 1 | D87: =equal(RC[-3],"abcdef") -> #NAME? | F87: =AND(R[-3]C[-3],R[-2]C[-3],R[-1]C[-3],RC[-3],R[-3]C[-2],R[-2]C[-2],R[-1]C[-2],RC[-2]) -> #NAME? | G87: =DEFINE("testconcat",RC[-1]) -> #NAME?
F88: , | G88: =testconcat() -> #NAME?
A89: FUNCTIONVALUED FUNCTIONS
A90: =binom0() -> #NAME? | B90: =apply(RC[-1],49,3) -> #NAME? | E90: =(RC[-3]=22100) -> #NAME?
A91: =binom1() -> #NAME? | B91: =apply(RC[-1],3) -> #NAME? | E91: =(RC[-3]=22100) -> #NAME?
A92: =binom2() -> #NAME? | B92: =apply(RC[-1]) -> #NAME? | E92: =(RC[-3]=22100) -> #NAME?
F93: =AND(R[-3]C[-1],R[-2]C[-1],R[-1]C[-1]) -> #NAME? | G93: =DEFINE("testapply",RC[-1]) -> #NAME?
A94: MANY ARGUMENTS
A95: =manyargs(10,20,30,40,50,60,70,80,90) -> #NAME? | E95: =(RC[-4]=450) -> #NAME? | G95: =DEFINE("testmanyargs",RC[-2]) -> #NAME?
A96: =manyargs(10,20,30,40,50,60,70,80) -> #NAME? | G96: =DEFINE("manyargs1",RC[-6]) -> #NAME?
A97: =manyargs(10,20,30,40,50,60,70,80,90,100) -> #NAME? | G97: =DEFINE("manyargs2",RC[-6]) -> #NAME?
A99: CHOOSE
A100: =weekdaynamechoose(0) -> #NAME?
A101: =weekdaynamechoose(6) -> #NAME?
A102: =monthlen(2008,1) -> #NAME? | B102: 31 | E102: =(RC[-4]=RC[-3]) -> #NAME?
A103: =monthlen(2008,2) -> #NAME? | B103: 29 | E103: =(RC[-4]=RC[-3]) -> #NAME?
A104: =monthlen(2009,2) -> #NAME? | B104: 28 | E104: =(RC[-4]=RC[-3]) -> #NAME?
A105: =monthlen(2009,11) -> #NAME? | B105: 30 | E105: =(RC[-4]=RC[-3]) -> #NAME?
A106: =monthlen(2008,12) -> #NAME? | B106: 31 | E106: =(RC[-4]=RC[-3]) -> #NAME? | F106: =AND(R[-4]C[-1],R[-3]C[-1],R[-2]C[-1],R[-1]C[-1],RC[-1]) -> #NAME? | G106: =DEFINE("testchoose",RC[-1]) -> #NAME?
A108: SUM
A109: =SUM(10) -> 10 | B109: 10 | E109: =(RC[-4]=RC[-3]) -> 1
A110: =SUM(10,Data!R3C3:R4C5) -> 112 | B110: 112 | E110: =(RC[-4]=RC[-3]) -> 1
A111: =SUM(10,Data!R3C3:R4C5, Data!R15C5) -> #VALUE! | B111: 214 | E111: =(RC[-4]=RC[-3]) -> #VALUE!
A112: =SUM(10,Data!R3C3:R4C5, Data!R15C5, Data!R[-97]C[4]:R[-95]C[4]) -> #VALUE! | B112: 616 | E112: =(RC[-4]=RC[-3]) -> #VALUE! | F112: =AND(R[-3]C[-1],R[-2]C[-1],R[-1]C[-1],RC[-1]) -> #VALUE! | G112: =DEFINE("testsum",RC[-1]) -> #NAME?
A114: AVERAGE
A115: =AVERAGE(10) -> 10 | B115: 10 | E115: =(RC[-4]=RC[-3]) -> 1
A116: =AVERAGE(10,Data!R3C3:R4C5) -> 16 | B116: 16 | E116: =(RC[-4]=RC[-3]) -> 1
A117: =AVERAGE(10,Data!R3C3:R4C5, Data!R15C5) -> #VALUE! | B117: =214/13 -> 16.46153846153846 | E117: =(RC[-4]=RC[-3]) -> #VALUE!
A118: =AVERAGE(10,Data!R3C3:R4C5, Data!R15C5, Data!R15C5:R17C5) -> #VALUE! | B118: =616/21 -> 29.333333333333332 | E118: =(RC[-4]=RC[-3]) -> #VALUE! | F118: =AND(R[-3]C[-1],R[-2]C[-1],R[-1]C[-1],RC[-1]) -> #VALUE! | G118: =DEFINE("testaverage",RC[-1]) -> #NAME?
A120: MAX
A121: =MAX(10) -> 10 | B121: 10 | E121: =(RC[-4]=RC[-3]) -> 1
A122: =MAX(10,Data!R3C3:R4C5) -> 23 | B122: 23 | E122: =(RC[-4]=RC[-3]) -> 1
A123: =MAX(10,Data!R3C3:R4C5, Data!R15C5) -> #VALUE! | B123: 23 | E123: =(RC[-4]=RC[-3]) -> #VALUE!
A124: =MAX(10,Data!R3C3:R4C5, Data!R15C5, Data!R15C5:R17C5) -> #VALUE! | B124: 200 | E124: =(RC[-4]=RC[-3]) -> #VALUE! | F124: =AND(R[-3]C[-1],R[-2]C[-1],R[-1]C[-1],RC[-1]) -> #VALUE! | G124: =DEFINE("testmax",RC[-1]) -> #NAME?
A126: MIN
A127: =MIN(10) -> 10 | B127: 10 | E127: =(RC[-4]=RC[-3]) -> 1
A128: =MIN(10,Data!R3C3:R4C5) -> 10 | B128: 10 | E128: =(RC[-4]=RC[-3]) -> 1
A129: =MIN(10,Data!R3C3:R4C5, Data!R15C5) -> #VALUE! | B129: 10 | E129: =(RC[-4]=RC[-3]) -> #VALUE!
A130: =MIN(10,Data!R3C3:R4C5, Data!R15C5, Data!R15C5:R17C5) -> #VALUE! | B130: 10 | E130: =(RC[-4]=RC[-3]) -> #VALUE! | F130: =AND(R[-3]C[-1],R[-2]C[-1],R[-1]C[-1],RC[-1]) -> #VALUE! | G130: =DEFINE("testmin",RC[-1]) -> #NAME?
A132: MAP
A133: =map(CLOSURE("square",NA()), Data!R3C3:R4C5) -> #NAME?
A134: =SUM(map(CLOSURE("square",NA()),Data!R3C3:R4C5)) -> #NAME? | B134: =Data!R[-128]C[8] -> 1888 | E134: =(RC[-4]=RC[-3]) -> #NAME?
A135: =map(CLOSURE("binom",NA(),NA()),hcat(2,3),hcat(4,5)) -> #NAME? | B135: =INDEX(RC[-1],1,1) -> #NAME? | C135: =INDEX(RC[-2],1,2) -> #REF! | E135: =AND(RC[-3]=15,RC[-2]=56) -> #NAME? | F135: =AND(R[-1]C[-1],RC[-1]) -> #NAME? | G135: =DEFINE("testmap",RC[-1]) -> #NAME?
A137: COUNTIF
A138: =COUNTIF(CLOSURE("normalbmi",NA()),Data!R3C3:R4C5) -> #NAME? | B138: 3 | E138: =(RC[-4]=RC[-3]) -> #NAME?
A139: =COUNTIF(CLOSURE("normalbmi",NA()),Data!R3C2:R102C2) -> #NAME? | B139: 1 | E139: =(RC[-4]=RC[-3]) -> #NAME?
A140: =SUMIF(CLOSURE("normalbmi",NA()),Data!R3C3:R4C5) -> #NAME? | B140: 66 | E140: =(RC[-4]=RC[-3]) -> #NAME?
A141: =SUMIF(CLOSURE("normalbmi",NA()),Data!R3C2:R102C2) -> #NAME? | B141: 24 | E141: =(RC[-4]=RC[-3]) -> #NAME? | F141: =AND(R[-3]C[-1],R[-2]C[-1],R[-1]C[-1],RC[-1]) -> #NAME? | G141: =DEFINE("testcountsumif",RC[-1]) -> #NAME?
A143: CLOSURE AND APPLY
B144: =partialapp(2,7,3,9,4) -> #NAME? | C144: =(RC[-1]=27394) -> #NAME?
A145: =CLOSURE("partialapp",NA(),NA(),NA(),NA(),NA()) -> #NAME? | B145: =apply(RC1,2,7,3,9,4) -> #NAME? | C145: =(RC[-1]=27394) -> #NAME?
A146: =CLOSURE("partialapp",2,NA(),NA(),NA(),NA()) -> #NAME? | B146: =apply(RC1,7,3,9,4) -> #NAME? | C146: =(RC[-1]=27394) -> #NAME?
A147: =CLOSURE("partialapp",2,7,NA(),NA(),NA()) -> #NAME? | B147: =apply(RC1,3,9,4) -> #NAME? | C147: =(RC[-1]=27394) -> #NAME?
A148: =CLOSURE("partialapp",2,7,3,NA(),NA()) -> #NAME? | B148: =apply(RC1,9,4) -> #NAME? | C148: =(RC[-1]=27394) -> #NAME?
A149: =CLOSURE("partialapp",2,7,3,9,NA()) -> #NAME? | B149: =apply(RC1,4) -> #NAME? | C149: =(RC[-1]=27394) -> #NAME?
A150: =CLOSURE("partialapp",2,7,3,9,4) -> #NAME? | B150: =apply(RC1) -> #NAME? | C150: =(RC[-1]=27394) -> #NAME? | F150: =AND(R[-6]C[-3],R[-5]C[-3],R[-4]C[-3],R[-3]C[-3],R[-2]C[-3],R[-1]C[-3],RC[-3]) -> #NAME? | G150: =DEFINE("testCLOSUREAPPLY",RC[-1]) -> #NAME?
A152: NESTED CALLS
A153: =SUB(2,SUB(5,11)) -> #NAME? | B153: 8 | C153: =(RC[-2]=RC[-1]) -> #NAME?
A154: =SUB(SUB(5,11),13) -> #NAME? | B154: -19 | C154: =(RC[-2]=RC[-1]) -> #NAME?
A155: =CLOSURE("sub",NA(),NA()) -> #NAME?
A156: =apply(R155C1,2,apply(R155C1,5,11)) -> #NAME? | B156: 8 | C156: =(RC[-2]=RC[-1]) -> #NAME?
A157: =apply(R155C1,apply(R155C1,5,11),13) -> #NAME? | B157: -19 | C157: =(RC[-2]=RC[-1]) -> #NAME? | F157: =AND(R[-4]C[-3],R[-3]C[-3],R[-1]C[-3],RC[-3]) -> #NAME? | G157: =DEFINE("testnestedcalls",RC[-1]) -> #NAME?
A159: TABULATE
A160: =tabulate(CLOSURE("rowcol",NA(),NA()),2,3) -> #NAME? | B160: =INDEX(R160C1,1,1) -> #NAME? | C160: 11 | D160: =(RC[-2]=RC[-1]) -> #NAME?
B161: =INDEX(R160C1,1,3) -> #REF! | C161: 13 | D161: =(RC[-2]=RC[-1]) -> #REF!
B162: =INDEX(R160C1,2,3) -> #REF! | C162: 23 | D162: =(RC[-2]=RC[-1]) -> #REF! | F162: =AND(R[-2]C[-2],R[-1]C[-2],RC[-2]) -> #NAME? | G162: =DEFINE("testtabulate",RC[-1]) -> #NAME?
A164: HARRAY, VARRAY
A165: =harray(11,12,13) -> #NAME? | B165: =harray(21,22,23) -> #NAME? | D165: =vcat(RC[-3],RC[-2]) -> #NAME?
A166: =varray(11,21) -> #NAME? | B166: =varray(12,22) -> #NAME? | C166: =varray(13,23) -> #NAME? | D166: =hcat(RC[-3],RC[-2],RC[-1]) -> #NAME?
A168: COLUMNS, ROWS
A169: =COLUMNS(R[-4]C) -> 1 | B169: =COLUMNS(R[-4]C) -> 1 | D169: =COLUMNS(R[-4]C) -> 1
A170: =COLUMNS(R[-4]C) -> 1 | B170: =COLUMNS(R[-4]C) -> 1 | C170: =COLUMNS(R[-4]C) -> 1 | D170: =COLUMNS(R[-4]C) -> 1
A171: =R[-2]C=3 -> 0 | B171: =R[-2]C=3 -> 0 | D171: =R[-2]C=3 -> 0
A172: =R[-2]C=1 -> 1 | B172: =R[-2]C=1 -> 1 | C172: =R[-2]C=1 -> 1 | D172: =R[-2]C=3 -> 0 | F172: =AND(R[-1]C[-5],R[-1]C[-4],R[-1]C[-2],RC[-5],RC[-4],RC[-3],RC[-2]) -> 0
A173: =ROWS(R[-8]C) -> 1 | B173: =ROWS(R[-8]C) -> 1 | D173: =ROWS(R[-8]C) -> 1
A174: =ROWS(R[-8]C) -> 1 | B174: =ROWS(R[-8]C) -> 1 | C174: =ROWS(R[-8]C) -> 1 | D174: =ROWS(R[-8]C) -> 1
A175: =R[-2]C=1 -> 1 | B175: =R[-2]C=1 -> 1 | D175: =R[-2]C=2 -> 0
A176: =R[-2]C=2 -> 0 | B176: =R[-2]C=2 -> 0 | C176: =R[-2]C=2 -> 0 | D176: =R[-2]C=2 -> 0 | F176: =AND(R[-1]C[-5],R[-1]C[-4],R[-1]C[-2],RC[-5],RC[-4],RC[-3],RC[-2]) -> 0 | G176: =DEFINE("TESTCOLUMNSROWS",R[1]C[-1]) -> #NAME?
F177: =AND(R[-5]C,R[-1]C) -> 0 | G177: =TESTCOLUMNSROWS() -> #NAME?
A179: SLICE
A180: =checkslice(Data!R3C3:R4C5) -> #NAME?
A181: =checkslice(R160C1) -> #NAME?
A182: =checkslice(R[-17]C[3]) -> #NAME?
A183: =checkslice(R[-17]C[3]) -> #NAME? | F183: =AND(R[-3]C[-5],R[-2]C[-5],R[-1]C[-5],RC[-5]) -> #NAME? | G183: =DEFINE("testslice",RC[-1]) -> #NAME?
A185: ROWMAP, COLMAP
A186: =rowmap(CLOSURE("rowmapcheck",NA(),NA(),NA()),Data!R3C3:R4C5) -> #NAME? | B186: =INDEX(RC1,1,1)=111213 -> #NAME? | C186: =INDEX(RC1,2,1)=212223 -> #REF!
A187: =colmap(CLOSURE("colmapcheck",NA(),NA()),Data!R3C3:R4C5) -> #NAME? | B187: =INDEX(RC1,1,1)=1121 -> #NAME? | C187: =INDEX(RC1,1,2)=1222 -> #REF! | D187: =INDEX(RC1,1,3)=1323 -> #REF! | F187: =AND(R[-1]C[-4],R[-1]C[-3],RC[-4],RC[-3],RC[-2]) -> #NAME? | G187: =DEFINE("testrowcolmap",RC[-1]) -> #NAME?
A189: EVALCONDS, no duplication or folding
A190: =AVERAGE(tabulate(CLOSURE("testevalcond1",NA(),NA()),10,100)) -> #NAME? | B190: =0.8*10+0.2*1 -> 8.1999999999999993 | C190: =ABS(RC[-2]-RC[-1])<0.7 -> #NAME?
A191: =AVERAGE(tabulate(CLOSURE("testevalcond2",NA(),NA()),10,100)) -> #NAME? | B191: =0.64*10+0.36*1 -> 6.7600000000000007 | C191: =ABS(RC[-2]-RC[-1])<0.7 -> #NAME? | F191: =AND(R[-1]C[-3],RC[-3]) -> #NAME? | G191: =DEFINE("testevalcond",RC[-1]) -> #NAME?
A193: #N/A pseudo error
A194: =NA() -> #N/A | F194: =ISERROR(testna()) -> 1 | G194: =DEFINE("testna",RC[-6]) -> #NAME?
G195: =testna() -> #NAME?
A197: VSCAN
A198: fib5 = | B198: =vscan(CLOSURE("nextfibrow",NA()),hcat(1,1),5) -> #NAME? | E198: =(2=COLUMNS(R198C2)) -> 0
E199: =(6=ROWS(R198C2)) -> 0 | G199: =DEFINE("testvscan",R[1]C[-1]) -> #NAME?
E200: =(3=INDEX(R198C2,3,2)) -> #REF! | F200: =AND(R[-2]C[-1],R[-1]C[-1],RC[-1]) -> #REF! | G200: =testvscan() -> #NAME?
A202: HSCAN
A203: fib5 = | B203: =hscan(CLOSURE("nextfibcol",NA()),vcat(1,1),5) -> #NAME? | E203: =(6=COLUMNS(R203C2)) -> 0
E204: =(2=ROWS(R203C2)) -> 0 | G204: =DEFINE("testhscan",R[1]C[-1]) -> #NAME?
E205: =(3=INDEX(R203C2,2,3)) -> #REF! | F205: =AND(R[-2]C[-1],R[-1]C[-1],RC[-1]) -> #REF! | G205: =testhscan() -> #NAME?
A207: REDUCE | G207: =DEFINE("testreduce",R[1]C[-1]) -> #NAME?
A208: =reduce(CLOSURE("rowcol",NA(),NA()), 7, hcat(2,3,4)) -> #NAME? | B208: 7234 | F208: =RC[-5]=RC[-4] -> #NAME? | G208: =testreduce() -> #NAME?
A210: CLOSURE, stepwise application
A211: =CLOSURE("sub",2,NA()) -> #NAME? | B211: =CLOSURE(RC[-1],5) -> #NAME? | C211: =apply(RC[-1]) -> #NAME? | D211: =SUB(2,5) -> #NAME? | E211: =(RC[-2]=RC[-1]) -> #NAME? | G211: =DEFINE("testclosure",R[1]C[-1]) -> #NAME?
A212: =CLOSURE("sub",NA(),5) -> #NAME? | B212: =CLOSURE(RC[-1],2) -> #NAME? | C212: =apply(RC[-1]) -> #NAME? | D212: =SUB(2,5) -> #NAME? | E212: =(RC[-2]=RC[-1]) -> #NAME? | F212: =AND(R[-1]C[-1],RC[-1]) -> #NAME? | G212: =testclosure() -> #NAME?
A214: CLOSURE AND SPECIALIZE | D214: =SUB(2,5) -> #NAME?
A215: =CLOSURE("sub",2,NA()) -> #NAME? | C215: =apply(RC[-2],5) -> #NAME? | D215: =(RC[-1]=R211C4) -> #NAME?
A216: =CLOSURE("sub",NA(),5) -> #NAME? | C216: =apply(RC[-2],2) -> #NAME? | D216: =(RC[-1]=R211C4) -> #NAME?
A217: =SPECIALIZE(R[-2]C) -> #NAME? | C217: =apply(RC[-2],5) -> #NAME? | D217: =(RC[-1]=R211C4) -> #NAME?
A218: =SPECIALIZE(R[-2]C) -> #NAME? | C218: =apply(RC[-2],2) -> #NAME? | D218: =(RC[-1]=R211C4) -> #NAME?
A219: =CLOSURE("sub") -> #NAME? | C219: =apply(RC[-2],2,5) -> #NAME? | D219: =(RC[-1]=R211C4) -> #NAME? | F219: =AND(R[-4]C[-2],R[-3]C[-2],R[-2]C[-2],R[-1]C[-2],RC[-2]) -> #NAME?
A220: =CLOSURE("sub",2,NA()) -> #NAME? | B220: =CLOSURE(RC[-1],5) -> #NAME? | C220: =apply(RC[-1]) -> #NAME? | D220: =(RC[-1]=R211C4) -> #NAME?
B221: =SPECIALIZE(R[-1]C) -> #NAME? | C221: =apply(RC[-1]) -> #NAME? | D221: =(RC[-1]=R211C4) -> #NAME?
A222: =CLOSURE("sub",NA(),5) -> #NAME? | B222: =CLOSURE(RC[-1],2) -> #NAME? | C222: =apply(RC[-1]) -> #NAME? | D222: =(RC[-1]=R211C4) -> #NAME?
B223: =SPECIALIZE(R[-2]C) -> #NAME? | C223: =apply(RC[-1]) -> #NAME? | D223: =(RC[-1]=R211C4) -> #NAME?
A224: =SPECIALIZE(R[-4]C) -> #NAME? | B224: =CLOSURE(RC[-1],5) -> #NAME? | C224: =apply(RC[-1]) -> #NAME? | D224: =(RC[-1]=R211C4) -> #NAME?
B225: =SPECIALIZE(R[-1]C) -> #NAME? | C225: =apply(RC[-1]) -> #NAME? | D225: =(RC[-1]=R211C4) -> #NAME?
A226: =SPECIALIZE(R[-4]C) -> #NAME? | B226: =CLOSURE(RC[-1],2) -> #NAME? | C226: =apply(RC[-1]) -> #NAME? | D226: =(RC[-1]=R211C4) -> #NAME?
B227: =SPECIALIZE(R[-1]C) -> #NAME? | C227: =apply(RC[-1]) -> #NAME? | D227: =(RC[-1]=R211C4) -> #NAME? | F227: =AND(R[-7]C[-2],R[-6]C[-2],R[-5]C[-2],R[-4]C[-2],R[-3]C[-2],R[-2]C[-2],R[-1]C[-2],RC[-2]) -> #NAME? | G227: =DEFINE("testclosurespecialize",R[1]C[-1]) -> #NAME?
F228: =AND(R[-9]C,R[-1]C) -> #NAME? | G228: =testclosurespecialize() -> #NAME?
A230: EQUAL
A231: 34 | B231: 34 | C231: =equal(RC[-2],RC[-1]) -> #NAME?
A232: abc | B232: =RC[-1] & "" -> abc | C232: =equal(RC[-2],RC[-1]) -> #NAME?
A233: abcdef | B233: =R[-1]C[-1]&"def" -> abcdef | C233: =equal(RC[-2],RC[-1]) -> #NAME?
A234: =CLOSURE("sub") -> #NAME? | B234: =CLOSURE("sub") -> #NAME? | C234: =equal(RC[-2],RC[-1]) -> #NAME? | G234: =DEFINE("testequal",R[1]C[-1]) -> #NAME?
A235: 17 | B235: 34 | C235: =NOT(equal(RC[-2],RC[-1])) -> #NAME? | F235: =AND(R[-4]C[-3],R[-3]C[-3],R[-2]C[-3],R[-1]C[-3],RC[-3]) -> #NAME? | G235: =testequal() -> #NAME?

Sheet: @NormalDist
A1: Some function sheet examples | C1: sestoft@itu.dk 2007-09-25
A3: The distribution function of the Gaussian distribution N(0,1)
A4: Algorithm 66 in Statlib, based on alg. 5666 from JF Hart: Computer approximations, 1968
A5: =DEFINE("normdistcdf", R[2]C[1],R[1]C[1]) -> #NAME?
A6: z = | B6: -5
A7: p = | B7: =IF(R[-1]C<0, R[4]C, 1-R[4]C) -> 2.8665157189233351E-7
A8: zabs = | B8: =ABS(R[-2]C) -> 5
A9: expntl = | B9: =EXP(-1*R[-1]C*R[-1]C/2) -> 3.7266531720786709E-6
A10: pdf = | B10: =R[-1]C/SQRT(2*PI()) -> 1.4867195147342979E-6
A11: p' = | B11: =IF(R[-3]C>37,0,IF(R[-3]C<7.071,R[-2]C*R[3]C/R[3]C[2],R[-1]C/(R[-3]C+1/(R[-3]C+2/(R[-3]C+3/(R[-3]C+4/(R[-3]C+0.65))))))) -> 2.8665157189233351E-7
A13: pi | C13: qi
A14: 220.206867912376 | B14: =RC[-1]+R8C2*R[1]C -> 15090.765358973758 | C14: 440.413735824752 | D14: =RC[-1]+R8C2*R[1]C -> 196189.56987697078
A15: 221.21359616993101 | B15: =RC[-1]+R8C2*R[1]C -> 2974.1116982122762 | C15: 793.82651251994798 | D15: =RC[-1]+R8C2*R[1]C -> 39149.831228229203
A16: 112.07929149787 | B16: =RC[-1]+R8C2*R[1]C -> 550.57962040846905 | C16: 637.33363337883088 | D16: =RC[-1]+R8C2*R[1]C -> 7671.200943141851
A17: 33.91286607838299 | B17: =RC[-1]+R8C2*R[1]C -> 87.700065782119808 | C17: 296.56424877967299 | D17: =RC[-1]+R8C2*R[1]C -> 1406.7734619526041
A18: 6.3739622035316499 | B18: =RC[-1]+R8C2*R[1]C -> 10.757439940747364 | C18: 86.780732202945984 | D18: =RC[-1]+R8C2*R[1]C -> 222.04184263458623
A19: 0.70038306444368803 | B19: =RC[-1]+R8C2*R[1]C -> 0.87669554744314304 | C19: 16.064177579206891 | D19: =RC[-1]+R8C2*R[1]C -> 27.052222086328051
A20: 3.5262496599891002E-2 | B20: =RC[-1] -> 3.5262496599891002E-2 | C20: 1.7556671631826399 | D20: =RC[-1]+R8C2*R[1]C -> 2.1976089014242319
C21: 8.8388347648318405E-2 | D21: =RC[-1] -> 8.8388347648318405E-2
A23: The inverse distribution function of the Gaussian distribution N(0,1)
A24: Algorithm AS241 from Applied Statistics 37, 3, 1988
A25: This agrees well with the R qnorm() function and hence seems more precise than Excel's built-in function
A26: =DEFINE("invnormdistcdf",R[2]C[1],R[1]C[1]) -> #NAME?
A27: p = | B27: 0.49
A28: z = | B28: =IF(ABS(R29C2)<=0.425, R29C2*R40C2/R40C4, R31C2) -> -2.5068908258711046E-2
A29: q = | B29: =R[-2]C-0.5 -> -1.0000000000000009E-2
A30: r = | B30: =0.180625-R[-1]C*R[-1]C -> 0.18052500000000002
A31: z' = | B31: =IF(R43C2<=5,R53C2/R53C4, R62C2/R62C4)*IF(R[-2]C<0, -1, 1) -> -2.5068929265374327E-2
A33: 2509.0809287301199 | B33: =RC[-1]*R30C2 -> 452.95183465900493 | C33: 5226.4952788528499 | D33: =RC[-1]*R30C2 -> 943.51306021491087
A34: 33430.575583588092 | B34: =(R[-1]C+RC[-1])*R30C2 -> 6116.8237871790579 | C34: 28729.085735721899 | D34: =(R[-1]C+RC[-1])*R30C2 -> 5356.6458976364929
A35: 67265.770927008707 | B35: =(R[-1]C+RC[-1])*R30C2 -> 13247.392910778748 | C35: 39307.895800092701 | D35: =(R[-1]C+RC[-1])*R30C2 -> 8063.066389982564
A36: 45921.953931549797 | B36: =(R[-1]C+RC[-1])*R30C2 -> 10681.546338711361 | C36: 21213.794301586498 | D36: =(R[-1]C+RC[-1])*R30C2 -> 5285.2052763455058
A37: 13731.693765509401 | B37: =(R[-1]C+RC[-1])*R30C2 -> 4407.2001698144541 | C37: 5394.1960214247501 | D37: =(R[-1]C+RC[-1])*R30C2 -> 1927.8989192799754
A38: 1971.59095030655 | B38: =(R[-1]C+RC[-1])*R30C2 -> 1151.5312669598445 | C38: 687.18700749205698 | D38: =(R[-1]C+RC[-1])*R30C2 -> 472.08838693052121
A39: 133.14166789178401 | B39: =(R[-1]C+RC[-1])*R30C2 -> 231.91558156409025 | C39: 42.313330701600897 | D39: =(R[-1]C+RC[-1])*R30C2 -> 92.862370075538848
A40: 3.3871328727963599 | B40: =R[-1]C+RC[-1] -> 235.30271443688662 | C40: 1 | D40: =R[-1]C+RC[-1] -> 93.862370075538848
A42: r' = | B42: =IF(R[-13]C<0, R[-15]C, 1-R[-15]C) -> 0.49
A43: r'' = | B43: =SQRT(-1*LN(R[-1]C)) -> 0.84460043090059145
A44: r''' = | B44: =IF(R43C2<=5, R43C2-1.6, R43C2-5) -> -0.75539956909940864
A46: 7.7454501427834095E-4 | B46: =RC[-1]*R44C2 -> -5.8509097003395412E-4 | C46: 1.0507500716444101E-9 | D46: =RC[-1]*R44C2 -> -7.9373615135136011E-10
A47: 2.2723844989269101E-2 | B47: =(R[-1]C+RC[-1])*R44C2 -> -1.672360524652803E-2 | C47: 5.47593808499534E-4 | D47: =(R[-1]C+RC[-1])*R44C2 -> -4.136515273941054E-4
A48: 0.24178072517745 | B48: =(R[-1]C+RC[-1])*R44C2 -> -0.17000805141857239 | C48: 1.51986665636164E-2 | D48: =(R[-1]C+RC[-1])*R44C2 -> -1.1168593987490599E-2
A49: 1.27045825245236 | B49: =(R[-1]C+RC[-1])*R44C2 -> -0.83127960767628073 | C49: 0.14810397642747999 | D49: =(R[-1]C+RC[-1])*R44C2 -> -0.10344092888963072
A50: 3.6478483247631992 | B50: =(R[-1]C+RC[-1])*R44C2 -> -2.1276347952263324 | C50: 0.68976733498510001 | D50: =(R[-1]C+RC[-1])*R44C2 -> -0.44291071451612235
A51: 5.7694972214606901 | B51: =(R[-1]C+RC[-1])*R44C2 -> -2.7510613074967609 | C51: 1.6763848301838 | D51: =(R[-1]C+RC[-1])*R44C2 -> -0.93176581547063786
A52: 4.6303378461565377 | B52: =(R[-1]C+RC[-1])*R44C2 -> -1.4196046875222235 | C52: 2.0531916266377501 | D52: =(R[-1]C+RC[-1])*R44C2 -> -0.84712457453259138
A53: 1.4234371107496799 | B53: =R[-1]C+RC[-1] -> 3.8324232274564718E-3 | C53: 1 | D53: =R[-1]C+RC[-1] -> 0.15287542546740862
A55: 2.0103343992922799E-7 | B55: =RC[-1]*R44C2 -> -1.5186057389711067E-7 | C55: 2.0442631033899298E-15 | D55: =RC[-1]*R44C2 -> -1.5442354674265729E-15
A56: 2.7115555687434801E-5 | B56: =(R[-1]C+RC[-1])*R44C2 -> -2.03683636700942E-5 | C56: 1.4215117583164401E-7 | D56: =(R[-1]C+RC[-1])*R44C2 -> -1.0738093580368334E-7
A57: 1.2426609473880699E-3 | B57: =(R[-1]C+RC[-1])*R44C2 -> -9.2331929105396167E-4 | C57: 1.8463183175100501E-5 | D57: =(R[-1]C+RC[-1])*R44C2 -> -1.3865965102038776E-5
A58: 2.65321895265761E-2 | B58: =(R[-1]C+RC[-1])*R44C2 -> -1.9344929541036095E-2 | C58: 7.8686913114561297E-4 | D58: =(R[-1]C+RC[-1])*R44C2 -> -5.8392625854179455E-4
A59: 0.29656057182850398 | B59: =(R[-1]C+RC[-1])*R44C2 -> -0.20940857673156904 | C59: 1.4875361290850601E-2 | D59: =(R[-1]C+RC[-1])*R44C2 -> -1.0795743865218265E-2
A60: 1.78482653991729 | B60: =(R[-1]C+RC[-1])*R44C2 -> -1.1900700505419617 | C60: 0.136929880922735 | D60: =(R[-1]C+RC[-1])*R44C2 -> -9.52816727819739E-2
A61: 5.4637849111641099 | B61: =(R[-1]C+RC[-1])*R44C2 -> -3.2283623641677095 | C61: 0.59983220655588698 | D61: =(R[-1]C+RC[-1])*R44C2 -> -0.38113725580169061
A62: 6.657904643501098 | B62: =R[-1]C+RC[-1] -> 3.4295422793333885 | C62: 1 | D62: =R[-1]C+RC[-1] -> 0.61886274419830944

Sheet: @Goalseek
A1: A non-iterative GOALSEEK(f, target, a) | F1: 2008-11-16
A3: FINDEND(f,target,a) = an argument value that gives the opposite sign
A4: =DEFINE("findend",R[1]C[8],R[1]C[1],R[1]C[3],R[1]C[5]) -> #NAME?
A5: f = | C5: target = | D5: 0 | E5: a = | F5: 1 | I5: =R[3]C+0 -> #NAME?
A7: a | B7: delta | C7: a-delta | D7: a+delta | E7: f(a-delta) | F7: f(a+delta) | G7: OK(a-delta) | H7: OK(a+delta)
A8: =R5C6 -> 1 | B8: 1E-4 | C8: =R8C1-RC2 -> 0.99990000000000001 | D8: =R8C1+RC2 -> 1.0001 | E8: =apply(R5C2,RC[-2])-R5C4 -> #NAME? | F8: =apply(R5C2,RC[-2])-R5C4 -> #NAME? | G8: =R9C1*RC[-2]<=0 -> #NAME? | H8: =R9C1*RC[-2]<=0 -> #NAME? | I8: =IF(RC7,RC3,IF(RC8,RC4,R[1]C)) -> #NAME?
A9: =apply(R5C2,R5C6)-R5C4 -> #NAME? | B9: =R[-1]C*10 -> 1E-3 | C9: =R8C1-RC2 -> 0.999 | D9: =R8C1+RC2 -> 1.0009999999999999 | E9: =apply(R5C2,RC[-2])-R5C4 -> #NAME? | F9: =apply(R5C2,RC[-2])-R5C4 -> #NAME? | G9: =R9C1*RC[-2]<=0 -> #NAME? | H9: =R9C1*RC[-2]<=0 -> #NAME? | I9: =IF(RC7,RC3,IF(RC8,RC4,R[1]C)) -> #NAME?
B10: =R[-1]C*10 -> 0.01 | C10: =R8C1-RC2 -> 0.99 | D10: =R8C1+RC2 -> 1.01 | E10: =apply(R5C2,RC[-2])-R5C4 -> #NAME? | F10: =apply(R5C2,RC[-2])-R5C4 -> #NAME? | G10: =R9C1*RC[-2]<=0 -> #NAME? | H10: =R9C1*RC[-2]<=0 -> #NAME? | I10: =IF(RC7,RC3,IF(RC8,RC4,R[1]C)) -> #NAME?
B11: =R[-1]C*10 -> 0.1 | C11: =R8C1-RC2 -> 0.9 | D11: =R8C1+RC2 -> 1.1000000000000001 | E11: =apply(R5C2,RC[-2])-R5C4 -> #NAME? | F11: =apply(R5C2,RC[-2])-R5C4 -> #NAME? | G11: =R9C1*RC[-2]<=0 -> #NAME? | H11: =R9C1*RC[-2]<=0 -> #NAME? | I11: =IF(RC7,RC3,IF(RC8,RC4,R[1]C)) -> #NAME?
B12: =R[-1]C*10 -> 1 | C12: =R8C1-RC2 -> 0 | D12: =R8C1+RC2 -> 2 | E12: =apply(R5C2,RC[-2])-R5C4 -> #NAME? | F12: =apply(R5C2,RC[-2])-R5C4 -> #NAME? | G12: =R9C1*RC[-2]<=0 -> #NAME? | H12: =R9C1*RC[-2]<=0 -> #NAME? | I12: =IF(RC7,RC3,IF(RC8,RC4,R[1]C)) -> #NAME?
B13: =R[-1]C*10 -> 10 | C13: =R8C1-RC2 -> -9 | D13: =R8C1+RC2 -> 11 | E13: =apply(R5C2,RC[-2])-R5C4 -> #NAME? | F13: =apply(R5C2,RC[-2])-R5C4 -> #NAME? | G13: =R9C1*RC[-2]<=0 -> #NAME? | H13: =R9C1*RC[-2]<=0 -> #NAME? | I13: =IF(RC7,RC3,IF(RC8,RC4,R[1]C)) -> #NAME?
B14: =R[-1]C*10 -> 100 | C14: =R8C1-RC2 -> -99 | D14: =R8C1+RC2 -> 101 | E14: =apply(R5C2,RC[-2])-R5C4 -> #NAME? | F14: =apply(R5C2,RC[-2])-R5C4 -> #NAME? | G14: =R9C1*RC[-2]<=0 -> #NAME? | H14: =R9C1*RC[-2]<=0 -> #NAME? | I14: =IF(RC7,RC3,IF(RC8,RC4,R[1]C)) -> #NAME?
B15: =R[-1]C*10 -> 1000 | C15: =R8C1-RC2 -> -999 | D15: =R8C1+RC2 -> 1001 | E15: =apply(R5C2,RC[-2])-R5C4 -> #NAME? | F15: =apply(R5C2,RC[-2])-R5C4 -> #NAME? | G15: =R9C1*RC[-2]<=0 -> #NAME? | H15: =R9C1*RC[-2]<=0 -> #NAME? | I15: =IF(RC7,RC3,IF(RC8,RC4,R[1]C)) -> #NAME?
B16: =R[-1]C*10 -> 10000 | C16: =R8C1-RC2 -> -9999 | D16: =R8C1+RC2 -> 10001 | E16: =apply(R5C2,RC[-2])-R5C4 -> #NAME? | F16: =apply(R5C2,RC[-2])-R5C4 -> #NAME? | G16: =R9C1*RC[-2]<=0 -> #NAME? | H16: =R9C1*RC[-2]<=0 -> #NAME? | I16: =IF(RC7,RC3,IF(RC8,RC4,R[1]C)) -> #NAME?
B17: =R[-1]C*10 -> 100000 | C17: =R8C1-RC2 -> -99999 | D17: =R8C1+RC2 -> 100001 | E17: =apply(R5C2,RC[-2])-R5C4 -> #NAME? | F17: =apply(R5C2,RC[-2])-R5C4 -> #NAME? | G17: =R9C1*RC[-2]<=0 -> #NAME? | H17: =R9C1*RC[-2]<=0 -> #NAME? | I17: =IF(RC7,RC3,IF(RC8,RC4,err("No zero crossing found"))) -> #NAME?
A19: GOALSEEK(f, target, a) = x s.t. f(x)=target
A20: =DEFINE("goalseek",R[37]C[3],R[1]C[1],R[1]C[3],R[1]C[5]) -> #NAME?
A21: f = | C21: target = | D21: 0 | E21: a = | F21: 1
B23: a0 | C23: b0 | D23: f(a0)-target | E23: f(b0)-target
B24: =R21C6 -> 1 | C24: =findend(R21C2,R21C4,RC[-1]) -> #NAME? | D24: =apply(R21C2,RC[-2])-R21C4 -> #NAME? | E24: =apply(R21C2,RC[-2])-R21C4 -> #NAME?
B26: Invariant: f(ai)<=target<=f(bi)
B27: ai | C27: bi | D27: xi=(ai+bi)/2 | E27: f(xi)-target
B28: =IF(R24C4<=0,R[-4]C,R[-4]C[1]) -> #NAME? | C28: =IF(R24C4<=0,R[-4]C,R[-4]C[-1]) -> #NAME? | D28: =(RC[-2]+RC[-1])/2 -> #NAME? | E28: =apply(R21C2,RC[-1])-R21C4 -> #NAME?
B29: =IF(R[-1]C5<=0,R[-1]C4,R[-1]C) -> #NAME? | C29: =IF(R[-1]C5>=0,R[-1]C4,R[-1]C) -> #NAME? | D29: =(RC[-2]+RC[-1])/2 -> #NAME? | E29: =apply(R21C2,RC[-1])-R21C4 -> #NAME?
B30: =IF(R[-1]C5<=0,R[-1]C4,R[-1]C) -> #NAME? | C30: =IF(R[-1]C5>=0,R[-1]C4,R[-1]C) -> #NAME? | D30: =(RC[-2]+RC[-1])/2 -> #NAME? | E30: =apply(R21C2,RC[-1])-R21C4 -> #NAME?
B31: =IF(R[-1]C5<=0,R[-1]C4,R[-1]C) -> #NAME? | C31: =IF(R[-1]C5>=0,R[-1]C4,R[-1]C) -> #NAME? | D31: =(RC[-2]+RC[-1])/2 -> #NAME? | E31: =apply(R21C2,RC[-1])-R21C4 -> #NAME?
B32: =IF(R[-1]C5<=0,R[-1]C4,R[-1]C) -> #NAME? | C32: =IF(R[-1]C5>=0,R[-1]C4,R[-1]C) -> #NAME? | D32: =(RC[-2]+RC[-1])/2 -> #NAME? | E32: =apply(R21C2,RC[-1])-R21C4 -> #NAME?
B33: =IF(R[-1]C5<=0,R[-1]C4,R[-1]C) -> #NAME? | C33: =IF(R[-1]C5>=0,R[-1]C4,R[-1]C) -> #NAME? | D33: =(RC[-2]+RC[-1])/2 -> #NAME? | E33: =apply(R21C2,RC[-1])-R21C4 -> #NAME?
B34: =IF(R[-1]C5<=0,R[-1]C4,R[-1]C) -> #NAME? | C34: =IF(R[-1]C5>=0,R[-1]C4,R[-1]C) -> #NAME? | D34: =(RC[-2]+RC[-1])/2 -> #NAME? | E34: =apply(R21C2,RC[-1])-R21C4 -> #NAME?
B35: =IF(R[-1]C5<=0,R[-1]C4,R[-1]C) -> #NAME? | C35: =IF(R[-1]C5>=0,R[-1]C4,R[-1]C) -> #NAME? | D35: =(RC[-2]+RC[-1])/2 -> #NAME? | E35: =apply(R21C2,RC[-1])-R21C4 -> #NAME?
B36: =IF(R[-1]C5<=0,R[-1]C4,R[-1]C) -> #NAME? | C36: =IF(R[-1]C5>=0,R[-1]C4,R[-1]C) -> #NAME? | D36: =(RC[-2]+RC[-1])/2 -> #NAME? | E36: =apply(R21C2,RC[-1])-R21C4 -> #NAME?
B37: =IF(R[-1]C5<=0,R[-1]C4,R[-1]C) -> #NAME? | C37: =IF(R[-1]C5>=0,R[-1]C4,R[-1]C) -> #NAME? | D37: =(RC[-2]+RC[-1])/2 -> #NAME? | E37: =apply(R21C2,RC[-1])-R21C4 -> #NAME?
B38: =IF(R[-1]C5<=0,R[-1]C4,R[-1]C) -> #NAME? | C38: =IF(R[-1]C5>=0,R[-1]C4,R[-1]C) -> #NAME? | D38: =(RC[-2]+RC[-1])/2 -> #NAME? | E38: =apply(R21C2,RC[-1])-R21C4 -> #NAME?
B39: =IF(R[-1]C5<=0,R[-1]C4,R[-1]C) -> #NAME? | C39: =IF(R[-1]C5>=0,R[-1]C4,R[-1]C) -> #NAME? | D39: =(RC[-2]+RC[-1])/2 -> #NAME? | E39: =apply(R21C2,RC[-1])-R21C4 -> #NAME?
B40: =IF(R[-1]C5<=0,R[-1]C4,R[-1]C) -> #NAME? | C40: =IF(R[-1]C5>=0,R[-1]C4,R[-1]C) -> #NAME? | D40: =(RC[-2]+RC[-1])/2 -> #NAME? | E40: =apply(R21C2,RC[-1])-R21C4 -> #NAME?
B41: =IF(R[-1]C5<=0,R[-1]C4,R[-1]C) -> #NAME? | C41: =IF(R[-1]C5>=0,R[-1]C4,R[-1]C) -> #NAME? | D41: =(RC[-2]+RC[-1])/2 -> #NAME? | E41: =apply(R21C2,RC[-1])-R21C4 -> #NAME?
B42: =IF(R[-1]C5<=0,R[-1]C4,R[-1]C) -> #NAME? | C42: =IF(R[-1]C5>=0,R[-1]C4,R[-1]C) -> #NAME? | D42: =(RC[-2]+RC[-1])/2 -> #NAME? | E42: =apply(R21C2,RC[-1])-R21C4 -> #NAME?
B43: =IF(R[-1]C5<=0,R[-1]C4,R[-1]C) -> #NAME? | C43: =IF(R[-1]C5>=0,R[-1]C4,R[-1]C) -> #NAME? | D43: =(RC[-2]+RC[-1])/2 -> #NAME? | E43: =apply(R21C2,RC[-1])-R21C4 -> #NAME?
B44: =IF(R[-1]C5<=0,R[-1]C4,R[-1]C) -> #NAME? | C44: =IF(R[-1]C5>=0,R[-1]C4,R[-1]C) -> #NAME? | D44: =(RC[-2]+RC[-1])/2 -> #NAME? | E44: =apply(R21C2,RC[-1])-R21C4 -> #NAME?
B45: =IF(R[-1]C5<=0,R[-1]C4,R[-1]C) -> #NAME? | C45: =IF(R[-1]C5>=0,R[-1]C4,R[-1]C) -> #NAME? | D45: =(RC[-2]+RC[-1])/2 -> #NAME? | E45: =apply(R21C2,RC[-1])-R21C4 -> #NAME?
B46: =IF(R[-1]C5<=0,R[-1]C4,R[-1]C) -> #NAME? | C46: =IF(R[-1]C5>=0,R[-1]C4,R[-1]C) -> #NAME? | D46: =(RC[-2]+RC[-1])/2 -> #NAME? | E46: =apply(R21C2,RC[-1])-R21C4 -> #NAME?
B47: =IF(R[-1]C5<=0,R[-1]C4,R[-1]C) -> #NAME? | C47: =IF(R[-1]C5>=0,R[-1]C4,R[-1]C) -> #NAME? | D47: =(RC[-2]+RC[-1])/2 -> #NAME? | E47: =apply(R21C2,RC[-1])-R21C4 -> #NAME?
B48: =IF(R[-1]C5<=0,R[-1]C4,R[-1]C) -> #NAME? | C48: =IF(R[-1]C5>=0,R[-1]C4,R[-1]C) -> #NAME? | D48: =(RC[-2]+RC[-1])/2 -> #NAME? | E48: =apply(R21C2,RC[-1])-R21C4 -> #NAME?
B49: =IF(R[-1]C5<=0,R[-1]C4,R[-1]C) -> #NAME? | C49: =IF(R[-1]C5>=0,R[-1]C4,R[-1]C) -> #NAME? | D49: =(RC[-2]+RC[-1])/2 -> #NAME? | E49: =apply(R21C2,RC[-1])-R21C4 -> #NAME?
B50: =IF(R[-1]C5<=0,R[-1]C4,R[-1]C) -> #NAME? | C50: =IF(R[-1]C5>=0,R[-1]C4,R[-1]C) -> #NAME? | D50: =(RC[-2]+RC[-1])/2 -> #NAME? | E50: =apply(R21C2,RC[-1])-R21C4 -> #NAME?
B51: =IF(R[-1]C5<=0,R[-1]C4,R[-1]C) -> #NAME? | C51: =IF(R[-1]C5>=0,R[-1]C4,R[-1]C) -> #NAME? | D51: =(RC[-2]+RC[-1])/2 -> #NAME? | E51: =apply(R21C2,RC[-1])-R21C4 -> #NAME?
B52: =IF(R[-1]C5<=0,R[-1]C4,R[-1]C) -> #NAME? | C52: =IF(R[-1]C5>=0,R[-1]C4,R[-1]C) -> #NAME? | D52: =(RC[-2]+RC[-1])/2 -> #NAME? | E52: =apply(R21C2,RC[-1])-R21C4 -> #NAME?
B53: =IF(R[-1]C5<=0,R[-1]C4,R[-1]C) -> #NAME? | C53: =IF(R[-1]C5>=0,R[-1]C4,R[-1]C) -> #NAME? | D53: =(RC[-2]+RC[-1])/2 -> #NAME? | E53: =apply(R21C2,RC[-1])-R21C4 -> #NAME?
B54: =IF(R[-1]C5<=0,R[-1]C4,R[-1]C) -> #NAME? | C54: =IF(R[-1]C5>=0,R[-1]C4,R[-1]C) -> #NAME? | D54: =(RC[-2]+RC[-1])/2 -> #NAME? | E54: =apply(R21C2,RC[-1])-R21C4 -> #NAME?
B55: =IF(R[-1]C5<=0,R[-1]C4,R[-1]C) -> #NAME? | C55: =IF(R[-1]C5>=0,R[-1]C4,R[-1]C) -> #NAME? | D55: =(RC[-2]+RC[-1])/2 -> #NAME? | E55: =apply(R21C2,RC[-1])-R21C4 -> #NAME?
B56: =IF(R[-1]C5<=0,R[-1]C4,R[-1]C) -> #NAME? | C56: =IF(R[-1]C5>=0,R[-1]C4,R[-1]C) -> #NAME? | D56: =(RC[-2]+RC[-1])/2 -> #NAME? | E56: =apply(R21C2,RC[-1])-R21C4 -> #NAME?
B57: =IF(R[-1]C5<=0,R[-1]C4,R[-1]C) -> #NAME? | C57: =IF(R[-1]C5>=0,R[-1]C4,R[-1]C) -> #NAME? | D57: =(RC[-2]+RC[-1])/2 -> #NAME? | E57: =apply(R21C2,RC[-1])-R21C4 -> #NAME?
A59: =DEFINE("xcosx",R[1]C[1],R[1]C) -> #NAME?
A60: 0 | B60: =RC[-1]-COS(RC[-1]) -> -1
A62: Auxiliary recursive FINDENDRAUX(f,a,far,delta,r)
A63: =DEFINE("findendraux",R[6]C[3],R[1]C[1],R[2]C[1],R[3]C[1],R[4]C[1],R[5]C[1]) -> #NAME?
A64: f =
A65: a = | B65: 4
A66: far =
A67: delta = | B67: 10
A68: r =
A69: a+delta | B69: =R65C2+R67C2 -> 14 | C69: =apply(R64C2,RC[-1])-R68C2 -> #NAME? | D69: =IF(R66C2*RC[-1]<=0,RC[-2],R[1]C) -> #NAME?
A70: a-delta | B70: =R65C2-R67C2 -> -6 | C70: =apply(R64C2,RC[-1])-R68C2 -> #NAME? | D70: =IF(R66C2*RC[-1]<=0,RC[-2],R[1]C) -> #NAME?
A71: a+1/delta | B71: =R65C2+1/R67C2 -> 4.0999999999999996 | C71: =apply(R64C2,RC[-1])-R68C2 -> #NAME? | D71: =IF(R66C2*RC[-1]<=0,RC[-2],R[1]C) -> #NAME?
A72: a-1/delta | B72: =R65C2-1/R67C2 -> 3.9 | C72: =apply(R64C2,RC[-1])-R68C2 -> #NAME? | D72: =IF(R66C2*RC[-1]<=0,RC[-2],R[1]C) -> #NAME?
D73: =IF(R[-6]C[-2]>1000000,err("No root found"),findendraux(R[-9]C[-2],R[-8]C[-2],R[-7]C[-2],R[-6]C[-2]*2,R[-5]C[-2])) -> #NAME?
A75: Recursive FINDENDR(f,target,a)
A76: =DEFINE("findendr",R[4]C[1],R[1]C[1],R[2]C[1],R[3]C[1]) -> #NAME?
A77: f =
A78: target =
A79: a =
A80: result = | B80: =findendraux(R[-3]C,R[-1]C,apply(R[-3]C,R[-1]C)-R[-2]C,2,R[-2]C) -> #NAME?
A82: Auxiliary recursive GOALSEEKRAUX(f,a,b,far,fbr,r)
A83: =DEFINE("goalseekraux",R[9]C[1],R[1]C[1],R[2]C[1],R[3]C[1],R[4]C[1],R[5]C[1],R[6]C[1]) -> #NAME?
A84: f =
A85: a =
A86: b =
A87: far =
A88: fbr =
A89: r/target =
A90: m = | B90: =(R[-5]C+R[-4]C)/2 -> 0
A91: fmr = | B91: =apply(R[-7]C,R[-1]C)-R[-2]C -> #NAME?
A92: result = | B92: =IF(ABS(R[-5]C)<0.0000001,R[-7]C,IF(R[-5]C*R[-1]C<=0, GOALSEEKRAUX(R[-8]C,R[-7]C,R[-2]C,R[-5]C,R[-1]C,R[-3]C), GOALSEEKRAUX(R[-8]C,R[-2]C,R[-6]C,R[-1]C,R[-4]C,R[-3]C))) -> 0
A94: Recursive GOALSEEKR(f,target,a)
A95: =DEFINE("goalseekr",R[7]C[1],R[1]C[1],R[2]C[1],R[3]C[1]) -> #NAME?
A96: f =
A97: target =
A98: a =
A99: b = | B99: =findendr(R[-3]C,R[-2]C,R[-1]C) -> #NAME?
A100: far = | B100: =apply(R[-4]C,R[-2]C)-R[-3]C -> #NAME?
A101: fbr = | B101: =apply(R[-5]C,R[-2]C)-R[-4]C -> #NAME?
A102: result = | B102: =GOALSEEKRAUX(R[-6]C,R[-4]C,R[-3]C,R[-2]C,R[-1]C,R[-5]C) -> #NAME?

Sheet: @BulletLoan
A1: BULLETPV(coupon, terms, eff.int) | E1: 2009-02-01
A2: Present value of n-year bullet loan (stående lån)
A3: =DEFINE("bulletPV",R[4]C[3],R4C2,R5C2,R6C2) -> #NAME?
A4: coupon = | B4: 4
A5: n = | B5: 10
A6: eff.int r = | B6: 6
A7: (1+r/100)^n= | B7: =(1+R[-1]C/100)^R[-2]C -> 1.7908476965428546 | D7: =100/RC[-2]+R[-3]C[-2]*(RC[-2]-1)/R[-1]C[-2]*100/RC[-2] -> 85.279825897170596
A10: BULLETPVAFTERTAX(coupon, terms, taxrate, eff.int)
A11: Present value of n-year bullet loan (stående lån) after tax where tax is levied only on the coupon
A12: =DEFINE("bulletPVAFTERTAX",R17C4,R13C2,R14C2,R15C2,R16C2) -> #NAME?
A13: coupon = | B13: 3
A14: n = | B14: 6
A15: taxrate = | B15: 32
A16: eff.int r = | B16: 2.1
A17: (1+r/100)^n= | B17: =(1+R[-1]C/100)^R[-3]C -> 1.1328031618053713 | D17: =100/RC[-2]+(1-R[-2]C[-2]/100)*R[-4]C[-2]*(RC[-2]-1)/R[-1]C[-2]*100/RC[-2] -> 99.665045421877636
A20: NOMINAL(effective, npery)
A21: Returns the nominal rate, given the effective rate and the number of periods
A22: =DEFINE("nominal", R[4]C[1],R[1]C[1],R[2]C[1]) -> #NAME?
A23: effective = | B23: 5.3543E-2
A24: npery = | B24: 4
A25: periods = | B25: =FLOOR(R[-1]C,1) -> 4
A26: nominal = | B26: =((R[-3]C+1)^(1/R[-1]C)-1)*R[-1]C -> 5.2500319868356016E-2
A46: foo

Sheet: @Calendar
A1: Gregorian calendar, following Dershovitz and Reingold, 3ed 2008 | G1: 2009-01-10 | H1: 2012-01-27
A2: Modified from initial implementations by Hui Xu and Mainul Liton, IT University of Copenhagen
A4: =DEFINE("leapyear",R[2]C[1],R[1]C[1]) -> #NAME? | B4: leapyear(yyyy) | C4: N&D: gregorian-leap-year
A5: yyyy = | B5: 1904
A6: result = | B6: =AND(MOD(R[-1]C,4)=0,OR(MOD(R[-1]C,100)<>0, MOD(R[-1]C,400)=0)) -> 1
A8: =DEFINE("fixdate", R[6]C[1],R[1]C[1],R[2]C[1],R[3]C[1]) -> #NAME? | B8: fixdate(yyyy,mm,dd) | C8: N&D: fixed-from-gregorian
A9: yyyy = | B9: 1901
A10: mm = | B10: 1
A11: dd = | B11: 1
B12: =R[-3]C+FLOOR((R[-2]C+9)/12,1) -> 1901
B13: =12+MOD((R[-3]C-2),-12) -> 11
A14: result = | B14: =-306+365*(R[-2]C-1) +FLOOR((R[-2]C-1)/4,1)-FLOOR((R[-2]C-1)/100,1)+FLOOR((R[-2]C-1)/400,1)+FLOOR((3*R[-1]C-1)/5,1)+30*(R[-1]C-1)+R[-3]C -> 693961
A16: =DEFINE("efixdate",R[2]C[1],R[1]C[1]) -> #NAME? | B16: efixdate(yyyymmdd)
A17: yyyymmdd = | B17: =10000*R[-8]C+100*R[-7]C+R[-6]C -> 19010101
A18: result = | B18: =fixdate(FLOOR(R[-1]C/10000,1),MOD(FLOOR(R[-1]C/100,1),100),MOD(R[-1]C,100)) -> #NAME?
A20: =DEFINE("gyear",R[4]C[1],R[1]C[1]) -> #NAME? | B20: gyear(fixed) | C20: N&D: gregorian-year-from-fixed
A21: fixed = | B21: 733416
A22: approx = | B22: =FLOOR((400/146097*(R[-1]C+1)),1) -> 2008
A23: start = | B23: =1+365*R[-1]C+FLOOR(R[-1]C/4,1)-FLOOR(R[-1]C/100,1)+FLOOR(R[-1]C/400,1) -> 733408
A24: yyyy = | B24: =IF(R[-3]C<R[-1]C,R[-2]C,R[-2]C+1) -> 2009
A26: =DEFINE("gmonth",R[6]C[1],R[1]C[1]) -> #NAME? | B26: gmonth(fixed) | C26: N&D: gregorian-month-from-fixed
A27: fixed = | B27: =R[-13]C -> 693961
A28: y=gyear(fixed+306) = | B28: =gyear(R[-1]C+306) -> #NAME?
A29: fixdate(yyyy-1,3,1) = | B29: =fixdate(R[-1]C-1,3,1) -> #NAME?
A30: diff = | B30: =R[-3]C-R[-1]C -> #NAME?
B31: =FLOOR((5*R[-1]C+2)/153,1)+3 -> #NAME?
A32: result = | B32: =12+MOD(R[-1]C,-12) -> #NAME?
A34: =DEFINE("gday",R[4]C[1],R[1]C[1]) -> #NAME? | B34: gday(fixed) | C34: N&D: gregorian-day-from-fixed
A35: fixed = | B35: =R[-21]C -> 693961
A36: yyyy = | B36: =gyear(R[-1]C) -> #NAME?
A37: mm = | B37: =gmonth(R[-2]C) -> #NAME?
A38: result = | B38: =R[-3]C-fixdate(R[-2]C,R[-1]C,1)+1 -> #NAME?
A40: =DEFINE("gdate",R[2]C[1],R[1]C[1]) -> #NAME? | B40: gdate(fixed) | C40: N&D: gregorian-date-from-fixed
A41: fixed = | B41: =R[-27]C -> 693961
A42: yyyymmdd = | B42: =10000*gyear(R[-1]C)+100*gmonth(R[-1]C)+gday(R[-1]C) -> #NAME?
A44: =DEFINE("date",R[4]C[1],R[1]C[1],R[2]C[1],R[3]C[1]) -> #NAME? | B44: date(yyyy,mm,dd)
A45: yyyy = | B45: 2009
A46: mm = | B46: 2
A47: dd = | B47: 9
A48: yyyymmdd = | B48: =10000*R[-3]C+100*R[-2]C+R[-1]C -> 20090209
A50: =DEFINE("year",R[2]C[1],R[1]C[1]) -> #NAME? | B50: year(yyyymmdd)
A51: yyyymmdd = | B51: =R[-3]C -> 20090209
A52: yyyy = | B52: =FLOOR(R[-1]C/10000,1) -> 2009
A54: =DEFINE("month",R[2]C[1],R[1]C[1]) -> #NAME? | B54: month(yyyymmdd)
A55: yyyymmdd = | B55: =R[-7]C -> 20090209
A56: mm = | B56: =MOD(FLOOR(R[-1]C/100,1),100) -> 2
A58: =DEFINE("day",R[2]C[1],R[1]C[1]) -> #NAME? | B58: day(yyyymmdd)
A59: yyyymmdd = | B59: =R[-11]C -> 20090209
A60: dd = | B60: =MOD(R[-1]C,100) -> 9
A62: =DEFINE("days",R[3]C[1],R[1]C[1],R[2]C[1]) -> #NAME? | B62: days(date1,date2)
A63: date1 = | B63: 20090109
A64: date2 = | B64: 20090315
A65: days = | B65: =efixdate(R[-1]C)-efixdate(R[-2]C) -> #NAME?
A67: =DEFINE("weekday",R[2]C[1],R[1]C[1]) -> #NAME? | B67: weekday(fixed)
A68: fixed = | B68: =R[-54]C -> 693961 | C68: Mon=0
A69: weekday = | B69: =MOD(R[-1]C+6,7) -> 1
A71: =DEFINE("weekdayofdate",R[2]C[1],R[1]C[1]) -> #NAME? | B71: weekdayofdate(yyyymmdd)
A72: yyyymmdd = | B72: =R[-55]C -> 19010101 | C72: Mon=0
A73: weekday = | B73: =WEEKDAY(efixdate(R[-1]C)) -> #NAME?
A75: =DEFINE("kdayob",R[3]C[1],R[1]C[1],R[2]C[1]) -> #NAME? | B75: kdayob(fixed,k)
A76: fixed = | B76: =R[-62]C -> 693961
A77: k = | B77: 6 | C77: Mon=0
A78: kdayob = | B78: =R[-2]C-MOD(R[-2]C-R[-1]C+6,7) -> 693959
A80: =DEFINE("kdayoa",R[3]C[1],R[1]C[1],R[2]C[1]) -> #NAME? | B80: kdayoa(fixed,k)
A81: fixed = | B81: =R[-67]C -> 693961
A82: k = | B82: 6 | C82: Mon=0
A83: kdayoa = | B83: =kdayob(R[-2]C+6,R[-1]C) -> #NAME?
A85: =DEFINE("kdaynearest",R[3]C[1],R[1]C[1],R[2]C[1]) -> #NAME? | B85: kdaynearest(fixed,k)
A86: fixed = | B86: =R[-72]C -> 693961
A87: k = | B87: 6 | C87: Mon=0
A88: kdaynearest = | B88: =kdayob(R[-2]C+3,R[-1]C) -> #NAME?
A90: =DEFINE("kdaya",R[3]C[1],R[1]C[1],R[2]C[1]) -> #NAME? | B90: kdaya(fixed,k)
A91: fixed = | B91: =R[-77]C -> 693961
A92: k = | B92: 6 | C92: Mon=0
A93: kdaya = | B93: =kdayob(R[-2]C+7,R[-1]C) -> #NAME?
A95: =DEFINE("kdayb",R[3]C[1],R[1]C[1],R[2]C[1]) -> #NAME? | B95: kdayb(fixed,k)
A96: fixed = | B96: =R[-82]C -> 693961
A97: k = | B97: 6 | C97: Mon=0
A98: kdayb = | B98: =kdayob(R[-2]C-1,R[-1]C) -> #NAME?
A100: =DEFINE("nthkday",R[4]C[1],R[1]C[1],R[2]C[1],R[3]C[1]) -> #NAME? | B100: nthkday(n,k,fixed)
A101: n = | B101: 1
A102: k = | B102: 6
A103: fixed = | B103: =R[-89]C -> 693961
A104: result = | B104: =IF(R[-3]C>0, 7*R[-3]C+kdayb(R[-1]C,R[-2]C), 7*R[-3]C+kdaya(R[-1]C,R[-2]C)) -> #NAME?
A106: =DEFINE("fixedfromiso",R[4]C[1],R[1]C[1],R[2]C[1],R[3]C[1]) -> #NAME? | B106: fixedfromiso(week,day,yyyy)
A107: week = | B107: 2
A108: day = | B108: 6
A109: yyyy = | B109: 2009
A110: fixed = | B110: =nthkday(R[-3]C,6,fixdate(R[-1]C-1,12,28))+R[-2]C -> #NAME?
A112: =DEFINE("isoyear",R[3]C[1],R[1]C[1]) -> #NAME? | B112: isoyear(fixed)
A113: fixed = | B113: =R[-99]C -> 693961
A114: approx = | B114: =gyear(R[-1]C-3) -> #NAME?
A115: year = | B115: =IF(R[-2]C>=fixedfromiso(1,1,R[-1]C+1),R[-1]C+1,R[-1]C) -> #NAME?
A117: =DEFINE("isoweek",R[2]C[1],R[1]C[1]) -> #NAME? | B117: isoweek(fixed)
A118: fixed = | B118: =R[-104]C -> 693961
A119: isoweek = | B119: =FLOOR((R[-1]C-fixedfromiso(1,1,isoyear(R[-1]C)))/7,1)+1 -> #NAME?
A121: =DEFINE("easter",R[6]C[1],R[1]C[1]) -> #NAME? | B121: easter(yyyy)
A122: yyyy = | B122: 2000
A123: century = | B123: =FLOOR(R[-1]C/100,1)+1 -> 21
A124: shifted-epact = | B124: =MOD(14+11*MOD(R[-2]C,19)-FLOOR(3*R[-1]C/4,1)+FLOOR((5+8*R[-1]C)/25,1),30) -> 0
A125: adjusted-epact = | B125: =IF(OR(R[-1]C=0,AND(R[-1]C=1,10 < MOD(R[-2]C,19))),R[-1]C+1,R[-1]C) -> 1
A126: paschal-moon = | B126: =fixdate(R[-4]C,4,19)-R[-1]C -> #NAME?
A127: easterfixed = | B127: =kdaya(R[-1]C,6) -> #NAME?
A129: =DEFINE("today",R[1]C[1]) -> #NAME? | B129: today()
A130: fixed = | B130: =FLOOR(NOW(),1)+693594 -> 735292
A132: =DEFINE("holidays",R[3]C[1],R[1]C[1]) -> #NAME? | B132: holidays(year) | C132: Movable (easter-related) holidays in Denmark
A133: yyyy = | B133: 2012
A134: easter(year) = | B134: =easter(R[-1]C) -> #NAME?
A135: result = | B135: =vcat(R[-1]C-49, R[-1]C-7,R[-1]C-3,R[-1]C-2,R[-1]C,R[-1]C+1,R[-1]C+26,R[-1]C+39,R[-1]C+49,R[-1]C+50) -> #NAME?
A137: =DEFINE("isinarray",R[3]C[1],R[1]C[1],R[2]C[1]) -> #NAME? | B137: isinarray(array, n) | D137: =DEFINE("samenumber",R[4]C[1],R[1]C[1],R[2]C[1],R[3]C[1]) -> #NAME?
A138: array = | B138: =holidays(R[-129]C) -> #NAME? | D138: old =
A139: n = | B139: =R[-125]C -> 693961 | D139: n1 =
A140: result = | B140: =reduce(CLOSURE("samenumber",NA(),R[-1]C,NA()),0,R[-2]C) -> #NAME? | D140: n2 =
D141: (n1=n2) = | E141: =OR(R[-3]C,R[-2]C=R[-1]C) -> 1
A143: =DEFINE("isworkday",R[6]C[1],R[1]C[1]) -> #NAME? | B143: isworkday(fixdate)
A144: fixdate = | B144: =R[-130]C -> 693961
A145: mm = | B145: =gmonth(R[-1]C) -> #NAME?
A146: dd = | B146: =gday(R[-2]C) -> #NAME?
A147: holidays = | B147: =holidays(gyear(R[-3]C)) -> #NAME?
A148: weekday = | B148: =WEEKDAY(R[-4]C) -> 2
A149: isworkday = | B149: =AND(R[-1]C<5, NOT(isinarray(R[-2]C,R[-5]C)), NOT(AND(R[-4]C=1,R[-3]C=1)), NOT(AND(R[-4]C=6,R[-3]C=5)), NOT(AND(R[-4]C=12, OR(R[-3]C=24,R[-3]C= 25,R[-3]C= 26,R[-3]C=31)))) -> #NAME?
A151: =DEFINE("bankdayoa",R[2]C[1],R[1]C[1]) -> #NAME? | B151: bankdayoa(fixdate)
A152: fixed = | B152: =R14C2 -> 693961
A153: result = | B153: =IF(isworkday(R[-1]C),R[-1]C,bankdayoa(R[-1]C+1)) -> #NAME?
A155: =DEFINE("bankdaya",R[2]C[1],R[1]C[1]) -> #NAME? | B155: bankdaya(fixdate)
A156: fixed = | B156: =R14C2 -> 693961
A157: result = | B157: =bankdayoa(R[-1]C+1) -> #NAME?
A159: =DEFINE("bankdayob",R[2]C[1],R[1]C[1]) -> #NAME? | B159: bankdayob(fixdate)
A160: fixed = | B160: =R14C2 -> 693961
A161: result = | B161: =IF(isworkday(R[-1]C),R[-1]C,bankdayob(R[-1]C-1)) -> #NAME?
A163: =DEFINE("bankdayb",R[2]C[1],R[1]C[1]) -> #NAME? | B163: bankdayob(fixdate)
A164: fixed = | B164: =R14C2 -> 693961
A165: result = | B165: =bankdayob(R[-1]C-1) -> #NAME?

Sheet: Calexamples
A1: Example uses of calendar functions
A3: Second Tuesday of the year
A5: Month | B5: 2012 | C5: 2013 | D5: 2014 | E5: 2015 | F5: 2016
A6: 1 | B6: =gdate(kdayoa(fixdate(R5C,RC1,1),1)+7) -> #NAME? | C6: =gdate(kdayoa(fixdate(R5C,RC1,1),1)+7) -> #NAME? | D6: =gdate(kdayoa(fixdate(R5C,RC1,1),1)+7) -> #NAME? | E6: =gdate(kdayoa(fixdate(R5C,RC1,1),1)+7) -> #NAME? | F6: =gdate(kdayoa(fixdate(R5C,RC1,1),1)+7) -> #NAME?
A7: 2 | B7: =gdate(kdayoa(fixdate(R5C,RC1,1),1)+7) -> #NAME? | C7: =gdate(kdayoa(fixdate(R5C,RC1,1),1)+7) -> #NAME? | D7: =gdate(kdayoa(fixdate(R5C,RC1,1),1)+7) -> #NAME? | E7: =gdate(kdayoa(fixdate(R5C,RC1,1),1)+7) -> #NAME? | F7: =gdate(kdayoa(fixdate(R5C,RC1,1),1)+7) -> #NAME?
A8: 3 | B8: =gdate(kdayoa(fixdate(R5C,RC1,1),1)+7) -> #NAME? | C8: =gdate(kdayoa(fixdate(R5C,RC1,1),1)+7) -> #NAME? | D8: =gdate(kdayoa(fixdate(R5C,RC1,1),1)+7) -> #NAME? | E8: =gdate(kdayoa(fixdate(R5C,RC1,1),1)+7) -> #NAME? | F8: =gdate(kdayoa(fixdate(R5C,RC1,1),1)+7) -> #NAME?
A9: 4 | B9: =gdate(kdayoa(fixdate(R5C,RC1,1),1)+7) -> #NAME? | C9: =gdate(kdayoa(fixdate(R5C,RC1,1),1)+7) -> #NAME? | D9: =gdate(kdayoa(fixdate(R5C,RC1,1),1)+7) -> #NAME? | E9: =gdate(kdayoa(fixdate(R5C,RC1,1),1)+7) -> #NAME? | F9: =gdate(kdayoa(fixdate(R5C,RC1,1),1)+7) -> #NAME?
A10: 5 | B10: =gdate(kdayoa(fixdate(R5C,RC1,1),1)+7) -> #NAME? | C10: =gdate(kdayoa(fixdate(R5C,RC1,1),1)+7) -> #NAME? | D10: =gdate(kdayoa(fixdate(R5C,RC1,1),1)+7) -> #NAME? | E10: =gdate(kdayoa(fixdate(R5C,RC1,1),1)+7) -> #NAME? | F10: =gdate(kdayoa(fixdate(R5C,RC1,1),1)+7) -> #NAME?
A11: 6 | B11: =gdate(kdayoa(fixdate(R5C,RC1,1),1)+7) -> #NAME? | C11: =gdate(kdayoa(fixdate(R5C,RC1,1),1)+7) -> #NAME? | D11: =gdate(kdayoa(fixdate(R5C,RC1,1),1)+7) -> #NAME? | E11: =gdate(kdayoa(fixdate(R5C,RC1,1),1)+7) -> #NAME? | F11: =gdate(kdayoa(fixdate(R5C,RC1,1),1)+7) -> #NAME?
A12: 7 | B12: =gdate(kdayoa(fixdate(R5C,RC1,1),1)+7) -> #NAME? | C12: =gdate(kdayoa(fixdate(R5C,RC1,1),1)+7) -> #NAME? | D12: =gdate(kdayoa(fixdate(R5C,RC1,1),1)+7) -> #NAME? | E12: =gdate(kdayoa(fixdate(R5C,RC1,1),1)+7) -> #NAME? | F12: =gdate(kdayoa(fixdate(R5C,RC1,1),1)+7) -> #NAME?
A13: 8 | B13: =gdate(kdayoa(fixdate(R5C,RC1,1),1)+7) -> #NAME? | C13: =gdate(kdayoa(fixdate(R5C,RC1,1),1)+7) -> #NAME? | D13: =gdate(kdayoa(fixdate(R5C,RC1,1),1)+7) -> #NAME? | E13: =gdate(kdayoa(fixdate(R5C,RC1,1),1)+7) -> #NAME? | F13: =gdate(kdayoa(fixdate(R5C,RC1,1),1)+7) -> #NAME?
A14: 9 | B14: =gdate(kdayoa(fixdate(R5C,RC1,1),1)+7) -> #NAME? | C14: =gdate(kdayoa(fixdate(R5C,RC1,1),1)+7) -> #NAME? | D14: =gdate(kdayoa(fixdate(R5C,RC1,1),1)+7) -> #NAME? | E14: =gdate(kdayoa(fixdate(R5C,RC1,1),1)+7) -> #NAME? | F14: =gdate(kdayoa(fixdate(R5C,RC1,1),1)+7) -> #NAME?
A15: 10 | B15: =gdate(kdayoa(fixdate(R5C,RC1,1),1)+7) -> #NAME? | C15: =gdate(kdayoa(fixdate(R5C,RC1,1),1)+7) -> #NAME? | D15: =gdate(kdayoa(fixdate(R5C,RC1,1),1)+7) -> #NAME? | E15: =gdate(kdayoa(fixdate(R5C,RC1,1),1)+7) -> #NAME? | F15: =gdate(kdayoa(fixdate(R5C,RC1,1),1)+7) -> #NAME?
A16: 11 | B16: =gdate(kdayoa(fixdate(R5C,RC1,1),1)+7) -> #NAME? | C16: =gdate(kdayoa(fixdate(R5C,RC1,1),1)+7) -> #NAME? | D16: =gdate(kdayoa(fixdate(R5C,RC1,1),1)+7) -> #NAME? | E16: =gdate(kdayoa(fixdate(R5C,RC1,1),1)+7) -> #NAME? | F16: =gdate(kdayoa(fixdate(R5C,RC1,1),1)+7) -> #NAME?
A17: 12 | B17: =gdate(kdayoa(fixdate(R5C,RC1,1),1)+7) -> #NAME? | C17: =gdate(kdayoa(fixdate(R5C,RC1,1),1)+7) -> #NAME? | D17: =gdate(kdayoa(fixdate(R5C,RC1,1),1)+7) -> #NAME? | E17: =gdate(kdayoa(fixdate(R5C,RC1,1),1)+7) -> #NAME? | F17: =gdate(kdayoa(fixdate(R5C,RC1,1),1)+7) -> #NAME?
A19: Easter-related holidays, for Denmark
B21: 2012 | C21: 2013 | D21: 2014 | E21: 2015 | F21: 2016
A22: Fastelavn | B22: =map(CLOSURE("gdate"),holidays(R21C)) -> #NAME? | C22: =map(CLOSURE("gdate"),holidays(R21C)) -> #NAME? | D22: =map(CLOSURE("gdate"),holidays(R21C)) -> #NAME? | E22: =map(CLOSURE("gdate"),holidays(R21C)) -> #NAME? | F22: =map(CLOSURE("gdate"),holidays(R21C)) -> #NAME?
A23: Palmesoendag | B23: #NAME? | C23: #NAME? | D23: #NAME? | E23: #NAME? | F23: #NAME?
A24: Skaertorsdag | B24: #NAME? | C24: #NAME? | D24: #NAME? | E24: #NAME? | F24: #NAME?
A25: Langfredag | B25: #NAME? | C25: #NAME? | D25: #NAME? | E25: #NAME? | F25: #NAME?
A26: Paaskedag | B26: #NAME? | C26: #NAME? | D26: #NAME? | E26: #NAME? | F26: #NAME?
A27: Anden paaskedag | B27: #NAME? | C27: #NAME? | D27: #NAME? | E27: #NAME? | F27: #NAME?
A28: Store bededag | B28: #NAME? | C28: #NAME? | D28: #NAME? | E28: #NAME? | F28: #NAME?
A29: Kristi himmelfart | B29: #NAME? | C29: #NAME? | D29: #NAME? | E29: #NAME? | F29: #NAME?
A30: Pinsedag | B30: #NAME? | C30: #NAME? | D30: #NAME? | E30: #NAME? | F30: #NAME?
A31: Anden pinsedag | B31: #NAME? | C31: #NAME? | D31: #NAME? | E31: #NAME? | F31: #NAME?
A33: Last bankday of the month
B34: 2012 | C34: 2013 | D34: 2014 | E34: 2015 | F34: 2016
A35: 1 | B35: =gdate(bankdayb(fixdate(R34C,RC1+1,1))) -> #NAME? | C35: =gdate(bankdayb(fixdate(R34C,RC1+1,1))) -> #NAME? | D35: =gdate(bankdayb(fixdate(R34C,RC1+1,1))) -> #NAME? | E35: =gdate(bankdayb(fixdate(R34C,RC1+1,1))) -> #NAME? | F35: =gdate(bankdayb(fixdate(R34C,RC1+1,1))) -> #NAME?
A36: 2 | B36: =gdate(bankdayb(fixdate(R34C,RC1+1,1))) -> #NAME? | C36: =gdate(bankdayb(fixdate(R34C,RC1+1,1))) -> #NAME? | D36: =gdate(bankdayb(fixdate(R34C,RC1+1,1))) -> #NAME? | E36: =gdate(bankdayb(fixdate(R34C,RC1+1,1))) -> #NAME? | F36: =gdate(bankdayb(fixdate(R34C,RC1+1,1))) -> #NAME?
A37: 3 | B37: =gdate(bankdayb(fixdate(R34C,RC1+1,1))) -> #NAME? | C37: =gdate(bankdayb(fixdate(R34C,RC1+1,1))) -> #NAME? | D37: =gdate(bankdayb(fixdate(R34C,RC1+1,1))) -> #NAME? | E37: =gdate(bankdayb(fixdate(R34C,RC1+1,1))) -> #NAME? | F37: =gdate(bankdayb(fixdate(R34C,RC1+1,1))) -> #NAME?
A38: 4 | B38: =gdate(bankdayb(fixdate(R34C,RC1+1,1))) -> #NAME? | C38: =gdate(bankdayb(fixdate(R34C,RC1+1,1))) -> #NAME? | D38: =gdate(bankdayb(fixdate(R34C,RC1+1,1))) -> #NAME? | E38: =gdate(bankdayb(fixdate(R34C,RC1+1,1))) -> #NAME? | F38: =gdate(bankdayb(fixdate(R34C,RC1+1,1))) -> #NAME?
A39: 5 | B39: =gdate(bankdayb(fixdate(R34C,RC1+1,1))) -> #NAME? | C39: =gdate(bankdayb(fixdate(R34C,RC1+1,1))) -> #NAME? | D39: =gdate(bankdayb(fixdate(R34C,RC1+1,1))) -> #NAME? | E39: =gdate(bankdayb(fixdate(R34C,RC1+1,1))) -> #NAME? | F39: =gdate(bankdayb(fixdate(R34C,RC1+1,1))) -> #NAME?
A40: 6 | B40: =gdate(bankdayb(fixdate(R34C,RC1+1,1))) -> #NAME? | C40: =gdate(bankdayb(fixdate(R34C,RC1+1,1))) -> #NAME? | D40: =gdate(bankdayb(fixdate(R34C,RC1+1,1))) -> #NAME? | E40: =gdate(bankdayb(fixdate(R34C,RC1+1,1))) -> #NAME? | F40: =gdate(bankdayb(fixdate(R34C,RC1+1,1))) -> #NAME?
A41: 7 | B41: =gdate(bankdayb(fixdate(R34C,RC1+1,1))) -> #NAME? | C41: =gdate(bankdayb(fixdate(R34C,RC1+1,1))) -> #NAME? | D41: =gdate(bankdayb(fixdate(R34C,RC1+1,1))) -> #NAME? | E41: =gdate(bankdayb(fixdate(R34C,RC1+1,1))) -> #NAME? | F41: =gdate(bankdayb(fixdate(R34C,RC1+1,1))) -> #NAME?
A42: 8 | B42: =gdate(bankdayb(fixdate(R34C,RC1+1,1))) -> #NAME? | C42: =gdate(bankdayb(fixdate(R34C,RC1+1,1))) -> #NAME? | D42: =gdate(bankdayb(fixdate(R34C,RC1+1,1))) -> #NAME? | E42: =gdate(bankdayb(fixdate(R34C,RC1+1,1))) -> #NAME? | F42: =gdate(bankdayb(fixdate(R34C,RC1+1,1))) -> #NAME?
A43: 9 | B43: =gdate(bankdayb(fixdate(R34C,RC1+1,1))) -> #NAME? | C43: =gdate(bankdayb(fixdate(R34C,RC1+1,1))) -> #NAME? | D43: =gdate(bankdayb(fixdate(R34C,RC1+1,1))) -> #NAME? | E43: =gdate(bankdayb(fixdate(R34C,RC1+1,1))) -> #NAME? | F43: =gdate(bankdayb(fixdate(R34C,RC1+1,1))) -> #NAME?
A44: 10 | B44: =gdate(bankdayb(fixdate(R34C,RC1+1,1))) -> #NAME? | C44: =gdate(bankdayb(fixdate(R34C,RC1+1,1))) -> #NAME? | D44: =gdate(bankdayb(fixdate(R34C,RC1+1,1))) -> #NAME? | E44: =gdate(bankdayb(fixdate(R34C,RC1+1,1))) -> #NAME? | F44: =gdate(bankdayb(fixdate(R34C,RC1+1,1))) -> #NAME?
A45: 11 | B45: =gdate(bankdayb(fixdate(R34C,RC1+1,1))) -> #NAME? | C45: =gdate(bankdayb(fixdate(R34C,RC1+1,1))) -> #NAME? | D45: =gdate(bankdayb(fixdate(R34C,RC1+1,1))) -> #NAME? | E45: =gdate(bankdayb(fixdate(R34C,RC1+1,1))) -> #NAME? | F45: =gdate(bankdayb(fixdate(R34C,RC1+1,1))) -> #NAME?
A46: 12 | B46: =gdate(bankdayb(fixdate(R34C,RC1+1,1))) -> #NAME? | C46: =gdate(bankdayb(fixdate(R34C,RC1+1,1))) -> #NAME? | D46: =gdate(bankdayb(fixdate(R34C,RC1+1,1))) -> #NAME? | E46: =gdate(bankdayb(fixdate(R34C,RC1+1,1))) -> #NAME? | F46: =gdate(bankdayb(fixdate(R34C,RC1+1,1))) -> #NAME?
A48: First bankday of the month
B49: 2012 | C49: 2013 | D49: 2014 | E49: 2015 | F49: 2016
A50: 1 | B50: =gdate(bankdayoa(fixdate(R34C,RC1,1))) -> #NAME? | C50: =gdate(bankdayoa(fixdate(R34C,RC1,1))) -> #NAME? | D50: =gdate(bankdayoa(fixdate(R34C,RC1,1))) -> #NAME? | E50: =gdate(bankdayoa(fixdate(R34C,RC1,1))) -> #NAME? | F50: =gdate(bankdayoa(fixdate(R34C,RC1,1))) -> #NAME?
A51: 2 | B51: =gdate(bankdayoa(fixdate(R34C,RC1,1))) -> #NAME? | C51: =gdate(bankdayoa(fixdate(R34C,RC1,1))) -> #NAME? | D51: =gdate(bankdayoa(fixdate(R34C,RC1,1))) -> #NAME? | E51: =gdate(bankdayoa(fixdate(R34C,RC1,1))) -> #NAME? | F51: =gdate(bankdayoa(fixdate(R34C,RC1,1))) -> #NAME?
A52: 3 | B52: =gdate(bankdayoa(fixdate(R34C,RC1,1))) -> #NAME? | C52: =gdate(bankdayoa(fixdate(R34C,RC1,1))) -> #NAME? | D52: =gdate(bankdayoa(fixdate(R34C,RC1,1))) -> #NAME? | E52: =gdate(bankdayoa(fixdate(R34C,RC1,1))) -> #NAME? | F52: =gdate(bankdayoa(fixdate(R34C,RC1,1))) -> #NAME?
A53: 4 | B53: =gdate(bankdayoa(fixdate(R34C,RC1,1))) -> #NAME? | C53: =gdate(bankdayoa(fixdate(R34C,RC1,1))) -> #NAME? | D53: =gdate(bankdayoa(fixdate(R34C,RC1,1))) -> #NAME? | E53: =gdate(bankdayoa(fixdate(R34C,RC1,1))) -> #NAME? | F53: =gdate(bankdayoa(fixdate(R34C,RC1,1))) -> #NAME?
A54: 5 | B54: =gdate(bankdayoa(fixdate(R34C,RC1,1))) -> #NAME? | C54: =gdate(bankdayoa(fixdate(R34C,RC1,1))) -> #NAME? | D54: =gdate(bankdayoa(fixdate(R34C,RC1,1))) -> #NAME? | E54: =gdate(bankdayoa(fixdate(R34C,RC1,1))) -> #NAME? | F54: =gdate(bankdayoa(fixdate(R34C,RC1,1))) -> #NAME?
A55: 6 | B55: =gdate(bankdayoa(fixdate(R34C,RC1,1))) -> #NAME? | C55: =gdate(bankdayoa(fixdate(R34C,RC1,1))) -> #NAME? | D55: =gdate(bankdayoa(fixdate(R34C,RC1,1))) -> #NAME? | E55: =gdate(bankdayoa(fixdate(R34C,RC1,1))) -> #NAME? | F55: =gdate(bankdayoa(fixdate(R34C,RC1,1))) -> #NAME?
A56: 7 | B56: =gdate(bankdayoa(fixdate(R34C,RC1,1))) -> #NAME? | C56: =gdate(bankdayoa(fixdate(R34C,RC1,1))) -> #NAME? | D56: =gdate(bankdayoa(fixdate(R34C,RC1,1))) -> #NAME? | E56: =gdate(bankdayoa(fixdate(R34C,RC1,1))) -> #NAME? | F56: =gdate(bankdayoa(fixdate(R34C,RC1,1))) -> #NAME?
A57: 8 | B57: =gdate(bankdayoa(fixdate(R34C,RC1,1))) -> #NAME? | C57: =gdate(bankdayoa(fixdate(R34C,RC1,1))) -> #NAME? | D57: =gdate(bankdayoa(fixdate(R34C,RC1,1))) -> #NAME? | E57: =gdate(bankdayoa(fixdate(R34C,RC1,1))) -> #NAME? | F57: =gdate(bankdayoa(fixdate(R34C,RC1,1))) -> #NAME?
A58: 9 | B58: =gdate(bankdayoa(fixdate(R34C,RC1,1))) -> #NAME? | C58: =gdate(bankdayoa(fixdate(R34C,RC1,1))) -> #NAME? | D58: =gdate(bankdayoa(fixdate(R34C,RC1,1))) -> #NAME? | E58: =gdate(bankdayoa(fixdate(R34C,RC1,1))) -> #NAME? | F58: =gdate(bankdayoa(fixdate(R34C,RC1,1))) -> #NAME?
A59: 10 | B59: =gdate(bankdayoa(fixdate(R34C,RC1,1))) -> #NAME? | C59: =gdate(bankdayoa(fixdate(R34C,RC1,1))) -> #NAME? | D59: =gdate(bankdayoa(fixdate(R34C,RC1,1))) -> #NAME? | E59: =gdate(bankdayoa(fixdate(R34C,RC1,1))) -> #NAME? | F59: =gdate(bankdayoa(fixdate(R34C,RC1,1))) -> #NAME?
A60: 11 | B60: =gdate(bankdayoa(fixdate(R34C,RC1,1))) -> #NAME? | C60: =gdate(bankdayoa(fixdate(R34C,RC1,1))) -> #NAME? | D60: =gdate(bankdayoa(fixdate(R34C,RC1,1))) -> #NAME? | E60: =gdate(bankdayoa(fixdate(R34C,RC1,1))) -> #NAME? | F60: =gdate(bankdayoa(fixdate(R34C,RC1,1))) -> #NAME?
A61: 12 | B61: =gdate(bankdayoa(fixdate(R34C,RC1,1))) -> #NAME? | C61: =gdate(bankdayoa(fixdate(R34C,RC1,1))) -> #NAME? | D61: =gdate(bankdayoa(fixdate(R34C,RC1,1))) -> #NAME? | E61: =gdate(bankdayoa(fixdate(R34C,RC1,1))) -> #NAME? | F61: =gdate(bankdayoa(fixdate(R34C,RC1,1))) -> #NAME?

Sheet: @External
A1: Calling external functions from sheet-defined functions
A3: =DEFINE("log16",R[2]C[1],R[1]C[1]) -> #NAME? | B3: Logarithm base 16
A4: x = | B4: 4
A5: log16(x) = | B5: =extern("System.Math.Log$(DD)D",R[-1]C,16) -> #NAME?
A7: =DEFINE("sinh",R[2]C[1],R[1]C[1]) -> #NAME? | B7: Hyperbolic trigonometry
A8: x =
A9: sinh(x) = | B9: =extern("System.Math.Sinh$(D)D",R[-1]C) -> #NAME?
A11: =DEFINE("cosh",R[2]C[1],R[1]C[1]) -> #NAME?
A12: x =
A13: cosh(x) = | B13: =extern("System.Math.Cosh$(D)D",R[-1]C) -> #NAME?
A15: =DEFINE("tanh",R[2]C[1],R[1]C[1]) -> #NAME?
A16: x =
A17: tanh(x) = | B17: =extern("System.Math.Tanh$(D)D",R[-1]C) -> #NAME?
A19: =DEFINE("format",R[2]C[1],R[1]C[1]) -> #NAME? | B19: String formatting
A20: x = | B20: =RAND() -> 0.85775974087935491
A21: fmt = | B21: =extern("System.String.Format$(TO)T", "x={0:F6}", R[-1]C) -> #NAME?
A23: =DEFINE("indexof", R[3]C[1], R[1]C[1], R[2]C[1]) -> #NAME? | B23: String search
A24: str = | B24: abcdefgh
A25: pat = | B25: def
A26: indexof = | B26: =extern("System.String.IndexOf(T)I",R[-2]C, R[-1]C) -> #NAME?
A28: =DEFINE("broken",R[1]C[1]) -> #NAME? | B28: Broken: Statically wrong argument
A29: broken = | B29: =extern("System.Math.Sinh$(D)D","aa") -> #NAME?
A31: =DEFINE("startswith", R[3]C[1], R[1]C[1], R[2]C[1]) -> #NAME? | B31: Startswith -- boolean return value
A32: str = | B32: abcdefgh
A33: pat = | B33: def
A34: indexof = | B34: =extern("System.String.StartsWith(T)Z",R[-2]C, R[-1]C) -> #NAME?
A36: =DEFINE("toupper", R[2]C[1], R[1]C[1]) -> #NAME? | B36: Toupper
A37: str = | B37: careFUL
A38: toupper= | B38: =extern("System.String.ToUpper()T",R[-1]C) -> #NAME?
A40: =DEFINE("len", R[2]C[1], R[1]C[1]) -> #NAME? | B40: LEN -- calling a property
A41: str = | B41: careFUL
A42: length = | B42: =extern("System.String.get_Length()I",R[-1]C) -> #NAME?
A44: =DEFINE("isoformat", R[4]C[1],R[1]C[1], R[2]C[1], R[3]C[1]) -> #NAME? | B44: Isoformat
A45: yyyy | B45: 2009
A46: mm | B46: 1
A47: dd | B47: 25
A48: Isoformat | B48: =extern("System.String.Format$(TOOO)T","{0:0000}-{1:00}-{2:00}", R[-3]C, R[-2]C, R[-1]C) -> #NAME?
A50: =DEFINE("println",R[2]C[1],R[1]C[1]) -> #NAME? | B50: Print on console
A51: str = | B51: Hello, world
A52: no result = | B52: =volatilize(extern("System.Console.WriteLine$(T)W", R[-1]C)) -> #NAME?
A54: =DEFINE("trytypes", R[5]C[1],R[1]C[1]) -> #NAME? | B54: Demonstration of type-based optimization
A55: x =
A56: sinh(x) = | B56: =extern("System.Math.Sinh$(D)D",R55C2) -> #NAME?
A57: cosh(x) = | B57: =extern("System.Math.Cosh$(D)D",R55C2) -> #NAME?
A58: ssq = | B58: =R[-2]C*R[-2]C+R[-1]C*R[-1]C -> #NAME?
A59: result = | B59: =extern("System.Math.Log$(D)D",R58C2) -> #NAME?
A61: =DEFINE("stringarrayconcat", R[3]C[1],R[1]C[1],R[2]C[1]) -> #NAME? | B61: Array arguments
A62: s1 = | B62: abcd
A63: s2 = | B63: defg
A64: result = | B64: =extern("System.String.Concat$([T)T", hcat(R[-2]C, R[-1]C)) -> #NAME?
A66: =DEFINE("externsum1d",R[2]C[1],R[1]C[1]) -> #NAME? | B66: SUM of a row of numbers
A67: row = | B67: =R[5]C[2] -> #NAME?
A68: sum = | B68: =extern("Externals.TestExtern.Sum$([D)D",R[-1]C) -> #NAME?
A70: =DEFINE("externfib",R[2]C[1],R[1]C[1]) -> #NAME? | B70: Array 1D of results
A71: n = | B71: 10
A72: res = | B72: =extern("Externals.TestExtern.Fibs$(D)[D", R[-1]C) -> #NAME? | D72: =externfib(15) -> #NAME?
A74: =DEFINE("mmult",R[3]C[1],R[1]C[1],R[2]C[1]) -> #NAME? | B74: Matrix multiply, 2D args and res. | D74: 1 | E74: 2 | G74: 5 | H74: 6 | J74: =RC4*R74C[-3]+RC5*R75C[-3] -> 19 | K74: =RC4*R74C[-3]+RC5*R75C[-3] -> 22
A75: A = | B75: =R[-1]C[2]:RC[3] -> #VALUE! | D75: 3 | E75: 4 | G75: 7 | H75: 8 | J75: =RC4*R74C[-3]+RC5*R75C[-3] -> 43 | K75: =RC4*R74C[-3]+RC5*R75C[-3] -> 50
A76: B = | B76: =R[-2]C[5]:R[-1]C[6] -> #VALUE!
A77: A * B = | B77: =extern("Externals.TestExtern.MatMult$({D{D){D", R[-2]C, R[-1]C) -> #NAME? | D77: =MMULT(R[-2]C[-2],R[-1]C[-2]) -> #VALUE! | E77: =equal(RC[-1],R[-3]C[5]:R[-2]C[6]) -> #NAME?
A79: =DEFINE("httpget",R[2]C[1],R[1]C[1]) -> #NAME? | B79: HTTP Get
A80: address = | B80: http://www.itu.dk
A81: contents = | B81: =extern("Externals.TestExtern.HttpGet$(T)T", R[-1]C) -> #NAME?
B83: http://www.ftnet.dk/graphics/Finanstilsynet/Mediafiles/newdoc/diskonteringsrente/landespaendsjusterede_diskonteringssatser.xls
B84: Output
B85: '06-12-2011
A86: =extern("Externals.Actulus.Finanstilsynet$(TTT){D",B75,B76,B77)
A88: =DEFINE("dayofyear",R[2]C[1]) -> #NAME? | B88: Day of year via ,NET
A89: current datetime = | B89: =volatilize(extern("System.DateTime.get_Now$()LSystem.DateTime;")) -> #NAME?
A90: day of year = | B90: =extern("System.DateTime.get_DayOfYear()I", R[-1]C) -> #NAME?
A92: =DEFINE("islower",R[2]C[1],R[1]C[1]) -> #NAME? | B92: Is char lower case letter?
A93: char =
A94: islower = | B94: =extern("System.Char.IsLower$(C)Z", R[-1]C) -> #NAME?

Sheet: @Errors
A1: Test of error propagation | D1: 2012-01-02
A2: ArgCount | B2: ArgType | C2: NumError | D2: Name | E2: #REF! | F2: Name | G2: #N/A | H2: Custom
A3: =log16() -> #NAME? | B3: =LOG("") -> #VALUE! | C3: =LOG(-1) -> #NUM! | D3: =foobar() -> #NAME? | E3: =INDEX(Data!R[-2]C[-4]:R[-1]C[-3],10,10) -> #REF! | F3: =CLOSURE(" klyx") -> #NAME? | G3: =NA() -> #N/A | H3: =err("Custom") -> #NAME?
A4: =apply(RC13,R3C) -> #NAME? | B4: =apply(RC13,R3C) -> #NAME? | C4: =apply(RC13,R3C) -> #NAME? | D4: =apply(RC13,R3C) -> #NAME? | E4: =apply(RC13,R3C) -> #NAME? | F4: =apply(RC13,R3C) -> #NAME? | G4: =apply(RC13,R3C) -> #NAME? | H4: =apply(RC13,R3C) -> #NAME? | J4: 1 | K4: =IF(RC[-1],11,22) -> 11 | L4: =DEFINE("error01",RC[-1],RC[-2]) -> #NAME? | M4: =CLOSURE("error01",NA()) -> #NAME?
A5: =apply(RC13,R3C) -> #NAME? | B5: =apply(RC13,R3C) -> #NAME? | C5: =apply(RC13,R3C) -> #NAME? | D5: =apply(RC13,R3C) -> #NAME? | E5: =apply(RC13,R3C) -> #NAME? | F5: =apply(RC13,R3C) -> #NAME? | G5: =apply(RC13,R3C) -> #NAME? | H5: =apply(RC13,R3C) -> #NAME? | J5: 1 | K5: =IF(AND(RC[-1],RAND()),11,22) -> 11 | L5: =DEFINE("error02",RC[-1],RC[-2]) -> #NAME? | M5: =CLOSURE("error02",NA()) -> #NAME?
A6: =apply(RC13,R3C) -> #NAME? | B6: =apply(RC13,R3C) -> #NAME? | C6: =apply(RC13,R3C) -> #NAME? | D6: =apply(RC13,R3C) -> #NAME? | E6: =apply(RC13,R3C) -> #NAME? | F6: =apply(RC13,R3C) -> #NAME? | G6: =apply(RC13,R3C) -> #NAME? | H6: =apply(RC13,R3C) -> #NAME? | J6: 1 | K6: =IF(OR(RC[-1],RAND()),11,22) -> 11 | L6: =DEFINE("error03",RC[-1],RC[-2]) -> #NAME? | M6: =CLOSURE("error03",NA()) -> #NAME?
A7: =apply(RC13,R3C) -> #NAME? | B7: =apply(RC13,R3C) -> #NAME? | C7: =apply(RC13,R3C) -> #NAME? | D7: =apply(RC13,R3C) -> #NAME? | E7: =apply(RC13,R3C) -> #NAME? | F7: =apply(RC13,R3C) -> #NAME? | G7: =apply(RC13,R3C) -> #NAME? | H7: =apply(RC13,R3C) -> #NAME? | J7: 1 | K7: =IF(RC[-1],11,22)*0 -> 0 | L7: =DEFINE("error04",RC[-1],RC[-2]) -> #NAME? | M7: =CLOSURE("error04",NA()) -> #NAME?
A8: =apply(RC13,R3C) -> #NAME? | B8: =apply(RC13,R3C) -> #NAME? | C8: =apply(RC13,R3C) -> #NAME? | D8: =apply(RC13,R3C) -> #NAME? | E8: =apply(RC13,R3C) -> #NAME? | F8: =apply(RC13,R3C) -> #NAME? | G8: =apply(RC13,R3C) -> #NAME? | H8: =apply(RC13,R3C) -> #NAME? | J8: 1 | K8: =IF(AND(RC[-1],RAND()),11,22)*0 -> 0 | L8: =DEFINE("error05",RC[-1],RC[-2]) -> #NAME? | M8: =CLOSURE("error05",NA()) -> #NAME?
A9: =apply(RC13,R3C) -> #NAME? | B9: =apply(RC13,R3C) -> #NAME? | C9: =apply(RC13,R3C) -> #NAME? | D9: =apply(RC13,R3C) -> #NAME? | E9: =apply(RC13,R3C) -> #NAME? | F9: =apply(RC13,R3C) -> #NAME? | G9: =apply(RC13,R3C) -> #NAME? | H9: =apply(RC13,R3C) -> #NAME? | J9: 1 | K9: =IF(OR(RC[-1],RAND()),11,22)*0 -> 0 | L9: =DEFINE("error06",RC[-1],RC[-2]) -> #NAME? | M9: =CLOSURE("error06",NA()) -> #NAME?
A10: =apply(RC13,R3C) -> #NAME? | B10: =apply(RC13,R3C) -> #NAME? | C10: =apply(RC13,R3C) -> #NAME? | D10: =apply(RC13,R3C) -> #NAME? | E10: =apply(RC13,R3C) -> #NAME? | F10: =apply(RC13,R3C) -> #NAME? | G10: =apply(RC13,R3C) -> #NAME? | H10: =apply(RC13,R3C) -> #NAME? | J10: 1 | K10: =IF(RC[-1]=0,11,22)*0 -> 0 | L10: =DEFINE("error07",RC[-1],RC[-2]) -> #NAME? | M10: =CLOSURE("error07",NA()) -> #NAME?
A11: =apply(RC13,R3C) -> #NAME? | B11: =apply(RC13,R3C) -> #NAME? | C11: =apply(RC13,R3C) -> #NAME? | D11: =apply(RC13,R3C) -> #NAME? | E11: =apply(RC13,R3C) -> #NAME? | F11: =apply(RC13,R3C) -> #NAME? | G11: =apply(RC13,R3C) -> #NAME? | H11: =apply(RC13,R3C) -> #NAME? | J11: 1 | K11: =IF(AND(RC[-1]=0,RAND()),11,22)*0 -> 0 | L11: =DEFINE("error08",RC[-1],RC[-2]) -> #NAME? | M11: =CLOSURE("error08",NA()) -> #NAME?
A12: =apply(RC13,R3C) -> #NAME? | B12: =apply(RC13,R3C) -> #NAME? | C12: =apply(RC13,R3C) -> #NAME? | D12: =apply(RC13,R3C) -> #NAME? | E12: =apply(RC13,R3C) -> #NAME? | F12: =apply(RC13,R3C) -> #NAME? | G12: =apply(RC13,R3C) -> #NAME? | H12: =apply(RC13,R3C) -> #NAME? | J12: 1 | K12: =IF(OR(RC[-1]=0,RAND()),11,22)*0 -> 0 | L12: =DEFINE("error09",RC[-1],RC[-2]) -> #NAME? | M12: =CLOSURE("error09",NA()) -> #NAME?
A13: =apply(RC13,R3C) -> #NAME? | B13: =apply(RC13,R3C) -> #NAME? | C13: =apply(RC13,R3C) -> #NAME? | D13: =apply(RC13,R3C) -> #NAME? | E13: =apply(RC13,R3C) -> #NAME? | F13: =apply(RC13,R3C) -> #NAME? | G13: =apply(RC13,R3C) -> #NAME? | H13: =apply(RC13,R3C) -> #NAME? | J13: 1 | K13: =COS(SIN(TAN(ACOS(ASIN(ATAN(RC[-1])))))) -> 0.89730001584059194 | L13: =DEFINE("error10",RC[-1],RC[-2]) -> #NAME? | M13: =CLOSURE("error10",NA()) -> #NAME?
A14: =apply(RC13,R3C) -> #NAME? | B14: =apply(RC13,R3C) -> #NAME? | C14: =apply(RC13,R3C) -> #NAME? | D14: =apply(RC13,R3C) -> #NAME? | E14: =apply(RC13,R3C) -> #NAME? | F14: =apply(RC13,R3C) -> #NAME? | G14: =apply(RC13,R3C) -> #NAME? | H14: =apply(RC13,R3C) -> #NAME? | J14: 1 | K14: =ABS(LOG(LOG10(EXP(SQRT(RC[-1]))))) -> 0.36221568869946325 | L14: =DEFINE("error11",RC[-1],RC[-2]) -> #NAME? | M14: =CLOSURE("error11",NA()) -> #NAME?
A15: =apply(RC13,R3C) -> #NAME? | B15: =apply(RC13,R3C) -> #NAME? | C15: =apply(RC13,R3C) -> #NAME? | D15: =apply(RC13,R3C) -> #NAME? | E15: =apply(RC13,R3C) -> #NAME? | F15: =apply(RC13,R3C) -> #NAME? | G15: =apply(RC13,R3C) -> #NAME? | H15: =apply(RC13,R3C) -> #NAME? | J15: 1 | K15: =1+2-3*4/RC[-1]<78 -> 1 | L15: =DEFINE("error12",RC[-1],RC[-2]) -> #NAME? | M15: =CLOSURE("error12",NA()) -> #NAME?
A16: =apply(RC13,R3C) -> #NAME? | B16: =apply(RC13,R3C) -> #NAME? | C16: =apply(RC13,R3C) -> #NAME? | D16: =apply(RC13,R3C) -> #NAME? | E16: =apply(RC13,R3C) -> #NAME? | F16: =apply(RC13,R3C) -> #NAME? | G16: =apply(RC13,R3C) -> #NAME? | H16: =apply(RC13,R3C) -> #NAME? | J16: 1 | K16: =RC[-1]^3.1 -> 1 | L16: =DEFINE("error13",RC[-1],RC[-2]) -> #NAME? | M16: =CLOSURE("error13",NA()) -> #NAME?
A18: =ISERROR(R3C) -> 1 | B18: =ISERROR(R3C) -> 1 | C18: =ISERROR(R3C) -> 1 | D18: =ISERROR(R3C) -> 1 | E18: =ISERROR(R3C) -> 1 | F18: =ISERROR(R3C) -> 1 | G18: =ISERROR(R3C) -> 1 | H18: =ISERROR(R3C) -> 1 | I18: =ISERROR(23) -> 0 | J18: =ISERROR(Data!R[-17]C[-9]:R[-16]C[-9]) -> 1 | K18: =ISERROR(CLOSURE("ndie",NA())) -> 1 | L18: =AND(AND(RC[-11],RC[-10],RC[-9],RC[-8],RC[-7],RC[-6],RC[-4]),NOT(OR(RC[-3],RC[-2],RC[-1]))) -> 0 | M18: =DEFINE("testiserror",RC[-1]) -> #NAME?

Sheet: @Lookup
A1: Excel-style lookup functions implemented as sheet-defined functions
A3: =DEFINE("matchcolaux",R[8]C[1],R[1]C[1],R[2]C[1],R[3]C[1],R[4]C[1]) -> #NAME? | B3: MATCHCOLAUX(x, arr, a, b)
A4: x =
A5: arr =
A6: a =
A7: b =
A8: m = | B8: =CEILING((R[-2]C+R[-1]C)/2, 1) -> 0
B9: =matchcolaux(R[-5]C,R[-4]C,R[-1]C,R[-2]C) -> #NAME?
B10: =matchcolaux(R[-6]C,R[-5]C,R[-4]C,R[-2]C-1) -> #NAME?
A11: result = | B11: =IF(R[-5]C>R[-4]C,NA(), IF(INDEX(R[-6]C,1,R[-4]C)<=R[-7]C, R[-4]C, IF(INDEX(R[-6]C,1, R[-3]C)<=R[-7]C, R[-2]C,R[-1]C))) -> 0
A13: =DEFINE("matchrowaux",R[6]C[1],R[1]C[1],R[2]C[1],R[3]C[1],R[4]C[1]) -> #NAME? | B13: MATCHROWAUX(x, arr, a, b)
A14: x =
A15: arr =
A16: a =
A17: b =
A18: m = | B18: =CEILING((R[-2]C+R[-1]C)/2, 1) -> 0
A19: result = | B19: =IF(R[-3]C>R[-2]C,NA(), IF(INDEX(R[-4]C,R[-2]C,1)<=R[-5]C, R[-2]C, IF(INDEX(R[-4]C,R[-1]C,1)<=R[-5]C, matchrowaux(R[-5]C,R[-4]C,R[-1]C,R[-2]C),matchrowaux(R[-5]C,R[-4]C,R[-3]C,R[-1]C-1)))) -> 0
A21: =DEFINE("match",R[3]C[1],R[1]C[1],R[2]C[1]) -> #NAME? | B21: MATCH(x,arr)
A22: x =
A23: arr =
A24: result = | B24: =IF(ROWS(R[-1]C)=1,matchcolaux(R[-2]C,R[-1]C,1,COLUMNS(R[-1]C)), matchrowaux(R[-2]C,R[-1]C,1,ROWS(R[-1]C))) -> #NAME?
A26: =DEFINE("hlookup",R[4]C[1],R[1]C[1],R[2]C[1],R[3]C[1]) -> #NAME? | B26: HLOOKUP(x, arr, r)
A27: x =
A28: arr =
A29: r =
A30: result = | B30: =INDEX(R[-2]C, R[-1]C, matchcolaux(R[-3]C, R[-2]C, 1, COLUMNS(R[-2]C))) -> #NAME?
A32: =DEFINE("vlookup",R[4]C[1],R[1]C[1],R[2]C[1],R[3]C[1]) -> #NAME? | B32: VLOOKUP(x, arr, r)
A33: x =
A34: arr =
A35: c =
A36: result = | B36: =INDEX(R[-2]C, matchrowaux(R[-3]C, R[-2]C, 1, ROWS(R[-2]C)), R[-1]C) -> #NAME?
A38: =DEFINE("interpolaterow",R[8]C[1],R[1]C[1],R[2]C[1],R[3]C[1]) -> #NAME? | B38: INTERPOLATEROW(ts,xs,t) | D38: Linear interpolation in two row vectors
A39: ts = | B39: =hcat(1,10,100) -> #NAME?
A40: xs = | B40: =hcat(3,30,300) -> #NAME?
A41: t = | B41: 5
A42: max i st ts(i)<=t | B42: =MATCH(R[-1]C,R[-3]C) -> #N/A
A43: ts(i+1) = | B43: =INDEX(R[-4]C,1,R[-1]C+1) -> #N/A
A44: ts(i) = | B44: =INDEX(R[-5]C,1,R[-2]C) -> #N/A
A45: interpolate | B45: =(INDEX(R[-5]C,1,R[-3]C)*(R[-2]C-R[-4]C)+INDEX(R[-5]C,1,R[-3]C+1)*(R[-4]C-R[-1]C))/(R[-2]C-R[-1]C) -> #N/A
B46: =IF(R[-5]C<=INDEX(R[-7]C,1,1), INDEX(R[-6]C,1,1), IF(R[-4]C=COLUMNS(R[-7]C),INDEX(R[-6]C,1,R[-4]C),R[-1]C)) -> #NAME?

Sheet: @Lambda
A1: Experiments with higher-order functions | E1: 2009-04-01
A3: =DEFINE("selfaux",R[4]C[1],R[1]C[1],R[2]C[1],R[3]C[1]) -> #NAME? | B3: SELFAUX(h,a,x), helper for self-application
A4: h =
A5: x =
A6: a =
B7: =apply(apply(R[-3]C,apply(R[-2]C,R[-2]C)),R[-1]C) -> #NAME?
A9: =DEFINE("self",R[3]C[1],R[1]C[1],R[2]C[1]) -> #NAME? | B9: SELF(h,x), a unit of self-application
A10: h =
A11: x =
B12: =CLOSURE("selfaux", R[-2]C,R[-1]C,NA()) -> #NAME?
A14: =DEFINE("yv", R[3]C[1],R[1]C[1]) -> #NAME? | B14: YV(h), a Y combinator for CBV
A15: h =
A16: SELF(h) = | B16: =CLOSURE("self",R[-1]C,NA()) -> #NAME?
B17: =apply(R[-1]C,R[-1]C) -> #NAME?
A19: =DEFINE("facbaseaux", R[3]C[1],R[1]C[1],R[2]C[1]) -> #NAME? | B19: FACBASEAUX(f, n), non-recursive factorial (on numbers)
A20: f =
A21: n =
B22: =IF(R[-1]C=0,1,R[-1]C*apply(R[-2]C,R[-1]C-1)) -> 1
A24: =DEFINE("facbase", R[2]C[1],R[1]C[1]) -> #NAME? | B24: FACBASE(f, n), non-recursive factorial (on numbers)
A25: f =
B26: =CLOSURE("facbaseaux",R[-1]C,NA()) -> #NAME?
A28: =DEFINE("yfac",R[2]C[1],R[1]C[1]) -> #NAME? | B28: YFAC(n), factorial in terms of YV
A29: n =
B30: =apply(YV(CLOSURE("facbase",NA())), R[-1]C) -> #NAME?
A32: =DEFINE("car", R[2]C[1],R[1]C[1]) -> #NAME? | B32: CAR
A33: xs =
B34: =INDEX(R[-1]C,1,1) -> 0
A36: =DEFINE("cdr", R[2]C[1],R[1]C[1]) -> #NAME? | B36: CDR
A37: xs =
B38: =INDEX(R[-1]C,1,2) -> #REF!
A40: =DEFINE("cons",R[3]C[1],R[1]C[1],R[2]C[1]) -> #NAME? | B40: CONS
A41: car =
A42: cdr =
B43: =harray(R[-2]C,R[-1]C) -> #NAME?
A45: =DEFINE("atomp",R[2]C[1],R[1]C[1]) -> #NAME? | B45: ATOMP
A46: xs =
B47: =NOT(isarray(R[-1]C)) -> #NAME?
A49: =DEFINE("makelist",R[2]C[1],R[1]C[1]) -> #NAME? | B49: MAKELIST(n)
A50: n =
B51: =IF(R[-1]C=0,42,cons(R[-1]C,makelist(R[-1]C-1))) -> 42
A53: =DEFINE("length",R[2]C[1],R[1]C[1]) -> #NAME? | B53: LENGTH(xs)
A54: xs =
B55: =IF(atomp(R[-1]C), 0, 1 + length(cdr(R[-1]C))) -> #NAME?

Sheet: @Sampling
A1: Sampling plan evaluation | C1: 2009-05-20
A2: van Schothost, Zwietering, Ross, Buchanan, Cole: Food Control 2009
A4: =DEFINE("poissonlognormal1",R[5]C[3],R[1]C[1],R[2]C[1],R[3]C[1]) -> #NAME? | B4: POISSONLOGNORMAL1(mean,sigma,sample)
A5: mean = | B5: -2
A6: sigma = | B6: 0.8
A7: sample = | B7: 100
A9: logc | D9: =SUM(R[11]C[1],R[21]C[1],R[31]C[1],R[41]C[1],R[51]C[1],R[61]C[1],R[71]C[1],R[81]C[1],R[91]C[1],R[101]C[1],R[102]C[1])*0.2 -> #NAME?
A10: -10 | B10: pnormal | C10: npersample | D10: p
A11: =R[-1]C+0.2 -> -9.8000000000000007 | B11: =normdensity(R[-1]C[-1]) -> #NAME? | C11: =10^(R[-1]C[-2]*R6C2+R5C2)*R7C2 -> 1E-8 | D11: =RC[-2]*(1-EXP(-RC[-1])) -> #NAME?
A12: =R[-1]C+0.2 -> -9.6000000000000014 | B12: =normdensity(R[-1]C[-1]) -> #NAME? | C12: =10^(R[-1]C[-2]*R6C2+R5C2)*R7C2 -> 1.4454397707459248E-8 | D12: =RC[-2]*(1-EXP(-RC[-1])) -> #NAME?
A13: =R[-1]C+0.2 -> -9.4000000000000021 | B13: =normdensity(R[-1]C[-1]) -> #NAME? | C13: =10^(R[-1]C[-2]*R6C2+R5C2)*R7C2 -> 2.0892961308540249E-8 | D13: =RC[-2]*(1-EXP(-RC[-1])) -> #NAME?
A14: =R[-1]C+0.2 -> -9.2000000000000028 | B14: =normdensity(R[-1]C[-1]) -> #NAME? | C14: =10^(R[-1]C[-2]*R6C2+R5C2)*R7C2 -> 3.0199517204019903E-8 | D14: =RC[-2]*(1-EXP(-RC[-1])) -> #NAME?
A15: =R[-1]C+0.2 -> -9.0000000000000036 | B15: =normdensity(R[-1]C[-1]) -> #NAME? | C15: =10^(R[-1]C[-2]*R6C2+R5C2)*R7C2 -> 4.3651583224016156E-8 | D15: =RC[-2]*(1-EXP(-RC[-1])) -> #NAME?
A16: =R[-1]C+0.2 -> -8.8000000000000043 | B16: =normdensity(R[-1]C[-1]) -> #NAME? | C16: =10^(R[-1]C[-2]*R6C2+R5C2)*R7C2 -> 6.309573444801882E-8 | D16: =RC[-2]*(1-EXP(-RC[-1])) -> #NAME?
A17: =R[-1]C+0.2 -> -8.600000000000005 | B17: =normdensity(R[-1]C[-1]) -> #NAME? | C17: =10^(R[-1]C[-2]*R6C2+R5C2)*R7C2 -> 9.1201083935590103E-8 | D17: =RC[-2]*(1-EXP(-RC[-1])) -> #NAME?
A18: =R[-1]C+0.2 -> -8.4000000000000057 | B18: =normdensity(R[-1]C[-1]) -> #NAME? | C18: =10^(R[-1]C[-2]*R6C2+R5C2)*R7C2 -> 1.3182567385563926E-7 | D18: =RC[-2]*(1-EXP(-RC[-1])) -> #NAME?
A19: =R[-1]C+0.2 -> -8.2000000000000064 | B19: =normdensity(R[-1]C[-1]) -> #NAME? | C19: =10^(R[-1]C[-2]*R6C2+R5C2)*R7C2 -> 1.9054607179632162E-7 | D19: =RC[-2]*(1-EXP(-RC[-1])) -> #NAME?
A20: =R[-1]C+0.2 -> -8.0000000000000071 | B20: =normdensity(R[-1]C[-1]) -> #NAME? | C20: =10^(R[-1]C[-2]*R6C2+R5C2)*R7C2 -> 2.7542287033381272E-7 | D20: =RC[-2]*(1-EXP(-RC[-1])) -> #NAME? | E20: =SUM(R[-9]C[-1],R[-8]C[-1],R[-7]C[-1],R[-6]C[-1],R[-5]C[-1],R[-4]C[-1],R[-3]C[-1],R[-2]C[-1],R[-1]C[-1],RC[-1]) -> #NAME?
A21: =R[-1]C+0.2 -> -7.8000000000000069 | B21: =normdensity(R[-1]C[-1]) -> #NAME? | C21: =10^(R[-1]C[-2]*R6C2+R5C2)*R7C2 -> 3.9810717055349105E-7 | D21: =RC[-2]*(1-EXP(-RC[-1])) -> #NAME?
A22: =R[-1]C+0.2 -> -7.6000000000000068 | B22: =normdensity(R[-1]C[-1]) -> #NAME? | C22: =10^(R[-1]C[-2]*R6C2+R5C2)*R7C2 -> 5.7543993733714903E-7 | D22: =RC[-2]*(1-EXP(-RC[-1])) -> #NAME?
A23: =R[-1]C+0.2 -> -7.4000000000000066 | B23: =normdensity(R[-1]C[-1]) -> #NAME? | C23: =10^(R[-1]C[-2]*R6C2+R5C2)*R7C2 -> 8.3176377110265827E-7 | D23: =RC[-2]*(1-EXP(-RC[-1])) -> #NAME?
A24: =R[-1]C+0.2 -> -7.2000000000000064 | B24: =normdensity(R[-1]C[-1]) -> #NAME? | C24: =10^(R[-1]C[-2]*R6C2+R5C2)*R7C2 -> 1.2022644346173971E-6 | D24: =RC[-2]*(1-EXP(-RC[-1])) -> #NAME?
A25: =R[-1]C+0.2 -> -7.0000000000000062 | B25: =normdensity(R[-1]C[-1]) -> #NAME? | C25: =10^(R[-1]C[-2]*R6C2+R5C2)*R7C2 -> 1.7378008287493499E-6 | D25: =RC[-2]*(1-EXP(-RC[-1])) -> #NAME?
A26: =R[-1]C+0.2 -> -6.800000000000006 | B26: =normdensity(R[-1]C[-1]) -> #NAME? | C26: =10^(R[-1]C[-2]*R6C2+R5C2)*R7C2 -> 2.5118864315095484E-6 | D26: =RC[-2]*(1-EXP(-RC[-1])) -> #NAME?
A27: =R[-1]C+0.2 -> -6.6000000000000059 | B27: =normdensity(R[-1]C[-1]) -> #NAME? | C27: =10^(R[-1]C[-2]*R6C2+R5C2)*R7C2 -> 3.630780547700962E-6 | D27: =RC[-2]*(1-EXP(-RC[-1])) -> #NAME?
A28: =R[-1]C+0.2 -> -6.4000000000000057 | B28: =normdensity(R[-1]C[-1]) -> #NAME? | C28: =10^(R[-1]C[-2]*R6C2+R5C2)*R7C2 -> 5.2480746024976613E-6 | D28: =RC[-2]*(1-EXP(-RC[-1])) -> #NAME?
A29: =R[-1]C+0.2 -> -6.2000000000000055 | B29: =normdensity(R[-1]C[-1]) -> #NAME? | C29: =10^(R[-1]C[-2]*R6C2+R5C2)*R7C2 -> 7.585775750291734E-6 | D29: =RC[-2]*(1-EXP(-RC[-1])) -> #NAME?
A30: =R[-1]C+0.2 -> -6.0000000000000053 | B30: =normdensity(R[-1]C[-1]) -> #NAME? | C30: =10^(R[-1]C[-2]*R6C2+R5C2)*R7C2 -> 1.0964781961431721E-5 | D30: =RC[-2]*(1-EXP(-RC[-1])) -> #NAME? | E30: =SUM(R[-9]C[-1],R[-8]C[-1],R[-7]C[-1],R[-6]C[-1],R[-5]C[-1],R[-4]C[-1],R[-3]C[-1],R[-2]C[-1],R[-1]C[-1],RC[-1]) -> #NAME?
A31: =R[-1]C+0.2 -> -5.8000000000000052 | B31: =normdensity(R[-1]C[-1]) -> #NAME? | C31: =10^(R[-1]C[-2]*R6C2+R5C2)*R7C2 -> 1.5848931924610951E-5 | D31: =RC[-2]*(1-EXP(-RC[-1])) -> #NAME?
A32: =R[-1]C+0.2 -> -5.600000000000005 | B32: =normdensity(R[-1]C[-1]) -> #NAME? | C32: =10^(R[-1]C[-2]*R6C2+R5C2)*R7C2 -> 2.2908676527677471E-5 | D32: =RC[-2]*(1-EXP(-RC[-1])) -> #NAME?
A33: =R[-1]C+0.2 -> -5.4000000000000048 | B33: =normdensity(R[-1]C[-1]) -> #NAME? | C33: =10^(R[-1]C[-2]*R6C2+R5C2)*R7C2 -> 3.3113112148258744E-5 | D33: =RC[-2]*(1-EXP(-RC[-1])) -> #NAME?
A34: =R[-1]C+0.2 -> -5.2000000000000046 | B34: =normdensity(R[-1]C[-1]) -> #NAME? | C34: =10^(R[-1]C[-2]*R6C2+R5C2)*R7C2 -> 4.7863009232263322E-5 | D34: =RC[-2]*(1-EXP(-RC[-1])) -> #NAME?
A35: =R[-1]C+0.2 -> -5.0000000000000044 | B35: =normdensity(R[-1]C[-1]) -> #NAME? | C35: =10^(R[-1]C[-2]*R6C2+R5C2)*R7C2 -> 6.9183097091892934E-5 | D35: =RC[-2]*(1-EXP(-RC[-1])) -> #NAME?
A36: =R[-1]C+0.2 -> -4.8000000000000043 | B36: =normdensity(R[-1]C[-1]) -> #NAME? | C36: =10^(R[-1]C[-2]*R6C2+R5C2)*R7C2 -> 9.9999999999998975E-5 | D36: =RC[-2]*(1-EXP(-RC[-1])) -> #NAME?
A37: =R[-1]C+0.2 -> -4.6000000000000041 | B37: =normdensity(R[-1]C[-1]) -> #NAME? | C37: =10^(R[-1]C[-2]*R6C2+R5C2)*R7C2 -> 1.4454397707459131E-4 | D37: =RC[-2]*(1-EXP(-RC[-1])) -> #NAME?
A38: =R[-1]C+0.2 -> -4.4000000000000039 | B38: =normdensity(R[-1]C[-1]) -> #NAME? | C38: =10^(R[-1]C[-2]*R6C2+R5C2)*R7C2 -> 2.0892961308540227E-4 | D38: =RC[-2]*(1-EXP(-RC[-1])) -> #NAME?
A39: =R[-1]C+0.2 -> -4.2000000000000037 | B39: =normdensity(R[-1]C[-1]) -> #NAME? | C39: =10^(R[-1]C[-2]*R6C2+R5C2)*R7C2 -> 3.019951720401993E-4 | D39: =RC[-2]*(1-EXP(-RC[-1])) -> #NAME?
A40: =R[-1]C+0.2 -> -4.0000000000000036 | B40: =normdensity(R[-1]C[-1]) -> #NAME? | C40: =10^(R[-1]C[-2]*R6C2+R5C2)*R7C2 -> 4.3651583224016269E-4 | D40: =RC[-2]*(1-EXP(-RC[-1])) -> #NAME? | E40: =SUM(R[-9]C[-1],R[-8]C[-1],R[-7]C[-1],R[-6]C[-1],R[-5]C[-1],R[-4]C[-1],R[-3]C[-1],R[-2]C[-1],R[-1]C[-1],RC[-1]) -> #NAME?
A41: =R[-1]C+0.2 -> -3.8000000000000034 | B41: =normdensity(R[-1]C[-1]) -> #NAME? | C41: =10^(R[-1]C[-2]*R6C2+R5C2)*R7C2 -> 6.3095734448018876E-4 | D41: =RC[-2]*(1-EXP(-RC[-1])) -> #NAME?
A42: =R[-1]C+0.2 -> -3.6000000000000032 | B42: =normdensity(R[-1]C[-1]) -> #NAME? | C42: =10^(R[-1]C[-2]*R6C2+R5C2)*R7C2 -> 9.1201083935590335E-4 | D42: =RC[-2]*(1-EXP(-RC[-1])) -> #NAME?
A43: =R[-1]C+0.2 -> -3.400000000000003 | B43: =normdensity(R[-1]C[-1]) -> #NAME? | C43: =10^(R[-1]C[-2]*R6C2+R5C2)*R7C2 -> 1.3182567385563982E-3 | D43: =RC[-2]*(1-EXP(-RC[-1])) -> #NAME?
A44: =R[-1]C+0.2 -> -3.2000000000000028 | B44: =normdensity(R[-1]C[-1]) -> #NAME? | C44: =10^(R[-1]C[-2]*R6C2+R5C2)*R7C2 -> 1.9054607179632348E-3 | D44: =RC[-2]*(1-EXP(-RC[-1])) -> #NAME?
A45: =R[-1]C+0.2 -> -3.0000000000000027 | B45: =normdensity(R[-1]C[-1]) -> #NAME? | C45: =10^(R[-1]C[-2]*R6C2+R5C2)*R7C2 -> 2.7542287033381499E-3 | D45: =RC[-2]*(1-EXP(-RC[-1])) -> #NAME?
A46: =R[-1]C+0.2 -> -2.8000000000000025 | B46: =normdensity(R[-1]C[-1]) -> #NAME? | C46: =10^(R[-1]C[-2]*R6C2+R5C2)*R7C2 -> 3.9810717055349491E-3 | D46: =RC[-2]*(1-EXP(-RC[-1])) -> #NAME?
A47: =R[-1]C+0.2 -> -2.6000000000000023 | B47: =normdensity(R[-1]C[-1]) -> #NAME? | C47: =10^(R[-1]C[-2]*R6C2+R5C2)*R7C2 -> 5.7543993733715363E-3 | D47: =RC[-2]*(1-EXP(-RC[-1])) -> #NAME?
A48: =R[-1]C+0.2 -> -2.4000000000000021 | B48: =normdensity(R[-1]C[-1]) -> #NAME? | C48: =10^(R[-1]C[-2]*R6C2+R5C2)*R7C2 -> 8.3176377110266639E-3 | D48: =RC[-2]*(1-EXP(-RC[-1])) -> #NAME?
A49: =R[-1]C+0.2 -> -2.200000000000002 | B49: =normdensity(R[-1]C[-1]) -> #NAME? | C49: =10^(R[-1]C[-2]*R6C2+R5C2)*R7C2 -> 1.2022644346174068E-2 | D49: =RC[-2]*(1-EXP(-RC[-1])) -> #NAME?
A50: =R[-1]C+0.2 -> -2.0000000000000018 | B50: =normdensity(R[-1]C[-1]) -> #NAME? | C50: =10^(R[-1]C[-2]*R6C2+R5C2)*R7C2 -> 1.7378008287493668E-2 | D50: =RC[-2]*(1-EXP(-RC[-1])) -> #NAME? | E50: =SUM(R[-9]C[-1],R[-8]C[-1],R[-7]C[-1],R[-6]C[-1],R[-5]C[-1],R[-4]C[-1],R[-3]C[-1],R[-2]C[-1],R[-1]C[-1],RC[-1]) -> #NAME?
A51: =R[-1]C+0.2 -> -1.8000000000000018 | B51: =normdensity(R[-1]C[-1]) -> #NAME? | C51: =10^(R[-1]C[-2]*R6C2+R5C2)*R7C2 -> 2.5118864315095687E-2 | D51: =RC[-2]*(1-EXP(-RC[-1])) -> #NAME?
A52: =R[-1]C+0.2 -> -1.6000000000000019 | B52: =normdensity(R[-1]C[-1]) -> #NAME? | C52: =10^(R[-1]C[-2]*R6C2+R5C2)*R7C2 -> 3.6307805477010006E-2 | D52: =RC[-2]*(1-EXP(-RC[-1])) -> #NAME?
A53: =R[-1]C+0.2 -> -1.4000000000000019 | B53: =normdensity(R[-1]C[-1]) -> #NAME? | C53: =10^(R[-1]C[-2]*R6C2+R5C2)*R7C2 -> 5.2480746024977043E-2 | D53: =RC[-2]*(1-EXP(-RC[-1])) -> #NAME?
A54: =R[-1]C+0.2 -> -1.200000000000002 | B54: =normdensity(R[-1]C[-1]) -> #NAME? | C54: =10^(R[-1]C[-2]*R6C2+R5C2)*R7C2 -> 7.5857757502918011E-2 | D54: =RC[-2]*(1-EXP(-RC[-1])) -> #NAME?
A55: =R[-1]C+0.2 -> -1.000000000000002 | B55: =normdensity(R[-1]C[-1]) -> #NAME? | C55: =10^(R[-1]C[-2]*R6C2+R5C2)*R7C2 -> 0.10964781961431799 | D55: =RC[-2]*(1-EXP(-RC[-1])) -> #NAME?
A56: =R[-1]C+0.2 -> -0.80000000000000204 | B56: =normdensity(R[-1]C[-1]) -> #NAME? | C56: =10^(R[-1]C[-2]*R6C2+R5C2)*R7C2 -> 0.15848931924611068 | D56: =RC[-2]*(1-EXP(-RC[-1])) -> #NAME?
A57: =R[-1]C+0.2 -> -0.60000000000000209 | B57: =normdensity(R[-1]C[-1]) -> #NAME? | C57: =10^(R[-1]C[-2]*R6C2+R5C2)*R7C2 -> 0.22908676527677638 | D57: =RC[-2]*(1-EXP(-RC[-1])) -> #NAME?
A58: =R[-1]C+0.2 -> -0.40000000000000208 | B58: =normdensity(R[-1]C[-1]) -> #NAME? | C58: =10^(R[-1]C[-2]*R6C2+R5C2)*R7C2 -> 0.33113112148258955 | D58: =RC[-2]*(1-EXP(-RC[-1])) -> #NAME?
A59: =R[-1]C+0.2 -> -0.20000000000000207 | B59: =normdensity(R[-1]C[-1]) -> #NAME? | C59: =10^(R[-1]C[-2]*R6C2+R5C2)*R7C2 -> 0.4786300923226362 | D59: =RC[-2]*(1-EXP(-RC[-1])) -> #NAME?
A60: =R[-1]C+0.2 -> -2.0539125955565396E-15 | B60: =normdensity(R[-1]C[-1]) -> #NAME? | C60: =10^(R[-1]C[-2]*R6C2+R5C2)*R7C2 -> 0.69183097091893353 | D60: =RC[-2]*(1-EXP(-RC[-1])) -> #NAME? | E60: =SUM(R[-9]C[-1],R[-8]C[-1],R[-7]C[-1],R[-6]C[-1],R[-5]C[-1],R[-4]C[-1],R[-3]C[-1],R[-2]C[-1],R[-1]C[-1],RC[-1]) -> #NAME?
A61: =R[-1]C+0.2 -> 0.19999999999999796 | B61: =normdensity(R[-1]C[-1]) -> #NAME? | C61: =10^(R[-1]C[-2]*R6C2+R5C2)*R7C2 -> 0.99999999999999512 | D61: =RC[-2]*(1-EXP(-RC[-1])) -> #NAME?
A62: =R[-1]C+0.2 -> 0.39999999999999797 | B62: =normdensity(R[-1]C[-1]) -> #NAME? | C62: =10^(R[-1]C[-2]*R6C2+R5C2)*R7C2 -> 1.4454397707459221 | D62: =RC[-2]*(1-EXP(-RC[-1])) -> #NAME?
A63: =R[-1]C+0.2 -> 0.59999999999999798 | B63: =normdensity(R[-1]C[-1]) -> #NAME? | C63: =10^(R[-1]C[-2]*R6C2+R5C2)*R7C2 -> 2.0892961308540312 | D63: =RC[-2]*(1-EXP(-RC[-1])) -> #NAME?
A64: =R[-1]C+0.2 -> 0.79999999999999805 | B64: =normdensity(R[-1]C[-1]) -> #NAME? | C64: =10^(R[-1]C[-2]*R6C2+R5C2)*R7C2 -> 3.0199517204020037 | D64: =RC[-2]*(1-EXP(-RC[-1])) -> #NAME?
A65: =R[-1]C+0.2 -> 0.999999999999998 | B65: =normdensity(R[-1]C[-1]) -> #NAME? | C65: =10^(R[-1]C[-2]*R6C2+R5C2)*R7C2 -> 4.3651583224016424 | D65: =RC[-2]*(1-EXP(-RC[-1])) -> #NAME?
A66: =R[-1]C+0.2 -> 1.199999999999998 | B66: =normdensity(R[-1]C[-1]) -> #NAME? | C66: =10^(R[-1]C[-2]*R6C2+R5C2)*R7C2 -> 6.3095734448019094 | D66: =RC[-2]*(1-EXP(-RC[-1])) -> #NAME?
A67: =R[-1]C+0.2 -> 1.3999999999999979 | B67: =normdensity(R[-1]C[-1]) -> #NAME? | C67: =10^(R[-1]C[-2]*R6C2+R5C2)*R7C2 -> 9.1201083935590628 | D67: =RC[-2]*(1-EXP(-RC[-1])) -> #NAME?
A68: =R[-1]C+0.2 -> 1.5999999999999979 | B68: =normdensity(R[-1]C[-1]) -> #NAME? | C68: =10^(R[-1]C[-2]*R6C2+R5C2)*R7C2 -> 13.182567385564017 | D68: =RC[-2]*(1-EXP(-RC[-1])) -> #NAME?
A69: =R[-1]C+0.2 -> 1.7999999999999978 | B69: =normdensity(R[-1]C[-1]) -> #NAME? | C69: =10^(R[-1]C[-2]*R6C2+R5C2)*R7C2 -> 19.054607179632399 | D69: =RC[-2]*(1-EXP(-RC[-1])) -> #NAME?
A70: =R[-1]C+0.2 -> 1.9999999999999978 | B70: =normdensity(R[-1]C[-1]) -> #NAME? | C70: =10^(R[-1]C[-2]*R6C2+R5C2)*R7C2 -> 27.542287033381562 | D70: =RC[-2]*(1-EXP(-RC[-1])) -> #NAME? | E70: =SUM(R[-9]C[-1],R[-8]C[-1],R[-7]C[-1],R[-6]C[-1],R[-5]C[-1],R[-4]C[-1],R[-3]C[-1],R[-2]C[-1],R[-1]C[-1],RC[-1]) -> #NAME?
A71: =R[-1]C+0.2 -> 2.199999999999998 | B71: =normdensity(R[-1]C[-1]) -> #NAME? | C71: =10^(R[-1]C[-2]*R6C2+R5C2)*R7C2 -> 39.810717055349571 | D71: =RC[-2]*(1-EXP(-RC[-1])) -> #NAME?
A72: =R[-1]C+0.2 -> 2.3999999999999981 | B72: =normdensity(R[-1]C[-1]) -> #NAME? | C72: =10^(R[-1]C[-2]*R6C2+R5C2)*R7C2 -> 57.543993733715482 | D72: =RC[-2]*(1-EXP(-RC[-1])) -> #NAME?
A73: =R[-1]C+0.2 -> 2.5999999999999983 | B73: =normdensity(R[-1]C[-1]) -> #NAME? | C73: =10^(R[-1]C[-2]*R6C2+R5C2)*R7C2 -> 83.176377110266841 | D73: =RC[-2]*(1-EXP(-RC[-1])) -> #NAME?
A74: =R[-1]C+0.2 -> 2.7999999999999985 | B74: =normdensity(R[-1]C[-1]) -> #NAME? | C74: =10^(R[-1]C[-2]*R6C2+R5C2)*R7C2 -> 120.22644346174094 | D74: =RC[-2]*(1-EXP(-RC[-1])) -> #NAME?
A75: =R[-1]C+0.2 -> 2.9999999999999987 | B75: =normdensity(R[-1]C[-1]) -> #NAME? | C75: =10^(R[-1]C[-2]*R6C2+R5C2)*R7C2 -> 173.78008287493711 | D75: =RC[-2]*(1-EXP(-RC[-1])) -> #NAME?
A76: =R[-1]C+0.2 -> 3.1999999999999988 | B76: =normdensity(R[-1]C[-1]) -> #NAME? | C76: =10^(R[-1]C[-2]*R6C2+R5C2)*R7C2 -> 251.18864315095749 | D76: =RC[-2]*(1-EXP(-RC[-1])) -> #NAME?
A77: =R[-1]C+0.2 -> 3.399999999999999 | B77: =normdensity(R[-1]C[-1]) -> #NAME? | C77: =10^(R[-1]C[-2]*R6C2+R5C2)*R7C2 -> 363.07805477010066 | D77: =RC[-2]*(1-EXP(-RC[-1])) -> #NAME?
A78: =R[-1]C+0.2 -> 3.5999999999999992 | B78: =normdensity(R[-1]C[-1]) -> #NAME? | C78: =10^(R[-1]C[-2]*R6C2+R5C2)*R7C2 -> 524.80746024977179 | D78: =RC[-2]*(1-EXP(-RC[-1])) -> #NAME?
A79: =R[-1]C+0.2 -> 3.7999999999999994 | B79: =normdensity(R[-1]C[-1]) -> #NAME? | C79: =10^(R[-1]C[-2]*R6C2+R5C2)*R7C2 -> 758.57757502918309 | D79: =RC[-2]*(1-EXP(-RC[-1])) -> #NAME?
A80: =R[-1]C+0.2 -> 3.9999999999999996 | B80: =normdensity(R[-1]C[-1]) -> #NAME? | C80: =10^(R[-1]C[-2]*R6C2+R5C2)*R7C2 -> 1096.4781961431843 | D80: =RC[-2]*(1-EXP(-RC[-1])) -> #NAME? | E80: =SUM(R[-9]C[-1],R[-8]C[-1],R[-7]C[-1],R[-6]C[-1],R[-5]C[-1],R[-4]C[-1],R[-3]C[-1],R[-2]C[-1],R[-1]C[-1],RC[-1]) -> #NAME?
A81: =R[-1]C+0.2 -> 4.1999999999999993 | B81: =normdensity(R[-1]C[-1]) -> #NAME? | C81: =10^(R[-1]C[-2]*R6C2+R5C2)*R7C2 -> 1584.8931924611129 | D81: =RC[-2]*(1-EXP(-RC[-1])) -> #NAME?
A82: =R[-1]C+0.2 -> 4.3999999999999995 | B82: =normdensity(R[-1]C[-1]) -> #NAME? | C82: =10^(R[-1]C[-2]*R6C2+R5C2)*R7C2 -> 2290.8676527677708 | D82: =RC[-2]*(1-EXP(-RC[-1])) -> #NAME?
A83: =R[-1]C+0.2 -> 4.5999999999999996 | B83: =normdensity(R[-1]C[-1]) -> #NAME? | C83: =10^(R[-1]C[-2]*R6C2+R5C2)*R7C2 -> 3311.3112148259083 | D83: =RC[-2]*(1-EXP(-RC[-1])) -> #NAME?
A84: =R[-1]C+0.2 -> 4.8 | B84: =normdensity(R[-1]C[-1]) -> #NAME? | C84: =10^(R[-1]C[-2]*R6C2+R5C2)*R7C2 -> 4786.3009232263812 | D84: =RC[-2]*(1-EXP(-RC[-1])) -> #NAME?
A85: =R[-1]C+0.2 -> 5 | B85: =normdensity(R[-1]C[-1]) -> #NAME? | C85: =10^(R[-1]C[-2]*R6C2+R5C2)*R7C2 -> 6918.309709189366 | D85: =RC[-2]*(1-EXP(-RC[-1])) -> #NAME?
A86: =R[-1]C+0.2 -> 5.2 | B86: =normdensity(R[-1]C[-1]) -> #NAME? | C86: =10^(R[-1]C[-2]*R6C2+R5C2)*R7C2 -> 10000 | D86: =RC[-2]*(1-EXP(-RC[-1])) -> #NAME?
A87: =R[-1]C+0.2 -> 5.4 | B87: =normdensity(R[-1]C[-1]) -> #NAME? | C87: =10^(R[-1]C[-2]*R6C2+R5C2)*R7C2 -> 14454.397707459284 | D87: =RC[-2]*(1-EXP(-RC[-1])) -> #NAME?
A88: =R[-1]C+0.2 -> 5.6000000000000005 | B88: =normdensity(R[-1]C[-1]) -> #NAME? | C88: =10^(R[-1]C[-2]*R6C2+R5C2)*R7C2 -> 20892.961308540416 | D88: =RC[-2]*(1-EXP(-RC[-1])) -> #NAME?
A89: =R[-1]C+0.2 -> 5.8000000000000007 | B89: =normdensity(R[-1]C[-1]) -> #NAME? | C89: =10^(R[-1]C[-2]*R6C2+R5C2)*R7C2 -> 30199.517204020198 | D89: =RC[-2]*(1-EXP(-RC[-1])) -> #NAME?
A90: =R[-1]C+0.2 -> 6.0000000000000009 | B90: =normdensity(R[-1]C[-1]) -> #NAME? | C90: =10^(R[-1]C[-2]*R6C2+R5C2)*R7C2 -> 43651.583224016693 | D90: =RC[-2]*(1-EXP(-RC[-1])) -> #NAME? | E90: =SUM(R[-9]C[-1],R[-8]C[-1],R[-7]C[-1],R[-6]C[-1],R[-5]C[-1],R[-4]C[-1],R[-3]C[-1],R[-2]C[-1],R[-1]C[-1],RC[-1]) -> #NAME?
A91: =R[-1]C+0.2 -> 6.2000000000000011 | B91: =normdensity(R[-1]C[-1]) -> #NAME? | C91: =10^(R[-1]C[-2]*R6C2+R5C2)*R7C2 -> 63095.734448019481 | D91: =RC[-2]*(1-EXP(-RC[-1])) -> #NAME?
A92: =R[-1]C+0.2 -> 6.4000000000000012 | B92: =normdensity(R[-1]C[-1]) -> #NAME? | C92: =10^(R[-1]C[-2]*R6C2+R5C2)*R7C2 -> 91201.083935591232 | D92: =RC[-2]*(1-EXP(-RC[-1])) -> #NAME?
A93: =R[-1]C+0.2 -> 6.6000000000000014 | B93: =normdensity(R[-1]C[-1]) -> #NAME? | C93: =10^(R[-1]C[-2]*R6C2+R5C2)*R7C2 -> 131825.67385564113 | D93: =RC[-2]*(1-EXP(-RC[-1])) -> #NAME?
A94: =R[-1]C+0.2 -> 6.8000000000000016 | B94: =normdensity(R[-1]C[-1]) -> #NAME? | C94: =10^(R[-1]C[-2]*R6C2+R5C2)*R7C2 -> 190546.07179632536 | D94: =RC[-2]*(1-EXP(-RC[-1])) -> #NAME?
A95: =R[-1]C+0.2 -> 7.0000000000000018 | B95: =normdensity(R[-1]C[-1]) -> #NAME? | C95: =10^(R[-1]C[-2]*R6C2+R5C2)*R7C2 -> 275422.87033381761 | D95: =RC[-2]*(1-EXP(-RC[-1])) -> #NAME?
A96: =R[-1]C+0.2 -> 7.200000000000002 | B96: =normdensity(R[-1]C[-1]) -> #NAME? | C96: =10^(R[-1]C[-2]*R6C2+R5C2)*R7C2 -> 398107.17055349908 | D96: =RC[-2]*(1-EXP(-RC[-1])) -> #NAME?
A97: =R[-1]C+0.2 -> 7.4000000000000021 | B97: =normdensity(R[-1]C[-1]) -> #NAME? | C97: =10^(R[-1]C[-2]*R6C2+R5C2)*R7C2 -> 575439.93733715976 | D97: =RC[-2]*(1-EXP(-RC[-1])) -> #NAME?
A98: =R[-1]C+0.2 -> 7.6000000000000023 | B98: =normdensity(R[-1]C[-1]) -> #NAME? | C98: =10^(R[-1]C[-2]*R6C2+R5C2)*R7C2 -> 831763.77110267535 | D98: =RC[-2]*(1-EXP(-RC[-1])) -> #NAME?
A99: =R[-1]C+0.2 -> 7.8000000000000025 | B99: =normdensity(R[-1]C[-1]) -> #NAME? | C99: =10^(R[-1]C[-2]*R6C2+R5C2)*R7C2 -> 1202264.4346174195 | D99: =RC[-2]*(1-EXP(-RC[-1])) -> #NAME?
A100: =R[-1]C+0.2 -> 8.0000000000000018 | B100: =normdensity(R[-1]C[-1]) -> #NAME? | C100: =10^(R[-1]C[-2]*R6C2+R5C2)*R7C2 -> 1737800.8287493852 | D100: =RC[-2]*(1-EXP(-RC[-1])) -> #NAME? | E100: =SUM(R[-9]C[-1],R[-8]C[-1],R[-7]C[-1],R[-6]C[-1],R[-5]C[-1],R[-4]C[-1],R[-3]C[-1],R[-2]C[-1],R[-1]C[-1],RC[-1]) -> #NAME?
A101: =R[-1]C+0.2 -> 8.2000000000000011 | B101: =normdensity(R[-1]C[-1]) -> #NAME? | C101: =10^(R[-1]C[-2]*R6C2+R5C2)*R7C2 -> 2511886.4315095949 | D101: =RC[-2]*(1-EXP(-RC[-1])) -> #NAME?
A102: =R[-1]C+0.2 -> 8.4 | B102: =normdensity(R[-1]C[-1]) -> #NAME? | C102: =10^(R[-1]C[-2]*R6C2+R5C2)*R7C2 -> 3630780.5477010296 | D102: =RC[-2]*(1-EXP(-RC[-1])) -> #NAME?
A103: =R[-1]C+0.2 -> 8.6 | B103: =normdensity(R[-1]C[-1]) -> #NAME? | C103: =10^(R[-1]C[-2]*R6C2+R5C2)*R7C2 -> 5248074.6024977406 | D103: =RC[-2]*(1-EXP(-RC[-1])) -> #NAME?
A104: =R[-1]C+0.2 -> 8.7999999999999989 | B104: =normdensity(R[-1]C[-1]) -> #NAME? | C104: =10^(R[-1]C[-2]*R6C2+R5C2)*R7C2 -> 7585775.7502918486 | D104: =RC[-2]*(1-EXP(-RC[-1])) -> #NAME?
A105: =R[-1]C+0.2 -> 8.9999999999999982 | B105: =normdensity(R[-1]C[-1]) -> #NAME? | C105: =10^(R[-1]C[-2]*R6C2+R5C2)*R7C2 -> 10964781.961431848 | D105: =RC[-2]*(1-EXP(-RC[-1])) -> #NAME?
A106: =R[-1]C+0.2 -> 9.1999999999999975 | B106: =normdensity(R[-1]C[-1]) -> #NAME? | C106: =10^(R[-1]C[-2]*R6C2+R5C2)*R7C2 -> 15848931.924611134 | D106: =RC[-2]*(1-EXP(-RC[-1])) -> #NAME?
A107: =R[-1]C+0.2 -> 9.3999999999999968 | B107: =normdensity(R[-1]C[-1]) -> #NAME? | C107: =10^(R[-1]C[-2]*R6C2+R5C2)*R7C2 -> 22908676.527677696 | D107: =RC[-2]*(1-EXP(-RC[-1])) -> #NAME?
A108: =R[-1]C+0.2 -> 9.5999999999999961 | B108: =normdensity(R[-1]C[-1]) -> #NAME? | C108: =10^(R[-1]C[-2]*R6C2+R5C2)*R7C2 -> 33113112.14825901 | D108: =RC[-2]*(1-EXP(-RC[-1])) -> #NAME?
A109: =R[-1]C+0.2 -> 9.7999999999999954 | B109: =normdensity(R[-1]C[-1]) -> #NAME? | C109: =10^(R[-1]C[-2]*R6C2+R5C2)*R7C2 -> 47863009.232263535 | D109: =RC[-2]*(1-EXP(-RC[-1])) -> #NAME?
A110: =R[-1]C+0.2 -> 9.9999999999999947 | B110: =normdensity(R[-1]C[-1]) -> #NAME? | C110: =10^(R[-1]C[-2]*R6C2+R5C2)*R7C2 -> 69183097.091893107 | D110: =RC[-2]*(1-EXP(-RC[-1])) -> #NAME? | E110: =SUM(R[-9]C[-1],R[-8]C[-1],R[-7]C[-1],R[-6]C[-1],R[-5]C[-1],R[-4]C[-1],R[-3]C[-1],R[-2]C[-1],R[-1]C[-1],RC[-1]) -> #NAME?
B111: =normdensity(R[-1]C[-1]) -> #NAME? | C111: =10^(R[-1]C[-2]*R6C2+R5C2)*R7C2 -> 99999999.99999924 | D111: =RC[-2]*(1-EXP(-RC[-1])) -> #NAME? | E111: =RC[-1] -> #NAME?
A114: =DEFINE("poissonlognormal2",R[4]C[1],R[1]C[1],R[2]C[1],R[3]C[1]) -> #NAME? | B114: POISSONLOGNORMAL2(mean,sigma,sample) | E114: sigma = | F114: 1
A115: mean = | B115: -2 | E115: sample = | F115: 5
A116: sigma = | B116: 0.8
A117: sample = | B117: 100 | G117: PLOGN1 | H117: PLOGN2 | I117: PLOGN3
B118: =poissonlognormalaux2(R[-3]C,R[-2]C,R[-1]C,-10*R[-2]C+R[-3]C,10*R[-2]C+R[-3]C,0.2*R[-2]C)*0.2*R[-2]C -> #NAME? | F118: -6 | G118: =poissonlognormal1(RC6,R114C6,R115C6) -> #NAME? | H118: =poissonlognormal2(RC6,R114C6,R115C6) -> #NAME? | I118: =poissonlognormal3(RC6,R114C6,R115C6) -> #NAME?
F119: =R[-1]C+1 -> -5 | G119: =poissonlognormal1(RC6,R114C6,R115C6) -> #NAME? | H119: =poissonlognormal2(RC6,R114C6,R115C6) -> #NAME? | I119: =poissonlognormal3(RC6,R114C6,R115C6) -> #NAME?
A120: =DEFINE("poissonlognormalaux2",R[7]C[1],R[1]C[1],R[2]C[1],R[3]C[1],R[4]C[1],R[5]C[1],R[6]C[1]) -> #NAME? | B120: POISSONLOGNORMALAUX2(mean,sigma,sample,start,end,step) | F120: =R[-1]C+1 -> -4 | G120: =poissonlognormal1(RC6,R114C6,R115C6) -> #NAME? | H120: =poissonlognormal2(RC6,R114C6,R115C6) -> #NAME? | I120: =poissonlognormal3(RC6,R114C6,R115C6) -> #NAME?
A121: mean = | B121: -2 | F121: =R[-1]C+1 -> -3 | G121: =poissonlognormal1(RC6,R114C6,R115C6) -> #NAME? | H121: =poissonlognormal2(RC6,R114C6,R115C6) -> #NAME? | I121: =poissonlognormal3(RC6,R114C6,R115C6) -> #NAME?
A122: sigma = | B122: 1 | F122: =R[-1]C+1 -> -2 | G122: =poissonlognormal1(RC6,R114C6,R115C6) -> #NAME? | H122: =poissonlognormal2(RC6,R114C6,R115C6) -> #NAME? | I122: =poissonlognormal3(RC6,R114C6,R115C6) -> #NAME?
A123: sample = | B123: 5 | F123: =R[-1]C+1 -> -1 | G123: =poissonlognormal1(RC6,R114C6,R115C6) -> #NAME? | H123: =poissonlognormal2(RC6,R114C6,R115C6) -> #NAME? | I123: =poissonlognormal3(RC6,R114C6,R115C6) -> #NAME?
A124: start = | B124: -10 | F124: =R[-1]C+1 -> 0 | G124: =poissonlognormal1(RC6,R114C6,R115C6) -> #NAME? | H124: =poissonlognormal2(RC6,R114C6,R115C6) -> #NAME? | I124: =poissonlognormal3(RC6,R114C6,R115C6) -> #NAME?
A125: end = | B125: 10 | F125: =R[-1]C+1 -> 1 | G125: =poissonlognormal1(RC6,R114C6,R115C6) -> #NAME? | H125: =poissonlognormal2(RC6,R114C6,R115C6) -> #NAME? | I125: =poissonlognormal3(RC6,R114C6,R115C6) -> #NAME?
A126: step = | B126: 0.2 | F126: =R[-1]C+1 -> 2 | G126: =poissonlognormal1(RC6,R114C6,R115C6) -> #NAME? | H126: =poissonlognormal2(RC6,R114C6,R115C6) -> #NAME? | I126: =poissonlognormal3(RC6,R114C6,R115C6) -> #NAME?
B127: =IF(R[-3]C>R[-2]C,0,poissonlognormalpoint(R[-6]C,R[-5]C,R[-4]C,R[-3]C)+poissonlognormalaux2(R[-6]C,R[-5]C,R[-4]C,R[-3]C+R[-1]C,R[-2]C,R[-1]C)) -> #NAME? | F127: =R[-1]C+1 -> 3 | G127: =poissonlognormal1(RC6,R114C6,R115C6) -> #NAME? | H127: =poissonlognormal2(RC6,R114C6,R115C6) -> #NAME? | I127: =poissonlognormal3(RC6,R114C6,R115C6) -> #NAME?
F128: =R[-1]C+1 -> 4 | G128: =poissonlognormal1(RC6,R114C6,R115C6) -> #NAME? | H128: =poissonlognormal2(RC6,R114C6,R115C6) -> #NAME? | I128: =poissonlognormal3(RC6,R114C6,R115C6) -> #NAME?
A129: =DEFINE("poissonlognormalpoint",R[7]C[1],R[1]C[1],R[2]C[1],R[3]C[1],R[4]C[1]) -> #NAME? | B129: POISSONLOGNORMALPOINT(mean,sigma,sample,logc) | F129: =R[-1]C+1 -> 5 | G129: =poissonlognormal1(RC6,R114C6,R115C6) -> #NAME? | H129: =poissonlognormal2(RC6,R114C6,R115C6) -> #NAME? | I129: =poissonlognormal3(RC6,R114C6,R115C6) -> #NAME?
A130: mean = | B130: -2 | F130: =R[-1]C+1 -> 6 | G130: =poissonlognormal1(RC6,R114C6,R115C6) -> #NAME? | H130: =poissonlognormal2(RC6,R114C6,R115C6) -> #NAME? | I130: =poissonlognormal3(RC6,R114C6,R115C6) -> #NAME?
A131: sigma = | B131: 0.8
A132: sample = | B132: 100
A133: logc = | B133: -2
A134: c = | B134: =10^R[-1]C -> 0.01
A135: poisson = | B135: =EXP(-R[-1]C*R[-3]C) -> 0.36787944117144233
B136: =normdensitygeneral(R[-3]C,R[-6]C,R[-5]C)*(1-R[-1]C) -> #NAME?
A138: =DEFINE("poissonlognormal3",R[4]C[1],R[1]C[1],R[2]C[1],R[3]C[1]) -> #NAME? | B138: POISSONLOGNORMAL3(mean,sigma,sample)
A139: mean = | B139: -2
A140: sigma = | B140: 0.8
A141: sample = | B141: 100
B142: =INTEGRATE(CLOSURE("poissonlognormalpoint",R[-3]C,R[-2]C,R[-1]C,NA()),-10*R[-2]C+R[-3]C,10*R[-2]C+R[-3]C) -> #NAME?
A144: Reimplementing T53:AH53 in the ICMSF sheet "2class enrich"
A145: Also an example of a closure where the late argument is not the last one (cell E148)
D146: P(accept) | E146: 0.05
A147: =DEFINE("accept",R[8]C[12],R[1]C[1],R[2]C[1],R[3]C[1],R[4]C[1],R[5]C[1]) -> #NAME? | B147: INPUT | E147: OUTPUT
A148: mean = | B148: -2 | D148: mean = | E148: =goalseek(CLOSURE("accept",NA(),R149C2,R150C2,R151C2,R152C2),R146C5,0) -> #NAME?
A149: sigma = | B149: 0.8
A150: amount s = | B150: 100
A151: n = | B151: 1 | D151: n = | E151: =CEILING(goalseek(CLOSURE("acceptofn",R148C2,R149C2,R150C2,R152C2,NA()),R146C5,MAX(1,1+R152C2)),1) -> #NAME?
A152: c = | B152: 0 | C152: c must be less than n
B153: =R[2]C[11] -> #NAME? | C153: =1-RC[-1] -> #NAME?
B154: 0 | C154: 1 | D154: 2 | E154: 3 | F154: 4 | G154: 5 | H154: 6 | I154: 7 | J154: 8 | K154: 9 | L154: 10 | M154: P(accept)
A155: =poissonlognormal2(R148C2,R149C2,R150C2) -> #NAME? | B155: =IF(R[-1]C>R152C2,0,BINOM(R151C2-R[-1]C,R[-1]C)*(1-RC1)^(R151C2-R[-1]C)*RC1^R[-1]C) -> #NAME? | C155: =IF(R[-1]C>R152C2,0,BINOM(R151C2-R[-1]C,R[-1]C)*(1-RC1)^(R151C2-R[-1]C)*RC1^R[-1]C) -> 0 | D155: =IF(R[-1]C>R152C2,0,BINOM(R151C2-R[-1]C,R[-1]C)*(1-RC1)^(R151C2-R[-1]C)*RC1^R[-1]C) -> 0 | E155: =IF(R[-1]C>R152C2,0,BINOM(R151C2-R[-1]C,R[-1]C)*(1-RC1)^(R151C2-R[-1]C)*RC1^R[-1]C) -> 0 | F155: =IF(R[-1]C>R152C2,0,BINOM(R151C2-R[-1]C,R[-1]C)*(1-RC1)^(R151C2-R[-1]C)*RC1^R[-1]C) -> 0 | G155: =IF(R[-1]C>R152C2,0,BINOM(R151C2-R[-1]C,R[-1]C)*(1-RC1)^(R151C2-R[-1]C)*RC1^R[-1]C) -> 0 | H155: =IF(R[-1]C>R152C2,0,BINOM(R151C2-R[-1]C,R[-1]C)*(1-RC1)^(R151C2-R[-1]C)*RC1^R[-1]C) -> 0 | I155: =IF(R[-1]C>R152C2,0,BINOM(R151C2-R[-1]C,R[-1]C)*(1-RC1)^(R151C2-R[-1]C)*RC1^R[-1]C) -> 0 | J155: =IF(R[-1]C>R152C2,0,BINOM(R151C2-R[-1]C,R[-1]C)*(1-RC1)^(R151C2-R[-1]C)*RC1^R[-1]C) -> 0 | K155: =IF(R[-1]C>R152C2,0,BINOM(R151C2-R[-1]C,R[-1]C)*(1-RC1)^(R151C2-R[-1]C)*RC1^R[-1]C) -> 0 | L155: =IF(R[-1]C>R152C2,0,BINOM(R151C2-R[-1]C,R[-1]C)*(1-RC1)^(R151C2-R[-1]C)*RC1^R[-1]C) -> 0 | M155: =SUM(RC[-11],RC[-10],RC[-9],RC[-8],RC[-7],RC[-6],RC[-5],RC[-4],RC[-3],RC[-2],RC[-1]) -> #NAME?
A157: =DEFINE("acceptofn",R[6]C[1],R[1]C[1],R[2]C[1],R[3]C[1],R[4]C[1],R[5]C[1]) -> #NAME? | B157: ACCEPTOFN(sigma,s,c,mean,n)
A158: mean = | B158: -2
A159: sigma = | B159: 0.8
A160: amount s = | B160: 100
A161: c = | B161: 0
A162: n = | B162: 1
B163: =accept(R[-5]C,R[-4]C,R[-3]C,MIN(100,MAX(1,FLOOR(R[-1]C,1))),R[-2]C) -> #NAME?

Sheet: @BlackScholes
A2: Computing binary van der Corput sequences
A4: =DEFINE("add",R[3]C[1],R[1]C[1],R[2]C[1]) -> #NAME? | B4: ADD(x,y) | E4: VANDERCORPUT TABLE
A5: x | B5: 12 | E5: 0.5 | F5: =hcat(RC[-1]) -> #NAME? | G5: =COLUMNS(RC[-1]) -> 1 | I5: 1 | J5: =vandercorput(RC[-1]) -> #NAME? | K5: =(RC[-5]=RC[-1]) -> #NAME?
A6: y | B6: 15 | E6: =R[-1]C/2 -> 0.25 | F6: =nextvdc(RC[-1],R[-1]C) -> #NAME? | G6: =COLUMNS(RC[-1]) -> 1 | I6: =R[-1]C+1 -> 2 | J6: =vandercorput(RC[-1]) -> #NAME? | K6: =(RC[-5]=RC[-1]) -> #NAME?
B7: =R[-2]C+R[-1]C -> 27 | E7: =R[-1]C/2 -> 0.125 | F7: =nextvdc(RC[-1],R[-1]C) -> #NAME? | G7: =COLUMNS(RC[-1]) -> 1 | I7: =R[-1]C+1 -> 3 | J7: =vandercorput(RC[-1]) -> #NAME? | K7: =(RC[-5]=RC[-1]) -> #NAME?
E8: =R[-1]C/2 -> 6.25E-2 | F8: =nextvdc(RC[-1],R[-1]C) -> #NAME? | G8: =COLUMNS(RC[-1]) -> 1 | I8: =R[-1]C+1 -> 4 | J8: =vandercorput(RC[-1]) -> #NAME? | K8: =(RC[-5]=RC[-1]) -> #NAME?
A9: =DEFINE("nextvdc",R[3]C[1],R[1]C[1],R[2]C[1]) -> #NAME? | B9: NEXTVDC(x,v) | E9: =R[-1]C/2 -> 3.125E-2 | F9: =nextvdc(RC[-1],R[-1]C) -> #NAME? | G9: =COLUMNS(RC[-1]) -> 1 | I9: =R[-1]C+1 -> 5 | J9: =vandercorput(RC[-1]) -> #NAME? | K9: =(RC[-5]=RC[-1]) -> #NAME?
A10: x | B10: 0.25 | E10: =R[-1]C/2 -> 1.5625E-2 | F10: =nextvdc(RC[-1],R[-1]C) -> #NAME? | G10: =COLUMNS(RC[-1]) -> 1 | I10: =R[-1]C+1 -> 6 | J10: =vandercorput(RC[-1]) -> #NAME? | K10: =(RC[-5]=RC[-1]) -> #NAME?
A11: v | B11: =vcat(0.5) -> #NAME? | E11: =R[-1]C/2 -> 7.8125E-3 | F11: =nextvdc(RC[-1],R[-1]C) -> #NAME? | G11: =COLUMNS(RC[-1]) -> 1 | I11: =R[-1]C+1 -> 7 | J11: =vandercorput(RC[-1]) -> #NAME? | K11: =(RC[-5]=RC[-1]) -> #NAME?
B12: =hcat(R[-1]C,R[-2]C,map(CLOSURE("add",R[-2]C,NA()),R[-1]C)) -> #NAME? | E12: =R[-1]C/2 -> 3.90625E-3 | F12: =nextvdc(RC[-1],R[-1]C) -> #NAME? | G12: =COLUMNS(RC[-1]) -> 1 | I12: =R[-1]C+1 -> 8 | J12: =vandercorput(RC[-1]) -> #NAME? | K12: =(RC[-5]=RC[-1]) -> #NAME?
K13: =AND(R[-8]C,R[-7]C,R[-6]C,R[-5]C,R[-4]C,R[-3]C,R[-2]C,R[-1]C) -> #NAME?
A14: =DEFINE("vandercorput",R[3]C[1],R[1]C[1]) -> #NAME? | B14: VANDERCORPUT(n)
A15: n
B16: =vandercorput(R[-1]C-1) -> #NAME?
B17: =IF(R[-2]C<=1,hcat(0.5),nextvdc(2^(-R[-2]C), R[-1]C)) -> #NAME?
A19: Quasi Monte Carlo Black Scholes simulation
A21: =DEFINE("qmcbs",R[11]C[1],R[1]C[1],R[2]C[1],R[3]C[1],R[4]C[1],R[5]C[1],R[6]C[1],R[7]C[1]) -> #NAME? | B21: QMCBS(p0,d0,r,delta,sigma,T,p)
A22: p0 | B22: 20
A23: d0 | B23: 20
A24: r | B24: 0.08
A25: delta | B25: 0.08
A26: sigma | B26: 0.25
A27: T | B27: 2
A28: p | B28: 0.99
A29: trendrn = | B29: =(R[-5]C-R[-4]C-R[-3]C*R[-3]C/2)*R[-2]C -> -6.25E-2 | F29: 1
A30: sigraiz = | B30: =R[-4]C*SQRT(R[-3]C) -> 0.35355339059327379
A31: vt(x) = | B31: =R[-9]C*EXP(R[-2]C+R[-1]C*invnormdistcdf(R[-3]C)) -> #NAME? | E31: =qmcbs(20,20,0.08,0.08,0.25,2,0.99) -> #NAME? | F31: =apply(SPECIALIZE("qmcbs",20,20,0.08,0.08,0.25,2,NA()),0.99) -> #NAME?
B32: =IF(R[-1]C>=R[-9]C,R[-1]C-R[-9]C,0) -> #NAME? | E32: =benchmark(CLOSURE("qmcbs",20,20,0.08,0.08,0.25,2,0.99),R29C6*1000) -> #NAME? | F32: =benchmark(CLOSURE(SPECIALIZE("qmcbs",20,20,0.08,0.08,0.25,2,NA()),0.99),R29C6*1000) -> #NAME?
A34: =DEFINE("simulate",R[6]C[1],R[3]C[1],R[5]C[1]) -> #NAME?
A35: r = | B35: 0.08
A36: T = | B36: 2
A37: n = | B37: 2 | E37: 2 | F37: 0
A38: vdc seq = | B38: =vandercorput(R[-1]C) -> #NAME?
A39: fcn = | B39: =CLOSURE("qmcbs",20,20,R35C2,0.08,0.25,R36C2,NA()) -> #NAME? | E39: =simulate(R37C5,CLOSURE("qmcbs",20,20,R35C2,0.08,0.25,R36C2)) -> #NAME? | F39: =simulate(R37C5,SPECIALIZE("qmcbs",20,20,R35C2,0.08,0.25,R36C2,NA())) -> #NAME?
A40: simres = | B40: =SUM(map(R39C2,R38C2))/COLUMNS(R38C2)*EXP(-R35C2*R36C2) -> #NAME? | E40: =benchmark(CLOSURE("simulate",R37C5,CLOSURE("qmcbs",20,20,R35C2,0.08,0.25,R36C2,NA())),R37C6) -> #NAME? | F40: =benchmark(CLOSURE("simulate",R37C5,SPECIALIZE("qmcbs",20,20,R35C2,0.08,0.25,R36C2,NA())),R37C6) -> #NAME?

Sheet: @RungeKutta
A1: Solving differential equations
A3: =DEFINE("rungekutta20",R[5]C[1],R[1]C[1],R[2]C[1],R[3]C[1],R[4]C[1]) -> #NAME?
A4: t0 = | B4: 0 | C4: Initial t
A5: h = | B5: 0.1 | C5: Step size
A6: y0 = | B6: =EXP(-5) -> 6.737946999085467E-3 | C6: The solution value at t=t0
A7: f = | B7: =CLOSURE("kmnexample84") -> #NAME? | C7: A function f(t,y) describing the derivative of y
A8: res = | B8: =R[12]C -> #NAME?
A9: t | B9: y | C9: k1 | D9: k2 | E9: k3 | F9: k4 | H9: Correct | I9: Error
A10: =R[-6]C[1] -> 0 | B10: =R[-4]C -> 6.737946999085467E-3 | C10: =R5C2*apply(R7C2,RC1,RC2) -> #NAME? | D10: =R5C2*apply(R7C2,RC1+0.5*R5C2,RC2+0.5*RC[-1]) -> #NAME? | E10: =R5C2*apply(R7C2,RC1+0.5*R5C2,RC2+0.5*RC[-1]) -> #NAME? | F10: =R5C2*apply(R7C2,RC1+R5C2,RC2+RC[-1]) -> #NAME? | H10: =EXP(-5*(RC[-7]-1)^2) -> 6.737946999085467E-3 | I10: =ABS(RC[-1]-RC[-7]) -> 0
A11: =R[-1]C+R5C2 -> 0.1 | B11: =R[-1]C+(R[-1]C[1]+2*R[-1]C[2]+2*R[-1]C[3]+R[-1]C[4])/6 -> #NAME? | C11: =R5C2*apply(R7C2,RC1,RC2) -> #NAME? | D11: =R5C2*apply(R7C2,RC1+0.5*R5C2,RC2+0.5*RC[-1]) -> #NAME? | E11: =R5C2*apply(R7C2,RC1+0.5*R5C2,RC2+0.5*RC[-1]) -> #NAME? | F11: =R5C2*apply(R7C2,RC1+R5C2,RC2+RC[-1]) -> #NAME? | H11: =EXP(-5*(RC[-7]-1)^2) -> 1.7422374639493501E-2 | I11: =ABS(RC[-1]-RC[-7]) -> #NAME?
A12: =R[-1]C+R5C2 -> 0.2 | B12: =R[-1]C+(R[-1]C[1]+2*R[-1]C[2]+2*R[-1]C[3]+R[-1]C[4])/6 -> #NAME? | C12: =R5C2*apply(R7C2,RC1,RC2) -> #NAME? | D12: =R5C2*apply(R7C2,RC1+0.5*R5C2,RC2+0.5*RC[-1]) -> #NAME? | E12: =R5C2*apply(R7C2,RC1+0.5*R5C2,RC2+0.5*RC[-1]) -> #NAME? | F12: =R5C2*apply(R7C2,RC1+R5C2,RC2+RC[-1]) -> #NAME? | H12: =EXP(-5*(RC[-7]-1)^2) -> 4.076220397836619E-2 | I12: =ABS(RC[-1]-RC[-7]) -> #NAME?
A13: =R[-1]C+R5C2 -> 0.30000000000000004 | B13: =R[-1]C+(R[-1]C[1]+2*R[-1]C[2]+2*R[-1]C[3]+R[-1]C[4])/6 -> #NAME? | C13: =R5C2*apply(R7C2,RC1,RC2) -> #NAME? | D13: =R5C2*apply(R7C2,RC1+0.5*R5C2,RC2+0.5*RC[-1]) -> #NAME? | E13: =R5C2*apply(R7C2,RC1+0.5*R5C2,RC2+0.5*RC[-1]) -> #NAME? | F13: =R5C2*apply(R7C2,RC1+R5C2,RC2+RC[-1]) -> #NAME? | H13: =EXP(-5*(RC[-7]-1)^2) -> 8.6293586499370536E-2 | I13: =ABS(RC[-1]-RC[-7]) -> #NAME?
A14: =R[-1]C+R5C2 -> 0.4 | B14: =R[-1]C+(R[-1]C[1]+2*R[-1]C[2]+2*R[-1]C[3]+R[-1]C[4])/6 -> #NAME? | C14: =R5C2*apply(R7C2,RC1,RC2) -> #NAME? | D14: =R5C2*apply(R7C2,RC1+0.5*R5C2,RC2+0.5*RC[-1]) -> #NAME? | E14: =R5C2*apply(R7C2,RC1+0.5*R5C2,RC2+0.5*RC[-1]) -> #NAME? | F14: =R5C2*apply(R7C2,RC1+R5C2,RC2+RC[-1]) -> #NAME? | H14: =EXP(-5*(RC[-7]-1)^2) -> 0.16529888822158656 | I14: =ABS(RC[-1]-RC[-7]) -> #NAME?
A15: =R[-1]C+R5C2 -> 0.5 | B15: =R[-1]C+(R[-1]C[1]+2*R[-1]C[2]+2*R[-1]C[3]+R[-1]C[4])/6 -> #NAME? | C15: =R5C2*apply(R7C2,RC1,RC2) -> #NAME? | D15: =R5C2*apply(R7C2,RC1+0.5*R5C2,RC2+0.5*RC[-1]) -> #NAME? | E15: =R5C2*apply(R7C2,RC1+0.5*R5C2,RC2+0.5*RC[-1]) -> #NAME? | F15: =R5C2*apply(R7C2,RC1+R5C2,RC2+RC[-1]) -> #NAME? | H15: =EXP(-5*(RC[-7]-1)^2) -> 0.28650479686019009 | I15: =ABS(RC[-1]-RC[-7]) -> #NAME?
A16: =R[-1]C+R5C2 -> 0.6 | B16: =R[-1]C+(R[-1]C[1]+2*R[-1]C[2]+2*R[-1]C[3]+R[-1]C[4])/6 -> #NAME? | C16: =R5C2*apply(R7C2,RC1,RC2) -> #NAME? | D16: =R5C2*apply(R7C2,RC1+0.5*R5C2,RC2+0.5*RC[-1]) -> #NAME? | E16: =R5C2*apply(R7C2,RC1+0.5*R5C2,RC2+0.5*RC[-1]) -> #NAME? | F16: =R5C2*apply(R7C2,RC1+R5C2,RC2+RC[-1]) -> #NAME? | H16: =EXP(-5*(RC[-7]-1)^2) -> 0.44932896411722151 | I16: =ABS(RC[-1]-RC[-7]) -> #NAME?
A17: =R[-1]C+R5C2 -> 0.7 | B17: =R[-1]C+(R[-1]C[1]+2*R[-1]C[2]+2*R[-1]C[3]+R[-1]C[4])/6 -> #NAME? | C17: =R5C2*apply(R7C2,RC1,RC2) -> #NAME? | D17: =R5C2*apply(R7C2,RC1+0.5*R5C2,RC2+0.5*RC[-1]) -> #NAME? | E17: =R5C2*apply(R7C2,RC1+0.5*R5C2,RC2+0.5*RC[-1]) -> #NAME? | F17: =R5C2*apply(R7C2,RC1+R5C2,RC2+RC[-1]) -> #NAME? | H17: =EXP(-5*(RC[-7]-1)^2) -> 0.63762815162177322 | I17: =ABS(RC[-1]-RC[-7]) -> #NAME?
A18: =R[-1]C+R5C2 -> 0.79999999999999993 | B18: =R[-1]C+(R[-1]C[1]+2*R[-1]C[2]+2*R[-1]C[3]+R[-1]C[4])/6 -> #NAME? | C18: =R5C2*apply(R7C2,RC1,RC2) -> #NAME? | D18: =R5C2*apply(R7C2,RC1+0.5*R5C2,RC2+0.5*RC[-1]) -> #NAME? | E18: =R5C2*apply(R7C2,RC1+0.5*R5C2,RC2+0.5*RC[-1]) -> #NAME? | F18: =R5C2*apply(R7C2,RC1+R5C2,RC2+RC[-1]) -> #NAME? | H18: =EXP(-5*(RC[-7]-1)^2) -> 0.81873075307798171 | I18: =ABS(RC[-1]-RC[-7]) -> #NAME?
A19: =R[-1]C+R5C2 -> 0.89999999999999991 | B19: =R[-1]C+(R[-1]C[1]+2*R[-1]C[2]+2*R[-1]C[3]+R[-1]C[4])/6 -> #NAME? | C19: =R5C2*apply(R7C2,RC1,RC2) -> #NAME? | D19: =R5C2*apply(R7C2,RC1+0.5*R5C2,RC2+0.5*RC[-1]) -> #NAME? | E19: =R5C2*apply(R7C2,RC1+0.5*R5C2,RC2+0.5*RC[-1]) -> #NAME? | F19: =R5C2*apply(R7C2,RC1+R5C2,RC2+RC[-1]) -> #NAME? | H19: =EXP(-5*(RC[-7]-1)^2) -> 0.9512294245007139 | I19: =ABS(RC[-1]-RC[-7]) -> #NAME?
A20: =R[-1]C+R5C2 -> 0.99999999999999989 | B20: =R[-1]C+(R[-1]C[1]+2*R[-1]C[2]+2*R[-1]C[3]+R[-1]C[4])/6 -> #NAME? | C20: =R5C2*apply(R7C2,RC1,RC2) -> #NAME? | D20: =R5C2*apply(R7C2,RC1+0.5*R5C2,RC2+0.5*RC[-1]) -> #NAME? | E20: =R5C2*apply(R7C2,RC1+0.5*R5C2,RC2+0.5*RC[-1]) -> #NAME? | F20: =R5C2*apply(R7C2,RC1+R5C2,RC2+RC[-1]) -> #NAME? | H20: =EXP(-5*(RC[-7]-1)^2) -> 1 | I20: =ABS(RC[-1]-RC[-7]) -> #NAME?
A21: =R[-1]C+R5C2 -> 1.0999999999999999 | B21: =R[-1]C+(R[-1]C[1]+2*R[-1]C[2]+2*R[-1]C[3]+R[-1]C[4])/6 -> #NAME? | C21: =R5C2*apply(R7C2,RC1,RC2) -> #NAME? | D21: =R5C2*apply(R7C2,RC1+0.5*R5C2,RC2+0.5*RC[-1]) -> #NAME? | E21: =R5C2*apply(R7C2,RC1+0.5*R5C2,RC2+0.5*RC[-1]) -> #NAME? | F21: =R5C2*apply(R7C2,RC1+R5C2,RC2+RC[-1]) -> #NAME? | H21: =EXP(-5*(RC[-7]-1)^2) -> 0.95122942450071413 | I21: =ABS(RC[-1]-RC[-7]) -> #NAME?
A22: =R[-1]C+R5C2 -> 1.2 | B22: =R[-1]C+(R[-1]C[1]+2*R[-1]C[2]+2*R[-1]C[3]+R[-1]C[4])/6 -> #NAME? | C22: =R5C2*apply(R7C2,RC1,RC2) -> #NAME? | D22: =R5C2*apply(R7C2,RC1+0.5*R5C2,RC2+0.5*RC[-1]) -> #NAME? | E22: =R5C2*apply(R7C2,RC1+0.5*R5C2,RC2+0.5*RC[-1]) -> #NAME? | F22: =R5C2*apply(R7C2,RC1+R5C2,RC2+RC[-1]) -> #NAME? | H22: =EXP(-5*(RC[-7]-1)^2) -> 0.81873075307798193 | I22: =ABS(RC[-1]-RC[-7]) -> #NAME?
A23: =R[-1]C+R5C2 -> 1.3 | B23: =R[-1]C+(R[-1]C[1]+2*R[-1]C[2]+2*R[-1]C[3]+R[-1]C[4])/6 -> #NAME? | C23: =R5C2*apply(R7C2,RC1,RC2) -> #NAME? | D23: =R5C2*apply(R7C2,RC1+0.5*R5C2,RC2+0.5*RC[-1]) -> #NAME? | E23: =R5C2*apply(R7C2,RC1+0.5*R5C2,RC2+0.5*RC[-1]) -> #NAME? | F23: =R5C2*apply(R7C2,RC1+R5C2,RC2+RC[-1]) -> #NAME? | H23: =EXP(-5*(RC[-7]-1)^2) -> 0.63762815162177322 | I23: =ABS(RC[-1]-RC[-7]) -> #NAME?
A24: =R[-1]C+R5C2 -> 1.4000000000000001 | B24: =R[-1]C+(R[-1]C[1]+2*R[-1]C[2]+2*R[-1]C[3]+R[-1]C[4])/6 -> #NAME? | C24: =R5C2*apply(R7C2,RC1,RC2) -> #NAME? | D24: =R5C2*apply(R7C2,RC1+0.5*R5C2,RC2+0.5*RC[-1]) -> #NAME? | E24: =R5C2*apply(R7C2,RC1+0.5*R5C2,RC2+0.5*RC[-1]) -> #NAME? | F24: =R5C2*apply(R7C2,RC1+R5C2,RC2+RC[-1]) -> #NAME? | H24: =EXP(-5*(RC[-7]-1)^2) -> 0.44932896411722134 | I24: =ABS(RC[-1]-RC[-7]) -> #NAME?
A25: =R[-1]C+R5C2 -> 1.5000000000000002 | B25: =R[-1]C+(R[-1]C[1]+2*R[-1]C[2]+2*R[-1]C[3]+R[-1]C[4])/6 -> #NAME? | C25: =R5C2*apply(R7C2,RC1,RC2) -> #NAME? | D25: =R5C2*apply(R7C2,RC1+0.5*R5C2,RC2+0.5*RC[-1]) -> #NAME? | E25: =R5C2*apply(R7C2,RC1+0.5*R5C2,RC2+0.5*RC[-1]) -> #NAME? | F25: =R5C2*apply(R7C2,RC1+R5C2,RC2+RC[-1]) -> #NAME? | H25: =EXP(-5*(RC[-7]-1)^2) -> 0.28650479686018976 | I25: =ABS(RC[-1]-RC[-7]) -> #NAME?
A26: =R[-1]C+R5C2 -> 1.6000000000000003 | B26: =R[-1]C+(R[-1]C[1]+2*R[-1]C[2]+2*R[-1]C[3]+R[-1]C[4])/6 -> #NAME? | C26: =R5C2*apply(R7C2,RC1,RC2) -> #NAME? | D26: =R5C2*apply(R7C2,RC1+0.5*R5C2,RC2+0.5*RC[-1]) -> #NAME? | E26: =R5C2*apply(R7C2,RC1+0.5*R5C2,RC2+0.5*RC[-1]) -> #NAME? | F26: =R5C2*apply(R7C2,RC1+R5C2,RC2+RC[-1]) -> #NAME? | H26: =EXP(-5*(RC[-7]-1)^2) -> 0.16529888822158623 | I26: =ABS(RC[-1]-RC[-7]) -> #NAME?
A27: =R[-1]C+R5C2 -> 1.7000000000000004 | B27: =R[-1]C+(R[-1]C[1]+2*R[-1]C[2]+2*R[-1]C[3]+R[-1]C[4])/6 -> #NAME? | C27: =R5C2*apply(R7C2,RC1,RC2) -> #NAME? | D27: =R5C2*apply(R7C2,RC1+0.5*R5C2,RC2+0.5*RC[-1]) -> #NAME? | E27: =R5C2*apply(R7C2,RC1+0.5*R5C2,RC2+0.5*RC[-1]) -> #NAME? | F27: =R5C2*apply(R7C2,RC1+R5C2,RC2+RC[-1]) -> #NAME? | H27: =EXP(-5*(RC[-7]-1)^2) -> 8.6293586499370259E-2 | I27: =ABS(RC[-1]-RC[-7]) -> #NAME?
A28: =R[-1]C+R5C2 -> 1.8000000000000005 | B28: =R[-1]C+(R[-1]C[1]+2*R[-1]C[2]+2*R[-1]C[3]+R[-1]C[4])/6 -> #NAME? | C28: =R5C2*apply(R7C2,RC1,RC2) -> #NAME? | D28: =R5C2*apply(R7C2,RC1+0.5*R5C2,RC2+0.5*RC[-1]) -> #NAME? | E28: =R5C2*apply(R7C2,RC1+0.5*R5C2,RC2+0.5*RC[-1]) -> #NAME? | F28: =R5C2*apply(R7C2,RC1+R5C2,RC2+RC[-1]) -> #NAME? | H28: =EXP(-5*(RC[-7]-1)^2) -> 4.0762203978366066E-2 | I28: =ABS(RC[-1]-RC[-7]) -> #NAME?
A29: =R[-1]C+R5C2 -> 1.9000000000000006 | B29: =R[-1]C+(R[-1]C[1]+2*R[-1]C[2]+2*R[-1]C[3]+R[-1]C[4])/6 -> #NAME? | C29: =R5C2*apply(R7C2,RC1,RC2) -> #NAME? | D29: =R5C2*apply(R7C2,RC1+0.5*R5C2,RC2+0.5*RC[-1]) -> #NAME? | E29: =R5C2*apply(R7C2,RC1+0.5*R5C2,RC2+0.5*RC[-1]) -> #NAME? | F29: =R5C2*apply(R7C2,RC1+R5C2,RC2+RC[-1]) -> #NAME? | H29: =EXP(-5*(RC[-7]-1)^2) -> 1.7422374639493421E-2 | I29: =ABS(RC[-1]-RC[-7]) -> #NAME?
A30: =R[-1]C+R5C2 -> 2.0000000000000004 | B30: =R[-1]C+(R[-1]C[1]+2*R[-1]C[2]+2*R[-1]C[3]+R[-1]C[4])/6 -> #NAME? | C30: =R5C2*apply(R7C2,RC1,RC2) -> #NAME? | D30: =R5C2*apply(R7C2,RC1+0.5*R5C2,RC2+0.5*RC[-1]) -> #NAME? | E30: =R5C2*apply(R7C2,RC1+0.5*R5C2,RC2+0.5*RC[-1]) -> #NAME? | F30: =R5C2*apply(R7C2,RC1+R5C2,RC2+RC[-1]) -> #NAME? | H30: =EXP(-5*(RC[-7]-1)^2) -> 6.7379469990854375E-3 | I30: =ABS(RC[-1]-RC[-7]) -> #NAME?
A33: =DEFINE("KMNEXAMPLE84",R[3]C[1],R[1]C[1],R[2]C[1]) -> #NAME? | C33: Kahaner, Moler, Nash example 8.4
A34: t =
A35: y =
A36: f(t,y) = | B36: =-10*(R[-2]C-1)*R[-1]C -> 0
A39: =DEFINE("rungekutta1", R[8]C[1], R[1]C[1],R[2]C[1],R[3]C[1],R[4]C[1],R[5]C[1]) -> #NAME? | G39: ti | H39: yi | J39: Correct | K39: Error
A40: fprime = | B40: =CLOSURE("kmnexample84",NA(),NA()) -> #NAME? | G40: =RungeKutta1(CLOSURE("kmnexample84",NA(),NA()),0,2,EXP(-5),20) -> #NAME? | H40: #NAME? | J40: =EXP(-5*(RC[-3]-1)^2) -> #NAME? | K40: =ABS(RC[-1]-RC[-3]) -> #NAME?
A41: t0 = | B41: 0 | E41: =CLOSURE("RungeKutta1",CLOSURE("kmnexample84"),0,2,EXP(-5),2000) -> #NAME? | G41: #NAME? | H41: #NAME? | J41: =EXP(-5*(RC[-3]-1)^2) -> #NAME? | K41: =ABS(RC[-1]-RC[-3]) -> #NAME?
A42: tn = | B42: 2 | G42: #NAME? | H42: #NAME? | J42: =EXP(-5*(RC[-3]-1)^2) -> #NAME? | K42: =ABS(RC[-1]-RC[-3]) -> #NAME?
A43: y0 = | B43: =EXP(-5) -> 6.737946999085467E-3 | E43: Benchmark RK | G43: #NAME? | H43: #NAME? | J43: =EXP(-5*(RC[-3]-1)^2) -> #NAME? | K43: =ABS(RC[-1]-RC[-3]) -> #NAME?
A44: n = | B44: 20 | E44: 0 | G44: #NAME? | H44: #NAME? | J44: =EXP(-5*(RC[-3]-1)^2) -> #NAME? | K44: =ABS(RC[-1]-RC[-3]) -> #NAME?
A45: vec0 = | B45: =hcat(R[-4]C,R[-2]C) -> #NAME? | E45: =benchmark(R41C5,R44C5) -> #NAME? | G45: #NAME? | H45: #NAME? | J45: =EXP(-5*(RC[-3]-1)^2) -> #NAME? | K45: =ABS(RC[-1]-RC[-3]) -> #NAME?
A46: h = | B46: =(R[-4]C-R[-5]C)/R[-2]C -> 0.1 | E46: =benchmark(R41C5,R44C5) -> #NAME? | G46: #NAME? | H46: #NAME? | J46: =EXP(-5*(RC[-3]-1)^2) -> #NAME? | K46: =ABS(RC[-1]-RC[-3]) -> #NAME?
A47: result = | B47: =vscan(CLOSURE("rk1_aux",R[-7]C,R[-1]C),R[-2]C,R[-3]C) -> #NAME? | E47: =benchmark(R41C5,R44C5) -> #NAME? | G47: #NAME? | H47: #NAME? | J47: =EXP(-5*(RC[-3]-1)^2) -> #NAME? | K47: =ABS(RC[-1]-RC[-3]) -> #NAME?
E48: =benchmark(R41C5,R44C5) -> #NAME? | G48: #NAME? | H48: #NAME? | J48: =EXP(-5*(RC[-3]-1)^2) -> #NAME? | K48: =ABS(RC[-1]-RC[-3]) -> #NAME?
A49: =DEFINE("rk1_aux",R[10]C[1],R[1]C[1],R[2]C[1],R[3]C[1]) -> #NAME? | G49: #NAME? | H49: #NAME? | J49: =EXP(-5*(RC[-3]-1)^2) -> #NAME? | K49: =ABS(RC[-1]-RC[-3]) -> #NAME?
A50: fprime = | G50: #NAME? | H50: #NAME? | J50: =EXP(-5*(RC[-3]-1)^2) -> #NAME? | K50: =ABS(RC[-1]-RC[-3]) -> #NAME?
A51: h = | G51: #NAME? | H51: #NAME? | J51: =EXP(-5*(RC[-3]-1)^2) -> #NAME? | K51: =ABS(RC[-1]-RC[-3]) -> #NAME?
A52: vi = | G52: #NAME? | H52: #NAME? | J52: =EXP(-5*(RC[-3]-1)^2) -> #NAME? | K52: =ABS(RC[-1]-RC[-3]) -> #NAME?
A53: ti = | B53: =INDEX(R[-1]C,1,1) -> 0 | G53: #NAME? | H53: #NAME? | J53: =EXP(-5*(RC[-3]-1)^2) -> #NAME? | K53: =ABS(RC[-1]-RC[-3]) -> #NAME?
A54: yi = | B54: =INDEX(R[-2]C,1,2) -> #REF! | G54: #NAME? | H54: #NAME? | J54: =EXP(-5*(RC[-3]-1)^2) -> #NAME? | K54: =ABS(RC[-1]-RC[-3]) -> #NAME?
A55: k1 = | B55: =R51C2*apply(R50C2,R53C2,R54C2) -> #NAME? | G55: #NAME? | H55: #NAME? | J55: =EXP(-5*(RC[-3]-1)^2) -> #NAME? | K55: =ABS(RC[-1]-RC[-3]) -> #NAME?
A56: k2 = | B56: =R51C2*apply(R50C2,R53C2+R51C2/2,R54C2+R[-1]C/2) -> #NAME? | G56: #NAME? | H56: #NAME? | J56: =EXP(-5*(RC[-3]-1)^2) -> #NAME? | K56: =ABS(RC[-1]-RC[-3]) -> #NAME?
A57: k3 = | B57: =R51C2*apply(R50C2,R53C2+R51C2/2,R54C2+R[-1]C/2) -> #NAME? | G57: #NAME? | H57: #NAME? | J57: =EXP(-5*(RC[-3]-1)^2) -> #NAME? | K57: =ABS(RC[-1]-RC[-3]) -> #NAME?
A58: k4 = | B58: =R51C2*apply(R50C2,R53C2+R51C2,R54C2+R[-1]C) -> #NAME? | G58: #NAME? | H58: #NAME? | J58: =EXP(-5*(RC[-3]-1)^2) -> #NAME? | K58: =ABS(RC[-1]-RC[-3]) -> #NAME?
A59: result = | B59: =hcat(R[-6]C+R[-8]C,R[-5]C+(R[-4]C+2*R[-3]C+2*R[-2]C+R[-1]C)/6) -> #NAME? | G59: #NAME? | H59: #NAME? | J59: =EXP(-5*(RC[-3]-1)^2) -> #NAME? | K59: =ABS(RC[-1]-RC[-3]) -> #NAME?
G60: #NAME? | H60: #NAME? | J60: =EXP(-5*(RC[-3]-1)^2) -> #NAME? | K60: =ABS(RC[-1]-RC[-3]) -> #NAME?